名字,会员级别,评论内容,评论时间,点赞数,评论数,评价星级
丶***丶,PLUS会员,京东物流很快，商品很好，一个大赞,2018-03-01 13:01:18,0,0,5
j***3,金牌会员,手机不错，这个价钱值得拥有，就是什么东西都没送，连个简单的壳膜一类的都没送，让人不能理解,2018-03-01 12:58:41,0,0,5
j***7,金牌会员,大屏用着很爽，存储空间大，速度快,2018-03-01 12:43:52,0,0,5
w***3,银牌会员,手机还行，就是电池耗电有点快，基本上是一天一冲，反应速度比较快，抢红包啥的都不是事，毕竟只有两千多块，不能要求太高，一般的手游还能满足，大型手游玩时间长了CPU就会发热,2018-03-01 12:43:14,0,0,5
蓝***南,PLUS会员,屏幕挺大的，有些耗电，充满电一夜待机到早上消耗了百分之9的电，用一段时间看看再说！,2018-03-01 12:35:45,0,0,5
贾***迅,PLUS会员,挺好的，质量不错，很满意,2018-03-01 12:08:48,0,0,5
Z***郎,PLUS会员,这部手机很满意，中端机选了好久选的这款,2018-03-01 12:00:30,0,0,5
花***丶,PLUS会员,感觉有点长，还有就是wifi信号比不过低端国产机，毕竟不是3星高端产品，摄像头设计丑,2018-03-01 11:31:01,0,0,5
三***爷,PLUS会员,挺好的，反应略微有些卡顿,2018-03-01 11:16:50,0,0,5
怀***2,金牌会员,好看手感不错,2018-03-01 11:09:28,0,0,5
j***e,PLUS会员,优惠的时候买的，比较划算，希望以后活动多多,2018-03-01 11:09:24,0,0,5
y***s,金牌会员,送给爸爸的 总体蛮好的 一个多月了还没出现什么大问题 就是没有手电筒这个功能,2018-03-01 11:06:15,0,0,5
j***w,银牌会员,手机外观还可以，还没用，不知道速度怎么样,2018-03-01 11:01:03,0,0,5
1***m,钻石会员,此用户未及时评价，系统默认好评。,2018-03-01 10:37:55,0,0,5
j***p,金牌会员,手机外观好看超薄机身轻巧，内存容量较大运行速度快，服务好,2018-03-01 10:35:26,0,0,5
j***e,PLUS会员,三星的手机一直很好用。只要不是硬件有什么问题，还是用起来很方便的。京东商城的手机售后服务也很人性化，以后一直会在京东商城购买手机的。,2018-03-01 10:22:24,0,0,5
j***0,金牌会员,"特意用了几天才来评价，1.包装完好，手机正品。2.手机很薄，颜值非常高。3.手机反应灵敏，速度极快，流畅无卡顿。4.电池还行，中度使用，坚持一天没问题。
    缺点：1.拍摄照片色彩及清晰度不高，不如原来的Note 3。2.手机充电插口就是个奇葩，家里好几个三星充电器都不能和它通用，猪脑的设计。
    总结：手机很棒，相机很差，充电接口猪脑。",2018-03-01 10:20:06,0,0,4
b***经,PLUS会员,红红火火恍恍惚惚1会哈更很刚哈更很刚哈更会哈更,2018-03-01 10:12:54,0,0,5
蜂***蜂,PLUS会员,用了快一个月，什么问题没有！三星的手机质量不错，毕竟是大品牌！虽然是韩国货，但是我一个消费者，实惠才是硬道理，全网通插2张卡不说，还可以插张TF内存卡，一共3张卡，速度很快，相当实用！照相效果也很好！,2018-03-01 10:05:12,0,0,5
万***9,金牌会员,还没用，过几天评论！,2018-03-01 10:01:56,0,0,5
jd_185186gig,金牌会员,手机质量不错，是正品，京东买的比较放心，内存比较大，不会出现卡了，虽然分辨率一般，但价格还不算贵，像素拍照还可以，挺清晰的。期待后期使用效果。总之给好评了,2018-03-01 09:57:03,1,0,5
j***1,PLUS会员,机器到货很快，物流很给力，用着也不错，跟3000-4000的手机用着区别不大吧，我不打游戏,2018-03-01 09:49:15,0,0,5
j***1,PLUS会员,机器到货很快，物流很给力，用着也不错，跟3000-4000的手机用着区别不大吧，我不打游戏,2018-03-01 09:48:29,0,0,5
j***t,金牌会员,买手机电脑一直都是从京东买，送货快，方便快捷，质量有保证,2018-03-01 09:41:49,0,0,5
c***0,PLUS会员,拍照效果不错，前摄像头带美颜效果哦，给父母买的，屏幕大，运行速度父母使完以后说比原来的快多了，真心不错.,2018-03-01 09:25:00,0,0,5
Z***粒,PLUS会员,很薄很好看,2018-03-01 09:24:21,0,0,5
1***u,PLUS会员,到手价2142，，，，，，,2018-03-01 09:17:15,0,0,5
极***速,PLUS会员,还不错，就是手机自带的S助手活动不能参加，也没其他的补助,2018-03-01 08:59:39,0,0,5
旭日泽梅,金牌会员,"手机用几天了，使用非常好。触屏的灵敏度非常好用，电池非常棒，大容量耐用，时间长且温度不高，系统反应灵敏速度快，非常好，值得点赞！
由于手机正在使用，就不上相片了，写一下品牌标签吧：SAM**NG C900 pro.",2018-03-01 08:46:19,0,0,5
j***z,PLUS会员,三星没有网友说的那么差，是不是水军多啊，昨天玩了一天，拍照好于同价位手机，特别是听歌超出预期，总之满意,2018-03-01 08:35:51,0,0,5
j***q,银牌会员,现在用起反应挺快的，不错咯。,2018-03-01 07:02:04,0,0,5
j***t,PLUS会员,帮别人买的，手机很好,2018-03-01 06:59:23,0,0,5
H***n,PLUS会员,三星C9不愧为顶尖产品，虽有众说纷坛，但收到试用后还是举手机号盛赞。无论灵敏度，还是舒适感，都是富甲群雄。,2018-03-01 06:58:34,0,0,5
心***1,金牌会员,给京东快递点个赞，速度，第二天就到货。c9手机电池大，可以用两天。就是个别时候有点慢，总体来说还不错。,2018-03-01 06:45:21,0,0,5
r***3,PLUS会员,外观不错，性价比感觉可以，电池跟之前用的手机差不多,2018-03-01 01:29:34,1,0,5
E***n,PLUS会员,帮同事买的。还不错。,2018-03-01 01:26:28,0,0,5
t***g,金牌会员,6寸屏但握在手中一点也不显累赘，金属机身相当轻薄，手感还行吧。4000mah电池。,2018-03-01 01:01:20,0,0,5
l***3,银牌会员,再次在京東买的自营?產品--手機，送貨快，產品正在試用中，三星這款手機性價比不錯。,2018-03-01 00:31:09,0,0,5
j***守,银牌会员,很不错老婆用了说很喜欢,2018-03-01 00:15:07,0,0,5
琳***L,金牌会员,有机会在来关照你们这店,2018-02-28 23:33:50,0,0,5
j***0,PLUS会员,腊月十三订单，第二天就收到货哩，购物一级速度。手机款式新颖，颜色漂亮给老婆买的，称心如意。才使用半天，质量还不错???,2018-02-28 22:35:15,1,0,5
l***a,PLUS会员,送货很快，手机很漂亮，颜色好看！非常薄，手感绝佳！卡槽设计非常好，三个卡槽不会冲突！,2018-02-28 22:21:58,0,0,5
j***x,钻石会员,三星大品牌，京东购物方便快捷，相信京东。,2018-02-28 22:18:44,0,0,5
爱***子,银牌会员,屏幕大、照相相素挺高的。很满意，一直用三星,2018-02-28 22:10:59,0,0,5
j***f,银牌会员,用了几天还可以,2018-02-28 21:35:03,0,0,5
一***6,钻石会员,非常好，已经换上手机无法给手机拍照了,2018-02-28 21:27:31,0,0,5
j***b,银牌会员,有点大，没看好,2018-02-28 21:23:15,0,0,5
j***_,PLUS会员,屏幕大，清晰，内存够用。,2018-02-28 21:20:51,0,0,5
j***u,银牌会员,这手机非常好，特意晚了一个月用用后来评价,2018-02-28 21:05:55,0,0,5
M***7,银牌会员,还行吧就是老让我升级这点不喜欢,2018-02-28 20:58:08,0,0,5
j***f,PLUS会员,不错,2018-02-28 20:45:59,0,0,5
_***陈,PLUS会员,帮我妈买的，其实18年2000多买这个配置真的有点过时了，不过毕竟不是我们年轻人用，三星的质量也还行，爸妈喜欢就好，手机确实挺薄，背面有点丑，希望经久耐用,2018-02-28 20:23:47,0,0,5
j***7,银牌会员,拍照效果很好，反应灵敏，这个价位的手机，很不错啦，京东就是好,2018-02-28 19:52:53,0,0,5
杨***y,银牌会员,掉电太快了，屏幕分辨率不清！充完电一分钟掉百分之一,2018-02-28 19:23:03,0,1,1
v***8,企业会员,第二次购买这款手机了，京东服务，还是一贯的给力。,2018-02-28 19:08:55,0,0,5
S***Y,钻石会员,正品很好用,2018-02-28 18:56:41,0,0,5
j***A,银牌会员,包装可以，速度给力。但是我索要的发票呢？至于机子质量之类用后在评价,2018-02-28 18:22:17,0,0,5
帝***l,PLUS会员,三三星里面价格和性能算比较不错的了,2018-02-28 17:59:08,0,0,5
少***林,钻石会员,东西不错，6个g还是够用就是三星系统不行,2018-02-28 17:50:19,0,0,5
y***4,钻石会员,给爸爸买的，非常好，之前没货，挂了一个到货通知，没几天就到货。年二十九自行取货，老爸很喜欢大气，性价比也高,2018-02-28 17:49:16,0,0,5
大***7,银牌会员,故意用了三天才来，机子收到后以升级到7.0版本，系统顺畅必近是新机子，还未产生垃圾，之前其他人讲电不经用，不过我到是够用了，可能是我不怎么玩手机，一天下来我能正常接打电话，发信息，看微信，易信，都很够用了。电还有剩余，2200元的中端机，足够我玩了。到目前为止我很满意，感觉不亏。,2018-02-28 17:28:39,0,0,5
神***李,银牌会员,就拍照效果不好，其他都行，稳定吃鸡，系统是6.几的,2018-02-28 17:25:39,0,0,5
得***轩,钻石会员,6.0大屏，6G运行内存与64G手机内存配置，性价比高，手机好用外观大气，京东自营送货快。,2018-02-28 17:14:21,0,0,5
陈冯丹丹,金牌会员,手机是好手机,2018-02-28 17:07:41,0,0,5
z***1,PLUS会员,帮朋友买的，朋友用了一个月了说这款机子很好用,2018-02-28 16:46:37,0,0,5
j***a,PLUS会员,挺好的。,2018-02-28 16:45:00,0,0,5
jd_180840yeu,银牌会员,好好好！送货太快了！,2018-02-28 16:38:02,0,0,5
j***1,金牌会员,续航不太好，每天两次，其他不错,2018-02-28 16:21:25,0,0,5
为***哦,钻石会员,拍照还可以，为什么什么东西都没有送，我们一下买两个,2018-02-28 16:03:02,0,0,5
j***9,金牌会员,很好看，发货快,2018-02-28 15:47:20,0,0,5
t***X,银牌会员,手机还可以，刚买上有点不会用！！！? ? ? ?,2018-02-28 15:29:19,0,0,4
买***买,银牌会员,用几天后评价，金东自营店商品品质还是有保障，各方面表现令人满意，印象最好就是机子薄，整机美感十足。c9运行流畅，摄像逼真，声音立体感强，续航能力棒，一款不错的手机。,2018-02-28 15:27:02,0,0,5
j***2,PLUS会员,非常好用，送人的。上档次,2018-02-28 15:21:21,0,0,5
2***孩,PLUS会员,很好，很快，值得购买,2018-02-28 15:20:16,0,0,5
j***o,金牌会员,手机很不错，电池耐用。充电口和普通安卓手机不一样，物流很给力，24小时左右就到本市了，就是送货的小哥太慢了，大概过年的原因,2018-02-28 14:57:21,0,0,5
L***U,银牌会员,收到宝贝，不错，喜欢，非常好，非常满意，做工质量棒棒哒，相信三星，感谢京东，用好了，下次继续来光临。,2018-02-28 13:47:29,0,0,5
孤***狼,金牌会员,这手机外放有点迟钝，，听筒也有点迟钝，，给媳妇儿买的，，我用这个一年了，其他感觉还不错，，，不防水，我的手机已经进水了，我媳妇儿一定要他注意了，总的来说，屏幕大，电池大，续航不错，系统运行比较流畅，我的玩了一年的王者荣耀，一类的大型游戏，还是很好用，个人感觉性价比很不错,2018-02-28 13:29:02,0,0,5
k***4,PLUS会员[试用],续航感觉对不起4000毫安。日常使用没问题。屏幕太大对比小屏幕显示就很明显的不够细腻。oled 色彩鲜艳。,2018-02-28 13:28:04,0,0,5
百***8,PLUS会员,挺好的，买了三个了,2018-02-28 13:21:58,0,0,5
平***值,PLUS会员,十分给力，买了好几台了~~~~~~~~~~~~~~~~~~~,2018-02-28 13:01:31,0,0,5
j***5,钻石会员,手机不错，屏幕也很大，用惯了感觉很舒服！好评一个！,2018-02-28 12:58:29,0,0,4
卢***雨,PLUS会员,挺好看的，这个价钱买到这样的手机真心不错了,2018-02-28 12:51:22,0,0,5
j***m,银牌会员,手机还没用，轻轻一碰屏幕就碎了,2018-02-28 12:43:45,0,0,5
j***c,金牌会员,不错,2018-02-28 12:32:22,0,0,5
正***猫,钻石会员,第一次用小米，印象不错。国产手机越来越好用了,2018-02-28 12:30:43,0,0,5
j***p,金牌会员,用了可以很喜欢 不错不错,2018-02-28 12:27:23,0,0,5
水***0,PLUS会员,正常使用的机器，没有什么特别突出的,2018-02-28 12:24:18,0,0,5
j***毛,PLUS会员,手机质量不错，电池很耐用，就是真的裸机，连个膜都不送,2018-02-28 12:11:43,0,0,5
f***0,金牌会员,很好！用的很舒服！,2018-02-28 12:02:38,0,0,5
晴***主,PLUS会员,手机超薄，质感很好，粉色清新又不俗气，运行快，屏幕大，京东送货超快，很满意的购物体验,2018-02-28 12:00:43,0,0,5
倩***伶,银牌会员,还不错，大小合适，手感合适，价格也合适,2018-02-28 11:51:37,0,0,5
b***g,PLUS会员,"有什么办法搞搞这个骗丨子？

骗丨子信息： 

真实姓名：吴慧 

手、机号：15113298109 

Q、Q：1394961812 

微、信：WH15113298109 

临近年关，片子横行，如果老哥你曾经被骗过，感同身受，如果你手中恰好有轰炸机，就随手帮帮忙轰炸一下骗、子，打击一下骗、子的嚣张气焰吧，让骗、子得到应有的惩罚！还交易市场一片朗朗晴天

谁有轰丨炸机帮我炸一下。感激不尽",2018-02-28 11:50:31,0,0,5
b***8,钻石会员,"有什么办法搞搞这个骗丨子？

骗丨子信息： 

真实姓名：吴慧 

手、机号：15113298109 

Q、Q：1394961812 

微、信：WH15113298109 

临近年关，片子横行，如果老哥你曾经被骗过，感同身受，如果你手中恰好有轰炸机，就随手帮帮忙轰炸一下骗、子，打击一下骗、子的嚣张气焰吧，让骗、子得到应有的惩罚！还交易市场一片朗朗晴天

谁有轰丨炸机帮我炸一下。感激不尽",2018-02-28 11:46:11,0,0,5
j***i,钻石会员,质量可以，很薄，屏大。,2018-02-28 11:45:00,0,0,5
j***h,金牌会员,什么都没有送，就手机和充电器,2018-02-28 11:32:50,0,0,5
j***5,金牌会员,手机挺好用的还是三星,2018-02-28 11:31:23,0,0,5
虽***然,银牌会员,第一感觉就是大气！电池续航能力感觉还行，从早上到中午一直打游戏还剩70%电量，毕竟是大屏幕手机，能做到这样已经很不错了。其他方面性能还有待观察，总体来说还是不错的！,2018-02-28 10:41:37,0,0,5
d***2,金牌会员,手机用这速度挺快，屏幕非常清晰，机身手感舒适，好评！,2018-02-28 10:40:14,0,0,5
-***-,PLUS会员,挺好的，关键是过年都送货，辛苦了快递工作人员,2018-02-28 10:35:50,0,0,5
叶***e,银牌会员,外观挺漂亮的，很薄，欠点手感，加个手机壳应该会好点。,2018-02-28 10:26:19,0,0,5
j***m,银牌会员,还没有发现问题,2018-02-28 10:25:41,0,0,5
j***1,PLUS会员,质量挺好，送货速度超快，非常不错！,2018-02-28 10:25:39,0,0,5
j***b,银牌会员,电池用得有点快，指纹比较不灵活,2018-02-28 10:12:34,0,0,5
j***f,金牌会员,用了有一段时间才来评价好用功能多反应快给个???,2018-02-28 09:49:07,0,0,5
Q***m,银牌会员,手机什么也没赠送呀,2018-02-28 09:48:29,0,0,5
j***y,金牌会员,手机好用，电池能用一整天，不卡。,2018-02-28 09:46:05,0,0,5
j***l,PLUS会员,拍照效果没有我以前C7好，玩王者还有点，应该是正品，??,2018-02-28 09:35:36,0,0,5
l***u,钻石会员,老款了，估计快停产了，留一部当备用机吧,2018-02-28 09:31:02,0,0,5
一***w,金牌会员,身边朋友有用的，用了挺久了，还是很顺畅，感觉挺好，就想着买一个，果然没让我失望，很好用的手机，反应很快，满意,2018-02-28 09:29:27,1,2,5
y***7,金牌会员,好评！就是充电的头子和安卓的不一样。用了几天  机子不卡。,2018-02-28 09:26:31,0,0,5
J***f,金牌会员,手机到达快，黑色的好看，而且屏幕大，还薄，给家里面的老人用不错,2018-02-28 09:12:52,0,0,5
a***1,PLUS会员,东西挺好的是正品，物流速度快，价格实惠，下次还会来购买,2018-02-28 09:04:27,0,0,5
a***1,PLUS会员,东西挺好的是正品，物流速度快，价格实惠，下次还会来购买,2018-02-28 09:02:22,0,0,5
d***a,金牌会员,很不错，漂亮大方得体美观，速度也很快。,2018-02-28 08:56:50,0,0,5
我***哒,PLUS会员,挺好的是正品，物流速度快，价格实惠，下次还会来购买,2018-02-28 08:52:14,0,0,5
t***p,PLUS会员,不错 性价比高 固件升级后 发热现象没有发现，值得购买,2018-02-28 08:39:33,0,0,5
醇***泥,钻石会员,手机外观挺好看的，大屏的，蛮薄的，三星的手机工艺是可以的，裸机拿在手里手感挺好的，就是续航一般，4G的信号有点不太稳定呢，目前看其它还好吧，希望会耐用吧,2018-02-28 08:34:39,0,0,5
j***e,银牌会员,手机收到，用着挺不错的，就是电不咋耐用，,2018-02-28 08:31:49,0,0,5
j***d,金牌会员,这是给我哥哥买的他非常喜欢，性能也特别好,2018-02-28 08:01:37,0,0,5
t***b,钻石会员,东西不错，物流很快，性价比很高。,2018-02-28 07:40:20,0,0,5
青***和,金牌会员,可以，不错，挺好，用了一段时间，运行正常,2018-02-28 07:28:33,0,0,5
5***7,钻石会员,以前用的是三星C7，感觉就不错，这次买的C9，感觉更好,2018-02-28 06:59:17,0,0,5
j***m,银牌会员,一天前买的2290现在就降100说送无线快充也没送，忽悠我们，给差评很少给差评的,2018-02-28 02:01:47,0,1,1
暖***3,PLUS会员,挺不错的手机，质量很好,2018-02-28 00:07:50,0,0,5
p***5,PLUS会员,挺好值得拥有,2018-02-27 23:26:07,0,0,5
j***y,银牌会员,用了下，还挺好的,2018-02-27 23:18:30,0,0,5
z***0,钻石会员,刚拿到，挺好的和想象的一样,2018-02-27 22:59:33,0,0,5
S***济,金牌会员,用了三四天了 感觉照相并没有网上说的那么差  不经常玩游戏的话这款手机还是很不错的 颜值可以 内存运存都ok~,2018-02-27 22:46:15,0,0,5
w***y,PLUS会员,系统流畅，机子很漂亮。,2018-02-27 22:44:44,0,0,5
z***5,银牌会员,手机的质量效果还是不错的，三星手机总体来说还是性价比比较高的。,2018-02-27 22:36:43,0,0,5
p***o,PLUS会员,性价比还不错，基本能满足各项需求。,2018-02-27 22:31:08,0,0,5
w***6,金牌会员,不错,2018-02-27 22:08:50,0,0,4
m***y,PLUS会员,刚收到还没使用，希望没问题。,2018-02-27 22:08:00,0,0,5
末***男,金牌会员,三星明星机，配置很接地气，价格也算良心，值得,2018-02-27 22:04:53,0,0,5
j***x,PLUS会员,手机不错，老婆喜欢,2018-02-27 22:03:55,0,0,5
j***7,金牌会员,用了一周才来评价，手机性能很不错，运行非常快，相机像其他人评价的，一般，但也够用，屏幕蓝光过滤很不错，不刺眼，红包助手也非常好，可以第一时间抢红包，这个价钱买这样一部手机，值了,2018-02-27 22:00:08,0,0,5
j***g,银牌会员,物流很快，手机很好,2018-02-27 21:36:11,0,0,5
j***p,金牌会员,"服务好,速度快,东西正品",2018-02-27 21:16:48,0,0,5
j***2,钻石会员,手感很好，电池比以前的那个使用时间长多了。,2018-02-27 21:15:39,0,0,5
j***义,银牌会员,好,2018-02-27 20:57:32,0,0,5
s***r,金牌会员,东西和传说中的差不多,2018-02-27 20:52:22,0,0,5
j***p,银牌会员,用着还可以，就是手写不怎么灵，和指纹解锁不怎么灵，电池耐用，外表大气，手机超波，总知还可以，网速快，用一段时间在追平,2018-02-27 20:45:50,0,0,5
j***5,金牌会员,手机还可以，就是字体发白看不清楚。,2018-02-27 20:36:04,0,0,5
p***6,钻石会员,手机收到，不错，喜欢！,2018-02-27 20:29:58,0,0,5
j***h,银牌会员,用了一下和我的OPPO比对了一下，分辨率像素没有那么好在使用看看,2018-02-27 20:21:53,0,1,3
B***G,银牌会员,给弄丢了，没见着货，无法评价,2018-02-27 19:53:51,0,0,5
j***a,PLUS会员,快递很快，手机反应速度还好。,2018-02-27 19:53:22,0,0,4
安***贝,PLUS会员,"三星c9用着不错，很好，手感也好，很薄，已经买两个了，去年买一个，今天买一个送妈妈，这款哪哪都不错，就是漂亮手机壳不多哈哈
快递更是没的说，京东赞",2018-02-27 19:53:16,0,0,5
j***q,PLUS会员,很棒的手机，我很喜欢。谢谢京东。,2018-02-27 19:53:05,0,0,5
1***p,PLUS会员,好，好用外观漂亮设计美观手感好京东商城继续发扬，值得赞,2018-02-27 19:47:04,1,0,5
c***a,金牌会员,中端机子，刚用上系统升级了，还没怎么用，因为第一天后续评价吧，机子还行，毕竟价格也不高,2018-02-27 19:20:43,0,0,5
b***9,钻石会员,京东物流速度快到佩服，棒棒哒！手机很好。,2018-02-27 18:40:28,0,0,5
涿***屋,金牌会员,手机收到，快递很快，第二天就到了，手机质量很好，,2018-02-27 18:11:02,0,0,5
j***n,PLUS会员,屏幕够大，速度很快，很满意。,2018-02-27 18:00:24,0,0,5
j***f,银牌会员,还可以,2018-02-27 18:00:10,0,0,5
往***盘,金牌会员,手机用起来还可以，但是部分功能失效，比如截图快捷键不管用，怎么设置都不行，不知道买的是返修机还是京东专供机,2018-02-27 18:00:08,0,1,1
T***V,金牌会员,刚刚收到，正在研究，期待好的结果,2018-02-27 17:52:06,0,0,5
j***e,PLUS会员,速度挺快的，用着流畅,2018-02-27 17:45:57,0,0,5
我***人,钻石会员,说实话，1080的奥魔力屏幕用在5.0寸--5.5寸屏幕比较合适，用在6寸屏幕效果就很差了！告诉你三星：我只想要一款天山白颜色、屏幕尺寸大小5.5寸（非全面屏）、分辨率1080奥魔力屏、纯平不要曲面屏、骁龙6系或者8系处理器、1600万像素1.6或1.7大光圈摄像头、电池容量4000至5000毫安、金属框架ip68防水防尘的手机。,2018-02-27 17:44:21,2,0,5
j***d,银牌会员,整体可以，就是三星的UI太丑了，电量也没想象的耐用，玩跳一跳还有点卡，不像6g的表现,2018-02-27 17:40:18,0,0,4
巴***拉,PLUS会员,"质量非常好，与卖家描述的完全一致，非常满意,真的很喜欢，完全超出期望值，发货速度非常快，包装非常仔细、严实，物流公司服务态度很好，运送速度很快，很满意的一次购物",2018-02-27 17:13:02,0,0,4
j***a,银牌会员,物流很快，快递小哥态度也不错，手机不错，很薄，我很喜欢,2018-02-27 16:59:06,0,0,5
j***z,钻石会员,"还可以，就是充电时上网卡，反应慢
其他暂时没什么问题，如果送个手机壳和屏保就好了",2018-02-27 16:55:55,0,0,5
j***q,PLUS会员,很好的商品价格便宜质量又好速度很快,2018-02-27 16:55:21,0,0,5
5***3,钻石会员,送货速度快  购货方便  性价比高 大品牌  手机一直在京东买,2018-02-27 16:34:04,0,0,5
心***a,PLUS会员,质量不错，物流快捷，价格实惠,2018-02-27 16:33:29,0,0,5
j***3,金牌会员,刚买的就成这样了，打开微信听语音就嗡嗡响，微信关闭了都不行，还不停的响，必须关机从新来过，联系退货了，给退货，关键很麻烦，所有的应用程序都下好了，来回退耽误时间，希望想买这款手机的朋友三思啊！伤不起。,2018-02-27 16:32:36,0,0,5
w***o,银牌会员,发货速度非常快，昨天拍的今天到了，好,2018-02-27 16:27:07,0,0,5
j***4,钻石会员,手机还可以，但是不能领三星的礼品卡，不知道是不是已经有人用过了。三星客服刚开始说开机时间五天内能领，后来听说是京东买的，又说这型号机器不能领，使我很怀疑这机器是不是其他人退货的了。但是我用着还行，不知道后期怎么样。个人感觉摄像不清晰，说好的1600万像素怎么对比1200万像素的机器看不出优势呢。,2018-02-27 16:25:54,0,0,5
海***吟,PLUS会员,速度很快，拍照清楚，屏幕还蛮大的，价格实惠，物流快速。,2018-02-27 16:22:07,0,0,5
李***鱼,钻石会员,首先我是重度使用者一天到晚没有离开手机，第二系统很流畅我安装40几个软件系统照样秒开一点没有显示卡顿，第三手机音质很好听无损音乐是不一般的享受,2018-02-27 16:15:29,0,0,5
j***g,钻石会员,屏幕够大，但是屏幕不是很好，跟三星旗舰机区别很大，配置还可以,2018-02-27 15:58:09,0,0,4
z***6,银牌会员,试了下，运行速度很快，触摸也很灵敏，拍照也清晰，像素很好。很好很喜欢。就是喜欢京东自营的送货速度很快，辛苦快寄小哥了，很满意！！！,2018-02-27 15:46:03,0,0,5
j***王,钻石会员,很好的，这是第二个手机，一样的呢，自己就喜欢三星呢，家里用的都是三星手机呢,2018-02-27 15:34:20,0,0,5
呆***铭,PLUS会员,包装很好很满意。发货速度很棒,2018-02-27 15:34:09,0,0,5
j***1,钻石会员,还不错，用短时间了再来评论。,2018-02-27 15:24:41,0,0,5
5***3,钻石会员,外观性能都不错，性价比真的不赖，物流很快！给个赞?！,2018-02-27 15:24:30,0,0,5
小***3,金牌会员,外观很好看，电池速充很棒，反应也快，目前满意,2018-02-27 15:01:36,0,0,5
l***y,PLUS会员,手机性价比感觉还挺高的，支持力挺,2018-02-27 14:55:50,0,0,5
2***d,PLUS会员,质量很不错，值得推荐，京东物流很快，大部分东西都在京东买,2018-02-27 14:54:53,0,0,5
天***6,银牌会员,拍照效果好，音质也不错。,2018-02-27 14:53:38,0,0,5
d***u,PLUS会员,手机还好，就是电一天不到就用完了,2018-02-27 14:49:06,0,0,5
