名字,会员级别,评论内容,评论时间,点赞数,评论数,评价星级
1***m,银牌会员,东西没有少。没有发票。手机反应快。一个字手机很好啊！,2017-04-06 19:52:10,0,0,5
j***e,银牌会员,手机漂亮，实用，满意。,2017-11-09 12:31:54,0,0,5
j***w,银牌会员,手机很喜欢，手感和外观都是喜欢的类型！总体来看很满意！,2017-03-07 08:36:09,0,0,5
o***3,银牌会员,老婆都说非常好用，下次再买过,2017-09-18 09:19:59,0,0,5
D***r,铜牌会员,跟在实体店一样的，就是送的膜比较一般，,2017-06-29 11:40:22,0,0,5
o***o,银牌会员,不错比直营店便宜多了，但是没有直营店到的快。这手机买送给我爸的，还不错他也很喜欢,2017-11-20 12:43:21,0,0,5
j***9,银牌会员,手机颜值高，运行流畅，赞一个,2017-09-15 15:20:32,0,0,5
q***f,银牌会员,手机膜没用不是刚画的,2017-11-17 23:26:29,0,0,5
1***p,钻石会员,很不错哦，质量杠杠的，送货又快，送的小礼物很多，实用,2017-04-24 13:53:50,0,0,5
j***大,金牌会员,京东购物没问题，每一次都奇好。,2017-08-29 20:54:56,0,0,5
j***5,金牌会员,挺好的暂时没有发现什么问题,2017-09-30 20:51:05,0,0,5
j***u,银牌会员,手机用着很好用质量也不错,2017-10-15 22:02:02,0,0,5
A***l,银牌会员,拍照清楚，分辩率高，价位合适，手感很好。,2017-06-07 10:19:24,0,0,5
j***k,银牌会员,买时问了一下实体店，这个便宜了几十块钱,2017-06-23 19:05:20,0,0,5
1***者,金牌会员,帮同事买的，用着不错，我也是买的这款，同事看了说也想要个就帮着买了,2017-12-18 12:45:42,1,0,5
w***8,银牌会员,还好！！！现在用是没问题！！就看以后了,2017-06-22 15:50:57,0,0,5
爱***谓,钻石会员,给老爸用的，性能还行，就是铃声小了点…,2017-07-08 20:16:12,0,0,5
j***呆,银牌会员,手机真心不错！本以为不咋滴！但还是不错的,2017-06-04 22:58:32,0,0,5
1***u,银牌会员,国产好手机，各方面都不错,2017-05-03 22:23:51,0,0,5
j***s,银牌会员,手机相当不错，值得购买！系统很流畅！王者没问题！一切都还比较满意！颜值爆棚！比苹果实际！支持国产！,2017-06-19 17:36:01,0,0,5
1***X,银牌会员,一直都是用的华为系列手机? ，速度与激情的华为，上一步华为被偷了，又换了新华为荣耀8，,2017-07-14 09:21:01,1,0,5
p***7,金牌会员,发货速度快，服务好，感觉比官网买还对，以后就京东了,2017-03-28 15:57:09,0,0,5
j***3,金牌会员,不错的产品，，试用了一次，，不错，，漂亮，，给家人的礼物,2018-01-07 18:28:43,0,0,5
j***i,铜牌会员,不错，我用了几天在来评价的，真不错,2017-07-16 18:02:58,0,0,5
j***h,银牌会员,不卡！外观耐看！你值得拥有,2017-09-19 07:05:07,0,0,5
l***6,铜牌会员,京东快递很快，早上就拿到了，打开一看有好多东西阿！我以为只有一台手机呢！手机也不错。超赞?,2017-08-18 10:08:29,0,0,5
j***3,银牌会员,还不错，赠品都有收到，手感挺好，就是感觉小了点,2017-04-28 14:32:23,0,0,5
真***0,银牌会员,东西收到了，很不错，我很喜欢，现在专用来打电话再也不怕电话接不到了,2017-12-06 22:24:32,1,0,5
初***e,银牌会员,手机不错，挺好看的，性能也挺好的,2017-07-30 23:04:28,0,0,5
林***4,银牌会员,手机还行，就是像素差了点。,2017-09-16 10:08:12,0,0,5
j***生,金牌会员,手机很喜欢，就是内存有点小，送的配件很喜欢…,2017-05-09 04:53:07,0,0,5
y***i,钻石会员,还可以，性价比不错,2017-06-26 10:57:05,0,0,5
j***e,金牌会员,手机很漂亮，很好用，很实惠，还赠送好几样东西，颜色超赞，服务态度好，物流配送快！支持华为！！！,2017-07-13 08:01:11,0,1,5
亟***哥,钻石会员,物流快，手机外观精美漂亮，反应敏捷，下次再来这里,2017-04-07 16:18:30,0,0,5
S***茂,金牌会员,性价比非常高的一部手机，手机很流畅，速度也非常快,2017-04-02 16:52:45,0,0,5
何***2,银牌会员,手机可以，也很喜欢。。。,2017-09-30 20:55:44,0,0,5
j***p,银牌会员,1000元手机外感还行吧，才拿到用了才知道,2017-05-06 15:49:50,0,0,5
Y***F,银牌会员,商品很好，下次再来回顾,2017-10-15 14:37:29,0,0,5
j***a,铜牌会员,是正品，好评，开机试了一下，反应还挺快的，拿着也顺手，挺好的一个手机，支持购买,2017-11-15 17:50:54,0,0,5
雪***子,金牌会员,"还可以，用着不错的！
   老公比较喜欢！满意！",2017-04-20 12:45:00,0,0,5
这***5,银牌会员,电话用着不错，速度也可以。没啥问题！,2017-06-20 16:56:18,0,0,5
加***悔,金牌会员,可惜是移动版本，老板也不解释清楚。,2017-07-06 21:34:39,0,0,5
撸***0,银牌会员,"手感很好
運行速度快
帶上手機壳有種摩砂的帥",2017-04-23 12:39:27,0,0,5
胡***0,金牌会员,手机不错比实体店卖的便宜,2017-09-24 15:13:40,0,0,5
x***8,银牌会员,手机很好用，外观也好看，超喜欢。,2017-07-20 17:45:54,0,0,5
两广总督HOT,金牌会员,手机收到啦，自己喜欢的蓝色非常的好,2017-07-04 17:10:04,0,0,5
张***8,金牌会员,这宝贝挺喜欢，内存用着够的,2017-09-06 14:41:33,0,0,5
cfdDglVgETmn,银牌会员,还可以，现十天了没看出好坏,2017-09-05 13:56:50,0,0,5
jd_188676hia,铜牌会员,手机检查一下是正品牌，和网上介绍的一样样，已经用了两天，没有问题，很流畅，真心给商家好评,2017-08-20 13:39:54,0,0,5
俊***子,银牌会员,货到，用了两天，感觉还可以,2017-09-04 00:12:48,0,0,5
罗***4,银牌会员,手机非常不错，京东真心不错,2017-09-04 12:19:31,0,0,5
s***0,银牌会员,手感非常好，，感谢京东购物平台?,2017-07-15 21:07:14,0,0,5
h***k,银牌会员,手机很好，是正品，物流超快，下次还来,2017-06-12 11:40:55,0,0,5
妾***丶,金牌会员,挺好的，买个手机送了一大堆，都挺实惠,2017-06-12 08:29:24,0,0,5
b***v,银牌会员,不错     用着很舒服,2017-09-17 12:33:03,0,0,5
林***8,铜牌会员,手机很好看，用了半个月，还可以，物有所值,2017-05-09 15:24:42,0,0,5
j***j,银牌会员,手机用着很不错，一家人用的都是华为手机,2017-05-20 11:10:20,0,0,5
j***u,银牌会员,卖家服务可以，非常有耐心,2017-09-10 17:33:27,0,0,5
j***u,银牌会员,相信京东相信华为，快递也快到！,2017-07-24 14:40:57,0,0,5
j***2,银牌会员,看起来也不错，用起来更不错……,2017-08-25 19:30:22,0,0,5
j***己,金牌会员,东西很好！物流很快  值得购买,2017-07-23 11:54:51,0,0,5
j***q,银牌会员,用着挺顺畅的，感觉不错,2017-09-25 18:20:53,0,0,5
j***h,铜牌会员,我感觉非常好，值得购买。,2017-09-08 19:59:32,0,0,5
楓***癫,金牌会员,续航可以，充电慢点而已，整体上还不错,2017-06-01 06:53:57,0,0,5
姜***l,铜牌会员,手机还不错，挺好用的,2017-10-08 09:46:52,0,0,5
小***付,钻石会员,华为品牌，值得信赖，网络信号好……通话质量好！,2017-07-19 17:15:36,0,0,5
有***我,金牌会员,手机还可以，用了一段时间才来评价。,2017-06-16 16:53:42,0,0,5
y***0,PLUS会员,当时华为商城没货，帮别人买的，据说还不错,2017-05-04 09:13:19,0,0,5
1***p,金牌会员,HUAWEI，第三个了。支持国货。,2017-06-13 20:50:54,0,0,5
1***1,银牌会员,手机不错，就是发错了型号，不过已解决,2017-05-28 11:48:38,0,0,5
愿***5,铜牌会员,手机很好看，特别棒，用了一天，觉得特别好，原来手机的电用了好久才没有的，功能也很多，有这么便宜，性价比很高，钟爱的华为粉???别的都挺好，1099的根本抢不到，只能买这个，希望降价不要降的太快,2017-03-19 23:27:00,1,1,5
s***i,银牌会员,物美价廉 东西和叙述的一模一样。赞,2017-06-12 16:16:07,0,0,5
j***0,银牌会员,速度也很快，而且真的颜值很高，划得来。,2017-05-09 16:00:40,0,0,5
j***n,金牌会员,性价比很高 很喜欢,2017-11-03 18:32:39,0,0,5
李***3,铜牌会员,手机不错，反应速度挺快的，从深圳发的货,2017-05-08 12:48:34,0,0,5
M***萍,银牌会员,物流2天到，手感不错，很是喜欢！用看看再来追评,2017-03-09 15:54:06,0,0,5
j***b,银牌会员,反应速度，外观也挺不错的。,2017-08-12 19:43:26,0,0,5
北***小,银牌会员,"特别漂亮的手机  京东发货也快  还送小礼物哦  
很满意的一次购物",2017-03-14 21:30:39,0,0,5
k***l,银牌会员,这个还是很好的，都不错,2017-09-13 11:09:35,0,0,5
帝***罗,金牌会员,手机很好用，像素很好，赠品很多很好,2017-06-07 11:18:14,0,0,5
y***r,钻石会员,外观看上去还不错、用过之后再来评,2017-06-23 17:03:17,0,0,5
l***u,金牌会员,质量不错，屏显清晰，千元手机，信赖华为，支持国货，物流速度快，服务态度好，必须赞?,2017-08-27 16:41:00,0,1,5
C***n,PLUS会员,给我亲人买的 等他回来再看吧,2018-01-28 13:11:50,0,0,5
E***c,银牌会员,手机比较轻手感很好！,2017-09-27 20:18:51,0,0,5
-***-,银牌会员,给弟弟买的，学生用蛮好的，不买那么贵的。一直支持华为，我用的麦芒五?希望华为可以更强，加油,2017-07-17 08:41:43,0,0,5
h***e,银牌会员,手机用着很不错，物有所值，反应速度快，流畅！,2017-04-03 12:42:58,0,0,5
爱***我,PLUS会员,很不错！适合年轻人,2017-05-17 12:07:50,0,0,5
w***3,金牌会员,这个非常好用，颜色的也非常好看-,2017-06-19 18:24:23,0,0,5
j***r,铜牌会员,给学生买的，用用还行,2017-09-24 13:18:26,0,0,5
p***0,银牌会员,货真价实，送货速度快，服务质量上乘。,2017-05-16 09:17:52,0,0,5
j***v,银牌会员,不错，不错，可以的，可以买,2017-08-07 11:29:53,0,0,5
j***g,金牌会员,不错，非常满意，用了两个月了已经,2017-06-16 13:32:19,0,0,5
f***k,银牌会员,很符合，都好，下次还会来买,2017-08-03 15:38:54,0,0,5
随***风,金牌会员,"看起来不错
需支援观察",2017-09-04 12:41:55,0,0,5
a***你,银牌会员,手机还可以，就是不太好看,2017-08-18 10:08:42,0,0,5
Z***Q,银牌会员,一直用华为手机，这手机用着非常好，。,2017-05-12 02:56:52,0,0,5
j***～,金牌会员,手机不错，做工精良，反应快，待机长。第一次遇到买手机盒里面送壳的。。。。,2017-11-21 21:02:34,0,0,5
大***玉,银牌会员,手机不错   性价比很高,2017-08-15 21:38:01,0,0,5
j***9,银牌会员,我不玩游戏，但是玩游戏肯定不会卡,2017-06-11 19:34:01,0,0,5
j***l,金牌会员,手机收到了，感觉挺好的，物流挺给力,2017-05-24 19:10:04,0,0,5
1***谭,钻石会员,一如既往的好啊?～～哈哈?,2017-07-29 00:34:01,0,0,5
小***的,金牌会员,不错，没有质量问题，发货也快，价格合理。,2017-04-23 22:17:56,0,0,5
j***7,银牌会员,手机质量好，物流速度快，工作人员态度也很好,2018-03-01 16:26:57,0,0,5
j***5,金牌会员,既然有运营商标志，超级差劲,2017-07-26 14:27:44,0,0,5
j***v,钻石会员,送给朋友的。。。。。。。,2017-08-11 12:42:25,0,0,5
采***薄,金牌会员,还行吧，用着，感觉物流慢了点，顺丰的走了有4天,2017-03-07 12:44:37,0,0,5
j***t,金牌会员,慢充，不怎么满意，物流有点慢，用了俩天多。,2017-04-07 20:28:16,0,0,5
文***福,钻石会员,不错的手机，我同事喜欢,2017-08-26 21:12:11,0,0,5
jd_156087fyw,银牌会员,还行吧，价格微高了些。性价比不高,2017-06-05 23:14:39,0,0,5
方***磊,金牌会员,质量很好，快递便捷，非常满意！,2017-06-19 23:41:50,0,0,5
y***0,金牌会员,拿回来就碎了！不过便宜就算了吧！,2017-06-03 16:27:21,0,0,5
j***f,银牌会员,用了一个星期感觉手机还是不错的 支持国产,2017-04-01 13:00:46,0,0,5
F***I,银牌会员,总的来说还是挺好的,2017-10-10 17:36:40,0,0,5
j***0,铜牌会员,超级喜欢，手感好，质量好。,2017-07-21 10:26:35,0,0,5
j***0,银牌会员,东西很好，买给侄女的，很喜欢！,2017-06-16 17:43:53,0,0,5
兔***仔,银牌会员,宝贝收到了，，不玩游戏的话，用起来还不错了啦,2017-03-19 20:57:00,0,0,5
逢***戏,银牌会员,好。朋友喜欢。送的,2017-10-08 00:34:50,0,0,5
B***h,银牌会员,手机挺好，真心行货，,2017-09-05 01:04:35,0,0,5
j***u,银牌会员,很好用，国产手机现在也很不错,2017-07-01 22:31:08,0,0,5
j***4,铜牌会员,这物流值的一赞，手机很漂亮     个人也比较满意     支持国产赞   赞   赞,2017-04-26 15:27:15,1,0,5
j***0,银牌会员,我出差回来，拆开快递，给我一个好大的惊喜啊，卖方和物流都不管，绝了,2017-12-24 14:26:18,0,0,5
u***e,银牌会员,还不错  手感很好 只是屏幕不行  看一小会儿眼睛就不舒服  这个价位来说很不错了,2017-03-10 11:57:18,0,0,5
1***5,银牌会员,不错，还可以，值得拥有,2017-08-17 20:59:10,0,0,5
VmVrGNMjxDri,铜牌会员,手机还可以还算好用,2017-10-05 00:04:52,0,0,5
r***S,金牌会员,真心感觉不错。很期待的一款手机性价比高。,2017-03-30 09:01:31,0,0,5
j***a,银牌会员,买给我妈 华为就是好用,2017-08-17 11:52:48,0,0,5
j***q,银牌会员,手机还好，就是钢化膜一下就掉了！,2017-05-27 14:46:13,0,0,5
雲***H,金牌会员,宝贝不错，质量挺好的，物流也挺快,2017-05-27 08:34:06,0,0,5
1***H,金牌会员,手机不错的，用起来挺顺手的呢！,2017-06-12 22:24:37,0,0,5
I***c,银牌会员,感觉不一样！不好不美,2017-08-31 22:17:35,0,0,5
涅***9,钻石会员,非常好用，已经是第二次购买了，两天买了两部手机，大赞！物流也是超快的，真给力！！,2017-08-29 16:55:50,0,0,5
j***z,金牌会员,货已收到，实物与图片描述相符！,2017-06-07 21:44:21,0,0,5
d***g,银牌会员,挺流畅的，外观也好看，可惜没买到黑色的！！！,2017-03-09 16:17:19,0,0,5
i***k,银牌会员,手机收到了！用了一天，感觉不错！值得购买！,2017-03-22 06:26:49,0,0,5
F***J,银牌会员,买手机不送耳机子么？,2017-08-26 17:40:57,0,0,5
悠***8,金牌会员,时尚炫酷，运行内存大，体验很好,2017-06-05 16:21:48,0,0,5
j***0,银牌会员,刚到手，个人感觉挺满意！,2017-07-24 18:23:11,0,0,5
j***m,银牌会员,才用没发现问题过段时间再评价,2017-06-20 23:39:01,0,0,5
j***w,银牌会员,手感不错，感觉不错，用用在说吧！,2017-05-19 08:59:25,0,1,5
w***k,银牌会员,第一次在京东买手机！与描述的一样！很满意！,2018-02-10 16:01:40,0,0,5
j***i,PLUS会员,服务热情，物流速度很快,2017-08-08 14:38:09,0,0,5
j***1,钻石会员,"第二次买华为荣耀8青春版了，赶上618优惠，这次黑白各一台，品质ok,是买华为的第五台手机",2017-06-04 19:35:40,0,1,5
j***3,金牌会员,不错，用的感觉挺好的！,2017-08-08 10:29:55,0,0,5
成***长,金牌会员,很好。只是包装有点脏。,2017-08-07 18:36:04,0,0,5
l***2,银牌会员,物流很快，手机也很好看，用着还行,2017-05-17 00:00:22,0,0,5
L***布,金牌会员,挺好的，还比较流畅。价格挺好。,2017-06-01 09:45:43,0,0,5
新***气,铜牌会员,手机很好，描述的一样，很漂亮,2017-06-17 23:30:05,0,0,5
a***6,金牌会员,看着很不错 这两天比较忙 没时间好好体验,2017-03-17 09:16:11,0,1,5
j***q,银牌会员,外观还是挺喜欢的，质量要用一段时间才知道，物流给力，第一次在京东买手机，用的好话，下次再买，,2017-05-16 11:20:37,0,0,5
x***s,铜牌会员,可以，外观都行,2017-08-20 09:56:30,0,0,5
迎风笑LI,钻石会员,暂时还不错，就是有时候有点卡了。,2017-05-13 21:32:02,0,0,5
z***5,金牌会员,速度超快，用着还不错,2017-08-18 16:50:19,0,0,5
j***o,银牌会员,机子有点变形，像是移动定制机,2017-06-14 12:45:34,0,0,5
j***b,银牌会员,货都没有收到，就交易完了！假的要死,2017-04-28 21:08:37,0,0,5
j***z,银牌会员,很不错，工艺，系统真的好，完全不像**元的手机，比我爸的iPhone还要好。,2017-04-05 18:03:39,2,2,5
z***i,银牌会员,手机很漂亮，颜色很喜欢。,2017-07-12 15:24:16,0,0,5
j***b,银牌会员,非常好，就是物流太慢太慢。,2017-06-26 10:02:52,0,0,5
y***c,银牌会员,手机不错很，很鲜亮,2017-09-14 11:49:19,0,0,5
贾***5,金牌会员,质量不错，样式新颖，华为手机还是很受欢迎的，老爸很喜欢，希望能用长久，价格也很实惠,2017-07-28 08:59:54,0,0,5
y***8,PLUS会员,东西不错满足日常使用,2017-08-12 16:24:03,0,0,5
j***h,铜牌会员,外观高大上，用着也得心应手。,2017-06-07 20:39:35,0,0,5
今***贝,铜牌会员,宝贝收到了，质量很好,2017-08-11 22:35:05,0,0,5
j***0,银牌会员,颜色靓丽，制作精美，很漂亮,2017-06-23 22:09:03,0,0,5
j***c,金牌会员,更好的东西，很喜欢,2017-09-12 23:03:56,0,0,5
家***r,银牌会员,像素差，手机还可以,2017-09-12 11:00:11,0,0,5
j***2,金牌会员,开关音量按钮有点松，功能还是很不错。,2017-04-04 20:58:23,0,0,5
阎***伟,银牌会员,给孩子买的，孩子很满意,2017-07-26 06:00:04,0,0,5
j***h,金牌会员,520送给爱人的礼物，很满意！,2017-05-20 13:52:41,0,0,5
q***1,银牌会员,不错。用起来很顺手。。故意下载个大型游戏不卡。。。够用了,2017-04-29 12:18:56,0,0,5
K***强,钻石会员,第二次买了，应该好用,2017-08-07 16:41:25,0,0,5
木***I,银牌会员,手机不错。。。物流稍微慢点，总体不错，?,2017-03-21 12:14:33,0,1,5
j***e,铜牌会员,手机使用还感觉挺不错的。,2017-07-05 17:15:24,0,0,5
裴***阳,银牌会员,可以！很棒的手机。,2017-09-06 15:26:24,0,0,5
n***Q,银牌会员,蛮好～～～～～～～～！！！,2017-06-15 13:14:53,0,0,5
j***e,金牌会员,物流很慢，手机还可以,2017-08-03 08:04:11,0,0,5
j***2,银牌会员,相当好用  性价比高,2017-07-31 06:56:58,0,0,5
丽***知,铜牌会员,白色买给自己用，超级喜欢，白色的那一面，看起很有质感，会好好用的,2017-12-06 10:20:24,0,0,5
八***尾,银牌会员,颜值太棒了，十分满意。,2017-07-12 19:44:41,0,0,5
T***I,银牌会员,赠品还可以，店家的确用心,2017-06-24 09:07:00,0,0,5
j***f,铜牌会员,给妹妹买的，很喜欢,2017-08-27 23:37:39,0,0,5
j***u,铜牌会员,手机不是我用所以也不知道,2017-06-19 20:02:50,0,0,5
G***E,银牌会员,用了这么久，感觉还可以,2017-07-06 00:31:10,0,0,5
王***5,金牌会员,好用的很。买完后爱不释手。,2017-06-02 13:59:13,0,0,5
s***6,铜牌会员,很好，非常满意，物有所值,2017-06-17 13:40:01,0,0,5
j***8,铜牌会员,手机收到了，用段时间看看,2017-06-16 07:33:14,0,0,5
李***0,铜牌会员,这款手机很好用，用了一天感觉各项性能都好，网速也很快。过段时间再买一台！5分必须5分,2017-06-16 19:59:59,0,0,5
j***e,银牌会员,昨天下单的今天上午就送到真是快京东就是好。感觉不错先用用先！,2017-12-24 12:17:22,0,0,5
i***T,铜牌会员,手机不错，赠品很多实用。,2017-06-13 11:08:56,0,0,5
心***感,银牌会员,手机不错，我试了下可以，买给别人。。,2017-03-16 11:23:47,0,0,5
莱***丶,银牌会员,手机很漂亮，一定要仔细，摔了换手机,2017-04-01 09:44:24,0,1,5
丽***知,铜牌会员,送给爸爸的手机，没想到黑色这么好看哇，实在很喜欢，价格也很美丽,2017-12-06 10:18:00,0,0,5
j***了,金牌会员,手机用起来比较流畅,2017-08-15 09:59:35,0,0,5
j***c,银牌会员,东西不错，很喜欢。,2017-08-14 18:07:28,0,0,5
j***a,PLUS会员,手机还可以，使用一段时间再加追评价,2017-03-22 10:43:38,0,1,5
只***Q,银牌会员,拍照清楚  自带钢化膜的,2017-06-08 11:28:33,0,0,5
柒***囍,银牌会员,非常好，这个配置也不错,2017-06-23 19:51:58,0,0,5
j***p,银牌会员,手机到手了，挺不错的，就是物流慢了点,2017-03-10 16:58:24,0,0,5
j***e,银牌会员,这个挺好的，赠品也很好,2017-06-22 12:46:47,0,0,5
懒***h,钻石会员,手机很漂亮，物美价廉。,2017-06-21 20:14:40,0,0,5
y***u,银牌会员,给叔叔买的手机很好！快递哥态度很好！,2018-02-11 08:46:47,0,0,5
j***b,银牌会员,很漂亮的手机，很喜欢,2017-07-07 07:13:41,0,0,5
s***9,银牌会员,一直相信华为，真的很不错,2017-06-04 05:48:15,0,0,5
8***9,银牌会员,这个手机老了好长时间了，颜色好喜欢的用的也不错，发货也挺快的，不错的一次网购,2017-08-16 12:22:40,0,0,5
y***7,铜牌会员,荣耀正品。卖家服务很好。,2017-06-02 20:34:06,0,0,5
v***E,银牌会员,手机满意，快递小哥服务态度也好,2017-04-15 16:01:33,0,0,5
十***殿,铜牌会员,很不错买个自己喜欢的人，她也很喜欢,2017-03-20 00:12:28,0,1,5
jd_137120cto,银牌会员,下午买，第二天早上收到，快递给力，用气泡袋包装得很好。手机快而好用。好评。,2017-08-21 09:53:54,0,0,5
j***q,铜牌会员,还可以比想象中好,2017-12-09 18:26:29,0,0,5
j***k,银牌会员,宝贝收到了   各方面都是不错的 愉快的一次购物  祝卖家生意兴隆,2017-05-14 15:21:29,2,0,5
i***L,银牌会员,手机挺好的，家里人很喜欢,2017-05-29 21:34:01,0,0,5
李***夫,银牌会员,还可以只是快递有点慢,2017-07-01 15:38:39,0,0,5
j***p,银牌会员,手机还可以，就是送的东西不怎么样,2017-03-27 10:42:48,0,0,5
塔***克,铜牌会员,很满意的一次购物,2017-12-08 19:52:20,0,0,5
j***5,金牌会员,手机不错，漂亮，运行流畅的,2017-05-10 10:52:19,0,0,5
B***K,银牌会员,产品不错快递很快很满意,2017-06-12 12:56:33,0,0,5
艳***说,PLUS会员,手机运行挺不错的，很流畅,2017-05-26 12:39:22,0,0,5
z***生,银牌会员,很好，很喜欢，值得信赖,2017-06-11 17:20:39,0,0,5
谢***楚,金牌会员,可以的，华为，买了给别人的，还行,2017-04-09 23:32:45,0,0,5
水***狄,PLUS会员,东西收到，已在使用，感觉不错,2017-04-26 09:20:43,0,0,5
j***o,铜牌会员,此款手机拍照片很清晰，,2017-06-08 10:28:05,0,0,5
Q***y,银牌会员,满意，跟我想像的一样,2017-06-24 05:34:17,0,0,5
j***r,金牌会员,和oppo比起来 色素差,2017-05-20 20:43:10,0,0,5
c***p,铜牌会员,物流很快，货也挺好,2017-07-25 02:04:35,0,0,5
j***c,银牌会员,好用，不卡，外观漂亮,2017-06-21 23:18:02,0,0,5
j***t,金牌会员,各方面还行，挺好看的,2017-06-21 16:15:29,0,0,5
j***5,金牌会员,快递速度，东西看看再说吧,2017-05-19 15:19:31,0,0,5
n***V,金牌会员,商品不错，儿子很喜欢,2017-06-20 22:12:57,0,0,5
李***琪,铜牌会员,还可以吧，东西很齐全,2017-06-19 23:38:54,0,0,5
z***i,银牌会员,很漂亮!全五星好评!,2017-06-18 15:47:19,0,0,5
j***1,银牌会员,还算可以！如果你需要,2017-06-18 11:13:53,0,0,5
j***V,铜牌会员,还可以? ? ? ?,2017-06-16 11:59:46,0,0,5
C***b,铜牌会员,手机很好  不卡 流畅,2017-05-30 17:34:15,0,0,5
龙***霞,金牌会员,商品不错，服务到家。,2017-06-15 13:41:41,0,0,5
J***森,金牌会员,很好，期望值不是太高,2017-06-13 21:52:56,0,0,5
j***b,钻石会员,就这个价钱的手机，还可以,2017-05-10 14:02:42,0,0,5
j***0,金牌会员,好用的狠了，好看的,2017-07-15 20:56:06,0,0,5
j***s,PLUS会员,这次是买给朋友的。。。朋友很开心！,2017-03-09 14:50:50,0,0,5
m***r,铜牌会员,手机好用，什么都好，支持国产,2017-04-15 15:11:29,0,0,5
G***i,铜牌会员,膜贴完有白边，不好,2017-07-14 00:30:26,0,0,5
w***w,PLUS会员,买手机还是华为的，支持国货,2017-04-23 22:07:24,0,0,5
老扬城-1,铜牌会员,还没用，看着不错，就是快递不给力,2017-03-08 12:43:53,0,0,5
S***李,金牌会员,东西很好但是屏幕很容易摔坏,2017-04-25 19:10:47,0,0,5
j***r,钻石会员,还挺好看的，很秀气的，不像我看过的之前的华为那么笨重那么沉，谢谢京东和商家啊,2017-07-19 12:49:18,0,0,5
j***1,铜牌会员,整体来说完全可以,2017-11-16 02:52:42,0,0,5
s***4,银牌会员,给我爷爷买的，他的反应挺好的，我也觉得不错。性价比挺高的，下次还会过来。。,2017-08-03 10:48:52,0,0,5
f***1,银牌会员,不错奥，性价比很高，速度很快,2017-04-11 09:56:58,0,0,5
j***0,金牌会员,手感不错！反应速度还是行。,2017-04-20 08:14:18,0,0,5
j***5,银牌会员,用了两天了 挺好的,2017-07-08 17:40:01,0,0,5
1***Q,银牌会员,很不错，而且运行速度还可以,2017-04-18 04:40:41,0,0,5
j***t,钻石会员,给朋友买的手机带的不错,2017-05-19 12:00:07,0,0,5
j***4,铜牌会员,一点都不好建议不要买,2017-03-18 08:56:20,1,0,5
R***8,钻石会员,不错，朋友说好服务态度也好,2017-04-17 15:18:21,0,0,5
h***0,银牌会员,有的，还行吧。。。,2017-07-06 09:08:28,0,0,5
Y***k,金牌会员,家人很喜欢 一直都很信赖京东,2017-04-03 23:35:39,0,0,5
j***0,银牌会员,蛮不错的，爱我的大华为,2017-05-17 11:30:19,0,0,5
j***9,钻石会员,挺好的，基本够用。叫青春版但是给老人用也可以,2018-01-02 19:06:03,0,0,5
W***h,铜牌会员,手机加附加品都还满意,2017-06-01 21:18:26,0,0,5
j***8,银牌会员,手机很好，物流服务态度也一流～,2017-03-13 13:09:53,0,0,5
j***e,铜牌会员,手机很好，运行流畅,2017-07-04 10:47:49,0,0,5
j***t,PLUS会员,外观漂亮，速度可以，买给老板用的。好,2017-12-11 10:38:57,0,0,5
