名字,会员级别,评论内容,评论时间,点赞数,评论数,评价星级
糊***主,钻石会员,很喜歡的！原來用的就是華為，支持國貨，此款又有很多更先進的功能。,2018-01-13 10:49:02,0,1,5
j***2,金牌会员,包装完整，拆开后手机用起来还是很不错的，京东快递员态度满分,2018-02-24 02:11:10,0,1,5
依***动,银牌会员,手机闪充速度让我很满意，流畅度还可以，就是店家发货速度让人受不了,2018-01-08 19:52:14,0,1,5
无***鱿,PLUS会员,用了几天 还可以吧 UI不太好看 有点乱,2018-02-04 21:07:13,0,1,5
夜***雪,钻石会员,加价100块买的，手机挺好用的。手机后盖不是玻璃的，是塑料的，这点让这款手机有点掉价。,2017-11-28 01:23:48,0,1,5
j***d,PLUS会员,还不是很温柔，正在慢慢摸索，华为mate7确实挺不错的，没得食,2017-12-18 12:55:42,0,1,5
我跑故我在,钻石会员,给老人买的，总体还可以，基本符合老人要求，大品牌，相对放心些,2018-01-29 13:07:42,0,1,5
x***1,PLUS会员,质量不错，也是真货，就是用惯三星对华为功能不太会用，正在熟悉中',2017-11-29 09:33:48,0,1,5
j***e,PLUS会员,发货慢  而且借口太多不发货  **的商家   购买者需要慎重考虑,2017-11-04 17:27:50,0,1,5
丶***丶,PLUS会员,是正品，用了几天才来评论，华为系统支持华为，发货是京东配送的，很快,2017-11-03 08:22:50,0,1,5
龙***n,PLUS会员,不错，送客户的，反应很好，流畅，下次继续,2018-01-12 11:00:01,0,2,5
M***Y,银牌会员,"收到后立马代替了苹果6p,手工很好，顺滑，屏幕也不错，上几张用mate10照的北京秋叶",2017-10-27 12:14:52,0,1,5
纯***y,金牌会员,屏幕挺惊艳的，虽然不能单手握持，但现在主流都是大屏也就无所谓了，mate10真的漂亮,2017-11-08 23:33:19,0,1,5
你***说,PLUS会员,支持国产不仅仅是口号，是真的好用，送给客户的。客户也很喜欢,2017-12-25 21:58:54,0,1,5
你***说,PLUS会员,支持国产不仅仅是口号，是真的好用，送给客户的。客户也很喜欢,2017-12-25 21:58:29,0,1,5
j***p,钻石会员,商品质量很好！就是4G网首选移动！我是双卡！联通流量多移动流量少！其他挺满意的！,2017-12-06 21:09:37,0,1,5
L***n,银牌会员,很不错，反应也快值得购买，支持国货，华为越来越强大。,2018-02-26 18:09:48,0,1,5
j***k,金牌会员,钢化膜是坏的！,2017-11-28 15:52:13,0,1,5
j***4,PLUS会员,包装很好，手机很好用，物美价廉，超值,2018-01-22 00:15:50,0,1,5
努***子,PLUS会员,手机不错，就是快递比较慢了一点，一直在等等手机来。等着用，用起来非常流畅五星不解释,2017-11-08 21:59:16,0,1,5
叮***了,PLUS会员,手机我是很满意，就是商家的发货速度啊  真是慢啊。我也是醉了。,2017-11-06 11:33:10,0,1,5
1***p,PLUS会员,这是在京东买的5台手机了，一如既往的好,2018-01-05 18:40:45,0,1,5
j***0,银牌会员,手机应用里下个小游戏都玩不了，连不上服务器失败，还说检查网络是否正常，有点后悔买了,2017-11-04 13:43:12,0,1,5
忠***心,PLUS会员,非常给力，加价购买再使用优惠券，比官网价格还便宜10元！,2017-12-18 01:09:09,0,1,5
h***d,PLUS会员,包装很好，卖家态度也很好，物流速度也很好，热心、细心、真诚。,2017-11-13 13:58:27,0,1,5
传***e,金牌会员,感觉后盖缝隙有点大，，能塞进去一张折起来的A4纸，，其他的还好。。全面屏很惊艳。。,2017-10-27 20:25:09,0,1,5
白***9,金牌会员,机器包装很精致,2017-11-08 14:21:54,0,1,5
2***d,PLUS会员,还可以这个手机，买给老公的礼物，拍照很清晰，用起来也方便,2017-12-06 22:49:37,0,1,5
j***3,钻石会员,说实在话，不怎样，用了没几天就出现卡顿！以附图！广告做的挺厉害，现实却不如人意！,2017-11-04 18:09:13,0,1,5
旧***风,金牌会员,手机用了快一周了，真的很顺畅很大气。满满商务范儿，拍照清晰，打游戏流畅，逼格很高,2017-11-04 12:22:53,0,1,5
b***n,PLUS会员,向朋友推荐的这个手机，给他父母用买了两个，之前没用过这个牌子,2017-11-02 11:43:26,0,1,5
j***c,金牌会员,有点小失落，新到手的手机内竟然被安装了美团，携程，高德地图等软件，感觉像水货?,2017-10-31 23:10:28,0,1,5
杨***佩,PLUS会员,总的讲该款手机很时尚，用起来得心应手，我很喜欢很满意,2017-12-27 22:39:53,0,1,5
j***e,PLUS会员,相比之前用的mate7有了很大的提升  目前为止用得很流畅,2017-11-08 17:02:17,0,1,5
SN初心,PLUS会员,"质量非常好，与卖家描述的完全一致，非常满意,真的很喜欢",2017-12-09 14:27:31,0,1,5
绿***8,PLUS会员,加价买了黑色的，各方面都不错，值得拥有，希望价格能够。,2017-12-08 22:26:08,0,1,5
j***s,PLUS会员,超级无敌赞好吗？简直高端大气上档次，低调奢华有内涵，超爱,2017-11-19 01:00:32,0,1,5
j***1,银牌会员,手机刚到手   还没摸熟   就是那个钢化膜不好贴,2018-01-30 12:21:55,0,1,5
j***7,PLUS会员,"终于到货了，用了不想用iphone x,国产越来越好了",2017-11-27 21:07:57,0,1,5
j***5,银牌会员,买全网通给我个移动定制版，我也是醉了       坑,2018-01-07 12:53:05,0,1,5
D***6,银牌会员,充电速度超快～屏幕大，看视频爽！太好用啦?,2018-03-06 19:34:40,0,1,5
j***5,PLUS会员,手机很好收到了，感觉挺不错的，流畅度很高，可以入手,2017-12-18 15:20:50,0,1,5
j***b,PLUS会员,屏幕特别大，追剧特别爽。手感舒适。画面清晰，运行流畅。,2017-11-17 11:32:57,0,1,5
j***f,PLUS会员,手机非常的不错，价格超级公道，物流很快，手机特别特别喜欢,2017-11-01 11:37:46,0,1,5
j***♂,银牌会员,还不错，新包装，暂时没有什么问题，给老公买的很高兴,2018-01-13 20:13:43,0,1,5
呂***飛,银牌会员,比我的9pro大气多了   支持国产  支持华为,2018-01-28 16:43:03,0,1,5
大***1,钻石会员,手机还可以用了一天还有50的电，就是手机是移动版本的,2017-11-26 19:03:21,0,1,5
龙***5,金牌会员,产品一般没有这上要说的那么好。物流就慢的就像蚂蚁走一样。很失望的一次购物,2017-11-27 23:22:21,0,1,5
j***o,银牌会员,"质量不错

质量还可以，不过送货速度太慢了，下次不讲你那贵了两百块钱。",2017-12-09 10:06:41,0,1,5
二***张,PLUS会员,产品还行挺好用的,2017-12-07 11:29:33,1,1,4
j***b,PLUS会员,手机非常好看，很好用，但是发货太慢了，这点希望改进一下,2017-11-04 10:31:02,0,1,5
z***d,钻石会员,国产真心不错。反正比三星好用太多了。三星真心越用越卡，实在受不了了。,2017-12-22 11:23:31,0,1,5
j***1,金牌会员,效果比想象的好，一直关注支持华为，相信国货,2018-02-28 15:04:42,0,1,5
大***仔,金牌会员,双十一下的单。14号下午到了。找人剪了卡一用上各方面爽。挺好的。值这钱。,2017-11-14 21:30:04,0,1,5
l***j,金牌会员,质量很好，美观大气上档次，运行速度快，支持国货！,2018-01-10 04:52:34,0,1,5
j***2,金牌会员,手机使用还挺顺畅，就是当时我说要全网通，结果给我发了个移动全网通！,2017-12-25 10:12:05,0,1,5
E***灬,PLUS会员,很给力的手机，第一次用华为，感觉很棒。已经不输给苹果,2017-11-08 00:24:07,0,1,5
l***金,PLUS会员,手机大了点，其他的都挺好,2018-02-01 10:19:39,0,1,5
j***a,PLUS会员,手机用着很流畅，不愧华为旗舰,2018-01-02 11:11:21,0,1,5
j***v,PLUS会员,手机不错，京东快递也给力，杠杠的，给老板全五分好评！,2017-11-01 17:53:52,0,2,5
椰***S,PLUS会员,送给客户的，还好赶上了，配送改地址又慢，只好自己去取,2017-10-30 22:01:08,0,1,5
懂***米,PLUS会员,喜欢国产  相信京东正品  祝店家生意兴隆,2017-10-29 13:48:34,1,0,5
马***丞,PLUS会员,东西已收到，这是第一部华为手机，也不知道怎么辨别真伪……总体感觉不错！,2017-10-27 21:38:07,0,1,5
歌***悠,PLUS会员,不错的手机，做工，大小，尺寸刚刚好运行快速流畅,2017-12-12 10:28:57,0,1,5
掌***温,银牌会员,手机挺好的，运行速度比较快。质感和颜色挺好的，国产手机不错。华为…,2017-12-28 14:53:57,0,1,5
j***c,金牌会员,外观漂亮，物流也快，不错，就是所配耳机音质不好,2018-01-07 12:43:14,0,1,5
j***t,PLUS会员,正品  店家服务周到  手机在实体店看过才买的,2017-12-09 13:28:45,0,1,5
雨***秀,金牌会员,手机触感很好，老公非常喜欢，速度超快的,2018-03-06 08:11:11,0,1,5
龚***办,PLUS会员,黑色的机器大气端庄，很喜欢,2018-01-05 13:12:44,0,1,5
兮***了,银牌会员,用了几天才来评价的，手机挺不错的，就是不适合女生使用，太宽了！！！,2017-12-06 21:24:25,0,1,5
爱***0,PLUS会员,东西很好啊 手机真心棒 华为就是好啊 以后继续支持,2017-11-02 22:06:47,0,1,5
s***u,PLUS会员,很好用的新机器，比9稍微小一点，更方便携带，很满意,2017-10-30 22:36:04,0,1,5
-***-,PLUS会员,很好 特别好 非常不错的 京东上买东西方便又实惠,2017-11-15 16:53:53,0,1,5
果***逼,钻石会员,是新的  给老人买的  实体店都要加钱四五百  华为这一点真不厚道,2017-11-30 14:15:24,0,1,5
顾***鹏,银牌会员,棒棒的  下次继续支持,2018-01-27 19:09:16,0,1,5
j***Α,PLUS会员,宝贝真不错，质量上乘，物流也很快，相信京东。,2017-12-15 08:55:10,0,1,5
h***8,PLUS会员,早早的就买到了，用起来真不错，AI强大，深得我心,2017-11-12 10:23:33,0,1,5
n***o,银牌会员,非常满意。手机完美。物流超给力。华为产品世界第一。中国物流强无敌。,2017-11-24 09:21:51,0,1,5
l***8,钻石会员,手机昨天中午收到的，才用一天，暂时不做评价。,2017-12-05 15:11:17,0,1,5
j***8,银牌会员,货收到，无损，使用后才知质量好，中国第一品牌,2018-01-03 12:17:53,0,1,5
l***n,银牌会员,新机到手后很开心，速度和品质都有所提高！,2018-01-31 13:13:53,0,1,5
秦***n,金牌会员,很不错，就是后面不是金属的，手感一般，运行速度，系统可以，屏幕很爽！,2017-11-01 15:59:06,0,1,5
魏***2,PLUS会员,手机快好用。完美。还会继续购买的？卖家服务很好。,2017-10-30 14:39:42,0,1,5
S***坤,PLUS会员,帮朋友买的 他说很好用。这家店应该是最优惠的了吧,2017-10-28 14:30:04,0,1,5
1***2,金牌会员,东西收到了，物流很快，第二天就收到，外观不错，先用用再追加评价,2017-12-14 15:53:37,0,1,5
j***m,PLUS会员[试用],东西非常好，总体来说非常好用，支持国货！,2018-01-26 01:38:45,0,1,5
z***3,金牌会员,新手机速度一流！以后不会用苹果的。,2018-03-08 15:17:16,0,1,5
j***1,PLUS会员,哪有空照那么多相片，评价还不一定给豆。爱给不给,2017-11-06 00:02:40,0,1,5
j***3,钻石会员,国产好手机,2017-12-20 09:44:47,0,1,5
j***n,金牌会员,手机上网快，图像清晰，大小适中是自己喜欢的。包装仔细，物流给力。,2017-11-19 07:33:13,0,1,5
蒋***人,钻石会员,总体还不错，手机是好机，物流不太给你，还投放错地方，好在客服给力。,2017-11-02 22:46:17,0,1,5
l***k,PLUS会员,手机挺好的，反应速度也很快，希望能用久点,2017-12-19 16:40:14,0,1,5
j***e,钻石会员,手机真的很好，比苹果好用，就是不知道卖家怎么送我一张红米的钢化膜,2017-11-16 08:20:57,0,1,5
D***i,银牌会员,试用了这么久，华为手机确实不错，一直用苹果，现在改用华为了,2017-12-29 16:33:01,0,1,5
j***q,银牌会员,很好，用起来很好，是正品，京东买东西不错，希望下次再愉快购买,2017-12-11 08:47:33,0,1,5
我***a,金牌会员,手机已经用了一段时间，是正品。不愧是国产手机中的精品，非常不错,2017-11-24 22:43:18,0,1,5
z***Q,PLUS会员,快递速度太慢，周折4天，这效率配不上多快好省,2017-11-08 11:23:50,0,1,5
k***1,企业会员,华为旗舰机，用着很爽，长时间不重启软件会自动关闭，啥原因呢？,2017-12-08 16:04:12,0,2,5
等***-,钻石会员,手机还不错，比官网便宜而且免息！也是正品……,2018-01-04 22:25:39,0,1,5
大***号,PLUS会员,非常好，价格实惠，运行内存大，发货快，满分！,2017-11-05 06:50:48,0,1,5
A***Q,PLUS会员,非常好，价格实惠，运行内存大，发货快，满分！,2017-11-05 06:47:52,0,1,5
j***j,PLUS会员,手机收到了，是正品，不错，就是发货时间太长了,2017-11-05 10:16:58,0,1,5
小***2,金牌会员,老婆的生日礼物，当时说太大了，用了几天喜欢的不得了！完美哦！,2017-12-06 21:56:03,0,1,5
蔡***红,钻石会员,原来用p9plus，刚用有点不习惯。综合比p9plus强点。,2017-12-03 22:58:35,0,1,5
Captain707,PLUS会员,mate10，值得拥有，支持国产机，棒棒哒！,2017-11-01 02:19:36,0,1,5
无***O,PLUS会员,我大华为的手机就是不一般，就是好用，赞赞赞。,2017-11-01 01:05:10,0,1,5
6***m,PLUS会员,华为高端机，用着就是不错，快递很快。,2017-12-31 14:49:33,0,1,5
随***界,PLUS会员,华为的品质还是有目共睹的，支持国产,2018-02-10 22:35:44,0,1,5
z***3,PLUS会员,不愧是华为手机，对得起Mate10的名号。,2017-11-11 17:09:39,0,1,5
k***8,PLUS会员,质量蛮好的，送客户的，不知道效果怎么样,2017-12-13 07:04:10,0,1,5
t***5,PLUS会员,买来作为单位年会奖品的，还没开始用。,2017-12-22 00:04:01,0,1,5
j***f,银牌会员,"手机送到了还不知道好不好用,用后才知道",2018-01-02 16:02:45,0,1,5
微***过,PLUS会员,手机很好很强大，支持国产。支持华为。。。。,2017-11-02 00:07:22,0,1,5
j***0,PLUS会员,不错，京东就是快，第三方都跟着快～～～,2017-12-01 16:56:46,0,1,5
天***月,钻石会员,"自己在用mate9,老丈人换手机，毫不犹豫推荐小10,满意。",2017-11-13 10:57:11,0,1,5
小***n,银牌会员,使用效果非常好送的手机皮套也很好,2018-02-10 11:06:20,0,1,5
李***宾,金牌会员,不错。挺好的。用着挺方便。很好。。。,2018-01-09 11:47:36,0,1,5
j***b,金牌会员,非常喜欢，也很好用，手超快！,2018-03-07 16:49:52,0,1,5
j***强,PLUS会员,买给朋友的 还没打开  华为手机都可以的,2017-11-08 17:41:23,0,1,5
1***6,钻石会员,很不错，感觉很多地方技术先进，要是照相有专业功能就完美了,2017-12-09 20:50:29,0,1,5
j***u,银牌会员,手机不错，速度快，功能强，特别是照相效果更是一流，物有所值！,2017-11-07 20:16:47,0,1,5
唐***q,钻石会员,速度还是很快的，服务态度也非常好，还要再用一下手机才知道功能,2017-11-06 21:57:59,0,1,5
j***s,金牌会员,第一次用华为手机，操作告方面挺好的，物流速度也挺快的。,2017-12-24 09:53:57,0,1,5
A***r,金牌会员,送老爷子的，老爷子觉得还可以,2018-02-28 15:44:13,0,1,5
j***u,PLUS会员,为什么自营的物流那么快，第三方的这么慢。,2017-10-30 15:23:01,0,1,5
启***旭,PLUS会员,很好很不错，下次再来买。。。。。。。。,2017-11-14 13:13:46,0,1,5
杯***2,PLUS会员,虽然贵了点，手机还是非常满意的。赞?,2017-11-13 15:15:55,0,1,5
安***9,金牌会员,暂时感觉还不错！等待后续观察！?,2018-01-10 21:57:39,0,1,5
佳***刷,银牌会员,手机很不错功能很强大 我是华为mate系列忠实粉丝哈哈,2017-12-13 00:26:34,0,1,5
j***i,PLUS会员,手机真心不错除了物流稍微有点差其他还好,2017-11-09 22:18:07,0,1,5
S***7,钻石会员,华为  华为  支持国货！,2018-03-08 14:58:08,0,1,5
1***p,金牌会员,手机拍照很清晰，特别是超级夜景，,2018-01-22 21:42:35,0,1,5
j***s,PLUS会员,好评好评，很好用，手机很给力，没话好说,2017-11-08 20:04:40,0,1,5
l***8,钻石会员,手机收到了，很好用，价格合理，物流速度快，还有精美礼品,2017-12-08 16:55:58,0,1,5
j***8,PLUS会员,速度可以，使用方便，赞一下国货。,2017-12-19 00:30:49,0,1,5
x***j,钻石会员,京东购物放心，速度快，正品,2018-02-27 13:30:29,0,1,5
t***a,钻石会员,非常好，外观好看，作为年会奖品,2018-01-26 10:42:13,0,1,5
j***锐,银牌会员,旗舰手机，妈妈很满意，可以的,2018-02-08 10:31:33,0,1,5
j***仕,PLUS会员,关注了很久。买了也感觉挺舒服的,2017-12-26 23:45:45,0,1,5
j***7,银牌会员,不错，还行，挺好的，用起来不错,2018-01-21 21:48:54,0,1,5
范***康,钻石会员,手机很不错，就是等了好长时间啊,2018-01-18 21:35:29,0,1,5
j***q,银牌会员,手机外观，性能均很棒，目前正在使用适应期，不过多评价,2017-12-04 21:46:24,0,1,5
N***i,PLUS会员,1年1台mate手机，年年换新机。,2017-11-12 20:55:32,0,1,5
c***7,PLUS会员,发货速度快价格划算很满意 赞一个,2017-11-27 18:18:01,0,1,5
j***1,金牌会员,非常好的一次购物，超级快,2018-02-23 21:09:42,0,2,5
jd_138420vwp,金牌会员,一直信赖的品牌，实用不奢华。,2018-01-23 06:46:35,0,1,5
青***绿,PLUS会员,国产机皇 反应超迅速 值得购买,2017-12-08 20:20:56,0,0,5
a***家,PLUS会员,手机不错，就是发货慢了点，总体5星,2017-11-03 16:28:48,0,1,5
j***3,银牌会员,手机拿到手的感觉还不错，不愧是旗舰机，颜值爆表，很喜欢,2017-11-03 10:46:27,0,1,5
A***h,PLUS会员,很好，帅。。。。。。。。。。。。。,2017-11-02 21:49:58,0,1,5
P***5,PLUS会员,两天到货，外形尺寸趁手，单手可操作,2017-11-02 16:50:54,0,1,5
魏***7,PLUS会员,手机好的。流畅。反应快。正品行货。,2017-10-31 10:15:24,0,1,5
1***3,PLUS会员,发货快，效率高，手机漂亮，很好用,2017-11-15 14:16:21,0,1,5
梦***c,PLUS会员,非常好的手机，很好用，好想再买一个,2017-10-29 00:33:34,0,1,5
j***f,PLUS会员,手机还好，发货太慢，不按承诺发货,2017-11-13 12:26:12,0,1,5
虎***3,银牌会员,用了好一段时间才来评价，真心不错！下次还会再来,2017-12-28 15:14:56,0,1,5
华***技,PLUS会员,给别人买的，相信华为的品质,2017-12-28 11:01:21,0,1,5
a***0,钻石会员,除了又厚又重没什么不好,2018-02-22 19:43:50,0,1,5
枫***s,金牌会员,手机非常不错，店家发货也给力,2018-01-08 10:27:59,0,1,5
j***e,PLUS会员,非常给力！！！！！！！！！！！！,2017-11-06 10:06:25,0,1,5
k***u,PLUS会员,还没用，不过老牌子了信的过！,2017-12-05 13:18:33,0,1,5
嗳***仔,PLUS会员,快递很快，手机很棒，性能也不错！,2017-11-02 13:35:24,0,1,5
j***y,PLUS会员,国产机皇雄起，给力啊，流畅的一匹,2017-11-01 19:48:00,0,1,5
焐***弑,金牌会员,手机很好，快递速度很快，手机很满意，值得大家购买,2017-12-03 01:54:02,0,1,5
香***4,银牌会员,已收到，29号下午下的单，今天中午就到了，还是挺快的,2017-10-31 14:15:30,0,1,5
j***d,银牌会员,手机感觉挺不错的，第一次买华为手机。手感也不错,2017-12-17 16:02:23,0,1,5
炎***潮,PLUS会员,运行好 速度快  值得购买,2017-12-15 09:40:26,0,1,5
d***0,钻石会员,很不错的一款手机，使用方便，性价比高，很喜欢。,2017-12-14 14:18:46,0,1,5
j***2,钻石会员,对女生来说，有点大了，但是像素和分辨率都不错,2017-12-28 16:37:09,0,1,5
死***斯,PLUS会员,出来时间不长刚上手，玩玩还不错,2017-11-11 01:13:49,0,1,5
献***瑞,钻石会员,大品牌，相信华为，手机速度很快，拍照非常666,2017-12-07 12:05:26,0,1,5
l***8,金牌会员,刚刚收到，买来送人的，感觉还不错，等用用在看,2017-12-22 19:57:57,0,1,5
r***5,PLUS会员,不愧是华为，非常完美，好,2017-12-21 21:51:32,0,1,5
T***6,PLUS会员,给朋友买的，他很喜欢，值得选购,2017-11-04 13:04:50,0,1,5
s***n,钻石会员,他他他獭兔不不不不啊啪啪啪,2018-01-01 15:09:53,0,1,5
j***z,金牌会员,相对9来说要宽短一些 手感不错 华为的铁粉。,2017-12-17 20:08:41,0,1,5
w***9,PLUS会员,华为的手机质量还是ok.的,2017-11-27 03:35:54,0,1,5
w***阳,银牌会员,反应快，刚开始用，感觉很好，样子什么的都很满意,2017-11-26 14:04:13,0,1,5
j***j,PLUS会员,很不错，我喜欢，会再次购买的,2017-11-08 20:25:07,0,1,5
无***哥,PLUS会员,挺好用的 一直都是华为的粉丝,2017-11-08 15:08:19,0,1,5
P***1,钻石会员,手机外观看着还不错，性能挺好，使用一段时间后再看,2017-11-07 15:39:40,0,1,5
雨***g,银牌会员,听说手机不错，运行很快,2018-01-19 10:34:38,0,1,5
拉***波,PLUS会员,双11的手机终于到了，值得,2017-11-20 20:08:53,0,1,5
j***p,PLUS会员,很好的手机，很实用，下次还买,2017-11-03 08:19:09,0,0,5
s***w,钻石会员,很不错的东西，感谢快递小哥。手机好好！感谢！,2017-12-01 17:37:31,0,1,5
c***j,PLUS会员,刚收到手机，希望能用个四五年,2017-10-28 19:33:59,0,0,5
能***丶,PLUS会员,东西很好我很喜欢。棒棒哒???！！！,2017-12-12 19:20:53,0,1,5
黛***烟,银牌会员,物流二天多收到的，比想象中的次日送达慢一些,2017-12-11 16:07:16,0,1,5
s***2,钻石会员,比mate8、9的黑边小很多，速度、拍照不错！,2017-11-08 20:02:49,0,1,5
j***t,PLUS会员,帮朋友买的，已使用很好,2017-12-09 16:20:18,0,1,5
1***p,银牌会员,刚收到，感觉还行，先用用看！之后再来追加评价,2017-11-22 22:35:55,0,1,5
H***u,PLUS会员,手机在用，感觉电池一般,2017-12-08 01:13:22,0,1,5
w***1,PLUS会员,还行吧，就是客服积极点更好,2017-11-05 16:58:09,0,1,5
j***4,PLUS会员,很喜欢，黑色外观很酷。,2017-12-06 15:52:49,0,1,5
h***0,PLUS会员,很好服务！不错的京东！,2017-12-06 16:27:15,0,1,5
a***i,银牌会员,用了一个多月了，很好,2018-01-19 21:55:14,0,1,5
j***n,PLUS会员,手机很不错，玩啥都无压力,2017-11-18 19:52:05,0,1,5
cicci阳羊羊,金牌会员,东西配送速度很快 包装很完整 正品 很棒,2017-12-18 14:13:44,0,1,5
肖***1,PLUS会员,手机很好，已经用上了。。。,2017-10-30 22:21:35,0,1,5
W***n,PLUS会员,特别好的东西，包装很严实！,2017-10-29 01:02:57,0,1,5
j***j,钻石会员,手机质量不错，运行速度很快，相机效果很好,2017-12-14 18:02:18,0,1,5
O***Q,金牌会员,商家发货不满意！手机还是很满意！主要是支持华为,2017-10-28 16:08:24,0,1,5
j***i,金牌会员,屏幕大，速度快，做工看上去很高大上，用后再评,2017-11-12 17:47:09,0,1,5
田***4,PLUS会员,物美价廉哦物美价廉哦哦哦！,2017-10-27 00:10:21,0,1,5
晚***雪,金牌会员,非常不错，很实惠，快递也很给力！看好京东,2017-12-11 12:14:57,0,1,5
f***i,PLUS会员,一直信赖京东?,2018-01-08 11:14:23,0,1,5
j***c,PLUS会员,很不错的手机，没让我失望,2017-11-07 12:55:01,0,1,5
莫***华,PLUS会员,感觉指纹还是在前面比较好,2017-11-06 18:33:27,0,1,5
M***泪,钻石会员,华为品质，值得信赖,2018-02-03 01:01:53,0,1,5
z***5,钻石会员,帮朋友买的，买手机还是要京东啊！朋友很满意,2017-11-20 12:33:17,0,1,5
j***4,钻石会员,高大上，支持国产，,2018-02-01 10:02:21,0,1,5
u***M,金牌会员,机子真心不错，杠杠滴,2018-01-01 19:46:10,0,1,5
j***d,PLUS会员,很好，谢谢，我太喜欢了。,2017-10-31 17:28:48,0,1,5
星***会,PLUS会员,帮朋友买的，非常满意！,2017-11-15 19:46:38,0,1,5
j***u,金牌会员,已收到，是想象的那种，手感不错，用后在说感受,2017-10-30 12:51:46,0,1,5
r***8,钻石会员,华为手机确实好用。,2018-01-28 10:46:08,0,1,5
j***熊,金牌会员,一直用华为，很不错，这次是给老婆换，很满意,2017-11-12 11:17:45,0,1,5
j***y,金牌会员,快递太慢！还是京东的，其他用了再说！,2017-12-29 12:15:29,0,1,5
佛***鹏,PLUS会员,用了一个月了，还不错,2017-11-28 11:11:33,0,1,5
我***7,PLUS会员,真的很给力，完毕完毕完毕,2017-10-29 12:19:13,0,1,5
j***o,PLUS会员,除了发货慢，其他都很好,2017-11-09 16:37:11,0,1,5
d***4,PLUS会员,手机不错，反应速度很快,2017-11-07 17:38:30,0,1,5
M***K,金牌会员,今天收到正在用，但确得比本地实体店的贵了,2017-11-21 22:27:22,0,1,5
j***v,金牌会员,很不错啊，手感非常好，满意的一次网购。,2017-12-07 08:01:17,0,1,5
梦***然,PLUS会员,我的最爱，更高级的京东,2017-11-05 21:03:53,0,1,5
剁***D,钻石会员,手机用了几天，感觉各方面表现都很不错,2017-12-22 09:33:07,0,1,5
z***2,PLUS会员,华为的旗舰，很不错,2017-12-20 19:00:23,0,1,5
j***x,金牌会员,手机用起来很好，还有好多新功能没有开发，,2017-11-19 11:40:25,0,1,5
c***g,钻石会员,收到货了，包装完好，店主贴心，有膜有套套。,2017-11-03 15:37:30,0,1,5
1***p,金牌会员,没抢到官网的只能加钱了。用了半个月还可以,2017-11-19 17:04:31,0,1,5
jd_136658ztr,银牌会员,物流速度很快。手机还未使用。外观不错。,2017-12-04 12:50:57,0,1,5
重***云,金牌会员,不错的一次网购，跟描述的一样～推荐购买,2017-12-04 09:42:16,0,1,5
S***9,PLUS会员,东西很好很喜欢还不错,2017-11-17 12:55:29,0,1,5
z***3,钻石会员,东西收到了！包装精致！,2017-11-01 12:00:35,0,1,5
t***w,PLUS会员,屏幕很不错，做工很好。,2017-10-31 13:45:02,0,1,5
