名字,会员级别,评论内容,评论时间,点赞数,评论数,评价星级
社***哥,金牌会员,外观跟视频里面一样很漂亮，手机内配设施很好，很流畅！！！,2018-02-05 08:47:48,0,0,5
阿***2,PLUS会员,京东商城值得信赖，物流速度灰常赞！,2018-02-11 08:19:02,0,0,5
悟***花,银牌会员,效果不错，一如既往地支持华为荣耀，各项性能都挺好的。,2018-02-23 20:02:42,0,0,5
要不要这么难取,金牌会员,手机用了几天了，暂时没有问题。使用体验还不错，就是开始的时候充电比较慢，耗电快，现在正常了,2017-09-11 10:53:34,0,0,5
默***然,银牌会员,不错哦，给老公买的，比我买的时候少300，感觉还行,2018-03-05 18:57:55,0,0,5
小***1,PLUS会员,菊花9非常强劲，第二台冬天不会自动关机。还用什么水果粮食,2017-12-20 14:19:31,0,0,5
简***流,金牌会员,手机性能方面都蛮不错的，外观无损伤，整体目前来看都蛮OK的，至于使用后如何后续再追评。,2017-09-13 12:41:00,0,0,5
j***o,银牌会员,挺满意的。抢了个劵还算实惠。性能不挑。就是续航一般。,2018-01-23 00:13:54,0,0,5
j***j,银牌会员,手机拿到了，一点不卡，运行很流畅，不错值得购买,2018-03-05 23:33:43,0,0,5
蚂蚁牙black,金牌会员,手机觉对的正品，很酷炫，手感好的没话说，而且颜色很好看，开机后手机很流畅，玩游戏也一点都不卡，，物流速度也很快，客服态度也还好，很愉快的一次购物体验！,2017-07-30 21:44:58,0,0,5
用***苦,PLUS会员,电池给力，续航持久，值得信赖,2018-02-12 23:38:39,0,0,5
闫***7,银牌会员,手机收到了，外观非常满意挺好！?,2017-07-03 14:17:25,0,0,5
黑***丶,银牌会员,快递比以前慢了好多，手机还行，感觉电池不是很耐用，充电也没想象中那么快，其他还行吧，用了几天,2017-07-02 18:04:20,0,0,5
许尔强,PLUS会员,玩王者荣耀666，快递给力,2017-08-03 18:04:12,0,0,5
j***8,银牌会员,帮别人买的，货物一到就赞不绝口，真正的物超所值，支持国产，支持京东，赞一个！?,2017-09-19 11:51:50,0,0,5
m***3,金牌会员,新机子，比我预期的要好，运行速度快，比苹果机好用,2018-01-15 13:06:36,0,0,5
程***8,PLUS会员,购物满意，信奈京东。,2018-03-07 08:11:13,0,0,5
熊***排,PLUS会员,灰色非常酷，手机大小对我来说刚好，系统流畅，打游戏很畅快，发货很快！,2017-07-01 15:57:05,0,0,5
j***y,金牌会员,挺好用，支持国产，华为好样的。主要是系统流畅。,2018-01-13 13:07:47,0,0,5
剑***殇,金牌会员,性能外形很不错，但是发热高，电池续航能力差。还有最关键的是官网居然秒不到只能来这买,2017-08-02 07:25:44,0,0,5
j***s,银牌会员,正版没错，挺漂亮的，就是玩游戏久了手机发热厉害,2018-01-03 17:09:52,0,0,5
陆***富,银牌会员,手机收到了，不知道是真品，还是假品，等待验证,2018-01-15 18:09:42,0,0,5
j***帅,PLUS会员,手机不错，女儿比较喜欢，速度也比较快。手机前后都比较漂亮！华为荣耀，值得拥有?,2017-08-13 17:11:26,0,0,5
j***3,银牌会员,手机的信号不怎么好啊，总感觉是假的，但确实是真的，灰色不错。手机也还好，不卡,2017-08-25 20:27:55,0,0,5
U***0,金牌会员,挺好的，背面超酷的，快递也快前天下单昨天早上就到了，跑分也高，CPU打开速度也快,2017-07-16 05:43:48,0,0,5
t***6,金牌会员,很棒的产品和购物体验，京东商城和京东快递小哥确实要比其他选择更好,2017-11-18 21:37:24,0,0,5
w***6,金牌会员,手机不错，运行速度很快，照像也很清晰，虚拟键盘设计很巧，方便又实用，为荣耀点个?,2017-07-11 08:38:06,0,0,5
m***8,PLUS会员,不错用起来很舒服  很快   奶奶灰用来很好,2017-11-13 15:00:32,0,0,5
1***A,金牌会员,手机可以，刚开始用的时候有点热，用着用着就没有这种情况了,2017-08-07 21:42:47,0,0,5
z***3,金牌会员,确实不错，刚开始打有断触现象，关闭皮套模式和防误触模式后，基本解决了,2017-10-10 12:10:18,0,0,5
超***贴,金牌会员,手机用着很不错，就是电不是太耐用，不过还好有快充，还不错。,2017-12-26 13:05:05,0,0,5
陈***7,金牌会员,东西不错，挺满意的，物流也很快。,2018-03-04 21:30:08,0,0,5
1***p,金牌会员,荣耀9的背面做工什么精美。 配色也是独出心裁 刚开箱就跑了下安兔兔12w。还不错,2017-06-29 22:23:52,0,0,5
j***p,PLUS会员,手机还不错就是降价太快了，才一周就降了100,2017-11-02 19:40:55,0,0,5
j***9,钻石会员,哥GVv哥古古怪怪他他他发发发仍然仍然哒哒哒哒哒哒哒哒哒哒哒哒哒哒哒,2017-09-30 23:45:59,0,0,5
丶***t,银牌会员,可以，手感挺好的，目前还没看出什么来，用段时间来,2017-09-20 13:33:53,0,0,5
一***阳,金牌会员,荣耀手机做的真的不错，性价比也很高～,2018-01-15 21:30:52,0,0,5
j***0,金牌会员,还好，就是发货速度慢送货慢，不满意,2018-01-28 16:00:16,0,0,5
太***道,金牌会员,性价比高，系统好，一直在用荣耀。,2018-02-06 09:43:30,0,0,5
你***奇,PLUS会员,华为的粉丝相信华为荣耀的品质手机很好大小合适用着很舒服。,2017-07-03 09:36:31,0,0,5
j***p,银牌会员,京东速度没得说，手机很满意，赠品也好,2017-06-22 11:04:02,4,0,5
w***T,钻石会员,买手机比官网贵了300块 这就是营销手段啊  不过喜欢这个手机 所以就买了,2017-07-04 10:22:10,0,0,5
丫***4,PLUS会员,好看的不得了，用了好几天再来评价的，很喜欢，商家发货很快，态度很好，赞一个,2017-06-30 16:41:58,4,0,5
艾***涛,PLUS会员,荣耀手机依然那么优秀，支持国产。,2017-12-11 17:28:40,0,0,5
王***平,金牌会员,手机到了，外观还可以，手感也还行！用起来也挺好的！要是有白色的就好了！,2017-07-19 19:37:43,0,0,5
樂***天,金牌会员,很棒，买个姐姐，她喜欢。,2018-03-04 16:42:08,0,0,5
j***4,银牌会员,手机是用过之后评价的，应该都这样吧！买东西之前找客服询问，一点有用信息都没发现，态度也是爱理不理，后面下单之后，发的东西里面没耳机，联系客服，客服跟我说本来就没有耳机，就很气，感觉客服态度前后变化很大，后面说补发耳机，我给你地址，但收货的地址跟我给的不一样，联系客服说登记错了。。。。货好不好先不说，就这不靠谱的态度，也不敢买了,2018-03-07 09:55:53,0,0,5
j***f,金牌会员,太好用了 超级好用 颜色也好看  速度快 真的很喜欢   很满意很慢,2017-07-21 21:17:04,0,0,5
张***b,金牌会员,收到手机一直用了这么久才来评价的，机子很好，反应快，外观精美！,2017-08-18 15:48:42,0,0,5
剁***n,金牌会员,手机手感不错，颜值高，不卡顿,2018-01-04 09:53:37,0,0,5
阿***么,银牌会员,快递到了 手机挺好的,2018-03-02 18:20:20,0,0,5
w***9,金牌会员,很好，很好用。颜色和图片还是有色差，买之前可以在柜台看样机。,2017-08-25 12:27:25,0,0,5
小***克,金牌会员,手机很流畅，玩王者加载超快，待机比较理想,2017-08-25 10:32:48,0,0,5
j***k,银牌会员,手机很赞，卖家送的壳很漂亮，身边的朋友都很羡慕。,2017-11-28 15:02:09,0,0,5
O***W,银牌会员,用了一段时候才来评价的   整体感觉挺好的   没出什么问题,2017-08-23 11:57:17,0,0,5
青***狗,银牌会员,买个手机居然六天才发货，商家不耐心，最失败的一次购物，建议去别的店,2017-07-03 18:53:57,0,0,5
h***y,银牌会员,还不错的 送的东西挺多,2018-02-05 22:21:19,0,0,5
k***i,银牌会员,感觉用起来掉电特别快,2018-02-16 14:41:17,0,0,5
c***n,银牌会员,就是电池不耐用，其它都可以。,2017-11-16 10:35:09,0,0,5
j***c,银牌会员,第二次买了?  我支持国货  华为  中华有为择华为  ?,2017-08-17 19:16:48,0,0,5
j***m,金牌会员,"第一次使用华为的手机，感觉还不错正在熟悉中
！",2017-11-18 02:43:11,0,0,5
j***2,金牌会员,手机很漂亮的，蓝色可以亮瞎眼呀！不卡顿，反应快，拍照很漂亮哦?,2017-07-11 21:28:37,0,0,5
Y***7,银牌会员,好，就是语音助手有点不好，,2017-11-13 21:26:41,0,0,5
窒息先生,金牌会员,手机真的不错之前用的荣耀8现在用了荣耀9，卖家也很给力送的耳机是坏的跟卖家说了就给补发了一个快递速度也很给力第二天就到了,2017-08-04 17:24:17,0,0,5
你***楼,金牌会员,还算可以吧，不是太满意,2018-01-09 21:55:16,0,0,5
丿***灬,钻石会员,帮朋友买的   还不错吧     京东已经不是以前的京东了,2017-08-06 13:16:12,0,0,5
j***c,PLUS会员,手机质量很好，自己很喜欢,2017-11-18 13:12:09,0,0,5
s***3,钻石会员,挺好用的，反应快，待机时间OK，质感不错~给个五星！,2017-12-18 17:27:22,0,0,5
F***v,银牌会员,手机很好，速度快，颜值高，一家人都在用荣耀手机，店家服务态度好，发货快，赞一下，京东快递小哥服务好，很给力。,2017-07-28 09:53:58,1,0,5
sinoprime,PLUS会员,手机入手几天，速度快，颜色也好。双摄像头好。不错，超值。支持国货。,2017-08-07 15:44:43,3,0,5
j***9,银牌会员,华为手机，值得信赖,2018-02-04 18:29:23,0,0,5
j***颜,金牌会员,充电宝送过来已经碰坏了，说是给我重新发一个，不知道发了没啊,2017-07-06 11:21:14,0,0,5
j***h,钻石会员,一家人都在用荣耀好用值得购买，发货很快小东西送的很实用满意,2017-07-04 11:26:07,0,0,5
1***c,金牌会员,手机很漂亮，质量很好，物流速度快，送给老爸，很满意非常喜欢。支持国产华为荣耀手机。希望能用住。卖家服务态度好。,2017-09-07 21:07:58,0,0,5
j***d,银牌会员,东西还可以，就是物流太慢了，一个星期才到。,2017-11-06 15:18:28,0,0,5
航***9,银牌会员,手机还算可以吧   不过手机卖2599扣税都扣了377了,2017-07-17 23:52:24,0,0,5
jd_230057346,银牌会员,系统好快，实际操作了才来评价的，外观手感都非常满意,2017-09-01 16:31:20,0,0,5
郎***模,金牌会员,外表的确很惊艳，背面还是双曲面，手感很不错，好评！,2017-08-26 21:02:12,0,0,5
1***9,PLUS会员,手机非常好 店家服务很好 物流速度快,2017-07-04 13:57:41,0,0,5
n***J,银牌会员,好用是好用的！但是降价钱太快了！一个月一个价钱！,2017-09-03 09:30:59,0,0,5
j***c,银牌会员,包装看起来很好，包得很用心，相信货一定很好，谢谢了！,2017-08-01 23:51:07,0,0,5
j***e,银牌会员,19号拍的26号发货今天才到，见过**的没见过这么**的,2017-07-01 20:29:56,0,0,5
j***在,银牌会员,这手机太帅了，非常炫酷！不错 一直用荣耀！,2017-10-18 22:03:42,0,0,5
j***l,银牌会员,手机收到，使用起来确实不错，流畅，外观也是很亮。附上的照片没有开灯，暗了点儿，但是背面还是亮啊,2017-12-17 17:00:12,0,0,5
R***s,银牌会员,帮别人买的  目前来看还不错  也比较满意 先用着吧,2017-07-26 09:25:37,0,0,5
J***g,金牌会员,手机可以，速度很快，电池能用一天，充满1个半小时左右,2017-07-21 22:08:48,0,0,5
t***7,银牌会员,屏幕很大，用的很顺手，背面弧度也很漂亮，满意!,2017-09-07 17:03:28,0,0,5
经***途,PLUS会员,东西很不错，一直用华为，推荐国货,2017-07-16 13:02:23,0,0,5
琉***瓜,银牌会员,个人觉得不错，用着用也挺好的，推荐大家可以买这个手机,2017-07-02 02:50:59,0,0,5
j***8,银牌会员,目前来说，各方面都不错，颜值比较好，手感也比较好?,2017-07-18 16:30:48,0,0,5
y***i,银牌会员,非常满意，荣耀9品质没得说，颜值了得你懂的，赞。,2017-08-01 17:51:56,0,0,5
二***草,钻石会员,手机颜值突破天际，而且不卡，好看。贼他娘帅气,2017-09-02 05:11:40,0,0,5
j***8,PLUS会员,用了段时间，感觉还不错,2017-09-16 21:09:03,0,0,5
大***b,金牌会员,挺好的，手感不错，挺薄的，系统什么都，都很棒耶！,2017-07-27 21:16:10,0,0,5
e***6,金牌会员,手机发货很及时，第二天就收到了。只是怎么没发票？,2017-07-26 12:50:42,0,0,5
想***买,金牌会员,王者荣耀，断触严重???,2017-12-14 19:09:10,0,0,5
我***沙,钻石会员,颜色好速度快价格高用的人多，经常桩机,2017-10-26 20:51:30,0,0,5
j***y,银牌会员,今天刚刚拿到的，跟网上看到的一样，反应快，很喜欢,2017-07-22 18:02:10,0,0,5
A***R,金牌会员,荣耀9颜值真高，我十分喜欢，就是送的膜给我贴废了。,2017-07-04 12:38:49,0,0,5
jd134120xeo,钻石会员,物流太慢。。。。。。。。手机还行，玩游戏不卡。。。。是正品。。。。。。,2018-01-08 09:28:13,0,0,5
魏***兴,PLUS会员,很不错呀～建议购买～品质保障,2017-07-19 11:50:31,0,0,5
j***w,金牌会员,挺好的，也比较快，应该是正品,2017-12-18 12:43:47,0,0,5
诉***忆,金牌会员,还不错啊，前摄像位置看着不是很好，应该改善一下,2017-07-22 20:16:35,0,0,5
j***e,银牌会员,手机不错！  耳机  手机膜  和壳都不太好！！,2017-07-03 16:38:06,0,0,5
j***6,银牌会员,送朋友的生日礼物，朋友很喜欢，谢谢。,2017-10-07 08:02:26,0,0,5
入***丶,银牌会员,给老妈买的，用着还可以，蛮好看的，颜值超高,2017-08-18 00:09:29,0,0,5
c***9,银牌会员,手机本身和预想的一样，就是发货慢,2017-11-04 23:18:41,0,0,5
向***i,银牌会员,手机买了一段时间了，各种性能还可以，就是耗电快,2017-07-12 18:33:17,0,0,5
j***w,银牌会员,真心不想吐槽物流，可以用爬来形容了。真心难慢！,2017-07-11 11:45:55,0,0,5
枫***晚,PLUS会员,不错的，买给女朋友的，很小巧,2017-12-02 09:23:41,0,0,5
j***1,金牌会员,手机用着很不错，有些功能我还没使用,2017-10-15 10:45:31,0,0,5
j***k,银牌会员,手机很好用。。速度快。就是没买到喜欢的颜色,2017-08-08 21:48:35,0,0,5
L***仔,金牌会员,用的还不错价格也合理 华为越来越好了,2017-09-22 00:19:37,0,0,5
當***u,银牌会员,看起来还差不多  但是我自己贴不好  丑丑的,2017-07-14 20:33:58,0,0,5
j***o,金牌会员,华为手机，品质值得信赖，支持国产品牌,2017-09-14 11:39:51,0,0,5
j***e,银牌会员,手机很好！漂亮，卖家服务态度很好！物流也给力！,2017-06-24 11:25:01,0,0,5
1***p,钻石会员,店家服务态度好，还专门打电话问有没有收到货。,2017-07-08 09:27:06,0,0,5
l***7,银牌会员,手机蛮不错，很好看，运行速度非常快，我很满意,2017-07-03 16:58:11,0,0,5
j***8,钻石会员,手机给老爸用的，老爸说还不错，使用很流畅,2017-08-01 16:37:32,0,0,5
悦***明,银牌会员,手机很好  手感超级棒,2017-07-12 10:09:16,0,0,5
锡***狐,PLUS会员,屏幕大小合适，很漂亮，性能很不错。,2017-09-11 09:01:01,0,0,5
无***空,金牌会员,这个必须好评，比我那爱疯6s还用多了，,2017-08-09 09:41:09,0,0,5
j***c,金牌会员,非常好。。。。。。。。。。。。。。。。。。,2017-07-06 18:00:16,0,0,5
逍***子,钻石会员,是正品，很给力，大气漂亮，做工精美,2017-09-09 22:23:32,0,0,5
j***e,银牌会员,手机很不错，是正版，运行速度很快，像素超棒,2017-07-01 08:39:50,0,0,5
政***g,银牌会员,非常喜欢，真的是爱不释手，个人用手机很流畅,2017-06-30 10:08:17,0,0,5
j***p,银牌会员,质感很好，而且产品很漂亮,2017-11-21 21:47:22,0,0,5
k***A,银牌会员,荣耀手机是可以的，性价比高，值得够买。,2017-07-31 13:35:03,0,0,5
1***p,银牌会员,好看到不行，不喜欢大手机所以感觉手感好，速度也很快，非常满意了,2018-01-04 20:42:01,0,0,5
s***Y,金牌会员,手机已收到，商家送的手机膜不是全包的，其他的都挺好，早就想买，一直等到双11才舍得买,2017-11-20 12:54:02,0,0,5
冼***锋,金牌会员,用了一个多月了，觉得挺好用,2017-10-30 19:07:04,0,0,5
b***y,银牌会员,性价比高，颜色独特，值得收藏的一款手机,2017-07-18 12:33:57,0,0,5
j***6,银牌会员,唯一缺点就是电池不耐用,2017-11-22 15:10:45,0,0,5
j***r,银牌会员,不愧是新款，用的很好，儿子很喜欢，超赞,2017-07-15 19:45:43,0,0,5
j***a,金牌会员,关注荣耀9半年了，价格降到心理价位。外观靓丽，使用流畅，很满意！与小米6纠结了很长时间，因为很少玩游戏，对处理器要求可以适当降低，毕竟荣耀9便宜几大百。很满意的一次购物！,2018-01-07 11:50:04,1,1,5
丶***x,金牌会员,第一眼的感觉就是超喜欢?，好，特喜欢,2017-07-31 22:15:29,0,0,5
宠***s,金牌会员,手机很好用这是真的，语音助手不够智能,2017-07-26 23:26:41,0,0,5
7***3,银牌会员,买完出了新颜色 但还是这个颜色经典,2017-08-12 15:39:27,0,0,5
j***f,金牌会员,不错，不错。手感好，反应快，大小也合适,2017-07-09 11:20:07,0,0,5
孟***1,PLUS会员,手机的颜值酥到我了，帅的阔以啊！最喜欢的是待机时间可以，玩游戏够流畅也不卡机。,2017-07-10 14:47:43,0,0,5
沐***生,金牌会员,时间久了，都忘了，非常好，下次还来,2017-08-08 21:15:25,0,0,5
阳***来,银牌会员,手机整体感觉很好包装也很好手机也不卡,2017-07-20 18:26:06,0,0,5
一***g,金牌会员,手机昨天就收到了，很漂亮，功能强大,2017-08-03 07:38:42,0,0,5
j***1,银牌会员,手机今天刚拿到手，手感大小都很不错，外观漂亮时尚，值得推荐大家购买！,2017-07-01 14:37:11,3,0,5
f***3,银牌会员,发货快，物流速度很快，京东速度。很流畅，不卡顿。很满意。,2018-01-21 13:28:02,0,0,5
京***东,PLUS会员,手机不错。,2017-11-19 13:48:27,0,0,5
x***9,银牌会员,手机很好看，挺流畅，物流也快，很不错,2017-07-13 17:16:36,0,0,5
j***u,金牌会员,非常非常好，照相特别清晰，然后送了，还有好多好多的礼品。质量非常非常好，也特别特别满意，谢谢商家！,2017-07-04 15:10:26,0,0,5
枭***貔,金牌会员,外观漂亮，续航不错，拍照样张很满意,2017-07-26 11:28:29,0,0,5
跑***年,PLUS会员,手机很漂亮，我买的灰色的，不错很赞。,2017-07-09 08:08:28,0,0,5
t***r,金牌会员,手机正品，赠品劣质,2017-12-15 11:59:28,0,0,5
j***z,银牌会员,挺好的，买回来挺漂亮，一直用华为,2017-08-08 21:41:25,0,0,5
易***3,银牌会员,手机不错的。正品。大家赶紧买。好好用,2017-07-07 09:03:47,0,0,5
j***0,金牌会员,外观很有质感，时尚和商务并存。电池还可以吧，中度使用的话一天是没问题的，关键还有快充，问题不大。运行流畅，毕竟新机，这个可以留待后续观察。拍照功能较强，屏幕成像质量高，音质不错。整体满意。,2017-06-23 09:52:57,3,2,5
远***黛,银牌会员,实机感受，流光溢彩，系统流畅。,2017-08-22 17:27:15,0,0,5
j***3,PLUS会员,喜欢，用起来流畅！,2017-07-04 10:45:31,0,0,5
精5神尕2小伙0,金牌会员,终于抢到了?，期待了好久，很流畅，而且音质不错，就是时间玩的长了少少有点烫，但是不影响使用，很好,2017-07-07 14:03:57,0,0,5
小***糕,银牌会员,这个颜色不得不说还是特别漂亮的,2017-08-18 11:11:14,0,0,5
j***生,银牌会员,很好，用起来很顺手,2017-12-06 10:23:32,0,0,5
j***y,钻石会员,我推荐，我喜欢，用了几天来评价的,2017-07-27 20:20:26,0,0,5
G***A,银牌会员,手感好，不卡顿，外形帅气,2017-09-26 18:59:06,0,0,5
徐***梅,金牌会员,挺好用的，颜色也很漂亮，发烫严重,2017-07-23 18:40:43,0,0,5
JWOlIStirKDD,银牌会员,有问题咨询卖家基本秒回，感动。,2017-08-08 12:44:18,0,0,5
j***4,银牌会员,挺好的，物流还行，就是快充有点慢,2017-07-22 18:23:47,0,0,5
真***系,银牌会员,手机刚到，还没开始用，不过快递很快,2017-07-04 21:12:39,0,0,5
我***平,银牌会员,还可以  但是建议把膜买好,2017-08-31 14:17:24,0,0,5
j***c,银牌会员,手机很不错外观很赞,2017-11-18 10:12:05,0,0,5
心***3,金牌会员,因为是给我弟弟买的，回家试过后才来评论，手机本身是正品，就是电池不经用，和别的手机比，费电太快，不够用的，赠品还好都实用，就是发货好慢啊，手机上午买的，第二天下午我又买了一套雷蛇的鼠标键盘，结果雷蛇的东西到了，手机还没到，比雷蛇还慢一整天才到，我也是醉了,2017-07-23 18:02:34,0,0,4
k***B,银牌会员,手机音量键和电源键很松担心会进灰尘,2017-06-22 11:06:28,0,0,5
m***余,银牌会员,可以的，现在用了荣耀9还是可以的,2017-07-09 02:29:06,0,0,5
j***u,银牌会员,充电还行！2-3小时差不多能满！,2017-07-04 17:35:31,0,0,5
Y***哥,银牌会员,手机非常不错，就是快递慢了点,2017-08-06 11:10:27,0,0,5
未***雾,金牌会员,充电太慢！待电不理想！其它还好！,2017-07-03 21:30:07,0,0,5
j***1,银牌会员,手机很nice，送的东西也很齐全,2017-07-01 10:34:13,0,0,5
哲***货,金牌会员,还不错，同事看了都觉得好看，就是不知道用起来怎么样了,2018-01-06 15:34:30,0,0,5
威***人,银牌会员,感觉不错，送给客户也很满意。。,2017-07-10 02:42:17,0,0,5
j***b,银牌会员,好好好好好好好好得不得了！,2017-08-13 21:52:47,0,0,5
J***9,金牌会员,"一个月降价300,也就醉了",2017-08-03 12:23:27,0,0,5
r***8,PLUS会员,手机不错，送的礼品很喜欢，价格实惠，用了几天还算可以，支持国货,2017-09-02 20:49:56,0,0,5
岚***玥,银牌会员,给老弟买的，很喜欢,2017-10-19 22:39:32,0,0,5
看***1,金牌会员,效果不错！手机体验起来很好！,2017-07-14 18:02:11,0,0,5
j***w,PLUS会员[试用],性价比很高的机子。,2017-10-17 09:23:40,0,0,5
a***T,银牌会员,手机好用  物美价廉,2017-09-12 20:17:38,0,0,5
j***l,银牌会员,还行，就是后盖太容易沾指纹,2017-07-26 00:04:03,0,0,5
j***7,金牌会员,应该用起来不错。。。。。。,2017-07-25 11:05:58,0,0,5
j***r,银牌会员,非常好，非常满意。会回购的。,2017-07-08 12:14:20,0,0,5
j***x,银牌会员,手机和在网上看到的一样，喜欢,2017-07-06 12:36:38,0,0,5
j***k,银牌会员,怎么没见开卡槽的插针,2017-09-07 20:00:13,0,0,5
与我无关iiii,金牌会员,这手机不赖，好评！,2017-10-09 17:04:19,0,0,5
黄***哥,PLUS会员,电池不耐用，机身易发热,2017-08-19 14:49:16,0,0,5
王***7,金牌会员,给老公买的，他很满意，很喜欢,2017-06-30 17:09:04,0,0,5
o***4,金牌会员,好好好啊好好好好好好好,2017-08-25 18:41:12,0,0,5
j***d,银牌会员,发票没提供，何时寄过来？,2017-08-01 23:25:35,0,0,5
漂***瓶,PLUS会员[试用],商品非常的好，运行也很快,2017-08-01 15:08:10,0,0,5
j***d,银牌会员,刚开始使用还不知道具体怎么样,2017-06-29 11:48:06,0,0,5
林***8,银牌会员,不错，是正品，赠品也很良心,2017-07-12 13:23:56,0,0,5
为***心,PLUS会员,自己买了一个这个是帮朋友买的，反应迅速，系统流畅,2017-11-30 20:17:21,0,0,5
能***兒,钻石会员,手机很漂亮，流畅，喜欢,2017-08-04 10:02:58,0,0,5
j***z,金牌会员,挺好的，性能不错外观很好,2017-07-14 11:04:54,0,0,5
一***尚,银牌会员,不会用啊，怎样呼出后台啊,2017-07-10 18:11:33,0,0,5
红***愿,金牌会员,颜色不对，收到的是蓝色,2017-07-20 16:30:48,0,0,5
y***3,银牌会员,手机是真心的漂亮就是物流太慢了走了五天。。。,2018-01-09 08:05:44,0,0,5
小***4,PLUS会员[试用],颜值爆表，我靠，真的超好看，骚蓝真的好骚，拍照也是超高清，华为真不错，好评,2017-07-03 10:06:12,1,0,5
e***O,银牌会员,发货速度太慢等了10才到,2017-06-30 14:45:41,0,0,5
a***l,钻石会员,很时尚性能也非常好。,2017-08-02 01:09:21,0,0,5
1***b,金牌会员,挺好看的，就是物流太慢了,2017-06-30 12:16:51,0,0,5
肆***乖,银牌会员,东西不错，用起来很好，,2017-07-16 11:26:26,0,0,5
j***1,金牌会员,快递快，早上下单的，下午就到了。手机比较流畅，外观好。。,2017-09-03 09:12:41,2,0,5
笑***h,钻石会员,性价比高，给女儿用的,2017-07-29 10:32:44,0,0,5
我***哥,银牌会员,还好用吧，那个你漂亮玩游戏不卡，拍照，还可以反应就是有待提升啊，还是觉得没有苹果啊,2017-07-05 11:04:11,0,0,5
j***7,银牌会员,特别差劲，大家下单要三思，买了一台荣耀9原本很相信这个牌子，没想到这里的价格乱标价，两天前下单2699，两天后货还没有收到居然降价为2499，联系卖家，卖家居然不同意退回差价给我，欺骗消费者的利益。,2017-08-09 15:21:24,0,0,5
j***5,银牌会员,以前用的荣耀8，感觉就很好，现在换荣耀9.今天刚刚到货，华为真的没话说，一个字，值,2017-07-02 16:50:38,0,0,5
O***y,银牌会员,还不错，就是发货慢了点,2017-07-01 12:25:08,0,0,5
海***鸟,PLUS会员,首先包装很有感觉，看上去就很不错，试了手机，手感很不错，触屏的感觉很不错，反映灵敏，拍照很NX！！性价比很高！特别喜欢的这款蓝色的，醒目大气！！,2017-06-17 14:21:32,8,1,5
j***f,银牌会员,没送卡针啊怎么回事？,2017-07-02 06:00:35,0,0,5
j***y,PLUS会员,挺好，外观很好看。,2017-08-02 11:59:43,0,0,5
