名字,会员级别,评论内容,评论时间,点赞数,评论数,评价星级
j***a,金牌会员,挺好的，外观挺精致，,2018-03-08 16:21:08,0,0,5
牛***德,PLUS会员,运行流畅，外观好看，屏幕色彩也好，基本上玩游戏也可以坚持一天，华为的系统的用户体验就是比iphone好，以后还是支持国产,2018-03-07 22:49:58,0,0,5
提***人,钻石会员,手机非常不错 手小 单手拿着正合适 以前一直用mate7 这次换了 希望有比以前手机更惊艳的表现 物流很快 下单不到10小时 拿到手了,2018-03-07 09:19:13,0,0,5
z***7,钻石会员,速度很快，没有卡顿，电池充电快，多充一会会用更长时间的，屏幕面积比妹8稍小，单手握持感更好一些，国货中的精品了，相信华为，支持国货,2018-03-06 22:37:37,0,0,5
d***6,金牌会员,拍照功能的确很棒，自拍功能也非常强大。运行速度很快，屏幕看着也舒服，喜欢这个淡淡的粉。之前用的三星，第一次用华为还是非常满意的。,2018-03-09 12:30:16,0,0,5
s***n,PLUS会员,使用小半个月回来评论，确实挺好用的！之前iPhone送修买来备用，现在有点不知道如何取舍哪台作为备用机了！,2018-03-08 22:09:08,0,0,5
什么怎么了,金牌会员,特意用了一段时间才来评价。外观很时尚，手机反应很快。电池没有想象中的那么耐用，一天一充吧。总体还是感觉值得购买的。,2018-02-26 18:04:33,1,0,5
j***l,钻石会员,老妈十分开心喜欢,2018-03-08 17:44:18,0,0,5
梦***7,金牌会员,没什么～大家懂得。3月6号晚上下的单，居然不在优惠范围内～早上一睁眼一个原装皮套没了。活动界面不知包括哪个时间段。笑谈,2018-03-07 13:52:44,0,0,5
S***丶,金牌会员,我不是黑国产手机  做工的确没有苹果好  下面有图   摄像头拍出来的效果还没有6sp好   本来是想买小米了后来决定支持一下华为毕竟也是中国电子行业的龙头  结果没想到手机拿到后充电口松的会自己切歌（用耳机听歌时）后摄像头也歪了一个   彻底放弃了没耐心了   还是三千米那个小米用用算了    国产手机还是不能超过三千大米。,2018-01-10 19:09:39,56,30,1
夜***魂,PLUS会员,原来一直用苹果，这是第一次买安卓系统的手机，用着感觉比苹果慢点有限，希望华为越做越好，支持国货。,2018-03-08 10:32:53,0,0,5
非***腿,金牌会员,续航很给力，能用一天，充电也很快，边打游戏边充电就充满了，系统也挺好用，摆脱了苹果觉得国产也是很好的，以后还会支持,2018-03-09 17:46:21,0,0,5
人***由,PLUS会员,安卓旗舰机中，粉嫩的颜色不多，如果这款手机没有粉色，我会把它加入“（同价位）最丑的安卓手机清单”，但奇怪的是粉色居然是一种能提高手机颜值的颜色！手机正反面是淡粉色（有玻璃质感和烤漆质感的混合感），侧面、指纹识别处的圈圈是金属光泽的淡玫粉色，手机的充电线插口内侧也是粉色的，手机背面没有华为奇怪的菊花图案。粉色是清新淡雅的那种粉，非常舒服，适合各个年龄段（我觉得男人用这个颜色也不会觉得鲜艳和俗气，反而增添活力）。包装盒内自带软的透明保护套，省去了消费者选购保护套的时间。系统很智能，不愧是旗舰机。声音外放效果一般。屏幕分辨率效果比某品牌机差一些，不过毕竟比人家便宜上千元，牺牲了屏幕和外放也能理解。拍照性能上，对焦效果还不错，色彩上感觉无功无过。手机可以选择标准色彩和艳丽色彩。花朵的动态壁纸很有趣。智能情景越来越智能。手机速度很快，希望能坚持一年不卡顿，不然这个价位就贵了。,2018-03-09 13:54:49,0,0,5
a***-,PLUS会员,给老公买的，他很满意，运行快，轻薄，价格再议诙谐就好了，没办法刚好赶上过年，啥优惠都没有，,2018-03-09 07:21:46,0,0,5
诸***亮,PLUS会员,挺好 握感比mate10好很多.就是屏幕看起来有点颗粒感 没有6S细腻  大屏比6S爽多了,2018-03-08 07:24:02,0,0,5
周样686,金牌会员,手机到手用了一个星期了吧，总体感觉很流畅，打开应用速度很快，玩游戏性能也是非常不错的，毕竟价钱摆着呢，物有所值吧，不过在使用过程中发现手机在启动手机App应用时会有点慢，在相同网络环境下相比较苹果手机打开速度慢了5秒左右吧。其它的要说相机了，确实是自带美图与高清的像素。而且夜晚拍照也看的很清楚。总体手机还是不错的,2018-03-09 10:44:54,0,0,4
t***o,PLUS会员,一直京东买东西，看中送货快捷，东西应该是真品。很好用。出去还要去不同的地方买不同的东西。,2018-03-07 10:27:06,0,0,5
j***8,金牌会员,宝贝收到，很惊艳比荣耀7x速度快屏幕大而且还小一圈，屏幕清晰亮度自适应感光调节，电池续航能力强，再体验体验,2018-03-09 19:25:55,0,0,5
j***9,PLUS会员,感觉有的时候有点卡顿。不知道怎么回事。开屏反应超快。系统但还是比苹果的要慢点。优待改良,2018-03-08 17:29:09,0,0,5
9***m,钻石会员,拍照清晰，电池与同类相比没啥大的差别，触屏也没有苹果那么灵敏，不过也算不错了，不知道用过一段时间以后会咋样,2018-03-07 07:55:55,0,0,5
k***3,PLUS会员,很好用，棕色很好看，送了手机壳和手机膜（膜是贴好的）。这款手机不用壳的话很滑，容易掉。,2018-03-06 23:11:12,0,0,5
j***雪,PLUS会员,颜值不错，运行速度没有想像的快，最苦老的是不支持京东和微信指纹支付，要输密码，很糟心,2018-03-07 17:47:17,0,0,5
愤***尚,PLUS会员,很不错，之前买的mate9被偷了，立马换新机。只不过华为宣传的AI功能还没体会到～～,2018-03-07 08:55:35,0,0,5
j***3,钻石会员,手机手感很好，感觉也不大，跟以前5.5寸没有什么区别。，970系统就是不一样，反应飞快，照相也是超给力,2018-03-09 22:41:00,0,0,5
s***7,PLUS会员,是不是就我一个人觉得手机没有图片那么薄？拍照功能也许是没弄明白的原因，没觉得效果好,2018-03-09 18:28:45,0,0,5
永***t,PLUS会员,帮一个兄弟的母亲买的，手机她很喜欢。目前在使用，等追评吧，毕竟刚用无法给出准确答案,2018-03-08 00:28:44,0,0,5
H***3,PLUS会员,国产机皇，电池续航一天尚可，使用强度不大的话，到晚上十一点大概还能剩下20%左右。,2018-03-07 09:56:00,0,0,5
q***r,PLUS会员,非常好，以后不用去商场买了，太方便了，京东就是牛，越来越喜欢！非常方便，好用。。。,2018-03-08 14:11:02,0,0,5
冰***子,PLUS会员,运行流畅，刚从苹果转安卓，指纹的位置还有些稍稍不太适应，但华为的手机真没让我失望,2018-03-07 08:28:15,0,0,5
z***5,PLUS会员,好货确实是好货，但价格不比实体店低，而且没有任何售后服务，实体店有服务有赠品。,2018-03-09 09:46:12,0,0,5
j***2,PLUS会员,手机用了几个星期，还是一样的流畅，手感也没变，屏幕显示也很不错，建议大家入手。,2018-03-08 23:21:49,0,0,5
牛***路,PLUS会员,"哇喔~这个手机简直太棒了！
我一个男生因为当时别的颜色缺货，所以就买了个这个手机~不过感觉颜色还是挺漂亮的，而且拍照效果简直棒极了！这个就是最吸引我的一点！
a-ptx蓝牙高清音频的支持，预装安卓8，超级超级棒的照相，极棒极美的屏幕，不错的外观！一直支持华为！",2018-03-09 10:12:05,0,0,5
x***l,钻石会员,用了一个多月才来评价。特别特别好用的一款手机，摄像摄影功能非常好用，颜色也非常好，大赞???,2018-03-07 17:23:11,0,0,5
李***啊,银牌会员,一天到，手机好到不像话，王者荣耀无压力，颜值可以，本来计划买苹果，后来发现了这款手机，果断改变主意,2018-03-07 08:20:56,0,0,5
h***a,PLUS会员,华为最新牛机，老婆喜欢的不得了，省电，屏幕超级清晰，且斜面可观度好，继续支持。,2018-02-22 15:40:48,0,0,5
孩***v,PLUS会员,怀着一颗忐忑的心情入手了这个手机，颜色，性能，都很喜欢，支持国货，支持华为。,2018-03-07 21:13:01,0,0,5
j***e,银牌会员,宝贝已收到，很精致好喜欢，手机克隆了部分内容，但要换nano卡，还得去移动营业厅，暂时还没使用。,2018-03-06 18:07:10,0,0,5
e***0,钻石会员,产品本身不错，可以当个小电脑用。我买了炒比特币，芯片和系统集成稳定很重要。用了一天，非常满意！,2018-03-09 23:09:50,0,0,5
j***龙,PLUS会员,刚使用一天，感觉不错，比我以前美腿8好用，其他没有什么感受，使用时间太短。,2018-03-09 09:48:12,0,0,5
S***6,PLUS会员,用了多天才能评价，运行速度流畅，拍照清晰，夜景校呆也是杠杠的。手感也挺好。,2018-03-07 18:26:39,0,0,5
M***a,PLUS会员,很好的一款手机，非常省电，颜色和外观都很漂亮，原厂膜较软，没几天就花了。,2018-03-08 13:42:13,0,0,5
明***君,PLUS会员,从mate8过渡到m10p，小了一大圈，手感很好，其他一如既往。符合预期,2018-03-07 10:20:53,0,0,5
沧***独,钻石会员,老公给买的三八礼物！很喜欢的手机，颜色好看，速度惊人的快，超级高清，看剧有立体感！支持国货！,2018-03-08 15:44:14,0,0,5
路***1,PLUS会员,电池很耐用，运行速度很快，目前没啥问题，就是有点小贵～～～性价比一般吧,2018-03-09 21:19:17,0,0,5
j***m,PLUS会员,让我一顿好等，结局还是不错的。非常舒服，终于可以支持一下华为了，哈哈哈。,2018-02-21 11:30:05,0,0,5
j***枚,PLUS会员,电池比较给力 偶尔玩玩游戏一天也基本够用 照相那叫一个给力 支持国货,2018-03-09 18:15:01,0,0,5
z***y,PLUS会员,心里种草半年，终于拿下，不愧是旗舰机，唯一的不满就是音乐和外放是短板,2018-03-09 11:11:02,0,0,5
老***7,PLUS会员,给老婆买的手机，颜色也好看。就是感觉和mate9 pro没太大差别。,2018-03-07 21:03:36,0,0,5
L***9,PLUS会员,运行速度真是快。支持国货。??????????,2018-03-09 20:49:31,0,0,5
又***钱,钻石会员,手机没有想象中的6.0寸屏那么大宽度和5.5的差不多，屏幕长了不少！使用还是非常不错！,2018-03-09 19:16:48,0,0,5
罐***才,PLUS会员,新的手机来犒劳自己的，支持华为支持国货，确实很好用，智能助手很贴心,2018-03-09 23:21:50,0,0,5
自***3,PLUS会员[试用],非常的好用  屏幕丝般柔滑  但是玩游戏左边摇杆老是拉不回来。。。,2018-03-07 19:25:12,0,0,5
z***u,PLUS会员,关注了一段时间，终于买了，感觉很满意，算是目前国产机的顶尖产品了。,2018-03-09 16:40:50,0,0,5
r***g,PLUS会员,"用了一段才来评价，很流畅屏幕清楚电池耐用，比原来的p10
强太多了",2018-03-06 19:59:39,0,0,5
1***p,PLUS会员,屏幕还可以啊，照相机也不错，手机暂时还没出毛病，等以后在看看吧。,2018-03-08 07:08:41,0,0,5
灿***5,PLUS会员,用了四部苹果，终于改用华为了，没想到完全不受系统影响，很好很强大,2018-03-08 17:59:44,0,0,5
F***2,PLUS会员,手机不送，物流也快，就是没配件送，华为官方网站TYPE-C接口。,2018-03-06 14:58:58,0,0,5
F***p,PLUS会员,非常好用，大气，适合我们这种中年大叔用。推荐给身边好几个朋友了。,2018-03-06 15:41:45,0,0,5
下***班,金牌会员,感觉不错，屏幕很惊艳，相片也很清楚，已经是第二台华为手机了，现在的华为手机越来越好了,2018-03-07 13:42:25,0,0,5
j***l,银牌会员,第一次用华为的手机，感觉不错，功能很强大，国产手机发展越来越好，以后就用华为手机了。,2018-03-08 11:03:07,0,0,5
j***4,银牌会员,杠杠滴！比苹果，没觉得哪里不如苹果！反而有比苹果优秀的地方！国产当自强！支持国产！！,2018-03-07 12:43:07,0,0,5
小***r,钻石会员,买给老公的，用了半个月了，有死机现象，毕竟这么贵的价格，所以不是特别满意，屏幕显示没有苹果的流畅，其他还可以吧，指纹反应很快,2018-03-05 19:38:23,0,1,3
宏***7,PLUS会员,非常喜欢，性能很好，配置很高，反应很快，款式很不错，送货跟快，,2018-03-07 12:01:30,0,0,5
j***x,金牌会员,快递包装一般吧，反正手机到也没有损坏，然后送货速度也四颗星吧，手机一般就这么用用吧,2018-03-08 07:14:48,0,0,5
j***i,银牌会员,很报谦用了快两月了才来评价，手机绝对满意，美观，大气，电很耐用，没发现有什么毛病。,2018-03-06 21:28:03,0,0,5
1***6,PLUS会员,手机很不错,2018-03-08 21:47:45,0,0,5
E***神,金牌会员,支持华为   刚拿到手   很满意    发货快  手机也好看   华为越来越好,2018-03-08 12:55:49,0,0,5
周***晨,PLUS会员,用了一个月了，质量可以，拍照不错，只是预装软件好多卸载不了。,2018-03-09 11:38:27,0,0,5
-***-,钻石会员,快递最后一站压住了，晚一天送到。机器还可以，没大要求，包装简单未破损。支持国货。,2018-03-06 20:46:07,0,0,5
深***渔,银牌会员,挺好使的 回来用了一段时间了 电量厚大 手感很好 新机的原因吧没有卡顿 系统不错,2018-03-07 20:28:33,0,0,5
j***e,PLUS会员,华为手机一直是我的最爱，，用了五年手机，，，一直没有换过品牌,2018-03-07 11:53:21,0,0,5
n***4,钻石会员,安卓手机不知道用不用得惯，但是目前用下来各方面都还好。另外，京东的物流满分好评,2018-03-09 23:43:26,0,0,5
兄***子,PLUS会员,手机还是不错，但没给自己很惊艳的感觉，使用上还不是很习惯。,2018-03-07 22:39:29,0,0,5
j***n,银牌会员,老公很喜欢！快递太给力了，那么大的雪都没有耽误送货！应该给京东快递员五星好评！,2018-03-08 15:31:56,0,1,5
j***7,银牌会员,手机绝对原装正品，包装精美，用了两天感觉功能太强大，相机? 杠杠滴，值得买入,2018-03-08 01:30:08,0,0,5
无***9,PLUS会员,屏幕还行，比10轻一点，大的不是很多，拍照很好用，速度很快,2018-03-07 11:29:58,0,0,5
j***1,钻石会员,屏幕很大，国产最好的手机。总体使用感觉非常好。我对手机依赖。需要每天都充电。,2018-03-09 21:31:08,0,0,5
2***m,金牌会员,这款手机颜值较高，粉色的特适合女士用，可一手掌控用了一段时间了，感觉还不错。,2018-03-09 14:35:33,0,0,5
a***3,PLUS会员,感觉手机比例还是2:1更好，握着个人觉得比mate10好,2018-03-07 22:28:48,0,0,5
阿***溜,PLUS会员,华为品质值得信赖！！原来没钱，买华为。现在，没钱买华为！,2018-03-09 11:31:41,0,0,5
j***6,金牌会员,手机运行速度还可以，外观也不错，就是打游戏会有卡顿，仿佛对不起这个价位的手机,2018-03-07 13:49:40,0,0,5
j***5,PLUS会员,快递飞快中午下单下午5点多就到手，手机和我想象中是一样,2018-03-09 10:56:37,0,0,5
不***觉,PLUS会员,一直用这个牌子的手机，顺手了，功能也很强大，送人有面子,2018-03-08 19:56:34,0,0,5
j***6,钻石会员,手机响应速度很快，感觉比三星速度还快一点，支持国产，如果有个国产系统更好。,2018-03-09 21:07:49,0,0,5
n***r,PLUS会员,华为的东西，应该是很好的?还在转资料，使用后再评价。,2018-03-08 18:50:15,0,0,5
j***2,金牌会员,还不错，节前买的，充电特别快，就是拍照拍人物特别奇怪，很白，怎么调都奇怪。,2018-03-06 23:12:46,0,0,5
G***u,PLUS会员,拍照挺强的。屏幕建议自己贴个钢化膜。质感很好,2018-03-03 23:27:01,1,0,5
1***p,金牌会员,不错，没有耳机单独接口，和充电一起的。不好，背后解锁不美观，三个圈圈一起,2018-03-09 15:30:06,0,0,5
烟***行,PLUS会员,小米手机用着不错，功能性也好而且像素清晰，超大号电池,2018-03-09 05:17:26,0,0,5
A***1,PLUS会员,装上卡后，直接上的高铁，信号比iPhone要好太多了,2018-03-08 15:36:36,0,0,5
j***5,银牌会员,还不错   物流想到给力  感觉很高大上 就是拍照还没搞明白 继续研究中,2018-03-08 10:09:30,0,0,5
潇***宇,PLUS会员,支持国货，国货当自强，美的很，再来一瓣蒜，撩咋了！,2018-03-09 20:39:20,0,0,5
j***2,PLUS会员,很好用，指纹解锁特别方便，拍照像素也很好，推荐购买,2018-03-09 08:06:25,0,0,5
爱***2,PLUS会员,信赖京东自营的东西，活动价格很给力，物流也赞，五星,2018-03-06 21:33:06,0,1,5
s***u,PLUS会员,支持国货，据说高级的不得了。老公弃苹果改投华为了,2018-03-09 11:18:47,0,0,5
飞***刀,PLUS会员,非常好、很快拍照很清晰运行速度很好！不愧为高端机,2018-03-08 15:25:36,0,0,5
巫***哒,金牌会员,颜色说实话比图片更好看，而且很流畅，相机功能很强大，很好，看中很久了,2018-03-08 09:39:43,0,0,5
j***7,银牌会员,触感不错，续航能力强大，有一些论坛上常有的毛病，用一段时间后再来评价,2018-03-07 21:44:32,0,0,5
芯***瑷,PLUS会员,屏幕很大，响应速度快，待机时间够长，拍照效果很好,2018-03-07 09:05:06,0,0,5
风***好,PLUS会员,华为还是一如既往，用的很舒服，国产他应该是大哥了,2018-03-06 18:51:17,0,0,5
j***3,金牌会员,挺好用的，语音识别也很准确，电量足。还能自动调亮度，很智能一款手机。,2018-03-06 20:21:59,0,0,5
j***e,金牌会员,非常好，老妈很喜欢，一学就会，拍照很专业，买回来就没关机，一直很快,2018-03-10 00:46:39,0,0,5
j***g,金牌会员,是真的好，特别是售后，好的没话说，一个月内买了两部，和妹子一人一部,2018-03-08 23:18:18,0,0,5
z***g,PLUS会员,速度快，抓在手里大小合适，支持华为，越做越好。,2018-03-08 09:18:47,0,0,5
Z***G,PLUS会员,用着挺好的，华为值得信赖，以后就不用苹果手机壳,2018-03-08 11:29:25,0,0,5
皮***4,金牌会员,上手效果很好，运行流畅，没有问题，物流很快，服务可靠放心，信任京东,2018-03-07 13:48:54,0,0,5
李***0,企业会员,公司年会奖品，配送很及时，价格也蛮实惠的，可惜量多不能再进一步优惠,2018-03-06 22:01:30,0,0,5
z***1,钻石会员,一直在京东买手机。对京东的东西还是很放心的，而且物流也快，满意。,2018-03-09 22:24:52,0,0,5
j***d,PLUS会员,手感不错，大小重量很有存在感，功能用下在感觉,2018-03-08 09:23:19,0,0,5
珍***2,金牌会员,不得不佩服现在的国产机，这是第六个华为了，mete系列忠实客户。,2018-03-08 00:18:26,0,0,5
l***n,PLUS会员,mate10确实不错，好看，好用，拍照漂亮。,2018-03-07 14:50:38,0,0,5
_***r,钻石会员,不错，老婆很喜欢，粉色蛮漂亮的，以前不太习惯华为，但这款确实不错,2018-03-07 18:28:38,0,0,5
我***你,金牌会员,这几天用着很好！感觉速度特别快！下载了几个大型游戏！感觉也很好！,2018-03-06 15:09:13,0,0,5
行***物,PLUS会员,使用起来非常流畅，手感也很好，我挺喜欢的。,2018-03-09 17:27:45,0,0,5
8***m,金牌会员,手机还可以，用了一天没发现什么问题，手感是没得说，系统一样如此,2018-03-06 22:56:46,0,0,5
j***o,银牌会员,包装实在严实导致我找快递的时候差点没找到而且快递不是一般的快速,2018-03-07 23:05:05,0,0,5
m***s,PLUS会员,手机还是很好的，一直想买的，这次给老婆买的,2018-03-08 19:08:26,0,0,5
龙***3,钻石会员,屏幕大，图像清晰。运行速度流畅，手感极佳。拍照效果媲美专业。,2018-03-09 20:03:25,0,0,5
许***9,金牌会员,以为还有赠品呢，知道没有赠品的话就不在上面买了，买贵这么多。,2018-03-09 13:54:37,0,0,5
黄***颂,金牌会员,用着还可以,2018-03-08 11:43:51,0,0,5
1***6,PLUS会员,信号不  上网经常打不开  电池续航还行,2018-03-07 17:54:56,0,0,5
琰***哒,金牌会员,很不错，满意的，就是之前的华为都送一张钢化膜，这个好像没有诶,2018-03-08 07:32:47,0,0,5
j***5,银牌会员,东西超给力,2018-03-07 08:31:08,0,0,5
沉***音,金牌会员,儿子在用，先用的苹果6splus.给我用了。非常好华为真牛逼,2018-03-07 12:49:47,0,0,5
S***0,PLUS会员,华为品牌民族骄傲，用起来还不错，挺满意的,2018-03-07 08:33:46,0,0,5
暗***9,PLUS会员,大品牌的产品质量就是好，用起来比较放心！,2018-03-07 08:24:20,0,0,5
j***4,银牌会员,挺好的?,2018-03-06 14:30:40,0,0,5
F***i,PLUS会员,东西不错，京东送货也很快，好评一个?,2018-03-09 22:24:10,0,0,5
麦***琛,PLUS会员,真的不错，华为手机果然很好用，特别喜欢,2018-03-09 15:33:59,0,0,5
独***品,银牌会员,第一次用华为，产品还是很给力的！加油，希望一代比一代更好！,2018-03-09 07:46:42,0,0,5
1***a,金牌会员,华为手机目前在国产手机里还是非常不错的，电池续航能力还不错,2018-03-09 17:45:02,0,0,5
j***8,金牌会员,服态度非常好！建议大家赶紧抢购吧，真的是物超所值！全五分！,2018-03-07 23:45:06,0,0,5
j***a,金牌会员,电池没有想像中那么耐用，速度很快，拍照很骚，其他没什么亮点,2018-03-07 13:38:58,0,0,5
暖***7,PLUS会员,感觉灵敏度还是不行，有时候触屏不太灵敏,2018-03-07 08:35:39,0,0,5
jd_189775gxc,银牌会员,入手第一天，很满意，暂时没有什么不可能好的地方，支持国产。,2018-03-06 13:47:33,0,0,5
懂***8,PLUS会员,公司活动的礼品，盒子好看，特别高大上,2018-03-08 09:03:11,0,0,5
懂***8,PLUS会员,公司活动的礼品，盒子漂亮，特别高大上,2018-03-08 08:53:46,0,0,5
j***c,PLUS会员,还行吧，没有微信指纹支付，有点不习惯,2018-03-07 10:47:44,0,0,5
g***3,PLUS会员,买来送人了，看着很漂亮，具体效果不知,2018-03-07 08:52:25,0,0,5
9***w,钻石会员,挺好的，其实买的手机就带了，不过留着备用也是挺有必要的！,2018-03-08 17:43:02,0,0,5
爱***帆,金牌会员,一直都是华为忠实客户！从mater2一直到今天收到的10,2018-03-06 17:52:45,0,1,5
奥***密,企业会员,速度快，服务到位，继续努力。京东继续加油，做好中国服务。,2018-03-06 20:03:35,0,0,5
德***才,PLUS会员,速度很快，产品包转不错，舍不得打开,2018-03-09 17:33:41,0,0,5
W***s,金牌会员,超级好用。。也很帅。。宽度正合适。。支持国产。支持华为,2018-03-09 09:28:18,0,0,5
敏***n,银牌会员,男朋友很喜欢，说了好久就想买这款手机，简直爱不释手呢！,2018-03-08 18:49:08,0,0,5
艾***o,PLUS会员,给老爹买的，从8升级到10，很满意,2018-03-08 11:30:21,0,0,5
此***待,PLUS会员,高颜值高速度贵 有贵的道理 真不错,2018-03-07 11:51:24,0,0,5
j***b,PLUS会员,喜欢，物美价廉，京东是我的购物首选,2018-03-07 09:49:01,0,0,5
奔***牜,PLUS会员,很不错的商品，质量也很好、值得购买,2018-03-06 22:45:16,0,0,5
w***9,金牌会员,这款手机用起来感觉真的很好，够流畅，屏幕大，玩游戏很爽,2018-03-06 17:46:19,0,0,5
南***府,PLUS会员,此用户未及时评价，系统默认好评。,2018-03-10 00:41:31,0,0,5
c***g,PLUS会员,发货快，性价比高，一如既往的支持,2018-03-08 21:47:26,0,0,5
c***g,PLUS会员,发货快，性价比高，一如既往的支持,2018-03-08 21:47:15,0,0,5
j***w,PLUS会员[试用],很喜欢续航能力很强运行速度也很快,2018-03-08 17:07:06,0,0,5
信***力,注册会员,机器很完美，第一次网上买手机观察了好多家，还是这里好,2018-03-08 19:05:35,0,0,5
j***e,PLUS会员,手机很棒，国产很给力，一直在用。,2018-03-08 11:33:06,0,0,5
j***5,PLUS会员,电池很耐用，屏幕解锁很快，满意。,2018-03-08 00:22:40,0,0,5
Y***o,钻石会员,运行速度挺快的，屏幕成像也不错，摄像头也很棒，很满意,2018-03-06 20:10:23,0,0,5
1***p,金牌会员,宝贝挺好的，绝对的新机，京东一直都是这么的值得信任！,2018-03-08 12:28:24,0,0,5
g***1,PLUS会员,外观漂亮，正使用中，感觉还不错,2018-03-08 19:00:18,0,0,5
塞***3,PLUS会员,货收到了，还没用，看起来还不错,2018-03-08 12:08:47,0,0,5
j***h,银牌会员,东西真的质量好，非常长满意，发货也快，服务态度也好,2018-03-07 23:48:02,0,0,5
d***h,PLUS会员,用了一段时间了，非常好，好评！,2018-03-07 20:45:10,0,0,5
蹇***龙,金牌会员,功能非常强大，非常漂亮的手机，支持国产，棒棒的，哦,2018-03-07 19:13:27,0,0,5
r***3,PLUS会员,心仪已久的手机，终于不用抢了,2018-03-09 22:32:48,0,0,5
i***4,钻石会员,真的太好用了，屏幕大，速度也很快。粉色特别好看！,2018-03-09 08:49:52,0,0,5
l***o,PLUS会员,电池续航能力很好，外观也合适,2018-03-08 21:59:00,0,1,5
A***P,钻石会员,没问题，高端大气上档次，屏幕大老爷子使用不费力！,2018-03-08 23:35:10,0,0,5
哈***哥,钻石会员,给媳妇买的，用着不错，替换苹果的认知不容易啊。。,2018-03-09 11:31:35,0,0,5
g***e,PLUS会员,东西很不错，很好快递很给力！,2018-03-08 15:19:10,0,0,5
城***寒,银牌会员,"电池续航时间不错,反应速度也非快.物流快,超赞.",2018-03-08 17:48:40,0,1,5
S***i,PLUS会员,已经在用了，华为手机不错?,2018-03-08 14:06:35,0,0,5
