名字,会员级别,评论内容,评论时间,点赞数,评论数,评价星级
fengshaobo,金牌会员,华为手机非常不错，上午下单下午就收到货，京东这服务好得出乎意料，以后买电器就想来京东。,2018-03-07 22:31:58,0,0,5
jd_159827aoa,银牌会员,好用，耐摔，拿到手几天摔了2次，无事，就是内存到手只有107g    内存消耗也特别快,2018-03-06 20:37:12,0,0,5
j***价,钻石会员,感谢京东?给我提供的优质的服务，发货速度很快，优质的仓储服务，小哥态度很好，感谢京东,2018-03-09 16:16:33,0,0,5
星爷世界波,PLUS会员,手机待机不长，机子很小巧，用惯了大屏的，觉得很小，用了几天了习惯了,2018-03-06 15:21:21,0,0,5
马***君,PLUS会员,非常喜欢?性价比超高，送给家人的礼物，以后会继续关注的，赞一个,2018-03-09 00:02:01,0,0,5
g***0,金牌会员,手机可以，拍照效果不错！用用看吧，上个手机用了不到半年就出问题了，京东不错，给退款了,2018-03-07 16:10:39,0,0,5
j***6,铜牌会员,手机收到了，比想象的要小一点，不过没关系，快递员态度很好，送货速度也快，给个好评！,2018-03-09 18:35:37,0,0,5
j***b,银牌会员,拍照很清晰，反应速度也好快，总的来说很满意，物流也超快，今天下单，第二天也就收到了,2018-03-09 12:25:07,0,0,5
j***0,PLUS会员,屏幕很好看，系统也很流畅，各方面都不错，支持华为，支持国产手机,2018-03-09 16:56:25,0,0,5
j***b,PLUS会员,东西很好，物流很快，完美的一次购物体验，以后买东西还是上京东。,2018-03-08 12:37:31,0,0,5
a***8,PLUS会员,漂亮！！！,2018-03-09 12:56:24,0,0,5
关***成,PLUS会员,拍片妥妥的,2018-03-07 16:23:58,0,0,5
e***h,PLUS会员,"很难得的正品，网购以来最满意的了,蛮好的，呵呵，以后继续光顾",2018-03-10 01:21:10,0,0,5
j***m,PLUS会员,送货速度快。有便宜。太实惠了。京东购物就显示项目很棒是好。,2018-03-09 01:49:04,0,0,5
j***o,钻石会员,发货很快，华为的手机品质一流，这是我买的第四台华为手机了，非常值得信赖与拥有！,2018-03-09 17:02:02,0,0,5
喜***T,PLUS会员,东西很好，一直买华为的手机，就是华为手机掉价太快了，不保值,2018-03-08 12:34:06,0,0,5
j***l,PLUS会员,公司采购  方便 快捷  物流满意  品质满意 总之都满意,2018-03-08 15:00:51,0,0,5
j***l,PLUS会员,公司采购  方便 快捷  物流满意  品质满意 总之都满意,2018-03-08 14:42:13,0,0,5
我***君,PLUS会员,好看好看好看  屏幕不错  颜值高  喜欢喜欢哈哈哈哈哈哈,2018-03-07 18:16:12,0,0,5
M***1,金牌会员,华为宝贝很好用，有点苹果7般样式，建议买大点的plus。那样电池更能用！！！,2018-03-09 23:51:46,0,0,5
秋***8,PLUS会员,"用着还可以吧，电池耐电。支持国货
信赖京东，赞赞赞赞赞！",2018-03-09 17:25:18,0,0,5
刀***叨,PLUS会员,系统很流畅，颜值也很高，尤其是拍照，非常不错的。。。。。,2018-03-08 09:06:11,0,0,5
j***v,PLUS会员,帮姑姑买的，两个一起买感觉挺划算的，华为毕竟也是大品牌嘛,2018-03-08 18:05:25,0,0,5
一***7,金牌会员,很不错 送爸爸的 爸爸很喜欢 颜色很漂亮 很亮 镜面效果很好 值得购买 推荐,2018-03-08 10:34:38,0,0,5
V***L,PLUS会员,买给老婆用的，她喜欢就好。日常使用挺流畅的，颜值也很高！,2018-03-07 09:48:21,0,0,5
x***0,金牌会员,手机很漂亮，真心喜欢，大小正适合我，运行速度快，手机配制已还不错，物美价廉！,2018-03-06 20:40:45,0,0,5
夜***狼,金牌会员,反正电器什么的，手机，电脑都在京东买，全家人的手机都是京东买的，挺相信京东的,2018-03-07 07:33:03,0,0,5
春***迹,银牌会员,屏幕很亮，很清晰，下次还会购买就是快递不行，把东西丢在别人那，就不就不问了,2018-03-09 13:18:06,0,0,5
梦***号,银牌会员,真的很不错哦，手机大小正合适，形状也是我喜欢的类型！用着也不错，使用流畅！,2018-03-09 22:41:53,0,0,5
S***9,PLUS会员,买给老妈的，跟小妹同款的，她觉得不错，那应该就不错吧！,2018-03-09 16:46:49,0,0,5
j***x,PLUS会员,是正品，运行速度快，内存大，手感好，价格合理，值得推荐,2018-03-08 07:59:04,0,0,5
饶***丶,PLUS会员,手机很好，等了很久才有草本绿，一直喜欢华为，支持国产。,2018-03-07 23:05:18,0,0,5
我***子,钻石会员,爸爸手机坏了，比较信任华为的品牌，而且京东的快递很快，用了很久没什么问题。,2018-03-07 21:41:18,0,0,5
j***b,银牌会员,喜欢，用了很顺手，款式也喜欢，有耳机和透明硬壳手机壳，不小心摔了一次也没坏,2018-03-07 14:09:26,0,0,5
z***8,PLUS会员,商家给力，比外边便宜，物流给力，送货杠杠的！愉快的购物,2018-03-06 21:51:03,0,0,5
j***h,PLUS会员,等了这么久，终于降价了，很喜欢，女朋友用了同款，很好用,2018-03-08 15:14:40,0,0,5
l***n,PLUS会员,商品送货速度快超级快，物美价廉，一直信赖京东，赞赞赞,2018-03-08 14:22:20,0,0,5
b***生,PLUS会员,续航能力还OK啦，不过有时不那么好吧，其他还是可以的,2018-03-08 16:27:27,0,0,5
d***8,金牌会员,货收到了，挺好的，外观好看，就是充电的时候，手机有点热，再试试再来评价。,2018-03-08 08:17:05,0,0,5
j***喏,金牌会员,给老公买的挺快的第二天就到了  用着还可以就是老公说电池没有旧的那只耐用,2018-03-07 08:08:32,0,0,5
j***胡,PLUS会员,拍照清晰，运行流畅。电子产品一直是京东自营，安心。,2018-03-09 21:53:05,0,0,5
j***s,PLUS会员,手机看了好久才下单，颜值爆表，很好用，华为值得信赖,2018-03-09 10:52:21,0,0,5
j***e,PLUS会员,很喜欢这款手机，待机时间长，运行速度也快，五星好评,2018-03-09 09:22:52,0,0,5
好***魚,PLUS会员,帮一个朋友买的，半卖半送，亏了?????,2018-03-08 01:54:07,0,0,5
j***i,PLUS会员,手机质量好，价格优惠，送货速度非常快，一直信赖京东,2018-03-07 21:23:24,0,0,5
爱***喵,PLUS会员,给弟弟弟买的，物流很快，然后弟弟说很喜欢很合适的。,2018-03-06 20:25:14,0,0,5
兽***张,银牌会员,质量满分，性能满分，外观满分，物流满分，总之好的没话说，国产最棒！！！,2018-03-10 00:34:56,0,0,5
j***w,PLUS会员,送货快，用着还行，就是有点小了，不过一直信赖华为,2018-03-09 14:54:18,0,0,5
紫***8,PLUS会员,手机收到了质量很好很漂亮包装好没有破损物流也很快,2018-03-09 13:28:44,0,0,5
j***y,PLUS会员,每天都要充电，有时候会卡，反应慢，怀疑是不是正品,2018-03-09 10:51:38,0,0,5
泷***琰,PLUS会员,帮朋友买的，一直支持华为，发货速度快，质量也好,2018-03-09 14:31:15,0,0,5
m***1,金牌会员,这款手机适合女神用?内存大，再也不用担心手机软件更新后内存不足了,2018-03-09 21:34:48,0,0,5
j***蓝,金牌会员,给老公买的新手机，他很喜欢，速度快，质量不错，外观漂亮，大小合适。,2018-03-07 23:17:14,0,0,5
j***8,PLUS会员,不错?不错，快递给力，手机也给力，京东更给力,2018-03-08 02:21:02,0,0,5
敷***切,金牌会员,发票上面一个字都没有打印（不知道是你们打印机的问题还是员工的问题）,2018-03-07 09:54:39,0,0,5
叮***哐,钻石会员,一直信赖华为，华为手机一直很流畅，拍照也很给力，下次还买华为！！！,2018-03-06 17:32:57,0,0,5
z***6,金牌会员,手机在用，拍照效果挺好，现在使用也没有出现什么问题，感觉还不错。,2018-03-09 20:37:54,0,0,5
j***岸,金牌会员,感觉很精致，操作很流畅，拍照特别清晰，第一次用华为，比预期的要好,2018-03-08 13:24:04,0,0,5
欣***脸,金牌会员,用起来不错，之前给孩子买了一台银色的，这回自己买了这款草木绿的！,2018-03-09 06:14:05,0,0,5
大***邪,PLUS会员,刚上手，运行速度还可以！支持国货！支持京东！,2018-03-07 14:27:18,0,0,5
j***b,PLUS会员,用了几天了，感觉还可以，手感也不错，物流也快,2018-03-06 17:18:34,0,0,5
j***u,PLUS会员,手机还不错，性价比挺高的，华为的质量也还可以,2018-03-06 14:15:02,0,0,5
e***1,金牌会员,买来作为备用机的，速度可以，外形大方没关，暂时无不适感，喜欢。,2018-03-09 22:24:18,0,0,5
j***c,PLUS会员,给弟弟买的 还不错吧 毕竟便宜  支持华为,2018-03-09 17:23:16,0,0,5
j***k,PLUS会员[试用],手机非常好用，而且好看，期待后面的使用情况,2018-03-09 11:38:20,0,0,5
路***_,PLUS会员,帮朋友买的 京东自营就是有速度 包装也完整,2018-03-08 15:06:38,0,0,5
散***b,PLUS会员[试用],手机很好，物流也很快，店家服务很到位，好评,2018-03-08 13:03:41,0,0,5
顽***宝,PLUS会员,帮人家买的，外形漂亮，最喜欢的是送货速度。,2018-03-08 10:14:24,0,0,5
可***奖,PLUS会员,挺喜欢的 值得拥有 服务很周到快递也很给力,2018-03-07 18:12:35,0,0,5
流***8,PLUS会员,没有小米好看，显得比较版的那种，适合商务的,2018-03-07 23:56:25,0,0,5
7***9,PLUS会员,帮妹妹入手的手机，4+128G，希望杠杠滴,2018-03-06 15:43:29,0,0,5
黑***哼,PLUS会员[试用],给老妈买的，感觉打开了新世界~玩儿的不亦乐乎~,2018-03-06 13:47:55,0,0,5
茶***5,金牌会员,京东商城物流快，昨天下午下单，第二天就到。很好看的手机，还没使用。,2018-02-01 06:42:30,0,0,5
j***4,PLUS会员[试用],此用户未及时评价，系统默认好评。,2018-02-25 18:32:23,1,1,5
Z***l,PLUS会员,手机想当不错了，给我爸买的！用着很流畅！,2018-03-09 20:09:16,0,0,5
别敷衍我513,PLUS会员,手机收到了质量好很漂亮，包装好物流也很快,2018-03-09 13:34:52,0,0,5
乐***果,金牌会员,非常满意！,2018-03-08 22:37:44,0,0,5
j***饼,钻石会员,物流很给力，华为手机买了第六个了，经常买来送人，质量非常过硬,2018-03-09 19:58:18,0,0,5
x***3,PLUS会员,拍照效果很好，就是有点小了！，其它还可以,2018-03-07 20:38:34,0,0,5
j***5,银牌会员,快递太给力啦！早上下单下午到！就是包装不太好，勉强过的去吧！,2018-03-07 19:24:08,0,0,5
摇***竹,PLUS会员,给妈妈买的手机 物流超级快 手机也很好用,2018-03-07 16:47:40,0,0,5
月***仙,PLUS会员,拍照是真清晰呀，美颜效果也好，反应也迅速,2018-03-07 02:36:21,0,0,5
j***j,PLUS会员,发货速度，很不错的产品哦京东值得信赖。,2018-03-09 11:59:26,0,0,5
d***i,PLUS会员,很好用，值得推荐希望再来，推荐爹妈使用,2018-03-09 12:05:45,0,0,5
j***q,金牌会员,不错，真的很好，物流也快。上午订的下午就到了。颜色很喜欢。,2018-03-08 21:34:18,0,0,5
j***d,PLUS会员,宝贝性价比超好，而且京东物流超给力哦。,2018-03-08 14:47:07,0,0,5
j***y,银牌会员,手机不错，值得购买，相信京东品质有保证，下次还会合作，谢谢,2018-03-08 22:48:50,0,0,5
j***2,PLUS会员,运行速度满意，照相也很好。样子也好看。,2018-03-07 13:43:40,0,0,5
j***2,银牌会员,国产手机还是华为好，款式新，价格实惠，等下次活动给朋友买个,2018-03-07 13:07:53,0,0,5
s***c,PLUS会员,手机，手感不错，有点像iPhone6.,2018-03-06 18:08:19,0,0,5
j***6,金牌会员,一直都很喜欢华为手机，家里人身边朋友都在用华为手机！！！！,2018-03-07 20:08:45,0,0,5
j***8,银牌会员,买了三天，从沙发上掉下来，屏幕就碎了，不到半米，质量太差了,2018-03-07 18:30:58,0,0,5
平***8,PLUS会员,货已收到，物流速度很快，使用后再评价,2018-03-09 23:02:48,0,0,5
墙***1,PLUS会员,很好，价格便宜，物流很快，送货上门。,2018-03-09 15:41:02,0,0,5
墙***1,PLUS会员,很好，价格便宜，物流很快，送货上门。,2018-03-09 15:40:18,0,0,5
淡***痕,PLUS会员,物流超快，给快递小哥10086*赞！,2018-03-08 19:09:35,0,0,5
Z***g,银牌会员,"东西拿到了，还没开始使用
不过快递速度很惊人，包装挺好的",2018-03-08 09:43:17,0,0,5
灯***灭,PLUS会员,真的不错，华为品控做得很出色，很流畅,2018-03-07 22:15:54,0,0,5
复***业,PLUS会员,京东自营的，送货快，手机有保障，放心,2018-03-07 19:08:53,0,0,5
x***2,PLUS会员,感觉还可以，拍照挺不错的，用着也流畅,2018-03-07 09:40:10,0,0,5
长***鸟,金牌会员,手机晚上下单 第二天中午就到了，打开包装，是正品，好评！,2018-03-07 08:53:44,0,0,5
L***8,PLUS会员,很好用  外观很好看   物流非常快,2018-03-06 23:14:52,0,0,5
P***D,PLUS会员,还不错，赶上好的价格，颜值很高的手机,2018-03-07 13:43:35,0,0,5
4***1,PLUS会员,质量很好，主要看上京东的速度，快！,2018-03-09 20:27:26,0,0,5
月***者,PLUS会员,外观漂亮，内存巨大，送给老妹很喜欢,2018-03-09 11:02:33,0,0,5
y***k,PLUS会员,己经是第三台了，华为的品质值得信任,2018-03-09 09:42:11,0,0,5
l***t,PLUS会员,买给女同学 收货了友谊 让我哭一会,2018-03-08 11:20:44,0,0,5
j***k,PLUS会员,看着还不错 还没正式启用 相信京东,2018-03-08 11:45:13,0,0,5
j***p,PLUS会员,手机收到了，刚用了一下，感觉还不错,2018-03-08 21:49:29,0,0,5
w***6,PLUS会员,发货快，配送快，快递哥送货更快！！,2018-03-07 19:44:05,0,0,5
英***5,PLUS会员,不错的一次购物。很不错。价格也美丽,2018-03-08 12:08:26,0,0,5
江***s,金牌会员,东西好好好，值得购买，第二次在京东上购买手机，值得信赖,2018-03-08 22:18:24,0,0,5
不***蚁,PLUS会员,给我妹买的，她看上的。待机挺可以的,2018-03-07 00:07:34,0,0,5
天***我,PLUS会员,外观不错。就是不是最流行的全面屏,2018-03-08 23:56:06,0,0,5
j***f,金牌会员,外观大气，使用速度快，华为手机就是好，一直在用华为！,2018-03-09 12:46:15,0,0,5
柠***6,PLUS会员,京东就是速度快，手机还不错，蛮好,2018-03-08 10:39:45,0,0,5
沒***我,PLUS会员,帮我姐姐买的 ，我姐说像素不太好,2018-03-07 21:04:47,0,0,5
泡***点,PLUS会员,手机非常不错，画面漂亮，操作流畅,2018-03-07 22:17:43,0,0,5
F***i,PLUS会员,手机还不错，性能够用，又便宜实在,2018-03-07 19:28:38,0,0,5
w***5,PLUS会员,可单手操作，大小适中，轻薄，好。,2018-03-07 09:12:40,0,0,5
j***2,银牌会员,外观很好看，用起来也挺顺手的，128G大内存很实用！,2018-03-07 10:30:36,0,0,5
j***°,银牌会员,买给爸爸用的  外观很漂亮 大小也合适 喜欢的不得了,2018-03-06 20:48:06,0,0,5
宝***1,银牌会员,领了券买了两个手机，一个自己用，一个老爸用，太合适了,2018-03-08 14:53:25,0,0,5
小***4,金牌会员,不错   对象很喜欢  用着很舒服  简直爱不释手,2018-03-10 01:06:00,0,0,5
j***b,PLUS会员,手机很漂亮小巧，运行速度挺快的,2018-03-09 14:00:11,0,0,5
王***x,PLUS会员,很喜欢这部手机下次继续支持华为,2018-03-09 12:46:37,0,0,5
z***1,PLUS会员[试用],帮亲戚买的。很喜欢，质量也很好,2018-03-09 09:42:17,0,0,5
e***c,PLUS会员,很实用，性价比高，物流超级给力,2018-03-08 23:21:08,0,0,5
雨***8,PLUS会员,速度一样的快。手机外观漂亮大气,2018-03-08 13:56:42,0,0,5
s***6,PLUS会员,发货挺快的，手机运行稳定，好评,2018-03-08 12:16:36,0,0,5
j***m,PLUS会员,给老妈买的，微信视频效果不错！,2018-03-08 10:02:41,0,0,5
j***2,PLUS会员,很好，颜色也漂亮，华为值得信赖,2018-03-07 23:26:49,0,0,5
小***物,PLUS会员,化为手机不错 苹果果断不会再用,2018-03-07 20:17:22,0,0,5
p***s,PLUS会员,东西很好，以后会再来买的！！！,2018-03-07 13:26:21,0,0,5
W***蓉,PLUS会员,送给妈妈的礼物，妈妈用的挺顺！,2018-03-07 19:33:11,0,0,5
亦***a,金牌会员,暂时还可以吧，就是没按键还有那么一坨空地，不太好看,2018-03-06 20:08:30,0,0,5
j***-,钻石会员,手机很不错，用起来感觉很好！！！喜欢！！！！！！！,2018-03-06 16:12:48,0,0,5
j***m,金牌会员,手机拍照功能强大，外观美观，相当适合女性朋友！！！,2018-03-06 19:26:08,0,0,5
宝***x,PLUS会员,很好很给力的，不错的，杠杠的。,2018-03-07 20:13:28,0,0,5
琳***仔,银牌会员,暂时来说还是不错的，很喜欢很喜欢很喜欢很喜欢很喜欢,2018-03-10 00:36:39,0,0,5
行***0,银牌会员,给老公买的，他不喜欢，给我自己用了，觉得还可以。,2018-03-09 23:27:51,0,0,5
杭***少,PLUS会员,一直京东购买，多快好省妥妥的,2018-03-09 12:12:52,0,0,5
j***f,PLUS会员,手机收到了，内存大运行快好用,2018-03-09 10:05:40,0,0,5
蚕***猫,PLUS会员,蛮漂亮 女生用的，有点像苹果,2018-03-08 16:22:24,0,0,5
j***5,PLUS会员,运行有点卡顿，总体来说还不错,2018-03-08 14:49:17,0,0,5
A***O,PLUS会员,这手机真好，这方面都好。加油,2018-03-08 11:13:44,0,0,5
超***晨,铜牌会员,昨天下单今天下午到，到手合适，给老婆买的她很喜欢,2018-03-08 16:30:39,0,0,5
j***a,注册会员,宝贝收到了超级喜欢，快递也很给力，各方面都很不错,2018-03-08 13:51:54,0,0,5
r***z,PLUS会员[试用],质量不错，物流给力，值得购买,2018-03-08 05:31:36,0,0,5
珊***4,PLUS会员,手机很好看，棒棒哒，支持支持,2018-03-08 10:37:28,0,0,5
洪***爺,PLUS会员,感觉质量很好，用段时间看看.,2018-03-07 19:37:37,0,0,5
C***0,PLUS会员,京东非常好，一如既往的好便宜,2018-03-07 20:10:02,0,0,5
x***j,钻石会员,正品，我儿子用，很不错，速度快，内存大，价格便宜,2018-03-06 21:53:28,0,0,5
a***g,金牌会员,给老爸买的，用的还可以，大小也合适物有所值吧，,2018-03-09 21:54:06,0,0,5
文***块,企业会员,外形使用很不错，价格在妖四七几的样子，还算划算,2018-03-08 20:17:01,0,0,5
小***子,PLUS会员,还不错，老妈喜欢，屏幕稍小,2018-03-08 12:31:54,0,0,5
童***4,银牌会员,还不错，用后追评，刚好抢了200的卷，就买多台,2018-03-08 13:25:18,0,0,5
b***b,PLUS会员,送货快，包装好，信赖京东！,2018-03-08 10:17:44,0,0,5
j***i,金牌会员,京东自营的，快递很快。网速有点卡，价钱还可以。,2018-03-08 12:06:52,0,0,5
j***f,PLUS会员[试用],不错，给男票买的，挺喜欢的,2018-03-08 14:21:44,0,0,5
j***v,银牌会员,帮老婆买的，挺不错的，手机特别好用，快递也很快,2018-03-08 17:59:38,0,0,5
j***v,钻石会员,电池比较耐用，外观大气，还不错，这款性价比也高,2018-03-07 23:51:26,0,0,5
j***7,银牌会员,自己用的nova2，给爸爸买的S，家人很喜欢。,2018-03-08 12:30:04,0,0,5
s***1,PLUS会员,手机收到了，还真的很不错哦,2018-03-07 19:37:37,0,0,5
j***9,金牌会员,给女儿买的，功能及各方面都很好，闺女也很喜欢！,2018-03-07 16:30:13,0,0,5
刘***1,银牌会员,物流好快一下就到了。很喜欢，手感很好，屏幕清晰,2018-03-07 16:41:21,0,0,5
刘***3,银牌会员,物流好快一下就到了。很喜欢，手感很好，屏幕清晰,2018-03-07 16:40:21,0,0,5
k***i,银牌会员,拍照效果可以，给妈妈用出去拍照回来说觉得特喜欢,2018-03-07 19:38:31,0,0,5
y***8,金牌会员,挺好?好用，好看?下次再来买，好评！！！！,2018-03-06 20:24:27,0,0,5
jd_132606ahl,银牌会员,好用，用啦好几个月啦，内存超级大，特别喜欢?,2018-03-06 22:44:26,0,0,5
s***n,PLUS会员,东西收到了很满意，支持京东,2018-03-06 21:32:49,0,0,5
l***t,银牌会员,手机挺好的 用了这么久才来评价 没出现任何情况,2018-03-06 20:49:54,0,0,5
付***j,银牌会员,手机不是我在用  用的人反映不错 相信华为品牌,2018-03-06 17:34:08,0,0,5
千色行,PLUS会员,不错，质量挺好，速度快。,2018-03-09 20:13:42,0,0,5
大***难,PLUS会员,很喜欢的一款 终于买到了,2018-03-09 12:51:29,0,0,5
z***J,铜牌会员,手机用了几天还可以，华为值得信赖，支持国货。,2018-03-09 15:02:28,0,0,5
东***8,钻石会员,小米摔坏了，换华为手机，运行快，充电也超快！,2018-03-09 10:51:00,0,0,5
四***W,钻石会员,终于到货了，朋友等到头都晕了，不过手机还可以,2018-03-09 16:35:02,0,0,5
小***7,PLUS会员,还可以吧，比较划算，好评,2018-03-08 17:30:34,0,0,5
s***g,PLUS会员,东西不错，京东物流也很快,2018-03-08 11:02:28,0,0,5
j***z,银牌会员,上午拍的，今天下午就到手，京东快递员很热情！,2018-03-08 09:36:00,0,0,5
夜***人,钻石会员,支持国货！不错！手感，手机的反馈速度也不错！,2018-03-08 18:25:36,0,0,5
s***s,钻石会员,搞活动买的，越来越便宜，已经买了三个了～～～,2018-03-08 07:40:53,0,0,5
T***G,金牌会员,配送速度快，东西不错，买来给长辈用，绝对合适,2018-03-07 17:36:44,0,0,5
天***3,PLUS会员,华为手机真不错，好用实惠,2018-03-07 11:38:20,0,0,5
j***2,金牌会员,手机都是从京东买的，发货快，不错！质量也好！,2018-03-07 14:00:05,0,0,5
吟***对,银牌会员,手机相当不错，京东自营店出品的，绝对正品保障,2018-03-07 09:37:40,0,0,5
伊***8,金牌会员,帮表妹买的，她觉得还可以吧，我家人都用的华为,2018-03-07 11:14:37,0,0,5
j***d,金牌会员,手机外观漂亮，但是有时候会卡顿有反应也会迟钝,2018-03-06 21:31:54,0,0,5
是***桥,银牌会员,哈哈哈，懒得拍照片用这个代替吧???,2018-03-10 00:01:10,0,0,5
一***8,金牌会员,不好意思评价晚了，手机特别好用！没有瑕疵！,2018-03-09 20:57:02,0,0,5
s***h,PLUS会员,很好很实惠，支持老刘！,2018-03-09 10:00:40,0,0,5
jd_139981jki,铜牌会员,拍照效果很好，屏幕也很好，特别喜欢超级好评,2018-03-09 13:18:39,0,0,5
雨***e,银牌会员,很好看的颜色，连着三个华为都是在京东买的～,2018-03-09 16:26:39,0,0,5
c***1,PLUS会员,物流快，包装好，质量好,2018-03-08 16:12:43,0,0,5
爱***犬,PLUS会员,好用真的好用而且还实惠,2018-03-08 14:21:42,0,0,5
t***h,PLUS会员,手机没电了我现在在外面,2018-03-08 12:26:58,0,0,5
请***爷,PLUS会员,信号一般般，其他还行。,2018-03-08 11:11:00,0,0,5
j***e,铜牌会员,外观漂亮，拍照功能强大，没有卡顿，非常好！,2018-03-08 13:12:16,0,0,5
j***4,金牌会员,手机大小合适，合适单手。很漂亮，值得购买。,2018-03-08 10:56:45,0,0,5
s***3,PLUS会员,手机挺好的，手机挺好的,2018-03-08 13:02:43,0,0,5
l***0,银牌会员,给妈妈买的，很不错的手机，希望国产做大做强,2018-03-07 16:38:03,0,0,5
睿***球,PLUS会员,很好。正品。支持国货。,2018-03-06 19:56:00,0,0,5
帅***1,PLUS会员,不错的选择，比较好用！,2018-03-06 21:59:21,0,0,5
B***3,PLUS会员,给小孩儿的，应该不错。,2018-03-06 18:18:42,0,0,5
壞***乖,银牌会员,用着还可以，就是卖家太小气了什么礼物都没有,2018-03-06 22:18:03,0,0,5
j***v,银牌会员,买了，在打折的时候买的，还没用，给父母的。,2018-03-08 17:08:11,0,0,5
z***o,金牌会员,送人的，评价还可以，华为还是有那么点保障的,2018-03-06 16:46:46,0,0,5
柠***p,PLUS会员,手机性价比高，棒棒哒,2018-03-09 20:11:49,0,0,5
j***z,金牌会员,手感非常好，金属机身，屏幕不错，就是费电,2018-03-09 09:06:37,0,0,5
n***7,银牌会员,用的不错，就是购买后迅速降价，让人很困扰,2018-03-09 08:54:55,0,0,5
1***3,金牌会员,手机运行速度快，整体感觉很爽，值得购买。,2018-03-09 11:08:03,0,0,5
N***u,银牌会员,外观很漂亮，用起来也很不错，老妈很满意。,2018-03-08 20:06:55,0,0,5
巫***0,PLUS会员,赶上活动价格，还不错,2018-03-08 14:25:00,0,0,5
l***i,PLUS会员,物美价廉不错好评好评,2018-03-08 15:27:00,0,0,5
勤***喵,PLUS会员,很好看，女朋友喜欢！,2018-03-07 22:28:21,0,0,5
明***芊,金牌会员,给力的手机，刚买完搞活动价格继续低，疯了,2018-03-07 13:34:29,0,0,5
愉***_,金牌会员,手机蛮好看的，也很薄，就是用起来有点卡机,2018-03-07 12:03:17,0,0,5
a***p,金牌会员,用了半个月才来评价，手机很好，老婆喜欢。,2018-03-06 15:54:24,0,0,5
j***s,银牌会员,手机目前挺好用，我还是比较相信华为的。,2018-03-09 09:08:29,0,0,5
j***k,铜牌会员,第一衣用华为手机，系统挺流畅，值得入手,2018-03-09 09:03:57,0,0,5
j***6,银牌会员,good，京东还是非常不错的，，，，，,2018-03-08 23:48:29,0,0,5
且***6,钻石会员,像素很好，手机屏幕也合适，手感比较好。,2018-03-08 20:14:01,0,0,5
j***智,钻石会员,给儿子买的  很好用  他喜欢的不得了,2018-03-08 10:02:58,0,0,5
清***0,银牌会员,拿着很轻盈，很适合女孩子用，喜欢?,2018-03-09 11:19:49,0,0,5
s***6,PLUS会员,用两天了，确实可以,2018-03-09 00:00:52,0,0,5
j***t,钻石会员,正品，速度快，外观也漂亮，买给妈妈的,2018-03-08 20:06:54,0,0,5
1***p,银牌会员,手机很大气，华为国产大品牌，支持国货,2018-03-08 16:30:50,0,0,5
j***h,PLUS会员,东西不错物流也给力,2018-03-08 10:39:22,0,0,5
龙***y,PLUS会员,非常好用，而且便宜,2018-03-08 09:21:13,0,0,5
1***p,钻石会员,手机很漂亮，很薄，买给老人用的，不错,2018-03-07 18:10:47,0,0,5
