名字,会员级别,评论内容,评论时间,点赞数,评论数,评价星级
微***迹,金牌会员,给女朋友买的，打开之后拿着手机，这个手感真的还不错，非常舒服，后盖拿在手上不糙，比较光滑，还有自带的钢化膜，不过比手机屏幕小了些，如果合适的话就是最好的了，华为的系统还是挺好的，用荣耀8习惯了，剩下的就等使用一段时间再来看看,2017-11-15 19:59:00,15,8,5
潜***杰,PLUS会员,一直都是用华为的手机，华为的手环，华为的家电，什么都是用华为的，华为，真的很好，华为不仅仅是世界500强，更是对客户的用心，华为这方面做得不错，其实我会，我是华为的副总裁,2017-09-28 21:39:47,28,5,5
芝***0,银牌会员,怎么说呢？很满意，第一次用华为手机大一的时候在实体店买的荣耀3C，当时感觉用着很好。大二时双11在网上看到了冰川白的荣耀7i，不知道出于什么心态，觉得很适合自己，就买了下来，当时1300万的像素真的超棒，用华为时间长了也就习惯了。现在我家四口都用的华为，华为的几个系列几乎都用过，有种特别的情怀在里面。一开始初次接触模拟键觉得不好用，现在几年下来，觉得可隐身的虚拟键很好。大学三年下来，身边的同学都在用ov手机，尝试了各种手机，我觉得还是我大华为最好。像素不是最高的，但是是最清晰的；屏幕不是最大的，却是最舒服；功能或许不是最多的，但有的功能却很实在。华为手机记录了我大学三年的点滴。其实今天买的华为Nova2的玫瑰金在没收货之前我是不满意的，因为我最最喜欢的草木绿从初售到现在河南地区一直没货。有一点失望，但收到玫瑰金手机后，觉得也很棒。虽然依旧有不足，但依旧喜欢。华为加油。希望河南地区能快点有草木绿。华为Nova2是华为的新机型，初次体验觉得很棒，不足还没发现，用用在评价。希望官方快有草木绿。不要让我这个花粉失望，继续加油做手机。虽然包装简陋，但依旧感谢京东的快递小哥真诚的服务态度。,2017-06-22 22:06:30,279,84,5
霸***爷,银牌会员,快递很给力！上午下单！下午就到了！做工很给力精巧，用了几天出现了一次卡顿！其余都中规中矩！充电速度很快！不看视频不玩游戏电池还是很给力！买手机时给客服发了几个问题都没有回！这个很差！所以下单时要看清楚是不是自己要买的配置！有问题再追加！,2018-03-09 09:06:21,0,0,5
z***1,PLUS会员,"手感颜值俱佳！
前几天一直在纠结挑选手机！因为我不喜欢大屏的，去年到现在一直在用小米5s顶配板，但是用了几个月就越来越卡了。所以我才想到更换，看了华为的几款5.2寸的机型，觉得还是偏大，又考虑了Nova第一代，发现处理器骄龙625比较低端，接着又犹豫，直到16号发货Nova2，看了好些朋友的评价后，17号今天我才入手。收到后进行了试用，觉得很不错，外观手感也和苹果67比较接近。这是我买的最贵的一台国产手机，以前的小米5s才2299。
其他的以后再来追评吧！",2018-01-03 15:14:44,1,2,5
M***晨,银牌会员,草木绿的颜色可以说是没有什么色差的，拿到手后觉得非常满意，手机薄薄的，拿起来手感不错，屏幕大小刚刚好，值得一提的是，京东发货非常的快，晚上下单，第二天上午就到了，效率非常高，华为的手机一直在用，也是老牌子了，值得信赖，在国产手机里属于佼佼者，会一直支持的，另外觉得草木绿这个颜色真的很特别，喜欢的亲可以放心下单，我觉得不会失望，以前买的华为手机摔几次仍然用的很好，可见华为的品质确实值得信赖，又是京东自营的，有保障。,2017-06-28 11:57:12,36,4,5
西***柜,钻石会员,很好很好，给爸爸买的。希望喜欢。,2018-02-10 14:39:32,1,1,5
r***2,金牌会员,优惠很划算.减了200多.感觉真机颜色要比图片好.大小正好.物有所值.比苹果6稍大一点点.手感很好,2018-03-08 19:59:37,0,0,5
陪君舞,金牌会员,11.30华为品牌日给媳妇买的，作为生日礼物，比平时便宜400，非常实惠，收到时候，打开被经验到了，还送了手机壳，贴了钢化膜，必须赞一个，支持国产！,2017-12-03 20:26:19,15,2,5
M***想,金牌会员,刚上手感觉挺好用的！快递小哥老给力了 那么大的雨给我送过来了！,2017-06-18 08:07:46,12,0,5
M***M,PLUS会员[试用],颜值十分之高啊！新机子流畅度十分好，电池续航也是十分好。基本上没有什么毛病，不过是买来给妈妈用的，所以对性能没多大要求，但总体来说性能不错，年轻人的需求也是可以满足的吧。拍照的效果也是跟官方宣传的无异，拍人拍物画质效果都让人满意。华为品牌真的好体贴，做出性价比如此高的产品，希望品牌发展越来越好！！,2017-10-28 12:33:47,8,3,5
j***l,PLUS会员,上午定的下午就到了，照相特别的清晰，速度很快的，不错哦,2018-03-07 17:46:28,0,0,5
n***多,PLUS会员[试用],挺好的 挺轻的 比较适合爸妈用,2018-03-01 11:46:45,1,0,5
j***d,银牌会员,买来送给妈妈的。外观好看且流畅。妈妈很喜欢,2018-03-06 17:00:36,0,0,5
q***9,金牌会员,心水了好久，终于到手了，不发热，充电快,2018-03-09 21:41:47,0,0,5
l***o,金牌会员,手机非常漂亮，比照片还好。四周一圈圆润光滑，手感非常好。送的手机壳属于硬壳，喜欢软壳的朋友所以有必要再买一个。音乐功放效果很不错！相机还没怎么玩，之后再评价。界面，配套软件，等等，比前几年进步许多。华为的体验就是好。,2018-03-08 23:22:46,0,0,5
蓝***丽,钻石会员,"刚收到，看起来还不错呢，想着黑色经典不易过时，但是有点后悔买黑色呢，因为很容易有指纹呢！好在收到时已经贴了前膜，送了透明壳，但是这样一来，原本有点分量的手机就更有分量了，还是要自己买薄壳。
说明书过于简单，自行百度了这款手机的一些运用方法，发现有的确实霸气，挥手拍照，截屏，录屏这些都很棒，当然，还需要继续研究！系统一来就让我更新，这是什么意思呢？打算今天完到没电，试试充电如何。",2017-06-27 19:29:38,4,0,5
j***j,PLUS会员,非常感谢京东商城给予的优质的服务，从仓储管理、物流配送等各方面都是做的非常好的。送货及时，配送员也非常的热情，有时候不方便收件的时候，也安排时间另行配送。同时京东商城在售后管理上也非常好的，以解客户忧患，排除万难。给予我们非常好的购物体验。,2018-03-09 11:37:34,0,0,5
S***6,钻石会员,老婆喜欢，颜色厚薄都比较满意。拍照比较好。,2017-07-21 19:26:25,5,0,5
熊***2,银牌会员,第一次购买华为手机，手机一送到手感觉挺有分量的，很结实，开机对各方面进行检查，是正品，手机反应速度特别快，尤其欣赏指纹功能，反应真的是太快了，前后拍照特别清晰，快充功能一般般，跟我以前oppo n3充电速度慢很多，物流速度超赞，上午买的，下午就到了，不愧为京东！在使用一段时间，试试效果，后期再追评！,2017-08-03 02:05:50,1,0,5
于***5,金牌会员,送货快，手机很好，手感不错，精美绝伦。超级棒，喜欢支持国产。,2017-06-25 13:59:51,1,1,5
1***p,金牌会员,想问一下为什么系统总内存是3.64GB，不是4GB呢,2017-12-17 22:04:51,2,0,5
地***灵,钻石会员,手机小巧玲珑，外观漂亮，机身手感不错，有种拿着苹果7的感觉，手机用起来很流畅，拍照清晰，音质很好无杂音，为华为点个赞，赠送的拍照神器，看起来也很高大上，暂时未发现问题，用一段时间再来追加评论！,2017-06-29 23:35:45,4,0,5
j***2,PLUS会员,用不到一个月坏了两次，第一次后摄像头不对焦(买到手第16天的时候)返回维修，第二次是手机屏幕(买到手第23天即返回维修后3天),2017-09-24 14:37:50,69,18,1
C***i,PLUS会员,"之前考虑荣耀八的，后来看到有这个颜色的
Nova2，果断下单。机身跟五点二寸荣耀一样长，五寸，小巧。输入法用的很不习惯，语音输入不比之前荣耀的，，，不知道是不是因为它还不熟悉我的声音。前置两千万挺好的，适合女生，后置一般吧。第一次充电快三个小时才充满，不知道是什么原因。之后每次充电大概两小时。每天充一次电。",2018-03-08 11:46:11,0,0,5
j***h,PLUS会员,手机很好，屏幕分辨率高，像素高，拍照清晰，外观颜值高，个人很满意的一次购物。电池也很耐用，系统流畅，使用体验感很好。物流速度快。,2018-03-09 00:26:56,0,0,5
j***q,银牌会员,拿到手机应该是4天左右了，去外面贴了个膜，就怕手机碎屏，晚上贴的膜，不过没找到特别适合的，所以手机屏幕两边没有完全贴住，第二天中午低着头玩手机，要拿水杯，手机就放膝盖上了，然后水杯拿到了，手机从膝盖上滑下去了，滑到地面了，木板，赶紧捡起来，晚了，已经碎了，跟大树一样，四分五裂了，贴的钢化膜还完好无损，把膜撕掉，确认一遍，还是屏碎了，然后在京东上点个维修，就显示提交成功，可我不知道是免费修还是自费修，自费多少钱也不知道，然后点击个取消，准备找客服咨询的，京东电话就来了，自费，不管7天与否，拿到手碎屏就是自个的事，价格380的换屏费80块的人工费……,2018-03-08 13:04:33,0,0,5
红***一,钻石会员,之前在手机店想买华为P9，没注意被店家拿P9青春版来骗我，发现后马上退货，然后果断上京东买，最后选了这款手机，先不说手机好不好，最起码在京东能买到原装未拆封的机子，实体店就不能……以后买手机只认京东了,2018-02-24 20:03:51,0,0,5
j***1,钻石会员,京东的速度就是快，昨天晚上十点前下单，今天上午十点送到！原来一直在犹豫，不喜欢太大的手机，但又担心屏幕小了整体质量会下降，但手机到手后，让我非常满意，工艺质量非常精致，单手简单操作不再那么局促，并且手感非常好，自己需要的功能基本都有了！另外试了一下音乐播放效果，非常棒！拍照的效果挺棒，可选择的功能很多。至于速度不是我最关心的，因为不玩游戏，很少看视频，所以没有感觉到速度的高低，当然是比我从前的4C强太多啦，总之非常满意，这价位，值啦！,2018-03-06 22:17:18,2,0,5
h***6,银牌会员,拍照效果还不错，手机运行的也很流畅，反应速度也不错，性价比不错，比个?吧,2018-03-08 16:01:03,0,0,5
j***x,PLUS会员,看着不错，好品牌，可以的，实惠，实惠实惠实惠实惠,2018-03-08 08:21:37,0,0,5
j***k,银牌会员,很不错的手机，外形很漂亮，很喜欢。支持国产手机！！！,2018-03-09 09:06:43,0,0,5
j***b,银牌会员,手机还是去实体店买好些   这手机微信和QQ发定位都不行啊      同样的地方其他品牌的手机都可以使用,2018-03-04 15:27:00,0,1,2
1***p,钻石会员,东西收到了，期待中的好，很喜欢，样子大气，是我想要的，颜色也比想象中好看，期待使用高性能！！,2018-03-09 10:51:19,0,0,5
j***0,金牌会员,年前买的，年货节确实优惠一些，现在活动都不如那时候便宜了,2018-03-07 10:13:43,0,0,5
桂***零,PLUS会员,现在的国产手机真的是很不错了，运行速度很快，各种软件也装上了，没有问题。,2018-03-07 18:58:08,0,0,5
超***0,钻石会员,手感还行，不错,2018-03-08 00:35:17,1,0,5
j***d,银牌会员,很不错，手感超级好，而且比实体店还便宜，一样真品，真心喜欢，特满意,2018-03-08 18:41:55,0,0,5
j***浪,PLUS会员,不错，下午到的，物流很快，很给力，物超所值,2018-03-07 19:41:49,0,0,5
A***9,金牌会员,京东就是快。手感不错，在京东买的第二个手机了,2018-03-02 19:14:02,1,0,5
j***6,PLUS会员,感觉还可以吧，希望能用时间长点,2018-03-08 21:08:39,0,0,5
o***o,金牌会员,颜值高 颜值高 颜值高！ 而且非常好用 打游戏特别流畅 打王者一点都不卡 延迟超低 屏幕也很大 用着很舒服 拿在手里也很轻薄 蓝色超好看啊 而且功能很多 特意用了几天来评价 内存也够大 快充充电超快 太喜欢了 性价比超高啊！,2018-03-07 19:10:27,0,0,5
Y***w,PLUS会员,买给母亲的，除了系统暂时还不太习惯，其它都挺喜欢的。店家很细心，给贴了膜。,2018-03-07 14:21:06,0,0,5
B***鱼,金牌会员,nova2外观贼漂亮 希望能耐用,2018-03-08 19:28:28,0,0,5
j***鹤,银牌会员,昨天收到的，今天换的nano小卡。外观漂亮拿着舒适。桌面上的图标刚看时不适应，像不清楚似的可能就这样的吧。其它的没啥感觉，我想杂也比我畅享5s强，我不玩王者荣耀啥的没试咋样。包装外面是图中的塑料袋，里面是手机盒,2018-01-27 15:31:09,1,0,5
a***o,银牌会员,续航能力还没体验，因为给老婆买的，拍照确实很好，手感也很好，信得过的华为，牛,2018-03-07 17:40:35,0,0,5
j***0,金牌会员,用了几天才来评价的，应该，是正品，以后还会光顾的，,2018-03-06 18:30:06,0,0,5
萌***_,PLUS会员,不得不说，手机颜值很高，金属的边框摸起来很有质感，系统的话，优化的也还不错，挺好，满意,2018-03-08 18:53:16,0,0,5
胡***8,PLUS会员,价格低，尺寸合适。一直用7换华为的。不太喜欢这个操作系统。电池带电不错，不用的话估计待电1周。正常用一天有剩余，不需要中间充电。相机不行，不好用。如果是商务打电话的话大力推荐。玩的话还是推荐买更贵的机型！,2018-03-06 15:41:03,0,0,5
御***g,PLUS会员,东西很好，京东值得信赖，物流非常快，隔天收到货，搞活动买的，很划算，还会再买的,2018-03-09 10:05:05,0,0,5
y***6,PLUS会员,在京东商城购买的手机收到了，物流配送中心的服务态度和质量都非常好，手机非常满意,2018-03-08 14:47:45,0,0,5
a***3,PLUS会员[试用],这款手机是给叔叔买的，生日给他的礼物，不错哦，很喜欢呢，成功的一次购物。,2018-03-08 19:13:04,0,0,5
j***b,银牌会员,京东上买了三次手机，前两次男票下单买的还可以，这次自己下单买的超差，买得最差的字一次超级失望,2018-02-28 15:59:55,2,1,1
j***0,银牌会员,草绿色，颜值满分。手机尺寸也刚好满足，主要性价比高，能以这个价位买到真是十分满意了，目前手机反应速度还可以啊，拍照也是十分给力的，期待后续体验。,2018-03-07 08:30:23,0,0,5
j***9,PLUS会员,感觉现在入手挺合适的，当一个备用机，个人感觉绿色的更好看一点,2018-03-07 18:23:19,0,0,5
j***p,PLUS会员,华为的手机越来越好了！性能强大～父母辈都用的这个～很棒.,2018-03-08 12:05:18,0,0,5
j***w,PLUS会员,送货速度快！价格便宜！质量超级好！下次再来买！,2018-03-06 14:22:39,0,0,5
8***凉,PLUS会员[试用],手机很好，很不错，没下错单，下次继续支持,2018-03-08 21:29:28,0,0,5
g***q,PLUS会员,手机活动买的，用着还不错，价格合适。,2018-03-09 09:49:46,0,0,5
3***1,PLUS会员,这手机很好用，我在坐车追这个手机。,2018-03-08 13:19:46,0,0,5
冰***舰,金牌会员,十分的不错，效果非常好，屏幕清晰，续航持久，棒棒哒！,2018-03-09 16:13:52,0,0,5
猪***翻,铜牌会员,用了快10天了，总体来说还将就，毕竟就这个价位，但不过最让人烦的就是屏幕的灵敏度问题，打字的时候经常点了屏幕没反应，特别是两边边缘，基本上点了没用，是真的难受，用的很是窝火,2018-03-09 02:29:45,0,0,5
j***眼,PLUS会员,京东快递真的很快，东西也不错,2018-03-09 01:12:16,0,0,5
j***j,PLUS会员,这个手机挺好用，配置高运行快,2018-03-07 21:23:18,0,0,5
符***总,PLUS会员,买给家里父母，大气上档次。他们挺开心。买给家里父母，大气上档次。他们挺开心。买给家里父母，大气上档次。他们挺开心。买给家里父母，大气上档次。他们挺开心。,2018-03-07 20:04:56,0,0,5
折***5,PLUS会员[试用],用了一段时间再来评价的，早就看了这款机子了，终于决定在京东上买，外观很漂亮，反应灵敏，非常喜欢,2018-01-05 21:08:41,0,0,5
小***蝈,PLUS会员,为所欲为为所欲为为所欲为,2018-03-07 18:24:58,0,0,5
j***f,银牌会员,黑色的手机，你应该值得拥有很很漂亮哦。,2018-03-08 15:02:53,0,0,5
j***人,银牌会员,手机收到了，速度很流畅，老婆喜欢，好评,2018-03-08 10:08:17,0,0,5
d***2,PLUS会员,买给老妈用，还行，不卡机，后置拍照一般，前置像数好一点，微信拍照电话短信够用了,2018-03-07 21:08:08,0,0,5
j***c,铜牌会员,手机已收到 非常漂亮 发货速度 好评,2018-03-08 14:19:03,0,0,5
西***君,PLUS会员,还挺满意的，目前为止，用着还行！就是发现买完之后降价了，不开心?,2018-03-07 20:11:56,0,0,5
j***i,钻石会员,一直信赖国产华为，好用。,2018-03-06 14:38:53,0,0,5
f***1,PLUS会员,手机很不错，外观高大上，用起来很流畅，推荐大家购买。,2018-03-08 15:13:22,0,0,5
j***g,PLUS会员,相比较了下还是京东服务好，之前觉得**不错，一比较京东服务还是更好，处理任何问题速度蛮快，真的很放心在这买东西,2018-03-09 14:10:21,0,0,5
j***2,金牌会员,送货速度快，快递小哥服务很好，手机质量确实好，京东质量值得信赖！,2018-03-07 21:56:22,0,0,5
灵***8,PLUS会员,好便宜，京东商城就是快，值得够买,2018-03-09 11:23:21,1,0,5
l***2,钻石会员,华为的忠实粉丝，第三款产品了，希望国货越来越好。支持国货，使用起来很流畅，价格也好，出新品了还可以继续更换，不会舍不得银子,2018-03-09 09:11:25,0,0,5
郭***0,银牌会员,昨天晚上下的单，今天上午就收到了宝贝，这物流也太给力了！！手机颜色太棒了，哥哥非常喜欢，手感也特别舒服，用着也应该不错。,2018-03-09 14:27:24,0,0,5
j***长,钻石会员,想买一个小的，这款还不错，单手可操控，用一段时间才能知道怎样，快递小哥不错，经常买，他都认识我了，非常敬业的小哥，赞一个,2018-03-07 21:30:27,0,0,5
Z***e,钻石会员,外观很漂亮，大小刚好，女孩子很合适！系统流畅拍照清晰！,2018-03-08 18:48:51,0,0,5
芦***笛,PLUS会员,手机我正在用，所以没办法用自己的手机给自己的手机拍照片。评价一下就是颜色好看，机身设计合理。总体感觉不错，但是有安卓机的通病，就是用久了会卡顿。,2018-03-06 15:10:18,1,0,5
至***哥,PLUS会员,很不错，系统很流畅，值得购买,2018-03-07 22:13:42,0,0,5
蚊***r,金牌会员,东西拿到手机感觉很惊艳，手感好，颜值高，反应灵敏，很赞，这是我在京东买的第好几个手机了，这个是我送人的，哈哈,2018-03-08 15:44:51,0,0,5
小***程,PLUS会员,帮朋友买的手机。他试用了几天。很满意。一直在京东上买手机一类的产品，都没有失望过。赞?,2018-03-08 00:10:54,0,0,5
j***q,PLUS会员,罢了路路通快递公司上班的时候给我打电话让我看看能不能帮你问问别人有没有名额限制时间,2018-03-09 11:00:16,0,0,5
R***b,金牌会员,手机外形适合年轻人，反应快，拍照像数略低些,2018-03-07 13:22:52,0,0,5
独***渠,PLUS会员,给父母买的，很不错哦,2018-03-08 15:40:26,0,0,5
j***e,PLUS会员,非常好，很赞，京东商城值得信赖！！！！一如既往地支持，希望越做越大！！！！！,2018-03-07 20:46:36,0,0,5
j***ギ,PLUS会员,非常给力的网上购买过程 非常感谢京东带来购物的感觉 价格非常给力 产品非常好,2018-03-08 20:34:23,0,0,5
j***2,金牌会员,电池能用一天半玩游戏有点热    信号好刚收到手机摔地上了，但是一点不影响通话，一次完美的网购,2018-03-09 14:24:18,0,0,5
h***t,PLUS会员,收到了，质量不错，灵敏度高。发货速度很快。非常感谢京东商城给予的优质服务,2018-03-08 19:42:38,0,0,5
c***兴,铜牌会员,我们家艺兴代言的，同学也有是花粉，所以换手机就选择了这一款，用了一天，真的超棒，黑色款最爱,2018-03-09 13:34:05,0,0,5
j***8,金牌会员,外观确实是我想要的。手感很好。但是用惯了苹果，安卓机子用的第一天就会觉得运行速度慢，有点卡,2018-03-06 22:14:48,0,0,5
j***c,铜牌会员,和商品描述一致,2018-02-26 20:24:43,1,0,5
R***B,PLUS会员,手机很好，买来送给远方亲人的，他说很好用，没传照片，所以没办法晒图了,2018-03-08 08:41:52,0,0,5
旺***仔,钻石会员,还不错，远看就是一个小苹果,2018-03-06 13:20:05,0,0,5
j***o,PLUS会员,刚拿回来就打开了这个，运行速度挺好的，而且外观也挺好看的，值得买,2018-03-07 23:10:06,0,0,5
好***呗,PLUS会员,手机不错，值得购买，相信京东，品质有保证，下次还会合作，谢谢,2018-03-08 04:45:23,0,0,5
2***m,钻石会员,华为手机还不错，我们全家都用它，货到后我女儿很一喜欢，快递小哥态度好给五颗星。,2018-03-08 08:15:53,0,0,5
赵***s,PLUS会员,电池续航能力强，华为牌子值得信赖，京东服务也是杠杠的。,2018-03-08 22:54:07,0,0,5
j***m,银牌会员,手机好漂亮，就是第一次用华为，操作系统不太习惯。物流很快，早上下单下午到。,2018-03-08 19:36:54,0,0,5
小***l,PLUS会员,就要黑色 黑色  帮朋友买的 很满意 我还顺便溜达一圈,2018-03-08 22:15:47,0,0,5
三***帝,金牌会员,挺好的吧，用用再说，不知道质量怎么样！发现装sim卡的竟然是塑料的，伤感！,2018-03-06 19:26:43,0,0,5
j***l,PLUS会员,真的很不错的手机，服务也好，下次还会到这家店里来的,2018-03-08 08:09:14,0,0,5
R***u,银牌会员,自己用，以前也是用华为，感觉挺好，反应速度快，希望能经久耐用(^_^),2018-03-06 17:21:57,0,0,5
j***z,PLUS会员,手机真心不错，性价比高，买手机上京东，正品送到家,2018-03-09 07:59:37,0,0,5
璨***9,PLUS会员,京东值得信赖，发货快，送货上门，服务态度好。满意,2018-03-08 01:13:17,0,0,5
j***v,PLUS会员,手机到手，感觉不错，期待许久，活动时购买优惠。,2018-03-08 22:34:18,0,0,5
j***8,PLUS会员,信赖京东，京东快递非常给力，手机质量也不错哇！,2018-03-08 14:41:52,0,0,5
录少,PLUS会员,拍照效果很好，支持国产华为，良心商品，快递给力,2018-03-07 15:28:08,0,0,5
倾***者,钻石会员,帮领导买的，一到货就迫不及待的用了，他说还是国货好啊！???,2018-03-07 15:41:47,0,0,5
飘***至,PLUS会员,电池续航好，拍照效果好，电池续航好，拍照效果好,2018-03-07 18:05:28,0,0,5
j***e,银牌会员,快递没得说啊 就是快 手机也很好 很满意 发货嗖嗖的快 下次还买,2018-03-07 20:55:50,0,0,5
j***f,铜牌会员,特别好  给爸爸买的  手感也不错   喜欢小手机的可以考虑入手,2018-03-07 19:59:17,0,0,5
冬***弟,PLUS会员,运行速度很快，拍照功能强大，手感好，性价比高,2018-03-06 22:45:32,0,0,5
k***7,PLUS会员,不错，满意的产品，送货快速，信赖京东！！！,2018-03-09 03:40:14,0,0,5
J***r,PLUS会员,真心不错，华为这个还是可以的吧，先用用看看,2018-03-07 22:53:06,0,0,5
故***式,银牌会员,除了外观别的一无是处，屏幕垃圾死，滑动变色有虚影看着容易晕，,2018-03-06 20:22:35,0,0,5
j***h,金牌会员,对手机没有过多的高要求，因为不玩手机游戏感觉还好因为平时要带孩子，没时间，一直玩手机，所以电量还可以，屏幕辨析度也挺好的,2018-03-09 16:29:43,0,0,5
E***e,PLUS会员,我家全是用的华为了，国家品牌值得信赖。,2018-03-08 15:36:06,0,0,5
w***8,PLUS会员[试用],网速快，手机手感很好，发货速度非常快。,2018-03-07 10:29:08,0,0,5
j***u,PLUS会员,喜欢用华为，支持国产，旧手机也是华为。,2018-03-07 20:45:17,0,0,5
Y***2,PLUS会员,屏幕有点小！其他还可以！。。。。。。。,2018-03-06 14:34:26,0,0,5
j***c,铜牌会员,大小正合适，一个手拿着玩儿也刚刚好，特意用了一段时间才评价的，没有卡的现象，就是送的透明壳是硬的，后来自己又买了一个壳,2018-03-08 10:39:00,0,0,5
活***撒,PLUS会员,机器很漂亮，做活动买的，价格也很优惠,2018-03-09 16:59:59,0,0,5
j***i,PLUS会员,京东不错 发货快 服务好 支持京东,2018-03-09 18:30:18,0,0,5
烈***魂,PLUS会员,手机颜值不错，相信华为，小花粉一枚,2018-03-08 18:31:46,0,0,5
张***s,PLUS会员,游戏更新好想你超级超级德克士没觉得,2018-03-08 13:04:36,0,0,5
胡***8,金牌会员,好到我不知道除了好还能用什么词来表达了，而且速度太快了,2018-02-27 09:21:29,0,0,5
超***爸,PLUS会员,性价比高，手机速度快，朋友很喜欢,2018-03-09 23:32:16,0,0,5
