名字,会员级别,评论内容,评论时间,点赞数,评论数,评价星级
大***毒,钻石会员,性价比很高的手机外观时尚大气,2018-01-31 07:56:43,0,0,5
w***o,银牌会员,手机还可以，只是快递慢了点，,2018-01-29 12:42:28,0,0,5
j***5,铜牌会员,升级版本后电池就不耐用了,2018-02-27 16:51:51,0,0,5
h***8,银牌会员,给爸爸买的、他很喜欢??,2018-01-29 08:50:40,0,0,5
j***0,金牌会员,帮表哥买的！他说很好！很大气,2018-01-28 01:38:25,0,0,5
m***o,银牌会员,物流很快，但是卖家出货很慢,2018-02-11 10:14:43,0,0,5
j***o,铜牌会员,给爸爸买的，目前用着还不错,2018-02-11 11:23:24,0,0,5
l***2,金牌会员,手机还不错，是我喜欢的蓝色,2018-02-08 13:46:42,0,0,5
v***J,银牌会员,没有带发票为什么是假的吗,2018-02-22 09:01:54,0,0,5
l***8,银牌会员,手机还能用，赠品垃圾！,2018-03-08 13:47:59,0,0,5
j***a,铜牌会员,用电真快啊。。。。。。,2018-03-06 19:10:29,0,0,5
j***a,铜牌会员,还可以  看起来是不错,2018-03-04 21:34:18,0,0,5
c***9,银牌会员,老婆很喜欢。买的也实惠。。,2018-02-02 19:03:13,0,0,5
i***q,银牌会员,我兄弟说不错，下次还来,2018-03-03 20:42:07,0,0,5
j***u,银牌会员,用起来很不错，值得拥有,2018-03-02 20:11:01,0,0,5
L***9,金牌会员,反应比较快，老妈很喜欢,2018-03-02 18:25:15,0,0,5
陆***1,银牌会员,妈妈用着呢，暂时没毛病,2018-03-02 15:13:41,0,0,5
j***8,银牌会员,用着挺不错  值得购买,2018-03-02 11:50:03,0,0,5
昵***s,银牌会员,刚到手，还没用，应该可以,2018-02-13 10:01:40,0,0,5
j***s,银牌会员,物流太慢，一周才收到货,2018-02-27 21:22:27,0,0,5
a***c,铜牌会员,没我想象中的大，还可以,2018-02-27 15:01:10,0,0,5
w***x,金牌会员,电池续航时间长照相清晰,2018-02-26 16:44:59,0,0,5
x***n,银牌会员,给妈妈买的，每天晚上都视频,2018-01-28 09:50:13,0,0,5
C***A,银牌会员,手机给力，京东值得信任,2018-02-26 13:04:48,0,0,5
z***1,金牌会员,手机今天刚收到，很喜欢！,2018-02-09 00:07:26,0,0,5
1***p,金牌会员,给老爸买的，电池挺耐用,2018-02-23 10:19:57,0,0,5
t***k,银牌会员,手机感觉棒棒的 手感不错,2018-02-07 10:58:18,0,0,5
jd137120lap,钻石会员,质量不错的，继续支持。,2018-02-21 09:47:24,0,0,5
jd137120lap,钻石会员,质量不错的，继续支持。,2018-02-21 09:47:03,0,0,5
j***4,金牌会员,可以，反应速度也行。,2018-03-06 12:00:13,0,0,5
U***I,金牌会员,妈妈很喜欢，也实用。,2018-03-05 23:39:54,0,0,5
j***r,金牌会员,还不错，手感也可以。,2018-03-05 19:52:48,0,0,5
j***6,铜牌会员,真差劲，反应太慢，不能用,2018-02-03 15:32:54,0,0,5
4***8,金牌会员,还不错，等使用后再评价。,2018-02-02 10:53:15,0,0,5
j***i,金牌会员,赶紧发那些附属产品！！！,2018-01-31 18:13:32,0,0,5
j***5,银牌会员,非常好非常好非常好非常好,2018-02-06 18:54:51,0,0,5
j***k,银牌会员,宝贝不错。物流就有点慢了,2018-01-30 18:34:18,0,0,5
j***c,银牌会员,手机刚拿到，用下再评,2018-02-27 18:12:37,0,0,5
b***5,银牌会员,看起来可以，等试用再追评,2018-01-28 20:31:47,0,0,5
j***q,银牌会员,反应快，外观漂亮大方,2018-02-26 11:45:20,0,0,5
j***f,银牌会员,还可以吧玩游戏真不行,2018-02-24 22:28:49,0,0,5
j***b,银牌会员,还在用 目前看还不错,2018-02-24 08:51:58,0,0,5
Z***4,银牌会员,刚拿到手机，还没有用过,2018-02-08 22:22:15,0,0,5
b***o,PLUS会员,很好，妈妈很喜欢,2018-02-21 23:17:46,0,0,5
w***翔,金牌会员,手机收到了，下次再买！,2018-02-06 14:09:32,0,0,5
j***c,银牌会员,给朋友买了  还可以,2018-02-18 19:25:56,0,0,5
L***1,银牌会员,还行，刚到货，我喜欢。,2018-02-01 23:09:48,0,0,5
l***6,铜牌会员,给老爷子用的。还可以。,2018-02-01 11:07:25,0,0,5
X***L,铜牌会员,觉得还好！大小合适！,2018-02-11 15:45:14,0,0,5
Z***平,银牌会员,配送太慢，商家服务差,2018-02-10 13:39:08,0,0,5
j***a,金牌会员,买给老妈用的，还不错。,2018-01-25 19:23:22,0,0,5
P***C,铜牌会员,还不错，老公还算满意,2018-02-09 11:21:01,0,0,5
j***r,银牌会员,好用，老人家用很好！,2018-02-08 12:10:39,0,0,5
孤***3,PLUS会员,大品牌，值得信赖,2018-01-30 11:18:32,0,0,5
w***7,银牌会员,不知道质量怎么样，,2018-02-28 13:44:57,0,0,5
j***8,银牌会员,漂亮，快递小哥很好,2018-02-28 12:13:15,0,0,5
幻***界,金牌会员,非常棒，朋友非常喜欢,2018-01-29 07:39:40,0,0,5
j***f,银牌会员,第四个华为，性价比高,2018-01-27 17:12:47,0,0,5
G***C,银牌会员,发货和描述的不一样,2018-02-25 19:08:28,0,0,5
k***b,银牌会员,手机很好看用的也很好,2018-01-26 21:40:58,0,0,5
j***0,铜牌会员,一次挺满意的到付网购！店家态度好??收到的手机跟图片一致！功能实在！速度嗖嗖的………，很满意?,2017-12-16 17:36:09,0,1,3
z***h,铜牌会员,还可以，小孩还喜欢,2018-02-23 11:49:11,0,0,5
j***d,铜牌会员,比较满意，符合实物,2018-02-12 18:23:56,0,0,5
j***d,铜牌会员,不错，玩游戏很流畅,2018-02-10 09:13:33,0,0,5
o***h,银牌会员,性价比高，值得拥有,2018-02-05 13:04:23,0,0,5
理***麻,铜牌会员,800元  不错了,2018-02-05 10:20:53,0,0,5
j***0,银牌会员,刚到手，过几天再评,2018-02-03 19:31:30,0,0,5
1***3,银牌会员,东西不错，很好用。,2018-02-03 09:27:03,0,0,5
j***w,银牌会员,第二次下单啦挺好的,2018-02-01 22:09:10,0,0,5
j***7,铜牌会员,下次还来   不错,2018-01-31 21:57:29,0,0,5
杀***带,铜牌会员,物流很慢一个星期多,2018-01-31 14:45:47,0,0,5
j***a,铜牌会员,手机巳经收到挺满意,2018-01-27 10:41:56,0,0,5
j***t,铜牌会员,还好啦   挺轻的,2018-01-26 21:54:06,0,0,5
j***k,铜牌会员,用了一个月，都挺好,2018-01-26 19:07:37,0,0,5
jd_185661khy,银牌会员,这次购物相当满意！,2018-01-25 21:49:20,0,0,5
j***b,铜牌会员,不错，第二次买了,2018-03-09 21:30:06,0,0,5
j***u,银牌会员,很满意的一次购物,2018-03-08 07:06:14,0,0,5
猛***8,铜牌会员,屏幕合适，质量好,2018-03-05 15:34:04,0,0,5
j***4,银牌会员,手机好看，好用:,2018-03-02 10:07:04,0,0,5
j***2,钻石会员,非常好用  很好,2018-03-01 13:12:40,0,0,5
K***R,铜牌会员,不行，屏幕有毛病,2018-02-27 18:26:08,0,0,5
j***3,银牌会员,很值得够买的手机,2018-02-25 18:49:32,0,0,5
冉***2,银牌会员,不愧是国产老大哥,2018-02-24 20:37:02,0,0,5
j***3,铜牌会员,速度还是很快的！,2018-02-20 11:02:04,0,0,5
e***3,钻石会员,卖家忘送手机膜了……,2018-02-13 15:25:45,0,0,5
X***A,铜牌会员,真的还可以，不亏,2018-02-12 21:18:38,0,0,5
j***5,铜牌会员,希望以后快点发货,2018-02-09 20:06:08,0,0,5
W***b,银牌会员,产品很好价格实惠,2018-02-03 11:33:06,0,0,5
愤***2,银牌会员,好用，外观漂亮，,2018-02-01 11:46:27,0,0,5
j***w,银牌会员,挺好的吧，不会卡,2018-01-30 18:05:41,0,0,5
一***5,银牌会员,没有想象的那么好,2018-01-29 10:23:10,0,0,5
j***x,铜牌会员,手机挺好，网速快,2018-01-28 20:06:27,0,0,5
j***香,银牌会员,给老人买的，还行,2018-01-28 10:51:44,0,0,5
j***q,金牌会员,好，非常流畅。。,2018-01-26 15:19:57,0,0,5
1***6,金牌会员,第二次买了帮朋友,2018-01-25 21:17:46,0,0,5
j***t,金牌会员,还挺好的,2018-01-28 22:19:16,0,0,5
t***3,银牌会员,目前用着还不错,2018-03-09 15:19:24,0,0,5
Y***8,银牌会员,可以的支持京东,2018-03-02 22:33:17,0,0,5
刘***男,银牌会员,性能还行，实用,2018-03-01 19:20:39,0,0,5
j***d,金牌会员,东西不错质量好,2018-02-28 10:12:00,0,0,5
j***3,铜牌会员,看着不错，还行,2018-02-27 21:24:21,0,0,5
j***k,银牌会员,外形大小合适。,2018-02-26 11:11:40,0,0,5
j***h,铜牌会员,不错，很喜欢！,2018-02-11 10:07:51,0,0,5
1***p,银牌会员,刚拿到还没有用,2018-02-01 11:35:42,0,0,5
l***n,金牌会员,速度也快，很好,2018-01-30 22:35:44,0,0,5
j***7,银牌会员,现在用起还可以,2018-01-27 16:50:14,0,0,5
j***h,铜牌会员,手机一般吧！新机就有点卡。不过一分钱一分货，这点钱买了也不会觉得很亏。后面居然发现其他店家买得更便宜，还是有点后悔了。,2018-03-03 06:53:11,0,0,4
j***3,银牌会员,手机收到，当没收到赠品。联系店家服务员，她说:“赠品和手机一起发了，不可能没有发赠品”。我说:“没有赠品，你们查查发货视频，有没有发货”。她又说:“要快递员证明有没有赠品”。后我联系快递员，快递员过来了。他看了我的下单单据。快递员说:“手机收到后确定收到，才发赠品”。现在我要问店家，你们店家服务员不知道确定收到货才发赠品吗？这个店家服务员可以滚走。（看下面拍照）,2018-01-02 18:49:43,1,1,2
5***勇,银牌会员,手机非常不错,2018-03-04 22:33:36,0,0,5
j***5,铜牌会员,快递完好无损,2018-03-03 11:48:54,0,0,5
j***6,铜牌会员,手机后期评价,2018-03-03 12:34:04,0,0,5
j***f,铜牌会员,挺好用的不错,2018-02-26 20:15:36,0,0,5
钊***4,银牌会员,配送员很优秀,2018-02-22 12:47:01,0,0,5
j***x,银牌会员,很好，很喜欢,2018-02-19 01:02:53,0,0,5
j***w,PLUS会员[试用],老妈很喜欢，,2018-02-13 23:28:10,0,0,5
朱***毅,铜牌会员,很好，不卡。,2018-02-11 17:46:17,0,0,5
j***n,银牌会员,它的功能很强,2018-02-07 12:38:55,0,0,5
伍***峰,金牌会员,几好，直得买,2018-02-03 23:05:18,0,0,5
J***S,银牌会员,挺好非常满意,2018-02-03 16:16:13,0,0,5
x***6,银牌会员,手机到还不错,2018-02-03 13:08:00,0,0,5
j***v,铜牌会员,这个手机还行,2018-01-31 11:37:27,0,0,5
摘***星,金牌会员,支持国产,2018-03-06 12:11:31,0,0,5
y***康,银牌会员,物美价廉,2018-02-17 13:56:20,0,0,5
左***来,铜牌会员,包装太简单，就用了一个缓冲的塑料充气袋装着小盒子，以前用vivo的习惯了，用着不是很顺手，屏幕分辨率不高，送的赠品很一般。,2018-01-31 18:07:24,1,1,3
水***6,铜牌会员,手机是正品，耳机小小失望。,2017-12-11 17:01:29,0,1,3
H***t,金牌会员,打电话时声音不是很清，有点混声音,2018-01-29 18:04:48,0,0,4
j***y,金牌会员,买给长辈用的！！！！！,2018-03-08 13:42:03,0,0,4
王***4,银牌会员,还算不错的，，，,2018-02-04 11:10:17,0,0,4
j***5,铜牌会员,12月31号买的  都好几天了还没到货  感觉不对劲  结果都1月4号了居然还没发货  在我的不断催促和投诉的情况下  好不容易才给我发货的  发的别看是顺丰快递不过就是顺丰最慢的快递服务类型  如果我不催不投诉的话  估计今天都没有到货  客服半天也解决不了问题  除了没完没了的说抱歉之外就没有任何解决问题的策略  最后客服把仓库电话给我让我自己问  但是电话就是不接直接挂断  拜托  这是你们的工作职责好不好,2018-01-06 16:58:10,0,2,2
M***4,PLUS会员,感觉还可以,2018-03-06 16:31:32,0,0,5
韦传龙,PLUS会员,看胡歌买的,2018-03-06 10:01:09,0,0,5
归***爱,PLUS会员,手机还行！,2018-02-23 15:26:35,0,0,5
脑***峰,铜牌会员,还不错吧，就是分辨率有点，，还有居然不送东西的，这醉了,2018-02-20 21:50:52,0,1,3
落***灬,银牌会员,妈妈很满意,2018-02-08 10:08:43,0,0,5
邓***3,银牌会员,?好?,2018-02-01 22:19:53,0,0,5
大***3,银牌会员,反应有点慢,2018-02-01 11:48:01,0,0,5
还***春,银牌会员,手机很不错,2018-01-29 23:36:59,0,0,5
j***4,铜牌会员,手机挺棒！,2018-01-28 19:02:53,0,0,5
你***生,铜牌会员,原装正品！,2018-01-26 12:37:46,0,0,5
w***0,铜牌会员,这是新手机吗？，稀巴烂，第一次在京东购物以后再也不信了,2017-12-12 23:20:20,0,1,3
小***4,金牌会员,很好用,2018-03-07 08:10:19,0,0,5
j***y,金牌会员,没有意想的那么好，像素不清晰，摄像头边缘漆都掉了,2017-09-30 11:19:43,0,1,3
u***P,铜牌会员,东西好不好且不说，应该说卖家服务态度就是狗屎，咨询一次想骂人一次，拖拖拉拉一个多星期才拿到手机，这种卖家竟然能在京东上存活？？？,2018-01-30 17:07:57,0,1,3
z***v,银牌会员,电话不能用，我简直怀疑是2手货，今天刚刚到货没电了，我充电后开机就锁了，真的很垃圾,2018-01-18 11:30:42,0,1,2
买***次,钻石会员,耳这么脏 说配送搞的 这也太能推了 手机里面装了一堆软件 装一个应该有不少收入 下单没没看清 第三方的确定不靠谱。,2018-02-12 11:27:43,0,1,3
j***0,铜牌会员,哪有闪光灯啊这手机,2017-11-17 20:39:31,0,1,3
越***奥,银牌会员,不知道这个手机是不是都发烧啊，开机随便玩了会，后背发烫，不知道还以为买的小米呢，哎，用一段时间在接着评论,2018-02-07 21:58:45,0,1,3
j***8,铜牌会员,我在京东买了一部荣耀九手机，说好配送耳机线，、防爆膜，，可是在收到货物时，根本就没有配送耳机线给我，感觉到贵司不负责任！,2017-12-07 05:28:21,0,1,3
1***2,银牌会员,非常满意,2018-01-28 19:41:49,0,0,5
j***c,银牌会员,感觉没有想象的好。预装了很多像手机**，**会，天天快报等等东西，感觉不像新手机。,2018-02-26 22:55:22,0,1,3
咔***渔,PLUS会员,手机挺好的，挺漂亮的，功能挺齐全的，就是快递太不给力了，我无缘无故的说我，要改天收货,2017-10-08 11:29:42,1,1,3
S***k,铜牌会员,买新手机竟然没有耳机，用了几天发现蓝牙连接上了但是放歌没声音，媒体声音连接不上,2018-02-28 04:52:09,0,1,3
j***o,铜牌会员,"手机还好不过电板确实不是多好.我以前用的是2015年,
版华为畅享5s这手机电板和5s比差的多.",2017-11-22 08:29:40,1,1,3
j***3,铜牌会员,电池用电快 屏幕分辨率一般  一千块了哇 一个配件都没送 让我去哪里买,2018-02-16 10:45:24,0,1,3
j***8,金牌会员,手机包装盒没有封膜的，只有两张自己贴的胶带、打开后你会发现手机膜都已经被贴好了！京东就是这么贴心！,2018-02-28 09:45:07,1,1,1
g***M,银牌会员,话说手机用了说下情况：凑合用，指纹解锁不能用。下订单之后一个周没发货，联系客服，半天回一句，抱歉，忙。隔天继续联系客服，又是抱歉忙。好不容易发货了，四五天物流还是没有挪动位置，联系客服，说货已经发，不归他们管了，这前前后后半个月，而且语气是不耐烦的样子。问的多了，客服私下给我手机发信息骂我。,2017-11-27 03:31:07,14,4,1
s***3,金牌会员,手机很轻，像素很低，开机后看起来就很low，不知是否是正品？,2018-02-21 09:23:15,0,1,3
L***X,铜牌会员,其它还行，先用一段时间才明白，就快递有点慢，四号下单，十号收单,2018-01-12 00:12:45,0,1,3
M***丶,银牌会员,其他的都还好，就是配的耳机我就看不懂了，不是原装的？,2018-01-15 13:33:43,0,1,3
f***6,金牌会员,运行的内存实际上只有3G，并没有4G，总内有64G。,2018-01-13 22:35:24,0,1,3
t***1,银牌会员,物流是硬伤整整七天等着花儿都谢了！手机带的赠品也一般,2018-01-08 23:46:16,0,1,3
国***人,PLUS会员,一次买两台感觉还不错价格也不高,2018-01-22 21:53:53,0,1,3
四***入,银牌会员,被耍得团团转，周一下单周五才到。送的耳机是那种黑色绕脖子一看就很不好的耳机，说好的手机套也没送害人还得再网上买一个两三天才能到。手机膜不带酒精棉。客服没人理，总是转售后转售后转了两天了还再转。  荣耀的手机很不错这个是真的，但是这家店实在让人失望。希望能给各位朋友一个参考。,2017-11-26 14:13:08,0,1,2
杨***龙,银牌会员,音质感人，像素也一般，毕竟一千都不到的东西,2018-03-07 21:58:18,0,1,3
j***x,铜牌会员,不是配钢化镆，手机外壳，手环，到哪去了？,2018-02-21 14:33:16,0,1,3
x***1,金牌会员,第一次下载微信就登录不了，找商家直接说不行就退货吧，这态度我也是醉了，哎,2017-09-24 13:38:59,0,1,3
j***2,银牌会员,买了有点后悔了，质量不咋地，画像效果不好,2018-01-09 18:12:36,0,1,3
战***上,铜牌会员,什么防爆膜，给我的防爆膜根本对不上，不管怎么贴，都能把前摄挡住,2017-11-20 12:01:12,0,1,3
j***p,铜牌会员,说好三天到五天能到，结果八天才到，发货太慢了，希望以后能发货快点,2017-11-03 06:09:45,0,1,3
I***夫,银牌会员,略卡啊  是不是买到了翻新机了？,2018-02-23 10:50:48,0,1,3
j***d,银牌会员,手机不用多说了，一份价钱一分货，这个钱段买个这样的手机也值了。,2017-11-03 23:11:29,0,1,3
G***c,铜牌会员,不满意，机子很轻，而且之前看过，是拍照神器，可是像素超级差，,2017-11-10 22:32:13,0,1,3
e***o,银牌会员,"手机不错，刚到二天还可以吧?
就是大慢了，下单八天才到",2017-09-21 23:04:45,1,1,3
1***7,银牌会员,手机卡的不要不要的，，怀疑不是原装的，拆过的，，要不不会这么卡,2017-10-26 11:29:48,0,1,3
不***躁,铜牌会员,第一次买华为手机千元机分辨率确实不好 不太满意喽,2017-12-28 11:18:26,0,1,3
j***6,银牌会员,快递太慢了 其他都还凑合吧,2018-02-06 22:03:55,0,1,3
j***c,铜牌会员,三颗星，是因为京东物流太慢了……连百世快递都不如……手机还是很好用的,2017-11-07 21:20:15,1,1,3
P***C,银牌会员,手机充点太慢，而且带电不行。,2018-01-15 21:56:28,0,1,3
j***c,铜牌会员,很好用,2018-02-27 08:46:08,0,0,5
j***i,铜牌会员,还可以…,2018-02-23 18:14:06,0,0,5
惘***然,银牌会员,用着还行，快递能再快点就好了，发货就发了好几天,2017-12-07 14:33:17,0,1,3
熊***婆,金牌会员,照相不清晰，我要退货,2018-02-15 20:30:54,0,1,3
X***余,铜牌会员,运行快,2018-02-07 16:46:21,0,0,5
j***y,铜牌会员,还不错,2018-02-05 15:57:33,0,0,5
j***u,铜牌会员,还可以,2018-02-01 22:29:41,0,0,5
z***9,银牌会员,还行，电池不怎么耐用,2018-02-01 19:54:12,0,1,3
j***e,银牌会员,还可以,2018-01-27 21:32:13,0,0,5
s***M,铜牌会员,手机质量不怎么好。,2018-02-24 17:31:59,0,1,3
f***5,银牌会员,手机可以，就是说送的耳机没有呀,2017-11-28 13:06:08,0,1,3
j***d,银牌会员,手机不错，商家不行,2017-12-18 19:14:06,1,1,3
j***5,钻石会员,一般，反应迟钝，屏幕分辨率不高,2017-11-07 20:50:41,0,1,3
j***7,银牌会员,颜色相差太大啦，不满意,2017-12-28 20:33:40,0,1,3
j***1,银牌会员,下午收到了，感觉声音有点尖,2017-11-25 21:40:11,0,1,3
冰***士,金牌会员,还可以吧，就是发货太慢。,2017-12-07 14:35:29,0,3,3
王***3,银牌会员,东西一般般，凑合着用,2017-12-06 09:35:32,0,1,3
j***l,银牌会员,刚买回来用完电，关机充电，到开机开不了后来强制开机才开得了！本来想换，可后来又可以开机了，所以没换,2017-12-15 18:30:22,0,1,2
j***明,铜牌会员,手机套发错了，叫商家从发一个，结果发了一个垃圾手机套给我！我和同事一起买的，他的手机套就是原装的，大家看一下这是华为v9的手机套吗！大家不要再买了！,2017-12-20 17:01:01,3,1,1
z***p,铜牌会员,刚买就降小一百了！,2017-12-08 13:50:23,0,1,3
浪***四,银牌会员,购买回来打开镜面有划伤，钢化膜还有气泡，耳机线也是次品，和商家联系，竟然拒接。望大家相互转告，切勿上当，我已经通过京东平台来解决此事。,2018-01-11 09:38:12,2,2,1
程***情,钻石会员,发货久，刚买就降价,2017-11-19 14:31:50,0,1,3
j***r,铜牌会员,就感觉电池不太好，充电特别慢，要四五个小时，电量消耗的挺快的，不像是那种新刚买的手机，新的手机不会是这样，而且刚买来里面就有各种其他软件，什么优酷视频，反正大家要是买的话还是考虑一下比较好,2018-03-03 13:47:03,0,1,2
路***芦,银牌会员,比较不错,2018-03-07 12:50:01,0,0,5
j***2,钻石会员,手表还好,2018-03-06 17:53:16,0,0,5
j***0,金牌会员,挺满意的,2018-03-02 15:11:21,0,0,5
j***4,铜牌会员,手机很好,2018-02-23 11:21:21,0,0,5
阿***属,铜牌会员,发货慢，送的手机套也是大小都不一样！等了足足的七天才送到！唉！,2018-01-06 18:12:18,0,1,2
wincheng2010,钻石会员,王者荣耀,2018-02-15 10:31:50,0,0,5
天***7,银牌会员,外观好看,2018-02-14 18:44:46,0,0,5
j***7,银牌会员,为快递小哥点赞！,2017-12-15 22:45:09,0,1,3
年***马,金牌会员,华为，好,2018-02-04 08:28:09,0,0,5
余***生,银牌会员,很好?,2018-02-03 22:51:21,0,0,5
j***q,铜牌会员,质量太差,2018-01-28 22:45:27,0,0,5
j***k,铜牌会员,物流慢，手机还行,2017-11-26 09:06:29,0,3,3
j***e,银牌会员,非常好，也不贵。,2017-11-06 14:07:56,0,1,3
哈***9,银牌会员,售后服务真它码辣几，电话接都不接，还挂我机，售前抱歉就能完事了吗。丢泥嘛。,2017-11-20 12:38:26,8,2,1
哈***9,银牌会员,我买东西从不喜欢评价，这次让我非常脑火，我在你们旗舰店买了两部手机，用了一月现在一部出现通话中两三分钟就自动挂机，而是经常自动挂机。我找你说明情况，你让我给售后打电话，我打过去挂我三次电话！我丢你全家。。。你售前现在连话都不回我。我丢你老母,2017-11-20 12:21:43,14,3,1
j***5,银牌会员,"不能在预计发货时间发货就算了，但是还没发货就降价100,还有比这更堵心的事吗？！好歹等收到货再降价都要好一点！这是有史以来最最郁闷的一次购物！",2018-01-27 19:22:34,0,1,2
juanzi1314,金牌会员,手机那在手上特别轻，声音听着有点刺耳，不知道声音就这样还是手机有问题，最失败的一次购物，还不如去实体店买，给老人用的，先用再说吧。,2018-01-17 13:29:22,0,1,2
金***7,银牌会员,过了几天才来平价，这款手机运行速度基本可以，但前后像素很差，照片不清晰，照出来的字略快一点就有重影，客服态度也不好，叫他补发票，一直不能到位。真是郁闷。,2017-11-14 16:56:40,0,1,2
1***9,银牌会员,"今天刚拿到手机我发发表真实用机感受，
1、买家的包装很周到，但背面存在划痕。
2、赠送了礼物，
3、价格确实比京东自营的要便宜，
4、用了不到一个小时，手机发热，经常闪退，反应略卡，我真的怀疑是不是原厂正规手机，是不是翻新机，怎么刚用不到一个小时，比我现在正在用了2年，华为5C还要卡么。",2018-01-24 13:29:07,1,2,1
j***i,银牌会员,骗人商家，页面上写有送耳机壳膜，一样都没有，虽然不是值得几块钱，但是用骗人的手段还真是不良商家，,2018-01-26 18:20:50,0,1,2
j***h,银牌会员,本来以为是一次愉快的购物，可是发货太慢了，72小时后才发货，想拿到货就等个五六天吧！待有所改进吧！,2018-01-07 11:28:15,0,1,2
j***霜,PLUS会员,31号下单5号才到，说好的4号送达呢？都***套路，原来京东也如此的套路。,2018-02-05 22:14:53,0,1,2
z***9,金牌会员,手机还可以，但是物流实在太慢太慢了，就是因为京东物流快才选择下单，结果从下单到收货搞了7天时间,2018-01-12 09:35:18,0,1,2
靈***王,铜牌会员,还可以。。。,2018-01-04 16:03:48,0,1,3
有***头,铜牌会员,经过了七天的运送终于拿到了。赠品有点小套路。防爆膜。防爆膜。然而不是钢化膜,2018-02-14 13:01:07,0,1,2
j***y,金牌会员,这手机不好用，不流畅，有卡顿现象，来电声音又小。更可气送货又慢。下单到收到货要一个星期左右。,2017-12-31 07:53:40,0,1,2
布***熊,金牌会员,机器是给家里年龄大的人用的，的确会出现评论说的卡顿现象，而且是在并没有安装多少软件的前提下，软件大概有十个左右，并且在买的时候就已经选择需要开发票的选项但是卖家就是装作没看见，在多次讨要之后才给邮寄，真是醉了，就这售后服务也是烂透了以后买这种东西还是要去官方或者信誉好的店吧,2017-12-21 10:08:59,2,1,1
j***1,铜牌会员,不讲信用说给补差价也不给补，发货也慢拍了4天还没发货，屏幕颜色不正，不是正品，不要购买,2017-12-11 11:41:46,2,5,1
W***然,金牌会员,买后立马降价……,2017-12-24 21:08:08,0,1,3
j***f,铜牌会员,刚拿到手机还没怎么玩，手机发烫厉害，第一次用华为的还不习惯。其它问题还需继续摸索。,2017-09-26 11:21:21,1,2,2
j***o,银牌会员,怎么没耳机?,2017-11-10 19:20:15,0,1,3
j***d,银牌会员,还可以,2018-02-27 15:02:41,1,0,5
j***1,银牌会员,昨天收到手机的，用了一天，下载一些软件用，手机比较卡，运行慢,2017-09-19 09:31:43,2,1,2
l***1,PLUS会员,还好吧,2018-03-08 10:32:58,0,0,4
jd_130413kut,银牌会员,最糟心的一次购物，售后服务差，只有三句话，我在的，请稍等，为您转接，刚买的手机，出现问题，邮回去之后，还告诉我让我去所在地维修点去维修，7天无理由退换货，我凭什么拿去维修，我只是让你给我换新的，又没说要退掉，没办法只能直接找京东售后了,2017-12-31 21:02:04,3,1,1
