名字,会员级别,评论内容,评论时间,点赞数,评论数,评价星级
萌***_,PLUS会员,"质量非常好，与卖家描述的完全一致，非常满意,真的很喜欢，完全超出期望值，发货速度非常快，包装非常仔细、严实，物流小哥服务态度很好，运送速度很快，很满意的一次购物",2017-12-12 17:16:57,0,0,5
x***1,金牌会员,反响挺快的 还可以,2017-07-14 17:20:47,0,0,5
R***灬,银牌会员,东西不错，值得购买,2017-07-13 16:14:08,0,0,5
j***c,钻石会员,机器不错，挺好看,2017-11-16 11:18:03,0,0,5
t***4,金牌会员,性价比高值得购买。,2017-07-08 11:31:21,0,0,5
j***x,银牌会员,外观漂亮，手感好。,2017-06-28 23:48:07,0,0,5
我***啊,银牌会员,非常满意，非常满意,2017-06-22 08:56:24,6,2,5
j***d,银牌会员,很不错，给老爸买的，我都有点心动,2018-01-23 17:16:16,0,0,5
m***e,金牌会员,刚回来才拿到，手机还行，只是双十一买也亏了，现在降价了,2017-12-09 19:48:13,0,0,5
j***f,银牌会员,手机收到了，颜值挺高，哈哈哈，挺喜欢的。,2017-12-10 12:19:59,1,0,5
j***j,银牌会员,挺好的！值得信赖,2017-09-20 16:21:33,0,0,5
轻***兮,银牌会员,手机功能强大，我以为不是正品，是正品，买的不错，十分的好用！,2017-09-14 20:19:26,0,0,5
若***_,金牌会员,挺喜欢这手机的，续航，运行否很不错，就感觉充电速度有些慢了。,2017-08-25 17:07:21,0,0,5
j***4,银牌会员,很好，快速很快！,2017-08-21 15:10:07,0,0,5
方***同,银牌会员,超棒  自己体验,2017-08-19 22:42:14,0,0,5
z***6,金牌会员,手机很漂亮，刚刚开箱还没用，等用过后再来分享。,2017-12-02 17:40:45,0,0,5
L***雨,金牌会员,手机真不错，很炫,2017-08-07 12:07:54,0,0,5
j***y,银牌会员,发货慢了一点儿，总得来说还是可以的！,2017-09-03 17:08:14,0,0,5
j***9,金牌会员,用着很舒服很满意,2017-07-30 07:46:02,0,0,5
谁***s,金牌会员,手机颜值非常高，就是送的膜不怎么样，还有就是发货有点慢,2017-06-26 11:27:36,1,1,5
j***f,金牌会员,手机很好.外观美,2017-07-26 12:02:35,0,0,5
红***c,银牌会员,可以，就是物流慢,2017-07-22 10:08:26,0,0,5
y***0,PLUS会员,挺好的，满意哦,2017-12-27 04:07:52,0,0,5
j***w,金牌会员,整体用起来不错啊,2017-07-19 10:08:59,0,0,5
没***k,钻石会员,好看，手感也好?,2017-07-03 10:07:56,0,0,5
吾***我,PLUS会员,手机很好用，跟实货很像，拍照和功能和我man9没两样。,2017-08-20 07:42:50,0,0,5
jd_176663qsm,银牌会员,就是快递慢了点，其他的还好，手机速度也快,2017-09-04 12:40:28,1,0,5
h***7,钻石会员,东西正品，物流较慢,2018-01-14 22:39:48,0,0,5
j***0,银牌会员,双11买的今天到了 里面不错 价格还行吧,2017-11-14 14:33:06,0,1,5
y***7,银牌会员,太好了，真的不错。,2018-01-10 13:07:59,0,0,5
j***6,银牌会员,手机超快 充电速度挺快呀  运行咻咻咻    不得不赞,2017-07-11 10:43:45,0,0,5
z***a,金牌会员,快递速度很快，手机也很好用，很漂亮，运行很快,2017-06-29 11:32:19,1,0,5
j***5,银牌会员,快递很快，拿到之后真的很薄出乎我意料很喜欢,2017-07-04 14:06:29,1,0,5
j***0,金牌会员,产品不错，不过性能得后面看看，目前还不错，电池还可以,2017-07-03 16:05:22,0,0,5
j***n,银牌会员,手机外观很漂亮，使用起来流畅度很高，感觉挺好。,2017-08-16 21:08:33,0,0,5
j***y,银牌会员,收到了还不错，就是不知道运行怎么样,2017-11-16 22:35:09,0,0,5
j***4,钻石会员,很棒，感觉比苹果手机好用，速度快，打王者荣耀很适合,2017-07-03 14:23:26,0,0,5
吴***0,银牌会员,手机还是很不错的 就是物流比较气人 京东物流好慢,2017-06-26 23:42:13,0,0,5
3***0,银牌会员,刚买完，设置好就发现官网可以直接买高配的了无语~~冲动是魔鬼啊！（不知道可不可退货←_←）,2017-07-07 15:15:23,0,1,5
j***8,银牌会员,这个手机不错，性价比很高，建议购买,2017-07-11 13:34:00,1,0,5
kUFGMHYkuxHp,银牌会员,东西很好值得购买。快递很快,2017-06-21 11:20:06,8,4,5
j***3,钻石会员,东西还可以，使用方便，质量保证。,2017-09-24 19:13:15,0,0,5
美***折,金牌会员,手机靓，刚刚上手以后追加！,2017-11-10 08:24:43,0,0,5
L***Y,银牌会员,挺满意，送货也很快，送的东西也挺好。好用！,2017-07-01 07:32:28,0,0,5
d***e,金牌会员,手感很好，一直喜欢华为机，这次也一样。,2017-08-01 12:10:03,0,2,5
b***o,金牌会员,刚拿到，用一段时间再来评论,2017-11-02 11:08:30,0,0,5
孑***I,银牌会员,少一颗星是因为这个物流让我等了那么久，从下单到拿到货，用了7天吧，手机没有问题，运行程序反应迅速，68G的有49G可用，6G的有4G左右，总之就是这样，物流真的慢啊。,2017-11-04 15:39:09,0,0,4
狒***i,银牌会员,很漂亮的一款手机     用起来很舒服,2017-06-30 20:39:38,0,3,5
g***g,金牌会员,等了好久，刚收到，很好用，很喜欢！,2017-06-28 10:18:31,0,2,5
许***子,金牌会员,喜欢，华为手机我喜欢,2017-07-27 19:54:04,1,1,5
j***明,金牌会员,买给父亲辈的，屏幕大小恰恰好，土豪金大气，价钱又不贵，和苹果机比起来，性价比更好。,2017-07-04 13:51:13,1,0,5
哟***子,PLUS会员,手感不错，系统启动正常，使用了1个月感觉很赞。店家还送了手机壳，屏保等配件，物超所值！,2018-02-19 20:37:18,0,0,5
O***n,金牌会员,手机颜值和性能都不错 电池很耐用,2017-06-26 15:37:59,0,0,5
j***f,银牌会员,"为什么全部四星呢？？因为他写的是配荣耀耳机，他给我配的是个不知道什么的耳机。。。
然后手机方面的，一点问题也没有，堪称完美机",2018-02-28 01:52:25,0,0,4
两***花,金牌会员,谢谢小礼品，骚情的蓝很好看。,2017-06-30 13:18:17,0,0,5
算***生,银牌会员,用着还可以！！,2017-08-17 21:04:29,0,0,5
z***峰,金牌会员,该店家有望改进的地方，总体还可以！这是我买的第二部，华为荣耀9国人品牌高大上的感觉！支持国货,2018-01-28 20:15:23,1,0,5
我***了,PLUS会员,手机颜值爆表，美的不像话，手感也很好，系统运行流畅，打王者荣耀一点不卡，完美,2017-06-17 13:37:35,17,0,5
A***h,银牌会员,非常不错的机子，比苹果机强? ，人机操作是顶级的设计，手感 ?，拍照与听音乐非常满意。购买本就奔着荣耀去买的，几年前我买的荣耀4摔了不知多少次与车子碾压过一次用着没事，上个月摔中小石子屏有点裂纹。呵呵 买了荣耀9。一个荣耀系的铁粉，希望荣耀一直在。,2017-11-12 08:31:50,0,0,5
紫***9,金牌会员,中午刚收到，很喜欢超赞?,2017-06-29 21:38:45,0,0,5
j***z,PLUS会员,手机和预想一样很好,2017-09-02 11:05:27,0,0,5
章***根,PLUS会员,颜色颜色很正，手感比较不错，功能很强大，价格还行，手感比较不错，功能很强大，价格还行，赞赞赞赞赞赞赞赞赞赞赞赞赞赞赞赞赞赞。,2017-07-02 08:40:39,0,0,5
jd_182587asn,PLUS会员,看着还不错，用着也可以，很漂亮，心仪好久了，终于买到手了，比其他店便宜挺多的，双十一物流稍微有点慢可以理解,2017-11-17 12:35:34,0,1,5
j***p,银牌会员,很不错，颜色很漂亮，应该是正品，赠品很多，标配的抢不到只能在京东买了，也没办法，不过这个手机性价比是真的挺高，也值了，送的东西质量一般，还在探索新手机，像素好的没话说，指纹解锁也不错，非常灵敏，照出来的照片完全不需要滤镜和美颜，果然是美的有声有色，期待青春版出来,2017-07-18 22:18:32,0,0,5
心***道,银牌会员,我买的是蔚蓝的,2017-07-23 18:31:19,0,0,5
王***1,金牌会员,还行吧。。。。,2017-07-19 14:10:27,0,0,5
j***0,银牌会员,还可以不错很好,2017-07-15 11:59:44,0,0,5
俺***马,银牌会员,很喜欢，满意了,2017-07-10 11:15:37,0,0,5
h***0,银牌会员,已收。 还好。,2017-07-09 23:26:50,0,0,5
百***澈,银牌会员,物流很快 好评,2017-07-06 22:44:09,0,0,5
不***游,钻石会员,不错，都很好哦,2017-07-05 20:59:19,0,0,5
o***M,银牌会员,还行，不错哦！,2017-07-02 21:02:55,0,0,5
E***v,银牌会员,手机不错，很好用，没别人说的那么多屁毛病，。真心好看，缺点是缝隙大就进灰，系统不适应，不好用，不是很人性化不如flyme,2017-12-09 22:43:33,0,0,5
v***A,银牌会员,基本上还算满意,2017-07-01 13:12:22,0,0,5
陌***u,PLUS会员,非常感谢京东商城给予的优质服务。从仓储管理物流配送等方面都是做的非常好的。送货及时配送员也非常的热情，有时候不方便收件的时候也安排时间另行配送。同时京东商城在售后管理上也是非常好的，以解客户忧患，排除万难。给我们非常好的购物体验。,2017-11-19 18:30:27,0,0,5
大***儿,银牌会员,非常好，特别有手感,2017-07-28 13:15:02,0,0,5
炎***呦,PLUS会员,期待好久的荣耀9，配置很强劲，漂亮的机身，不愧是老胡代言的，手机颜值完美匹敌呀。太多喜欢的理由了~,2017-06-17 14:50:02,14,0,5
j***t,钻石会员,颜色漂亮高颜值，立马把我的菜耀七比下去。手感轻巧双镜头，棒！其他性能慢慢体会。,2018-02-05 19:04:09,1,0,5
图***典,金牌会员,可以的，这很好。,2017-09-15 15:05:54,0,0,5
傻***_,银牌会员,手机总体来说还行，就是一个有个小坑，划了，手机膜太小了，都不是配套的，感觉电量不怎么尽使,2017-06-30 10:39:43,0,0,4
j***g,PLUS会员,手机一般，运行速度不怎么样，打游戏会卡，电池不耐用，其他方面都好,2018-01-10 18:41:32,0,0,5
F***v,银牌会员,手机外观很大气，音质不错，手机运行速度快！电池容量大耗电时间长,2018-03-06 10:58:19,1,0,5
炎***呦,PLUS会员,手机用上之后才来给评价。首先手机外观很美，手感很好，闪闪发光，整体感觉非常满意。再者 手机拍照感觉也不错，像素特别好，还有就是运行很流畅，是一款值得推荐的手机~,2017-07-11 14:43:21,0,0,5
j***d,金牌会员,?是正品，屏还是小。看着有点累，用完5.5的用这个有点不习惯，?速度还是不错的。唯一**的是?还没拿上用呢，你就下调价格。,2017-09-10 20:02:27,0,0,4
芊***羊,PLUS会员,终于收到了，官网抢不到，加钱有电影心疼，不过等不了了。手机没有让我失望，荣耀水准很高，很上档次,2017-06-18 09:40:40,12,1,5
y***9,银牌会员,手机漂亮也很好。本人很喜欢。大手机用习惯了，小手机不好用。打字经常按到好几个字。电池容量小电一天正常所需不够用。,2017-06-29 19:17:39,0,0,5
j***c,银牌会员,耗电有点过快,2018-02-20 18:57:54,0,0,5
j***l,银牌会员,物流太慢了，等了4天才拿到手，第一次用华为手机，看上去还不错，好不好要用了一段时间才知道了,2017-12-04 13:53:19,0,0,5
j***i,银牌会员,之前用的荣耀7，一直信赖华为，很喜欢这款手机，而且用了一阵了，没有卡顿，好评！,2017-09-19 17:50:23,0,0,5
j***q,银牌会员,手机还可以，就是赠品不怎么样，上一个手机买了没多久又买了这个，就感觉这是个裸机样什么都没有,2017-11-12 22:04:49,0,0,5
风***0,金牌会员,全新的手机  功能也比较强大  运行内存6G  反应很快  指纹解锁非常灵敏  送的充电宝很精致  很帅气,2017-07-03 17:29:23,0,0,5
j***u,银牌会员,手机还可以外观漂亮，刚拿到试用几天看看，就是送的防爆膜不好贴，贴坏了。可能是不专业吧，浪费了。,2017-09-29 22:29:07,0,0,5
agywbUdOyhFl,PLUS会员,第一次在京东上买手机，物流速度超快，而且这家店的店小二服务态度也超级好，一直认真回答并给予建议，非常喜欢这个机器的配置跟颜色，下次有需要再来这个牧申店购买，,2017-06-18 16:24:32,7,0,5
深***息,PLUS会员,大爱胡歌，顺路支持国产 荣耀双颜值,2017-06-18 09:29:45,17,0,5
石***歌,金牌会员,是正品。反正比标价要贵300块咯，买新鲜货就酱紫。性能还好，不过待机时间真的不长，我不玩儿游戏，稍微刷刷知乎豆瓣基本上就要充电了。很容易发烫。有些内置软件还删不去。最后，USB接口跟通用的不一样呢呵呵，荣耀真是越来越作了。,2017-07-06 12:28:24,0,0,5
j***u,银牌会员,华为荣耀9，好看又好用，上网快，内存大，价格消费者也能接受。,2018-01-22 17:54:45,0,0,5
l***6,PLUS会员,现在用着还不错，很流畅，指纹解锁秒开。买家还送了自拍杆和膜。,2017-12-24 14:46:37,0,0,5
j***g,钻石会员,刚收到，搞清楚了。前置摄像头好像不太习惯?，其他都还ok,2018-01-30 21:54:39,0,0,5
j***s,银牌会员,手机特别适合女孩子用，比较小巧，网上看好多评价机身发热，第一次充电有这种情况，用了有半个月啦，性能各方面还不错，就是电池感觉不是特别耐用，其它不错，对得起这个价格，值得推荐，物流发货就是太慢啦，有得提高,2017-11-30 20:40:34,0,0,5
那***门,金牌会员,用了几天后来评价，机身表面玻璃技术光滑手感很爽，但不知道这样的耀眼能维持多久。操作流畅反应很快，比之前用的荣耀7好出很多（荣耀7是最大的败笔）。到目前为止未发现任何故障，总体评价：非常满意。,2017-12-10 18:25:30,1,0,5
w***4,PLUS会员,很划算，正品，运行很快，漂亮，喜欢,2018-02-12 12:12:49,0,0,5
L***C,银牌会员,快递速度快  手机外观真心好看  用起来也很流畅  支持华为支持荣耀  五星好评,2017-08-04 16:41:08,1,0,5
h***8,银牌会员,物流很给为，手机运行速度快，外观漂亮，使用起来得心应手，很强大的一款智能手机,2017-11-16 11:47:45,0,0,5
谢***9,金牌会员,物美价优，物流很快，礼物也很实在，很愉快的一次购物,2018-01-24 14:40:22,0,0,5
j***w,金牌会员,外观还可以，手感不错！！！！运行速度玩王者没毛病！！,2018-01-05 22:01:41,0,0,5
许***f,金牌会员,一直用苹果，这次经朋友推荐，第一次用了咱国产傲娇品牌的手机，屏幕大小是我很喜欢的，运行速度目前还可以，拍照效果也不错，电池电量因为是新机子可能耗损不大，满意，总体！！！,2018-01-25 11:05:05,0,0,5
m***1,钻石会员,手机用着还不错，这个价位的行了。京东的物流给力。全品类次日达才完美 加油京东！,2017-09-28 15:29:40,0,0,5
e***6,PLUS会员,非常漂亮，总得来说很满意，,2018-01-22 20:20:42,0,0,5
优***豆,金牌会员,东西不错，物流超快！总体符合宝贝描述！给个赞,2018-02-02 14:52:53,0,0,5
j***d,PLUS会员,将就用将就用将就用将就用,2018-01-26 21:32:16,0,0,5
玖***丶,银牌会员,手机很好，很好看，就是发货太慢了，物流也很给力,2018-01-07 23:43:49,0,0,5
M***2,PLUS会员,漂亮，这手机没得说，卖手机的再这样下去我要完蛋了，都把机器造这么好看，逼着我换新的,2017-07-18 10:21:57,0,0,5
j***5,银牌会员,卖家发的是顺丰呢，非常的快，这个手机的颜色太酷了，我爱人非常的喜欢，非常的适合男人使用女儿试用了一下，感觉好好呀，她用的是苹果7，但是她说比苹果好用。现在国产手机也赶上来了，非常为我们的国家自豪，华为真是太伟大了,2017-07-03 20:59:03,0,0,5
二***十,PLUS会员,手机收到了，满意！,2018-03-02 11:09:29,0,0,5
J***人,PLUS会员,我胡哥代言超级帅气，手机也超级帅气背部流光波动美翻了，同时本人也是花粉荣耀8用到现在也很不错不卡，荣耀手机就是靠谱，物流快三天就到手该送的东西也都拿到了有诚信下次还来这家买。,2017-06-28 17:15:30,1,0,5
a***c,金牌会员,待机还行，运行速度挺不错的，挺满意,2018-03-03 08:57:48,0,0,5
j***c,PLUS会员,用了几天了才来评价，手机很满意，暂时没发现什么大问题，性价比很高，手机颜值很赞，设计合理，网速也不错，只是拍照可能没有同等价位的其他手机好，其他一切都好。,2017-11-18 14:22:41,1,0,5
z***2,银牌会员,送给老婆的还不错   老婆挺喜欢的   就是预装的东西有点多,2017-12-16 12:31:35,0,0,5
n***t,PLUS会员,123456789123456789还可以,2017-11-17 23:55:58,0,0,5
j***n,金牌会员,这个手机挺好的，个人比较喜欢,2018-01-16 22:55:58,1,0,5
笑***0,银牌会员,颜色很亮，分辨率清晰，反应灵敏，很不错。其他功能还待发掘。。,2017-12-01 13:40:41,0,0,5
d***3,钻石会员,手机看起来就很大气，很好看，感觉老胡代言的都不会错吧，哈哈,2017-12-11 14:02:02,0,0,5
t***S,银牌会员,用了一个多月了，非常满意，而且完全不用担心内存不够用了。,2017-12-14 18:32:07,0,0,5
s***爸,PLUS会员,漂亮，相信京东，相信华为，一如既往支持,2017-11-18 14:52:28,0,0,5
o***o,钻石会员,非常满意，好的狠，可以，大家放心买,2018-01-16 17:08:35,0,0,5
j***9,银牌会员,宝贝使用有段时间了，总体感觉不错。就是玩海战游戏时，屏幕太过灵敏，十字准心老跑偏。,2017-10-10 20:48:03,0,0,4
C***x,金牌会员,一直忘了评价，两天手机就到了，颜色还不错~手机用的很好，不卡~,2017-11-05 16:45:18,0,0,5
z***0,银牌会员,不错，很喜欢,2017-09-12 06:23:28,0,0,5
唯***宝,PLUS会员,辛苦快递小哥,2018-03-06 10:29:41,0,0,5
风***飞,PLUS会员,颜值很高，有点重，不适合女生，发热量较大，不玩游戏一般般用用，一天一充，打电话的时候不能使用4g只有2g网，没有快充，充电大概需要3小时，摄像头中规中矩，性价比不是很高,2017-07-30 12:25:35,0,0,5
j***g,银牌会员,非常不错的一款手机，符合心里的要求。背后的极光很喜欢，功能性也很好,2017-08-16 16:40:01,0,0,5
j***8,银牌会员,物流有点慢，说好的次日达呢？其他还可以，这次预装都可以删。,2017-07-27 19:02:14,1,0,5
s***6,PLUS会员,还不错很好下次再买,2017-10-26 11:18:52,2,0,5
我***y,银牌会员,特别好特别好,2017-08-23 15:58:52,0,0,5
给面儿,金牌会员,手机相当不错哦 就是快递太慢了 颜色也很满意 很是喜欢 赞,2017-10-08 11:37:32,0,0,5
j***0,银牌会员,手机漂亮，，送的配件也很齐全，手机总体手感好,2017-08-21 15:57:42,2,0,5
j***a,金牌会员,目前没有问题，试用后感觉还行,2018-01-20 09:34:48,0,0,5
暴***丶,金牌会员,还行不错很好,2017-08-10 20:35:47,0,0,5
游***哭,金牌会员,手机用起来顺手不错，指纹解锁很快，机型美，用了这个不想再用苹果手机了,2017-07-08 15:23:18,0,0,5
衬***控,银牌会员,感觉是市面上最漂亮的手机，没有之一，顶配版，运行更是无压力，好评！,2017-07-03 21:41:13,0,0,5
j***m,银牌会员,质量还行吧。,2017-07-18 08:53:22,0,0,5
L***y,PLUS会员,京东购物就是好，发货速度也很快，质量也有保证,2017-07-13 14:46:15,0,0,5
p***i,金牌会员,海鸥灰很好看,2017-07-11 12:44:24,0,0,5
H***p,金牌会员,还是不错的一款华为手机,2018-01-30 11:37:38,0,0,5
启***栋,PLUS会员,很强大到售后到快递师傅你们辛苦了,2017-07-25 21:27:44,1,0,5
小***队,钻石会员,挺好的东西呀,2017-07-08 21:57:27,0,0,5
高***农,银牌会员,手机用了一段时间还好暂时没发现什么不正常～,2017-12-30 08:47:02,0,0,5
O***-,钻石会员,是正品，耗电量也不错～帮邻居买的，特别满意～总之很赞,2017-07-19 22:01:37,1,0,5
c***3,金牌会员,手机不错哟，送的东西还可以就有些瑕疵！用几天再来追评,2017-10-08 15:45:17,0,0,5
j***6,银牌会员,这部手机不错，华为荣耀9,2018-01-07 20:40:30,0,0,5
h***6,金牌会员,手机非常棒。,2017-06-30 20:25:54,0,0,5
z***5,银牌会员,非常漂亮，这是我在京东买的第三个手机，是原装，外观大气，手感舒适，像素一般，没说的那么好，我在牧神手机旗舰店买的第三个送了两个自拍竿了，这次送的耳机是垃圾，其他的都好,2017-12-06 18:41:15,0,0,5
学***娘,银牌会员,因为是买送人的，所以用了一段时间才评价。手机很好用，送的东西也不错,2017-11-09 13:35:50,0,0,4
j***b,金牌会员,手感真的超级棒，摸起来特别舒服，功能也不错，真的,2017-08-01 10:56:09,1,0,5
j***5,银牌会员,手感很好画面清晰，用起来非常流畅一如既往的支持,2017-08-15 16:44:23,1,0,5
j***t,银牌会员,很好，是正货，容服态度很好，给个五星级仔赞，谢谢你了:!,2017-08-12 17:27:55,0,0,5
j***8,银牌会员,还可以就是发货慢，京东服务蛮好的。送了耳机和一个小小的充电宝,2017-07-06 17:41:12,0,0,5
O***桥,金牌会员,刚收到货，体验了一下，很好，很流畅，外形很漂亮，好评！,2017-08-20 12:31:50,0,0,5
1***p,金牌会员,手机刚刚到货  并没有我预期那么惊艳*贵   这个市场抽查?,2017-07-01 13:00:31,0,1,5
j***v,PLUS会员,用起来感觉一般般吧，没有太大突破。估计安卓系统都差不多,2017-08-13 08:21:24,0,0,4
李***5,银牌会员,怎么说呢？前期我是挺烦恼的，订购四天后才给发货。不过看在客服比较热情，物流服务比较周到的份上，相互体谅，习惯性给足好评，手机质量还是不错的。,2018-01-04 22:52:06,0,0,5
h***n,钻石会员,东西的非常好呢，我很喜欢，非常好非常好,2017-12-19 19:43:56,0,0,5
尼***鱼,银牌会员,机子很好，送的东西也比较实用，京东物流保护做的也不错，就是上海寄有点儿慢了。,2017-07-09 14:23:33,0,0,4
j***x,银牌会员,很喜欢 性价比很高第一次在京东买手机感觉还不错?,2017-08-25 16:50:40,0,0,5
2***6,金牌会员,快递还行，但是没有赠品，入手2999比官网贵一些，刚拿到，发现自营店有满减活动什么的，又多花钱了，另外无充电状态下更新系统和软件，背部出现发烫现象，总体还行吧，就喜欢这外观,2017-07-28 12:14:05,0,0,5
稀***k,银牌会员,用了一段时间了，非常不错，基本无卡顿，电池一天一充，蓝色很漂亮，拍照比原来的好很多，我不怎么玩游戏，就是下一些常用的app，绰绰有余,2018-01-28 11:05:59,0,0,5
j***3,银牌会员,手机运行快，960的芯片加上6G的运行內存，很流畅。屏幕分辩率是1080P很清晰，照相效果很好，总的来说荣耀9性价比很高，值得购买。,2018-01-28 02:24:50,0,0,5
j***o,银牌会员,先用了几天才来评价，好评！手机是正品行货，比官网便宜了几百块，算是省了几百块吧。手机的好坏我不做评价，因为手机不是店家生产的……,2018-01-17 16:34:11,1,0,5
y***恩,银牌会员,很帅气，玩起游戏和你顺畅，拍照也还好，就是发货有点慢,2017-07-20 21:33:30,0,0,5
j***3,银牌会员,玩王者荣耀刚刚的，，，，#,2017-11-17 15:28:21,1,0,5
l***o,金牌会员,"产品很不错，王者荣耀玩起来手机还是会发热。
期待新品",2017-07-01 22:10:53,0,0,5
j***c,银牌会员,物流太慢充电器线太僵根之前8的不一样其他都不错不过个人感觉跟8区别不是太大玩起来没啥新鲜感机子一如既往的好希望能耐用吧荣耀8用了快一年就开始卡了唉国产机也就这了还是给个好评,2017-06-30 09:21:30,0,0,5
j***q,金牌会员,商品不错，物流是真的差，我老婆比我晚半天下单，我却迟两天收到货，广州到佛山用了13个小时！彻底没脾气，京东物流最差的一次体验,2018-02-28 11:27:39,0,0,5
j***k,银牌会员,太漂亮了，女朋友喜欢,2017-06-30 17:47:17,3,0,5
j***6,钻石会员,很快的手机，就是贵点点，啥也不送我呀,2017-10-12 19:09:09,0,0,5
j***9,银牌会员,收到用了一天，日后再评。,2018-02-09 21:16:07,0,0,4
微***开,PLUS会员,拿到手很好，目前比较满意，还没试试开机以后怎么样。传闻搭载了机器学习的系统，不知道怎么样。,2017-06-18 09:44:09,6,0,5
大***8,银牌会员,华为荣耀九手机3D玻璃很棒,2017-12-23 12:56:02,0,0,5
j***g,PLUS会员,很好，实用，好用，漂亮，完美手机，好好好,2017-09-03 04:48:37,0,0,5
z***7,钻石会员,物流快，手机很喜欢，用了一天，流畅，手感很好。,2017-07-14 16:40:14,0,0,5
c***4,金牌会员,这款手机我关注了很久，这次店家搞活动很划算，手机拿到马上就用了，运行很流畅，颜值高，朋友同事都说好看，绝对是正品！值得推荐！,2018-01-31 17:27:03,0,0,5
你***奇,PLUS会员,手机很好非常满意，拿到手赶紧打开王者荣耀撸起来，流畅高清比较舒服外观那是妹的说漂亮美，裸机是不敢用的还好自带壳比较贴心，店家送的礼物也实用物流快满意~,2017-06-27 10:45:42,0,0,5
1***好,金牌会员,挺好的，就是系统好复杂，好多东西都搞不懂，,2017-08-01 01:24:49,0,0,5
y***P,金牌会员,八点多下单2499，到十点就卖2299，郁闷死了，今天刚收到货，还没用，先用的荣耀6p两年多还没坏，摔了无数次，就是内存不够，所以换了荣耀9，主要是喜欢这款的外表,2017-08-03 13:34:12,0,0,5
l***u,PLUS会员,照相真的是美的不要不要的，外行为很好看,2017-08-23 11:29:23,0,0,5
