名字,会员级别,评论内容,评论时间,点赞数,评论数,评价星级
A***7,金牌会员,新机到手有点卡顿，发热严重，下了常用软件内存就剩965m，听音乐音质有种金属感重，运行速度也没想像的快！，鲁大师跑分跑到一般就死机了！对不起四千多这个价位！,2017-04-01 21:00:32,23,10,1
j***r,银牌会员,"我就问下（前天刚在自营买的华为mate9pro ,就想问下请问手机带的那层膜是不是钢化膜？还有里面有一个小的接头是什么？）这两个问题，从到货到现在自营客服是不上班还是咋了？不回答！太令人失望",2018-01-29 17:21:26,0,0,3
j***j,PLUS会员,不错，正品,2018-03-05 11:17:54,0,0,5
心***旅,金牌会员,坑坑的曲屏,2018-03-06 15:07:59,0,0,5
j***n,钻石会员,用了几天后发现手机开屏时有时亮度有点苍白颜色不正常，息屏重新打开颜色又会正常，外包装盒正常可是里面手机盒一个交变形了，明显摔过，想买的还是考虑下吧，有问题,2018-02-28 10:29:57,0,1,3
j***d,金牌会员,商品不说了，我要说京东客服，下单是还专门填选的普通发票，结果收货了没有给普通发票，为什么是电子发票了？打电话给京东客服，百般推诿，让自己去打印发票，以后是不是下单的时候显示的完整手机，收货后没电池让自己去买？再以后屏幕电池都没有要自己去买？后来又说京东打印了寄过来，可是都过了10天了，为什么还没有收到发票呢？             果然中国企业只有在创业期才注意形象，一旦成长起来脸都不要了吗？,2018-02-22 09:53:40,0,2,1
L***N,银牌会员,真是搞不懂华为为什么要搞个不一样的充电插口，本来以前买的那台荣耀有时不够电了也能借同事的充电，接口一样嘛，换成这台之后真的很麻烦，每天上班还得带着接口，特别小，哪天丢了都不知道怎么办！？另外，屏幕为什么要做成弧形，完全不通用啊，市面上都没找到适合的钢化膜，华为要搞特殊也别这样啊，都怪我只看了参数，外形什么的没好好看,2018-01-07 22:29:56,0,1,2
呼***风,钻石会员,手机已收到，看着还可以，双曲面屏曲度不是很大，跟照片还是有一定区别。流畅度还算可以，但仍然比不上我的6S。,2018-02-25 05:54:54,0,1,3
情***7,金牌会员,手机一般吧。倒是没什么大问题，快递多花钱要9点送到，就是不给送，顺路也不给送过去。快递也是666,2018-02-22 19:00:31,0,1,3
G***7,金牌会员,手机是好的 问题是问啥里面没有发票 而且保修卡上面也没有盖章 出了问题我怎么售后???,2018-02-28 20:17:16,0,1,3
l***h,钻石会员,降价太快了吧，不到一个月降了400元，感觉好亏。送的什么破壳，没用几天就破了。,2018-03-04 06:51:57,0,1,3
j***b,金牌会员,入手感觉和图片区别很大 颜控要慎重 京东物流还是没得说 快递小哥很给力,2018-02-28 20:33:46,0,1,3
t***e,钻石会员,电量很不耐用，充满电10小时不到，几乎就用完了。是有问题吧？,2018-02-25 19:50:56,0,1,3
jdlhdfee,钻石会员,送来的是有问题的手机，手机自带膜很脏，有指纹，最搞笑的是手机本身壳体还夹根头发，就是拿一些有问题的手机糊弄消费者。京。东越来越恶心了。申请售后，就送2000京豆了事。千万别在京东买手机。,2017-11-24 07:50:53,6,1,1
charles.c_,金牌会员,手机本身初步使用没有什么问题。 但是商家为提供发票。,2018-03-08 09:23:04,0,1,3
糊***儿,PLUS会员,"才刚买半个多月就降了400,这…………",2018-02-17 20:08:44,0,1,3
k***e,金牌会员,16年旧出的手机还买这么贵，功能都和新机差好多啦,2018-01-24 20:44:57,0,1,3
K***u,银牌会员,手机还可以，但是买完第三天降价一百?。。。,2018-03-07 18:15:31,0,1,3
M***生,金牌会员,还可以,2018-03-09 09:41:59,0,0,5
血***4,银牌会员,高大上,2018-03-07 18:05:47,0,0,5
j***s,钻石会员,不错！,2018-03-06 09:50:27,0,0,5
