名字,会员级别,评论内容,评论时间,点赞数,评论数,评价星级
李***宰,金牌会员,好,2017-08-25 06:21:30,0,0,5
冯***o,PLUS会员,用了一段时间，机子很流畅，越来越喜欢华为，支持国产,2017-08-24 22:01:17,0,0,5
P***O,银牌会员,手机不错，就是这个五流太慢了手机和那个描述的一模一样，嗯，手机不错，那个，用起来特别好，就是他们的物流太慢了也,2017-08-24 21:40:53,0,0,5
y***0,银牌会员,感觉挺好。   看着很舒服。    功能很多。     挺上档次的,2017-08-24 19:08:27,0,0,5
j***6,银牌会员,手机很漂亮，功能也很好，特别是玩游戏的感觉很好,2017-08-24 13:25:12,0,0,5
然***语,钻石会员,手机很好看，上手舒服，还挺好用的，拿手上也有重量感,2017-08-24 10:49:35,0,0,5
j***y,银牌会员,手机在使用中，手感和速度都很好，很满意,2017-08-24 10:28:32,0,0,5
a***6,金牌会员,挺好用的，正品,2017-08-24 10:20:37,0,0,5
y***u,金牌会员,今收到货就验证了下真伪，一查确系正品。华为手机真心不错，已经是第四台了，从青春版到荣耀6再到现在的9，我真是华粉了。一点没有买苹果的欲望，觉得华为手机真的是良心机。,2017-08-23 23:37:04,0,0,5
丿***泊,金牌会员,用了12天，手机屏幕校准差。有时候充电的时候手机根本不用玩，新手机，屏幕校准用12天就出问题。,2017-08-23 22:34:08,0,0,1
w***1,PLUS会员,发货很快，价格适中，方便快捷。,2017-08-23 21:55:39,0,0,5
j***2,金牌会员,手机不错，很骚气，屏幕也大，非常好用。,2017-08-23 18:30:54,0,0,5
j***o,PLUS会员,很好，满意。,2017-08-23 12:59:53,0,0,5
j***风,银牌会员,合适，非常棒,2017-08-23 10:35:09,0,0,5
j***d,银牌会员,用着挺好的,2017-08-23 09:31:58,0,0,5
轩***王,金牌会员,好,2017-08-22 23:42:05,0,0,5
l***1,银牌会员,手机是正品，已经很多年没用过华为了，一直用苹果。这次用了2天的感觉，不比苹果差，有的方面还强，外观也很漂亮。比苹果售价比高。美中不足的是中了三等奖，并且怎么没有耳机送，不知道是华为抠，还是店家抠。,2017-08-22 22:07:23,0,0,5
j***e,银牌会员,头天早上下单第二天中午就到了，我只能说?????,2017-08-22 20:32:17,0,0,5
休***迷,银牌会员,不错,2017-08-22 16:37:44,0,0,5
乐***0,金牌会员,款式好，性能好，服务好。物流超给力。,2017-08-22 12:17:55,0,0,5
j***u,银牌会员,发货速度很快，颜色很正，媳妇超喜欢,2017-08-22 00:33:15,0,0,5
w***8,金牌会员,非常喜欢好，，，，，，，，,2017-08-21 22:43:16,0,0,5
j***z,金牌会员,手机收到！但没有耳机线？,2017-08-21 17:48:08,0,0,5
j***f,银牌会员,荣耀v9很好，,2017-08-21 14:52:49,0,0,5
w***6,PLUS会员,支持国货 支持华为,2017-08-21 12:46:34,0,0,5
w***6,PLUS会员,OK 华为手机 世界第一,2017-08-21 12:46:02,0,0,5
w***6,PLUS会员,OK 华为手机没的说！,2017-08-21 12:45:32,0,0,5
E***R,金牌会员,很好，非常满意,2017-08-21 11:51:13,0,0,5
2***6,钻石会员,非常一般，屏幕暗，信号差，充电慢，华为钱包还不支持退钱,2017-08-21 08:53:30,0,0,3
j***w,银牌会员,手感比想象中的要好特别指纹解锁，速度非常快比我之前用的苹果6要快支持国货，必须点赞才用一天麻，以后再追评,2017-08-21 08:26:54,0,0,5
a***2,金牌会员,非常棒！,2017-08-20 23:00:25,0,0,5
瞬***变,钻石会员,给老公新换的手机,2017-08-20 22:18:58,0,0,5
j***8,银牌会员,刚用还可以以后用用看,2017-08-20 22:10:45,0,0,5
f***5,金牌会员,好,2017-08-20 21:57:34,0,0,5
I***D,金牌会员,手机用了一段时间再评论的，用起来很快，一点也不卡，真的很棒，非常的喜欢！,2017-08-20 19:50:46,0,0,5
j***b,银牌会员,产品很好，我很满意,2017-08-20 12:39:10,0,0,5
n***湫,钻石会员,颜色很好看！降价了！,2017-08-20 12:36:51,0,0,4
徐-万-国,金牌会员,荣耀V9我想要的快，速度确实是快，虽然我拿到的是低速闪存版，而且玩王者荣耀一点都不卡，V9还是唯一一款可以开高帧率模式的华为手机,2017-08-20 12:12:50,0,1,5
爱***斯,银牌会员,手机收到了，用了一段时间，运行还可以，就是电池待机短,2017-08-20 07:49:37,0,0,5
j***d,金牌会员,手感挺好、质量看用了才知道,2017-08-20 07:22:18,0,0,5
蒙***儿,银牌会员,手机是送给老公的 手感不错 他挺喜欢的 好评,2017-08-20 00:20:03,0,0,5
秦***龍,银牌会员,手机荣耀V9.运行快，内存足够，极佳极佳。,2017-08-19 19:16:33,0,0,5
j***r,金牌会员,货收到了，款式很好，用起来运行很快。,2017-08-19 18:09:05,0,0,5
李***成,银牌会员,手感有   就是拍照不清晰,2017-08-19 17:26:45,0,0,5
x***0,银牌会员,用着不错！喜欢！,2017-08-19 14:50:09,0,0,5
泰***君,银牌会员,看视频机身会发热,2017-08-19 12:35:52,0,0,1
j***e,金牌会员,支持国产希望华为荣耀越做越好,2017-08-18 17:44:24,0,0,5
l***L,银牌会员,快递速度还可以,2017-08-18 15:58:50,0,0,5
Q***W,银牌会员,手机不怎么好，买后悔了，卡机卡的厉害，电池最多用12个小时,2017-08-18 15:15:49,2,0,1
j***k,金牌会员,很好，给老人买的,2017-08-18 10:34:56,0,0,5
a***7,银牌会员,手感挺好的，物流也快。??,2017-08-17 23:27:53,0,0,5
Y***y,钻石会员,手机非常漂亮，非常喜欢。支持国货,2017-08-17 21:22:14,0,0,5
y***m,金牌会员,反应很快，外观漂亮，顺畅手感好，很满意,2017-08-17 19:25:40,0,0,5
j***p,金牌会员,很好用，买了两个,2017-08-17 17:42:30,0,0,5
j***p,金牌会员,非常好用，很快,2017-08-17 17:42:11,0,0,5
z***i,金牌会员,昨天收到的，用着感觉挺好的，很满意。支持国产手机。,2017-08-16 13:40:11,1,0,5
w***w,PLUS会员,东西不错一直相信京东的东西，感谢一路相陪,2017-08-16 13:12:33,0,0,5
j***3,银牌会员,及格很不错 款式好看?,2017-08-15 21:52:28,0,0,5
z***f,银牌会员,手机屏幕非常容易摔碎，刚买回来就摔坏了，换屏之后又摔一次又碎了,2017-08-15 18:34:07,0,0,5
j***y,银牌会员,手机很棒，颜色配置我都很喜欢,2017-08-15 15:56:15,0,0,5
中***这,金牌会员,荣耀v9手机蓝色应该算经典主打款。4000毫安的电池在高性能的硬件待机时间也就一个白天，手机运行发的量还是蛮大的，个人感觉快充技术还是比较慢，不过6G的内存，128GB闪存，感觉明显要快很多。,2017-08-15 15:15:55,11,1,5
1***u,PLUS会员,物流快，先买了荣8，现又买9，不错，支持国货,2017-08-15 13:56:47,0,0,5
z***6,银牌会员,非常好用的手机，帮家人购的第二个V9,2017-08-15 13:07:50,0,0,5
风***秋,PLUS会员,是我想要的，送货速度也不慢，挺好的，用用再追评,2017-08-15 11:50:31,0,0,5
j***4,钻石会员,手机埏好，用了一天还行，快递有点慢，支持国货，问了客服耳机怎么没有，客服说出厂就沒有耳机，有点失望，那我只能另外在花钱买吧！,2017-08-14 23:20:40,0,0,2
小***6,金牌会员,给朋友买的，手机漂亮，不知后期怎么样,2017-08-14 20:22:28,0,0,5
j***h,银牌会员,不错速度快挺好,2017-08-14 18:34:19,0,0,5
1***7,金牌会员,哈哈哈哈哈哈哈,2017-08-14 09:33:20,0,0,5
j***4,PLUS会员,京东服务快又好，红色手机赠佳人!,2017-08-13 22:17:34,0,0,5
X***生,PLUS会员,很好，没有问题,2017-08-13 20:48:52,0,0,5
赵***红,银牌会员,用了几天才来评价不错，挺不错的一款手机！,2017-08-13 20:43:33,0,0,5
明***g,金牌会员,蛮好的，实用,2017-08-13 19:04:17,0,0,5
j***b,金牌会员,非常棒，手感好，喜欢,2017-08-13 18:48:47,0,0,5
茉***p,金牌会员,第一次在网上买手机，这次网购成功！手机高大上，拍照很清晰，很好用，颜色款式都很喜欢！还送了五款赠品，很划算！京东值得信赖！好评！,2017-08-13 16:47:54,0,0,5
x***梁,银牌会员,用了半个月才来评论，手机很顺畅，超赞,2017-08-13 13:50:55,0,0,5
x***1,银牌会员,指纹解锁很灵敏。,2017-08-12 18:28:59,0,0,5
i***1,金牌会员,货真价实的产品。,2017-08-12 17:38:49,0,0,5
瀚翔0013,金牌会员,V9竟然只有这么点改进，居然只是内存大点，CPU好那么一点点。。。屏幕和分辨率居然没变，太失望了。。。,2017-08-11 21:05:55,0,0,3
z***阳,银牌会员,很好，很实用,2017-08-11 16:56:07,0,0,5
n***g,PLUS会员,不错买了好几个了,2017-08-11 07:58:43,0,0,5
侯***国,银牌会员,收到了非常好,2017-08-10 22:30:02,0,0,5
l***o,银牌会员,支持国货，用了几天了，确实没有卡顿，希望真能保持500天不卡顿，后置双摄拍摄很赞，总体还是很满意的,2017-08-10 16:58:09,0,0,5
1***4,金牌会员,用的舒服，使用方便！,2017-08-10 10:21:01,0,0,5
x***w,钻石会员,一如既往的好，音质，像素也不错,2017-08-10 02:57:07,0,0,5
j***y,银牌会员,收到产品配件齐全无损，用了段时间装了很多款软件一样很爽，点功拖功速度很爽快，好棒。,2017-08-09 19:18:57,0,0,5
1***p,PLUS会员,手机用了两个多月了，整体感觉还不错哟,2017-08-09 12:49:20,0,0,5
j***0,钻石会员,什么破手机那回来就有问题三千多的手机没有我己前一仟元的手机好用！,2017-08-09 12:37:21,0,0,2
j***伍,PLUS会员,反应速度还可以，就是有一点发热,2017-08-09 11:17:48,0,0,5
4***6,金牌会员,收到货了感觉还不错，拍照效果不错，但是速度慢，手机颜值没问题,2017-08-08 19:50:18,0,0,5
w***9,金牌会员,送货到家，服务不错,2017-08-08 16:21:04,0,0,5
h***e,PLUS会员,产品不错，买给老婆的，她很喜欢。至于质量，我一直对华为产品有信心，除非不是华为正品。开始都是运行很快，没有卡顿，拍照以及音乐功能都挺不错。不过，电子产品都是在用过一段时间后才知道真正品质。那就要用一段时间后才知道，后面再来补评价，拭目以待。,2017-08-08 15:45:25,0,0,5
o***K,银牌会员,游的太慢了,2017-08-08 15:20:59,0,0,5
j***6,银牌会员,挺好的！！！！,2017-08-08 11:31:25,0,0,5
j***e,银牌会员,荣耀v9名不符实，承蒙华为水军的功劳，我买了荣耀v9顶配版，拍照惨不忍睹、信号一般，讨厌的虚拟键尽管能隐藏，看起来就是千元机的模样，再也不买华为.,2017-08-08 08:05:27,2,0,2
爱***己,PLUS会员,运行流畅，造型美观，128G容量够大，可以装多少内容了,2017-08-07 23:03:39,0,0,5
j***i,银牌会员,据说mate10价格不菲，所以买个荣耀v9来压压惊,2017-08-07 16:38:07,0,0,5
j***゜,银牌会员,很流畅，很好看,2017-08-07 09:45:07,0,0,5
O***k,银牌会员,宝贝很满意，是我羡慕中的那款，给五星,2017-08-07 08:20:44,0,0,5
j***a,银牌会员,玩个贪吃蛇的有点卡你说手机也有点发烫了。,2017-08-07 06:57:31,0,0,4
j***z,金牌会员,最近有点忙，没时间来评价，质量不错很好！下次还买。,2017-08-07 06:26:13,0,0,5
j***9,PLUS会员,不错！！！！！！！！！！！！！,2017-08-06 17:38:29,0,0,5
j***b,银牌会员,手机很好，颜色漂亮。,2017-08-06 16:35:13,0,0,5
吴***3,银牌会员,宝贝收到，效果很棒，喜欢的赶紧抢单吧。,2017-08-06 15:11:30,0,0,5
j***x,银牌会员,红色的很好看，很舒服的红色，颜值很高，适合女生购买,2017-08-06 14:00:34,0,0,5
千***泡,银牌会员,运存被系统就占了一多半，还有就是感觉太大了，还有点发烫。不过总体来说还是满意的，开始给我发错膜了，服务很好马上就说给我补发，等用短时间再来追加,2017-08-06 09:34:34,0,0,5
q***金,金牌会员,非常满意的手机及送的礼物,2017-08-06 09:17:17,0,0,5
1***c,钻石会员,挺好，颜值高，性价比高,2017-08-06 01:13:49,0,0,5
丿***兜,银牌会员,用了一段时间了，感觉这手机真心好用，就是物流信慢了点，四天才到货,2017-08-05 22:20:24,0,0,5
u***1,金牌会员,用的还可以,2017-08-05 17:32:46,0,0,5
李***9,银牌会员,手机不错，就是充电有点....还有送的指环都是坏的，染色都掉了.充电要2多-3个小时.不过我2手机还行.,2017-08-05 10:41:19,4,1,5
j***?,银牌会员,还可以。。。。,2017-08-05 10:24:32,0,0,5
众***香,钻石会员,好看好用值得购买,2017-08-05 07:53:39,0,0,5
迷***皮,金牌会员,买给朋友的，不知道怎么样,2017-08-05 00:00:05,0,0,3
j***y,金牌会员,很不错的手机，流畅不卡，很喜欢,2017-08-04 17:20:25,0,0,5
j***u,银牌会员,手机很不错，一点都不卡，非常好用。,2017-08-04 11:33:28,0,0,5
龙少007,钻石会员,昨天下单，今天到手。不错啊！是正品，用用后续追加评论！,2017-08-04 10:53:12,0,0,5
w***3,金牌会员,手机第二天就收到了，就是底下按键的问题，如果可以把最底下利用起来就好了，用虚拟的操作起来不舒服。之前用三星，所以感觉这个设计还是欠缺。其他都还好。,2017-08-03 22:26:11,0,0,5
隐***言,金牌会员,手机质量很好.各项功能使用流畅.很喜欢。产品很好.质量不错值得购买五星好评。,2017-08-03 20:58:26,0,0,5
j***c,金牌会员,为什么手背面才玩一会儿就很烫，好不好以后在评，,2017-08-03 11:27:55,0,0,5
幻***y,金牌会员,很好的手机！！！,2017-08-02 23:44:26,0,0,5
j***0,银牌会员,很好用！快！靓！正！,2017-08-02 20:37:55,0,0,5
jd_186886fdy,银牌会员,手机很靓，网速反应快，快递特别快，昨天下午下单，今天上午就收到了，飞一般的速度。只是送的礼物真的无语。,2017-08-02 11:39:39,0,1,5
j***v,金牌会员,给爱人买的，以前用华为，所以这回还买了华为。,2017-08-02 07:49:48,0,0,5
d***Q,银牌会员,还不错，手机用了一天多才没电,2017-08-02 06:13:39,0,0,5
微***情,银牌会员,质量很不错，手感很顺，触感一流，屏幕很大很好看,2017-08-01 18:08:57,0,0,5
j***1,银牌会员,很满意！赞?赞?赞?！、,2017-08-01 13:10:16,0,0,5
y***n,金牌会员,一颗星都不给，刚买就跌价，,2017-08-01 12:25:03,0,2,1
E***福,银牌会员,自己用的，选了一个火焰红，红色代表红红火火！手机性能很好，用起来很顺溜。是正品，系统什么都好，唯一不好的一点就是电池虽然4000毫安，但是好像很快就要充电！,2017-08-01 11:44:42,8,1,5
f***2,PLUS会员,高配版手机，到手外观做工很棒，红色颜色是蛮喜欢的那个颜色。系统运行速度很快。唯一缺点就是有点小贵。现在华为定价都这么高了，以后用不起了啊,2017-07-31 21:59:02,0,0,5
A***o,PLUS会员,手机很漂亮 非常流畅,2017-07-31 18:09:56,0,0,5
叶***3,银牌会员,好用，快递及时。,2017-07-31 09:23:51,0,0,5
jd150113mxv,钻石会员,大小合适，也漂亮，就是送的这个磨太次，其他的都好,2017-07-31 08:23:58,0,0,5
捏***鱼,金牌会员,超级快的，而且自拍很清楚。,2017-07-30 23:01:24,0,0,5
j***原,PLUS会员,手机收到了，很炫很不错。又回到华为啦,2017-07-30 19:20:27,0,0,5
擦***3,金牌会员,还不错，用起来挺好，屏幕大耗电也快，比v8优化很多，外观设计，重量，软件系统等都增加了优化了,2017-07-30 02:40:50,0,0,5
q***e,银牌会员,一如既往的好,2017-07-29 14:51:39,0,0,5
孙***明,银牌会员,刚收到还没用，等以后追加评论吧,2017-07-29 09:02:37,0,0,5
s***k,金牌会员,手机与描述一致，初步试用不错，照相效果好。5分,2017-07-29 07:04:08,0,0,5
5***8,金牌会员,手机用着感觉不错 大红色喜欢 耳机也很好用 大赞,2017-07-29 00:47:45,0,0,5
f***菲,金牌会员,外观漂亮，只是充电的时候机身会很热，很烫的感觉，担心会不会爆掉，,2017-07-29 00:20:38,0,0,5
荆***迪,银牌会员,1手机描述的电池容量很大其实不耐用，2玩一会就是发烫.不知道产品就这样还是运气不好,2017-07-28 23:00:52,2,1,1
S***子,钻石会员,手机还可以，用用在看,2017-07-27 21:53:56,0,0,5
鱼***y,银牌会员,手机很好看，很薄，手感也很好，朋友都推荐说华为很好，第一次用华为的手机，在印象中安卓系统的手机后面都会卡，习惯苹果系统一会还不大适应，不过真的很好用，一点儿都不卡，机器发热比苹果稍微好些，性价比绝对比苹果高呀！128G想下什么下什么，充一次电可以玩一天！满意！,2017-07-27 16:11:07,0,0,5
j***c,银牌会员,第一次购买用了不到一个月就被小偷了，很郁闷，但觉得手机好用，所以第二次买了，店家发货很快，态度也好。,2017-07-27 15:31:14,0,0,5
我***吗,银牌会员,手机不错，该买红色的，金色有时候阳光照射的时候像玫瑰金,2017-07-26 23:26:33,0,0,5
姜***龙,金牌会员,赠送的东西太差了，手指环也是坏的，充电器数据线还很硬，送的保护膜更不知道是什么东西？,2017-07-26 20:30:38,0,0,5
j***k,银牌会员,才买了一个多星期，手机明显变慢了，更可气的是屏幕偶尔会失灵，点这着没有用，联系大家还是去华为直营或者京东自营去买，毕竟质量能有保证。,2017-07-26 16:45:18,3,0,1
d***F,银牌会员,怎么耳塞都没有,2017-07-26 13:59:04,0,0,5
明***好,银牌会员,荣耀很不错的，用了很久才来评单,2017-07-26 13:08:12,0,0,5
l***u,金牌会员,手机很漂亮，很喜欢,2017-07-26 07:38:36,0,0,5
B***3,金牌会员,玩儿王者荣耀666特效全开没问题，只是耗电量略大,2017-07-26 04:15:48,0,0,5
j***t,银牌会员,其他的都不错，就是手机膜不好了，根本贴不上，总体还不错物有所值,2017-07-26 00:20:42,0,0,5
j***5,钻石会员,用起来还行，手感还好.华为不错.后面有问题在来追评,2017-07-25 20:47:44,0,0,4
蓝***牛,金牌会员,外表很美，很满意，但不知道好用不好用，用了后再来,2017-07-25 14:15:27,0,0,5
x***6,钻石会员,还在用之中，等待评价,2017-07-25 12:22:17,0,0,5
j***u,金牌会员,颜色很好看，物流很快,2017-07-25 11:01:29,0,0,5
w***0,PLUS会员,手机我很喜欢，特别是屏幕，电池4000毫安基本上一天都不用充电,2017-07-25 10:04:24,0,0,5
官***水,钻石会员,非常不错，值得拥有！,2017-07-25 09:49:43,0,0,5
疯一样的蓝人,银牌会员,不错的?,2017-07-24 18:21:57,0,0,5
耀哥---,钻石会员,手机不错。手感很好 而且也不贵,2017-07-24 15:47:20,0,0,5
j***u,金牌会员,刚上手，用几天在评价,2017-07-24 12:42:06,0,0,5
S***R,银牌会员,特别漂亮的手机，特别炫,2017-07-24 09:58:33,0,0,5
j***5,银牌会员,手机正品，值得拥有。,2017-07-23 20:55:58,0,0,5
阿***8,银牌会员,游戏反应还是有点延迟，有点小发热。用了一段时间才发现是主屏幕不够平，贴钢化膜不能完全贴紧、靠！不知道为什么！,2017-07-23 12:15:16,0,0,3
矿***元,钻石会员,手机用起还可以，就是时常都在发热，求解？？究竟是质量问题还是本身问题,2017-07-23 11:44:44,1,0,3
想***子,金牌会员,今天收到手机，儿子非常高兴，手机非常漂亮，精致，大气。这是给孩子的奖励，儿子非常满意，特别是那个VR。好评。,2017-07-22 18:57:16,0,0,5
j***t,PLUS会员,"送的纳米贴膜很差劲，没有耳机。
充电快，电池耐用，一天是绝对够用的不用充电。摄像也不错，偶尔有卡顿现象",2017-07-22 15:47:06,0,0,5
j***p,金牌会员,国产品牌也很好，支持国货,2017-07-22 13:14:58,0,1,5
j***3,金牌会员,用的不错，专门过了一段时间评价的,2017-07-22 09:57:51,0,0,5
常***华,钻石会员,手感不错很满意,2017-07-22 09:23:52,0,0,5
1***p,银牌会员,虽然是emmc，但还是在接受范围之内的，但为什么防爆膜变成了软膜！！！难受?,2017-07-21 19:19:54,0,0,3
j***s,银牌会员,红色最喜欢的颜色。还送了耳机。现在手机拿到好几天了。才来评价，现在感觉手机功能不错。。值得推荐。。。京东物流也不错。。。,2017-07-21 16:07:15,0,1,5
j***p,银牌会员,"外观漂亮，运行速度挺快的。就是要求开发票的，今天也没有到。联系了商家，态度还可以，说是给开的。等待中。拿到以后再追评。
    因为是朋友在网上帮我买这款，不知道是带了钢化膜和指环的，今天来评价才看到商家是没给我发钢化膜和指环。另外这款机子发热厉害，看视频看的小心翼翼的，介意的朋友请慎重。",2017-07-21 16:03:28,0,0,4
j***o,金牌会员,目前看来很不错,2017-07-21 13:56:00,0,0,5
j***3,银牌会员,手机很漂亮，手感非常好，快递也超快，就是第一次用华为操作还不怎么熟练，要是能把指纹识别放前面就完美了。,2017-07-20 22:34:52,0,0,5
5***惚,银牌会员,系统可以，操作很流畅，好评啦,2017-07-20 19:28:58,0,0,5
轩***冥,银牌会员,我非常满意！,2017-07-20 18:01:21,0,0,5
j***x,银牌会员,还没有用，但愿不错，物流挺快的,2017-07-20 08:18:37,1,0,5
天***7,银牌会员,物流挺快的，手机用了几天，总体感觉来说挺不错的的，值得拥有,2017-07-20 00:16:03,0,0,5
请***子,金牌会员,非常好 正品 没开封 送给妈妈生日礼物。妈妈超级喜欢??,2017-07-19 18:15:48,3,0,5
你***货,银牌会员,和描述的一样   很好,2017-07-19 10:28:40,0,0,5
OqmyaiGmTDvt,银牌会员,感觉挺好的卖家态度非常好,2017-07-19 10:07:12,0,0,5
d***7,银牌会员,东西不错，摄像头清晰，反应速度很快，整体外观漂亮，但是运行游戏（比如王者荣耀）一小时之后会出现轻微卡顿，请完善处理器、散热功能。,2017-07-19 10:01:19,0,0,4
j***1,金牌会员,可以啊，不错的选择，值得一试,2017-07-19 09:05:19,1,0,5
q***4,金牌会员,颜值还行，反应速度略低于同等价位的手机，中规中矩，拍照我就不说了，大家自己看吧，图1是荣耀V9，图2是2012年出产的诺基亚808。,2017-07-19 01:18:14,1,0,5
z***6,银牌会员,是喜欢的颜色，手感挺好的！质量得用过后才知道了,2017-07-18 23:35:06,0,0,5
j***9,银牌会员,用起来感觉不错，发货速度也很快的,2017-07-18 17:19:13,0,0,5
卸***痛,银牌会员,还不错，目前正在使用，如果好用的话会追加的,2017-07-18 16:47:22,0,0,5
风***雨,银牌会员,嗯，手机包装挺好，嗯物流就是物流稍微有点慢,2017-07-18 14:45:22,0,0,5
乜***伱,银牌会员,颜色看了比较喜欢,2017-07-18 10:40:06,0,0,5
w***5,银牌会员,很好的东西，值得拥有。,2017-07-18 08:33:06,0,0,5
P***6,金牌会员,三千多的还是卡，我也是醉了,2017-07-17 19:28:51,0,0,5
E***啦,金牌会员,手机很酷，操作比较人性化，画质清新，就是视频时画质一般,2017-07-17 17:10:51,0,0,5
j***0,钻石会员,手机好漂亮。是正品。气根包装好安全。非常满意。还送咗很多小礼品。,2017-07-17 14:25:11,5,0,5
l***5,金牌会员,做工比较精细，手感好，运行快，值得拥有。,2017-07-17 10:40:07,0,0,5
N***o,金牌会员,好…………………………,2017-07-17 09:25:22,0,0,5
末***油,银牌会员,"真的好无语，手机听筒有问题，中奖了，跟客服沟通后就开车一个小时去到官方店，然后被告知有问题也不能马上换机，要等一个星期，大哥，我是地球人没有手机会死的！不知道是为什么要因为你们的质量问题我来买单，最后又买多了一部替用，等新手机到就把这台退货，希望不会再次中奖吧，看有些评论说后面的机子是正品但是有次货，我不信然后买了，但事实可以证明好多东西，也不知是否存在店大欺客，且行且珍惜吧！
                           （一个什么都不懂又矮又穷又挫的小白字）",2017-07-16 22:56:31,3,0,1
j***w,金牌会员,手机还可以太重了，平时也不怎么用，拍照挺清晰，别的没发现什么毛病,2017-07-16 22:36:48,1,0,5
j***1,金牌会员,用着可以，感谢老板,2017-07-16 20:34:29,0,0,5
a***p,金牌会员,宝贝拿到手，打开跟描述一样，真正是我心宜的一款手机！支持国产品牌！！做到真正具有中国品牌，让每个国人都拥有国产手机,2017-07-16 12:08:16,10,0,5
5***K,金牌会员,手机用着不错，支持国产华为,2017-07-16 00:38:19,0,0,5
j***e,PLUS会员,好用正品、电池耐用,2017-07-15 21:16:30,0,0,5
j***z,银牌会员,今天刚到，很喜欢，就是送的贴膜不怎么样，被扔掉了,2017-07-15 20:42:44,1,0,5
大***曾,银牌会员,手机用了一段时间，不错,2017-07-15 16:16:50,0,0,5
j***f,银牌会员,因为第一次购买，问了售后很多问题，售后都一一耐心解答了。态度很好，发货很快。手机很漂亮，等使用一段时间再评价一次。反正喜欢的不得了！,2017-07-15 14:35:25,0,0,5
j***9,银牌会员,东西非常好，比官网还好，是一等奖，虽然不影响，但是还是很开心,2017-07-15 10:52:58,2,0,5
j***a,银牌会员,反应快，商家好,2017-07-15 09:46:19,0,0,5
j***7,银牌会员,不多说了，漂亮，好看,2017-07-14 23:56:42,0,0,5
q***q,银牌会员,可以非常好用,2017-07-14 17:26:12,0,0,5
j***c,银牌会员,目前还可以。。待后续使用,2017-07-14 14:48:41,0,0,5
E***g,PLUS会员,挺好用的，目前不卡。,2017-07-14 10:13:10,0,0,5
林***8,金牌会员,感觉挺好 速度性能 都不错,2017-07-14 08:33:47,0,0,5
