名字,会员级别,评论内容,评论时间,点赞数,评论数,评价星级
j***k,PLUS会员,好,2018-03-10 01:24:40,0,0,5
t***o,PLUS会员,好,2018-03-09 18:00:47,0,0,5
j***4,金牌会员,好,2018-03-09 07:26:54,0,0,5
J***G,PLUS会员,好,2018-03-08 19:41:27,0,0,5
m***n,钻石会员,好,2018-03-06 20:52:36,0,0,5
j***6,银牌会员,好,2018-03-06 20:05:39,0,0,5
O***Q,银牌会员,京东快递给力，手机总体来说还可以，毕竟一分钱一分货，玩王者荣耀不咋的，商家没赠品，钢化膜都没送，差评，送的手机壳太滑，直接摔地上,2018-03-07 10:02:39,0,0,4
j***f,金牌会员,给老婆买了个6加64的荣耀V9，用了一天半败家娘们就给丢了，一天半，丢了！我也是醉了，想再买一个可是京东居然到今天都没货，这里差评一下，刘总抓紧进货啦……只好先买这个过度一下，老婆说用着也挺好，屏幕尺寸刚刚好，比较适合女人用！,2018-03-08 20:34:35,0,0,5
j***i,银牌会员,差评！京东自营店退货服务太垃圾了！我二月七号的退货一直到三月四号中间我打了五次客户服务电话才给我做退款处理，而退货一直在服务站装箱不动,2018-03-05 17:18:12,1,1,1
jd_177829mxw,银牌会员,刚收到手机，先不说手机咋样，就配的那个手机壳吧，质量差到没法说，第一次买华为手机，没想到会是这么不愉快的一次购物，差评。。。,2018-03-05 16:48:22,0,1,1
j***j,银牌会员,"我真是一颗星都不想给
垃圾华为  亏我全家用华为
你这垃圾华为垃圾
我不想骂你
你这垃圾要我怎么支持你
第一次买后面居然有个坑，掉漆，华为质检你tm吃**大的吗去你mb垃圾华为质检赶紧倒闭吧亏我支持你相信你
后来换货***屏幕有坏点tnnd。
垃圾华为垃圾华为华为倒闭华为倒闭吧
我不是水军不是谁派来的欢迎采访我真是你mmb
华为去死吧就应该禁售你
连续两次质量问题啊这么小概率我这辈子没遇到过居然遇上了真是垃圾华为垃圾华为垃圾华为去死华为华为早点盗版吧祸害中国手机市场去死吧华为妈的死华为死华为死华为死华为死华为死华为死华为真的气死人了
没法忍你知道吗
人生第一次差评给你了华为祝你早日倒闭吧",2018-03-02 20:25:07,0,0,1
j***5,银牌会员,像素差，速度表差，差评,2018-03-09 23:23:17,0,0,1
j***z,金牌会员,拍照好看，美颜效果好，屏幕分辨率高，总之，是我喜欢的，跟想象中的也一样,2018-03-05 19:28:26,0,0,5
瑜***羽,PLUS会员,手机很惊艳，华为手机越来越好了。推荐,2018-03-05 19:25:49,0,0,5
j***h,银牌会员,真心不想给4星，手机打游戏发烫，电也不够用，我还没打电话，放家一天就20%电了，手机膜自己贴的。再用两天不行就退！,2018-03-05 19:21:46,0,0,4
T***o,钻石会员,质量不错，买来送老人用,2018-03-05 19:16:14,0,0,5
j***k,银牌会员,手机不错，很好看，很喜欢,2018-03-05 18:22:51,0,0,5
小阳努力,银牌会员,用了几天还行，就是相机我玩不转，希望客服主动教我一下,2018-03-05 18:16:53,0,0,5
j***l,银牌会员,非常好，特别喜欢，刚买三天就丢了，又买了一部黑色！,2018-03-05 18:13:57,0,0,5
u***g,银牌会员,给老人买的备用机，还行！,2018-03-05 18:13:30,0,0,5
jd_偶像之路,PLUS会员,华为的手机不愧是大品牌，很美观手感很舒服，客服也很棒，很喜欢，支持国产,2018-03-05 18:05:09,0,0,5
造***哥,金牌会员,收到了，更漂亮，物流也快,2018-03-05 17:57:42,0,0,5
1***p,钻石会员,手机不错，反应很快,2018-03-05 17:56:09,0,0,5
薰***2,银牌会员,上午下单，下午就到了，京东真是挺快的，手机外观精美，手机还没用，希望性能很好。,2018-03-05 17:52:39,0,0,5
j***v,金牌会员,东西可以  买给爸爸的    可以   不错不错  是新货666,2018-03-05 17:33:38,0,0,5
丶丶Jcc,钻石会员,给妈妈买的，学习使用微信，现在用的差不多了！挺好的，像素不错，视频聊天很好。,2018-03-05 17:33:32,0,0,5
s***0,银牌会员,Nova1被偷了之后，买了nava2?，小巧的女士手机，我喜欢！感觉2没有1好用，拿起来手感也没那么好。。。用了一个月之后再来评价，反应系统好像有点卡呀，尤其相机，常常反应迟钝的样子。。。有改进空间哈，希望华为越来越好，支持！,2018-03-05 17:33:27,0,0,5
s***j,钻石会员,用了几天才来评价的，整体感觉还可以，但是有些小问题很恼火，尤其是SIM卡的卡槽，简直无力吐槽，材质太软。还有电池，电池完全不像是2950mAh的用起来耗电量太快。还有操作系统，通知的开关简直就是个玩笑，不管你开还是关，APP的通知不会理睬这个开关。一句话总结将就着用。,2018-03-05 17:25:06,0,1,2
REX-KG,钻石会员,还好，颜值还是可以的,2018-03-05 17:21:13,0,0,5
j***w,银牌会员,超级不错 不过运行内存实在有点小了 才2.2G,2018-03-05 17:20:06,0,0,5
j***i,银牌会员,差评！京东自营店退货服务太垃圾了！我二月七号的退货一直到三月四号中间我打了五次客户服务电话才给我做退款处理，而退货一直在服务站装箱不动,2018-03-05 17:18:12,1,1,1
夜***娆,银牌会员,手机不错，就是过年时买的的，物流晚到了好几天,2018-03-05 17:17:15,0,0,5
j***2,银牌会员,物流快一天就到！拿到手机后和网上的一样很不错挺喜欢的,2018-03-05 17:16:16,0,0,5
BT-99,PLUS会员,很实用,2018-03-05 17:01:30,0,0,5
j***b,银牌会员,最快的送货速度真的不是一般的快，最喜欢的物流，京东物流。,2018-03-05 16:54:51,0,0,5
jd_177829mxw,银牌会员,刚收到手机，先不说手机咋样，就配的那个手机壳吧，质量差到没法说，第一次买华为手机，没想到会是这么不愉快的一次购物，差评。。。,2018-03-05 16:48:22,0,1,1
a***n,金牌会员,女儿的第一部手机，孩子挺喜欢的，送货也挺快,2018-03-05 16:47:38,0,0,5
疯***牛,金牌会员,不错的手机，外观好看，配置好，抢了好久才抢到,2018-03-05 16:35:18,0,0,5
糖***甜,铜牌会员,一般般，前置摄像头没有1200，戳心，不是很满意,2018-03-05 16:34:34,0,0,5
l***1,金牌会员,手机很好用,2018-03-05 16:34:29,0,0,5
葫***雀,PLUS会员,质量不错 物流快 卖家服务很好 满意,2018-03-05 16:27:43,0,0,5
J***店,钻石会员,好，非常好，特别的满意。,2018-03-05 16:26:39,0,0,5
y***0,金牌会员,手机运行比较快，现在再也不用担心内存不足了,2018-03-05 16:25:07,0,0,5
j***w,银牌会员,华为手机值得信赖,2018-03-05 16:24:26,0,0,5
j***m,金牌会员,还可以，就是电池不耐用,2018-03-05 16:11:11,0,0,4
z***m,PLUS会员,帮人买的 还不错,2018-03-05 16:00:48,0,0,5
记***t,银牌会员,很不错，反应也快，等待使用几天的效果,2018-03-05 15:52:32,0,0,5
此***丽,钻石会员,刚收到货，看起来不错，后续追加评价,2018-03-05 15:43:51,0,0,5
孤***村,银牌会员,送妈妈，不用太贵的，这个价位蛮好，,2018-03-05 15:34:20,0,0,5
M***O,银牌会员,还可以,2018-03-05 15:29:02,0,0,5
大***奇,铜牌会员,非常满意,2018-03-05 15:28:05,0,0,5
j***0,铜牌会员,屏幕比预期小，，还不错，喜欢小巧手机的可以选择,2018-03-05 15:20:39,0,0,5
张***i,PLUS会员,物流特解快，当天上午购买的，下午送到的，产品打开包装后，是正品，买了是自己联系业务用的，一直相信华为的品牌。,2018-03-05 15:18:51,0,0,5
j***d,银牌会员,还行,2018-03-05 15:16:27,0,0,5
无***对,PLUS会员,网上买电子产品，只信任京东！,2018-03-05 15:13:02,0,0,5
k***k,PLUS会员,"给妈妈买了一个，又给自己买了一个。
性价比很高，尺寸很合适。
太大的手机用着不方便，还是这个尺寸合适。",2018-03-05 15:03:49,0,0,5
兔***子,钻石会员,过年买的，用了一个月把，卡的很，难用！拍照功能也不好，颜色太假了，主要是我的大屏手机用的手疼买一个小的用，很一般很一般很一般。,2018-03-05 14:57:31,0,0,5
旺仔-fighter,银牌会员,快递真心给力，手机也挺漂亮的。小巧玲珑，系统挺流畅。有其他问题在追评,2018-03-05 14:52:50,0,0,5
j***1,金牌会员,手机很好,2018-03-05 14:51:00,0,0,5
j***c,银牌会员,外观不错，128G的内存，微信再多的单也不怕错过了，运行速度不卡很快。,2018-03-05 14:50:44,0,0,5
j***j,银牌会员,物流超快，刚回来，看着是原装正品，,2018-03-05 14:36:33,0,0,5
p***6,金牌会员,手感不错，系统流畅性可以，喜欢小屏手机,2018-03-05 14:28:41,0,0,5
j***7,银牌会员,用了几天，还可以，更新了一下系统，也还不错，目前比较满意！但是不能红包设置，让我错过了很多红包,2018-03-05 14:18:18,0,0,5
j***f,铜牌会员,非常美观大气，比苹果6好看，拿在手上很有感觉。,2018-03-05 14:13:12,1,0,5
n***0,银牌会员,特意用了一个月才来评价，确实不错，速度很快，也不卡，好评。,2018-03-05 14:10:02,0,0,5
j***2,银牌会员,手机用的不错，就喜欢这么大的。,2018-03-05 14:06:05,0,0,5
祥***记,银牌会员,不错,2018-03-05 14:05:20,0,0,5
s***6,银牌会员,总让我感觉手机是被人退回来换的那种  耳机 充电器包装盒很乱,2018-03-05 13:47:03,0,0,5
j***b,银牌会员,不错 大气体面,2018-03-05 13:45:41,0,0,5
j***6,钻石会员,外观很好看，系统也很棒,2018-03-05 13:42:35,0,0,5
e***i,PLUS会员,还行吧 华为就那么回事,2018-03-05 13:37:44,0,0,5
欢***l,金牌会员,手机我用了一个月了，手机运行也可以打游戏也不卡,2018-03-05 13:33:12,0,0,5
h***3,PLUS会员,手机性能不错，挺好用的，运行速度挺快。,2018-03-05 13:32:10,0,0,5
雪***蛾,钻石会员,用了一段时间，很好用,2018-03-05 13:13:36,0,0,5
j***4,铜牌会员,别的不说，只是比较卡，相机最卡，软件打开较多情况下，有卡顿或乱跳情况。个人觉得性能比不上我上一个米5。但是外型和手感堪称完美。,2018-03-05 13:11:29,0,0,4
xnBad-Boy,金牌会员,京东快递速度一贯快，昨天晚上买的，今天中午就到了，黑色也很漂亮，大小刚合适，等用段时间再来追加评论,2018-03-05 13:08:13,0,0,5
最***粒,银牌会员,发货速度很快哦！买给妈妈的，她很喜欢，买了plus大屏幕1999元，手机操作速度也很快。华为还自带送了一个透明壳。就是想吐槽一下拍照片，自带的磨皮效果有点过头了，挺白的，其他都无可挑剔。,2018-03-05 13:07:50,0,0,5
双***爱,金牌会员,喜欢的颜色,2018-03-05 12:49:52,0,0,5
千***d,钻石会员,5英寸屏幕单手正合适，外观圆润。,2018-03-05 12:41:40,0,0,5
j***o,铜牌会员,此手机巴适反应特快，比我想像中还好，没想到网上能买到这么好的商品，所以平五分,2018-03-05 12:28:49,0,0,5
j***z,铜牌会员,物流特别快，昨天晚上九点半下单，今天早上七点半就到了。使用感也很好！,2018-03-05 12:28:28,0,0,5
e***b,金牌会员,从苹果5S换成国产手机，首先在外观上觉得太大，但是国产手机几乎都是这么大屏的。另外，使用了好几年的苹果，突然换成安卓，还是蛮不习惯的。琢磨好几天，基础操作才算学会。不过说句实话，华为手机做得确实不错，不比苹果差,2018-03-05 12:23:28,0,0,5
郑***D,PLUS会员[试用],买给家人的手机不错,2018-03-05 12:23:06,0,0,5
A***花,银牌会员,给自己买的，老公给抢走了，真的很好以前用的三星，感觉比三星好很多，支持国产！,2018-03-05 12:21:52,0,0,5
T***E,金牌会员,外观不错，系统运行很快，如果能够指纹开机就更好了，摄像好像没有想象中的好，聚焦不完美，也许是我的使用技巧问题。,2018-03-05 12:13:48,0,0,5
j***h,银牌会员,很不错,2018-03-05 12:08:53,0,0,5
冰***7,银牌会员,物流速度很快，给老爸买的，非常喜欢，挺大气,2018-03-05 12:08:31,0,0,5
q***4,银牌会员,配送快，包装完整，用过之后再来追评，购物就选京东！,2018-03-05 12:04:47,0,0,5
京***艺,PLUS会员[试用],用起来还可以哦。手感不错刚刚好。而且价钱也不贵。是正品,2018-03-05 11:55:18,0,0,5
x***0,金牌会员,快递挺快的。上午下单下午就到了，手机用着也可以,2018-03-05 11:50:59,0,0,5
j***外,银牌会员,当天付款当天到，比预计还要提前，手机也是正品，很满意,2018-03-05 11:38:11,0,0,5
z***3,钻石会员,速度很快，运行速度也快，这是我买的第五个华为了,2018-03-05 11:25:24,0,0,5
肥***3,银牌会员,第一次在东京购物，太赞了！无论是送货还是服务都很赞，以后会继续支持！,2018-03-05 11:12:21,0,0,5
谷***江,钻石会员,手机很满意，是正品，外观很漂亮，手感很不错，功能也齐全。,2018-03-05 10:58:04,0,0,5
西***风,PLUS会员,此用户未及时评价，系统默认好评。,2018-03-05 10:52:08,0,0,5
b***E,金牌会员,手机非常好很喜欢,2018-03-05 10:50:12,0,0,5
3***U,金牌会员,用了不到2个月就用不了啦，而且音量按键也坏了，实在太好了，又可以换手机啦，京东用不起了,2018-03-05 10:43:27,0,0,5
文***1,PLUS会员[试用],这两试用还可以，功能各方面都不错的。,2018-03-05 10:31:46,0,0,5
j***e,银牌会员,好评,2018-03-05 10:27:09,0,0,5
j***2,金牌会员,屏幕大小刚适合，用着挺好的，已经用了一段时间了，感觉挺不错的一款手机,2018-03-05 10:24:18,0,0,5
康***源,银牌会员,不错，很好用，速度快，,2018-03-05 10:19:30,0,0,5
z***o,钻石会员,买了没两天就降价20,2018-03-05 10:17:51,0,1,1
j***d,金牌会员,除了感觉有点小  是自己没看仔细 其他都很满意,2018-03-05 09:52:28,0,0,5
j***p,银牌会员,挺好用的，第一天下单，第二天就到了，,2018-03-05 09:52:07,0,0,5
l***h,金牌会员,整体还可以,2018-03-05 09:48:27,0,0,4
j***f,铜牌会员,手机收到了，大小刚好，买的玫瑰金的很漂亮，性能怎么样用过一段时间在来评论！,2018-03-05 09:46:20,0,0,5
d***1,PLUS会员,自营发货快，手机漂亮，系统流畅，指纹灵敏。,2018-03-05 09:43:40,0,0,5
j***o,银牌会员,好用手感很好，5.0感觉有点小，现在的说明书越来越简单了都没说如何用,2018-03-05 09:35:22,0,0,5
z***n,钻石会员,还不错,2018-03-05 09:16:31,0,0,5
z***m,银牌会员,买给妈妈的，非常棒，颜值也很高哦！,2018-03-05 09:12:05,0,0,5
1***p,金牌会员,机子外观是不错，但是有点反应慢，用习惯了苹果，但是现在开始支持国产，习惯就好了,2018-03-05 09:03:09,0,0,5
j***6,银牌会员,帮别人买的，不知道体验怎么样,2018-03-05 08:24:56,0,0,5
a***4,钻石会员,华为手机挺好用的，已经买了七个了,2018-03-05 08:15:54,0,0,5
张***2,PLUS会员,做功精细，画面清晰细腻，华为，一值支持的品牌！,2018-03-05 08:09:08,0,0,5
j***5,钻石会员,以前买过这个手机?，很好用。又买了一部,2018-03-05 08:07:28,0,0,5
j***7,PLUS会员,还好。很薄，一直用华为。可以,2018-03-05 07:59:44,0,0,5
j***c,金牌会员,替朋友买的用了一段时间来评价不错的手感可以的,2018-03-05 07:48:35,0,0,5
j***c,金牌会员,速度是京东的优势第二次买这款啦质量可以的上午拍下午到手,2018-03-05 07:47:22,0,0,5
小***客,银牌会员,性价比超高。,2018-03-05 06:52:06,0,0,5
j***9,PLUS会员,拍照效果很好，很清晰,2018-03-05 06:17:31,0,0,5
F***I,钻石会员,送的有点慢了下次快点,2018-03-05 04:06:57,0,0,5
j***0,钻石会员,性价比高，拍照效果杠杠的，成了老婆的自拍神器，必须赞一个！,2018-03-05 03:04:41,0,0,5
j***2,PLUS会员,给舅舅买的，专门要轻薄的，这款和我之前的iPhone6一样大小，手感也不错，他很满意，就是买了没多久降价了100元有点伤。,2018-03-05 01:03:42,0,0,5
p***1,金牌会员,用了一段时间感觉不错，是正品！,2018-03-05 00:23:53,0,0,5
j***p,钻石会员,很好，发货快,2018-03-04 23:35:25,0,0,5
你***此,银牌会员,感觉还OK?,2018-03-04 23:34:21,0,0,5
3***m,钻石会员,送货快，质量好，老妈很满意,2018-03-04 23:09:16,0,0,5
子***紫,银牌会员,好用的不得了?,2018-03-04 22:48:26,0,0,5
飘***丝,金牌会员,很喜欢，物超所值，还送了手机壳。喜欢这个颜色。很好看。,2018-03-04 22:31:38,0,0,5
j***y,PLUS会员,用着不错，给朋友买的，朋友给了个大大的赞,2018-03-04 22:27:31,0,0,5
我***L,银牌会员,这款颜值很高，性价比还不错吧，平时功能也够用了。婆婆一眼就看上了，她觉得挺满意。,2018-03-04 22:22:04,0,0,5
j***f,金牌会员,外观很美 手感很好 运行速度够用 老妈用了说很好 好评,2018-03-04 22:16:10,0,0,5
j***6,PLUS会员,帮阿姨买的，本来想买黑的，结果没货，就买了蓝色，也很不错,2018-03-04 22:12:40,0,0,5
j***a,金牌会员,物流很快，零晨12零下单，傍晚就收到，其它还没用不知道,2018-03-04 22:09:11,0,0,5
大***豆,金牌会员,表姐叫我帮买的，没用过，好像还不错。,2018-03-04 22:08:39,0,0,5
力***育,PLUS会员,此用户未及时评价，系统默认好评。,2018-03-04 22:07:14,0,0,5
s***4,银牌会员,买给老爸用的。使用后，老爸称赞手感很好，拍照非常好，视频聊天速度很快！很值得的购物！,2018-03-04 22:05:09,0,0,5
c***2,金牌会员,性价比高，外观漂亮！！！！,2018-03-04 22:03:27,0,0,5
x***6,PLUS会员,今天刚收到货，好用，手感很舒服，目前还没发现缺点，截屏功能很喜欢哦,2018-03-04 22:03:06,0,0,5
郑***骢,PLUS会员,刚买完就降价了，还好有降价保护,2018-03-04 21:59:05,0,0,5
g***3,银牌会员,用了一段时间了，感觉还行,2018-03-04 21:56:06,0,0,5
d***6,金牌会员,为什么我昨天晚上买是1799，现在就变了1699.那不是骗人吗,2018-03-04 21:49:43,0,1,1
d***5,PLUS会员,一直在用，目前感觉不错，物流是真的快！照相真的不错！,2018-03-04 21:48:44,0,0,5
玉***轩,钻石会员,外观很漂亮，出厂自带贴膜，包装内有原厂保护壳，4G内存运行很流畅，发发微信什么的电池至少可以用一天。,2018-03-04 21:45:19,0,0,5
J***1,PLUS会员,超?性价比超高，喜欢?,2018-03-04 21:44:38,0,0,5
动***圣,PLUS会员,京东上东西挺好的，物有所值。,2018-03-04 21:27:39,0,0,5
j***7,银牌会员,给老人买的，非常喜欢,2018-03-04 20:54:25,0,0,5
j***w,金牌会员,孩子自己选的，送给孩子的新年礼物，物流给力,2018-03-04 20:54:04,0,0,5
j***l,铜牌会员,很喜欢，小巧精致，深得我心，用一段时间再来追评,2018-03-04 20:42:57,0,0,5
j***c,银牌会员,很喜欢这个颜色，手机也比较好用，就是快过年了，物流太慢了，几天才收到货,2018-03-04 20:41:45,0,0,5
c***l,钻石会员,给媳妇的，很喜欢，很满意,2018-03-04 20:37:10,0,0,5
S***t,银牌会员,用了好几天，机子很好，应该是原装未拆封过，暂时感觉不出有什么问题，继续观摩观摩,2018-03-04 20:33:32,0,0,5
W***2,金牌会员,还没使用，后排再评价！！！！！！！,2018-03-04 20:26:41,0,0,5
j***h,银牌会员,感觉很好，华为?京东?,2018-03-04 20:23:52,0,0,5
吴***6,PLUS会员,好用，相机不错，期待能用的久些。,2018-03-04 20:04:50,0,0,5
j***7,银牌会员,反应快！内存大！性价比很高的一款手机！,2018-03-04 20:04:15,0,0,5
j***i,银牌会员,今天刚收到，用后来评价。,2018-03-04 20:00:15,0,0,5
j***a,银牌会员,宝贝外包装完好，快递当天送到家，服务态度好，手机还没有拆开内包装，先给好评。待过几天使用后再来评价。,2018-03-04 19:48:58,0,0,5
暖***Q,银牌会员,很喜欢,2018-03-04 19:28:32,0,0,5
w***3,银牌会员,电池不是很耐用，其他还可以,2018-03-04 19:25:08,0,0,5
i***y,钻石会员,送货快，特卖实惠,2018-03-04 19:13:36,0,0,5
j***f,银牌会员,手机很好啊，感觉不错,2018-03-04 19:12:33,0,0,5
煮***吃,PLUS会员,从2012年到现在，我和我老婆全都是买的华为手机，也算忠实粉丝了，这个手机外观还可以，基本还是比较满意，就是买了3天就降价200块，幸亏保价返回来了，发现一个问题，我录了我的右手食指指纹，但是左手食指也能解锁，两个手指指纹一样吗？还是这个指纹解锁精度有待提高,2018-03-04 19:11:04,0,0,4
昕***轩,PLUS会员,很不错，像素可以，价格便宜，华为值得拥有,2018-03-04 18:59:51,0,0,5
忘***y,金牌会员,挺小巧的，送给妈妈的礼物，她老是说以前那个手机卡，内存小，现在这个手机虽然屏幕小了点，但是内存是够她用了,2018-03-04 18:46:02,0,0,5
适时放下诶,钻石会员,还是不错的   老爸用的还可以   华为手机质量没毛病,2018-03-04 18:36:54,0,0,5
1***p,银牌会员,非常适合妹纸，性价比高！非常赞?,2018-03-04 18:34:16,0,0,5
秦***6,银牌会员,手机很好！比较小巧！,2018-03-04 18:26:05,0,0,5
j***v,铜牌会员,快递很快,2018-03-04 18:24:50,0,0,5
让***缘,PLUS会员,手机颜值非常高，手感特别好，简直是太完美了。,2018-03-04 18:21:36,0,0,5
Z***d,金牌会员,4G运行内存，64G存储，前置后置摄像都是2000万像素，色彩，清晰度很好。物流很快!,2018-03-04 18:18:33,0,0,5
z***4,企业会员,已到货，还没有使用喜欢,2018-03-04 18:06:52,0,0,5
j***c,银牌会员,很好，运行流畅，外观好看！,2018-03-04 18:03:39,0,0,5
j***n,PLUS会员,不错,2018-03-04 17:56:56,0,0,5
M***e,金牌会员,挺好的，很不错,2018-03-04 17:52:49,0,0,5
小***0,PLUS会员[试用],"手机很快 
物流当天就到了?
满意的一次购物体验
像素超级棒嘻嘻嘻嘻",2018-03-04 17:49:03,0,0,5
华***快,PLUS会员,手机不错，小巧玲珑，用习惯大屏幕，小点不习惯了，早知道买荣耀9了。,2018-03-04 17:34:05,0,0,5
s***_,金牌会员,很喜欢这一款手机，挺好用的，速度挺快的，拍照像素也挺好。,2018-03-04 17:30:33,0,0,5
jd182*****264,银牌会员,刚收到货，质量先不评价，这物流。。。。，因为是寄到我们村的，从广州到我们市区很快，但之后转邮政，那可真慢呀，第五天才到，京东咋不给送到村里呢？,2018-03-04 17:24:56,0,1,3
j***i,金牌会员,第一次在京东上买手机，收到货后还很不错！而且比之前便宜了一百块！一直都在关注华为手机！,2018-03-04 17:19:06,0,0,5
j***r,银牌会员,"电池续航旧，可到达50小时
外形设计理念好看。手感舒服，妈咪五十岁都适用，自拍一流",2018-03-04 17:18:40,0,0,5
j***o,钻石会员,还好吧，毕竟不用来玩游戏,2018-03-04 17:17:48,0,0,5
嘟***铛,银牌会员,挺好的，颜值也超高，挺流畅,2018-03-04 17:10:56,0,0,5
j***1,铜牌会员,外观很漂亮，超薄，我喜欢，华为手机应该很好,2018-03-04 17:06:30,0,0,5
j***2,PLUS会员,价格实惠，物超所值。,2018-03-04 17:01:25,0,0,5
w***g,银牌会员,不错，物流很快,2018-03-04 17:00:09,0,0,5
A***n,银牌会员,送我妈的 挺好 就是屏幕有点小,2018-03-04 16:56:25,0,0,5
逛***杰,银牌会员,大致差不多吧？说好的赠品一个都没见到,2018-03-04 16:47:47,0,0,5
j***s,银牌会员,非常不满意，手机发烫反应还慢，这是用了1个月来评价的，不建议购买，有史以来最后悔的一次购物。很无奈。,2018-03-04 16:40:39,0,3,2
z***9,铜牌会员,挺快的,2018-03-04 16:39:42,0,0,5
东***化,金牌会员,手机很好用，外观很精致，一直没顾得评价！,2018-03-04 16:24:52,0,0,5
z***5,金牌会员,屏幕效果很好，运行速度很快，一直在用华为，质量很满意。,2018-03-04 16:22:10,0,0,5
w***5,钻石会员,速度超快，京东买着放心，手机很漂亮，孩子喜欢，操作顺手，赞,2018-03-04 16:19:42,0,0,5
j***g,银牌会员,用了一段时间过来评价，挺好的，就是有时候反应太灵敏了，我都没点那个选项，它自己就跳到那个页面了?,2018-03-04 16:16:18,0,0,5
刘***7,PLUS会员,华为手机就是好。这是第二次买了。支持华为,2018-03-04 15:46:29,0,0,5
j***0,银牌会员,有点卡，这个价位的手机不是很满意，,2018-03-04 15:36:04,0,1,3
j***b,银牌会员,手机还是去实体店买好些   这手机微信和QQ发定位都不行啊      同样的地方其他品牌的手机都可以使用,2018-03-04 15:27:00,0,1,2
A***1,银牌会员,一直看好华为  全家都用的是华为 这款手机对与学生来说性价比很高  运行很流畅！！！！给个赞,2018-03-04 15:13:48,0,0,5
j***q,银牌会员,手机很轻巧，反应快，电池比较容易发烫其他都还行,2018-03-04 15:12:12,0,0,5
四***8,金牌会员,挺好的,2018-03-04 14:56:39,0,0,5
j***w,金牌会员,宝贝很好，物流也很快，当天下单就到货了。非常满意的一次购物。,2018-03-04 14:51:16,0,0,5
爱***9,PLUS会员,手机还不错，一直用华为手机，屏幕5.5挺大的，用电能用一天！拍照也挺清晰的,2018-03-04 14:41:31,0,0,5
j***2,PLUS会员[试用],用了20天了，各方面都不错，手感也很好，朋友都很喜欢，过几天准备给姐姐再买一个！,2018-03-04 14:33:44,0,0,5
j***r,银牌会员,很满意的一次购物，就是快递出点小问题，总的来说还是不错的,2018-03-04 14:31:17,0,0,5
