名字,会员级别,评论内容,评论时间,点赞数,评论数,评价星级
j***8,金牌会员,性价比高得不行，支持国货华为,2017-09-29 07:39:00,0,0,5
j***.,银牌会员,顺畅！物流也快，很好的手机，很喜欢,2018-01-31 12:08:28,0,0,5
静***忆,金牌会员,手机总体还不错，比较流畅,2017-10-04 20:41:05,0,0,5
j***0,银牌会员,手机还挺好用的，手机挺可爱的? ，就是 物流有点慢呐,2018-01-17 19:01:30,0,0,5
j***i,PLUS会员,非常满意的一次购物，现在荣耀手机已经做的非常成功了！,2017-12-26 20:17:32,0,0,5
j***a,金牌会员,本人一直都是用华为手机的   这款荣耀9真心不错  手机跟送的礼物同描述一样  物流也挺快,2017-07-03 14:21:15,0,0,5
疯***子,金牌会员,荣耀九真心赞，带上耳机听歌音质极好，拍出来的照片也是狠不错的，可以支持分屏功能的,2017-07-07 14:27:24,0,0,5
S昵称好难,银牌会员,宝贝很完美！灰色高端大气上档次，相当流畅！而且手机在手遥控器都不用啦！方便！！赞,2017-07-03 14:28:41,0,0,5
j***6,银牌会员,手机颜值担当，音质很好服务态度也很好还送了充电宝手机膜后盖。玩游戏加载也很快。,2017-07-04 10:26:08,0,0,5
x***t,PLUS会员,帮别人买的，朋友非常喜欢，很好用 。 。。。。。,2017-09-11 21:13:33,0,0,5
李***告,银牌会员,这手机刚上手，比我想象中的要厚一点点，美中不足的是后盖玻璃很容易脏，留下印子。发货超过了时间。,2017-07-25 13:19:00,0,0,4
j***5,银牌会员,"不是说手机照张像单反吗？单反哪里去了，吃了？
像素特别差，不能对焦，录像放大都是昏的看不清人脸，还有客服态度特别差，直接发信息不理，差到了机点！！！手机用了两天来评价玩游戏有时候特别卡，开语音打游戏直接黑屏，就是特别气愤的像素！像素！像素！差差差！！！！",2017-08-17 20:06:03,0,0,5
j***e,银牌会员,用了两天再来给个评价。总体性价比高，触屏灵敏，指纹解锁。充满电使用状态可以玩两天，玩王者荣耀只是微热，拍照跟同事对比还是很有优势。可以充公交卡，不贴膜不戴套会更好看。,2017-07-04 12:16:17,3,2,5
你的名字我的姓氏yc,银牌会员,国产手机必须支持！,2017-06-28 10:54:35,0,0,5
再***镇,金牌会员,给个中评吧   感觉手机时而流畅时而卡顿    感觉屏幕有点小  我是帮同学买的   就这吧   推荐买安卓的话得买3000元以上的,2017-10-21 13:02:26,1,0,4
j***g,金牌会员,头天十点过下单，第二天早七点送达。说说我为什么买荣耀9吧，游戏绝对给力，综合来看荣耀9功能比较全面，照相待机都挺好，手感不错，信号好音质好，能满足我工作生活中的需求，总之还比较满意，实话实说。,2017-07-18 10:58:29,0,0,5
j***x,银牌会员,很酷，很炫，手机很喜欢，用了两天才来评价。确实好东西，验证是真的。,2017-09-02 10:08:54,0,0,5
d***s,金牌会员,这次是在京东购物最差的一次体验，手机价格比华为商城贵了300，华为商城只要2299，送了几样不值钱的东西，页面介绍说好评充30话费，找客服的时候只愿意充20，感觉商家一点信誉都没有，请想在这家购物的人注意不要再上当了。在京东购物那么多次这次体验最差！,2017-07-05 11:06:41,0,0,5
飘***光,银牌会员,发货快，快递迅速，克隆转移，哈哈，真心给力！,2017-07-29 21:08:53,0,0,5
大***吖,金牌会员,手机收到了！感觉很好！快递也挺快的，下单第二天就收到了,2017-07-25 22:08:02,1,0,5
孟***1,PLUS会员,终于抢到了。本来是奔着我胡哥买的。到货后却被这手机惊艳到了，美轮美奂的。蜜汁喜欢啊！拍照会有种很真实的感觉。手机待机时间也很长，出去玩一天可劲拍照回来还有一半呢 开心！,2017-06-17 14:51:26,50,4,5
细***嘟,银牌会员,手机很好用，华为荣耀王者玩起来很流畅，不卡，值得购买，,2017-07-13 17:14:08,1,0,5
j***9,PLUS会员,华为的手机就是好用，最重要的是老胡代言的,2017-06-25 14:55:35,2,0,5
j***k,金牌会员,手机是正品，很漂亮,2017-09-16 19:27:49,3,0,5
j***l,银牌会员,用了两天再来给个评价。总体性价比高，触屏灵敏，指纹解锁。充满电使用状态可以玩两天，玩王者荣耀只是微热，拍照跟同事对比还是很有优势。可以充公交卡，不贴膜不戴套会更好看。,2017-07-07 15:17:32,0,0,5
j***y,金牌会员,外观设计优美，运行流畅，价格合适，不错的选择,2017-07-08 15:22:46,0,0,5
4***7,银牌会员,手机刚到手，用几天再评论,2017-06-24 14:38:28,2,0,5
霞***0,PLUS会员,正面指纹比反面指纹更方便，非常喜欢加满意，而且魅海蓝十分漂亮。最主要还是介绍500天不卡。我实在想不出能不选择它的原因，果断入手。,2017-07-18 11:13:49,1,0,5
黑***H,银牌会员,用了2天，感觉还是不习惯，原来用5.5的，屏幕小了点，还是买V10好些，手机的这个配置放在这，是没问题的，挺流 畅的不卡！,2018-01-01 21:05:44,0,1,5
j***^,PLUS会员,期待已久的手机终于到了，马上就把玩了一把，外观设计很好看，拿在手里很有质感，系统很流畅，国产机能做到这样已经很不错了，离三星苹果的距离不远了，支持荣耀，支持华为。,2017-06-20 22:06:44,4,1,5
106的Zmg,金牌会员,超漂亮，先用着，后续评论。,2017-07-17 10:47:06,1,0,5
x***i,金牌会员,反应比较快，但一些耳机插上去不支持，没声音，不知为什么？,2017-07-09 10:32:35,0,0,4
j***x,PLUS会员,已用两叁个月了，质量好，正品，给个赞！,2017-09-20 11:08:48,2,1,5
1***j,银牌会员,还不错   买了俩部,2017-08-09 12:42:35,0,0,5
j***0,银牌会员,也还好用这么好,2017-07-13 13:17:03,0,0,5
V***4,PLUS会员,手机很漂亮，喜欢,2017-07-03 22:22:20,0,0,5
j***p,PLUS会员,荣耀9手机十分轻巧，单手操作非常舒适，系统运行流畅。京东物流送达，相当放心。,2018-02-06 15:18:36,0,0,5
九***月,PLUS会员,发货很快，第一天下午下单，第二天上午就到了。手机玩了一天，精品手机，官方原货。外形好看，照相清楚，音乐播放器的hifi芯片效果相当好。,2017-08-15 11:39:19,0,0,5
jd_132281vxx,银牌会员,"刚买了没有一周，就出现卡死的情况，触屏也不灵，联系客服就让我直接恢复出厂设置，真是无语。问题太多了，
明明没有后台应用，就是卡机。网上买手机真是不应该",2018-01-18 11:29:51,0,0,5
j***b,银牌会员,手机超级酷，手感没得说,2018-01-25 00:08:37,0,0,5
j***a,银牌会员,太坑了，刚买两天就掉价了。还说这是双十一的价格，买贵了补差价，然后客服完全不理，买手机的请慎重，完全没有诚信,2017-11-04 21:44:29,0,2,5
s***1,钻石会员,手机很漂亮，流光异彩，就是太滑了，不得不用套,2017-11-29 18:48:50,0,0,5
c***铠,金牌会员,比想象中的好用很多 这已经是买华为第三台机子了，支持华为！,2017-07-28 23:19:14,0,0,5
花***骨,PLUS会员,感觉不错很惊艳，奶奶灰低调奢华有内涵，很符合我的气质，朋友都说好看，使用方便 系统流畅不卡顿，通话声音很清晰，音质很好，非常喜欢，而且还是胡歌代言的，满意！！！,2017-07-03 12:00:39,0,0,5
j***j,银牌会员,比我想象的好  手机不上图是我只有这个刚买的   快递我的吐槽一下我二月四号订的到今天才到  我也体谅到春节快到所以也没脾气毕竟都有难处,2018-02-10 14:44:17,0,0,5
特***烦,钻石会员,使用三天后来评价，机器很漂亮，系统很流畅，华为手机还是值得信赖的。店家很不错，送的配件很多很实用。,2017-07-04 17:00:10,2,0,5
鸣***丶,银牌会员,快递包装很好，手机也是全新，没毛病。,2017-07-06 21:50:08,0,0,5
石***p,金牌会员,外观漂亮，运行流畅，拍照清晰，充电速度快。儿子非常喜欢，和图片一样，比市场价格低300元，喜欢的放心购买吧,2017-07-03 14:50:02,1,0,5
j***k,金牌会员,用了一段时间才来评价的，手机速度很快，外观漂亮大气！照片清晰漂亮！价格适中！,2018-01-06 10:36:49,0,0,5
会***鼻,银牌会员,总总得来说很喜欢。得感觉还可以，跟想象中没什么区别，就是送的防爆膜同学给贴反了，手机确实很漂亮。送的耳机还没拆。,2017-07-03 14:32:31,0,0,5
T***g,金牌会员,手机很流畅，我不爱玩游戏，这个手机正好能满足我，购物相当满意。只是手机里预装了好多用不上的APP，需要费心一一卸掉，其他都很满意。赠品很多，手机壳，手机屏幕保护膜，手机支架，耳机等等。,2017-12-01 17:50:09,3,0,5
t***9,金牌会员,先人板板的刚买官网就降200，晕。,2017-08-02 18:09:45,1,1,5
e***V,银牌会员,满意 没，外观还可以  就是快递很慢,2017-07-07 17:34:19,1,0,5
j***r,金牌会员,第一次用华为手机，付款8天才发货，用了20天来评论的，说实话很失望，打开网页很慢还不如用流量来得快，手机很重也很厚，苦哈哈的等了10天才收到货，不是理想的一次购物。,2017-07-16 19:41:48,0,0,5
张***g,银牌会员,好，这里给同事买的，货一到打开当时就喜欢上了，很不错的一次购物，,2018-01-14 15:32:08,0,0,5
徐***山,金牌会员,东西不错，非常好，快递也可以,2017-11-14 12:44:28,0,0,5
黑***柴,金牌会员,东西特意用了一个月才开评价的。是新货。帮姐姐买的。姐姐很喜欢。但是系统不稳定。第一次推送更新之后就出现不显示图标。现在用着还好。出现问题会追加评价。支持国货吧,2017-08-29 22:37:04,0,0,5
爱***道,银牌会员,用了一个多礼拜了，就目前来看手机可以打九十分以上，外观很漂亮，运行速度快，电池续航可以的，看个人习惯吧，打农药时间长了有一点发热，拍照少了点不评价。,2017-11-14 21:56:23,0,0,5
甬***珠,金牌会员,购买后使用至今，总体感觉好，值得购买。,2017-08-12 15:24:41,0,0,5
G***V,银牌会员,外观挺好看的，背面光滑曲面也挺闪的，上网也算流畅，拍照什么的一般吧，反正我不常拍照无所谓啦！就是玩游戏是感觉触屏不是很灵敏，难道是我的才出现这种情况？,2017-10-20 19:05:24,0,0,5
j***1,银牌会员,手机收到了呢     虽然没有次日达  比较遗憾   送的小礼品也是很多的    很实用好评,2017-07-05 16:00:22,1,0,5
j***j,PLUS会员,手机还不错，刚使用了一会，运行流畅外观漂亮，就是发货速度有点慢,2017-12-11 18:46:16,0,0,5
徐***5,银牌会员,网上抢了几次，没运气，花钱呗，加了300拍下了，谁叫自己喜欢呢，一直都喜欢灰的，以前喜欢苹果的深空灰，太贵，没买，这次的荣耀9灰得更漂亮，再也忍不住了。,2017-07-08 14:01:25,1,0,5
j***l,钻石会员,手机路上，慢慢，三方客服真蛋，,2017-07-03 18:15:22,1,0,5
欧***客,银牌会员,用了几天，才来评价，发货较快，不卡顿，电量能用一整天，总体还不错。,2017-07-11 21:17:59,3,0,5
j***9,PLUS会员,手机非常棒！卖家也非常好，，细心解答各种问题，，产品包装的特别好！值得信赖！,2017-07-07 18:25:36,0,0,5
W***4,PLUS会员,手机收到了，很满意，赠品也都有，好评,2017-07-03 10:21:55,0,0,5
j***z,银牌会员,手机外观不错，刚用几天一点也不卡，电池充电也快，用的也快，其他还没感觉,2017-08-16 20:26:11,2,0,5
a***7,PLUS会员,手机是买给妈妈用的，最近老太从老土的手机开始追求玩微信了，智的超越，出门想上网了，给她买个快点的让她更觉得有乐趣，希望能用个两年，妈妈用了一小时学会了，真是聪明的妈！希望手机没有问题,2017-11-14 18:08:17,0,0,5
z***7,PLUS会员,特别好用   全五分好评,2017-12-11 09:07:42,3,1,5
j***0,金牌会员,手机大小非常适合我的小手，之前用的mate8屏太大，老是拿不住，这次很好，蓝色也很酷,2017-07-03 14:34:49,1,0,5
鹏***蛋,PLUS会员,帮朋友买的，线下黑色一直缺货，还是京东厉害???,2017-12-06 14:13:52,0,0,5
Z***8,金牌会员,手机性能很好，反应也很快打游戏很流畅，只是膜一开始没有贴，还是自己出去贴的！,2017-08-24 20:46:04,1,0,5
z***w,金牌会员,一直用华为手机，非常不错，支持国产，荣耀九恨惊艳，物流也很快，昨天下单，今天上午就到。赞一个,2017-07-05 11:00:23,0,0,5
奶***腐,金牌会员,机子不错，我是用了很多年苹果改用华为的！国产现在真心不错了！相机确实给力,2017-07-04 13:42:56,2,0,5
j***i,金牌会员,不错，就是被商家黑了官网，买不到,2017-06-29 13:33:55,0,0,5
宁***8,PLUS会员,手机刚收到，一看就是正品质量应该没有问题。,2017-12-01 21:20:43,1,0,5
j***3,银牌会员,送货很快   很满意  送了很多东西  刚到手   还没试机 不过应该很好好评多多,2017-09-07 12:22:34,0,0,5
登珠峰看蜂窝,PLUS会员,虽说购买时距发布已经有大半年时间了，但手机依然很潮流！很有质感！开机反应都很快！值得推荐,2018-01-17 21:46:58,0,0,5
任***遥,钻石会员,手机很靓，用着也很好，很流畅，还送了很多东西。,2018-01-31 16:06:06,0,0,5
j***3,银牌会员,非常不满意，把手机内存4,2017-08-07 21:15:04,0,0,5
f***o,金牌会员,用了几天，感觉很不错，买的高配的运行顺畅，外观也不错，送了手机套，没送耳机,2017-10-28 10:21:19,0,0,5
w***n,金牌会员,手机非常漂亮惊艳，后置双摄像头拍照很给力，蓝色款看起来非常时尚。用起来手感真的不错。,2017-07-04 19:40:47,0,0,5
n***r,银牌会员,蓝色看起来很耀眼，符合我的要求，玩游戏流畅，超出我的预期，店家很有信誉度，非常喜欢。,2017-07-03 15:37:17,0,0,5
J***P,金牌会员,等了差不多一个星期，终于等到了。发货速度真心有点慢，手机挺好，蓝色版颜值挺高，喜欢！,2017-06-27 15:35:15,0,0,5
牛***银,金牌会员,手机很好看，6gb运行贼鸡儿快，第一次用华为，希望能能用几年，。,2017-12-02 12:02:50,0,0,5
雪***1,银牌会员,这个手机我收到了，荣耀9反应快，它的护眼功能，对眼睛起到保护作用，我很喜爱它。,2017-07-21 17:28:09,0,0,5
徐***晨,银牌会员,超级好看呐 颜值在线妥妥的 手机用起来特别流畅 都说好看嘻嘻超级喜欢 买荣耀没错,2017-07-03 14:25:18,0,0,5
j***l,钻石会员,终于到货啦！非常喜欢，颜色也很酷，京东物流就是快.五星好评,2017-07-02 23:11:25,2,0,5
z***1,银牌会员,很满意，物流也快。送爱人的。,2018-01-02 11:03:50,1,0,5
杰***1,钻石会员,用了半天没发现什么问题，就是送的膜贴坏了，不过网上好多说不用贴膜，我是不敢,2017-07-25 19:06:35,0,0,5
这***姐,金牌会员,手机性价比很高的，我8月初买了知更鸟色，感觉性能挺不错的，也不卡顿，现在给我爹买了奶奶灰,2018-03-03 21:26:50,0,0,5
z***0,银牌会员,手机收到了，买给媳妇用，外观漂亮，媳妇特别喜欢，，物流很快，支持京东。,2017-08-06 17:51:19,0,0,5
j***p,银牌会员,手机胡歌双帅，性能也可以跟上潮流，荣耀6用了三年还没坏作为留守手机，作为国产手机质量没话说，性价比超高。音质特别棒拍照很新颖，很喜欢～,2017-07-01 00:19:08,0,0,5
r***w,PLUS会员,服务不错，刚刚收到的货价格调整了，卖家也进行了补差。这个第三方很难得。以后买手机，还认准他们家。,2017-11-18 15:38:06,0,0,5
j***p,银牌会员,官方商城和京东抢不上，真是太讨厌饥饿营销了，只能加钱买了，快递是真的太慢了，5天才到我真是无话可说，买了一天多才发货，手机是绝对不错。,2017-07-02 14:25:01,0,0,5
j***7,银牌会员,很好   就是手机会有点发烫   还可以吧,2017-06-30 11:19:24,3,0,5
k***u,金牌会员,收到的手机非常满意～店家送的膜也很好～谢谢店家～必须五星～,2017-08-02 21:07:51,1,0,5
7***a,钻石会员,手机很漂亮，颜值高，手感好，运行速度杠杠的，值得拥有。,2017-08-23 17:20:16,1,0,5
s***q,钻石会员,手机反应挺快 运行也够用没卡顿现象 拍照也清晰  电池正常用一天半差不多  目前来看v9比p10好！没发现边框发黄现象也没死机现象，总体五分好评,2018-02-23 09:56:47,0,0,5
k***u,PLUS会员,灰色非常大气，上档次，质感非常强，运行速度非常快。,2017-07-03 21:23:20,0,0,5
j***n,金牌会员,我刚到货还没开始用呢，不知道好坏哎，颜色比我想象的要深一些，以后再评,2017-07-09 17:42:04,0,0,5
游***天,银牌会员,拿到手第一感觉还可以，具体还不知道，体验十分钟还可以,2017-11-12 20:43:55,0,0,5
d***7,钻石会员,不到一个月喇叭杂音太大，声音有底。客服让联系售后，可是提交售后以后 ，在也打不开售后页面！客服页面也打不开了！这是什么意思？,2017-08-11 11:21:47,0,0,5
有***你,金牌会员,特地用了一个月才来评价，一直用华为，心心念念买了荣耀九。使用流畅，无卡顿，内存够用，摄影强大，跟我去HK??拍了不少美照。,2017-08-23 10:27:05,0,0,5
j***h,银牌会员,刚买的荣耀9用着很舒服很满意，用了两天了感觉非常棒！！！,2017-07-18 15:32:05,1,0,5
于***政,钻石会员,手机很漂亮，反应很快！用一段时间后再追评,2017-11-15 16:06:22,1,0,5
日***陵,银牌会员,手机很好，用了差不多一个月了才来评价的，小问题没什么，手机很漂亮。卖家服务很不错我那个防爆膜坏了也给我补发了，很喜欢荣耀9。,2017-07-27 22:16:45,0,0,5
m***Z,银牌会员,非常满意  手机太棒了 特别顺滑 一点都不卡好看  好评,2017-06-30 15:07:10,1,2,5
g***g,金牌会员,很喜欢，我用的荣耀8，老婆生日给买的荣耀9。手感很好，老婆很喜欢,2017-07-07 18:21:36,0,0,5
沐***枫,金牌会员,用了几天，感觉很不错！很有手感，总体来说是一款比较赞的手机,2017-08-06 20:29:30,0,0,5
麻***样,PLUS会员,"像我这样优秀的人
本该灿烂过一生
怎么二十多年到头来
还在人海里浮沉
像我这样聪明的人
早就告别了单纯
怎么还是用了一段情
去换一身伤痕
像我这样迷茫的人
像我这样寻找的人
像我这样碌碌无为的人
你还见过多少人
像我这样庸俗的人
从不喜欢装深沉
怎么偶尔听到老歌时
忽然也晃了神
像我这样懦弱的人
凡事都要留几分
怎么曾经也会为了谁
想过奋不顾身
像我这样迷茫的人
像我这样寻找的人
像我这样碌碌无为的人
你还见过多少人
像我这样孤单的人
像我这样傻的人
像我这样不甘平凡的人
世界上有多少人
像我这样莫名其妙的人
会不会有人心疼",2017-12-19 11:16:42,0,0,5
z***8,银牌会员,手机绝对是正品，用了好久了，一直没空评价，选择华为绝对没错！,2017-07-10 21:47:55,0,0,5
一***鑫,银牌会员,手机很好，很美观，用起来也很流畅,2017-09-12 00:31:25,2,0,5
j***9,金牌会员,手机很好看，帮老爸买的，，手机也很好用，老爸很喜欢。强力推荐,2017-07-05 16:33:15,0,0,5
1***p,金牌会员,非常不错的手机，运行很快，总之非常不错的一款手机，,2017-07-06 10:31:18,1,0,5
j***e,银牌会员,觉得不错，用着还行，不过刚开始的时候，这个相机系统会出有些小问题！内存也还行，64的，系统占了十几个，应该都是这样的,2017-08-08 11:35:36,0,0,5
手***干,金牌会员,刚买标配版的不久高配的就跟当时标配一个价了，有点难受。没有usf没有疏油层也是够了。店家服务还行，没想象中的那么差。,2017-08-06 13:28:32,0,0,5
j***8,银牌会员,手机是正品，质量没得说，感谢商家的赠品，很丰富，可能因为天气原因，发货有点慢,2018-02-02 16:10:28,0,0,5
亚***王,金牌会员,用了两个多月了，偶尔会卡，不过清理下就没事了！背面颜值是真的高，手感挺滑得，好几次都是我力挽狂澜没摔在地上。,2017-10-03 16:18:10,0,0,5
古***秋,金牌会员,"前天下午下的订单，昨天就收到货了，这个物流速度确实值得赞一个！
包装完好，有防摔防挤压处理。考虑周到，很不错。谢谢京东！
宝贝看起来也很不错，漂亮，做工精细，手感也很好！",2017-09-12 10:49:31,0,0,5
梅***2,钻石会员,关注很久 没上我失望 正品 颜色非常漂亮 速度快 内存够大,2017-07-05 21:57:28,0,0,5
w***5,金牌会员,手机值得拥有，漂亮速度快，快递小哥也快谢谢合作愉快,2017-08-25 12:46:56,0,0,5
阿***-,银牌会员,买的灰色很好看，很漂亮，服务态度也很好，以后会多光顾！！,2017-07-05 07:21:58,0,0,5
刘***淼,金牌会员,物流给力，相信京东，一直在支持，产品质量刚刚的！！！！,2017-07-15 12:54:35,0,0,5
T***s,银牌会员,手机不错，很快，用了几个月，很不错，尺寸也刚好,2017-09-15 13:07:16,0,0,5
jd130761vqh,银牌会员,颜色超赞，触碰比苹果的还要灵敏！配置也超高，性价比高。,2017-07-05 17:06:36,0,0,5
叫兽海哥,银牌会员,刚用两天就出问题了，唉不懂怎么说这个手机了,2017-07-19 00:40:39,1,1,5
强***呆,银牌会员,用了几天，目前手机还不错，用着很好，很灵活,2017-07-08 13:41:40,1,0,5
张***J,银牌会员,刚用了没几天手机就开始卡顿，一卡就卡十几秒，有时能连着卡三四次，在优酷上看视频，人是慢进的话是快进的，卡成了球,2017-07-18 23:49:20,0,0,5
w***1,银牌会员,"入手有两天了，帮朋友买的。

目前使用来说，没什么大问题，具体情况不太清楚，后续会更新评价性能参数。",2017-10-06 10:58:07,0,0,5
j***a,银牌会员,手机到手，蓝色很好看，手感也很好，支持国产！！！,2017-08-01 15:42:47,0,0,5
j***6,PLUS会员,非常好，用的很棒,2017-12-21 20:56:05,1,0,5
j***i,银牌会员,电池耐用，运行速度流畅，手感超好，关键是功能符合我的意愿，希望下次还可以购买华为手机，果然名不虚传,2018-01-30 19:40:30,3,0,5
j***e,银牌会员,机子收到，实物比图片还要帅气，店家送的东西也很全。,2017-07-03 14:36:44,0,0,5
j***1,PLUS会员,等黑色等了好久，还好，和想象中一样，使用情况后续更新，华为粉，京东快递一无既往的快，不过店家出库时间好慢，配送了四样东西加一起也不够一百，多收三百，谁让着急上手呢，忍了,2017-07-23 11:28:15,0,9,5
丈***3,银牌会员,超级喜欢，抢了好多次没抢上，最后抢上还不发货，果断来京东了，真的是超级快啊，两天就开始用了，真心满意，好喜欢,2017-07-11 09:51:19,0,0,5
j***d,银牌会员,手机刚到手，还没用，从外观看非常漂亮，物流非常快，配送员服务态度非常好，等用了再做具体评价吧,2017-11-11 22:41:40,0,0,5
s***1,银牌会员,手机很好看，很喜欢也是正品，送了好多礼物谢谢了，,2017-07-03 20:12:20,0,0,5
f***g,银牌会员,比想象中的漂亮吧，对手机了解不多，但用起来比我的老手机流畅多了，店家挺贴心的，我留言说耳机想要白色的，然后收到确实是白色的，很开心，配件也送了一大堆。然后，顺便夸一夸华为实体店，昨天晚上收到手机，本来兴冲冲的就准备换的，结果发现手机卡大小不合适，出去找剪卡的，先后去了某手机移动专卖店和一手机维修处，都告诉我剪卡要收费5元，当时我就震惊了，最后还是去的华为专卖店，里面小哥热心帮助我剪得,2018-01-25 11:30:15,0,0,5
j***l,金牌会员,手机物流快，服务特别好，是一个值得信任的一个店铺,2017-06-25 21:47:37,0,0,5
何***铿,钻石会员,手机不错，看起来还行……,2017-11-16 15:40:23,1,1,5
Q***物,银牌会员,反映快，系统流畅,2017-08-26 17:27:16,0,0,5
j***w,银牌会员,孩子自己挑选的手机，价格适中，很喜欢的！,2017-08-24 22:08:04,0,0,5
j***9,金牌会员,特别好看的手机   很喜欢    用着是真不错,2017-07-04 13:03:16,0,0,5
j***3,银牌会员,宝贝收到了，很满意，玩王者荣耀一点也不卡，哈哈,2017-07-03 18:11:19,0,0,5
微***昏,PLUS会员,好手机，外观好，速度快，屏幕和荣耀8一样，怎么个一样法大家网上搜吧,2017-07-02 08:51:04,0,0,5
l***8,金牌会员,手机外观漂亮，颜色骚气十足。功能全。喜欢。,2017-07-23 09:41:51,0,0,5
p***菲,银牌会员,手机很漂亮，很喜欢，发货很快，送的礼品很合适,2017-07-03 22:26:44,0,0,5
l***f,银牌会员,用了一个月了，挺不错的。外观比我想象的还要好看，速度挺快的。,2018-02-09 16:26:20,0,2,5
j***9,金牌会员,非常满意！手机速度很快，外表很酷！赞！,2017-08-10 18:27:39,0,0,5
罗***3,金牌会员,还不错，走时准确，物超所值，值得够买。,2018-02-11 09:52:18,0,0,5
j***z,PLUS会员,用了几天，感觉还不错，手机很酷，超薄。,2018-02-01 05:09:15,0,0,5
j***9,银牌会员,手机收到，使用感觉特别赞，下次还会来购买,2017-07-03 14:24:13,0,0,5
