名字,会员级别,评论内容,评论时间,点赞数,评论数,评价星级
新***2,银牌会员,特意用了一段时间再评论，手机挺不错的。首先屏幕够大，我个人觉得稍微小一点更好，但是当前全面屏趋势，华为还是顺应潮流。运行速度也还行，安卓系统的特点，一开始都挺快，所以这个有待考证。电量也比较持久，正常使用一天没问题，关键是快充技术好，回血快。还有颜值也比较高，手感不错，但是个人也是比较爱惜手机，加了个手机套，体验就比较少了。整体来说，华为手机还是很好的，值得购买！,2018-03-08 13:20:17,0,0,5
S***L,PLUS会员,好评，，，，颜值很高，，，运行流畅。没毛病,2018-03-07 23:50:21,0,0,5
谢***唯,银牌会员,没的说，那么多钱，让她买苹果，愣是不要，哎，算了算了，买都买了,2018-03-09 16:44:39,0,0,5
岳***0,金牌会员,用着感觉很好，续航能力也不错，手机不离手也能玩一整天??,2018-03-08 20:53:33,0,0,5
l***o,PLUS会员,送人的，自己没用过，但客户反应说很好用！,2018-03-08 08:47:15,0,0,5
j***1,钻石会员,使用了有一个月了  各方面都还不错  尤其是电池  特别抗用,2018-03-06 14:51:21,0,0,5
京***手,PLUS会员,不错的选择，我们会一直支持的！,2018-03-01 20:20:29,1,0,5
t***0,PLUS会员,多次购买，信号超强，耗电低，运行流畅。,2018-03-08 11:06:54,0,0,5
j***o,PLUS会员,京东服务就是好送货快，解决问题效率高，本来买了另一个品牌但是信号不好给退款了，又换了华为这款，确实不错是我用的手机中效果最好的本来还纠结买某品牌，但是就冲着今年的冬奥会也果断放弃，还是支持国产并不比外国货差甚至更好?,2018-03-03 14:11:20,0,0,5
翔***-,钻石会员,给老爸买的，东西一如既往的好，亲戚朋友都在用这个品牌。赞,2018-03-09 10:33:35,0,0,5
n***2,PLUS会员,边框有个小坑，不影响使用，就没退换货,2018-03-07 22:48:59,0,0,5
d***j,PLUS会员,这个手机用着比苹果强很多，尤其是照相,2018-03-06 16:35:42,0,0,5
j***q,银牌会员,第一次手机电池不行了，换了个手机可以了，非常好的客户体验,2018-03-08 10:29:13,0,0,5
m***3,PLUS会员,第一次用安卓手机，华为的质量还是不错的，服务也很周到，收货时已经贴好了膜，还送了手机套，挺好的。,2018-03-08 10:39:14,0,0,5
雨***园,钻石会员,怎么说呢 买给母亲使用的 帮她从7升级到10Pro 但是和9使用下来没啥区别 内置软件一样删除不了 不root的话 华为只要美腿S可以删除内置 希望华为别把自己的华为视频这种垃圾软件强迫安装了 我可是买了你2个7 一个8 一个S 一个9 一个10了 支持国货的也够可以了 你丫也该为考虑一下国民感受 反正下次再买手机就是谁能删除内置我就买谁了 不打算死认华为了,2018-03-07 08:27:14,0,0,5
天***好,PLUS会员,正在用，感觉还不错，京东的物流超赞,2018-03-07 21:28:49,0,0,5
l***4,钻石会员,手机不错，就是承诺当日送达，结果隔日才收到，有些失望,2018-03-08 10:05:01,0,0,5
j***q,钻石会员,手感很好，感觉比苹果好用，特别是指纹解锁！支持国货！,2018-03-07 08:28:37,0,0,5
L***L,钻石会员,京东就是快，外观好看，设计的很好，系统也很流畅，满意,2018-03-06 22:34:08,0,0,5
斜***飞,金牌会员,之前买的三星s7用了一年半就电池鼓包了，换了这个。发现体验不错。电池续航挺长。拍照中规中矩。颜值担当。,2018-03-06 10:56:28,1,0,5
j***n,PLUS会员,物流快，东西没有优惠，用用试试,2018-03-07 20:58:02,0,0,5
j***f,钻石会员,帮朋友买的，送货快。已经是买了两台了，还是黑色好看,2018-03-08 11:55:59,0,0,5
m***l,钻石会员,屏幕大小合适，系统飞快，电池耐用，支持国产实力！！,2018-03-07 21:29:36,0,0,5
陈***2,PLUS会员,还不错，一直在京东买，值得信赖,2018-03-07 15:50:59,0,0,5
j***8,金牌会员,电池还行，一直用开华为的，运行还可以，也有卡过机。,2018-03-07 19:22:07,0,0,5
j***7,PLUS会员,有质感，手感不错，JD送货给力,2018-03-07 13:34:11,0,0,5
j***x,PLUS会员,华为的新款手机，外观很不错。,2018-03-09 21:07:54,0,0,5
j***a,钻石会员,手机好用，有手感，设计、性能都好，摄像非常不错。,2018-03-07 11:14:58,0,0,5
j***w,金牌会员,刚收到货，还没来得及使用，等用一段时间后在评论,2018-03-09 19:05:00,0,0,5
-***-,PLUS会员,不愧是旗舰级，速度就是快！,2018-03-09 09:03:08,0,0,5
飞***居,PLUS会员,很好！就是拼音输入快了乱码,2018-03-07 23:22:11,0,0,5
程***4,PLUS会员,手机很喜欢，发货速度很快。,2018-03-07 15:31:45,0,0,5
h***1,PLUS会员,耳机有正反区别，插反没声音,2018-03-07 13:20:22,0,0,5
j***b,金牌会员,上午下单，下午4点就到了，京东的速度就是超快。手机包装全新没有什么指纹之类的，很满意！先给好评，手机还没用…,2018-03-08 20:34:53,0,0,5
z***7,PLUS会员,很好，满意，送货快，方便！,2018-03-06 22:16:07,0,0,5
李***子,银牌会员,用的不错看视频有时候卡不知道是手机事还是网的事,2018-03-07 13:21:52,0,0,5
j***5,PLUS会员,送老公的新年禮物，他很喜歡,2018-03-06 20:35:11,0,0,5
杨***脚,钻石会员,华为这款手机真的不错，速度快，充电快，果断转粉,2018-03-06 19:08:32,0,0,5
以***7,PLUS会员,功能挺好，支持国产支持华为,2018-02-28 23:48:04,0,0,5
最***珑,金牌会员,很高大上的样子！还未使用，快不快使使看！嘿嘿,2018-03-07 10:26:22,0,0,5
M***0,PLUS会员[试用],很惊艳，完全没有了从苹果系统转安卓会不习惯的担忧，用得很顺手，功能很强大。,2018-03-07 06:23:31,1,0,5
张***秋,PLUS会员,手机质量好，价格还行。,2018-03-10 00:22:00,0,0,5
1***p,PLUS会员,"整体感觉好,还在适应中",2018-03-09 19:27:04,0,0,5
j***v,金牌会员,很大气，物流也很快，用了几天不错。很喜欢！,2018-03-08 21:23:50,0,0,5
j***g,金牌会员,配货的人员存心不良，把有问题的手机销售出来,2018-03-08 16:36:03,0,0,5
通缉犯灬流年,PLUS会员,刚到手，先来评价?做工真是没的说，四曲面手感超好，非常喜欢?等用了再来追评！！,2018-03-07 20:02:10,0,0,5
j***b,金牌会员,喜闻乐见换手机，希望能用更久吧，给爸爸买的,2018-03-07 09:38:26,0,0,5
D***H,PLUS会员,很好，很漂亮。太喜欢了,2018-03-06 23:37:05,0,0,5
瞪***孕,PLUS会员,手机不错，还在把玩中,2018-03-08 10:12:01,0,0,5
y***5,PLUS会员,很好，一分价钱一分货,2018-03-08 19:09:21,0,0,5
关***官,金牌会员,是款好手机，一直用的华为手机，支持国货。,2018-03-08 09:12:16,0,0,5
爱***空,银牌会员,很漂亮，就是包装不太好，也不塞点泡沫垫垫,2018-03-07 15:56:41,0,0,5
1***x,钻石会员,很好，喜欢在京东买东西，放心，售后无怃,2018-03-09 10:27:38,0,0,5
z***8,钻石会员,很好，之前用p8，现在换meta。好用,2018-03-06 16:55:25,0,0,5
j***0,PLUS会员,非常不错，质量很好,2018-03-08 10:47:26,0,0,5
j***0,PLUS会员,性能非常好，很大气,2018-03-08 10:44:55,0,0,5
s***6,钻石会员,产品质量好，速度没得说，一直信赖京东,2018-03-08 14:34:57,0,0,5
E***3,企业会员,影相功能非常强大，已经购买了第二部。,2018-03-06 23:15:36,0,0,5
j***房,银牌会员,东西收到还没打开看，不过速度还是挺快,2018-03-06 20:34:34,0,0,5
j***r,钻石会员,送货那个快啊 猝不及防就到了 呵呵,2018-03-08 21:38:09,0,0,5
咖***媚,金牌会员,手机收到，异常激动，是我想象的样子,2018-03-08 21:00:47,0,0,5
j***e,银牌会员,非常不错的，华为好机，你值得拥有。,2018-03-08 10:29:24,0,0,5
e***5,PLUS会员,一下买四个，什么时候水果学会双卡双待，什么时间回归,2018-01-14 12:54:55,3,2,5
j***心,金牌会员,送给老爸的礼物?，很好，不错,2018-03-08 09:22:47,0,0,5
睡***狗,钻石会员,好用啊 比苹果强多了 超乎想象,2018-03-07 11:50:52,0,0,5
西***子,金牌会员,服务好！快递速度也是杠杠的！,2018-03-10 01:00:19,0,0,5
笑***生,钻石会员,续航不是很好，拍照也不怎么样,2018-03-09 06:57:07,0,0,5
j***回,金牌会员,一分钱一分货 对得起这个价格,2018-03-08 09:15:50,0,0,5
简***S,PLUS会员,商品很好，挺不错的。很喜欢。,2018-03-07 12:31:33,0,0,5
5***0,金牌会员,4000毫安的电池真是好用,2018-03-08 11:53:17,0,0,5
j***x,银牌会员,手里没得说挺好的，是正品！,2018-03-08 11:43:38,0,0,5
风***慕,钻石会员,目前用下来不错，速度很快！,2018-03-08 11:21:22,0,0,5
玩***1,钻石会员,头一次使用华为手机，不错哦,2018-03-07 09:09:19,0,0,5
大***-,金牌会员,拿到手上高端大气上档次。,2018-03-08 14:25:44,0,0,5
京***用,PLUS会员,拍照效果非常不错，电池续航比苹果强太多，刚入手其他功能进一步体验,2018-03-08 11:36:46,0,0,5
j***w,金牌会员,使用中，感觉不错，是正品,2018-03-07 10:37:23,0,0,5
0***J,钻石会员,一直用华为，希望物有所值,2018-03-07 10:20:26,0,0,5
j***c,银牌会员,非常棒的国产机！支持国货,2018-03-06 16:40:22,0,0,5
林***a,金牌会员,如果屏幕再大点就更赞了~~,2018-03-09 23:08:19,0,0,5
4***生,钻石会员,很好用，一直信赖京东。,2018-03-09 14:15:05,0,0,5
奥巴胖,PLUS会员,使用起来很流畅，华为的质感很好现在，国产货能这样真的很有自豪感,2018-03-08 19:34:10,0,0,5
b***5,钻石会员,不错，很好，支持国产机,2018-03-07 23:27:20,0,0,5
c***i,金牌会员,很好。高端大气上档次。,2018-03-06 23:32:28,0,0,5
s***g,钻石会员,用了好些时候，很满意,2018-03-08 22:26:49,0,0,5
崇***_,金牌会员,包装也太**随意了吧,2018-03-08 18:35:01,0,0,5
1***p,金牌会员,用过后来评价，很好！,2018-03-08 16:08:58,0,0,5
x***8,金牌会员,还没有使用以后再说了,2018-03-06 18:26:52,0,0,5
不***同,PLUS会员,从八到九，到现在的10pro  越来越不错，希望华为手机更上一城楼,2018-01-01 14:18:45,0,0,5
追***年,银牌会员,老公买的，他很喜欢,2018-03-09 13:48:14,0,0,5
初***5,金牌会员,不错啊，帮老板买的,2018-03-09 11:42:34,0,0,5
j***e,银牌会员,刚收货，用后再来追,2018-03-08 13:54:18,0,0,5
l***7,金牌会员,支持华为，支持国产,2018-03-07 16:33:58,0,0,5
罗***宇,金牌会员,除了UI太丑，价格稍高之外没啥大毛病。换第三方启动器后看起来顺眼多了！,2018-03-08 14:59:14,0,0,5
-***-,PLUS会员,看了好久，终于下定决心买了下来，大爱,2018-03-06 17:36:48,1,0,5
秋***6,PLUS会员[试用],手机拍照蛮好，快门挺快的，国产手机质量好。,2018-03-02 07:31:16,2,0,5
j***t,金牌会员,华为手机正品好用,2018-03-07 03:31:00,0,0,5
j***p,PLUS会员,送货速度快，手机速度快，照相效果好,2018-03-07 06:54:36,0,0,5
梦***觉,PLUS会员,东西很好值得购买，下次还要来的哦,2018-03-09 07:15:34,0,0,5
M***_,钻石会员,用了两个月啦，手感很好，运行速度也快。很满意！,2018-03-07 12:00:25,0,0,5
不***7,钻石会员,对于华为是挺有好感的，但是你现在这个Mate10还是Pro，不管你是产能不足也好，饥饿营销也罢，正在慢慢消耗我对华为的好感，买个Pro标准版的根本抢不到，非要买个套餐版，华为商城买手机可以7折买碎屏险，京东这个旗舰店6个月碎屏险400块，想加价你就直接说，这种手段真够恶心的,2017-11-20 21:39:54,124,47,1
S***8,PLUS会员[试用],还行，挺不错的,2018-03-07 17:42:11,0,0,5
x***e,PLUS会员,不错，非常赞。,2018-03-07 12:15:05,0,0,5
京东小猪55,金牌会员,不错，用的很好，稳定，大气！华为雄起！,2018-03-07 02:25:07,0,0,5
北***话,金牌会员,很好，比较满意，给老婆用的。,2018-03-01 23:08:23,1,0,5
s***8,PLUS会员,用了两个月来评价，总体来说速度挺快的，全面屏看得也很大，还有拍照片也很清。,2018-03-02 20:25:52,1,0,4
d***0,PLUS会员,用了两个月了，感觉非常好，反应也快，最主要的是满足我双卡双待的要求了。拍照效果也不错，很满意！车水马龙被我拍成这样也是醉了。,2018-03-09 09:28:34,0,0,5
C***l,钻石会员,第二次购买了！,2018-03-09 19:46:41,0,0,5
j***8,钻石会员,怎么没有SD卡,2018-03-08 14:53:36,0,0,5
古***山,银牌会员,宝贝非常满意！,2018-03-08 11:51:10,0,0,5
神***器,PLUS会员,续航还好，中度可以用一天有剩，壳子背部丝滑无比，**的拿唔住啊！放在桌子或者沙发哪里，会慢慢慢慢滑下去。第一天就差点摔了！颜值不错，比有刘海好看多了。别人拿来拍照发现，美颜好厉害，和note8比了一下。我了个去，根本不认识自己了！不太喜欢。,2018-03-07 12:02:18,0,0,5
寻***月,PLUS会员,第四个华为手机了，从5年前得充宽带送的几百块的，到后来自己买的，感觉华为手机的质量也在越来越好，支持国货！,2018-02-23 15:05:05,1,0,5
j***b,金牌会员,手机的清晰度很好用，拍出来的照片特别好看，手机运行速度也很快，电池续航能力也很久，感觉比我买的苹果7划算多了，手机好用,2018-03-07 09:40:56,0,0,5
j***s,金牌会员,手机外观还是挺好看，手感舒服！晚上下单第二天上午就收到，很快！卖家态度很好！不过想提的是查询电池容量怎么只有3900,2018-03-07 22:48:15,0,0,5
l***u,金牌会员,系统流畅外观精美，先用一段时间在来评论，华为产品不用说好，我第一款用的是荣耀6感觉还不错，所以我相信华为，虽然这5都是用苹果，上手安卓机还不怎么适应。我在华为体验馆玩了好几个小时才决定买mate10的，不相信华为的可以去体验馆玩上几个小时吧。勿喷，谢谢！,2017-12-01 13:51:36,1,0,5
jd_139822pkw,PLUS会员,京东送货师傅特别贴心，提前送到货了。很漂亮的手机，握感很好，比mate10手感好，方便握住。,2018-03-07 16:36:10,0,0,5
f***g,PLUS会员,相当好的手机，在国内几乎没有对手，和iphone比也就是价钱的差距。真心太好用了。,2018-03-07 22:30:27,0,0,5
z***i,PLUS会员,屏幕颜色鲜艳，全面屏很大够爽。我不玩游戏，但是对流畅度有要求，mate10Pro满足了我。原来的mate8用了快两年，开应用是有些慢的，着急拍照的时候开相机更是等到不需要拍照(︶︹︺)。。现在问题都没啦,2018-03-09 00:06:28,0,0,5
B***1,企业会员,给儿子买的手机，儿子反馈还可以，就是包装太差，手机盒子在京东包装盒里晃来晃去，没有任何填充物，这些都不算问题，手机质量没问题就很好，唯一不满意的是客服，怎么都不回复，不说话，就是联系不上供应商和客服，无奈只管大胆下单了！,2018-03-06 16:20:54,0,0,5
桃***3,银牌会员,本来想买灰色的那个 结果拍错了 拿回来一看却是意外惊喜，哈哈 很喜欢。不过就像网上说的，也有同样的问题，就是耳机插进去之后晃动幅度特别大 虽然说不影响使用寿命，但还是觉得看着不太舒服，应该是设计的问题吧，算是一点小瑕疵,2018-03-08 21:05:48,0,0,5
j***h,PLUS会员,华为杠杠滴，拍照效果很好，闪拍，速度快，图像惊艳，超级喜欢?,2018-03-03 18:10:32,1,0,5
G***9,PLUS会员,用了一段时间，有时候会出现打电话过来，接听没声音，性能不稳定啊？？,2018-03-09 14:50:19,0,0,5
c***2,PLUS会员,很好的手机。,2018-03-06 23:24:07,0,0,5
d***9,PLUS会员[试用],買了第二支了，真的很不錯，好用??????,2018-03-07 13:19:50,1,0,5
我***周,PLUS会员,哈哈，身边越来越多的土豪朋友还用华为，反应都不错，刚开始还担心不习惯安卓系统，真的太棒了，才5399，物美价廉。身边用苹果的，都说苹果升级越来越慢，打死不买苹果，估计都是一样的感受吧。,2018-03-08 00:02:01,0,0,5
王***可,PLUS会员,买了有一段时间了用着一直很好，支持国产，我就是国粉！,2018-03-06 11:21:42,1,0,5
R***呀,PLUS会员,毕竟是华为的顶级产品，系统流畅度等方面没得说，只是对屏幕稍稍有些不满。第一本质还是1080的分辨率，略微有些不爽；第二自带的壁纸不是特别能表现出OLED的优势，感官上不如三星的舒服,2018-03-06 14:32:04,0,0,5
j***2,PLUS会员,一直被苹果裹挟的我，下定决心要换一台国产机，选定了华为mate10pro，手机拿到手非常的惊艳，是我喜欢的颜色。运行速度，装机容量，拍照效果都很满意，手感也很舒服。物流更是飞快。,2018-03-07 14:11:58,0,0,5
a***1,PLUS会员,开始喜欢上了华为，品牌、功能、外观都拿得出手！,2018-02-16 09:08:00,1,0,5
l***s,PLUS会员,外观漂亮，运行超级流畅，OLED屏幕显示非常好,2018-02-14 19:15:52,1,0,5
鄙***的,PLUS会员,首先耳机插上去太松了，可以360度偏离，其次，测试分还不如mate10，抢购的时候，必须要买套装，等于变相加价，让人很不爽。最后如果不是商务人士，用一加5T足够了！防水性能还不敢测试，怕万一进水了咋办，挺喜欢的，屏幕大，清晰，除了有点重。看在我公司和华为友好合作面子上，给个一星吧。,2017-12-06 20:35:07,18,20,1
j***5,PLUS会员,支持国货 ，华为手机性价比超高，网速，相机都很好.,2018-03-07 06:38:46,0,0,5
j***i,PLUS会员,不错，手感屏幕都不错。指纹识别超快，比苹果8快，很满意。,2018-01-10 11:54:08,0,0,5
欢***光,PLUS会员,年会奖品，同事们喜欢，高大上的，支持国货。棒棒的,2018-03-09 14:18:02,0,0,5
s***h,金牌会员,包装完好，京东快递就是给力，昨天下单说预计7号送达，结果今天就到了，,2018-03-06 22:37:39,0,0,5
j***1,PLUS会员,电池没想象的经用。其他还好。拍照虚化不错，点赞,2018-03-08 22:43:11,0,0,5
中***中,金牌会员,正品不解释。,2018-03-09 11:52:09,0,0,5
过***2,钻石会员,不错挺好用的,2018-03-07 22:56:18,0,0,5
d***败,金牌会员,宝石蓝的手机很漂亮，pro机型比例比普通mate10要协调很多。,2018-03-07 13:22:49,0,0,5
郭***生,钻石会员,"PLUS会员 



刚用了一天，还在探索中，外形很好看，包装也很大气，指纹解锁特别好用，比我那个苹果6好用很多。不过我担心充电的那个位置，那一块板会不会断啊?京东快递就是快辛苦了。",2018-03-09 16:22:33,0,0,5
p***8,PLUS会员,正在用该手机评价，已经摔过一次了，没事儿,2018-03-08 00:04:03,0,0,5
z***f,金牌会员,上午下单，下午就收到了，开机很快，运行流畅，外观非常漂亮。,2018-03-08 20:30:38,0,0,5
S***y,钻石会员,非常好的购物体验，手机自带的手机克隆功能太棒了！拍照神器！,2018-03-07 15:29:34,0,0,5
j***4,钻石会员,外观很漂亮，适合女生用，也适合单手操作。机身很薄,2018-03-06 09:35:32,1,0,5
j***q,金牌会员,一直被苹果裹挟的我，下定决心要换一台国产机，选定了华为mate10pro，手机拿到手非常的惊艳，是我喜欢的颜色。运行速度，装机容量，拍照效果都很满意，手感也很舒服。物流更是飞快。,2018-03-07 14:42:23,0,0,5
m***4,钻石会员,苹果用了很多年，实在用不惯安卓系统，虽说已经比早些年改良很多。屏幕亮度经常需要手动调，真是很麻烦。上飞机开了飞行模式，居然不能恢复，重启才行。自拍自带美颜，电池抗用，其他真一般,2018-03-08 22:30:36,0,0,5
b***f,PLUS会员,拿到的手机，表面被贴了钢化膜，商家说是二次抽检保护手机所为。致电华为官网也没得到答案，商家态度倒是很好，解释完后就表态，如有疑虑可选择退货。嫌麻烦考虑中。,2018-03-08 09:51:33,0,0,5
s***1,PLUS会员,手机很不错，物流也超快，值得推荐,2018-03-08 23:01:10,0,0,5
J***q,金牌会员,手机是正品，包装未拆封，手机很流畅，用用段时间后进行追评,2018-01-24 23:14:21,0,1,5
j***q,PLUS会员,"用了一段时间感觉不错的，没发现什么不能接受的问题。
比较出色的是摄像  ，拍出来的照片比苹果?机都美 
其次是待机时间长，不像以前用的机子都是每天一充",2018-03-08 08:21:01,0,0,5
j***3,PLUS会员,使用了一段时间，感觉一般般，分辨率有点低，还不如mate10的高，玩游戏没有苹果的好，反应比较慢。电池容量高，重度使用者可以玩一天，平常可以使用两天。,2018-03-07 21:16:11,0,0,5
j***n,PLUS会员,老公用着挺好，吃鸡农药都不卡,2018-03-09 15:09:41,0,0,5
浓***宝,PLUS会员,拍照清晰，运转速度快，赞?,2018-03-09 14:06:20,0,0,5
j***5,PLUS会员,用着还行，就是拍照片颜色有些失真，玩游戏偶尔卡，有时候界面还黑屏，大部分时候还行，充电很快差不多一小时左右充满，不玩游戏一天半充一次，玩游戏就没准了,2018-03-06 21:11:34,0,0,5
云***9,金牌会员,用了好多年苹果，改用华为手机，原来一直纠结。上手后觉得一点都不比苹果差。很多功能苹果还不具备。国内厂家还是优先考虑国人的使用方式。还有充电快充确实好，电池也很耐用。,2018-03-06 16:14:52,0,0,5
逃***1,金牌会员,用了几天才来评价，买了Mate10pro个和小米mix2。华为10pro在手感，外观，操控性都没mix2好，玩王者偶尔会卡，最重要的是还会死机！五千多的手机不如小米，真是失望！小mix2玩王者会经常断网断流，460ms也是相当头疼，如果不玩游戏还是建议买小米！mate10pro感觉不值五千多，不知道那么多好评哪来的？很是失望！,2018-02-12 20:04:50,22,26,1
m***6,PLUS会员,非常不错的产品，货真价实。京东超级物流秒到家，服务态度周到细致，有了京东，再也不用去逛街逛超市了，特别是plus专享各类优惠，实在挑不出毛病,2018-03-07 10:37:59,0,0,5
j***a,银牌会员,给男朋友买的礼物，很喜欢呀，蓝色敲好看,2018-03-09 10:42:04,0,0,5
j***e,银牌会员,正品机子很好用，你值得拥有。好好好?,2018-03-08 18:35:25,0,0,5
t***4,钻石会员,我对京东一向信任。这次真的很失望。套餐价买了一台黑色的10Pro。屏幕碎了跟我说找百修宝。百修宝告诉我要只有屏幕碎才换新机。其他有磕碰一概不换。因为我的边上掉漆。我就想去换一下边框。被华为维修告知。边框属于屏幕。如果京东说屏幕碎换新机。这个应该是可以的。因为边框和屏幕连在一起是一个配件。随后我打电话给京东。被告知这个是百修宝定的规矩叫我去找百修宝。百修宝告诉我即使他们(边框和屏幕)是一个配件。边框坏了就是不能换新机。满满的失望。京东客服告知管不了。在不了解mate10Pro构造的情况下就让京东金融(百修宝)对屏幕上保险是不是对消费者太不负责任。如果能换边框我肯定换现在这屏幕保险钱只能当做送给***了。吃哑巴亏也没办法。很不愉快的一次购物。,2017-12-31 18:20:05,38,14,1
l***5,钻石会员,s收到了，感觉还不错，用过再详细评价,2018-03-06 14:38:54,0,0,5
l***0,钻石会员,不错，手机我只用华为，给力,2018-03-04 17:44:14,1,0,5
l***2,PLUS会员,商品不错，物流速度快,2018-01-12 23:00:17,0,1,5
乖***6,银牌会员,还行吧，没用多久，用用再看怎么样,2018-03-07 18:26:21,0,0,5
U***N,银牌会员,很不错，比预想的要好。,2018-03-06 17:56:15,1,0,5
y***e,银牌会员,目前用着没出现什么问题，就是没有匹配的屏幕钢化膜,2018-03-09 09:17:25,0,0,4
s***4,银牌会员,手机用了不到一个月，忽然发现电话本里有好多不认识的人的电话，而且都是一个地方-辽宁辽阳，我是北京的，根本不认识辽宁的人，京东自营店不会卖的是二手机吧？,2018-03-08 23:31:59,0,0,5
a***n,PLUS会员,排除苹果同价位的旗舰用过几款了（三星续航短 小米拍照弱  HTC的系统优化太差 ），依然还是回到了华为。这台没短板，用2年可以。,2018-03-06 16:17:41,0,0,5
P***丶,金牌会员,实物到手比商品图片好看多了，970确实可以，系统很流畅。徕卡双摄也没让我失望，照相很清晰，画质很好。屏占比够大，将屏幕下方按钮隐藏之后，屏幕很漂亮,2018-03-06 15:15:11,0,0,5
j***3,钻石会员,非常精致好看，老妈很喜欢,2018-03-09 09:11:43,0,0,5
忘***K,PLUS会员,一直都信赖京东，但这次有点小失望，商品的包装太次了 5000多块的商品就一层塑料包装 也没有泡沫，在华为商城买同样的价钱 有礼品相送 而京东没有，早知道在华为商城买了,2018-03-01 04:57:35,0,1,3
i***2,PLUS会员,用了两个月了，整体感觉很不错。就是电源键在中间，每次拿着正好按到那个位置，每天要重启很多次。巨崩溃，不知道开发者是怎么考虑的,2018-03-07 11:18:45,0,0,5
j***魔,金牌会员,手感不错，比n8轻很多,2018-03-09 08:47:35,0,0,5
w***7,PLUS会员,第一次用华为手机，安卓系统得适应一段时间，唯一的问题就是京东发货包装能不能改进一下，一个纸盒子就发过来了连气泡膜都没有?,2018-03-09 16:24:33,0,0,5
