名字,会员级别,评论内容,评论时间,点赞数,评论数,评价星级
j***e,银牌会员,高端大气上档次，国产机的机皇，速度很快一流。,2017-10-31 13:57:49,29,33,5
j***始,金牌会员,目前看挺好的?过段时间来追评,2017-11-01 21:17:41,54,38,5
s***3,PLUS会员,快递用的京东物流*广东三线城市头尾三天。机子是很不错的，但是明明备注了要开发票，结果只有一张缺了角的不知道能不能生效的保修凭证。而且机子新开封，保护膜在home键右侧等多处有密集的划痕，插着卡针的纸片上面也有折痕，机子没有印象中新机器的那种味道，处女座对瑕疵有点无法忍。不知道华为的品控就是这样，还是卖的是退货机或者返修机或者二手机。不过除此以，外机子本身还是不错的，新机到手正在把玩，但mate7竟然没有type-C的转换头，这点就不如三星贴心了。,2018-01-12 20:56:11,0,2,3
l***4,金牌会员,手感超好，大容量超高性价比，没买错，永远都支持国货,2017-12-06 23:39:55,1,1,5
忧***去,PLUS会员,"非常感谢京东商城给予的优质的服务，从仓储管理、物流配送等各方面都是做的非常好的。送货及时，配送员也非常的热情，有时候不方便收件的时候，也安排时间另行配送。同时京东商城在售后管理上也非常好的，以解客户忧患，排除万难。给予我们非常好的购物体验。顺商祺！
Thank you very much for the excellent service provided by Jingdong mall, and it is very good to do in warehouse management, logistics, distribution and so on. Delivery in a timely manner, distribution staff is also very enthusiastic, and sometimes inconvenient to receive the time, but also arranged for time to be delivered. At the same time in the mall management Jingdong customer service is also very good, to solve customer suffering, overcome all difficulties. Give us a very good shopping experience. Shun Kei kei!",2017-11-08 22:35:31,8,11,5
幽***鸣,PLUS会员,可以非常满意喜欢。。。。。。,2017-10-29 01:20:01,5,14,5
j***p,PLUS会员,体积和之前的5.5寸差不多，非常精致，速度也很不错,2017-11-03 19:59:02,4,5,5
j***r,金牌会员,等了一周，终于收到了，正在试用中,2017-12-08 14:59:34,3,1,5
爱***8,PLUS会员,其他的都还可以，就是声音不正常,2017-11-21 11:37:11,4,2,5
j***w,PLUS会员,不错哦！真心的不错?宝贝很喜欢，物流也很给力啊！用过再多追评价吧?,2017-11-26 16:40:08,1,2,5
j***k,PLUS会员,昨天收到货的，目前用着还不错，继续体验,2018-01-05 09:17:37,0,0,5
人***见,PLUS会员,帮同事买的。他感觉挺满意，别的同事也有想法，感觉挺精致的,2017-11-30 12:08:20,2,3,5
w***n,钻石会员,今天一早收到手机，手感一流，摩卡金显档次，这是我第四部华为手机了，一如既往的好用，这回买的最高配，反应速度那叫快！,2018-01-10 11:56:42,1,2,5
黄***5,金牌会员,京东给力 物流快 产品好 原装未开封  非常高大尚  一家人都用华为 下次还来买,2017-12-17 15:09:16,9,3,5
m***0,PLUS会员,物流速度快哦,2017-12-12 09:56:58,1,2,5
怡***瓶,PLUS会员,手机超级棒，屏幕清晰，不愧是国产高端机，旗舰级手机，运行流畅，不发热，电池给力，拍照给力，我拍了几张样片！唯一和苹果抗衡的！现在是mate10的时代，而苹果走向衰落！店家发货也很快，顺丰包邮！是官网原封版！一起买了两台，一台亮黑，一台摩卡！,2017-11-07 16:43:21,18,2,5
胡***购,银牌会员,拿到快递吓我一跳，怎样用这个包装啊，拆开看还好，里面有泡沫，正在试用阶段，总体感觉还好。支持国产！！,2018-01-02 19:33:24,0,1,5
j***岸,银牌会员,手机很棒，就是运气不好买早了，收到的是移动定制机而已，还好我不是移动用户，一直追华为和荣耀,2017-12-11 12:07:42,0,1,5
Z***7,银牌会员,发货速度太慢了，京东快递没有问题，手机运行速度超快手机很好，信号相当不错,2017-12-05 13:51:26,1,1,5
时***浩,PLUS会员,手机收到了，谢谢老板京东商城就是好。挺快的，手机高大尚，大气好用。高端大气上档次，低调奢华有内涵。,2017-11-01 18:54:30,9,2,5
h***a,PLUS会员,很大气，rgbw的颜色虽然还是有问题，但已经不错了，为华为的勇气点赞,2017-11-01 21:43:49,10,3,5
晓***陈,PLUS会员,昨天就收到货了，现在才刚打开，未拆封商家很僵信用。物流也给力 ，期待后面使用,2017-12-13 21:17:36,1,1,5
人***戏,金牌会员,一直想买    终于剁手买了支持国产支持华为,2018-01-22 11:13:39,0,1,5
为***念,钻石会员,续航能力强，屏幕看起来很舒服,2018-01-27 16:44:56,0,1,5
古***秋,金牌会员,"手机拿到后开机居然是显示已经登录了8个软件系统。
恢复出厂设置后一下就少了16个软件。
各位老板帮忙判断一下：这是神马情况？",2018-02-24 13:24:04,0,1,3
空***個,PLUS会员,华为老大哥手机做的不错呦，欢迎大家都来评论，包装盒子上档次，手机更不用吹了,2017-10-28 18:00:08,11,3,5
周***昇,PLUS会员,机器不用讲，比9还是有提升，但因为是新系统，优化还需要时间，不比MATE9流畅和省电，卖家坑，承诺48小时内发货，才加价200买的，结果3天才发，还忽悠消费者讲什么仓库自动审核是否是黄牛之类的话。。。。。。,2017-11-08 22:35:54,7,1,5
j***8,PLUS会员,华为真我品质，快递比我想像的要快，京东就是快值得信赖。,2017-12-01 07:00:29,1,6,5
奶***枪,PLUS会员,你不要太美，第一次用meta系列，真的很美。,2017-11-09 08:07:05,6,1,5
1***p,银牌会员,帮客户买的，客户非常喜欢，包装很结实拆都不好拆，希望手机以后用着没什么问题。,2017-12-17 21:29:28,1,1,5
车梦晨,PLUS会员,操作流畅性：手机特别好，发货也很快，对苹果失望了而转国粉，玩转了一天非常不错，玩王者荣耀也非常流畅，电量非常耐用，充电速度非常快，摄像头也非常清晰。给她点个赞。,2017-12-30 17:22:22,2,2,5
腿***基,PLUS会员,手机很满意，特别满意，官网抢不到只能价钱了，不过有京券可以用还是很划算的，快递很快 两天就到了，就是手机卡得换小号的，明天还得跑躺营业厅去。,2017-11-04 18:31:49,2,1,5
R***2,PLUS会员,首先，非常感谢店家搞的活动，预售买的。这次是帮我朋友买的，因为很早前我也是这家店买的米6，也很优惠。收到手机后验了下，是正品，原封正品！！！而且我很相信这家店，在这里买好几次手机了，如期发货了，可能是物流原因，搞到慢了点较于正常速度，但还是可以。请大家放心购买。来自花粉的评价。,2017-11-25 13:43:56,0,1,5
胖***富,PLUS会员,国产首选的华为，不负众望，非常满意，非常喜欢，商家也信守诺言，很快就收到了商品，打开看过，眼前一亮，商品和描述的一样一样的，不过香槟金没有摩卡金漂亮，建议欲购还是选摩卡金，64G一般够用了，相信京东，信赖京东，谢谢京东，谢谢商家……,2017-11-17 11:57:51,2,1,5
j***5,钻石会员,非常棒的手机，原封未拆，支持国产，用了一天才来评价真心不错,2017-10-29 08:42:04,2,6,5
中***K,PLUS会员,手机收到了，手感很不错，支持华为！完美。,2017-12-03 12:01:18,0,1,5
hansenyang2000nkd,钻石会员,很满意这次华为的mate10，由于是老用户 所以使用起来得心应手，感觉相机拍摄的速度提高了，成功率接近水果手机，色调有点夸张，自动感光的屏幕调节范围加大并且更加准确舒适。,2017-12-30 11:00:15,0,1,5
1***p,金牌会员,昨天下的单，今天就收到了，货正速度快，非常满意。正在试用中，试用结果再追加。,2017-10-27 19:32:36,2,2,5
j***r,钻石会员,包装很好，快递也快，作为公司活动抽奖送的，领导很满意，员工也都评价不错，一次很好的购物,2017-12-25 12:36:48,0,1,5
t***n,PLUS会员,极致全面屏、人工智能技术、徕卡双摄以及4.5G LTE网络，支持国货！,2017-11-03 13:31:04,0,1,5
熊***振,金牌会员,性能强劲，相机逆天，手感不错，系统丝滑。颜值超高，物流也很快。,2017-11-09 06:31:36,2,1,5
j***c,银牌会员,今天收到货，感觉还不错，具体情况用短时间再说。,2018-02-06 19:24:19,0,1,5
Y***G,银牌会员,支持国货，价格定低些让大众都能买得起这样所洋品牌统统出局。,2017-11-30 15:27:50,1,1,5
s***o,金牌会员,刚到手，感觉不错。原用M8。,2017-10-25 17:33:43,10,7,5
y***8,金牌会员,昨天下单今天收到，发货速度很快，开箱验货完好无损，验证为正品，下午用了一下，安装了不少东西，运行速度不错，还升了一次系统，说是有优化。手机外观很漂亮，不亏是华为高端机，很值得购。,2017-10-27 18:23:27,1,1,5
j***n,金牌会员,货好就是不是全网通的,2017-11-29 18:12:02,1,5,5
风***8,PLUS会员,屏幕清晰，系统流畅，拍照比9提升了点，，续航能力一般，,2017-11-05 01:01:32,6,1,5
m***a,PLUS会员,很快就收到啦，原来以为缺货要等，结果当天就发货啦，试了一下，应该没啥问题，新机存在翻新的可能性不大，全密封的，也挺流畅。最满意的就是发货速度，苹果6坏了，着急用，在全市场几乎都断现货的情况下，这么快就拿到了，太赞了！,2017-10-29 21:59:31,2,2,5
j***e,PLUS会员,手机收到了，用了几天才来评价的，跑分还是挺高的，运行也流畅，如果价格低点就更完美了。,2017-11-08 13:23:32,2,1,5
c***v,金牌会员,速度快，很快，比我的苹果快，金属机身有手感，全面屏漂亮，给老婆买的，真想和她换手机用,2017-11-22 21:49:29,3,1,5
j***v,PLUS会员,到货非常快，物流也很给力。下次还会再来的也会介绍朋友过来?,2017-11-02 21:05:08,3,1,5
f***M,金牌会员,什么赠品都没有价钱又贵手机不好,2017-10-23 17:32:31,8,14,5
我***啦,PLUS会员,第二部MATE10，第一部首批自营抢到的，第二部只能加价了，不过店家不错，不算黑。手机必须OK，推荐购买。优点是系统比较开放，安卓中最流畅，充电快，商务性好，做工优秀，档次也不错，信号和网速优秀，照相机秒杀苹果，国内外售价让人很爽。缺点是屏幕过分鲜艳，不算很顶尖的屏幕，系统比苹果要差一点点，电池不算很厉害，重度一天用不到，玻璃材质不如金属稳重。最后说一句，有大家的支持，国货才能更好，男士建议黑色，我已后悔！,2017-11-03 15:03:49,4,1,5
和***尚,PLUS会员,收到了，支持…国货精品,2017-11-18 17:09:23,1,1,5
飘***8,PLUS会员,手机高端大气上档次，运作速度很快，电池续航持久,2018-02-15 12:42:57,0,1,5
失***丶,PLUS会员,今天收到货，拿起来手感很不错，就是物流有点慢，整体来说还可以。,2017-11-01 13:31:39,1,1,5
j***y,PLUS会员,支持国产，高端大气，970的处理器确实很快，手感细腻。,2017-10-31 16:26:43,1,1,5
李***李,PLUS会员,好，速度快，快递员服务员态度好。,2017-11-09 19:20:18,3,2,5
j***k,银牌会员,用了几天才来评价的，好用的一批，性价比神器！！华为，国之骄傲。,2017-12-19 13:57:18,1,2,5
d***0,PLUS会员,东西非常棒，速度屏幕超好，支持国货！很适合国人习惯！,2017-12-08 10:32:10,0,1,5
独***j,金牌会员,华为不愧是中华精品，我现在只用华为！速度，外观，爽心悦目，最让我满意的和意外的是高强度一白天，到晚上竟然仍有20%，Okay，放心买！,2017-11-23 22:27:25,0,1,5
S***0,PLUS会员,华为的新旗舰还是很不错的！强悍的很哟,2017-10-29 07:59:23,2,1,5
1***6,PLUS会员,不想说啥了，说48小时发货，也没发，申请退款直接拒绝，说是已经发货，物流信息根本就没有，最后直接发个移动定制版，说什么我也要投诉！,2017-12-08 16:16:00,0,1,5
g***1,金牌会员,华为的系列产品还是相当不错，质量可靠，我很喜欢，已经购买了两个。,2017-12-25 08:56:56,0,1,5
T***3,钻石会员,期待已久的手机终于到货了。自己抢了，七八天都没有抢上还是，店主给力啊。,2017-11-01 20:09:55,0,1,5
x***4,钻石会员,终于收到我需要的宝贝了，东西很好，价美物廉，谢谢掌柜的！说实在，这是我网上购物来让我最满意的一次购物。无论是掌柜的态度还是对物品，我都非常满意的。掌柜态度很专业热情，有问必答，回复也很快，我问了不少问题，他都不觉得烦，都会认真回答我，这点我向掌柜表示由衷的敬意，这样的好掌柜可不多。再说宝贝，正是我需要的，收到的时候包装完整，打开后让我惊喜的是，宝贝比我想象中的还要好！不得不得竖起大拇指。下次需要的时候我还会再来的，到时候麻烦掌柜给个优惠哦！,2018-01-24 13:36:09,0,1,5
x***4,钻石会员,终于收到我需要的宝贝了，东西很好，价美物廉，谢谢掌柜的！说实在，这是我网上购物来让我最满意的一次购物。无论是掌柜的态度还是对物品，我都非常满意的。掌柜态度很专业热情，有问必答，回复也很快，我问了不少问题，他都不觉得烦，都会认真回答我，这点我向掌柜表示由衷的敬意，这样的好掌柜可不多。再说宝贝，正是我需要的，收到的时候包装完整，打开后让我惊喜的是，宝贝比我想象中的还要好！不得不得竖起大拇指。下次需要的时候我还会再来的，到时候麻烦掌柜给个优惠哦！,2018-01-24 13:36:09,0,1,5
x***4,钻石会员,终于收到我需要的宝贝了，东西很好，价美物廉，谢谢掌柜的！说实在，这是我网上购物来让我最满意的一次购物。无论是掌柜的态度还是对物品，我都非常满意的。掌柜态度很专业热情，有问必答，回复也很快，我问了不少问题，他都不觉得烦，都会认真回答我，这点我向掌柜表示由衷的敬意，这样的好掌柜可不多。再说宝贝，正是我需要的，收到的时候包装完整，打开后让我惊喜的是，宝贝比我想象中的还要好！不得不得竖起大拇指。下次需要的时候我还会再来的，到时候麻烦掌柜给个优惠哦！,2018-01-24 13:36:09,0,1,5
t***2,钻石会员,太棒了，運行速度很快，畫面超清晰。做工很細緻。,2017-11-06 18:51:08,2,1,5
梦***行,PLUS会员,一直在用华为，荣耀系列到mate8，再到P10再到mate10。忠实的花粉。手机非常不错！支持华为！,2017-12-15 17:11:37,0,1,5
j***k,银牌会员,这手机拿到真心喜欢，本来想买pro版，在官网抢不到，只好在京东买了，贵了快500大洋，不过还是喜欢……手机拍照也相当清晰……喜欢喜欢喜欢,2017-11-22 22:07:54,0,1,5
j***9,金牌会员,拍的全网通的，发货过来是移动定制的，垃圾店铺,2017-12-06 13:01:31,1,5,5
j***5,PLUS会员,"怎么说呢，我第一台mate7现在还在用只不过机身屏幕有破损不过这也不影响使用所以就接着果断的来一台mate10,希望华为越走越好",2017-11-22 08:36:30,2,1,5
d***炮,金牌会员,手机没问题，在山旮旯里都有4G网，的确很惊喜，以前的手机4G网打王者荣耀都会时断时续的，体验感不好，现在完全不用担心。4G运存也完全不虚，说句实话，哪怕运存有8G，在安卓系统下能用到的也不超过2G，主要的还是看内存了不是电影迷的64G完全够用。很棒的一款手机，附上mate10和mate7的对比,2017-11-13 12:55:36,0,1,5
j***1,金牌会员,总体来说还可以，性能各方面都还不错，就是手机电池不行，一会儿就没有电了。,2018-03-02 22:53:51,0,1,5
j***6,金牌会员,手机比较满意，物流速度太慢，商家加价不太合理，国产手机精品不应玩饥饿营销，为了支持国产还是忍了,2017-11-26 18:10:01,0,1,5
迷***2,银牌会员,相到不错 特别是相机功能,2017-11-25 08:55:48,1,1,5
h***6,金牌会员,心仪已久的mate10到手，相当不错，我是华为迷，为这款手机点赞?,2017-10-24 17:42:00,21,2,5
j***9,银牌会员,还算不错，我要下单的是全网通。发货过来给我的是移动定制的。我想问能退货吗,2018-01-05 14:36:31,0,1,5
法***狗,PLUS会员,在京东自营和华为商城一直买不到，在这家买了，也没有贵多少，发货速度也在可以接受的范围内，而且机子是新品，质量没问题。良心店铺，点赞。,2017-11-06 22:25:24,0,1,5
y***2,银牌会员,"华为的这款手机确实不错，是款让苹果生惧的产品，从mate7,8到mate10，这是我购得第三部华为手机，华为我看好你哟。",2018-03-08 21:24:19,0,1,5
朝***6,PLUS会员,可以可以，店家挺给力的，手机也不错，再用几天试试看再来追评！,2017-11-03 10:26:56,1,1,5
j***v,金牌会员,手机今天收到的，看起来不错，中午下载的微信莫名其妙就丢了，过一会又回来了，有点晕，快递师傅还是比较负责的。赞。过几天再来追加评价。,2017-10-25 21:43:23,2,1,5
古***o,PLUS会员,赠品挺好的，官方自带贴膜，手机套。留着备用,2018-01-16 08:53:30,0,1,5
h***8,银牌会员,物流也很给力，满意！机子很漂亮，使用了几天，除了屏幕太容易留手印，其它都不错。,2017-11-25 02:38:12,0,1,5
D***8,PLUS会员,商品很不错，很喜欢，期待下次再买。,2018-01-03 19:22:05,0,1,5
j***2,PLUS会员,超级好，家人喜欢，送货快。,2018-02-14 13:42:51,0,1,5
a***v,PLUS会员,一拿到手就开箱了！贼流畅，不愧是国产机皇！用着高端大气上档次！！感觉我都像是老板了！！哈哈哈哈,2017-11-07 12:43:26,2,1,5
曾***厂,银牌会员,宝贝已经收到了，我玩了一个下午了，很喜欢?，有需要的朋友可以来购买哦！,2017-11-15 22:30:23,0,1,5
j***7,PLUS会员,华为mate10的无边框效果很赞，手机续航也很好，就是PDF的阅读速度还比不上苹果，这感觉是安卓阵营的通病,2017-12-31 19:46:01,0,1,5
Z***7,钻石会员,外观好看，和图片一样，信任国产，支持国产!,2018-02-11 17:23:27,0,1,5
j***j,钻石会员,华为mate10，又一代旗舰机，很是抢手，一直买不到，能在这家店买到了，很是不错，手机高端，配置高,2017-10-31 23:09:14,1,1,5
W***u,PLUS会员,送人的，暂时好用，期待质量经得起验证。,2017-12-08 20:48:51,0,1,5
漫***佳,银牌会员,手机收到包装很好，手机性能一级棒。已经送给出去了，很满意。,2017-12-01 20:29:05,0,1,5
j***9,PLUS会员,物流很快，质量不错，杠杠的，非常完美,2017-11-24 15:40:03,0,1,5
R***7,金牌会员,到货稍慢，不过东西还是不错的，果然是国产机皇，支持华为！,2017-11-20 10:16:13,0,1,5
Z***H,银牌会员,还可以吧，就是这个手机是移动制的,2018-01-13 05:30:59,0,1,5
j***g,银牌会员,第一次用华为的手机，还不怎么习惯?。不过真的很不错。,2017-11-27 10:44:21,0,1,5
8***g,金牌会员,机子很好用，机子速度很快，快递比想像的快，支持国产,2017-12-13 18:31:47,0,1,5
j***r,银牌会员,收到货也用了几天了，感觉特好！,2018-01-07 21:03:22,0,1,5
j***f,钻石会员,漂亮大方，非常喜欢。第三部华为手机了。一如既往的好。,2017-11-23 15:41:12,0,1,5
j***m,金牌会员,还不错，刚到手，用起来还行，,2018-01-11 18:07:44,0,1,5
J***n,金牌会员,手机很满意，果断好评,2018-03-05 15:13:11,0,1,5
1***n,金牌会员,手机反应很快，手机很棒,2018-02-13 22:31:53,0,1,5
1***p,银牌会员,正在试用中，感觉还不错,2018-02-08 18:39:06,0,0,5
j***7,PLUS会员,用了手机还不错，就是贵了点,2017-12-07 16:56:19,0,0,5
j***7,金牌会员,非常不错，就是发货慢，一直在第三方仓库待出库。,2017-11-22 23:14:43,0,1,5
j***5,PLUS会员,每次新手机都是京东买的，物超所值，感觉很不错，还送了钢化膜和手机壳，好评！,2017-12-03 19:15:29,1,1,5
米***2,PLUS会员,送货很速度，手机也很好！,2017-11-26 22:25:19,0,1,5
k***n,钻石会员,很快降价，又不返差价，下次再也不买第三方,2017-12-25 22:16:20,0,1,5
f***b,PLUS会员,手机使用很好???,2017-11-23 14:33:44,0,1,5
j***i,PLUS会员,真的手机很好用上网速度快,2017-11-21 03:17:46,0,1,5
jd_182785vpf,金牌会员,快递员最好，快递员好好好,2017-11-20 00:36:13,0,1,5
j***n,金牌会员,第一次用华为手机，总体满意。产品不错，速度也比较快，唯一不足是制造的有些粗糙。,2018-01-31 12:44:29,0,1,5
一***扣,PLUS会员,手机很好，看着大气值得买,2017-11-15 12:54:14,0,1,5
g***0,PLUS会员,很喜欢。支持国货！！！,2017-11-23 15:06:00,0,1,5
A***强,钻石会员,国产手机 做的不错,2018-01-30 06:52:45,0,1,5
L***人,银牌会员,感觉有点宽，单手握着没以前手机手感好,2017-12-25 13:37:25,0,1,5
H***张,PLUS会员,包装完好，快递哥很负责任，手机手感好。还没开始使用。支持国货支持华为。,2017-11-16 17:09:57,1,1,5
s***0,银牌会员,用一个月了，总体还不错，远行还可以。,2017-12-16 10:03:26,0,1,5
沸***高,PLUS会员,非常不错，除了价格稍微高了点之外，其他很好，赠品也不错的！！！,2017-10-27 17:24:33,2,2,5
h***1,钻石会员,帮朋友买，朋友用了一 天，没说什么。,2017-11-25 12:59:07,0,1,5
w***你,金牌会员,质量不错物流也很快卖家服务态度很好,2017-11-21 12:18:49,0,1,5
z***5,银牌会员,东西不错，各个环节的服务都挺好,2017-12-12 03:28:12,0,1,5
j***q,钻石会员,很不错的，值得购买的，推荐!,2017-12-19 20:29:10,0,1,5
谢***R,金牌会员,这价格浮动真大，有点不敢相信！,2017-12-02 13:31:26,0,1,5
文***4,钻石会员,快递比预计提前一天！我比较幸运，拿到了全网通版，今年运势好哦！,2018-02-23 13:09:46,0,1,5
御***下,金牌会员,不错，速度很快，没有指纹识别功能，之前用的mate8有，我以为10也有呢，整体还可以的,2017-12-28 07:13:16,0,2,5
j***o,金牌会员,很不错 外观高端大气 屏占比非常高 更重要的是虚拟键没有了 赞赞赞,2018-01-23 22:59:56,0,1,5
姬***宝,银牌会员,手机不错，鲁大师跑分第一名,2017-12-24 14:50:20,0,1,5
逼***症,银牌会员,首先物流是相当快的 然后手机收到了一切都很完美。谢谢谢谢  。,2018-02-06 21:33:23,0,1,5
x***7,钻石会员,饥饿营销游戏新利器。。。。。,2017-11-22 08:17:06,0,1,5
T***8,金牌会员,第一次用华为的手机感觉不错,2017-12-06 13:02:21,0,1,5
X***r,金牌会员,手机不错，速度快，手感极佳,2017-11-28 19:58:42,0,1,5
z***2,银牌会员,屏幕比我原来用的MATE8小了些，但是看起来更上档次，握感更舒服。这个商家有很多优点，第一很热心，我第一次因为买错了，很快几个小时就给我退款了。第二，物流还是蛮快的。第三，送的礼物非常实惠，有膜还有套。第四，他们还有白条服务，免息的哦，我问了一下实体店，这个不免息的话要400多的利息，可以说力度非常大！,2018-02-12 13:59:11,0,1,5
金***视,PLUS会员,漫长的等待终于到货了，屏幕清晰看着过瘾，支持一下,2017-11-05 20:52:02,2,1,5
自***0,钻石会员,手机还是不错的，比较好用,2017-11-28 21:23:41,0,1,5
明***A,银牌会员,物流很快，东西也是正品。,2017-11-26 11:14:29,0,1,5
註***伱,银牌会员,手机玩游戏很强大,2018-01-24 11:16:31,0,1,5
韓***團,金牌会员,货真价实，下次继续,2017-11-08 13:05:45,7,1,5
梁***豪,钻石会员,给我的是移动版的,2018-01-14 20:31:14,0,1,5
j***妮,PLUS会员,手机还不錯?，赠品也都有收到，就一开始設置有点烦、其它都好,2017-12-14 07:44:55,0,1,5
穿***子,钻石会员,包装完好，就是贵了点,2017-11-24 09:12:24,0,1,5
k***x,PLUS会员,高端大气上档次，不愧是好的品牌，基本是老用户了，运行速度挺快的,2017-11-08 19:52:22,0,1,5
