名字,会员级别,评论内容,评论时间,点赞数,评论数,评价星级
j***乄,金牌会员,哈哈哈哈哈哈哈哈好，赠品也行,2017-06-24 21:06:59,0,0,5
街***默,银牌会员,这是京东买的第二个手机，运行速度还可以，价位也便宜，外观又好看，觉的很赞,2017-08-11 15:43:43,1,0,5
j***の,金牌会员,手机挺好的，摸起来手感也不错，在千元机里还是挺不错的送的东西也挺多的，这款手机是支持指纹解锁的,2017-05-20 15:39:51,0,0,5
9***尔,金牌会员,不错，帮朋友买的，她说很好看，下次还会再来,2018-02-09 20:50:34,0,0,5
朱***6,银牌会员,手机很漂亮，运行快，拍照片清，通话清晰，上网快，卖家服务好，发货快，物流快,2017-10-09 12:04:57,0,0,5
j***0,金牌会员,还可以吧，反正不是我用，给家人买的，本来打算买小米的，不过跑分70000还过得去吧,2017-07-31 11:54:26,0,0,5
A***9,银牌会员,外观漂亮，拿在手机也不重，在千元手机大军里性价比很不错，给妈妈买的，她很喜欢,2017-09-09 16:29:56,0,0,5
j***9,银牌会员,手机好看，就是自带人家多了几个，玩游戏超级爽了，没毛病6666666666666,2017-08-07 11:22:11,0,0,5
j***p,银牌会员,刚收到货，包装完整，正品，开机运行快，好评。,2018-01-07 10:07:42,0,0,5
鈲***_,铜牌会员,手机颜值很高，用起来很流畅,2017-06-04 19:37:17,0,0,5
梧***6,银牌会员,不错喜欢，很满意的一次购物,2017-06-01 20:51:24,0,1,5
l***6,银牌会员,手机很好，很满意，用了三天了，觉得电池挺耐用的，色彩也很好，安装应用时也很快，赞一个,2017-06-16 09:12:51,0,1,5
j***7,金牌会员,宝贝刚收到就打开看了，很满意，赠送了很多配件，全部都送到了，还没使用，等用后再来评。,2017-06-09 20:49:53,0,0,5
终***于,银牌会员,和新买的壳一起晒晒，颜值爆表，玻璃外壳可以当镜子用，随时臭美?，满意的一次购物,2017-04-27 19:01:49,1,0,5
j***f,银牌会员,手机特意用三天再评价，灵敏，淸晰，而且还送了配套配件。好用。赞,2017-11-15 21:33:50,0,0,5
j***L,银牌会员,手机外表很好看，手感很好，物流速度也很快，用起来怎么样，后续用了再追加评论,2017-08-03 15:39:12,0,0,5
七***月,银牌会员,手机颜色颜值高，喜欢,2017-06-14 16:05:09,0,0,5
风***飘,银牌会员,我要白的，你给我金的，下次注意啊,2017-03-19 10:59:59,0,0,5
小***嘟,金牌会员,机器不错，做工质量看着都不错。触感不如苹果，但也不错了。功能齐全。,2017-04-23 21:43:39,2,0,5
D***n,钻石会员,包装相当简单，颜值还可以，双面玻璃，系统反应还行，因为不怎么玩游戏，普通使用一天左右，有的软件可以删掉，内存20左右，其他还行吧，还送了贴膜，外壳，自拍杆，廉价耳机，性价比较高,2017-12-13 10:37:06,0,0,5
水***5,金牌会员,宝贝收到，开心购物。,2017-06-01 00:48:33,0,0,5
小***7,银牌会员,给家里长辈买的，还是很满意的。功能基本够用，反应还算快吧，指纹也灵敏。,2017-08-21 09:53:00,0,0,5
jd_150138pay,银牌会员,手机还行，就是现在买手机没有配送耳机就是不太好了，算了，自个在买一个吧！,2017-07-31 10:24:17,0,0,5
鹜***尘,钻石会员,很好的手机！价格便宜！物有所值！还会惠顾的！很满意的一次购物！谢谢?,2017-08-21 08:16:05,0,0,5
g***f,银牌会员,怎么是移动定制版本,2017-06-13 18:35:48,0,0,5
晰***昊,金牌会员,第二次买了，家里孩子小总摔手机，京东买的方便，用的放心,2017-12-05 10:14:41,0,0,5
网***事,钻石会员,用了一个礼拜才评论，手感不错，已经是我的第四台华为手机了，支持国货,2017-08-16 20:20:07,0,0,5
d***u,PLUS会员,手机看使用人群，我感到这款手机已经够用了，原来ROM只有8G或16G的现在翻了一倍，运行而且是4G的，非常满意。,2017-06-30 14:21:37,0,0,5
j***c,银牌会员,手机性能很好外观好看高端大气上档次玩手游一点也不卡很流畅。。。,2017-06-19 10:38:10,1,0,5
余***9,金牌会员,华为的机子用起来速度快，国货精品，开机玩了几天再来评论的，确实很好。,2017-07-21 11:39:14,0,0,5
j***1,银牌会员,手机已收到，很漂亮，但感觉还是被忽悠了，我明明看的选的都是全网通，但到手却是移动定制版，唉！算了，千元手机又是第三方发货，就这样吧！,2017-06-11 13:36:28,0,0,5
j***k,铜牌会员,手机到了，很喜欢，东西送的也蛮多，物流跟客服都跟给力,2017-08-27 12:54:05,1,0,5
2***3,银牌会员,好垃圾的手机，买给老人用的，本来电话就少，过了半个月老人才告知拨打电话时对方听不见声音，只有免提对方才能听见，这种情况不是时时都发生，关机重启或升级一下系统又正常了，后联系客服叫我寄回去检测但是要付运费，我真是服了才半个多月的手机有问题还要开钱寄回去，而且检测时间一两个星期，老人之前的手机烂了才买的，由于没有替换手机所以就不想翻修只能将就着用了，还是tb好，一年换新，后悔在京东买这破手机,2018-02-11 01:28:51,0,0,5
j***k,铜牌会员,漂亮的人配美丽的手机       建议大家可以买,2017-12-07 23:11:36,0,0,5
j***＄,金牌会员,还是不错的，快递也快，第二天就到货了。颜色要是不要这么深就更好了。,2017-04-25 09:22:40,1,0,5
东***2,银牌会员,这手机太漂亮了！支持华为！,2018-01-19 14:15:32,0,0,5
你爱的是他伤的是我,铜牌会员,我选了个流光金，看起来还不错，用的也还可以，外表也挺好看的哈哈，,2017-07-31 15:55:46,0,1,5
山***说,银牌会员,颜值不错，反应快。就是不知道用久点会不会卡。相机有点渣,2017-07-09 18:35:03,1,2,5
j***n,银牌会员,好用，物流速度快,2017-08-09 19:40:49,0,0,5
j***z,银牌会员,"手机回来了~
颜值爆表~拍照也挺好的~~华为果然没让人失望~还会再支持",2017-08-05 14:54:26,1,0,5
阿***c,PLUS会员,手机用了一个月才来评价，4+32g内存有点不够用，平时使用还是有点卡，不流畅，以后加钱上9v,2017-10-07 09:05:38,0,0,5
j***7,银牌会员,挺好的就是卡就一个，还是最小的。我还好有两个卡有一个正好。,2017-08-19 17:27:48,0,0,5
j***i,银牌会员,手机还好。电池有点不耐用。送的贴膜也不好。其他的没什么问题。,2017-07-27 17:40:46,0,0,5
星***士,钻石会员,好好，手机很好看，手感很棒。给力的一次购物！,2017-11-21 06:58:11,0,0,5
j***l,铜牌会员,昨天下午收到的！看着还行！不知道是否是正品！！,2017-11-03 16:57:18,0,0,5
j***w,铜牌会员,第一次在京东购买华为手机，用了几天还是很不错的?支持国产手机,2017-07-11 12:54:26,0,0,5
j***k,铜牌会员,货收到，跟卖家描述的一样，成功的一次购物，就是不知道是不是正品，等过两天拿到售后不去检测一下再评价。,2017-12-18 17:00:24,0,0,5
j***c,金牌会员,买给儿子的，儿子很喜欢，赠品一样不少，手机很漂亮！,2017-07-09 13:59:58,1,0,5
梦***2,金牌会员,看外观还不错,2017-06-04 09:55:27,0,0,5
j***7,银牌会员,手机等到了，很棒，帮姐夫买的，他说很好用，还送到村门口，服务态度超好，目前没发现任何手机问题！比其他店还要实惠一点！,2017-08-09 12:02:57,0,0,5
金***人,金牌会员,外观超炫，超花，很符合我的爱好。触感也不错，而且蛮轻的，很喜欢。,2017-06-03 18:57:34,0,0,5
jd_157776cur,银牌会员,用了一个月才来评价！感觉很好，运行流畅。颜值高，同学说有点像爱疯,2017-05-27 12:45:26,0,1,5
荒***雪,银牌会员,手机触摸手感挺好，颜色与图片相同，总体来说挺好，很喜欢,2017-08-13 18:37:13,0,0,5
j***h,银牌会员,手机不错，外观时尚，赠品很多，物超所值，看好华为手机，很满意,2017-06-16 23:40:49,0,0,5
j***c,银牌会员,发货物流飞速，送的赠品也不少，漏开了发票马上就补寄了，服务很满意，手机很漂亮，手感一流，反应快，上网速度可以，给孩子买的，这个价位很合适，希望质量保证，相信的品牌,2017-06-02 17:53:14,2,0,5
j***u,银牌会员,华为荣耀手机我只一直用这个牌子的，质量和运速都很好，,2017-08-13 21:50:32,0,0,5
j***g,金牌会员,货已收到，货真价实愉快的购物，物流给力,2017-11-25 13:43:13,0,0,5
隐***铭,钻石会员,信赖京东，信赖国货精品，好评必须的！,2017-11-30 08:48:59,0,0,5
小***家,金牌会员,全网通，绝对正品，值得够买，使用了一下非常好。,2017-09-04 20:36:35,0,0,5
马里奥不懂奥利奥,银牌会员,手机很不错，对物流也很满意，以后会继续支持京东的?,2017-07-28 13:36:34,0,0,5
j***1,银牌会员,手机感觉很不错，手感很好。物美价廉。,2017-11-16 17:44:02,0,0,5
提***付,PLUS会员,外观还行，速度还行，自带n多电话，营销电话，已打拼音就出来，并无法删除，网查无法删除，可恶，极其可恶！华为荣耀怎么也是一个民族特色,2017-12-30 16:38:15,0,0,5
j***y,铜牌会员,使用了两天才来评价，手机是正品，很满意的一次购物,2017-08-04 10:48:33,0,0,5
j***a,铜牌会员,手机非常不错   没有磕碰  给个好评,2017-07-29 10:12:38,1,0,5
如***单,银牌会员,还不错，用了几天了还没发现什么问题就是送的钢化膜自己不会贴，没贴好，不过可以先用着！,2017-08-25 15:50:40,0,0,5
王***華,银牌会员,包装结实，物流给力，送的套和钢化膜特别的好。。。,2017-07-21 10:42:21,0,0,5
w***0,金牌会员,嗯嗯，东西收到了我是买给家人用的。我先检查了一遍，手机是正品，只是价格浮动太大了哟，希望婆婆会喜欢，还送了很多配件，谢谢。反正我自己也比较喜欢这款。??,2017-11-01 10:28:52,0,0,5
S***b,银牌会员,物流快，手机好，棒棒棒！值得购买,2017-06-10 17:09:39,0,0,5
l***3,银牌会员,用了两天了，今天才冲电，机子的反应灵敏，外型也漂亮，,2017-06-11 06:27:28,0,0,5
巴***下,金牌会员,收到钢化膜就坏了,2017-04-05 20:59:47,0,0,5
Q***M,银牌会员,手机和描述的一样美观，还没用，看样子应该很不错的，如用的好以后还会买的，快递员态度好，我经常从京东购物，支持京东,2017-06-16 13:22:29,0,0,5
j***d,银牌会员,手机是正品。质量杠杠滴。买了两台了。就是没有耳机。不知道为什么现在买手机耳机不算配件了。难道是中国人会做生意。耳机还得自己买。厂家有赚钱。我觉得不要这样营销。老百姓伤不起。,2017-06-06 12:05:40,0,0,5
土***2,银牌会员,手机到了好几天了，很喜欢，卖家很贴心，好评,2017-08-19 15:55:04,0,0,5
小晓93,金牌会员,非常不错，这是我在京东买的第二部了。无可挑剔！,2017-07-15 10:16:48,0,0,5
你洛成-血-,银牌会员,收到货了，感觉还不赖，具体的就要用了才知道,2017-08-17 12:28:38,0,0,5
j***e,金牌会员,不错的手机很流畅，孩子很喜欢青春版我做主白色漂亮,2017-06-24 01:45:41,0,0,5
1***p,银牌会员,很不错的手机，外观非常非常漂亮运行流畅很美,2017-08-06 10:42:15,0,0,5
果***妈,银牌会员,初中生用，表示不错，大小合适，拍照效果及音质不错。颜色没有想象中的好。听说金刚膜和手机保护套还没出，买不着，机身很滑，总担心。快递物流偏慢，态度不错。,2017-03-12 19:52:03,3,3,5
j***1,金牌会员,宝贝挺好用的，和图片上一模一样，买给家里人用的,2017-06-26 21:23:12,0,0,5
E***o,银牌会员,手机很漂亮，绝对是正品，未拆封，物流很快，两天到货，下次在来这里买！！,2017-03-21 14:48:58,1,1,5
a***l,银牌会员,手机工能不错，颜色也非常好看！你值得拥有。,2017-07-19 11:48:33,0,1,5
V***Z,铜牌会员,速度特别快，像素也好，安装王者荣耀也很快，不错的一个手机，替同学买的，我要是有需要还会再来，,2017-10-04 09:19:57,0,0,5
v***Q,银牌会员,很好，物有所值。,2018-01-30 15:58:18,0,0,5
心***薇,金牌会员,不错，手机性价比高。买给我妈妈使用的。我觉得华为很棒。哦耶耶,2018-01-27 15:23:26,0,0,5
j***s,铜牌会员,虽然有台风，但是依旧很快就到了，手机很不错还有很多赠品，4g的运行内存够用了，很满意的一次购物。,2017-08-26 18:37:42,0,0,5
殷***山,金牌会员,手机套，手机很好，也很好用最主要是实会,2017-08-04 21:37:20,0,0,5
Y***_,银牌会员,手机不错，网上查询正品。反应速度比我的荣耀7感觉要快，千元机颜值挺好。喜欢，价格比官网优惠！！！,2017-08-21 18:48:15,0,0,5
j***a,银牌会员,刚拿到，挺不错，手感和灵敏度不错，这个价格买到这样手机，很划算，过段时间不知道卡不卡，到时候再说,2017-08-20 19:53:20,0,0,5
j***5,PLUS会员,好，原封机器，就是发货速度能快点就好了,2018-01-29 16:35:28,0,0,5
长***主,PLUS会员,挺不错的，女朋友挺喜欢的，外观好看,2018-02-25 13:39:53,0,0,5
家和天下yu,银牌会员,这已经是在京东买的第四部华为，华为质量不错的，华为荣耀8青春版做为千元机，值得入手，颜值高，用起来也很流畅，反正也不怎么玩游戏，5.2屏正好，总的来说这款手机不错,2017-06-23 19:13:27,0,0,5
酒***哥,钻石会员,手机已经收到了，很漂亮，挺不错的。,2017-08-21 07:52:54,0,0,5
j***限,银牌会员,一直都想要一个蓝色的，这次终于买到了，刚拆开的时候十分激动，然后就迫不及待的试了一下，很流畅很好，是正品,2017-06-03 13:46:43,0,0,5
1***1,PLUS会员[试用],手机挺好的，物超所值吧。满意,2017-10-05 15:12:43,0,0,5
b***V,银牌会员,挺满意的，这个手机还行，挺好看的，钢化膜有点儿坑，没用几天就掉了，帮忙贴的师傅说都这样,2017-10-16 16:23:25,0,0,5
j***1,金牌会员,华为手机确实不错，这款手机外观漂亮，个人感觉比我原来的P9还漂亮，而且价格非常实惠，值得拥有，用了几天，很顺畅，像素高，日常使用完全很好！,2017-12-13 21:09:18,0,0,5
丘***可,银牌会员,手机好漂亮，给家公买的，希望他喜欢,2018-02-07 20:14:47,0,0,5
杨***龙,银牌会员,华为荣耀8手机，我用了一段时间质量廷好我买对了支持国货！,2018-01-24 05:38:03,0,0,5
f***5,金牌会员,东西不错，挺好用，还有许多赠品。快递小哥也挺给力。,2017-04-06 20:11:48,0,0,5
东***燕,银牌会员,物超所值！很喜欢，还送了很多小配件,2017-05-06 18:48:54,1,0,5
j***z,银牌会员,宝贝跟店家描述的一样，用起来棒棒哒,2017-07-28 00:17:29,0,0,5
j***0,银牌会员,买了两个，物流挺慢的，赠的钢化膜不太好，但是手机还不错,2018-01-29 15:18:06,0,0,5
我***x,铜牌会员,怎么说呢，这个手机颜色是没的说，还有自身的内存跟运行，除了像素差了一点点其他的都还是很完美的,2017-08-16 16:57:54,0,0,5
x***e,银牌会员,手机已经用上两天，感觉很不错，运行很流畅，我也没下游戏试玩。各应用间切换很迅速。对于这个价格来说，性价比还是超高的。,2017-04-21 10:07:59,0,0,5
追自己的我,PLUS会员,收到货了，机子很好看，曲面屏很有个性，买给奶奶用的，很喜欢,2017-03-27 08:29:43,5,9,5
j***1,铜牌会员,"收到手机用了半天感觉还可以，就付款了，到晚上手机就出问题了！屏幕下方出现一道亮线，有时候还闪，直接换
货，寄过去4-5天了，流程才走了不到一半，说是7-15个工作日才能处理好，当时买手机的迫切心情一下子被搞没了！对售后真是相当失望！",2017-11-28 14:17:03,3,0,5
夏***2,金牌会员,到货就用了真心喜欢，手机质量好颜色好看，真的不错卖家很细心回答问题谢谢，喜欢的下手买吧便宜质量放心,2017-06-13 13:44:29,0,0,5
w***6,银牌会员,物流很快，手机外观很漂亮，不过手机多玩一会儿眼睛很赤！,2018-01-14 18:15:37,0,0,5
j***a,银牌会员,"手感真好，像素也好,绝对是正品???",2017-06-16 21:21:05,0,1,5
R***W,银牌会员,收货时拿女儿专卖店买的同款作了比较一模一样，擦卡打了一个电话声音清晰别的功能还沒用，。,2017-09-06 06:42:41,0,0,5
解***帝,银牌会员,不错，可以的，很漂亮，大气，很喜欢。,2017-06-11 21:24:32,0,0,5
j***c,银牌会员,手机挺好的，还送了手机壳和膜,2017-07-25 14:52:05,0,0,5
烟***7,PLUS会员,很好，终于等到了！京东小哥辛苦了,2017-06-23 10:49:33,0,0,5
j***8,银牌会员,今天才拿到感觉还行。。,2017-06-21 21:30:07,1,0,5
w***8,银牌会员,下单后物流较快，虽远在深圳，但三日内可收货，赠品多多!同比价格也便宜，用得还好，相信华为!,2017-07-08 05:46:17,0,0,5
j***d,银牌会员,款式很喜欢，速度也很快，用用看看，挺好的好评！,2018-02-05 07:09:23,0,0,5
杰***8,银牌会员,手机给力，快递也快，很喜欢华为，支持国产货,2017-04-06 12:14:52,2,0,5
心***号,PLUS会员,机器绝对原装 还不错 颜色 速度 各方面都OK 喜欢 一直信赖京东 给力 物流速度太慢,2017-07-28 13:50:19,0,0,5
j***r,银牌会员,谢谢卖家送的，好。,2017-05-04 10:15:08,2,0,5
j***3,铜牌会员,手机好用哦，用着方便。,2017-08-22 00:07:06,0,0,5
星***c,PLUS会员,手机收到了，是正品，屏幕挺大的，运行速度不错不卡，下次还会再来光临,2017-07-20 18:30:31,0,0,5
j***s,铜牌会员,挺好的。用起来挺流畅。,2017-08-17 17:05:15,0,0,5
王***港,银牌会员,颜值高， 不错的千元机,2017-08-14 19:46:12,0,1,5
j***a,金牌会员,手机不知道怎么样，现在还没用,2017-03-31 10:20:50,1,1,5
j***o,铜牌会员,颜色我很喜欢的，用的还好，物流的速度不是很快,2018-01-26 00:53:33,0,0,5
潘***I,银牌会员,很杂事  很沃野,2017-08-20 18:10:23,0,0,5
j***4,金牌会员,手机很好用  手机很薄  手感也好  送的膜坏了  老板说给补一个  很好说话,2017-09-04 19:22:13,0,0,5
k***哈,银牌会员,这是一个1000多块钱性价比最高的手机，4+32不是说到哪里这个价格都买得到，真的是太划算了,2017-05-05 07:42:19,0,0,5
大***诗,PLUS会员,京东服务真是超级棒，服务非常细心到位，拿到这个手机真是一波三折，我自己把地址填的不准确，24号早上公司需要用，本来要被陪送到另外一个区的服务站，24号就收不到了，我就打了几通电话联系贵阳分拨用心帮我加急送到我这边服务站，我第二天7点多取，到我这边服务站取货分拣人员服务也非常好，优先帮我找出来了，虽然是第三方的货，但是交给京东配送绝对是明智选择,2017-12-26 01:24:58,0,0,5
j***c,铜牌会员,手机盒里没有捅针，和卖家说让我自己找，郁闷,2018-01-23 14:33:33,0,0,5
j***t,金牌会员,拍照不错，关键是使用方便，妈妈很喜欢,2018-03-04 09:47:13,0,0,5
j***3,金牌会员,手机是正品很喜欢，就是发货脱了点时间，赠品也很差劲，还是挺满意的。,2017-11-20 09:53:27,0,0,5
j***y,银牌会员,这个手机是经别人介绍买的，到手感觉确实很好,2018-01-18 02:48:05,0,0,5
j***z,PLUS会员,还可以，刚好一手，玩游戏也还行，暂时玩着还不错吧,2017-10-30 11:56:18,0,0,5
诺***郄,银牌会员,手机不错，性能也可以。买给老人用，还行,2018-02-09 21:00:57,0,0,5
j***g,银牌会员,手机收到了，非常满意,2017-07-20 14:19:33,0,0,5
笑***涯,银牌会员,手机还不错，就是爱起惹，而且32G只有23G能用，但是整体还不错，手感，视觉都可以的,2017-06-14 23:00:27,0,0,5
j***f,铜牌会员,手机现在用着，还好，我这是一个四季的感觉，比3G的运行速度快一点吧,2017-05-28 10:05:58,0,0,5
j***k,金牌会员,手机挺漂亮的，用着也很好，一直都用的是华为手机，还会继续支持的，合作愉快！,2017-09-05 08:33:34,0,0,5
蒋***君,银牌会员,之前有人用过，然后看到这个手机挺好的，就去买的，然后用起来感觉接触非常非常的快，很好用,2017-05-24 16:22:25,0,0,5
j***f,铜牌会员,5.2的屏幕比想象中大，蓝色的很漂亮,2017-08-09 11:34:16,0,0,5
j***0,银牌会员,什么东西嘛！从30cm的地方掉下去，屏幕就碎了，网上的质量真是没有保障，建议大家买之前慎重考虑,2017-04-09 18:58:09,0,0,5
j***b,银牌会员,好漂亮的手机，很喜欢，,2017-06-12 12:34:29,0,0,5
安***8,钻石会员,一直在用华为手机 真心不错还是国产手机好 性价比也很高，现在还是用国产手机时代了,2017-06-27 15:57:39,0,0,5
F***K,银牌会员,还好，没有让我失望,2017-07-27 21:12:41,0,0,5
j***5,银牌会员,手机用起来非常流畅。,2017-03-29 14:41:05,1,0,5
j***2,金牌会员,非常给力    手感很好我叔叔很喜欢     给方面都差不多吧,2017-06-03 07:14:33,0,0,5
j***0,银牌会员,给妈妈买的，很满意的，我也就给好评了,2018-01-23 15:56:20,0,0,5
j***f,银牌会员,质量很好 老婆很喜欢,2017-06-15 03:49:10,0,0,5
s***j,钻石会员,不错，物流很快，京东送货上门，还赠了很多东西，手机很漂亮?，4GB+32GB，新品物美价廉，华为荣耀一直在用，质量非常好，满意。,2017-06-30 12:31:31,1,0,5
邹***g,金牌会员,非常长不错，很喜欢，机器设计特别好看！推荐购买哦,2017-09-17 15:54:16,0,0,5
y***1,PLUS会员,孩子很喜欢，本人也偏向华为，用的也放心，很好的?,2017-08-30 10:09:12,0,0,5
j***a,银牌会员,不错非常很好，实物与图片一致。第一次网上还点担心，用了几天各方面都不错，值得赞?,2017-06-04 15:55:58,0,0,5
k***e,PLUS会员,华为一般了，都是一分钱一分货，便宜自然没有贵的好,2017-09-05 19:53:41,0,0,5
毛***l,银牌会员,正品，手机这块没啥说的，挺好的！,2018-02-02 20:55:23,0,0,5
j***d,银牌会员,手机做的很细致，很耐看。速度各方面都很好。永远支持华为荣耀。。。,2017-10-03 10:47:09,0,0,5
j***t,银牌会员,回复晚了，给家里人用，外观时尚，功能强大，就是运行久了会热，但没什么事，好评,2017-06-28 09:43:49,0,0,5
j***u,铜牌会员,挺好的一款手机，各方面都不错,2018-02-27 21:05:09,0,0,5
j***0,金牌会员,手机很好用，已经是第二部手机,2018-02-23 13:06:12,0,0,5
z***在,银牌会员,照相跟刚刚出炉时的像素一样，虽然模糊，但是还是看的清楚，很后悔买,2017-09-21 12:49:59,0,0,5
辽***东,金牌会员,挺好的，性价比挺高，符合这价格,2018-01-28 00:00:59,0,0,5
j***仌,铜牌会员,虽然一波三折但还是一吃愉快的购物～客服很好问题都给我解决了～果断5星,2017-08-07 12:06:28,0,0,5
j***8,银牌会员,手机表面外壳可以，触屏反应也行，但是～～手机有4G运行达不到4G运行，有些失望，以前那个华为畅玩6X3G运行都比这个手机运行快,2017-06-15 08:52:47,1,0,5
T***W,银牌会员,我好中意，支持华为,2017-05-31 08:30:40,0,0,5
j***b,银牌会员,手机还行 快递坑的要死！！！,2018-02-06 21:09:33,0,0,5
j***o,银牌会员,此用户未及时评价，系统默认好评。,2018-01-08 03:52:46,0,0,5
j***e,PLUS会员,手机收到了，款式不错也好看，希望用起来不会卡机！,2017-08-01 11:46:12,0,0,5
K***j,银牌会员,带，，，，，，，，，，，，，，，，，，，，，，，，，，，，，，，，，，，，,2017-06-07 20:50:15,0,0,5
X***3,银牌会员,不错，挺好用，这次没有送错了,2018-01-26 12:34:20,0,0,5
j***4,银牌会员,快递很慢，用了四五天时间才到，我从没有见过运手机还能这么慢的。,2017-09-09 06:23:34,0,0,5
j***a,铜牌会员,物流太慢 手机应该是正品,2018-02-23 07:29:52,0,0,5
j***g,银牌会员,挺满意的 也没少什么赠品 手机手感也非常好 我的才32g多 但现在还没出现什么卡问题 最重要还是因为凡凡的代言才买的 哈哈,2017-09-15 18:43:06,0,0,5
1***p,银牌会员,手机整体都还好，单手操作也合适。只是送的耳机有点问题，不过也没什么影响。,2017-06-16 10:14:33,0,0,5
若秋,金牌会员,其他都满意，就是背后多了个移动定制机的标识，一下就不美观了.......,2017-06-16 18:59:27,0,0,4
j***c,金牌会员,手机外观非常漂亮，快递服务也非常好，之前买了两部了，用的非常好，这一部是给老妈买的哦！,2018-02-07 17:15:20,0,0,5
j***d,银牌会员,东西用着挺不错的  物流速度还行快递小哥服务态度很好,2017-11-18 20:09:22,0,0,5
呜***_,金牌会员,很不错哦，颜值棒棒的，推荐4+64g鲁大师评测80000多分，配置属于中上等，性价比高。打了几把王者荣耀一点都不卡，是正品哦,2017-08-14 19:51:08,0,0,5
l***I,铜牌会员,手机看上去还行，先用用看。,2018-01-28 07:27:21,0,0,5
最***杀,银牌会员,手机正在用，反应快，外观时尚。华为会做的更大的，小意见，手机套有点大。,2017-06-22 08:54:49,0,0,5
骁***生,银牌会员,手机很漂亮，体验很好，漏发的发票和手机膜补发的很快，服务也很贴心。,2017-07-25 14:28:17,0,0,5
