名字,会员级别,评论内容,评论时间,点赞数,评论数,评价星级
q***锁,金牌会员,"5号下的单昨天才到快递不给力,手机整体还不做",2017-12-11 18:40:39,13,10,5
卢***文,铜牌会员,不是卡，畅快，就是没有卡针。,2017-12-07 23:40:48,22,10,5
小周99zhh,铜牌会员,就是快递太慢了   我16好下单   20号才到   京东快递不是很快的嘛？    手机我感觉还是不错的    等用一段时间再来追加评论,2018-01-20 14:39:41,3,1,5
j***b,铜牌会员,手机挺好的，物流也好快的??????,2018-01-13 20:58:11,1,0,5
孤***魂,铜牌会员,手机屏幕大小刚好合适，反应可以,2017-12-11 18:09:37,4,1,5
j***6,钻石会员,手机质量可以，需要进一步了解,2017-11-08 10:32:50,3,1,5
碧***子,铜牌会员,好可以，这价钱值了,2018-02-28 17:40:41,1,0,5
jd_183286ile,银牌会员,很好，用段时间看看,2018-02-19 09:12:23,0,0,5
一***s,银牌会员,手机 颜值好，后置摄像头1300万，前置800万，晚上照也清晰，内存拿回来的话 还剩 21 G左右，买给爸爸 的，他很喜欢。,2018-01-30 11:18:52,0,0,5
j***d,银牌会员,手机挺薄。手感不错，给老婆买的第一次网购手机，受到老婆夸奖。高兴不错的一次购物，给好评。,2018-01-17 18:15:38,2,1,5
朕***哥,金牌会员,不错，给老爸买的,2018-03-01 10:29:33,0,0,5
G***能,银牌会员,京东快递有点慢,2018-02-27 16:58:29,0,0,5
x***e,PLUS会员,华为的手机不用多说，国产的手机里面做的确实不错，这款手机做工挺精细的，支持指纹解锁，速度也快，屏幕分辨率1080p表现还可以，拍照的效果也不错，金属的机身，挺有质感，满意，谢谢京东快递师傅，这么热的温度下还能迅速的把产品送到客户手里，非常满意。,2017-09-27 11:07:43,10,7,5
轩***6,金牌会员,手机太好了，反应快，内存大，质量很好哦，一点都不卡，服务态度好，祝老板2018开门大吉,2018-02-25 09:54:50,0,0,5
b***7,钻石会员,用了一个星期稳定了才能评价。华为的质素OK，虽然不到千元（原价1200，活动减250多），该有的都有，速度也不慢。我没用什么软件来跑分了，只是直观感觉跟以前2千级别的机也差不多。唯一不好的地方时关屏幕后重新开有时要等两秒。还有我以前用的是5.5寸屏，这个其实只小了一点点，刚上手时还真很不习惯，过了一个星期终于好了。看看这个机能用多久，继续支持华为，这是我家人的第三台了。,2018-03-02 21:01:27,0,0,5
j***u,PLUS会员,外观还可以，老人用，运行速度还行，存储空间没太大要求，刚刚好，中规中矩的！,2018-01-31 15:51:30,3,0,5
j***f,金牌会员,刚用还可以,2018-03-09 13:06:31,0,0,5
青***老,银牌会员,一家人不用两家手机，手机颜值没得说，运行速度也比较快，就是华为的插件太多了，很多用不到。32的内存固件8G其它4G，就剩19G的内存了！有点小桑心π_π！！！联发科的CPU，不玩游戏，平常用也没啥大问题！,2018-02-03 19:01:12,0,0,5
j***b,银牌会员,用了几天才给评价，很轻很薄，解锁快，手感好，反应快不卡，电池充满用了3天（没连续用）还有电，拍照也很清晰，价格也合适，还是比较满意。,2018-02-25 15:03:43,0,0,5
j***p,银牌会员,19号下单24号前到，今天快递送到了，预定日期还快三天，,2018-02-21 18:44:20,0,0,5
光***光,铜牌会员,好用，很喜欢，同事也说好看,2018-02-05 13:29:30,0,1,5
j***1,铜牌会员,手机不错，用着很舒心，一开始说下单赠送耳机壳膜，哪去了？邮你们自己家了吗？商家答应补发，希望说到做到，产品给你们一星就不错了，别谢我,2018-01-29 10:34:54,1,0,5
h***1,铜牌会员,"没有评论那么水，王者荣耀最高画质也没有卡顿现象，但是，手机比较热，还可以接受，同时开十几个软件也不卡，如果以前用过5.5寸，或者更大屏幕的会有点不习惯，当然，无所谓的真心可以买，没快充，充电有点慢，洗个澡出来，大概充了百分之20，外观！颜值挺高的，没有红外，总结起来，这款手机，适合没有红外功能，不怎么玩游戏（我说的是大型3D,不包括王者，因为王者完全不是问题）没有陀螺仪，所以玩3D体验肯定不会很好，wifi非常给力，信号很足，可能华为是通讯出家的关系，连wifi下载东西手机可以7M/s。",2018-02-21 09:26:33,1,0,5
j***e,PLUS会员,刚收到  物流真的飞速  客服也非常耐心  手机外观很漂亮  等回家连上WiFi 撸两把王者农药试试,2017-09-14 10:23:42,7,7,5
h***a,PLUS会员,屏幕大小很合适，东西外观很漂亮，用着系统很流畅，外观也很好看。,2018-02-02 22:56:02,0,1,5
j***n,银牌会员,买的时候看带保护壳，收到货咋没有?手机总体来说还行，快递员态度好。,2018-02-01 19:00:25,1,0,5
d***玉,银牌会员,手机可以，没有磕碰，就是给贴的膜太小了。物流不快，一般要五六天。,2018-02-12 11:42:23,0,0,5
媛媛January,金牌会员,快递等了六天到了，这是购买送货最长的一次，不过拿到手机给父亲也挡不住脸上的喜悦就算了，只不过这手机壳上面怎么这么脏呢。最新系统更新后是这样的，我自己也是华为荣耀v9的用户，这款青春版是姐姐买给爸爸的新年礼物，相信选择没错。,2018-01-31 15:00:22,0,0,5
s***6,金牌会员,运行流畅，玩游戏也很快。,2017-09-25 12:56:00,4,0,5
y***7,钻石会员,不错，国产手机开始强大了，好用,2017-12-14 14:31:41,1,0,5
x***E,银牌会员,手机不错，但是，发票错了，并且送的配件不齐全。希望发票按照要求重新开，并且把漏发的耳机和保护套补给我,2018-01-30 19:35:35,2,0,5
j***9,PLUS会员,华为这品牌的手机已买了多少台已记不清楚了，其质量一直都非常稳定令人放心,2018-02-12 08:11:36,1,0,5
j***2,金牌会员,最近会出现突然死屏的情况，滑不动,2017-11-20 18:37:50,3,1,2
海***1,银牌会员,很不错，很时尚的样子。屏显也不错。这个价格应该是最优惠的。京东配送，真的很棒。不错，值得推荐。,2018-02-19 20:19:06,0,0,5
j***b,铜牌会员,手机非常不错，第一次网上买的手机，感觉真的很棒这款手机，就是发货速度真的太难等了。,2018-03-01 13:36:51,0,0,5
涵***2,铜牌会员,"手机的电池版一天都没有用到就没有电了
。",2017-11-21 17:30:56,1,1,2
飞***8,PLUS会员,拍照一般般吧，只是千元级的手机，反应也迟钝了，将就着用吧。,2018-03-08 23:23:48,0,0,5
j***a,银牌会员,收到还没使用，相信京东的品质，快递服务很好，产品后续追评,2018-02-16 08:13:28,0,0,5
绿***Q,PLUS会员,反映快，真的不错，值得信赖。希望华为机越来越好。,2018-01-31 12:09:09,1,0,5
广***正,铜牌会员,第一次在京东买东西，你确定这是新机？其它不想多说,2017-12-08 01:01:54,7,2,1
爱***民,PLUS会员,用三个星期了，感觉不错，自营不自营都差不多。,2018-02-24 10:36:50,0,0,5
恬***之,PLUS会员,感觉很不错，非常轻薄好操作,2018-02-21 09:32:56,0,0,5
j***8,PLUS会员,手机不错，反应挺快的，,2018-02-19 12:43:47,0,0,5
樱***妈,银牌会员,还可以吧！给妈妈买的，手机能带电一天左右！,2018-02-16 21:10:54,0,0,5
小***2,金牌会员,物流速度还可以，毕竟从南方配送。手机不错。,2018-01-25 22:03:32,0,0,5
j***e,银牌会员,宝贝已收到，感觉还可以吧,2018-01-27 17:15:55,0,0,5
N***a,铜牌会员,满意，4天就收到货，打开一看，款式还满好看的，就是送的东西不是一起送来，又要四天，都回家了，希望快过年买的东西一起来，可以寄老家吗,2018-02-04 14:46:13,1,0,5
j***i,铜牌会员,充电器链接口松的？,2018-02-20 12:50:59,0,1,5
j***v,银牌会员,信价产品，物美价廉,2018-01-31 12:06:04,0,0,5
j***l,PLUS会员,这个是真的好用，京东买东西就是放心，物流特别快好评！,2018-02-08 15:06:04,0,0,5
j***j,铜牌会员,这款手机对得起这价格，系统附加的应用有点多，也算可以吧。给个好评，客服应答不及时，物流也可以。,2018-02-24 17:37:13,3,0,5
会***子,PLUS会员,很喜欢这个颜色，赶上秒杀，太划算了，一直用华为的手机，相信它家的品质，简单试了试，暂时没发现问题,2018-01-29 14:55:46,0,0,5
j***5,银牌会员,很棒，好看的极光蓝，网速也不错，高配版也不过1000元，真的是太实惠了，用了十多天忍不住评价真的很棒!,2018-03-06 18:36:25,0,1,5
j***s,铜牌会员,东西收到了，给老公买的。还没有用，看了一下表面还可以。就是到货慢。等我用了后在来平价,2018-02-07 11:56:27,0,0,5
j***9,铜牌会员,电池不错，我玩了两个小时才用了三十几电 。屏幕也很好，有护眼模式?,2018-02-24 10:54:52,1,0,5
j***l,银牌会员,手机到手半月了，用得还可以，运行速度也还满意，机身颜色也很漂亮，蓝色适合男人用,2018-02-21 15:34:31,0,0,5
晶***扬,PLUS会员,一切如卖家描述一致，质量很好，包装结实，物流快，谢谢亲！,2018-02-14 14:24:07,0,0,5
T***w,铜牌会员,手机还可以，就是说好的赠品一个都没有，耳机，钢化膜，透明套啥都没呢？？？？,2018-01-31 10:09:02,0,0,5
梦***0,银牌会员,物有所值 ，值得购买！  愉快的一次购物  ！以后会经常光顾京东商城……,2018-01-29 21:35:45,0,0,5
j***q,铜牌会员,网购实物比网上看到的感觉还漂，，只是第一次用华为手机有些操作不太顺心,2018-01-27 19:10:47,0,0,5
j***花,银牌会员,手机收到了，京东快递员廖先生，非常好，我要给他十个赞。手机是916我看成913，我带了九百一十五，结果，搞得还差，快递员一块钱，下次京东买东西，再还给他吧！非常谢谢这个快递员，都成老朋友了,2018-01-30 09:01:09,0,0,5
j***o,银牌会员,手机感觉不错，性能应该也很好，完了一把大型游戏，手机也不热！,2018-01-08 19:30:48,1,0,5
卡***比,金牌会员,货收到啦，结果比我想象的要好的很多，我以为联发科的CPU会特别卡，其实也还不错。这个价位可以买到比这个配置更好的手机的，但是华为的系统我没用过，主要是外观好看很多！挺好的，希望质量也还行吧。,2018-02-21 11:10:22,0,0,5
j***v,银牌会员,刚拿到手机，用起来顶好用的，拍照也很清晰，这下出门不怕不带相机了,2018-02-12 15:14:23,0,0,5
黄***5,金牌会员,物超所值，可以买买买,2017-10-25 10:52:01,1,0,5
j***哦,银牌会员,今天中午刚拿到手的，感觉还不错，妈妈很喜欢。,2018-02-19 13:16:29,1,0,5
g***5,金牌会员,手机价格合理，外观也还不错，送给老爸用相当实用。,2018-01-25 20:15:22,0,0,5
A***O,铜牌会员,手机的还只用了一天不知到好不好用半个月评论,2018-02-21 06:16:20,0,0,5
j***5,铜牌会员,这是一次不错的选择的，很好很好！,2018-02-17 17:51:41,1,0,5
j***e,银牌会员,没有收货，在丰巢吧，送货员自退,2018-02-23 20:32:30,1,1,5
z***5,PLUS会员,挺符合介绍的，性价比还挺高的，总的来说挺满意的，当然满意是针对这个价格而言。,2018-02-27 14:24:26,0,0,5
Z***D,铜牌会员,机器行号不符用着还可以,2018-02-22 11:50:55,1,0,5
z***i,铜牌会员,刚刚收到货春节快递也那么快很好，,2018-02-21 12:24:02,0,0,5
j***4,铜牌会员,还可以吧，哈哈，买给表弟的,2018-02-21 13:58:28,0,0,5
j***p,铜牌会员,好东西，漂亮，值得信赖佣有！,2018-01-30 16:49:10,0,0,5
j***1,铜牌会员,手机还可以就是没有外套,2018-02-24 16:59:05,0,0,5
0***0,钻石会员,东西很好，价格也满意,2018-02-24 22:37:14,0,0,5
j***0,金牌会员,华为荣耀手机绝对超值,2018-01-29 12:12:50,0,0,5
j***3,铜牌会员,各方面都不错,2018-02-15 13:14:42,0,0,5
j***k,银牌会员,从23定的，物流显示23号出库，一直到26号在北京通州，28号还在北京通州，忍不住给京东客服打电话，京东客服告诉我说26号订单才发货，好，这算不算欺骗消费者？为什么喜欢在京东上买东西，第一送达时间快，第二保证送到客服手上，不会丢失，第三服务态度好，所以选择京东，但是，您家这就不一样了，这个手机用时7天才送到，还存在欺骗的嫌疑，您家客服更别提了，那是什么态度？答非所问，真是厉害了，第一次这么气愤的评论这些东西，这态度也太差了,2018-03-01 21:04:20,0,0,5
h***林,PLUS会员,很好用，很流畅，国产机越来越争气了，支持国产。,2018-01-31 15:00:39,0,0,5
j***6,铜牌会员,不错，感觉挺好的,2018-03-05 17:43:22,0,0,5
書***滴,铜牌会员,手机质量上没有问题，目前为止。除此之外运行较大的软件或游戏会出现不流畅和些许卡顿。总体还是可以的。毕竟不是高端的产品。,2018-03-05 16:07:53,0,0,5
j***2,铜牌会员,下次不在这里买了说送耳机和手机壳里面只有手机和充电器连取卡针都没有怎么坑而且货一个星期才拿到要不得建议大家不要来这里买,2018-02-27 12:07:13,0,0,5
j***p,银牌会员,和图片一样，很轻薄，手感很好，，在用一段时间希望不会失望,2018-02-25 18:55:11,0,0,5
东***也,PLUS会员,手机外观好看便宜实惠就是外放喇叭很差劲,2018-02-07 06:46:35,0,0,5
军***丫,金牌会员,手感不错，用了两天很流畅，极光蓝确实外观要漂亮些。现在都是拼服务的时代，说2号24点前送到，还真是，晚上都在送货！,2018-02-04 18:15:55,0,0,5
小***冲,金牌会员,手感不错，通话质量也很好，屏幕分辨率以及操作都还不错！,2018-01-30 16:06:32,0,0,5
j***b,银牌会员,画质清晰，电池很保电，信号强，拍照像素也不错，和实体店是一样的。用了这么久了没出现问题等再用一段时间来追评,2018-03-07 22:34:08,0,0,5
j***4,铜牌会员,这手机打王者不顺，人家打完出界面了，我的还在那里，屏幕还有一点点接触不良的样子，过了7日了换不了，真心无语。,2018-02-20 19:03:42,0,0,5
j***m,铜牌会员,手机刚拿到触感满意，运行才拿到不好说要用一段时间在评，其他方面的在这个价位也可以了，没什么不满足的,2018-03-02 15:06:20,0,0,5
Y***f,银牌会员,唉，还不如添几百买vivo这华为第一次购买就伤我心了，新机有划痕，卡顿，螺丝还看着像拆过，唉，退货吧！,2018-01-31 13:58:26,0,0,5
h***9,金牌会员,还不错挺好的4g运行内存，32g储存，系统占了13g……给老爸买的应该够用了，整体还是不错的，值得买,2017-12-14 10:48:49,1,0,5
Y***1,铜牌会员,手机很给力，老爸很喜欢，充满电后，待机十几天了都还有89％的电，屏幕感应也挺好的，????,2018-02-06 10:48:18,0,0,5
小***1,钻石会员,还不错，挺好用的，一直在京东买电子产品，都挺好用的，京东值得信赖，送货快，从来不耽误使用，赞一个,2018-02-14 10:19:03,0,0,5
H***寒,钻石会员,手机不错的，性能也还不错，支持国产,2018-01-30 19:40:33,0,0,5
j***t,PLUS会员,中端机，价位低，配置高，性能不错，颜色好看，运行流畅，快递超赞，满分好评,2018-01-31 14:51:23,0,0,5
j***r,金牌会员,手机还没开始用，效果怎么样还不知道，不过钢化膜太恶心了，一点都不能用都是气泡。怎么试都不行。,2018-01-25 21:10:02,0,0,5
j***t,铜牌会员,手机收到，是正品，包装也不错，和广告封面一样，儿子特别喜欢，值得拥有，朋友们赶紧下单吧,2018-03-04 10:46:16,0,0,5
刘***g,PLUS会员,手机外观不错，运行速度不错，显示器很清晰，灵敏度也不错不错得一款手机,2018-02-23 16:16:37,0,0,5
j***u,铜牌会员,手机外形蛮好的，就是内存小了点说是三十二的本身就去了八几，还有声音有点小，总体来说不错,2018-03-01 08:31:39,0,0,5
荧***1,钻石会员,华为手机真的很不错，价廉质好，我已多次购买，画面清晰，视频流畅，好用！支持国货！,2018-03-01 16:37:18,0,0,5
j***i,PLUS会员,商品质量不错，而且价格美丽，物流也很满意，下次还在京东商城购物,2018-02-12 16:12:10,0,0,5
l***8,金牌会员,感觉还可以在用,2018-02-21 14:46:55,0,0,5
万***夜,金牌会员,实话说，一般般，新手机拿到手就有点卡。什么都没弄了，就是卡，低端机还是买小米吧！,2018-02-20 12:23:08,0,0,5
木***木,金牌会员,给我姐姐买的，特别轻，反应也很快，她不玩游戏，用的软件也不多，所以不卡反应挺快,2018-02-28 10:30:31,0,0,5
521YUCHEN828,钻石会员,不错，挺好的。外观漂亮，运行速度较快，性价比很高。华为，国产大品牌，值得购买。,2018-02-21 10:18:40,0,0,5
j***y,铜牌会员,物流很快，商品也很不错，妈妈用得很顺手，还有感谢店主送的钢化膜和手机软壳.,2018-03-05 12:21:37,0,0,5
j***e,铜牌会员,手机还可以，物流也太慢了、一天买了两部，一个第三天就到了，另一个一周才到货,2018-03-04 14:31:40,0,0,5
j***5,PLUS会员,买了一台给儿子用，他超爱，亲戚看见了也要我帮忙买一台。,2018-02-22 15:53:16,0,0,5
J***V,银牌会员,还行吧  挺好看的,2018-02-05 10:49:22,0,0,5
g***购,金牌会员,手机收到，包装没有京东自营的好，没有耳机及外壳，其他还好，待使用观察！！！！,2018-01-29 14:05:26,0,0,5
j***f,铜牌会员,7号买的今天手机到了  外观还可以   不知道用起来怎么样    以后追加评论,2018-01-10 21:03:57,0,0,5
琴***6,铜牌会员,很好，比实体店便宜很多，是正品，亲们可以放心购买，值得信耐的一家店铺,2018-03-08 19:28:23,0,0,5
1***r,PLUS会员,买给我妈用的，我妈特别喜欢，功能齐全，外观也很好,2018-03-06 10:21:58,0,0,5
5***m,金牌会员,华为华为华为，好手机。比起苹果虽然差很多，作为国产机的代表已经很好了。,2018-02-19 11:31:29,0,0,5
j***u,银牌会员,东东收到，颜色很正，机型较薄线条流畅，价格超值，发货也快，值得信赖。,2018-02-26 16:02:52,0,0,5
龙华东湖,铜牌会员,性价比很好的一款手机，好用价格又不高，华为手机越做越好了，支持华为。,2018-02-24 13:18:48,0,0,5
牛***7,金牌会员,还错，主要是便宜，便宜，便宜。用起来也不错，用起来也不错，用起来也不错。,2018-01-31 13:26:17,0,0,5
侯***8,PLUS会员,自己以及给家人买的都是华为荣耀，感觉非常好用！,2018-02-27 15:25:03,0,0,5
笨***猫,PLUS会员,华为手机，大品牌，速度不错，就是预装软件有点多。,2018-02-12 20:54:07,0,0,5
j***7,铜牌会员,手机收到了，用了才来评价的，用着还不错拍照还可以。运行速度挺快。,2018-03-01 10:28:08,0,0,5
m***5,PLUS会员,帮朋友家人购买的，使用下来说不错..支持国产,2018-02-28 06:59:56,0,0,5
H***购,钻石会员,手机感觉还行，毕竟价格不算太贵，手机刚开始使用，就是手机的自带应用太多了，占了足足11个多G的内存，而且还不能卸载，希望多改进,2018-02-08 11:38:47,0,0,5
j***8,PLUS会员,手机到家了但是我还没有看到货，老婆说还可以，,2018-02-07 22:21:11,0,0,5
j***f,PLUS会员[试用],还可以，就是比同事双十一买的贵几百心塞。,2018-03-06 21:45:12,0,0,5
j***a,PLUS会员[试用],照片像素可以很清晰，待点时间长，手感很好,2018-03-05 18:32:31,0,0,5
j***c,银牌会员,收到了，还没有用，应该不错吧。这个价格居然还有赠品，贴心，贴心。,2018-02-03 11:29:33,0,0,5
C***z,铜牌会员,物流太慢，华东分拣中心更慢。27号订货8号到货。咨询态度可以。,2018-02-08 18:14:04,0,0,5
d***t,PLUS会员,物流非常快，东西很正很漂亮，用着也很方便,2018-02-20 01:28:00,0,0,5
j***0,PLUS会员,拿到手很喜欢。外观很漂亮。机器性能也不错。,2018-01-30 13:22:26,0,0,5
j***u,铜牌会员,手机用着不错，接受信号强，反应快，触屏特有手感，性价比高！,2018-02-26 15:16:14,0,0,5
j***x,PLUS会员,手机非常好用，一直用华为。国货我信赖,2018-03-07 11:55:28,0,0,5
j***2,银牌会员,手机不是我用，是我弟弟用，不过他拿到这款手机的时候很高兴,2018-03-05 01:00:16,0,0,5
j***兔,金牌会员,妈妈还挺满意的，觉得很好用，除了容易发热，目前没发现问题,2018-02-27 20:37:48,0,0,5
知***乐,银牌会员,手机各方面都冇错，就是这个店铺没有其它赠品，比如外壳什么的。,2018-01-27 22:46:04,0,0,5
j***e,PLUS会员,这款手机好用，且价格也很实惠，物超所值！,2018-01-26 15:35:06,0,0,5
尘***迷,银牌会员,拍照很清晰，可以查看拍照片的位置，手机充满后可以用很久,2018-03-09 14:33:59,0,0,5
j***e,铜牌会员,"手机很好用,用了几天才来评价。运行很快,物有所值。",2018-01-23 20:42:56,1,0,5
S***I,钻石会员,运行速度很快，用了一段时间才来评价的，很好，性价比很高！,2018-02-19 09:50:19,0,0,5
A***X,铜牌会员,手机很好。用了两个多月了。没有出现出任何问题。越用越喜欢,2018-02-17 22:56:59,0,0,5
s***l,金牌会员,性价比超高的一款手机，买给老爸老妈一人一个，很好很好的,2018-03-03 23:20:44,0,0,5
j***q,铜牌会员,客服服务热情，能解决服务之根本性问题。满意的一次购物。,2018-03-01 15:38:25,0,0,5
j***a,银牌会员,电池不耐用，才用了几天也不知道还会不会有有其实它的质量问题,2018-01-30 12:13:05,0,0,5
j***0,铜牌会员,宝贝收到了我好喜欢，屏幕大小合适比想象中的还要好！五星好评,2018-01-29 09:41:18,0,0,5
j***3,铜牌会员,啥赠品也没有，就一裸机，手感不好，特别轻，感觉不是正品,2018-02-26 08:26:34,0,0,5
J***U,铜牌会员,手机收到了，试用了几天，感觉挺好的，服务态度也很好，好评,2018-01-30 18:18:08,0,0,5
鬼***腥,铜牌会员,有点卡 感觉内存 跟运行内存有点假 真切，其他的都挺好的,2018-01-31 14:11:34,0,0,5
b***2,PLUS会员,这款手机外观不错，运行速度还可以。,2018-02-11 20:17:15,0,0,5
g***u,PLUS会员,关键是买得便宜，买的时间点要抓准,2018-02-25 14:36:33,0,0,5
j***子,金牌会员,快递很给力，商品也很好，一直都在用华为的机子，很满意,2018-02-25 14:47:16,0,0,5
b***u,金牌会员,给老丈人换个智能机，过年搞活动很实惠，便宜了2百多元,2018-02-24 17:16:44,0,0,5
jd_139175iyq,银牌会员,华为手机用过几个了，手感好，速度快，搞活动买又划算！,2018-02-22 23:33:48,0,0,5
j***0,银牌会员,今天刚拿到手看着还行，希望能用住吧。京东快递神速度。,2018-02-21 18:17:41,0,0,5
E***t,铜牌会员,手机收到了，但赠品不是一起发过来的。还要等我也是醉了。,2018-02-06 22:11:11,0,0,5
j***1,铜牌会员,手机刚收到，试用一下感觉还行，对得起这价位支持华为…,2018-02-28 19:35:05,0,0,5
j***x,铜牌会员,电池吗感觉还不错，新机肯定使用时间长，看看以后吧，,2018-02-19 11:20:10,0,0,5
C***B,铜牌会员,手感舒适，极光蓝很炫耀的一款手机！！售后服务也很好。,2018-02-01 20:00:21,0,0,5
飘***6,PLUS会员,主要是看重物流 顺丰包邮的,2018-03-09 17:46:35,0,0,5
jd_150222yfc,银牌会员,垃圾，卖的全是全新机，全是翻修机，有什么用呢？,2018-03-03 22:32:34,0,0,5
j***7,银牌会员,手机非常的实用，真心的实惠一千块钱不到性价比超高,2018-02-17 11:10:51,0,0,5
j***c,PLUS会员,非常好！大赞，以后会继续光顾,2018-02-14 20:41:10,0,0,5
j***9,铜牌会员,给家里人买的，下个星期回去再用，外光可似，先评价了,2018-01-30 18:16:12,0,0,5
F***O,PLUS会员,很好用，家人用了说挺好的。,2018-02-25 09:38:30,0,0,5
j***k,金牌会员,手机颜色没有图片上亮丽，给别人买的没有用不知道,2018-02-24 11:03:03,0,0,5
j***z,铜牌会员,宝贝收到了，外观很漂亮，屏幕清晰，手感很不错,2018-03-09 21:43:47,0,0,5
j***a,银牌会员,发货速度太慢了，今天终于收到货了，前后共4天,2018-03-08 20:10:53,0,0,5
j***u,金牌会员,当天下单就到了，像素反应超级不错，手感也很好！,2018-02-19 17:30:47,0,0,5
j***f,银牌会员,公公很喜欢这款手机，在手里折腾到半夜才睡，哈哈,2018-02-17 11:13:58,0,0,5
j***1,PLUS会员[试用],手机性价比高，运行速度快,2018-03-02 14:29:06,0,0,5
j***6,银牌会员,手机也不行，玩游戏就连穿越火线玩着都卡，假机子,2018-02-14 13:39:14,0,1,5
j***n,银牌会员,手机收到了，什么东西都无送，只是一个充电器，差差,2018-01-30 21:43:14,0,0,5
高***一,金牌会员,别的都行，就是内存只有一半左右，感觉不爽呀！,2018-02-25 16:40:30,0,0,5
g***H,PLUS会员,华为一贯得好！性价比很高,2018-02-23 14:28:28,0,0,5
火***家,银牌会员,怎么过完年价格就降低了两百啊，这差价太快了吧,2018-02-21 09:09:55,0,0,5
j***c,铜牌会员,等了好久终于到了，应该还行吧！等用了在来追评。,2018-02-06 18:03:31,0,0,5
m***o,银牌会员,这是第二台手机了，感觉不错，又买一台，刚发货了,2018-02-04 21:04:40,0,0,5
