名字,会员级别,评论内容,评论时间,点赞数,评论数,评价星级
x***7,PLUS会员,"使用快一月，总结优缺点如下：
优点：①必须赞指纹识别速度，甩苹果几条街，超赞。②双卡双待，不用带两个手机了。③曲面屏很新颖。④莱卡双摄名不虚传。⑤屏幕触控灵敏，跟手不错。⑥充电快，待机长（充满中度使用1.5天）。⑦小功能爱不释手，比如特别的截屏方式，可以遥控大多数电器，熄屏快呼电话，熄屏快拍照片等等，特别是语音助手，我试着给它一大串数字加减，话声刚落，结果秒出，计算器根本达不到这个速度。而且准确无误。⑧国产麒麟芯片不比苹果差，管他几核，是否骁龙，跑分几何，我只知道好用不卡就行，操作系统优化贴心好用。
缺点：①微信指纹支付不行，②双卡不是双4G待机，只能一个4G，一个2G，市面有双4G待机的手机。③曲面屏接近平面，只是有点弧度而已，和三星不能比。④夜间拍照效果不忍直视，像老人手机拍的，白天一些光线不足的地方细节涂抹严重，这是莱卡双摄吗？⑤实事求是的说屏幕灵敏度比不上iPhone。⑥做工还需提升，比如充电口、喇叭开口边缘没有打磨，像是刚下车床的模具。⑧语音助手有时有误开现象，跟人谈话比较尴尬。",2017-08-19 19:19:49,1441,334,5
莫禁莫言,金牌会员,"总述
1：如期收到包裹，外观包装很好，这次已经是在京东购买的第6部手机了，一如既往的信赖。
优点
2、外观及人机工程学：手机到手，把玩了个把个小时，功能正在熟悉中，外观算不上惊艳，手握贴合程度很高，单手操作上手容易，有三种选择模式设置功能键。指纹解锁很快，人机交互界面很舒适，不生硬。
3、从萌发换手机念头到下手购买相距10天左右，不算是冲动消费吧?购买之前也考虑过M10，荣耀9和三星手机SEDE7/8，价位不是主要的考虑因素，侧重于自己对手机的使用需求。如通讯质量保证是第一位的，本人长期在中东地区出差（阿曼、阿联酋、科威特），搭乘飞机时曾经遇到几位华为工程师，中东地区的基站、通讯改进都有华为的身影，为他们的工作和付出点赞。当我到了中东沙漠地带，同行的人携带的不同的手机：果机、三星、小米、华为，在同样的环境下，华为的4G/3G信号最强。往往是满格，其它手机就只有1格。对我来说，这在选购手机的时候是考虑比较多的因素。
4、对我来说，在国外，见到华为和长城很亲切，有图为证。
5、后续使用、经验分享会更新。
改进建议
6、自带程序太多，建议及时更新购机用户的需要，增加市场调研，如增加一些现在的主流APP；",2017-11-13 13:29:38,71,14,5
j***樨,钻石会员,我一直用华为Mate系列，打算送给家人急用，等不到M10上市啦！在和P10比较后最终选了M9 pro，比较适合商务人士，P10外形太像水果机了，又可以连接VR眼镜主要是难以抗拒他的鎏金颜值，都说曲屏没有3星好，但是华为系统强大呀，像素也好，京东还分别送了一个10000毫安充电宝和迷你小耳机，愉快试用中，等待华为的M10笔芯( ??ε?? ),2017-09-30 09:18:50,33,1,5
m***e,钻石会员,本来想买p9，被老公忽悠买了个这个。对我这种对性能基本没啥要求的人来说，内存大拍照好和双卡这几点满足了就ok了。（安卓的指纹支付好多软件不支持）觉得还是小的适合我。附苹果6和华为的拍照效果对比图。很奇怪华为拍照一向很鲜艳为什么这次苹果拍出来天更蓝？光线暗的时候拍照华为秒杀苹果,2017-03-23 13:04:45,325,162,5
江***越,PLUS会员,买了手机还送原厂自带手机壳和手机膜！华为越来越有心,2017-11-29 15:38:19,34,12,5
j***安,钻石会员,2013年7月19号买的三星s4用了4年坏掉了，没办法只有换手机了，618活动的时候买的，价格也不便宜，本来第一天快递师傅送到后都没有签收，直接退了，晚上老婆回家骂我送到了为什么不要，结果第二天又叫快递师傅送回来，希望这个手机也能使用4到5年，毕竟价格和配置在那里，（三星s4我都能用4年，相信华为也可以）说下使用一天晚上的感受吧，5月份生产的手机，用软件测试了几次应该是一等奖一等奖一等奖（重要的事情说三遍）指纹识别秒开很快，三星的2K显示屏很鲜艳，系统很流畅，下载东西飞快，声音外放很大，电池很耐用，毕竟4000毫安，手机外观一般，边框不算很窄。就是手机的上下额头很宽不好看，屏占比不高。拍照和苹果三星还是有不小的差距。其他的使用几天再说。,2017-06-22 09:49:15,284,210,5
P***购,钻石会员,又一款经典之作！用起来很流畅！！！！！,2017-02-14 10:41:35,142,41,5
董***大,银牌会员,很不错的体验，华为是国人的骄傲。本人这段时间有幸赴欧洲旅游，全程只看到我大华为有广告存在。国货当自强！还有相机的像素真的没的说,2017-12-02 13:06:57,57,1,5
j***c,银牌会员,手机不错，从3月15日抢购至今经半个多月过去了，华为手机第一次购买，手机外观漂亮，操作也好，4G信号也特别好，上无线网的速度也特别快，指纹识别精准，手指一放就开，很喜欢，华为没有叫我失望，支持国产。拍了几张咱农村没有艺术感的照片，在夜晚没有灯光情况下能拍星星月亮。,2017-04-01 20:30:17,93,4,5
H***j,钻石会员,很好很满意，支持国产，而且手机质量真的很不错。很满意。信赖京东，京东自营，服务有保障，质量有保障，售后有保障。很满意。,2018-03-08 12:41:48,1,2,5
伺***动,PLUS会员,"终于抢到了，名副其实的高大上，用了两天了，个人体验不错，你值得拥有 。
不过也抢的很疲惫 这款机因为OLED的供货被三星限制，国人还是要努力打造自主的手机零件供应链才够完美。
没抢到加油啊！",2017-03-20 21:52:27,230,132,5
Baal_Huang,钻石会员,"这次对华为实在是有点失望，之前我用的华为Mate7，实在是十分喜欢，耐用经摔，各方面表现都很出色。
优点：
　　外形十分好看，拿在手中也不会太轻，
　　外放的声音很大，音效也很好，
　　拍摄功能强大，对焦速度快，拍出来的照片颜色很舒服，
　　通话质量很不错，操作起来流畅度也很高。

缺点：
　　机器的续航能力很弱，差不多一天需要充2次电，这还是我用的不是很勤快的情况下。
　　拍照清晰度不理想，也可能是个人原因，每次拍完照就喜欢把图片放大一下，不放大还好，这一放大，颗粒感重的让人心焦，甚至还不如我之前用的mate7。
　　最后就是网上盛传的“华为闪存门”，没得说，中招了，满满的恶意。",2017-06-11 22:12:51,25,14,4
枫语桐路2008,PLUS会员,用了两天，整体感觉还不错，系统挺流畅的，反应快，电池续航还可以，照相感觉蛮好的，屏幕稍偏暖色一点点，价格感觉有点小贵，主要是奔着2k屏、双卡双待、微信双开、莱卡镜头去的，还有支持国产大华为，希望能用上一两年吧。,2017-07-12 13:03:42,10,3,5
YST_NO1,钻石会员,国产手机买过最贵的，物有所值。之前一直用的iPhone，但两卡带两手机确实麻烦，本打算买三星S7 edge，但又出了个萨德事件，果断不考虑，虽然用优惠券只需4288。再来说说本机吧，色彩靓丽，电池很给力，运行大型游戏无压力，完全能满足日常需求。大家都支持国货，国货才能自强。,2017-03-20 14:31:08,23,6,5
方***央,PLUS会员,犹犹豫豫，最后还是忍不住下单，机子的身形婀娜，比起当年我三年坏了六个机的三星也不呈多让，流畅度尚可，但和iOS比起来终究是有差距，下了个安兔兔但终究没有跑分，给自己留点恋想，国产手机走到这步不易，但想到国有企业攫利的疯狂其实对华为已没有了太多的好感，这些天来闹的沸沸扬扬的闪存门事件，几经多度辟谣，即便是广告上明明白白的mate9、usf2.1……也未能幸免，小软件的测试结果不知是否准确，当大家都是如此比较的时候，我只想得到一个相仿的数值，然而事竟不如人愿，多次测试的结果相仿，都只有400多，usf2.0无疑，华为是否能给个说法，态度强硬的华为拒绝承认第三方检测软件，好吧，我认，不会退换货，第一次或者也将是最后一次支持国产手机,2017-05-04 13:21:35,598,319,5
梭***崮,钻石会员,京东快递很快，北京发货到这一天就到了，手机也很棒，很好用，经典必出自华为…,2017-03-23 09:44:47,83,17,5
j***脉,PLUS会员,"第一次买高端机，首先，包裹可能简陋了一些，其次，打开包装有些细细的灰尘分布在手机上。

不过这些小问题不会影响我一直以来对华为和荣耀的支持。外观很惊艳。刚拿到手就迫不及待地把玩。然后，有一个小问题，home键似乎不太灵。可能是我手心出汗的缘故 。以后会追加评价的。华为加油！",2017-05-02 16:08:34,15,13,5
叩***陛,金牌会员,使用了一段时间才来评价的，还不错，比17年双十一，双十二便宜多了，速度很快，性价比比苹果高，内存和存储都够用，有送外壳，但是不好，重新买了一个，买了水凝膜，水凝膜不好，有彩色小颗粒，所以就没用，用的原装膜，肯定有人关心电池能用多久，续航比苹果plus强，大概看视频能看8到10小时，这个是买给老婆的生日礼物，还不错的啦,2018-03-09 20:38:13,0,0,5
麻***咪,PLUS会员,手机很漂亮的，非常喜欢，喜欢就买买买,2017-09-27 14:26:25,2,1,5
j***7,PLUS会员,我非常喜欢，非常满意，有我华为再也不用买三星苹果了，华为给力,2017-12-15 08:21:58,16,7,5
j***6,金牌会员,刚刚拿到 刚刚拆开 还没使用 应该不错 至少看着外观很高大上  很不错的选择 京东送货速度也是一级棒 只有京东信得过 给一个大大大大的赞赞赞,2018-03-08 16:08:22,0,0,5
风***动,PLUS会员,买来替换苹果手机的，单卡手机用着太费劲，还得带两个手机，还是国产手机好，双卡双待是标配，mate到手后已经升到安卓8.0，无论外观还是使用体验，都让人无比愉悦，照片有和苹果6s的对比，拍完照片6s就下岗了,2018-02-26 11:52:00,3,1,5
易***j,钻石会员,"早就听说华为的这款mate9pro  很牛叉。平时看到广告就觉得特别高大上，用了之后说说感受
速度快，华为手机中国人的神器，值得拥有，给亲戚买的，都说非常好用，比其它牌子强很多，
没得说啦，非常漂亮，秒杀苹果，照相功能超级强大，背景虚化无敌，拿到手里手感秒杀苹果三星 国产自强 很好 华为 谢谢你 让我拥有琥珀金",2017-01-14 20:01:00,28,11,5
b***1,PLUS会员,运行速度没得说，华为越来越棒了。指纹解锁速度超赞。,2018-03-01 01:06:29,2,0,5
爱***缘,金牌会员,"用了将近一个月，第一次坚持那么久来做评价！本人一般习惯好评！因为这是几千元的电子产品，用心评价对后来人都有所帮助！毕竟，我买的时候纠结买华为Mate9 pro还是果7，选择困难症！
外观：挺大气！没的说，超越了所有华为手机的外观！一点也不比苹果手机差，成熟稳重油然而生！
内存：由于我买的是64G，对于一个不喜欢看电视的人来说，足足够用！
待机：这是我最看好的一点，电池比较耐用！
流畅度：我必须吐槽一下，新机子不到一个月，有时候卡顿，让我受不了，尤其是机子本身自带的app，有时候竟然卡着不动啦！真不敢往后想！这一点可能有待改进！
综上所述，好东西肯定有美中不足的时候，期待改进！不是托，真实评价，不喜勿喷，仅做参考！",2017-09-07 20:44:04,9,2,4
s***l,PLUS会员,非常好，收到后自己升到了8.0.目前运行稳定，这时候买9比买10更具有性价比，适合想用高性能手机，又没有经济实力的同志们。,2018-03-09 22:58:00,0,0,5
b***1,PLUS会员,反应超快 而且屏幕很滑 摸着很舒服 像素也很好 拍照很清晰 老公非常喜欢 买的时候用了白条分期 真心不错,2018-03-05 21:47:49,0,0,5
1***p,金牌会员,头天晚上下单第二天下午就送到了，快递小哥是个很好的人,2017-05-20 09:26:25,5,1,5
懂***麦,金牌会员,大品牌，非常好用，价格便宜?～～～支持国产,2018-03-08 07:56:24,0,0,5
夜***1,钻石会员,"商品还行，物流也快，包装不好，而且我要了纸质发票
没有给我。",2018-03-02 13:17:23,1,1,3
j***y,金牌会员,可以可以 符合预期,2018-03-09 19:17:13,0,0,5
1***p,金牌会员,果然是国产名牌旗舰手机，名不虚传。工艺精，手感好，配置强，颜值高！最称道的是二代徕卡双摄镜头，拍出的片子色彩润泽，颇具韵味！快递神速，到货次日便送达，超赞！,2017-03-12 22:31:32,1,1,5
元***v,金牌会员,"好评!外观太美了!曲的力度很强,嗯，不错，朋友都说好,出去倍有面子，再用几天看看，如果好过几天我女朋友生日准备送她.",2017-05-09 20:16:55,9,1,5
你***货,金牌会员,E0aoaz6106外观很好看，上手的手感超好拿。拍照也很清晰…赞?赞?赞…,2018-03-08 08:29:16,0,0,5
清***p,金牌会员,物流超级快，要过年了居然隔天就收到了，谢谢辛苦的快递师傅。手机很好用，外观也没有让人失望，总之物有所值，一直用安卓系统手机，用起来很顺手。手机运行速度超快，希望2年之后也好用。,2018-02-11 07:36:30,2,0,5
j***p,银牌会员,快递很快，下午买的晚上就到，手机很漂亮，研究了两小时，中间稍微有点小卡顿，总体来说性价比很高了，拍照功能很强大，其他的用短时间再来追评。,2017-12-23 21:55:08,2,0,5
h***B,钻石会员,宝贝已收到，送货速度快，已经使用，不错值得够买。,2018-02-26 08:53:41,0,0,5
老***菜,银牌会员,双11前买的，先吐槽下京东太会套路，抢劵抢了几天，就是不给，弱弱的问，居然都推出活动了，何必还设置门槛，都是专劵专用的，好吧，既然不给人抢，麻烦可以温馨提示，新用户不给或者需要XX会员才有资格拿劵，点了几天永远都是：很抱歉，请稍候再试，那么我就不点了，真会折腾人，可恨的是等我买了，居然一点立马给劵，我想说，我都已经买了，你给我还有条毛用？？,2017-11-15 22:28:58,20,2,5
e***8,金牌会员,好好好，支持国货！,2018-03-08 21:07:49,0,0,5
陪***景,钻石会员,标准的华为粉，从荣耀3c到华为p7，p8.p9.p10一直在荣耀v10和mate9pro之间徘徊，后来选择了mate9pro，升级安卓8.0后挺流畅的，玩王者荣耀fps差不多在55-60之间，指纹识别灵敏。至于像素，我从来不拍照。。。,2018-03-05 01:18:30,1,0,5
jd128606bav,金牌会员,颜值9分以上，体验还要继续使用才能打分,2018-03-09 13:40:10,0,1,5
C***Y,钻石会员,国货精品。使用水果机的也过来赞了一下。,2018-03-06 13:55:24,0,0,5
j***r,PLUS会员,买给长辈用的，外观挺大气的，耐看，用起来也还不错，不卡,2018-03-05 17:30:37,0,0,5
凡***0,银牌会员,手机用了几天没有什么大的问题，说一说购买手机过程吧，那天没事干，拿着手机进去京东随便看看，哟白条额度有1万，想着使用白条购买东西试试还可以分期付款，购买价格为4399元，24个月分期付款，每个月还款218元也没有算一下，直接买了结账还款5230好像800利息.....槽糕。心想买都买了一个月还218元无所谓了，打开包的时候没有购买手机发票，问客服几天都不回复我，让我感觉京东自营店就这样的服务态度，京东以前不是这样的哦，还有让我惊喜的是请看图片。,2018-01-03 18:49:39,6,1,2
1***u,钻石会员,"说点什么好呢，今天收到货第一眼感动了！外形手感对于我来说无可挑剔。尤其指纹解锁，可以算秒解。
也赶得巧，今天是国家公祭日，生在和平年代，心里五味杂全，既然国产能做的好，我是第二部华为第一部是荣耀7，谨以mate9pro，支持国产，愿中国??越来强大?",2017-12-13 23:00:40,2,1,5
独***斯,PLUS会员,凌晨下的单今天下下午就到了，朋友抢了好几次都没有抢到，托我帮忙，我也不知道能不能抢到，没想到一抢就抢到了，京东购物就是好，下午朋友收到手机那个欢喜啊，朋友说手机就是大气好看，拿在手里特有面。以后再说换手机还来京东商城。配送员很好还提醒要不要开箱看一下，服务态度很好。满星五分。,2017-03-15 23:50:12,1,0,5
安***3,金牌会员,手机很漂亮，发货速度很快，收到货就迫不及待拆开了，质量也很好，运行速度更快，五星好评，买东西到京东，正品行货.放?,2017-02-21 17:51:00,1,0,5
j***t,金牌会员,曲面设计真的超级好看，再也不会划一划撞到手机壳，这点是个人感觉，大屏稍微感觉走电快，但是拍照20分钟也正常，微微发热吧，体感每个人不同，我妈妈用的荣耀用时间稍长会比较明显热手。总体感觉8分，升级到8.0也还好。莱卡相机镜头是吸引重点。,2018-03-08 19:59:27,0,0,5
j***n,金牌会员,大气，高档，快递快,2018-03-07 20:27:12,0,0,5
枫***郎,银牌会员,第一次买华为的mate系列手机，之前都是用苹果手机，体验了一天，很满意，真的不比苹果差，有些方面，例如拍照、续航能力、分辨率、流畅度甚至都超越苹果了。本担心的操作系统也很容易上手。为国货点赞，国货当自强，????,2018-03-04 16:42:29,2,0,5
j***c,钻石会员,京东发过来的不是全新机，拆开后屏幕上都有指纹印，本来想退货，可是原来手机坏了，着急用。算了，京东也是够了。,2018-03-04 09:39:27,1,0,5
x***u,钻石会员,此用户未及时评价，系统默认好评。,2018-02-19 09:56:41,2,0,5
硝***盐,PLUS会员,"开学季，性价比还可以吧，刚刚换前置指纹有点不习惯
这款还P10plus纠结了好久，最后选的mate9pro，看来真是年龄大了，希望M的品控给力……
先玩玩再来追评",2018-03-03 19:28:49,0,1,5
j***s,钻石会员,"国产机能做到这个程度已经很不错了
优点：
1.手感确实很不错，很细腻。
2.功能很齐全的。
缺点：
1.感觉没有美腿妻、美腿八电池抗事儿。


好评是一种美德。",2018-03-09 00:56:09,0,0,5
诸***昏,PLUS会员,果然高大上啊。旗舰啊，屏幕很棒啊，本来想买P10plus，结果黑色有货了，立马下单。果然没失望啊，照相效果很棒，清明出去玩忘带单反了，用这完全代替了，哈哈，华为越来越牛！,2017-04-04 17:43:16,1,0,5
j***j,银牌会员,上午下单，下午就到货啦！样子好看，高大上，用法还在摸索中，好用了再来追评,2018-03-06 18:09:21,0,0,5
x***y,钻石会员,金属手感，配件丰富(耳机、外壳，还贴了膜)，值得推介。,2018-03-03 16:36:50,1,0,5
冉***起,钻石会员,"1.昨天中午收到的手机，配送速度很快，只是京东的包装实在不敢恭维，京东的包装盒比手机盒大太多，边缘没有塞填充物，也没有用气泡膜，拿到的时候晃晃荡荡的，派送员说都在北京没必要用膜。
2.要手机的曲面屏，只是屏幕的边缘带弧度，不是三星的那种曲面。
3.昨天晚上12点入睡前手机充满电，100%。早上7点起床，电就89%了，现在10点多，已经不足80%了，感觉耗电量很快。我先生在官网买的那个mate10 早上我看电量还是100%，但愿只是我的心理作用，没在官网买的原因是图便宜，因为官网比这个贵四百块钱。
4.手机自带一个弯膜，因为屏幕边缘有弧度，可能是因为在外面贴膜不太容易，这点很贴心。我早上看到膜有一小片印，昨天拿到机子的时候，不细看没发现，不是矫情的人，无所谓了，况且已经用了，想换也不能了。
5.双卡双待单通这一点，看说明书发现其中一张卡通话的时候，别人呼叫另外一张卡，会提示无法接通或不在服务区，需要打开呼叫互转才行。
6.刚用多半天，手机整体还可以，挺薄的，就是觉得女孩子用，还是有点大。但性价比很高，买前看测评分8.1，比P10高，P10测评7.2分",2018-02-27 10:30:56,1,0,3
游***魚,PLUS会员,这款机子还是不错的，第二部了，用起来省心！,2017-09-10 19:53:33,1,0,5
随***9,钻石会员,漂亮极了！现在就用这个手机发评论呢。速度快。快递员很敬业，直接送货上门。服务好。,2018-02-21 17:51:22,0,1,5
C***8,PLUS会员,等了很久，终于等到折扣！2k三星oled曲面屏就是好看，虽然处理器是960，但是也够用了，关键是mate10pro不给力呀，分辨率才1080p，用的还是国产的oled……,2018-03-03 19:43:33,1,0,5
h***y,金牌会员,这部机买给爸爸当新年礼物的，系统反应什么的都很棒很流畅，手感也好，各种满意就是了。自己用的是果机，反正打算下一部手机换的华为了！国产机现在各种崛起，加油！,2018-03-08 18:16:07,0,0,5
D***x,银牌会员,手机到手，感觉和图片感觉还是有差别的，下巴的宽度感觉适中，额头太宽。。曲屏就一个显示效果。没有像三星那种快捷键。显示效果非常好。毕竟2K的效果。指纹轻触就能开锁很方便。指纹2老是出现触屏错误。。系统拿到手之后经过几次升级到8.0了。感觉和以前的系统没有明显的差距。充电挺快。。这款手机刚上市的时候就想试试。但是mate7一直没有退伍。最近手机摔坏了。正好这款降价就入手了。听说不如mate10.。。。。不过感觉还好用,2018-03-06 13:02:56,0,0,4
一***子,钻石会员,手感还不错，反应也还行。,2018-03-09 15:41:35,0,0,5
U***S,银牌会员,总结优缺点如下： 优点：①必须赞指纹识别速度，甩苹果几条街，超赞。②双卡双待，不用带两个手机了。③曲面屏很新颖。④莱卡双摄名不虚传。⑤屏幕触控灵敏，跟手不错。⑥充电快，待机长（充满中度使用1.5天）。⑦小功能爱不释手，比如特别的截屏方式，可以遥控大多数电器，熄屏快,2018-03-09 11:42:11,0,0,5
w***n,PLUS会员,外形好看，很薄，做工算得上精细上乘，系统流畅，配置够用，性价比很高！大小刚好，曾犹豫直接上mate10，但觉得从大小、外观、性价比综合考虑，还是选择了9Pro。毕竟9Pro的配置已经足够了，处理器也落后并不多。拍照功能，也只能说过得去吧，夜景拍照一般（可能我拿单反来对比了吧，哈哈！），系统没有升级到8，也是因为看论坛说升级后，夜景拍照更差。电池续航没有预想得那么强劲，可能跟用双卡有关，移动网络信号耗电比较多，也做了论坛说的双清，感觉续航确实有一丁点提升。总体来说，满意！性价比很高！,2018-03-08 17:47:45,0,0,5
j***2,PLUS会员,不错，挺好的，不过没有10的画面清晰，手感更舒服点,2018-01-19 09:28:34,2,0,5
j***6,钻石会员,这款手机不错的，各方面都比较好，反应也比较快，买来送老爸的，特别的不错,2018-03-05 18:18:34,0,0,5
c***9,银牌会员,手机感觉很上档次,2018-02-25 19:39:08,1,0,5
j***1,金牌会员,给妈妈买的，非常好，手机样式大气上档次，看起来很漂亮。音质好，屏幕清楚。感觉mate9pro比mate10pro性价比高，不过就是内存选的小了点，64g感觉用不了太久。,2018-03-09 20:35:25,0,0,5
平***成,银牌会员,用了一周左右，屏幕不是曲度很大但也很不错，视觉效果蛮不错。速度和反应灵敏。有二个不满意的点，一是包装，显得单薄，二是送货完全可以先给个电话说下，然后放小区的快递柜也好。,2018-03-07 21:30:44,0,0,5
j***c,金牌会员,外观正体不错，指纹解锁挺快的，就看使用表现了,2018-03-07 21:13:42,0,0,5
j***u,钻石会员,帮同学爸爸买的，超级喜欢，华为确实不错，推荐,2018-03-05 23:12:33,0,0,5
壮***强,PLUS会员,不错  速度很快   但是最近升级了发现速慢了点。。为什么,2017-06-03 18:00:58,7,0,5
j***v,银牌会员,各方面都挺好的  值得购买,2018-03-08 21:48:38,0,0,5
混***王,钻石会员,触屏很灵敏，上网速度快。,2018-03-08 12:05:35,0,0,5
j***x,金牌会员,好看，不过不是我用，,2018-03-08 14:19:57,0,0,5
涛***物,PLUS会员,用过很多华为手机了，非常喜欢这款，运行速度非常快，很满意。,2018-03-07 18:06:19,0,0,5
R***g,钻石会员,手机不错，超出想象，快递给力的，昨晚十点下单，今早十点就到了，给快递小哥点赞,2018-03-07 13:23:13,0,0,5
云***霓,金牌会员,手机很漂亮了，在mate10和mate9 pro里纠结好久，终于还是忠于了颜值。用到现在都很好，很喜欢home键手势设计。充电也很快。,2018-03-05 19:22:15,0,0,5
