名字,会员级别,评论内容,评论时间,点赞数,评论数,评价星级
你***奇,PLUS会员,机器到手话不多说开箱上图，先说说外观继承荣耀8的外观还是非常美丽荣耀可以说是手机行业中颜值非常高的一位玻璃后盖带着光线波纹非常吸晴夏日太阳光下一定是装逼神器，手机开箱全家福这次配件多了一个手机壳非常贴心，再说说性能方面搭载麒麟960处理器EMUI5.1系统1080FHD屏幕后置1200+2000万像素虽然是数码变焦略有遗憾但日常拍照也是比较清晰的配置方面可以说是很不错了与华为P10相同王者荣耀高画质没毛病，还有一点这次音质方面进步非常大本人音乐发烧友很满意！店家发货也还是比较及时的，至于官网旗舰店就没去抢过太麻烦抢不到，总体来说非常满意。,2017-06-17 11:08:27,225,92,5
j***9,PLUS会员,荣耀9手机收到经过几天使用，非常满意屏幕显示清晰色彩缤纷质量不错，好评,2017-12-17 08:43:17,2,0,5
j***h,钻石会员,大家看图把，荣耀手机真坑荣耀6p楞是用了2年多没坏可急死我了途中那么多新机都没法买，荣耀8我就一直想买，这个6p就是不坏还不怎么卡真是服了。这次荣耀9就必须买了那荣耀6p打算等我孩子出生的时候传给他？荣耀9就没得说了性能外观都非常完美希望这次不要用这么久，老板发货快赠品齐全好评。,2017-06-27 11:14:46,171,63,5
盛***6,PLUS会员,一直用华为荣耀的手机，据说是军工产品，是国产手机中最耐用的手机。之前买的华为荣耀plus6用了三年了，还没坏，前几天故意摔了一下，屏幕摔坏了，终于有理由换手机了，华为荣耀9比荣耀6好看多了。,2018-01-04 19:06:41,0,2,5
j***0,金牌会员,大家不在这家店买手机了，我一个月前买了一台荣耀9电池有问题，申请换货，可售后不想给你换却说手机刮花了，还说包装盒少了半个，我返回的都是一件不少的返回去的，卖家给我发的什么我返的什么，他们却说包装盒少了，这明摆着不想给你换找理由的。可京东售后呢在不明真理的情况下帮卖家说话，卖家说大便好吃他们也跟着说好吃，这售后比以前差远了，我看是收了卖家的好处费了吧。手机换了快五十天了还没影给京东售后打了多少电话，伤不起啊我等的好累，这个手机不换了咱时间耗不起再耗也没用人家就不想给你换，，同时在京东买了二斤桑葚干寄回来刚打开包装就有个大虫子，打电话给京东售后让处理，一售后小姐却说我今天买了一瓶可乐里面有虫子喝了也没事啊，这不就是一无赖吗，京东怎么**了一群无赖，难道这就是京东的售后服务吗，刘东你就**一些闲人无赖吗。我这也是最后一次在这个平台购物了，再见刘东。,2017-10-27 16:27:06,53,12,5
j***n,银牌会员,今天刚收到还没有用，整体看着还不错,2017-11-17 18:11:29,3,0,5
j***7,银牌会员,海鸥灰很漂亮，和我想象中的一样，手机质感非常好，店家赠送的礼品很齐全。客服服务态度很好，物流也很快。荣耀9物有所值，值得拥有！,2017-07-22 13:43:26,7,1,5
w***n,PLUS会员,手机不错，帮忙朋友买的，用起来真的不错，，，，，,2017-11-12 11:56:47,2,0,5
表***使,银牌会员,总体上感觉很不错，1:手感柔润但又不像iphone6那么滑，背面的确很漂亮，也不会像镜面那么浮夸，正面home键有点色差，但整体观感影响不大。2:看惯了iphone屏幕的清淡颜色，这次荣耀9的屏幕色彩还是很讨喜的，5.15寸对我来说刚刚好，不像mate那样自己hold不住。3:速度比我的iPhone6快很多（当然不是同一代的东西），充电和玩游戏时发热还是挺明显，尤其边充电边玩游戏的话温度能让手心出汗了，不插电玩游戏的话发热正常，只是有点暖暖的。（还是要比iphone6好点）。4:最后友情提醒：第一次开机使用旧机换新机功能的时候，提示要旧手机安装手机克隆这款软件，但app store是搜不到这个名字的，只能搜英文名“phone clone”。还有就是用这功能前请先把荣耀9的自动息屏关掉，因为手机克隆运行中不能切换应用和关闭屏幕。总的来说这价位买的荣耀9还是物有所值的。,2017-06-30 18:13:01,46,2,5
M***g,银牌会员,用了一段时间了，还不错！,2017-10-29 15:02:07,3,1,5
Z***7,钻石会员,一直在京东商城购物，第二次在京东购买华为手机支持国货，已用一月很好用！比V8性能好多了！这家店比自营店实惠！,2017-10-12 13:35:00,4,1,5
jd_512785275,金牌会员,东西真心不错，抢了好久没有抢到，加钱买了个，送咯好多东西很实用，这个颜色很喜欢,2017-07-08 11:53:12,20,1,5
依***炸,金牌会员,用了一段时间，感觉很好。机子外形好，反应快，电池耐用。手感很好。满意！,2017-08-31 09:20:43,2,0,5
何***L,金牌会员,太经典了，比我的p9还要漂亮华为真的很不错，还未购买的朋友值得入手,2017-06-28 20:50:37,17,6,5
unchmNgEqoWa,银牌会员,挺好的  我挺喜欢蓝色的,2017-08-25 13:28:12,0,1,5
二***7,银牌会员,手机还好，挺闪的，重量比较重，5.15的屏刚好，手机还没用，应该挺好，特别增加了实体键后，以前都不想买。加实体键后才买，米6太难抢了，就这小九九了。之前在手机店看过了才下手，买时没太注意，不是自营的，物流速度确实慢了点，等的那个呀！总体来说，挺好！,2017-09-01 14:45:51,1,3,5
s***u,钻石会员,用了5年小米，犹豫是不是还要继续用小米，看到荣耀9彻底被吸引了，质感、手感、美感、操控感、体积、重量等等挑不出任何不足。唯一不足是这款随机没有耳机，而店家送的耳机不理想。,2017-07-06 16:58:47,9,2,5
肖***嘿,银牌会员,东西很满意！是正品。还未使用，但外观很好看。,2017-08-02 12:34:48,3,0,5
-丑拒,金牌会员,手机挺好看的，正常使用，不知道是不是穿货,2017-11-12 08:35:48,0,0,5
蒋***7,PLUS会员,平时用5.7的屏，换屏了有点不习惯。系统流畅，质量不错呀。,2017-07-08 21:43:07,1,0,5
s***0,银牌会员,海鸥灰很漂亮，很满意。一开始，防爆膜型号给我发错了，但是客服很好，二话不说给我重新发，而且超级快，一天没到就到货了。,2017-07-03 23:44:07,9,5,5
j***w,PLUS会员[试用],送给老婆的生日礼物，漂亮，高端、大气上档次。,2017-09-28 08:58:30,2,1,5
零***o,银牌会员,手机是正品而且6G运存给力，相机色彩有些艳丽，手感好，就是快充一般了，系统的确没有Flyme好用，但是也不错。最不满意的就是快递问题了，不仅慢了近一天，而且被都被压变形了，当时都想拒收，手机盒都有点变形，他们这是做了什么？送的膜变形了不能用别的都挺好的。,2017-10-20 18:31:07,0,0,5
j***h,银牌会员,很不错呢 ，很好看  手机内存也够 运行很足 玩游戏不卡,2017-07-02 13:07:14,4,0,5
j***d,PLUS会员,物流2天到货很快，服务态度比较好促销送的赠品也多，手机也不多说了网上全是晒的美图很好看大家都知道晒几张图大家自己评测看下，总体很满意。,2017-06-28 17:51:46,10,3,5
华仔tom,金牌会员,我是双11当天下单的，入手价2299，第一次在京东买手机，心里还是有点小怕怕。等快递员当面给我拆开包裹时，发现担心是多余的。虽然遇上双11，发货有点慢，可快递员态度很好，亲自送到家，说其它都是枉然，货真价实才是硬道理。亲手划开手机盒的包装膜时，第一感觉是原装货，是正品。容我使用一段时间后，再来追评。,2017-11-18 10:35:37,5,2,5
j***1,PLUS会员,颜值很高的机器，配置也不错，双摄给力，还不突出，完美，不带套，感觉很好！备用机给力！,2017-12-27 09:31:31,1,0,5
摸***子,银牌会员,感觉不错。刚到手手感不错！原本以为是曲屏的不是的。不过手感可以的！而且验过了是真的。还有小礼物。就是没有配送耳机！,2017-06-23 23:20:41,18,5,5
x***3,PLUS会员[试用],安兔兔跑分12万多，系统流畅，指纹解锁是火箭的速度，双面玻璃太阳下亮瞎！相机也清楚晚上是夜视仪效果！,2017-07-03 22:33:31,7,0,5
j***f,PLUS会员,手机不用三天就到手了，京东快递真是快,2017-06-20 20:35:51,16,17,5
G***1,银牌会员,刚收到，外观看起来不错。,2017-08-17 17:00:12,0,0,5
金***7,银牌会员,手机确实不错，期待已久。从荣耀6一直用到现在，改换荣耀9了。价格性价比都超高。喜欢海鸥灰有男人气概。荣耀是国人的骄傲。,2017-07-03 22:12:57,9,0,5
j***f,金牌会员,手机收到了，谢谢快递小哥，手机很漂亮呦，赠东西也好多呀，特别喜欢，给朋友买的，当做生日礼物呢，朋友特别喜欢呢,2017-06-28 17:21:03,10,2,5
j***v,银牌会员,今天收到手机，和想象中的一样，很满意。还没用，据同事们说不错，期待中。上边展示的赠品也都有，已经都用上，比较满意。就是钢化膜老公贴的不专业，有气泡。下次换膜让专业人士换。,2017-06-30 23:06:17,2,1,5
NHBPJjAYvKJS,银牌会员,送的充电宝数据线不对，防爆膜也是匹配，啥意思,2017-06-21 13:15:19,24,10,5
j***m,钻石会员,手机特别漂亮 使用上手 操作流畅 是更换手机的不二之选 一机千年面 手机特别漂亮 使用上手 操作流畅 是更换手机的不二之选 一机千年面 手机特别漂亮 使用上手 操作流畅 是更换手机的不二之选 一机千年面,2017-07-27 10:53:23,0,1,5
羽***9,金牌会员,用了一个星期了，荣耀9真心不错，京东物流像蚂蚁，太慢了，卖家不错。一个星期的体验，用时间长点，会发热。语音控制很牛B，可以PK苹果7?，大小刚好，手感舒服，国产机真牛，支持华为，期待下一代产品。,2017-07-15 16:07:31,0,0,5
j***4,金牌会员,"特意使用了一个星期才来评价。
手机反应速度很快，好评！
发货物流一般。",2017-07-09 08:38:57,4,0,5
W***d,银牌会员,信的过的品质，没毛病,2017-07-05 05:55:08,3,0,5
9***x,钻石会员,这次无论是荣耀还是京东都很给力，比上次抢P10顺利得多。发货速度那更是没得说！说实话经过我自己对比，除了拍照以外，真没觉得比P10差太多。至于闪存的问题，不玩游戏的我真的觉得没太大关系。手感是真的不错，一开始还担心背面的弧形会有点丑，可看到真机后觉得毫无违和感，并且拿着很舒服。奶奶灰的颜色还是很漂亮，很炫至很特别。感觉还是荣耀比华为性价比高，更真诚！个人其实还很想看看蓝色和黑色版本的，不知道以后会不会有更适合女性的颜色，我给母后大人也买一部！,2017-06-25 15:03:12,3,1,5
泪***吹,金牌会员,机器到手话不多说开箱上图，先说说外观继承荣耀8的外观还是非常美丽荣耀可以说是手机行业中颜值非常高的一位玻璃后盖带着光线波纹非常吸晴夏日太阳光下一定是装逼神器，手机开箱全家福这次配件多了一个手机壳非常贴心，再说说性能方面搭载麒麟960处理器EMUI5.1系统1080FHD屏幕后置1200+2000万像素虽然是数码变焦略有遗憾但日常拍照也是比较清晰的配置方面可以说是很不错了与华为P10相同王者荣耀高画质没毛病，还有一点这次音质方面进步非常大本人音乐发烧友很满意！店家发货也还是比较及时的，至于官网旗舰店就没去抢过太麻烦抢不到，总体来说非常满意。,2017-06-30 08:19:43,0,0,5
失***心,银牌会员,手机没毛病。颜值很高我就觉得这快充速度不是很快。可能是为了安全吧。理解一下。各方面性能目前来说还不错用段时间再来评论。送了一堆东西美滋滋。,2017-10-05 19:27:29,0,0,5
小白的1314,银牌会员,这部手机外观非常好看，我个人喜欢黑色的特别好看，真的能当镜子用，送的东西也非常多。店家非常好，我之前也是用华为的这次在买一次，也是比较喜欢华为产品。,2017-08-27 15:39:10,3,1,5
人***囝,PLUS会员,急用机没等到1111上了，很不错的机子，支持华为，支持国产，用了7年的安卓机子，这个应该是最满意的，希望华为越做越好，打造高端品牌形象，同价位不想上米，虽然配置高，不玩游戏关系不大,2017-12-17 16:57:05,0,0,5
j***4,银牌会员,买的非常值，同事都说比苹果还上档次，国产手机中的精品，拍照超清晰，以后就华为了,2017-07-06 15:53:08,4,0,5
荧***空,银牌会员,到货够快，东西也不少，用了几天没有卡顿非常流畅，就是以前用小屏用惯了，换了大点的不太顺手，总的来说还不错!,2017-07-08 06:49:08,0,1,5
喵***东,金牌会员,手机是帮我朋友买的，手机很不错朋友很满意很赞！很值得入手。朋友再也不用担心玩王者农药卡啦！,2017-07-10 12:42:53,1,0,5
A***丶,金牌会员,前天买的，昨天到的，快递非常快，第一次买华为的，手感和苹果一样很不错，界面也非常棒，非常喜欢！！！,2017-07-10 18:56:59,0,0,5
龙***翔,银牌会员,华为荣耀，到了就晒图，服务，杠杠的。卖家的解释和卖家的服务不用说，非常好，京东的快递也是耐心，我改地址都给我送。,2017-07-17 16:34:11,3,1,5
L***7,金牌会员,很好！！！！手机很喜欢，很漂亮，非常满意，第一次用华为，满意！！！,2017-07-27 17:52:11,1,0,5
玉***客,PLUS会员,除了发货有点慢，其他都还不错！至于质量问题肯定要慢慢用才知道，目前感觉不错！,2018-01-07 20:08:17,0,0,5
t***g,金牌会员,外还是很漂亮的  其他可以  但就是快递有点慢了服务态度还是很好,2017-07-03 17:49:59,1,0,5
j***w,银牌会员,冲电很快的，自己下载的软件反应有点慢，照相很清晰，总的来说手机还是挺好的，,2017-07-05 17:09:31,0,0,5
弹***情,银牌会员,一直都很欣赏国产的东西，手里是正品，手感也不错，主要是颜色真的炫彩啊，双摄像头不失档次，喜欢的亲们下手吧！！！！,2017-12-23 11:13:21,0,0,5
河***云,银牌会员,刚收到，外观比较光滑，手感不错，后面有两个摄像头，一个1200万像素的，一个2000万像素的，再加上送了两个手机壳，一个硬壳一个软壳，不错，下次给我女朋友也买一个。,2017-09-06 18:27:01,0,0,5
x***g,PLUS会员,买的黑色的，除了发货比自营慢，其他都挺好的，价格还比自营便宜，不用去麻烦的抢优惠券。,2017-11-13 20:57:43,1,0,5
l***3,金牌会员,手机挺好看的，我去官网没货，实体店也没有货，就是他家有，就是老板送的东西没有，心里不舒服,2017-07-09 18:45:24,4,0,5
d***B,银牌会员,款式?颜色?性能?价位?谁与争锋?全方位多层次的品位，就在荣耀9,2017-07-07 21:44:55,0,0,5
飘***馨,PLUS会员,还不错，不过都是加价购的，送的东西都很低廉,2017-07-08 18:16:21,0,1,5
楼***叔,金牌会员,比v9小不到多少，一只手还是不行啊。。。。。。。。。。,2017-09-07 08:17:19,0,0,5
轻***帶,金牌会员,包装什么的都是新的，没有拆开的痕迹。感觉上不错。,2017-08-02 17:19:50,1,0,5
j***4,银牌会员,非常给力的手机，良心评价，我是用了一个星期来反馈的棒棒哒。,2017-07-18 21:31:27,0,0,5
j***i,金牌会员,很不错，快递非常快，服务好，卖家很热情，支持国产。,2017-06-30 20:13:18,1,0,5
宋***骏,银牌会员,发货很快，手机很不错，无损，赠品也很不错，是值得购买的手机,2017-07-13 14:11:56,0,0,5
1***p,金牌会员,之前看了很多论坛，关于这台手机的评价，确实荣耀9很值得入手，外观：双玻璃曲面很炫加上海鸥灰配色，典雅时尚，质感很好，和苹果的手感很相似，性能：开机速度快操作页面也很人性化，运存4G加上麒麟960可以值得期待，就是不知道后期安卓系统是否还会卡，之前用华为麦芒4，才用了一年半运行速度就很让人着急了，卖家服务也很好，赠送了承诺的东西，最后就是吐槽下京东的快递，建议还是买京东自营的东西，我20号下的单，27号才收到手机，这速度也太慢了，一问才知道除了北上广其它二线城市物流都靠陆运，也是醉了。,2017-06-27 14:39:15,8,1,4
矜***0,银牌会员,荣耀9真的特别好看，震惊，力挺华为，也不卡，非常满意！,2017-07-03 19:14:53,0,0,5
jd152530yjf,银牌会员,很完美的一次购物，卖家送了好多东西，服务态度也是很好。,2017-07-01 21:52:48,0,0,5
玩***猴,PLUS会员,下单到收货用了几天时间，手机不错，运行快，京东快递靠谱。。。不说了，看图，灰色好看。。,2017-08-31 11:43:24,0,0,5
wyd75,PLUS会员,荣耀6升级，比较轻薄，使用比较方便，发热比6好多了,2017-07-21 15:24:48,0,0,5
b***0,银牌会员,宝贝今天已收到，爱不释手。非常满意，颜色也非常正点，喜欢的不要不要的，杠杠的…,2017-07-07 11:06:22,3,0,5
M***3,银牌会员,手机正品  手机外形很漂亮     海鸥灰很赞,2017-07-03 14:38:06,0,0,5
j***f,银牌会员,外观精美，运行和内存续航很好，服务态度友好,2017-08-01 19:24:02,0,0,5
jd_186275oyb,金牌会员,物流还算快，收到手机查了下是新机子，很好，裸机手感特别强。这个价格在京东应该是最低价了，我对比了很久才下单。总体非常不错，好评,2018-01-03 21:15:17,0,0,5
j***青,银牌会员,用了两天才来评价的，性能是不错，我一直是米粉，这次我疼心舍弃小米了因为太烫，华为荣耀9玩王者荣耀 火影忍者手游感觉不是很烫 满意 就是送的膜不是防爆膜，而且充电器也是专属别的用不了，出门老是忘记带线 别的安卓充电器没用,2017-08-09 22:51:08,0,0,5
45敷衍,银牌会员,手机没问题，就是物流不给力，太慢了,2017-08-26 22:26:29,0,0,5
卖***子,金牌会员,比我想象中的要好很多，拿在手里就爱不释手，特别是这个颜色太给力，相机也不错。,2017-07-14 12:44:36,2,0,5
j***u,银牌会员,充电快。 做工精致。不错,2017-07-04 19:22:24,0,0,5
吖***o,银牌会员,买的时候有点担心，第二天下午三点就要走了，没想到第二天中午一点就到了，由衷的感谢快递小哥等我半小时取件。当然，手机很酷，第一感觉好炫，手感真的好，功能也挺强大，第一次用华为，以前用同学的华为返回在左边不习惯，荣耀9的功能键可以自由布置，这一点我觉得很好。玩游戏无压力，不发热，32个赞！！！?,2017-07-13 14:08:46,3,0,5
j***s,银牌会员,"上手两天来评价（?ò ∀ ó?）
总体来说手机还是很不错的，反应速度很快，海鸥灰的外形也很炫酷（只是我拍的不好hhhhh）正面指纹识别简直是用惯了苹果的人的福音，导航键可以自设这点也很赞。
店家超级良心，送了好多东西，送的胶套超级贴合机身，然后快递也蛮快的，两天差不多就到了。",2017-07-03 14:50:37,1,0,5
朽***克,钻石会员,非常不错 值得推荐,2017-07-17 17:28:18,0,0,5
x***2,PLUS会员,深度使用后回来评论。外观是非常的绚，而且屏幕大小合适单手操作，64G内存打开后剩48.7G，打开应用的速度和切换速度很流畅，打开多个应用手机都不发烫，手感有点温。5%充电到100%需要两个小时。满电中重度用户可以用一整天，平时工作使用都够了。个人觉得烧纸指纹解锁比较好用，速度挺快，屏幕下边没有了标志,2017-06-25 15:10:50,0,0,5
j***5,银牌会员,手机用着手感不错！,2017-07-09 09:48:07,0,0,5
小***1,银牌会员,给老爸买的，他挺满意的。就是在装手机卡的时候出了点“小插曲”，大体上不影响。拍照像素清晰，也比较快。快递也是直接送到手，挺好,2017-11-15 19:35:20,0,0,5
j***7,银牌会员,宝贝已经收到 用了几天才来评价的，我还是第一次在网上买手机，找了几家 最后看你家评论的都不错，最后才觉得在你家买的，也确实没有让我失望！是正品。这款手机是给我们孩子买的，她喜欢黑色，这个颜色确实很酷！孩子说这个手机用着也很好 速度快也流畅 一点都不卡，总之我家孩子非常满意！卖家发货也迅速 赞！,2017-12-02 23:05:40,0,0,5
j***3,银牌会员,非常好，非常好。,2017-07-21 12:43:17,0,0,5
j***j,金牌会员,就是发货有点慢，手机外观还挺可以。送的东西有防爆膜和指环扣，手机套与充电宝一个。遗憾的是没有送耳机。,2017-06-28 11:32:48,8,1,5
j***f,金牌会员,很漂亮，大小合适，流畅溝晰。,2017-06-30 23:36:07,3,0,5
你***匹,银牌会员,手机太漂亮了  满意！！,2017-07-03 12:20:16,3,0,5
j***f,金牌会员,很不错的手机  颜值高 性能好，,2017-07-15 08:33:32,0,0,5
l***5,PLUS会员,手感不错，虽然这是我得备用机，但是性能没得说,2017-07-14 19:58:08,0,1,5
K***萌,金牌会员,手机刚拿到手上还是比较惊艳的，确实很亮眼，先说说像素，还可以，双摄像头没有体现出来他的长处，送的东西很多，不过我这个买的比较晚，所以不是抢的。音质也还行，玩了游戏体验也可以，电池3000毫安有点不够用，总得来说值得买，是一部性价比还不错的手机。比较满意这次的购物,2017-06-29 01:03:08,3,0,5
T***狂,金牌会员,卖家很不错，东西一应俱全，建议改善和提高客服态度以及发货速度。手机很精美，试用了一段时间也没有任何问题，支持国产，支持华为，也支持京东百分百正品保证。,2017-07-25 13:34:44,0,0,5
w***7,银牌会员,还好，手感不错，性能用了才知道,2017-07-13 13:28:05,0,0,5
李***李,银牌会员,刚收到，用几天看咋样，,2017-09-02 15:51:02,0,0,5
j***0,PLUS会员[试用],很好，是未开封正品，使用没毛病。价低质优，比京东自营的划算，值得够买。,2017-09-12 09:45:48,1,0,5
C***杨,PLUS会员,好，快，省，大小物件首选京东，信赖的购物平台，很满意,2017-08-13 22:06:19,1,0,5
j***海,PLUS会员,发货速度特快，两天就收到手机了。包装完好，手机惊艳，朋友很满意，送的礼物挺实用，好评。,2017-07-08 16:09:24,0,0,5
j***l,金牌会员,挺好的，感觉不错，手感挺好，挺亮，手机流畅度也很好。,2017-06-27 17:14:55,9,0,5
j***g,银牌会员,手机不错很上手,2017-07-01 15:10:31,0,0,5
吃***陈,金牌会员,这款手机满足我对手机的所有需求，拍照清晰带美颜，指纹前置反应快，红外接口方便，底部有3.5mm的耳机孔，自带hifi，最喜欢的就是3D炫光玻璃，手感比荣耀其他手机要好，不比自用的iPhone差，为什么我知道辣么多，因为我关注很久了，低调奢华有内涵，值得我购买。,2017-06-17 13:19:10,47,6,5
陈***t,银牌会员,客服态度还不错。手机收到太惊喜了，第一次用高端机，哈哈??很愉快的一次购物,2017-07-06 13:24:00,0,0,5
j***ち,金牌会员,很吊，装逼神器，灰常喜欢?，哈哈哈哈哈哈哈,2017-07-19 22:29:56,3,0,5
B***Q,银牌会员,包装精致，朋友介绍买的，没让我失望，挺喜欢的。,2017-11-17 23:38:54,0,0,5
许***6,PLUS会员,提前收到了很惊喜之前预定的，还没开箱支持荣耀，东东原装未开封是正品相信JD！,2017-06-16 17:14:37,48,31,5
5***m,银牌会员,真心有质感，从荣耀6到9，我和老婆都是死忠，大爱荣耀,2017-07-06 15:32:44,0,0,5
天***翼,金牌会员,外形好看，做工精细，反应流畅，老妈很喜欢，物流太慢,2017-07-04 06:48:11,6,0,5
j***c,银牌会员,前几天到的，使用了几天刚来评价，总体来说，荣耀9还是不错的，系统运行流畅度还是可以的，不说太多了，王者去了,2017-08-11 22:08:05,0,0,5
j***4,金牌会员,我十九号下单的到今天我才收到货，不过没关系，个人觉得可以不过就是容易发热，没办法6G运行内存是这样的,2017-06-26 21:04:33,1,2,5
8***2,钻石会员,老爸很喜欢，手机质感很强，送货也快的,2017-07-13 08:45:19,1,1,5
3***6,钻石会员,很好用，颜值也很高，很喜欢，已经好几部华为了。,2017-07-10 18:59:38,0,0,5
l***4,银牌会员,手机很好用，外观很好看，非常喜欢,2017-07-19 15:11:33,1,0,5
胡***稀,银牌会员,手机不用多说，他是正品的，然而第一个快递速度太慢了，他不是自营店，双十一期间根本就没有客服的存在，全都是机器人在说话，，但是到自己拆封过后，发现预装软件实在太多了，乱七八糟的软件，这貌似不像华为的作风，这有点让人不爽快。手机用到现在，感觉还是挺好的。性价比还是不错的。,2017-11-24 20:32:38,0,0,5
孙***啦,PLUS会员,手机很漂亮，比我的华为p9好看多了。但是卖家送的膜和保护套我也是无语了，膜还好，保护套都畸形。。。,2017-08-01 16:11:44,0,0,5
f***已,钻石会员,外观非常漂亮，手感好，5、15寸，非常棒，本来想要买小米6，但是抢不到，这个也很完美。好评！,2017-09-09 21:25:32,0,0,5
