名字,会员级别,评论内容,评论时间,点赞数,评论数,评价星级
w***0,银牌会员,手机挺不错的，分期买的，用了有一个多月了，很喜欢。,2018-03-01 10:55:22,0,0,5
z***2,银牌会员,不错,2018-03-01 10:52:27,0,0,5
g***g,PLUS会员,还是很好的，价格便宜质量很好,2018-03-01 10:47:53,0,1,5
j***g,钻石会员,屏幕大小合适，手感也不错，外观很时尚,2018-03-01 10:47:31,0,0,5
j***3,银牌会员,外观不错，手感也可以，还没开始用，唯一遗憾就是没得赠品。,2018-03-01 10:29:25,0,0,5
z***7,钻石会员,用着还行～～～～～,2018-03-01 10:21:42,0,0,5
l***7,金牌会员,续航和运行速度不错，为老人买的足够用了,2018-03-01 10:12:05,0,0,5
R***e,银牌会员,确实不错，废话就不多说了，,2018-03-01 10:03:07,0,0,5
z***2,PLUS会员,"这款孔雀蓝的颜色真的显得很高级。
手机不错，送给妈妈的，妈妈很喜欢。屏幕够大，适合上了岁数的人看。
空能也很多，用苹果系统用习惯了，安卓系统还是要熟悉一阵子。
有一阵子不明原因的死机，现在好了",2018-03-01 10:02:20,0,0,4
h***a,钻石会员,机型很好看，爸爸很喜欢,2018-03-01 09:43:59,0,0,5
山***圈,银牌会员,还不错,2018-03-01 09:43:19,0,0,5
j***c,银牌会员,可以,2018-03-01 09:22:45,0,0,5
超***鱼,金牌会员,很好，帮朋友买的，在本店买了，好几部了，都反应很好，正品。都说很流畅，好用，性价比高。,2018-03-01 09:07:01,1,0,5
j***m,钻石会员,还不错，家人喜欢,2018-03-01 08:46:03,0,0,5
q***9,钻石会员,手机挺好的，屏大，字体也大，拍照清晰，给妈妈买的，他很喜欢,2018-03-01 08:40:38,0,0,5
x***9,PLUS会员,给老爸买的，反馈不错，外观也还看～,2018-03-01 08:19:21,0,0,5
s***g,PLUS会员,还可以吧，价格略高，用起来没什么问题，普通的一个安卓机,2018-03-01 08:12:44,0,0,5
s***5,银牌会员,"头晚下单第二天下午就到手
颜值杠杠的目前感觉良好",2018-03-01 08:00:30,0,0,5
o***L,银牌会员,比较满意粉一次购物,2018-03-01 07:55:08,0,0,5
c***9,钻石会员,物品不错，物流很快。,2018-03-01 07:47:05,0,0,5
利***乐,金牌会员,很好！用着很舒服！这是买的第二个手机,2018-03-01 07:39:41,0,0,5
j***1,金牌会员,非常好用，很喜欢喔，大家一起来买,2018-03-01 06:41:56,0,0,5
n***u,钻石会员,手机很好,2018-03-01 06:25:14,0,0,5
j***^,PLUS会员,用了很久才来评价，妹妹很喜欢，用起来很流畅，很大气上档次,2018-03-01 00:11:06,0,0,5
三***技,银牌会员,很好的一款手机，物流也快，支持京东,2018-02-28 23:39:11,0,0,5
j***8,银牌会员,手机还挺好用，怎么没有发票，所指的电子发票也没看到咋回事？,2018-02-28 23:18:08,0,0,5
洛***天,银牌会员,还可以，挺好的,2018-02-28 23:12:51,0,0,5
1***y,钻石会员,耳机 总有杂音   滋滋,2018-02-28 23:12:48,0,1,2
曼***仔,银牌会员,手机很棒。还有就是京东的物流没的说，快递小哥服务态度也是杠杠滴，支持京东,2018-02-28 22:39:37,0,0,5
j***1,PLUS会员,很好，很不错，良心品质，支持华为，支持国货。,2018-02-28 22:35:06,0,0,5
z***o,银牌会员,很不错 给老爸买的他美观大方 功能也够用了 满意,2018-02-28 22:24:25,0,0,5
铁***河,银牌会员,不错。,2018-02-28 22:06:33,0,0,5
秒***乐,金牌会员,外观设计大气，用了一个月了死机了一次，不理想,2018-02-28 22:02:44,0,1,3
j***a,金牌会员,产品外包装质量不错，手机待使用后再追评。,2018-02-28 21:22:50,0,0,5
j***o,钻石会员,好,2018-02-28 21:20:29,0,0,5
f***0,PLUS会员[试用],给家公买的，手感不错，内存够大，老人家用速度也完全没问题，就是送的贴膜和手机壳比较差，后来自己出去贴的,2018-02-28 21:06:04,0,0,5
l***2,银牌会员,送货很及时，一天到货,2018-02-28 21:04:58,0,0,4
h***4,金牌会员,老公已经用上了，挺好的，很轻薄,2018-02-28 20:51:46,0,0,5
a***l,银牌会员,快递很给为，给老人用，主要是拍照，收到后很喜欢,2018-02-28 20:49:02,2,0,5
j***j,PLUS会员,不错！,2018-02-28 20:47:26,0,0,5
Z***8,金牌会员,很喜欢，很好用,2018-02-28 20:42:53,0,0,5
jd_135317zqj,银牌会员,手机没有问题，可以,2018-02-28 20:28:07,0,0,5
l***8,银牌会员,很棒很好用,2018-02-28 20:24:55,0,0,5
给***光,银牌会员,挺好用手机，外型又漂亮！很好！,2018-02-28 20:22:13,0,0,5
j***h,PLUS会员[试用],京东太给力了24小时到货 大赞,2018-02-28 20:12:51,0,0,5
j***9,银牌会员,用着可以，值得推荐,2018-02-28 20:05:49,0,0,5
z***6,PLUS会员,给老爹买的新年礼物，看起来还不错。NFC功能可以查询防伪，不过得贴的很近才能用，不是太方便的。不知道如果NFC有读写功能，会不会效果好些呢？,2018-02-28 19:06:04,0,0,5
龚***3,PLUS会员,京东快递很给力，第二天就到，手机的外观老公很喜欢，颜色很正,2018-02-28 18:51:28,0,0,5
j***9,银牌会员,手机不好用，感觉像假的,2018-02-28 18:40:23,0,1,3
g***h,金牌会员,不错！家人喜欢！,2018-02-28 18:39:46,0,0,5
乀***六,银牌会员,东西还可以，还送了手机壳，就是感觉有点轻。,2018-02-28 18:09:34,0,0,5
j***4,银牌会员,外观不错性能还行，好像有时会卡,2018-02-28 17:56:31,0,0,5
学***6,银牌会员,初次体验还不错，华为值得信赖,2018-02-28 17:43:36,0,0,5
j***7,银牌会员,实物与图片相符,2018-02-28 17:31:33,0,0,5
细***爸,银牌会员,收到拆开用了一天，感觉挺不错的。包装很严实，物流也飞快，昨天下午下的单今天上午就到了。很赞！手机用起来很爽，速度超快！,2018-02-28 17:22:40,0,0,5
j***u,金牌会员,非常好用，送给别人的礼物,2018-02-28 17:11:28,0,0,5
d***i,PLUS会员,手机老婆很喜欢，老婆喜欢我也欢喜。喜欢应该不会再乱砸东西了吧！,2018-02-28 16:54:39,0,0,5
幸***合,金牌会员,好用，好看，就是拿着有点重，其他等用一段时间在看看,2018-02-28 16:27:38,0,0,5
z***o,PLUS会员,华为手机，国产品质，做工都很棒！,2018-02-28 16:16:47,0,0,5
龍***帥,PLUS会员[试用],买来新的，是贴好了膜的，问商家商家不理，是好开发票的也没开，先用麦芒5，再买的麦芒6，感觉比麦芒5还差,2018-02-28 16:16:31,0,1,1
j***f,银牌会员,很好,2018-02-28 16:13:46,0,0,5
jd_137106gyv,银牌会员,靓野！正，这是给大哥买的。这是20天内买第二部麦芒6了。太好用了太完美了。好东西不用多说。,2018-02-28 16:11:21,0,0,5
梁***财,钻石会员,非常好的哦哦哦！,2018-02-28 16:06:41,0,0,5
