名字,会员级别,评论内容,评论时间,点赞数,评论数,评价星级
雷***际,金牌会员,很轻很薄，32G内存固件用掉了11G！！图是我把手机自带的无用软件全部卸载之后，只下了个微信和酷狗的状态。拍照一般，就算基本满足要求。电池不知道抗不抗用，再来追评吧。,2017-12-14 21:14:03,67,15,5
t***9,金牌会员,第一次买华为的手机，觉得还可以吧，唯一的不足的地方就是屏幕的颗粒感有点重，其他的地方都可以接受，毕竟那个价格摆在那里了,2018-03-05 18:03:33,0,0,5
C***4,PLUS会员[试用],比iPhone轻 颜色挺好看 1008到手,2017-11-19 19:31:38,27,4,5
1***梦,PLUS会员[试用],买给老丈人的，他非常喜欢。超值，朋友都不信才几百块钱。,2017-12-25 03:11:23,10,2,5
叶***新,金牌会员,手机同等情况下，信号差，运行内存正常有2个G，但下载的日历，墨迹天气老是被关闭，想看日历天气还得重新打开，用着比较卡。样子还是比较好看的，价格比较便宜。总体手机一般。,2018-02-14 22:17:00,0,0,3
小***妹,PLUS会员,手机很漂亮，蓝色非常好看，一次就买了两个，物超所值,2018-03-07 21:40:57,0,0,5
jd_374884875,钻石会员,感觉反应不是很快，还可以了将就着用吧，毕竟是千元手机,2018-03-09 09:38:31,0,0,5
j***c,PLUS会员[试用],给男朋友买的，他说挺好的，颜色好看，我用的是荣耀8，感觉两个差不多,2018-03-08 20:37:48,0,0,5
j***n,铜牌会员,很好，老妈喜欢,2018-03-08 14:00:22,0,0,5
c***7,PLUS会员,搞活动买的，已用了，手机质量好，通话质量也很好，满意,2018-03-09 16:53:51,0,0,5
l***林,PLUS会员,非常好，颜色好看，老人用字体也大，我爸爸超级喜欢一个,2018-03-05 18:40:09,0,0,5
I***k,银牌会员,机子用的很好 很好用 而且还漂亮 很漂亮 一直用的都是华为 下次还可还要用 还要用一支香烟华为相信国产品牌 上次用的也是华为 支持国货 支持国货支持国货支持国货支持国货,2018-03-06 18:09:40,1,0,5
大***坚,金牌会员,手机质量挺好，就是快递有点慢哦,2018-03-05 19:29:13,0,0,5
一***2,钻石会员,给力呵呵呵呵呵呵1没想到还真快现在网速还可以看看以后吧,2017-11-29 19:26:21,0,0,5
蒋***8,银牌会员,手机不好，商家的服务态度也不好，外观有划痕还不不退，京东处理大概一个礼拜也没有结果……一次失败的购物，太差了这是,2018-03-07 17:30:50,0,0,5
忘***芳,金牌会员,性价比超高,2018-03-07 14:34:48,0,0,5
烟***7,金牌会员,用了几天还好，就是运行不够快，背后摄像头是突出来的，容易花,2018-03-06 17:27:41,0,0,5
s***g,PLUS会员,给妈妈买的，她挺喜欢的。用着也挺流畅，没什么毛病，还是很不错的，希望能坚持个两年吧！,2018-03-06 19:11:06,0,0,5
凌***飞,PLUS会员,抢购到的，刚好活动，2G的买不到，看看4G的更强大也没贵多少，果断下单了，没有失望,2018-03-07 23:04:35,0,0,5
x***3,金牌会员,手机还好，反应不是很快，给老爸买的，老人家用还可以。就是物流有点坑，给我寄错地方了，晚了三四天才到。,2018-03-08 10:31:34,0,0,5
小***菲,金牌会员,手机看着还行京东快递太给力了。，但是还没有用，等用了再追加评价吧！,2018-03-09 00:23:53,0,0,5
南***家,银牌会员,拍照方面比不上儿子的畅享5s，电池也就一般般啦！毕竟这么薄。,2018-03-07 08:59:38,0,0,5
一***0,PLUS会员,手机给我爸买的，运行速度还可以。。。。。,2018-03-06 18:21:59,0,0,5
j***1,铜牌会员,手机用了一个星期，下了好几个应用一点不卡反应流畅。支持华为。,2018-03-06 18:39:04,0,0,5
t***0,PLUS会员,漂亮美观，手感也很好，颜色也喜欢，超赞！,2018-03-05 18:51:17,0,0,5
c***n,PLUS会员,给我爸买的，时尚，接电话音质不错。,2018-03-09 03:11:07,0,0,5
j***e,PLUS会员,手机还可以，手机膜和手机套不怎么样,2018-03-07 11:12:49,0,0,5
我***间,银牌会员,还行吧。就是好像比我现在用的这台屏幕小。不过小屏幕大作用吧。毕竟配置不一样。这个要比我现在用的这个好。还是新机。,2018-03-07 11:55:17,0,0,5
阿***6,铜牌会员,东西还不错，运行啥的没毛病，给弟买的，还是比较中意的,2018-03-06 11:07:17,0,0,5
j***5,金牌会员,手机虽然内存不大，可也是够用的，也好看，老妈很满意,2018-03-09 11:34:13,0,0,5
t***w,PLUS会员,手机很快，很好用，物流也很快,2018-03-06 19:11:31,0,0,5
d***1,PLUS会员,还不错的小东东还不错的小东东,2018-03-05 22:27:36,0,0,5
g***e,钻石会员,手机很轻薄，手感不错，至于系统还得时间来检验，,2018-03-09 21:33:44,0,0,5
石***3,PLUS会员,华为手机，品质一如既往地好,2018-03-09 09:15:28,0,0,5
永***样,金牌会员,一直支持国产，支持京东，华为手机就是这么好用。,2018-03-09 22:01:20,0,0,5
j***a,银牌会员,手机?非常溜，手感也不错挺满意＼(＾▽＾*),2018-03-07 06:37:59,0,0,5
j***b,铜牌会员,感觉很好   就是手机太轻了  拿起来不习惯,2018-03-06 17:31:42,0,0,5
j***e,铜牌会员,新买的手机用了几天了，感觉还不错，给个好评,2018-03-09 15:10:28,0,0,5
泽***儿,金牌会员,非常不错的一次购物。手机不错，性价比很高！,2018-03-07 14:41:47,0,0,5
爱***旭,钻石会员,价格便宜，华为不错的国产手机，适合老人使用,2018-03-06 11:15:12,0,0,5
j***i,银牌会员,手机是给妈妈买的，很轻薄很好用，物超所值,2018-03-09 11:11:03,0,0,5
j***8,铜牌会员,手机还可以，很好看，物流也快，物美价廉。,2018-03-08 21:10:49,0,0,5
w***2,金牌会员,手机?很好的，颜色很喜欢，大小也正合适,2018-03-08 19:29:47,0,0,5
欧***联,金牌会员,不错，对得起这个价格.......,2018-03-08 16:52:54,0,0,5
C***D,银牌会员,手机刚刚收到，感觉还是挺流畅的,2018-03-07 20:41:20,0,0,5
j***0,金牌会员,颜色很喜欢，华为手机，支持国产,2018-03-06 13:43:05,0,0,5
小***巧,金牌会员,手机非常好，看起来很大方！！,2018-03-08 19:42:48,0,0,5
孤***书,银牌会员,服务到位，质量很好，安装细致,2018-03-08 13:23:28,0,0,5
肖***店,金牌会员,给妈妈买的，非常好用。超喜欢,2018-03-07 18:17:40,0,0,5
r***q,银牌会员,性价比高，直的中年人入手。,2018-03-09 08:46:07,0,0,5
1***p,金牌会员,拍照不错，手机也比较流畅。,2018-03-07 23:15:51,0,0,5
肥***胜,银牌会员,量还不错，内存大，运行流畅,2018-03-06 12:40:30,0,0,5
j***y,钻石会员,一直用荣耀的手机，全家都用,2018-03-05 23:05:56,0,0,5
霖杰123,银牌会员,好用，充电也很快，很喜欢……,2018-03-08 15:29:50,0,0,5
美***情,金牌会员,性价比很高，母亲很喜欢,2018-03-09 22:24:47,0,0,5
醉***帅,金牌会员,款式不错价格公道好评+,2018-03-09 22:25:41,0,0,5
j***1,钻石会员,手机很好，用起来不错。,2018-03-08 16:14:53,0,0,5
j***6,金牌会员,给我爸买的，用着还不错,2018-03-06 13:30:07,0,0,5
1***9,银牌会员,还可以  用起来也不错,2018-03-06 11:28:30,0,0,5
凤***物,银牌会员,帮表弟买的，他说还可以,2018-03-06 08:47:48,0,0,5
谁***强,银牌会员,不错，运行非常流畅。,2018-03-07 23:39:51,0,0,5
玛***麟,金牌会员,给老人家买的 很好用,2018-03-06 15:01:50,0,0,5
j***d,金牌会员,手机收到了运行还可以……,2018-03-06 11:58:42,0,0,5
于***神,铜牌会员,这个价位手机挺好的,2018-03-09 21:08:29,0,0,5
j***e,金牌会员,还没用上，感觉不错,2018-03-09 16:53:16,0,0,5
j***v,金牌会员,价格便宜的也挺好用,2018-03-08 22:04:12,0,0,5
j***1,铜牌会员,用起来真不错的机子,2018-03-08 14:56:05,0,0,5
在***子,PLUS会员[试用],高中狗买的手机……价格很实惠然后各方面都很好啦，像素也是阔以…不打游戏的话还是很ok的，总体来说挺好的，指纹识别也很快，新机子，电话杂音出现过一次就没出现过了，棒棒,2018-03-08 13:35:36,0,0,5
j***n,银牌会员,速度快。功能更方便,2018-03-07 18:58:40,0,0,5
J***m,金牌会员,不错，用着非常舒服,2018-03-06 03:22:37,0,0,5
j***0,银牌会员,年前买的，足够满足目前工作生活需要。手机不错，老婆用的也是同款手机。,2018-03-07 21:25:01,0,0,5
_***华,铜牌会员,性价比很高的手机,2018-03-08 22:47:44,0,0,5
t***g,金牌会员,刚拿到货用起来挺好的，反应也快，就是送的东西少，耳机都没有，,2018-03-09 13:13:15,0,0,5
1***p,金牌会员,好用，非常好用。,2018-03-07 13:15:43,0,0,5
j***v,金牌会员,手机续航能力略差,2018-03-07 07:49:37,0,0,5
碌***般,金牌会员,真心不错，值了,2018-03-09 16:13:02,0,0,5
j***r,金牌会员,网速快 像素好,2018-03-08 22:45:32,0,0,5
j***a,银牌会员,宝贝很满意，过年买的，京东快递还是在工作，给快递小哥点个赞，收到的手机是新机，跟自己的要求很符合，很满意的一次购物。,2018-02-24 16:00:24,0,0,5
陈***鑫,银牌会员,手机不错，上个手机就是荣耀，用习惯了喜欢这个牌子，送的膜不是钢化的，不过没有关系也没想着要用，就是物流实在太慢了,2018-03-07 13:13:21,0,0,4
j***g,钻石会员,很好，很好，,2018-03-08 17:18:34,0,0,5
c***4,PLUS会员,东西还行吧，千元机的品质，千元机的质量。,2018-03-09 00:42:23,0,0,5
l***8,银牌会员,手机收到了，用了一天，对于手机非常满意，就是物流有点慢,2018-03-03 17:47:33,0,0,5
j***7,铜牌会员,货已收到，物流很快，帮朋友买的，待用后再追评。,2018-03-08 12:41:21,0,0,5
j***0,PLUS会员,机子不错，一直喜欢华为,2018-03-07 07:40:17,0,0,5
j***l,金牌会员,荣耀出品，必属精品，永远是荣耀的粉丝,2018-03-06 11:59:54,0,0,5
1***p,银牌会员,外婆护送vermin陪我色涮羊肉,2018-03-07 13:16:38,0,0,5
胡***3,银牌会员,好心疼???,2018-03-06 17:53:27,0,0,5
发***成,银牌会员,手机看着挺漂亮的 ，给老婆买的，反应慢点，有待提高，一样的运存和内存没有vivo反应快，赶上过年了，年后发的货。,2018-03-07 10:05:56,0,0,5
齐***正,PLUS会员,手机不错，拍照效果非常的清晰，屏幕超炫哦，并且京东物流非常的快准时，超给力！极力推荐哦,2018-03-09 19:19:31,0,0,5
c***l,银牌会员,手机外形中规中矩，手感虽然一般，但是性能还是比较不错的，毕竟华为的牌子在这，这个价位算可以了。,2018-03-09 07:44:37,0,0,5
jd_180202lce,铜牌会员,电池很快就没电了。看电视2。3个小时就没电了，今年二月十四号买的，以前买的华为手机都不会。,2018-03-05 18:58:52,0,0,5
j***0,铜牌会员,相素差 手机卡总之没得说，一个字  差。快递让自己去取跑了三公里还要多，才取到，垃圾。,2018-03-09 14:16:11,0,0,5
勾***3,银牌会员,给别人买的，用着挺好，以后手机什么的还是买华为。村里人说外观好看，便宜实用。,2018-03-07 12:43:03,0,0,5
沐***愛,PLUS会员,手机挺好的，性价比很高，给公公买的，内存和运行都足够用了,2018-03-05 18:30:18,0,0,5
j***x,铜牌会员,送给爸爸的，他觉得挺好的，我自己一直用的三千多的，所以也不知道性价比高不高。,2018-03-07 09:15:16,0,0,5
j***1,钻石会员,宝贝收到了，很不错！妈妈很喜欢，继续光顾本店！谢谢老板送的礼物！非常感谢！,2018-03-09 22:37:13,0,0,5
s***8,PLUS会员,还不错，质感好，就是自带很多软件要删除，我妈妈够用了。,2018-03-07 23:24:10,0,0,5
j***h,银牌会员,手机收到了，暂时还没用，相信京东，相信华为都是不错的产品和服务，棒棒哒！,2018-03-07 08:24:20,0,0,5
j***1,银牌会员,手机好用！店家服务态度好！物流发货速度快！配送员服务态度很好！赞！！！,2018-03-09 20:34:28,0,0,5
j***u,PLUS会员,非常不错，给老爸买的。操作简单，容易上手。物流也快,2018-03-05 21:20:42,0,0,5
j***5,PLUS会员,唯一的就是不支持5GWIFI 路由器，很是郁闷,2018-03-09 10:23:42,0,0,5
j***k,PLUS会员,给老爸买的手机。颜色很好看。大小正好。很喜欢,2018-03-07 19:58:03,0,0,5
j***e,PLUS会员,手机到了，买给老爸用的，外观漂亮，喜欢好用！,2018-03-07 12:03:06,0,0,5
自***鸟,PLUS会员,已经买了第四个了，都是朋友看见不错，要帮忙买,2018-03-07 19:33:29,0,0,5
h***u,PLUS会员,质量杠杠的，手机很好用，下次还会继续光顾。,2018-03-08 23:31:30,0,0,5
初***海,PLUS会员,帮家里人买的，他们说用的很好，那就OK了。,2018-03-08 12:45:48,0,0,5
j***6,铜牌会员,拍照很模糊,2018-03-09 01:22:56,0,0,5
j***c,PLUS会员,机子质量保证，用了一段时间了也没有出现卡,2018-03-09 18:48:08,0,0,5
c***鹤,PLUS会员,帮人朋友购的，使用没什么问题，习惯性好评,2018-03-08 16:20:00,0,0,5
jd159133jbg,银牌会员,华为手机越来越好了 京东快递越来越快了 挺愉快的一次购物！,2018-03-08 23:02:01,0,0,5
j***m,铜牌会员,华为荣耀V9都算可以，以前一直用畅亨，支持国产，支持华为！,2018-03-08 15:06:33,0,0,5
瞿***君,PLUS会员,手机很好用这是第五个手机了喜欢这品牌,2018-03-09 07:02:46,0,0,5
j***n,金牌会员,物流速度挺快的，看着还行，没有用了，用后再做更详细的评价,2018-03-06 22:32:52,0,0,5
j***贵,钻石会员,运行速度很快，总体体验很舒服，帮朋友买的，朋友很开心。,2018-03-08 22:42:53,0,0,5
1***p,金牌会员,外观不错  挺漂亮的。手机运行也不错。可以的。给一个赞,2018-03-08 13:00:34,0,0,5
是***啊,银牌会员,手机整体适用流畅，屏幕大，后背指纹解锁，使用起来很顺手,2018-03-06 22:21:26,0,0,5
大***8,金牌会员,朋友说手机和赠品用着很不错！就是快递慢了点，习惯好评！,2018-03-06 08:23:01,0,0,5
建哥哥lILoveyou,PLUS会员,高端大气上档次，低调奢华有内涵。,2018-03-09 12:57:39,0,0,5
楠***i,金牌会员,买给妈妈用的  性价比很高 也很好看 不错的值得购买,2018-03-08 11:32:56,0,0,5
f***6,PLUS会员,手机不错性价比很好，用着很舒服,2018-03-08 10:15:43,0,0,5
Q***e,PLUS会员,这样的价钱可以买到这手机.值了,2018-03-06 16:09:38,0,0,5
快乐永恒008,PLUS会员,用着还可以，比在店里买的便宜,2018-03-09 12:56:46,0,0,5
x***3,金牌会员,手机还好，感觉反应不是很快，给老妈买的，挺喜欢的,2018-03-08 10:29:28,0,0,5
无***3,钻石会员,看着还不错，刚收到货希望用的住，价格蛮便宜的。,2018-03-08 11:23:12,0,0,5
9***d,金牌会员,拍照超级好用，运行流畅，运行王者荣耀一点也不卡,2018-03-08 09:07:50,0,0,5
Q***e,PLUS会员,华为品质值得拥有，手机不错,2018-03-06 16:08:02,0,0,5
jd_156561fpa,银牌会员,好评！手感不错，信号很好，父亲用的，简单大方。,2018-03-06 12:13:53,0,0,5
j***e,铜牌会员,宝贝收到很喜欢，手感很好，反应很快，照相很清楚,2018-03-05 20:36:30,0,0,5
j***i,金牌会员,质量很好，配送速度很快，一直都很信赖京东。,2018-03-08 21:28:07,0,0,5
闪***语,银牌会员,外观漂亮大气，手感也不错，玩游戏也不卡，,2018-03-07 16:39:25,0,0,5
a***魔,银牌会员,给妈妈买的，她很喜欢，开心的不行。挺好用,2018-03-07 08:57:27,0,0,5
2***m,钻石会员,买给老妈用的，还不错，比较信赖华为出品～,2018-03-06 19:20:23,0,0,5
l***8,PLUS会员,物美价廉！值得购买！,2018-03-06 08:39:07,0,0,5
j***p,银牌会员,颜色妈妈喜欢，运行有点慢。妈妈喜欢就好。,2018-03-05 21:07:28,0,0,5
j***v,铜牌会员,一直信赖京东，还不错比较满意，发货也快,2018-03-08 21:03:08,0,0,5
j***s,铜牌会员,手机有点轻，入网许可证贴哪了，东西还行,2018-03-08 08:58:44,0,0,5
j***年,金牌会员,手机很好用，配置也够好，很好的一次购物,2018-03-07 13:19:58,0,0,5
陈***6,银牌会员,手机已拿到，4G信号不稳定，反应有点慢,2018-03-06 19:32:08,0,0,5
会***_,银牌会员,给妈妈买的，她挺喜欢的。用起来还可以。,2018-03-06 10:46:15,0,0,5
q***8,金牌会员,东西还是不错的，也好用，包装也不错。,2018-03-07 08:30:43,0,0,5
j***7,钻石会员,手机，可以买的，不过不是新的二手货。,2018-03-07 06:43:56,0,0,5
d***2,钻石会员,帮老人买的，聊聊天上上网没什么问题,2018-03-09 13:03:10,0,0,5
j***z,金牌会员,速度非常快，但是不知道质量怎么样。,2018-03-08 19:32:23,0,0,5
芸***清,金牌会员,手机用了，效果挺好的，老人很喜欢！,2018-03-08 17:01:04,0,0,5
z***i,金牌会员,感觉好轻，还以为会有卡套，结果没有,2018-03-07 07:40:44,0,0,5
w***g,金牌会员,使用中，待观察功能以及性能，好评！,2018-03-06 21:41:58,0,0,5
j***e,金牌会员,此用户未及时评价，系统默认好评。,2018-03-09 15:32:18,0,0,5
疯***奴,金牌会员,买两部了，用着体验还是很不错的。,2018-03-08 13:53:02,0,0,5
s***3,钻石会员,手机比想象的要差一些，照相不清晰,2018-03-08 11:02:44,0,0,5
静***5,金牌会员,过年期间买点的，物流小哥很负责任,2018-03-08 07:32:43,0,0,5
j***7,银牌会员,很好用，服务态度很好，非常满意。,2018-03-07 10:21:16,0,0,5
s***8,银牌会员,质量很好，外观很美，也很好操作。,2018-03-06 13:09:46,0,0,5
c***9,金牌会员,手机外观不错，大小合适，挺好的,2018-03-09 17:32:54,0,0,5
w***I,铜牌会员,便宜有又实惠，物流很快，服务好,2018-03-08 23:15:06,0,0,5
j***h,铜牌会员,手机很好，很适合我用，给个赞！,2018-03-08 17:53:47,0,0,5
j***c,铜牌会员,给老爸买的挺好，目前没什么问题,2018-03-08 01:32:52,0,0,5
j***光,金牌会员,这个华为应该还可以，毕竟是牌子,2018-03-07 14:19:13,0,0,5
j***a,铜牌会员,手机不错，是正品，可以放心购买,2018-03-07 10:12:48,0,0,5
泛***爱,铜牌会员,除了快递有点慢，手机好的没话说,2018-03-06 13:01:31,0,0,5
j***n,金牌会员,屏幕大小合适，反应也很灵敏。,2018-03-09 17:04:56,0,0,5
j***4,银牌会员,与描述一样，不错，还可再来。,2018-03-07 19:01:49,0,0,5
拉***炮,金牌会员,性价比超级好，就爱用它打电话,2018-03-07 12:07:36,0,0,5
j***3,银牌会员,手机速度很快，打游戏完全不卡,2018-03-06 16:34:02,0,0,5
一***一,银牌会员,好用，这是给家人买的第二部了,2018-03-06 11:51:41,0,0,5
浮***茶,金牌会员,样子漂亮，使用也好用，挺好！,2018-03-06 11:06:00,0,0,5
罗***丝,金牌会员,帮朋友买的，运行流畅很满意！,2018-03-06 11:40:59,0,0,5
j***a,金牌会员,超薄像素也清晰，上网速度快,2018-03-09 06:24:45,0,0,5
j***i,铜牌会员,手机用起来还可以，我喜欢。,2018-03-06 13:14:27,0,0,5
l***1,银牌会员,还可以，物有所值吧，，，,2018-03-09 18:06:00,0,0,5
z***p,钻石会员,性价比超高支持国产...,2018-03-09 17:12:07,0,0,5
j***1,金牌会员,物品挺好，就是物流太慢了,2018-03-08 17:58:02,0,0,5
c***l,银牌会员,外观不错，京东就是不错。,2018-03-08 10:59:36,0,0,5
鸳***吟,铜牌会员,手感不错，运行也还流畅。,2018-03-06 20:17:54,0,0,5
j***c,铜牌会员,电池不耐用，感觉像假货,2018-03-07 19:17:04,0,0,5
j***a,铜牌会员,还行吧，毕竟不如高端机,2018-03-07 09:32:51,0,0,5
j***s,铜牌会员,用了一周，感觉还不错,2018-03-09 20:32:49,0,0,5
劳***号,银牌会员,暂时没问题。看以后了,2018-03-09 17:05:01,0,0,5
Q***v,铜牌会员,商品很好  物流很快,2018-03-09 08:03:22,0,0,5
t***1,PLUS会员,手机漂亮非常好用,2018-03-08 15:41:28,0,0,5
白***湖,金牌会员,给老人家买的，很不错,2018-03-08 13:52:13,0,0,5
j***o,银牌会员,质量可以 性价比挺好,2018-03-07 12:03:01,0,0,5
u***L,银牌会员,用了段时间还是可以吧,2018-03-06 21:46:04,0,0,5
j***p,银牌会员,很好的购物体验，不错,2018-03-05 17:24:01,0,0,5
j***0,银牌会员,感觉还行，给小孩用,2018-03-09 22:12:27,0,0,5
H***酒,银牌会员,和预计的时间不符合,2018-03-08 08:15:54,0,0,5
ixNPVlvuJSMF,银牌会员,质量好这是第二个了,2018-03-07 19:38:45,0,0,5
r***M,银牌会员,谢谢，很好，蛮实用,2018-03-06 20:28:11,0,0,5
j***d,金牌会员,这款手机挺好的！！,2018-03-06 20:18:45,0,0,5
A***北,金牌会员,给弟弟买的，还好吧,2018-03-06 09:20:12,0,0,5
j***q,银牌会员,非常好的一次购物,2018-03-09 12:10:39,0,0,5
j***1,金牌会员,还可以买给亲戚的,2018-03-08 18:46:17,0,0,5
a***g,银牌会员,很好，值得购买。,2018-03-07 22:45:21,0,0,5
m***g,金牌会员,值得拥有他，面好,2018-03-07 12:04:22,0,0,5
後***詩,银牌会员,给家里买的，够用,2018-03-06 21:20:02,0,0,5
剑***8,金牌会员,挺好用，值得购买,2018-03-06 17:57:54,0,0,5
t***L,银牌会员,还不错，还会再买,2018-03-06 11:30:41,0,0,5
情***c,银牌会员,挺好的，还不错,2018-03-09 20:13:50,0,0,5
j***8,银牌会员,物流太不给力了,2018-03-09 18:29:19,0,0,5
j***d,铜牌会员,服务好，物流快,2018-03-06 19:11:16,0,0,5
做***人,银牌会员,手机还是不错的，一直用这个华为，很好的品质，没说的。就是这次的物流太慢了，京东快递能等三天也是醉了。,2018-03-10 02:58:45,0,0,4
z***8,金牌会员,信赖京东我爱,2018-03-09 15:29:59,0,0,5
j***a,铜牌会员,用的还可以，,2018-03-07 09:01:32,0,0,5
黄***虎,金牌会员,第二次购买了,2018-03-06 00:38:18,0,0,5
j***a,钻石会员,就这样吧,2018-03-09 18:36:00,0,0,5
jd_138161war,钻石会员,物有所值,2018-03-05 19:31:54,0,0,5
J***-,PLUS会员,父亲很喜欢,2018-03-06 15:45:46,0,0,5
i***d,银牌会员,老爸很喜欢,2018-03-08 22:01:40,0,0,5
L***Z,银牌会员,手机喇叭声音一边大一边小的可怜，另外快递速度有够慢，足足发了七天才到货，26号下单1号到贵州，硬是在贵州本地拖了四天才到手。贵州人懒出新高度了,2018-03-04 16:57:44,0,0,3
巷***影,金牌会员,客观的说，手机运行速度还行，手机拍照太差，室内拍照噪点太大，还有电池电量，明显不行，早上玩一会，待机状态下，下午就没电了,2018-02-24 11:51:43,1,0,3
jd_156338asi,银牌会员,手机刚买来，发现相册有张照片，谁动了我的手机。还能退吗？,2017-11-06 15:46:19,56,5,1
菁***7,PLUS会员,给老人买的，觉得这个内存也挺大，最后选了这款。手机很轻，整体看起来也不值钱……之前买过一块其他型号的，就贵200，但质量差很多，早知道就多花二百块钱了。已经买回来了也不值得换了，先用着吧。,2018-03-07 20:45:18,0,0,3
张***我,铜牌会员,客观来说手机还不错，就是听筒声音有点小，后来找了客服，他让我直接去华为网点维修，这个态度不好,2018-03-09 16:41:35,0,0,3
百***赖,铜牌会员,还不错,2017-12-20 07:06:31,1,0,5
j***f,银牌会员,照相功能很差，拍一个照片慢的跟蜗牛似的，照片模糊不清,2018-03-01 08:37:12,0,0,3
Z***E,银牌会员,还没使用，不知道效果怎么样。。。。。。。。。。,2018-02-25 21:49:01,0,0,3
I***q,银牌会员,感应速度大慢，不怎么样，如买这款手机望三思。,2018-03-04 16:38:18,0,0,3
李萌萌jiu,铜牌会员,耳机子都没有   醉醉的   物流一塌糊涂整的    最次的都是充电器  耳机吧   一打开耳机子都没有  但是送了钢化膜  软膜还算可以了    给妈妈买的 卖家不知道总换客服还是怎着   说了一遍的话 要重复N遍   用着先看看吧,2018-02-13 21:53:54,0,0,2
x***e,银牌会员,感觉这个机子好卡按键不是很灵,2018-03-07 08:29:28,0,0,3
6***1,金牌会员,一点都不好，下次绝对不买华为,2018-03-06 22:46:34,0,0,3
j***9,铜牌会员,手机有点小?，整体还算不错,2018-03-04 15:33:49,0,0,3
荷***1,银牌会员,没有耳机，买了两个都没有耳机,2018-02-18 16:01:41,0,0,3
j***a,铜牌会员,一般吧，玩游戏就有点卡,2018-02-28 18:28:49,0,0,3
j***4,银牌会员,一般般,2018-03-08 16:56:38,0,0,5
j***t,银牌会员,可以了,2018-03-06 09:54:49,0,0,5
荷***1,银牌会员,没有耳机，买了两个没有,2018-02-18 16:02:02,0,0,3
k***k,金牌会员,颜色没想的好看,2018-02-24 22:21:18,0,0,3
y***i,银牌会员,运行还行，打电话偶尔会掉线。最主要是电池非常不耐用。待机耗电量太大了。已经设计一些内容，但是更本不管用。。。。怀疑是不是翻新机,2018-03-09 11:09:49,0,0,2
j***u,金牌会员,手机刚到手，为什么拍照这么不清晰?总感觉雾气朦朦的，配置显示前置800万，后置1300万，却还这么模糊,2018-02-26 00:25:48,0,0,2
l***蝶,银牌会员,东西还成，就是什么赠送都没有，要求不高，连个壳都没有，赠送物品只有一个充电器,2018-03-04 17:43:44,0,0,2
j***r,银牌会员,导航不好用，一直信号弱，手机恢复出厂还是不行，现在不能用导航根本无法出行,2018-02-28 22:31:25,0,0,2
有***东,铜牌会员,客服态度比较差，手机一般，感觉不怎么好，建议还是换一家吧,2018-02-14 20:37:41,0,0,2
