名字,会员级别,评论内容,评论时间,点赞数,评论数,评价星级
j***虎,PLUS会员,还不错，买给老丈人用的，黑色很大气，指纹灵敏，希望不卡就好。吐槽一下送的东西都太次了，除了软壳勉强用下，特别是钢化膜，贴上之后瞬间好low的即视感。只要手机好用就OK！价格比自营实惠，用的京东快递，第二天就到了。,2017-09-26 11:18:56,16,12,5
m***k,银牌会员,手机钢化收到就来评论了 手机很好颜色很漂亮物流也很好而且还送很多东西我朋友很喜欢。,2017-05-15 12:50:56,64,23,5
A***0,金牌会员,第三次在京东购买华为的手机了，荣耀手机的质量杠杠的，以前买的荣耀3掉在地上很多次一点也没事，华为的手机续航不错，手机拿在手上很轻，手感也不错。希望华为越做越好！,2017-04-09 22:13:45,78,24,5
j***2,铜牌会员,商品也很好就是物流太慢了。我等了五天才到。看着快递员态度好的份上。就给个五星吧。,2018-02-22 19:02:51,0,0,5
d***g,PLUS会员,包装相当简单，颜值还可以，双面玻璃，系统反应还行，因为不怎么玩游戏，普通使用一天左右，有的软件可以删掉，内存20左右，其他还行吧，还送了贴膜，外壳，自拍杆，廉价耳机，性价比较高,2017-04-27 22:25:21,85,18,5
一***乎,PLUS会员,漂亮，真的太值了，千元买到这样的手机。支持国货，中华有为。,2017-12-05 20:02:01,4,1,5
桃***上,PLUS会员,手机比较好用，是一款比较不错的产品，在京东上买东西也很方便。,2018-02-24 16:17:21,0,0,5
望***雨,钻石会员,这个还可以，够薄，挺快。就是送货太慢了！！！手机颜值高,2017-11-25 11:07:20,4,1,5
y***n,金牌会员,挺不错的一款手机，外观挺漂亮的，就是开机运行速度慢，充电时间挺长的,2017-12-12 08:31:25,2,0,5
好***-,金牌会员,颜值 颜值  颜值    重要的事情说三遍,2018-01-27 11:01:18,0,0,5
j***f,铜牌会员,手机用了几天才来评价，性价比很高，爸爸很喜欢,2018-01-08 11:52:43,0,0,5
j***e,金牌会员,第二次购买了，用着还行。适合中国老年人群使用。,2017-11-17 11:04:48,1,2,5
沧***田,银牌会员,"很好用
千元机照样有品味的",2017-10-09 14:00:08,3,1,5
北极狼的传说,金牌会员,帮家里亲人买的，已经买第三台了，机器很不错。,2017-12-29 11:04:50,0,0,5
张***5,金牌会员,刚到手，手机挺漂亮，看看用的怎么样吧,2017-11-21 19:17:00,0,1,5
j***1,银牌会员,质量很好，屏幕显示清晰，反应也不错，收货也快！快递服务态度很好！,2017-03-20 11:38:26,28,7,5
心***n,银牌会员,还行。怎么没有耳机？,2017-08-15 09:51:08,1,0,5
-***-,金牌会员,包装没得说，颜色也挺正，帮工人买的，固件内存占用不小，实际使用情况等回来工人用过再追评吧！,2017-07-04 21:41:34,12,2,5
0***w,金牌会员,已经收到了，这是第三个华为手机了。华为手机感觉一向都不错。,2017-12-09 15:34:03,1,0,5
C***5,金牌会员,2b媳妇用的还可以，朋友见了，也想买个，不晓得买没买,2017-07-03 23:08:10,14,0,5
等***悟,PLUS会员,今天拿到了，很新很不错，这个价格这个质量，幻彩蓝还是不错的，自带送了一个壳，耳机还是改成一张钢化膜吧,2017-11-23 23:26:47,4,0,5
你***8,银牌会员,帮朋友买的华为手机，那天很晚才下单购买的，我自己没有体验手机效果，不过他没来找我，说明手机还是可以的，电池容量也挺大，能够玩一天的手机，颜色外观他也是蛮中意的，就选了这个颜色。,2017-09-28 07:40:58,2,0,5
t***E,银牌会员,非常好，很好用，当然是对于我这种游戏盲而言，还有物流很快，包装完整,2017-08-15 10:54:01,1,2,5
j***r,铜牌会员,刚刚小小的用了一下感觉暂时还可以 就是包装简陋了点用段时间看看再回来追评物流也一般 一分钱一分货嘛 总体还不错 就演讲到这了 谢谢同志们的理解,2017-12-25 12:34:43,3,1,4
c***8,银牌会员,帮别人买的，手机运行速度很快，一直用的华为手机，不错!,2017-03-24 15:54:18,12,4,5
j***c,银牌会员,非常棒， 在各种店铺挑了很久，都没有买到非常高性价比的手机，偶然在京东上看到了 一见钟情 喜欢这个颜色还有设计。 手感特别好，而且价格非常便宜 才1300 多,2017-07-30 13:47:19,5,0,5
飞***州,银牌会员,宝贝收到，非常不错，手感很好，信号好，上网快不卡顿。满满的喜欢。,2017-06-26 00:18:52,2,1,5
M***版,银牌会员,手机收到了，很棒，很快，用着手感也不错，拿捏着质感也很好～,2017-08-14 09:23:11,2,0,5
j***g,银牌会员,物品与图片描述的一样，机身自带软件占20G左右，能用的只有40G.运行起来有点卡！高价钱买低配置的手机不划算啊,2017-06-10 22:28:52,7,2,5
j***5,银牌会员,宝贝已收到.非常不错的一款手机. 非常喜欢. 下次有需要还会继续来光顾此店.,2017-08-07 15:53:14,9,3,5
j***k,银牌会员,看着还行，不知道用了怎么样，，还送了钢化膜和透明手机壳,2017-08-15 16:23:13,2,0,5
l***e,PLUS会员,靓丽的白色，超大的屏幕，指纹感应，双卡双待，36G手机内存，大容量电池，拍照更清晰。总而言之，本次购机很满意 ，好评。,2017-08-22 14:22:59,1,2,5
j***h,银牌会员,jd服务人员非常好.东西也不错.该送的都送啦,2017-06-28 11:59:50,3,1,5
百***0,PLUS会员,指纹解锁比我的5s还快。拍照清晰，超喜欢。还在使用发现中，有惊喜后追评！！,2017-06-28 10:19:50,0,0,5
j***3,银牌会员,暂时还是没出现问题 东西还是很不错毕竟1000多的手机嘛 就别要求太多 已经很不错了 外观漂亮 系统用这给你的感觉不是最好的 到你也不会觉得很差 中规中矩 你肯定不能跟三星56千的高端机比 指纹解锁很快 感觉现在中国的手机能做成这样已经很不错了 加油,2017-03-19 22:30:50,23,2,5
j***d,铜牌会员,给老妈买的手机 用了半个月了才来评价 手机没有任何问题性价比更高  运行速度也很快 老妈玩玩微信打打游戏完全够用了  华为的手机真的很不错  希望华为以后越做越好,2017-06-14 12:17:26,5,0,5
j***a,铜牌会员,帮老妈买的，在京东买比较放心，拿到就用了，速度很快，颜色大气，价格比实体店便宜了好几百，内存32g，好用,2018-02-05 10:09:45,0,0,5
欧***妮,PLUS会员,很好的一款手机，送给即将上大学的学生，超级喜欢。,2017-07-21 10:06:27,1,0,5
1***p,金牌会员,物流速度快，机子运行速度快，就是答应说好的发票一直没给，答应的事不做，不然给5星,2017-04-13 17:23:04,2,0,4
l***y,PLUS会员,非常有手感，颜色清新。操作起来反应快且灵敏。支持国货了。包装安全。就为什不给发票，这好社会主义羊毛的作风不好吧！,2017-08-30 22:08:16,5,0,5
1***枫,PLUS会员,分辨率不是很好。这颜色666,2017-03-21 18:38:30,23,8,5
jd_182770vtw,铜牌会员,刚刚拆开    手机外观不错      第一眼的感觉很好    用几天看看      如果好我再来追加评论,2017-09-12 10:23:18,0,0,5
a***n,银牌会员,给老妈买的手机，配送相当快，颜色真的很漂亮，本来还担心颜色的问题，拆开看了很喜欢，很耐看，大方的感觉。哈哈哈，送了好多配件，挺好的。给老人用3g+32g够用了。,2017-06-02 11:01:24,13,1,5
j***范,金牌会员,一直观望了很久，在618之前下手买了这款荣耀八青春版，一直担心评论说那个碎屏啊，或者是反应迟钝了卡顿的现象，今天拿到手机了，嗯，首先颜色很惊艳，系统配置也不低，如果你不打游戏的话，卡顿的现象是不会出现的。手机各方面都不错，嗯，你光就是打电话呀，发微信呀，看电视剧呀，这些功能4G容量加32G的已经足够了，非常好，有什么细节的话再陆续分享,2017-06-11 16:44:25,1,0,5
欢***c,银牌会员,手机手感不错，外观很好看。功能也很到位。运行程序非常流畅。玩游戏更加顺心，值得订购。,2017-10-02 18:06:00,0,0,5
j***1,金牌会员,很好，荣耀8用起来很好用，第二次在京东买手机了。给老婆买的，她很满意。,2017-08-20 09:20:46,6,0,5
j***o,银牌会员,手机试了感觉很好，华为手机一无既往的支持！千元机感觉很值！,2017-06-14 14:14:50,2,0,5
G***蓝,金牌会员,手机很好，速度很快，从外地到北京就3天，这个价格应该是厂家直接发货的,2017-07-13 12:26:44,0,1,5
h***2,金牌会员,手机屏幕比较大，功能齐全，还有华为自带的 健康软件。指纹识别功能特别好，既安全也很快捷，非常棒！照相机的像素也很高，能很清晰的拍照。系统很流畅，画面很美感，强烈支持国产手机！,2017-06-18 10:21:15,3,0,5
j***r,铜牌会员,刚收到货，还没来的及使用，不过颜色特正，炒鸡喜欢，物流送到家门口，客服也很耐心，祝生意兴隆！,2017-07-26 17:46:38,2,0,5
喜***儿,PLUS会员,很漂亮的华为荣耀8青春版手机，操作简便，手感、质地都不错。,2017-10-25 14:51:30,2,0,5
小***哦,银牌会员,我是帮盆友买的，盆友说耳机，还有自拍杆都挺好的?,2017-06-19 18:25:58,0,0,5
z***爽,金牌会员,价格实惠，手机真伪识别得是正品行货来的，发货及时，物流很快，包装严实，商品与描述一致，外观漂亮不愧为颜质担当，手感不错，试用一个星期没什么质量问题，赠送的礼品很实用。,2017-06-15 23:24:58,0,0,5
1***李,银牌会员,手机非常不错，我买的64G的，运行内存4G，回来以后是49G，有很多下载好的软件，都不需要安内存卡了，非常棒的一款机，玻璃版面，魔幻黑 ，已经是第二次华为机了，非常不错，支持国产。下次还来光顾店家。祝店家生意兴隆。,2017-10-05 12:51:03,0,0,5
安***5,PLUS会员,"用了几天，打游戏没问题，买了就是打游戏用的，性价比挺高，颜值也不错！
但有几点要吐槽下，赠品挺多，但都是些鸡肋，特别是贴膜，根本没法贴，其实商家没必要非得送东西的，送差的东西只会造成消费者的反感
但是商家还是很好的，京东物流的速度也很快，晚上还送货",2017-05-30 04:19:28,2,0,5
j***m,铜牌会员,宝贝手机今天中午收到了，非常精美，买来送给儿子的他高兴坏了，至于分屏功能  问儿子他说好象有，屏幕上可以显示出另外一块信息，这就是分屏吗。,2017-07-08 18:53:38,1,0,5
始***7,PLUS会员,手机挺好看的用起来也很流畅感觉在贵一点的机型完全可以替换掉我的苹果7P了，以后不会在买苹果了。,2017-07-11 16:43:24,3,1,5
s***e,钻石会员,出乎预料的美，原来纠结着到底要不要买9的，看来青春8足够了,2017-08-22 13:49:33,2,1,5
不***寒,钻石会员,手感不错，系统比较流畅，每次亮屏都是不同的壁纸，很个性,2017-07-29 18:12:23,2,0,5
雨***6,银牌会员,不错，虽然给我买的颜色不一样，但手机还是不错的服务态度挺好的，,2017-08-09 06:41:28,1,1,5
j***j,银牌会员,手机不错，物流很快。发货有一点慢。昨天己经到货，给我老公买的，他用了说这手机不错。知是反应有一点慢,2017-10-21 07:22:42,1,1,5
j***4,铜牌会员,第二次买荣耀手机，我的第一台6X是上个月买的很不错，这台荣耀8青春版是给我老婆买的，老婆非常满意，很开心，希望华为越来越好！,2017-06-15 18:23:14,0,0,5
天***6,金牌会员,给老妈买的，超级喜欢，物有所值。,2017-10-09 12:46:44,0,0,5
秋***8,银牌会员,一直都在用华为荣耀系列，外观设计时尚，颜值高，平时一般使用都不会卡，手感接触也棒棒哒。,2017-06-13 11:23:14,2,0,5
j***a,银牌会员,手机用了几天才来评价！感觉各个性能良好！玩游戏不卡！电池比较耐用！正品！一次愉快购物！,2017-08-25 11:31:18,1,0,5
静***1,银牌会员,不错，质量很好，是原装正品未拆封的，卖家态度很好，快递小哥态度很好。建议大家买这家店的手机。,2017-09-06 18:23:02,0,0,5
j***x,铜牌会员,手机还不错 外观很好 也不卡顿,2017-08-28 15:03:29,0,1,5
黑***明,银牌会员,"包装太简单了。
手机安全收到。
收到第一天，没有发现有什么大问题，耳机有点脏。",2017-11-28 19:38:16,0,0,5
h***8,银牌会员,很好。别啰嗦，直接上图自己看。,2017-08-07 18:26:37,0,0,5
哪***晚,银牌会员,挺不错的  性价比高 外观也挺好,2017-06-23 19:37:43,0,1,5
喊***哥,金牌会员,老妈很喜欢。。。。。。,2017-08-21 11:09:48,0,0,5
一***济,银牌会员,物流很快，服务也挺好，手机就没得说了，一千多能买到这么性价比高的手机非常难的，赠品很多，很好用，总体非常满意，祝愿生意永远兴隆！！！！,2017-08-02 22:21:57,1,0,5
天***蓝,银牌会员,很不错的手机，性价比高，价格还实惠，店家的服务态度很好，还送了很多礼品。。。,2017-09-01 09:54:28,0,0,5
j***h,金牌会员,东西蛮快到的，说是3天，2天就到了。客服很负责任哦。帮我加急的，东西验过了，是正品，蛮不错的，反应蛮快的，很满意的一次购物，下次还来，附图,2017-03-19 13:34:47,2,0,5
j***7,铜牌会员,物流速度很快，东西已收到外观都ok，屏幕接触都ok，反应也不错?不知道以后用久了会怎么样再评价?,2018-01-10 18:04:58,0,0,5
张***1,银牌会员,特别好，买的物有所值，还是喜欢国产，支持华为，我是中国人，物流特别快，特别好,2017-05-24 00:30:19,0,0,5
彬***E,银牌会员,手机很漂亮，买来送给男朋友，他很喜欢！机子正品，运行流畅，王者荣耀666,2017-03-16 09:56:29,1,1,5
z***哥,金牌会员,手机很好，用了那么久都没卡，支持国货,2017-11-05 19:50:36,0,0,5
z***O,银牌会员,手机很好，性价比高，待机时间长，使用流畅，颜值高,2017-07-25 13:35:32,0,0,5
常***硕,PLUS会员,手机使用起来非常好，速度很快。指纹解锁，给我弟弟买的他很喜欢。玩游戏不卡可以运行起来非常好用。,2017-07-24 10:41:01,1,0,5
j***6,铜牌会员,"配货速度真快,晚上睡觉前下单,早上上班到货.",2017-04-01 12:35:01,7,0,5
爆***淋,金牌会员,买的年会奖品，看着挺不错的(*?´╰╯`?)?,2018-02-08 20:58:59,0,0,5
jd_(☆_☆464,金牌会员,店家服务态度很好，发过来移动定制版跟店家沟通，店家愉快的答应换了标配版的，手机不错，正品，诚信的店家，好评，换货速度快，祝店家生意兴隆,2017-06-26 11:08:18,1,0,5
s***0,金牌会员,性价比很高，屏幕也不小，支持国产。,2017-08-21 11:40:09,0,0,5
j***v,银牌会员,第二次帮同事买，用后很好！特别是镜面反影。,2017-06-07 10:47:10,0,0,5
t***l,钻石会员,气泡袋包装严谨，华为品质值得信赖，更重要的是支持国货，全家全部换成了华为手机！店家也很给力，发货迅速，还赠送了手机架和耳机，值得赞一个！,2017-03-13 17:51:18,0,1,5
7***8,金牌会员,真有点惊讶，外观真漂亮！颜值爆啊！,2018-01-18 08:21:09,0,0,5
苏依v,铜牌会员,"快递很慢，过了一天才到。
我查过手机，是真的，但用了几天，感觉大部分方面还可以，但是，在一些滑屏浏览的时候，比如看小说（我是向下滑着看的）、在京东浏览商品、在网页上看新闻等，偶尔会出现卡顿、不流畅、显示错乱等情况
运存剩下的有2.5G左右",2017-09-04 19:27:02,1,1,3
j***a,银牌会员,刚出的时候买了一个，现在买了个青春版，挺好用。,2018-01-30 19:03:52,0,0,5
W***水,银牌会员,货已收到！手机跟实体店一样，手感和配置跟网店描述一致。至于有没有其他问题，用用在看呗！,2017-07-09 22:14:03,0,0,5
p***n,PLUS会员,手机反应很快啊，非常好用。,2017-11-27 15:46:52,2,1,5
j***y,银牌会员,和图上一样非常好用,2017-08-31 15:50:28,0,1,5
刘***3,金牌会员,手机速度挺快，也没好看，哎呦不错呦,2017-03-23 20:50:00,1,0,5
j***w,PLUS会员,样子很好看，背面镜面很精细，下次还会购买,2018-01-05 09:14:21,0,0,5
l***l,PLUS会员,手机收到了，包装严密，保护措施做得很好，卖家送了钢化膜，手机套和手机壳，唯一遗憾的就是快递有些慢，等了快4天，忘给我发票，客服也很好沟通，承认了错误，立马给我补了发票。还不错,2017-08-28 20:10:36,0,0,5
无***丶,铜牌会员,还行吧   手机挺好看的  就是有点卡顿，    续航时间有点短,2017-05-08 12:18:56,2,0,5
q***V,银牌会员,昨天刚收到的，把玩了一天，觉得还不错，今天上手体验一番，看看这款千元机到底怎么样？值不值得购买？ 【机身外观】 1.荣耀8青春版整体而言，颜值非常高，同价位手机里算是佼佼者！ 2.机身采用双面2.5D玻璃设计，中框是纳米级注塑而成，按键也是注塑而成，整机视觉效果特别好，尤其是阳光下，非常漂亮。 3.,2017-11-09 06:54:16,0,0,5
z***1,银牌会员,手机还行，就是充电有点慢非常慢很慢，最重要的是没给耳机。,2017-11-28 12:24:01,0,1,2
z***9,金牌会员,发货很及时，手机很漂亮，正品,2017-03-17 17:49:27,1,0,5
j***r,银牌会员,手机挺好的我喜欢，就是拿到手机没有电，正在充电，等好了看了在评价,2017-07-08 07:52:17,0,0,5
j***u,金牌会员,很好，非常非常喜欢，手感又好，值得买,2017-09-06 16:55:19,1,1,5
我***轩,银牌会员,首先来说物流很给力，很快就送到我手里了。手机也很好很漂亮，基于安卓7.0的emui5特别给力，不卡。到手47％的电玩一下午还有27％很好的一次购物体验。,2017-03-16 09:53:19,3,1,5
j***d,钻石会员,东西不错，很好用，下次还会买,2017-07-21 15:26:01,1,0,5
尾***小,金牌会员,给老爸买的。应该不错哈。,2017-10-11 18:46:02,0,0,5
j***f,金牌会员,手机用上了，就是快递慢，五号早上下单，八号中午才到，如果着急用，建议在京东上买,2017-09-09 13:12:08,1,1,5
睡***X,金牌会员,用了一周左右来评价:很满意，性价比高。双镜面很酷，4G+64G配置完全带的动日常使用，流畅不卡；玩王者荣耀和炉石传说长时间手机会有微微升温但是很正常，最长时间玩6小时以上；拍照能力可以，完爆亲自用过的努比亚Z17mini，符合这个价位水平；指纹解锁真的很快!,2017-05-14 11:12:42,0,0,5
骑***驴,PLUS会员,给我侄子买的，用了一段时间才来评价，很满意，没毛病，一直信赖京东，这是从京东买的第三部手机了，唯一不好的就是快递真尼嘛慢，最慢的一次购物体验,2017-09-01 23:49:48,0,0,5
s***u,钻石会员,虽然是第三方发货，但商家送了不少赠品，价格比实体店要便宜到好几百块，值得购买。,2017-05-06 16:20:20,1,2,5
j***i,银牌会员,**商家！！**商家！！**商家！！假货！！假货！！假货！！千万别再上当受骗！收到手机包装没有塑封。和专卖的包装都不一样！收到货当天就申请退货，手机看了下就直接放回包装盒就申请退货，可他们说手机有划痕不给退。手机我就拿再手看了下，连膜都没撕，说是我弄得划痕，不给退货！假货！假货！我会像消协投诉的！别再上当受骗了！！！,2017-08-07 12:09:13,0,0,5
j***k,银牌会员,手机收到了，用了几天感觉挺好的，就是充电慢点，骚蓝色很有范，价位合适，物超所值，千来块的手机有这个感觉很难得，还有不少赠品。很值得入手,2017-07-03 19:04:47,0,0,5
7***m,PLUS会员,感觉比苹果手机好，无论从使用感觉，还是外观，很不错，一个千元机做到这一点不容易，支持国产，真心推荐，你买了不会后悔,2017-06-26 10:51:57,0,2,5
j***7,金牌会员,手机很漂亮，蓝色的很赞，内存剩21g左右，送了贴膜和保护壳。不错。,2017-08-25 14:46:27,0,0,5
1***p,银牌会员,这款手机外观很漂亮，我挺喜欢的，电池耐用不耐用这个现在真的不好说，只有用一段时间才能知道,2018-02-10 08:03:51,0,0,5
亿***霏,银牌会员,"手机用着很不错,就是担心掉在地上会碎掉.快递很快服务态度也好",2017-10-04 22:28:14,0,0,5
E***l,银牌会员,非常好，外观看着很时尚，设计感很好，正反面都很光滑，手感非常好，指纹解锁也很方便，用起来也没什么问题，背景照片都很搭看着很漂亮,2017-07-27 19:40:39,0,0,5
o***5,金牌会员,到手速度反应都很棒 样子和颜色都前卫  一个字形容棒  真心不错,2017-08-10 17:46:22,0,0,5
小***兜,金牌会员,弟弟推荐买的，现在国产做得越来越好了，支持国产??,2017-06-17 11:42:28,0,0,5
j***e,铜牌会员,"手机不错除去系统运存大概2.6左右进了下游戏蛮快的。
物有所值",2017-08-05 13:25:02,0,0,5
z***1,金牌会员,用着还可以吧 个别软件偶尔会触键没反应 机子发烫很厉害 如果看个视频打个游戏就更烫了,2018-01-19 18:45:15,0,0,5
j***l,银牌会员,手机已到货，颜色还满意，外观也可以，反应也很快，不错，这次是帮同事买的，用得好我也给妈妈买一个,2017-07-08 10:40:23,3,0,5
X***瑜,银牌会员,外观还好，里面功能俱全，唯一不足是没有配耳机,2017-09-20 15:18:16,1,0,5
1***p,铜牌会员,手机还行，就是送的钢化膜是次品，不是很满意，:能否换个。,2017-09-01 08:40:22,0,0,5
j***s,银牌会员,手机还可以，就是快递不给力，太慢了，我等了四五天才到,2017-09-22 10:46:35,0,0,5
f***w,金牌会员,手机果然好！！！与宣传的一样。。。商家速度也很快！！！,2017-08-21 17:47:52,0,0,5
f***i,钻石会员,两边钢化玻璃的，高颜值！6.18拿下价格实惠！而且礼品多多,2017-06-30 08:06:59,0,0,5
j***h,钻石会员,华为手机质量好！,2017-06-08 19:34:23,0,0,5
j***z,银牌会员,手机，很漂亮，外壳黑亮，双卡全网通，又可以插内存卡，用着挺舒服的，用了一周没毛病，支持华为，,2017-05-05 21:32:56,3,1,5
j***w,银牌会员,为什么没有耳机,2017-08-08 13:18:37,3,1,5
1***4,金牌会员,朋友非常喜欢。。。不错哦。你值得拥有。。,2017-08-03 18:33:17,1,0,5
j***f,铜牌会员,手机物流很快，配件也都齐全。其他的，本人正在试用中。,2017-07-03 19:25:39,0,0,5
秋***领,银牌会员,非常满意！京东快递员服务好！手机大气！超赞！！,2017-08-13 10:15:55,0,0,5
老***美,PLUS会员,"充电速度还可以 后面摄像头不错， 很好 我试了一般使用可以撑3天 很不错 ，海斯的CPU多任务还是游戏都可以胜任 很好，虽然双11购买爆仓，但是也很快收到了 ，外观很满意，屏幕显示也很不错 ，系统很流畅。一直都是荣耀的老客户，3C，3X，P6，P9mini,身边的很多拍样也在用，质量各方面都做得很不错，国货当自强",2017-11-23 10:29:57,0,0,5
伪***n,银牌会员,手机很好，给朋友买的，用了一个多月了，没有问题，很棒！！！,2018-01-20 13:02:36,1,0,5
d***c,PLUS会员,很漂亮，屏幕要是再经摔一点就好了,2017-06-05 23:50:47,0,1,5
l***6,银牌会员,好评没毛病，手机很薄，拿着手感好。,2017-07-05 08:47:42,1,0,5
j***m,银牌会员,宝贝很好，外观很漂亮，颜值很高，拿在手上很抢眼，手机性能也还不错，性价比很高，总之老公喜欢的不得了，说终于买到合自己心意的手机了，大爱！有图有真相，手机真的很好，店家还送了手机壳跟钢化膜，谢谢，有需要还会再来的！好评！,2017-08-22 08:57:46,0,0,5
普***7,银牌会员,很好看，喜欢，买对了！这次搞活动买的，很划算！,2017-06-08 16:58:54,0,0,5
j***1,金牌会员,手机很好挺好看的华为不错店家送了好几个东西挺好的物流也挺快点的京东就是信的过,2017-03-21 09:10:29,4,0,5
j***k,银牌会员,手机收到了，各应用程序使用的时候没有感到有卡机的现象，手感不错，指纹解锁非常快，灵敏度很强！！！,2017-08-19 10:27:38,0,0,5
M***9,钻石会员,性价比还可以，买给上初中的妹妹的，学生用用足够了，王者荣耀撸一把没有卡顿，可以了,2017-09-11 18:42:10,1,0,5
高***0,银牌会员,手机外观没有瑕疵，内存足够日常使用，拍照很清晰，音质不错，打王者荣耀把高清显示以及粒子质量等等调到最高也能完美运行，毫无卡顿，全场基本保持满帧，性能不错，玩王者荣耀可以玩6～7小时，屏幕显示清晰，性价比高，值得购买。,2017-07-03 13:07:17,0,1,5
j***6,金牌会员,手机已收到，非常完美。,2017-10-17 11:44:12,0,0,5
赵***5,银牌会员,非常好！物流也快。手机很好用，谢谢老板，谢谢快递小哥！,2018-01-11 18:32:02,0,0,5
青***灬,金牌会员,手机发货很快，两天就到了，手感很好，外形很漂亮，运行很流畅，作为刚过千元的千元机，很实惠。,2017-07-27 11:44:21,0,0,5
j***p,银牌会员,之前买了好用，这是第二次购买，正品，好评，好评,2018-02-27 22:21:04,0,0,5
