名字,会员级别,评论内容,评论时间,点赞数,评论数,评价星级
j***h,金牌会员,物有所值,2018-01-12 17:58:53,0,0,5
j***e,金牌会员,质量可以,2018-01-02 13:42:08,0,0,5
j***t,金牌会员,触感度不够灵敏,2018-03-06 18:29:53,0,1,3
m***3,银牌会员,合约机的问题，不说大家都清楚，只有认了，一分钱一分货。,2017-12-07 19:39:28,0,1,2
我***比,钻石会员,手机拿到以后，前几次连上充电，居然充不进去，一拔掉数据线直接关机。后来又试了几次才行。另外手机屏幕上有一个亮点。第一次买小米手机，不是很好的体验。,2018-01-31 18:05:22,0,1,2
j***d,铜牌会员,无缘无故显示切换服务器，几分钟一次！谁知道怎么解决？客服让我卸载自己下载的微信等软件……说可能不兼容～～～唉，买来一堆麻烦！,2018-01-12 12:25:40,0,1,1
1***p,金牌会员,而而会自动关机,2017-12-12 19:40:08,0,1,3
k***Q,银牌会员,就是没有耳机。,2017-09-21 18:45:48,0,1,3
邓***5,银牌会员,手机一般，我一直都是用的联通卡，给我发了个移动的手机，反应超慢，我这是中心地带好吗，怎么会反应慢呢，退货还不让，里面就配了充电头和线，针，其他的啥也没有，昨天打电话出去居然还给我黑屏，关也关不了机，还是别人先挂了机，好一半天才按关机后再重启，觉得很不值这个价，一打开流量刷刷的走得也太快了吧，后台我自己全清理了，流量还是走得很快，电池一般般，,2017-09-11 10:37:50,2,2,1
j***3,银牌会员,去年买了个，电池还是容易发烫，其他还好，感觉还行，就继续下单买新的，以前那个满电三个小时游戏，现在这个两个钟了，不是很满意，想换的，免费就没换,2017-12-16 16:16:14,0,1,2
x***u,银牌会员,买了两个来星期吧，手机从三十公分的高度不慎掉落，结果外屏又碎了。换这个手机是因为上一个红米pro也是碎屏了才买的，别的都挺不错，这屏幕太脆弱了。让人郁闷,2017-10-05 11:53:11,0,1,2
j***o,银牌会员,这款手机本身还是不错的，过年的时候买过一个黑的全网通，这次买的为什么是移动的制定机！出全网通的价格买了个移动定制机，桌面上一些东西都删不掉！,2017-11-15 11:56:16,0,1,2
jd_158445dqi,金牌会员,一打开包装手机是脏的，无语,2017-09-26 17:05:39,3,2,1
C***2,银牌会员,不知道后期怎么样，买来还没用半个月那天触摸屏就已开始没反应了！后来又可以了！这样就不知道能用多久了,2017-09-11 15:34:28,0,1,2
jd_159070xwf,铜牌会员,不是我不给好评，我买个手机，手机套都没送，太抠了,2017-11-02 13:41:00,0,1,1
1***m,金牌会员,原来买过几个小米，感觉还不错，可这次比较失望！按说明卡一用移动，卡二用联通。卡二经常性无信号，有时还不能识别，如去掉卡一，卡二还是放联通卡，这一现象就没了。并且上网还只能是卡一，真是叔可忍嫂嫂不可忍！更可恨的是联系客服，小米推京东，京东又推小米！！！总之，这次购物，失望之极！！！！,2017-12-12 15:31:28,0,1,1
j***e,银牌会员,今天早上凌晨十二点多一点买的今天下午三点可到货了，这速度够可以的 非常满意  不高兴,2017-10-09 21:33:32,0,1,2
小***j,金牌会员,真的，作为一个京东老用户，这次购物真的很生气，手机拿回来打电话老是断线，信号超级烂，联系客服换机也不给我换！上次买的苹果七也是，居然用电信卡不能上网，起初我以为是卡的问题，结果放在别人手机用得好好的！以后买电子产品还真的不能选择京东了！实话实说吧！很糟糕的一次购物,2017-11-16 21:09:12,1,1,1
家***6,PLUS会员,第一次用小米，安装软件特别慢，不知是不是个案！。。。。。,2017-10-03 10:49:58,0,1,2
p***e,银牌会员,"有的忽悠人，移动合约机写什么移动联通电信全网通，全网通只能全网打电话，但是上网只能是移动的，别的卡上不成网。也只能怪我本人不懂，下单太急，用了几天才发觉，发觉时已过了退货期限，换货也只能换同款同型号的，换了那也不一样吗？所以有的忽悠
移动的就是移动的，写什么全网通",2017-11-21 14:08:26,1,3,1
義***y,金牌会员,机身通话过程中会发热；会卡顿，电池不耐用；正常使用十小时后就要充电,2017-11-15 20:17:49,0,1,2
j***w,银牌会员,手机用了一个多月，经常卡机，死机，体验非常不好。别的功能一般！,2017-12-16 12:55:24,0,1,2
j***≦,钻石会员,挺好的,2018-01-02 13:20:44,0,0,5
千***L,银牌会员,1分都不想给，买了之后电池充不住电，返厂检测确实电池有问题，维修后返回来还是充不住电。我买的是新的手机，电池却有问题，返厂后是换了块电池还是原来的电池修修又寄回来了？都说小米手机好，第一次买却直接寄了个有问题的给我，麻烦你们的售后好一点，尽快帮忙解决问题,2017-12-10 09:36:01,1,1,1
j***2,铜牌会员,为什么手机到了一点电都没有啊，开机都开不了，我以为是坏的呢,2017-12-05 19:00:26,0,1,2
1***p,金牌会员,手机刚到就有划印，最主要还用贴纸贴着了。。,2016-12-13 21:20:27,3,0,1
jd_136417adm,银牌会员,什么玩意，给老爸买的一个手机。红米4，没到一个月就坏了，我买的时候一千多块钱。维修的那个人说修要800块，整个人都要爆炸了。。。。谁要买这款手机一定要注意，想清楚再买，忠告,2017-11-25 13:41:46,2,4,1
h***3,PLUS会员,新机器才到手就系统崩溃也是醉了,2017-11-18 17:25:11,0,1,2
j***j,银牌会员,一份价格，一份货，便宜的手机用起来卡，开机很慢，,2017-09-26 19:48:13,0,2,2
欢***仔,银牌会员,…机子就一个充电器，连耳机都没有,2017-10-11 23:37:13,0,2,2
w***3,钻石会员,跟360同等配置相比，卖这个价，其实有点贵，,2017-10-17 21:18:50,0,1,2
雅***芬,铜牌会员,因为是买给老人家用的，一开始他只是觉得声音少，就没理会，过了十几天无意中跟我提起手机声音很小声，我调调的时候才发现是因为左边的啦吧不响，只有一个啦吧响！京东的东西本来跟信赖的，但是现在真觉得有疑问，是不是翻新机子，为什么新买的机子竟然这样？,2017-11-29 10:09:33,0,1,1
h***s,钻石会员,完全不能用 。 前置摄像头是坏的。幸好及时发现,2017-09-06 21:19:37,0,1,2
j***H,金牌会员,三个G的运存开机慢、开软件慢、放个视频也慢…请问运存你给我弄哪去了？,2017-09-22 13:41:49,0,1,2
j***8,银牌会员,刚得才两天就卡的不行-尤其是玩游戏太卡了,2017-10-08 12:19:54,0,3,2
e***7,铜牌会员,当时买的时候没有看评论，就冲这内存大，想着打个电话，偶尔上网浏览一下新闻就行，结果没过多久，就出现了打电话的时候没有声音，重启一下才好。还有不得不吐槽的事网络信号，平时有点障碍物挡着或者在家用流量的时候，信号差得不行。除了内存大，没有一点优点。,2017-09-03 06:15:50,0,1,1
乐***5,铜牌会员,关闭屏幕时，一闪一闪的，突然我感觉到好像是买了二手手机，系统应用程序也乱七八糟，在这个软件用了一会，突然又退出，要么系统自动换其他的应用软件，我急着用手机，不然我就退回给你了。问题多多，建议大家不要买这款手机。,2017-09-27 15:19:10,3,1,1
j***7,银牌会员,就手机和充电器，耳机都没有……,2017-12-29 19:33:22,0,1,2
摩***君,金牌会员,开机的音有点吓人，去不了,2017-12-26 11:07:33,0,1,2
拐***7,金牌会员,卡的笑死人！卡的笑死人！卡的笑死人！重要的话说三遍。电量4100毫安，冲了一晚上，早上起来看了会段子，到中午就是55%了，还是5.5屏幕。以前的6.44小米max屏幕我可以玩整天不充电。,2018-01-05 11:49:32,2,1,1
j***？,金牌会员,"买了两天就掉价50 ,还不能申请价格保护，

气死我了， 还以套装为由不能申请价格保护！！！
气死我了， 还以套装为由不能申请价格保护！！！
气死我了， 还以套装为由不能申请价格保护！！！

相当失望，第一次听说套装不能进行价格保护！！！！！",2017-09-19 10:49:18,0,1,1
S***e,金牌会员,才用两月就返厂维修了，换主板。,2017-09-09 05:46:16,0,1,2
j***l,金牌会员,我已经无话可说了  这才买两个月不到 已经换两次了  质量太差  第一次不到10天 听筒坏了  换了个新的  然后两个月不到音量键坏了  无语  都是新手机    再也不会用小米了  质量真心渣渣  忘大家看到以后  也不要买,2017-09-03 12:41:33,0,2,1
j***e,金牌会员,我啥也不想说了，没想到我的信息第一次泄露是从小米的官方店。不管你们是卖出去了还是为了自己刷评论，竟然说这是京东的锅，跟你们没有任何关系？,2017-10-12 17:21:23,1,4,1
江***冥,PLUS会员,物流脑子有坑，广州到湛江送去梅州干什么，我不是看你次日达还上你这买个屁，走了4天小米官网下单都到了还等你吗，还修改物流信息强行次日达，祝你们京东双11越办越好，迟早把底都亏掉,2017-11-07 18:43:23,0,1,1
j***t,银牌会员,一星都不想给，买了半个月，屏幕出现重影。去线下小米售后，给换了主板，屏幕。售后维修人员，否定了人为损坏。只能说手机到我手的时候就有问题。服气,2018-01-16 20:33:16,0,1,1
j***2,钻石会员,超级烂，各种闪退各种卡。。。特别烦的是玩着游戏打开一下微信就闪退要重新登陆，其他软件也一样！五六百的红米都比这好用，一星不能再少了,2018-02-22 20:30:33,0,1,1
j***k,银牌会员,8月18日买的红米4A手机，9月6日中午，手机突然打不开了，哎，真是郁闷，网上购物第一次失败，正在联系客服，还没有回音，手机打不出去，不知道内心真是有多么的郁闷啊,2017-09-06 14:38:13,0,2,1
-***-,金牌会员,很喜欢,2018-02-25 16:00:11,0,0,5
L***6,金牌会员,好用了,2018-02-21 09:42:16,0,0,5
傻***痛,银牌会员,非常好,2018-02-04 17:58:29,0,0,5
夜***处,钻石会员,挺好吧,2018-01-30 16:49:59,0,0,5
j***s,金牌会员,还可以,2018-01-29 20:08:51,0,0,5
z***e,金牌会员,挺好用,2018-01-22 20:49:01,0,0,5
h***9,钻石会员,挺好的,2018-01-19 14:34:41,0,0,5
j***g,金牌会员,挺好的,2018-01-11 10:24:23,0,0,5
j***3,铜牌会员,好用，,2018-01-02 09:04:52,0,0,5
l***8,金牌会员,很好！,2018-01-01 21:53:51,0,0,5
j***m,金牌会员,还可以,2018-01-01 03:09:35,0,0,5
4***3,金牌会员,手机经常发热，拍照还会死机，10月26买的1199现在1099，很无语，看电视打电话进来还有电视声音，不推荐购买；CPU是联发科的不好！,2017-11-01 09:32:53,0,1,1
名***傅,银牌会员,一直钟爱于小米的产品，不过这次的有些不太满意，没有看清楚，买了移动定制版的，流量卡没法自己设置，默认的就是中国移动，要是能够自主选择就好了！,2017-09-02 23:05:59,0,1,1
j***9,铜牌会员,我要买4x的，给我发了一个积压的note4，号称千元机性价比最低的手机，买来手机就扔了，有钱任性，第一次用京东买东西，也是最后一次了,2017-10-31 00:47:40,0,1,1
唯***旭,银牌会员,还可以,2017-12-31 13:47:34,0,0,5
j***5,铜牌会员,太差劲了，小米接收信号很强势的，可这手机连每个人的手机都不如，还有手机代码都用不了，我怀疑不是正品，我都想退了，再从新买一台了,2017-11-18 23:48:51,0,1,1
魅***k,金牌会员,手机没什么问题，但是没有送耳机，第一次听说不送耳机的手机，我之前也是在这里买的小米5s都送了手机，客服还说什么全部都没送,2017-09-22 15:02:39,0,1,1
j***h,金牌会员,挺好,2018-02-09 20:44:28,0,0,5
阿***5,银牌会员,一般,2018-01-23 19:32:16,0,0,5
x***o,金牌会员,拍的明明是全网通，结果发过来是移动合约机的全网通，要不是急着用早就退货了，而且刚买完第二天就降价了，忍不了。,2017-10-14 19:40:41,0,1,1
R***d,银牌会员,不好用，刚买回来就把卡烧了，现在开机键有反应迟钝，不知道厂家能不能给修好，不如小米4X好用，,2017-10-25 19:58:07,0,1,1
看客-购物狂,金牌会员,10月17日手机开始使用11月1日晚上手机看视频，就突然黑屏没反应，插上充电器也没有任何用,2017-11-02 09:44:18,0,1,1
j***a,铜牌会员,刚买回来就发热。而且拍照根本不清楚？扫二维码根本扫不出来？请大家不要购买！京东的东西没一个好的？,2017-09-04 11:09:26,0,1,1
l***0,金牌会员,很多人都说网上买手机百分之八十是山寨的，不知道这次是不是这百分之二十,2017-10-24 12:26:39,0,1,1
戈***民,铜牌会员,手机一般吧，带电不行，不过指纹挺灵的，用了十天没啥毛病，电池还是4000毫安的，带电不行,2017-10-26 09:14:27,0,1,1
文***0,银牌会员,很垃圾，觉得再也不会在京东买手机了。像翻新的。卖的也比别处贵,2018-01-08 10:41:09,0,1,1
1***乐,银牌会员,手机质量太差了，没到3个月就坏了！现在是充不进电，开不了机！真耽误事！可急死我了！,2017-11-16 10:40:23,0,1,1
j***m,银牌会员,手机电池不行，只能勉强用一天，我感觉是别人用过的，第一次在网上买手机应该没有下次！….,2017-10-23 23:13:32,0,1,1
j***s,铜牌会员,纯粹的假货，手机发热，尤其充电发热严重，最可笑的手机屏没碰，没摔，居然碎了，商家也不管,2017-09-10 15:22:42,0,1,1
j***v,金牌会员,我想问问是新机吗，里面还有几个la 圾软件，最可恶的是小米自带的应用商店都被删除了,2017-09-26 10:32:48,0,1,1
默***m,银牌会员,吃个饭从口袋掉下来屏幕就坏了，什么质量？一般很少评论这次真的火大，处女膜都没有,2017-10-25 14:17:51,0,2,1
g***g,银牌会员,不知怎么搞的，速度还没有红米Note3快，不太理想，都不想要了，又过了退换期限了。,2017-09-20 11:28:25,0,1,1
史***政,银牌会员,小米不能买了，骗人的，还说是超长待机，我就放家里不用一天时间都就没电了。,2017-11-20 19:55:26,0,1,1
c***0,铜牌会员,用大半个月就屏幕触摸不行了，强制关机才行！再买一次小米，绝对让你绝望！,2017-11-18 13:15:56,0,1,1
q***1,金牌会员,用了没有几天就出现充不上电了，一晚上15%，是我中奖了，还是就这样的质量。,2017-10-10 06:54:58,0,1,1
n***M,银牌会员,我十一买的手机，有问题，充12小时，用了3个小时就没电了，我要退货。,2017-11-13 14:26:56,0,1,1
j***5,金牌会员,质量不好，通话过程中会突然没声音，申请售后维修后还是出现同样情况！,2017-10-28 09:54:19,0,1,1
呵***哈,银牌会员,很喜欢,2018-01-07 05:16:43,0,0,4
j***8,银牌会员,手机触摸屏不好用，无故死机，应该是二手机,2018-01-01 15:55:52,0,1,1
M***g,PLUS会员,，去年买了一个，感觉这个比去年买的差,2017-12-25 11:54:13,0,1,1
j***m,PLUS会员,非常不好，一个月就充不了电，垃圾手机,2017-12-21 14:58:51,0,1,1
j***5,铜牌会员,不好，用了两个月就偶尔会死机，,2018-02-03 16:51:52,0,1,1
J***5,银牌会员,买回来，用了一下，手机发热，超严重，还不定时关机，是什么问题呢？,2017-09-09 20:42:02,0,1,1
kuangzj,银牌会员,首先是副卡不能上网，然后用了几天就打不了电话了，用过最差的手机,2017-09-27 23:15:07,0,1,1
j***7,银牌会员,自营的怎么连个耳机都没有啊  出名了就开始欺骗欠费者了,2017-11-03 21:55:53,0,1,1
j***b,银牌会员,二次要产品，不投诉就不给发货，太耽误事了，快递小哥服务特别好,2017-09-12 20:57:08,0,1,1
j***n,铜牌会员,发票給弄错了，反应很多次了，还没有解决，客服服务差的不能再说,2017-09-08 12:31:29,0,1,1
s***3,银牌会员,机身发烫，可以煎鸡蛋。待机时间短。以后不会用这品牌的手机了,2017-09-22 23:58:32,0,1,1
l***n,PLUS会员,一买不到一天就掉价，我不想多说了！！,2017-09-21 04:50:10,0,1,1
m***1,银牌会员,是合约机，拿到手总有点不舒服，开机那个移动界面很恶心人,2017-10-01 13:33:54,0,1,1
漂***2,银牌会员,垃圾，1500的像素居然二维码都识别不了。,2017-12-17 15:05:56,0,1,1
j***b,银牌会员,手机太不好，要吗用着关机，要吗给电脑一样中毒,2017-11-23 18:22:05,0,1,1
f***W,银牌会员,手机可以，物流快，就是充电器充不入去电，不开心,2017-10-29 18:48:42,0,1,1
j***6,银牌会员,发热很严重，第一次充电就烫手了，不知道能不能退货啊,2017-09-20 18:21:06,0,1,1
H***j,银牌会员,送货慢，没有准时送到，还有就是不可以先看货再付款！,2017-09-03 18:58:30,0,1,1
乱***绪,铜牌会员,手机不行  太卡气的我都摔了估计是翻新的,2017-11-11 17:19:04,0,1,1
4***m,金牌会员,坑的一笔客服就一死人给的合约机居然不送话费,2017-10-18 11:51:57,0,1,1
G***b,铜牌会员,东西不好看，性能渣，反正是个废物东西，大家别买,2017-09-15 14:57:28,0,1,1
y***1,银牌会员,太歪了用了几才几天屏幕就碎了。又不保修,2017-11-03 17:43:17,0,1,1
W***4,金牌会员,手机买来没用多少天很卡死机厉害,2017-12-21 15:20:28,0,1,1
j***c,铜牌会员,，次品假全网通，再也不买这种了,2017-12-20 07:33:27,0,1,1
H***-,银牌会员,手机越用越卡了，半月不到，退货都不行了。,2017-09-06 01:49:16,0,1,1
牟***们,银牌会员,厂家不给开发票货是假了,2017-12-05 12:53:58,0,1,1
j***1,钻石会员,声音有点小问题，出现过听不到声音,2017-09-08 16:18:05,0,1,1
L***J,银牌会员,快递员态度不好！,2018-01-06 23:19:10,0,1,1
晓***涵,银牌会员,用了没几天，频繁死机,2017-09-14 07:54:44,1,1,1
小***1,钻石会员,这手机出厂都两年半了，晕倒,2017-10-11 16:53:50,0,1,1
Q***9,银牌会员,手机容易发热。现在不膨胀了。,2017-09-04 09:55:07,0,1,1
j***e,银牌会员,太差了，用的最差的手机…,2017-10-04 22:06:17,0,1,1
j***b,铜牌会员,太差了，一天准备退货,2017-10-19 22:47:04,0,1,1
c***9,金牌会员,拿到手机店，说是翻新机,2017-10-01 19:22:50,0,1,1
S***_,银牌会员,*微信步数都不支持,2017-11-10 19:29:51,0,1,1
1***n,钻石会员,这次的没有转网络换卡,2017-09-24 17:23:26,0,1,1
j***t,银牌会员,容易发热,2017-09-17 01:13:58,0,1,3
风***-,金牌会员,京东真的卖假货,2017-12-18 15:52:17,0,1,1
j***x,银牌会员,容易发热，,2017-09-20 21:47:19,0,1,2
洁***在,PLUS会员[试用],很好,2018-03-06 20:33:54,0,0,5
j***8,PLUS会员,不错,2018-02-04 17:05:07,0,0,5
K***来,PLUS会员,可以,2018-01-03 21:17:20,0,0,5
L***h,金牌会员,可以,2018-02-08 11:37:38,0,0,5
d***y,钻石会员,不错,2018-01-24 09:04:29,0,0,5
缤***4,银牌会员,很好,2018-01-21 15:32:41,0,0,5
小***9,钻石会员,好用,2018-01-16 11:25:33,0,0,5
赵***6,银牌会员,好评,2018-01-14 01:39:47,0,0,5
带***蓝,银牌会员,还行,2018-01-13 12:42:31,0,0,5
张***会,金牌会员,还行,2018-01-03 17:07:37,0,0,5
s***2,银牌会员,不错,2018-01-02 16:07:38,0,0,5
东***来,银牌会员,还行,2018-01-02 08:59:25,0,0,5
j***f,铜牌会员,挺好,2017-12-31 17:49:52,0,0,5
E***X,银牌会员,可以,2017-12-31 11:46:59,0,0,5
j***o,银牌会员,好的,2017-12-30 19:42:49,0,0,5
波***看,铜牌会员,看着还好,2017-11-08 18:25:11,0,1,2
裤***气,银牌会员,没有耳机,2017-11-03 15:43:21,0,1,2
s***0,金牌会员,像素真垃圾,2017-12-22 11:38:59,0,1,1
l***1,金牌会员,物流送货差,2017-12-08 19:08:33,0,1,1
山***尼,钻石会员,不咋地,2017-09-07 20:04:59,0,1,3
j***d,银牌会员,还可以,2017-12-09 13:29:57,0,1,3
锋***2,银牌会员,还可以,2017-11-15 18:18:46,0,1,3
j***d,金牌会员,好,2018-01-06 00:26:27,0,0,5
j***4,银牌会员,还行,2017-11-11 12:04:00,0,1,3
a***0,银牌会员,还好,2017-09-11 21:41:19,0,1,3
j***6,银牌会员,好,2018-01-12 01:01:38,0,0,5
j***f,金牌会员,好,2018-01-09 20:12:25,0,0,5
开***儿,金牌会员,可以啊,2017-10-26 06:50:07,0,1,1
j***o,银牌会员,已坏,2017-11-23 16:46:58,0,1,1
j***k,银牌会员,坑比,2017-10-29 23:57:17,0,1,1
1***5,金牌会员,好,2017-10-08 10:45:44,0,1,3
1***p,PLUS会员,??????????,2018-01-05 11:45:08,0,0,5
j***5,铜牌会员,差评，手机发烫严重，电池不禁用，而且我买的全网通手机发的却是移动定制版手机，大家注意了，不要被骗了，现在京东都不可靠了,2017-09-11 16:04:26,0,1,1
h***1,金牌会员,超级差才一个月死机好几次，放歌和接听电话突然就小的听不见了差评超级差评,2017-11-18 11:03:16,0,1,2
腿有点长,银牌会员,不想吐槽了，只是希望能满足我爸妈打电话上个微信而已，谁知这个什么破手机真的垃，基，玩五分钟左右的微信就开始机身发烫，系统运行就像吃了迟钝剂，卡的要死，跳屏更是家常便饭，真的对不起这个价格，差评！,2017-09-18 18:22:30,1,1,1
j***a,银牌会员,差评，信号差得要死，红米4A有四格信号而none4才两格信号，说好3G运行却只有1.5G，反正就是差。差评差评差评差评,2017-11-30 21:59:37,0,1,1
2***n,金牌会员,买来就是通话不好，当时想将就一下，后来打电话都反应听不清，没法去修了次没解决，第一次差评，最糟糕的购物体验,2017-12-12 11:14:56,0,1,1
jd_187698nrg,银牌会员,买了不到20天，手机竟然开不开机。这是什么手机。差评。绝对的差评。难道给的翻新机吗？小米都是这么干的么。无语了。,2017-09-26 11:49:11,0,1,1
j***p,铜牌会员,差评差评差评，连个耳机都没有，而且问个什么客服什么都不知道，早知道就不在京东买了，不负责任……又不懂，还卖什么电子产品,2017-11-04 18:52:32,0,1,1
缘***丶,银牌会员,差评！时不时给我来个自动关机，还有时候突然给你来个死机，就一直卡哪里  动都动不了。,2017-09-07 17:37:29,1,1,1
廖***嫗,金牌会员,一个月没到，就坏了，电池发热恐怖，好像快爆炸的感觉，漏电！差评！差评！差评！,2017-09-30 17:50:28,0,0,1
远***草,PLUS会员,好久不给差评哦 买的是裸机 裸机 裸机 你发的是合约机,2017-10-12 17:48:40,0,1,1
墨***l,银牌会员,差评(*｀Ω´*)v，还不如我之前买的好,2017-09-09 00:02:08,0,1,1
无***放,银牌会员,差评京东配送速度，慢死,2017-10-13 10:06:39,0,1,1
n***1,金牌会员,会莫名死机，信号是满格的，有充足电量，就是开不开机,2017-12-15 20:50:36,0,0,5
x***3,银牌会员,好,2017-12-15 20:07:53,0,0,5
l***妈,PLUS会员,给老人卖的，非常喜欢，每天不离手,2017-12-15 19:13:52,0,0,5
j***5,钻石会员,还不错,2017-12-15 18:57:19,0,0,5
j***6,银牌会员,很好用,2017-12-15 13:41:37,0,0,5
摩***叶,钻石会员,给老人用，屏幕大点看起来舒服，送货很快，满意。,2017-12-15 13:40:13,0,0,5
头***状,PLUS会员,给家里老人买的，灰常好用，电量住够用一天半,2017-12-15 12:56:43,0,0,5
F***d,金牌会员,这手机很垃圾，还没用半个月就死机了，关机都关不了,2017-12-15 09:26:43,0,0,5
r***y,银牌会员,物流速度不错，东西也很好！,2017-12-15 09:07:05,0,0,5
j***8,PLUS会员,一如既往的好！,2017-12-15 09:02:26,0,0,5
j***v,银牌会员,好用，老爸说不错,2017-12-15 08:53:18,0,0,5
墨***2,银牌会员,非常非常非常好,2017-12-15 08:51:18,0,0,5
京***超,PLUS会员,非常非常失望，原本换手机是为了微信运动记步用，却没有这个功能，查过了应该是有的，不知道为什么这款没有。其他也就不想说什么了。,2017-12-15 08:50:19,0,0,5
邓***阳,金牌会员,帮同事买的，用着反应还不错！赞一下！,2017-12-15 00:11:18,0,0,5
j***m,金牌会员,不错哦,2017-12-15 00:01:24,0,0,5
j***t,铜牌会员,很好用！性价比高！服务到位！,2017-12-14 21:13:31,0,0,5
j***q,银牌会员,一般，没有想象中那么好，是不是翻新机,2017-12-14 20:25:04,2,0,5
j***9,银牌会员,手机是给儿子买的，他很喜欢，,2017-12-14 20:05:36,0,0,5
a***帅,铜牌会员,手机不错，我很喜欢。物流那是相当的快！这样的价格能买到这么棒的手机真的挺不错的！,2017-12-14 18:37:27,0,0,5
靳***购,银牌会员,已经到了两天，手机反应很快，第一次充电提示4小时15分钟。快递员真的认真负责，早上我没在，傍晚又跑一趟，真的辛苦你了！,2017-12-14 18:30:17,0,0,5
j***o,PLUS会员,手机到位了，性价比很高，感觉非常实用,2017-12-14 17:09:29,0,0,5
w***8,PLUS会员,手机反应很快，手感不错物超所值,2017-12-14 17:07:09,0,0,5
j***e,金牌会员,在京东买手机已经好几部了，值得信赖！,2017-12-14 15:04:48,0,0,5
y***g,银牌会员,快，好,2017-12-14 14:41:49,0,0,5
l***t,金牌会员,给老爸买的，用着不错,2017-12-14 13:55:11,0,0,5
j***8,钻石会员,挺好的，他比较喜欢，颜色也漂亮，看着舒服。,2017-12-14 13:21:53,0,0,5
m***5,钻石会员,对不起，因为忙来评完了，手机挺好，快递相当棒，超快,2017-12-14 12:47:28,0,0,5
