名字,会员级别,评论内容,评论时间,点赞数,评论数,评价星级
j***0,银牌会员,用着不错，屏幕大很清晰，老年人用足够了，性价比很高,2018-03-08 09:56:25,0,0,5
b***9,PLUS会员,挺漂亮的，包装很喜庆，屏幕很大,2018-03-07 20:47:22,0,0,5
j***赚,银牌会员,运行速度可以。总体来说这个价位还是不错的，买了不亏,2018-03-07 19:00:09,0,0,5
t***i,PLUS会员,千元神机，屏幕非常修长，性价比高，千元以下没有其他机子比这机子更漂亮了，这款非常值得购买。,2018-03-08 22:58:22,0,0,5
K***l,钻石会员,性价比还是不错，就是感觉有点大了。总体还是不错的。,2018-03-06 23:35:00,0,0,5
财***了,银牌会员,宝贝收到了，质量很好，京东送货就是快，谁也比不了！,2018-02-28 16:30:03,0,0,5
君***鉴,金牌会员,电池续航能力不错屏幕清晰度可以手感不错小米良心价,2018-03-09 10:51:36,0,0,5
多***面,金牌会员,"红米5 Plus这台手机就价格和使用体验来说,可以说是小米公司比较有诚意的一款手机,手机手感不错,系统反应也挺流畅,机身尺寸放在裤袋里刚好,左边是红米5P，右边的是小米NOTE，1，屏幕是1080的显示效果还是不错的，2，电池续航时间可以，本人普通使用的情况下可以2天充一次电。3，相机拍照效果只能说够用，拍一些生活照的还是可以的。不过这款手机还是有一些需要改进的地方，1，手写输入法的切换有卡顿的情况，微信和QQ切换手写都会有2秒的卡顿，2，不能取消系统升级的通知功能，会隔一段时间就会弹出升级系统的对话框，让人挺烦的，3，选黑色的朋友注意了，黑色比较容易沾尘，",2018-03-09 21:10:51,0,0,5
h***2,PLUS会员,"常网购,总有大量的包裏收,感觉写评语花掉了我大量的时间和精力!所以在一段时间里,我总是不去评价者随便写写!但是,我又总是觉得好像有点对不住那些辛苦工作的卖家客服、仓管、老板。于是我写下了一小\段话,给我觉得能拿到我五星好评的卖家,以示感谢和尊敬!首先,宝贝是性价比很高的,我每次都会先试用再评价的,虽然宝贝不一定是最好的,但在同等的价位里面绝对是最棒的。希望店家能再接再厉,做得更大更强,提供更多更好的东西给大家。给您的商品和服务点赞&dquo吃在嘴里,甜在心上",2018-02-26 09:16:47,1,0,5
j***L,PLUS会员,给爸爸的新年礼物，颜值高！,2018-03-07 12:06:33,0,0,5
B***C,PLUS会员,非常好，真的很好，值得拥有,2018-03-06 20:55:05,0,0,5
m***9,钻石会员,大小价格合适，买了个RAM4G的千元机里。CPU也是同款手机里的佼佼者。第二次给同事推荐购买了。都很满意！,2018-03-08 08:15:52,0,0,5
j***b,金牌会员,上午订的下午就到了，这样的速度只能京东有，赞!,2018-03-06 18:48:09,0,0,5
j***z,铜牌会员,非常好  这已经是第二次购买了  黑色更好看,2018-03-08 17:19:13,0,0,5
卢***南,PLUS会员,手机收到两天了，感觉很好，尤其电池续航能力很强，满电状态一天下来约使用20%。拍照效果也挺好。物流也给力，从下单到手机到手不到20小时。赞一个！,2018-03-09 15:30:17,0,0,5
l***1,PLUS会员,米粉，希望小米越来越好。,2018-03-07 21:09:55,0,0,5
j***3,银牌会员,这是我第四次在京东上买手机了，就是信赖京东，但我从来没有买过这么差劲的手机，应该是被拆开过的，拿回来保护膜是贴在上面的，拿到手没有五分钟装卡不小心碰了一下屏幕就碎了，质量太差了，我的手机小孩经常摔都没坏，介意亲们别在买了！！！,2018-03-08 00:00:22,0,2,5
z***p,PLUS会员,还不错，下次继续会买。,2018-03-09 08:13:52,0,0,5
l***a,银牌会员,续航长手机好看主要价格便宜买给爸爸非常喜欢,2018-03-03 15:58:29,0,0,5
桃***Z,金牌会员,可以，机器我觉得比我小米Max漂亮多了，而且怎么我觉得默认主题比我小米Max的默认主题漂亮啊？错觉吗？,2018-03-06 20:03:38,0,0,5
J***生,钻石会员,说的20号到.21号才到，让我在家等了半天,2018-02-28 20:26:16,0,0,5
指***0,PLUS会员,很好京东品质值得信赖,2018-03-08 14:42:14,0,0,5
请***哥,金牌会员,不错，流畅，外观也好，给老爸老妈一人一部,2018-03-08 11:02:30,0,0,5
S***D,PLUS会员,给同学的妈妈买的，一开始他们想用华为，被我安利了一下，很满意,2018-03-07 14:22:58,2,0,5
w***2,PLUS会员,给老爸买的，屏幕很大这点很好，父母用的app不多，卡顿基本没有，miui系统优化的不错，只是做工啥的还只是千元机水平，这点在提高一点就完美了,2018-03-09 17:11:22,0,0,5
j***l,银牌会员,"质量非常好，与卖家描述的完全一致，非常满意,真的很喜欢，完全超出期望值，发货速度非常快，包装非常仔细、严实，物流公司服务态度很好，运送速度很快，很满意的一次购物",2018-03-09 18:14:04,0,0,5
jd_151924ufh,银牌会员,电池很给力，给家人买的，大人小孩都能用,2018-03-07 16:03:43,0,0,5
r***i,PLUS会员,挺好的，买来用了一段时间，外表时尚，功能强大，值这个价。第一次用小米，没失望。,2018-03-07 07:41:18,0,0,5
用***号,银牌会员,运行速度非常快，颜值高，续航好！棒棒哒,2018-03-06 19:39:59,0,0,5
独***白,银牌会员,挺好的，手机系统挺稳定的，手机也不发烫,2018-03-06 22:20:01,0,0,5
离***斯,银牌会员,东西收到了，还行，就是有划痕，*果然名不虚传，算了，暂时没什么其他问题。。。。。。。。。。。。。。,2018-02-25 20:45:44,0,0,5
s***s,金牌会员,快递快比实体店便宜，使用效果好质量好,2018-03-08 21:24:52,0,0,5
起***了,金牌会员,不错！买的第二个手机！挺快的屏幕也大,2018-03-08 14:33:18,0,0,5
带***条,金牌会员,物流非常快，给父母买的也很好用，满意,2018-03-07 09:59:38,0,0,5
傅***君,PLUS会员,东西收到以后马上查看，发现与图片描述一致，超级喜欢，卖家发货 速度很快 ，，服务也很到位，给老板点个赞，下次还会来购买.........,2018-03-07 17:44:09,0,0,5
_***_,PLUS会员,很不错，值得使用。,2018-02-21 06:54:53,0,0,5
j***d,铜牌会员,打游戏用的，容易发烫，散热比较快吧,2018-03-07 18:27:20,0,0,5
再来爱一次,银牌会员,这个手机是过年初一买的，因为这么晚才来评论，就是想，感受一下到底好不好，说真的千元手机，做到这份上真的真的超值，我在我们这边实体店比了好多家，都没有这款手机，因为这个是新上市的吗？，而且这个手感真的很舒服的，我觉得屏幕也够大。我就是今天在打算买两台64G的，一台给我儿子用一台给我朋友买的，我朋友刚好要买手机吗？用得好才会介绍给朋友。我不能说哪款手机怎么样怎么样。但是我至少觉得千元手机做到这份上，真的很超值。那个手机被我宝宝拿出去玩去了，我就没得拍照，晚一点我在，上传手机。,2018-03-07 19:28:12,0,0,5
玩***了,PLUS会员,很好，做工比note4x更精细一些。买的时候没注意带了手机壳了，还特别买了个，不过自带的比较光滑还是磨砂的好一些。等使用一段时间再来!,2018-03-09 18:38:57,0,0,5
墨***4,金牌会员,音质 流畅 都还可以 物有所值。,2018-03-09 16:18:40,0,0,5
7***6,PLUS会员,"一直在打开屏幕自动亮度，办公室里使用，一天没问题。
我是女生爱拍照，色彩有点暗，不过后期增强一下也是美美的，价格也不贵，总体还不错！",2018-03-09 21:29:13,0,0,5
j***r,铜牌会员,真的灰常好，本来在网上买手机有点担心，但是到手让我非常满意，以这个价格买到这样高配置的手机，真的很划算，并且这个屏摸起来好舒服呀。电池续航什么再来追评。,2018-03-07 15:34:45,0,0,5
钟***L,银牌会员,帮同学代购的。一开始要买一台很小的手机。谁知道屏幕这么大。????不知道他能不能接受。哈哈。一开始我不知道多大我就下单了。懵逼懵逼。手感还行吧。,2018-03-08 18:06:47,0,0,5
j***7,银牌会员,手机很棒，我很喜欢，外观也很好看，到货的速度特别快，前天晚上十点多买的，第二天中午就到了，客服也很好，买的第二天降价了，还是她告诉我方法让我少花了冤枉钱,2018-03-07 19:45:54,0,0,5
J***n,金牌会员,送老丈人的 挺喜欢 希望能用住,2018-03-09 13:55:40,0,0,5
康20151029,金牌会员,帮公公买的，他说很好，屏幕又大,2018-03-09 07:14:20,0,0,5
J***柒,金牌会员,全面屏看着都比较爽，背部解锁。电池续航4000+已经是很大的了。小米性价比高，这个价位挺值。如果想玩游戏的话，买高配，我买的低配，玩游戏有点卡。正常。,2018-03-10 01:35:37,0,0,5
C***1,铜牌会员,不说话，请看图！目前不超苹果！,2018-03-07 20:10:51,0,0,5
1***p,银牌会员,手机不错 屏幕大 给父母用刚好,2018-03-07 16:29:44,0,0,5
陈宗强,PLUS会员,帮朋友买滴，挺好滴，细长细长滴，音质不怎么好，其他还可以，颜值挺高的。,2018-03-06 23:40:06,0,0,5
j***n,铜牌会员,外观上真的体现是使实用型的，新机运行速度很快，就是没有什么小礼品送咯，其次拍照不是太好吧。,2018-03-07 00:42:18,0,0,5
帅***萧,银牌会员,很便宜的，主要就是工作备用机，用来拍照片和用微信的，主要给我妈买了一个64的粉，感觉电池比较耐用，所以999买的裸机，暂时没有什么问题，便宜好用就行了,2018-03-08 20:11:44,0,0,5
勤***悦,金牌会员,京东就是快，感觉不错希望好用,2018-03-09 16:21:28,0,0,5
c***3,银牌会员,给爸买的，已经使用，还可以!,2018-03-09 10:19:22,0,0,5
李***0,PLUS会员,很好很喜欢  很流畅，很美 一直用这个，一直在京东够买东西。发货快。,2018-03-07 20:47:29,0,0,5
j***d,企业会员,送货很快，京东物流和商品都点赞,2018-02-20 12:56:53,0,0,5
j***h,PLUS会员,给老人买的，手机外形美观，配置对得起这个价位，老人用的很开心。遗憾的是买了手机的第二天就降了30，好几次了，感觉有点不靠谱啊，,2018-03-08 23:58:32,0,0,5
A***M,PLUS会员,可以分身好用,2018-03-08 17:08:45,0,0,5
瑞***轩,PLUS会员,先买了一个5X，这是第二个小米，性价比高，全面屏比5X常规屏幕显示的内容多，大小却差不多，拿在手上很顺手，给老人用的很实用。,2018-03-10 00:50:48,0,0,5
j***4,银牌会员,运行速度正常，手机很不错,2018-03-07 13:18:24,0,0,5
j***a,金牌会员,手机很不错，买个我妈用的，就是micro usb不是主流不好，其他的还行。电池也够用,2018-03-07 17:10:27,0,0,5
x***6,银牌会员,上午下单，下午就收到了，速度很快！京东自营就是不一样，唯一不足的是没有赠品！??,2018-03-06 19:01:05,0,0,5
w***9,金牌会员,送货速度真快 中午下单 下午送达，东西很好，屏幕清晰度还不错，上网速度很快，很满意的一次购物，小米手机真的不错，性价比极高，比我的苹果好用多了。,2018-03-08 20:59:45,0,0,5
j***3,铜牌会员,还好吧，觉得电池挺好用的,2018-03-04 12:22:04,0,0,5
自***o,银牌会员,我特意用了几天才来评价这手机用起来还挺顺手的物流也快手机也挺好看的就是数据线太短了,2018-03-08 23:01:55,0,0,5
w***h,金牌会员,"坚决的吐槽！既然做不到全面屏，何必非要蹭热度；既然有这么宽的下巴，为什么不把三个按键放在下面？
另外，系统操作的便利性，真的真的真的不如flyme",2018-03-06 16:39:42,0,0,5
新***生,金牌会员,送妈妈的，跟荣耀7X对比了一下，还是觉得骁龙处理器可靠一点。希望不会用久了变太卡！,2018-03-06 19:50:19,0,0,5
j***s,银牌会员,手机到手之后首先感受到的就是惊艳，这么完美的屏占比，人性化的操作系统，同价位里超高的配置，很满意，很好用，唯一不足的就是现在买不送耳机啦啊？？,2018-03-08 10:32:23,0,0,5
jd_186877okr,PLUS会员[试用],是正品，用起来非常流畅，爱不释手，京东快递还是一如既往的给力,2018-03-07 17:14:38,0,0,5
吃***菜,PLUS会员,给爸爸买的，挺好,2018-03-06 19:53:57,0,0,5
c***9,金牌会员,一直支持小米，支持京东，第二个小米手机，京东送货很快！用了一天还不错！,2018-03-06 21:55:12,1,0,5
跳***洋,PLUS会员,手机用着挺好的，续航非常强  触感很好，手机用着挺好的，续航非常强  触感很好，手机用着挺好的，续航非常强  触感很好，,2018-03-09 14:10:46,0,0,5
缘***0,PLUS会员,不错，就是价格变动大，但老人用起很不错，反应也快，声音也大，用了几年小米，感觉作为老年机，这个价位还算实惠，总体满意！,2018-03-09 16:56:36,0,0,5
w***6,银牌会员,买的第二部红米手机，性比价真的不错，给妹妹买的，屏幕很大，用着很舒服，很喜欢。,2018-03-09 13:31:50,0,0,5
大***鹏,PLUS会员,惊叹于千元机的做工，买来做备用机的，用低廉的价钱体验了全面屏时代，屏幕圆角设计很漂亮，MIUI的系统也实用方便，好评！,2018-03-09 13:31:06,0,0,5
X***6,铜牌会员,手机非常好，够我用,2018-03-06 20:12:21,0,0,5
j***0,PLUS会员,这个的屏幕不够清晰，比我红米599机差。唯一好点就是屏幕大。如果当时我在家收的货我一定换或退，觉得不值999这个价。,2018-03-07 10:17:44,0,0,5
j***6,银牌会员,额总的来说还不错。就是感觉电池没有红米4x的够力。而且客服说支持快充 可是却没有那么理想。不过分辨率确实不错。屏幕也大。总的来说还可以。,2018-03-09 12:50:25,0,0,5
敏***桥,金牌会员,很不错，买给爸爸的,2018-03-02 07:39:21,0,0,5
张***8,钻石会员,商品收到了，还行，但是还是会出现之前的问题，就是有点卡，但是对得起这个价格,2018-03-09 12:48:01,0,0,5
j***笑,钻石会员,手机关注很久，一直想入手这款，手机很漂亮，系统很流畅反应快，拍照清晰度高，,2018-03-08 21:39:49,0,0,5
乱***步,钻石会员,京东小哥送货很快，双十一积压，小哥都忙坏了。晚上7点还在派件，这服务没的说，其他友商都扔自提点不吱声的，东西收到了。不错不错，给个赞。,2018-03-10 00:15:37,0,0,5
扫***1,PLUS会员,手机收到?，速度很快，反映灵敏，外观大气，真心不错的手机,2018-02-04 14:55:18,0,1,5
a***s,PLUS会员,千元机的楷模，一点不夸张，买给爸爸用的，拿到手很惊艳，我想下一部我要是换手机也会考虑千元机的，而且小米这款真的不错,2018-03-09 22:07:17,0,0,5
j***k,金牌会员,早上下单，傍晚就收到了，非常满意！拿到手，手感非常好，做工漂亮，试用中！,2018-03-08 20:18:46,0,0,5
龙***雳,PLUS会员,包装空荡  手机在盒子里激励桄榔  没有气泡膜了么？,2018-03-07 13:56:16,0,0,5
偷***试,金牌会员,东西收到以后马上查看，发现与图片描述一致，超级喜欢，卖家发货速度很快，，服务也很到位，给老板点个赞，下次还会来购买.........,2018-03-06 22:03:28,0,0,5
j***v,铜牌会员,我觉得挺好，买了到现在不卡，玩刺激战场流畅运行，看视频杠杠滴，特别是电池容量，爱死了，中午十二点玩到晚上吃完饭还有20多电,2018-03-06 23:15:41,1,0,5
F***I,金牌会员,发货速度快，跟同事买的！他说很好，希望用起来没什么问题，我就很开心了！,2018-03-09 13:43:01,0,0,5
j***b,金牌会员,手机用了半个月了，感觉很好，屏幕清晰，电池耐用。送货速度一如既往的快。,2018-03-06 20:54:01,0,0,5
b***1,钻石会员,性价比很高的一款手机，实物比照片好看，给我姐买的，基本上能满足她的需求,2018-03-08 07:32:14,0,0,5
_***阔,PLUS会员,给妈妈买的，时尚大屏，内存足够用，服务也非常满意,2018-03-07 22:15:27,0,0,5
单***凌,银牌会员,给妹妹买的，东莞这边玫瑰金没货了，只能买金色的，先开机了，看了配置，开机速度挺快的，桌面响应速度还可以，还未正式使用，不知道具体的操作速度怎样，家里几台都是小米的，继续支持吧，希望不让我失望,2018-03-08 21:02:13,0,0,5
n***7,PLUS会员,手感上佳，屏幕清晰触感灵敏，小米再次凭性价比赢得我的支持和信任。终于可以不在为电量发愁，千元左右无敌首选。,2018-03-09 08:32:17,0,0,5
j***c,铜牌会员,手机超好的哦，3G+32G适合日常学生当备用机用，我已经爱不释手了！！！昨天晚上六点下的单，今天中午十二点就到了，快递速度很快,2018-03-09 12:44:50,0,0,5
刘***兵,PLUS会员,很好，给老爸买的，很喜欢，手感要比想象中的好很多，一开始对前面的屏幕设计感觉很丑，到手后一看，还是很好看的,2018-03-07 12:55:10,0,0,5
jd_baob628,银牌会员,送货速度超快！！！赞一个！！！,2017-12-27 20:18:05,0,0,5
天***子,金牌会员,手机简直超出我的想象，运行速度也很快，屏幕更是让人觉得惊喜，流畅度，很高，这电量也十分的耐用。就是这一次京东发货太**慢了。,2018-03-09 12:57:06,0,0,5
绯***叶,银牌会员,手机到手 用了几天才来评价 电池特好  用了一天也没事  我是几乎一直在玩 这点满意  刚到手运行流畅  这个价格非常值了。,2018-03-09 11:46:57,0,0,5
凉介RO,铜牌会员,手机很不错，不卡很流畅，看中了小米做系统的才买小米手机，以前红米note手机升级到MIUI9都不会怎么卡，然后决定买小米手机,2018-03-07 13:07:57,0,0,5
n***-,金牌会员,目前很满意 高屏占比 ppi很不错 系统一贯是广受好评 新旧换机也很简单 希望不出问题 物流基本第二天到 京东自营的不担心,2018-03-08 21:33:25,0,0,5
二***s,金牌会员,手机很好，时隔两年再一次用回了小米～手机很流畅，用来打游戏的～自己用的是iphone X，不想用苹果打游戏，苹果电池不行～,2018-03-09 10:03:55,0,0,5
B***R,铜牌会员,这手机买来主要为了玩游戏，特别玩王者的流畅的没话说，开高画质，高粒子的不怎么卡，吃鸡也没毛病，穿越火线屏幕有点大，习惯就好,2018-03-07 13:17:49,0,0,5
靳***迪,银牌会员,手机给我老公买的，魅蓝S6，和红米选了好长时间，最后选了红米，手机电池容量大，手机比例好看，音质好，相机好，所以选了红米！,2018-03-08 22:55:17,0,0,5
j***c,铜牌会员,收到打开盒子一看手机到处全是手印，很明显手机被买家退过的，或者其他什么原因，网上查了查手机真伪也没查到，之前买的红米4X就可以查到，反正能用就行了，无所谓了。手机摁着图标来回拖动会有非常严重的回影（要多严重有多严重），音质也没之前买的4X好。这手机参数显示分辨率挺高，但跟苹果比起来同样的视频显示的就有点模糊了，总体总体还可以。,2018-03-08 15:34:17,0,0,4
f***i,PLUS会员,划算，性价比高，买过好几部小米的手机了？,2018-03-07 17:54:18,0,0,5
路***白,银牌会员,?刚收到给家里买的   还不知道用着咋样以后追加评价吧?,2018-03-06 20:31:08,0,0,5
j***s,钻石会员,满意满意，我啥都满意，使用中，没什么问题，家里老人也很喜欢！,2018-03-07 08:16:03,0,0,5
j***2,PLUS会员,非常的不错，值得信赖的产品，买过很多次,2018-03-08 15:34:44,0,0,5
天***6,金牌会员,手机不错，屏幕大而清晰，颜色鲜艳，运行速度快，性价比很高。,2018-03-07 01:41:13,0,0,5
l***3,铜牌会员,"手机还没有用，感觉外观还可以，因为手机卡大了，所以一直没有用
，手机卡咋这么小哦，我以前的都是小卡，没想到这手机卡更小",2018-03-08 09:17:52,0,0,5
jd_151819wrk,铜牌会员,京东物流很快，所购手机物美价廉，昨天中午下单今天午后就收到了，只是没见到发票和赠送的手机话费体验卡，不知是怎么回事？,2018-03-09 15:44:35,0,0,5
j***9,银牌会员,已经是第二部手机了  自己一个 爸爸一个  很好用  用一两个月了没有任何问题 主要全面屏 颜值高  又不贵  挺好,2018-03-09 13:19:27,0,0,5
大***Y,金牌会员,还可以吧  卖给爸爸的，系统好用  屏幕的素质很高，感觉很好，另外  拍照还可以吧  重点是电视续航  感觉特别好用,2018-03-09 19:43:23,0,0,5
f***e,PLUS会员,京东购物放心，价格实惠，物流相当快。,2018-03-07 14:28:31,0,0,5
j***6,PLUS会员,颜值高，性能度，反应快。小米手机不错,2018-03-06 20:18:48,0,0,5
6***1,PLUS会员[试用],这是有史以来红米手机系列最好的一部手机，手机运行速度特别快，而且外观也非常的漂亮，相机也很清晰，真是爱不释手！点赞！京东快递真快，服务态度好，没的说，牛！！,2018-03-06 19:46:32,0,0,5
j***4,PLUS会员,帮同事买的 搞活动优惠券30元 待同事使用后再来评价 作为米粉相信小米的品质。给快递小哥点赞！,2018-03-09 19:15:28,0,0,5
百***1,银牌会员,给老爸买的，因为天气原因今天晚上8点多才收到，迫不及待打开来看看，目前运行顺畅，机身无损伤，其他的等用段时间再看看~,2018-03-08 21:32:31,0,0,5
b***p,铜牌会员,"手机感觉不错，电池耐用，可以用2，3天。充电也挺快的，还送了一个软壳
就是防护措施不太好，只有一个手机盒，整体不错",2018-03-08 22:11:34,0,0,5
星星喜欢华晨宇,铜牌会员,"到手之后用了五六天了才来评价，必须夸一夸电池的续航，对于我这样的手机重度使用症患者来说早上七点半出门之前充满电，能坚持到到晚上十点，很满足了！然后颜值也超高，可惜没有红色款，不过我自己买了一个红色的手机壳也算是圆满了，第一次用红米，感觉性价比超高，对于我这样的学生党来说很划算了。负一屏的功能也很全，有些人吐槽的卡屏现象也没有出现。
送了青春版耳机，音质棒棒哒！
大概要成为米粉了???•?•??",2018-03-07 19:04:46,1,0,5
X***r,银牌会员,"送货速度：有一丢丢慢，但还是可以接受
外观：后置指纹解锁有点麻烦，需要拿起手机才行
使用感受：很快！打开软件速度非常快，用了之前的小米账号，还有很多数据。
内存：买了64g，大概可用有55g左右
礼品：送了手机壳，软壳。
希望可以再送一张膜，可以拿到就用，现在需要等钢化膜到了。
五星",2018-03-07 08:03:19,1,0,5
j***c,钻石会员,手机很不错，很漂亮，一直用小米，操作使用没什么问题。,2018-03-08 22:09:25,0,0,5
z***6,金牌会员,搞活动买的，就是冲着京东优惠券多，才来京东的。666,2018-03-08 16:03:52,0,0,5
j***7,PLUS会员,给老妈买了个大王卡。以前用的都是移动定制机?用了10多年移动号真没想过离开移动。手机很好用,2018-03-06 23:32:37,0,0,5
黑科技发烧友,PLUS会员[试用],没有那种全面屏的震撼，帮同学买的，不过小米这个牌子还是很不错的，红米系列的性价比也非常不错。,2018-03-09 13:30:22,0,0,5
j***5,铜牌会员,"第三天手机才到有点小慢，快递小哥炒鸡贴心
系统很流畅",2018-02-25 12:50:21,0,0,5
j***r,金牌会员,外观可以，京东配送特快，次日就拿到货，服务态度好！,2018-03-09 13:18:42,0,0,5
云***6,钻石会员,电池续航不错，晚上下单，第二天上午收到货，用了两天才充电，屏幕很好，系统反映很快，是我想要的，小米没有让我失望,2018-03-09 12:11:12,0,0,5
7***m,PLUS会员,性价比    比较高的一款机器,2018-03-08 01:19:01,0,0,5
g***2,钻石会员,相当不错，性价比超高，比5x好。小米系统比较好用。,2018-03-07 10:55:27,0,0,5
唐***霞,银牌会员,第一次用小米手机，新机吗挺好用的。就不知道用，几个月后怎么样不管怎么样吧，还是挺好的，小米喜欢机身挺漂亮的赞。,2018-03-08 17:42:15,0,0,5
快***喵,PLUS会员,买了两台，黑色给爸爸，粉色给妈妈，这个价位的手机，相同国产中，性价比，使用体验最好的了。而且红米5PLUS是17年12月出的手机，相当不错。,2018-03-08 10:27:37,1,0,5
只***夕,银牌会员,次日达妥妥的  午饭前就到了，手机刚用感觉还好。,2018-03-08 13:48:00,0,0,5
g***0,PLUS会员,第二次购买 第一次买了送爸妈的 感觉真的很好 这次送大姑一家了  很满意 真的很满意啊！,2018-03-09 22:48:46,0,0,5
j***蓒,银牌会员,手机手感比较好，用着比较流畅，物流也很给力，好评,2018-03-08 09:06:02,0,0,5
御***i,银牌会员,"噗。屏幕5.99寸 千元全面屏 
推荐 手感ok",2018-03-07 18:49:05,0,0,5
t***0,金牌会员,小米的手机还是很错的，性价比很高，期待以后得新款,2018-03-07 18:13:07,0,0,5
j***p,铜牌会员,物流很快，上午下单下午到手???用后再评。,2018-03-06 17:59:12,0,0,5
间***子,钻石会员,做工精细  质量上乘  性价比超高  不错的选择,2018-03-06 19:59:00,0,0,5
