名字,会员级别,评论内容,评论时间,点赞数,评论数,评价星级
p***r,铜牌会员,喜欢拍照的别选这款，像素真心不咋地，手机是非常大，商家服务态度爱理不理，自带东西特别多占了不少空间，待机一晚上20多的电没了，说实话我对这款手机的印象不怎么！,2017-10-02 07:08:18,4,0,5
s***w,钻石会员,收到宝贝已经十多天了，因为事情耽搁未来的及评价。整体感觉挺好，物超所值。,2017-11-13 11:42:48,0,0,5
s***s,PLUS会员,屏幕超大，家里老人很喜欢。,2018-01-21 18:53:20,0,0,5
w***1,银牌会员,首先非常信任京东商品，京东快递员服务很好，很满意，所以一直在京东购物。这块手机运行很快，我下载了更多软件，运行也特快，确实挺满意，美中不足的是没有贴膜和配保护壳。,2018-02-11 20:24:57,0,0,5
可***o,金牌会员,手机很好，满意,2017-08-06 20:44:58,0,0,5
f***w,PLUS会员,给爸爸买的，妈妈也买的同款，爸爸很喜欢，于是给他也买了这款，是正品，运行速度很快，屏大他们喜欢的。我老板也用的这款，他说比iPhone好用多了。,2018-01-09 19:48:35,0,0,5
j***5,银牌会员,"我看到好多用户购买的都是64G的我购了个128G,卖家服务好很有耐心，是正品，因为原封，质量怎么样？我用后会如实评价的，",2017-12-05 22:41:26,0,2,5
l***1,金牌会员,不错，已经用上了。小米还可以，性价比高。老人用真不错，字体大,2017-11-29 07:47:17,0,0,5
勇***0,银牌会员,物流给力，外观漂亮。比我预想的还薄点。好用后准备再买6部送亲人。,2017-10-27 17:46:58,0,0,5
小呀小兜兜,铜牌会员,屏幕超大，物流超快，正品 ??开心?,2017-11-08 12:47:55,2,1,5
j***9,PLUS会员,这款手机买得太值了，长得又漂亮，用久了居然也不怎么发热，好评！而且充电挺快的，用得时间又久，超喜欢！放口袋又不会太大。,2017-07-02 00:05:06,0,1,5
丁***晖,钻石会员,"质量非常好，与卖家描述的完全一致，非常满意,真的很喜欢，完全超出期望值，发货速度非常快，包装非常仔细、严实，物流服务态度很好，运送速度很快，很满意的一次购物！",2018-01-13 08:28:29,0,0,5
环***彬,PLUS会员,宝贝儿收到了，还没用，是正品，好评，用后再来评,2017-09-26 21:49:50,0,0,5
p***n,PLUS会员,老母亲要求买的 超级大一块 很适合老人家,2017-10-31 17:57:14,0,0,5
冷***辉,银牌会员,昨天下午刚拿的货，还可以，送货快！服务态度很好！,2017-11-12 07:51:23,1,0,5
6***鹏,钻石会员,这款手机很好看，是正品的，系统优化的不错很流畅的，电池也耐用。,2017-10-09 20:33:52,0,0,5
j***n,PLUS会员,屏幕很大，看视频特别攒劲,2017-12-01 12:35:55,1,0,5
j***q,PLUS会员,很好看很好用。不错电池大。待机时间长,2017-11-15 17:02:58,0,0,5
w***止,金牌会员,用了一个月才来评价，总体来说还可以，电池耐用  牛牛牛,2017-11-15 19:24:07,0,0,5
j***6,PLUS会员,质量不错的，发货速度很快，价格很实惠的,2017-10-14 12:15:47,0,0,5
j***6,金牌会员,手机收到了，帮朋友选择的，所以帮朋友买了，外观相当漂亮，拿在手机很舒服，下软件很快，配置还比较高，相素，分辨率也高，朋友非常高兴，很愉快的一次购物，给商家五星，点个赞?,2017-10-02 20:36:38,1,0,5
q***f,铜牌会员,不错，确实很大，速度也快，很爽，第二天就到了，电量大，很耐用,2017-09-26 15:19:05,0,0,5
j***淡,PLUS会员,手机还可以，操作敏捷反应迅速，谢谢京东,2017-10-09 21:17:42,0,0,5
h***0,钻石会员,屏幕大，手感好，超薄机身，超清晰屏幕，价格实惠。,2017-12-24 22:10:13,0,0,5
宝***湾,PLUS会员,不错，给老婆用的，大屏很爽。,2017-12-14 17:48:42,0,0,5
j***N,银牌会员,物流慢了一点，但6666666666666666666666666666666666666666666666666666666666666666666666666666666,2017-10-25 22:30:48,0,0,5
药***童,银牌会员,屏幕挺大，刚拿到货，希望没有毛病，外观挺喜欢，用一阵子再追加评论,2017-08-06 17:13:36,0,0,5
j***s,PLUS会员,不错 可以 没有评价帮朋友买的,2017-11-24 23:35:02,0,0,5
j***q,银牌会员,物流很快，用了几感觉还可以，屏幕很大玩游戏没问题,2017-12-07 12:31:37,0,0,5
无***嘟,钻石会员,很好很强大，老人用正合适！屏幕大字大电池耐用！,2017-12-08 18:38:05,0,0,5
s***g,PLUS会员,"从用了小米后就成了“小米粉”，
也从小米Max到Max2忠实跟随，
除了自用还介绍同事、朋友，
值得推荐。",2017-12-17 08:31:15,0,0,5
j***g,铜牌会员,还可以，屏幕挺大，全新的,2018-01-10 18:26:29,0,0,5
j***f,银牌会员,挺好的！开机时没长按。还以为开不了机呢，吓了一跳,2017-10-08 11:57:32,0,0,5
j***8,银牌会员,京东物流很快，手机外观挺漂亮，屏幕尺寸够大，就是觉得手机上网反应速度不太好，别的手机一点就打开了，小米MaX2还得缓冲一下，总体感觉还算满意,2017-11-27 21:41:04,0,0,5
j***m,金牌会员,这手机非常好用，网速又快又不卡，值得够买。唯一不足的就是不能开启超强模式。,2018-02-03 20:52:38,0,0,5
_***强,钻石会员,朋友说不错，上网快，屏大，他很喜欢,2017-12-17 19:32:26,0,0,5
j***v,铜牌会员,"宝贝已收到  相当的满意 ， 拿来看视频好给力?   手感也不错?  

再说物流  对于京东的物流没得说  相当快   当天买  第二天中午就到了",2017-12-28 21:14:28,0,0,5
j***y,银牌会员,刚到手，验证是真品。用段时间在来评价,2017-11-04 11:44:11,0,0,5
x***_,金牌会员,电池耐用，屏幕大看电影很爽。,2017-12-21 18:04:50,0,0,5
s***妈,金牌会员,还没用，帮朋友买的，等用了再来评价。,2017-10-10 20:45:12,0,0,5
j***e,银牌会员,宝贝收到，还没有用，咋没有防伪码呢？,2017-10-06 18:01:09,0,0,5
春***w,银牌会员,非常好。发货快。,2018-02-28 09:02:25,0,0,5
j***9,金牌会员,用了几天感觉还可以,2017-09-28 16:29:17,2,0,5
p***丶,PLUS会员,谢谢京东，一直支持你！谢谢京东，一直支持你！谢谢京东，一直支持你！谢谢京东，一直支持你！谢谢京东，一直支持你！谢谢京东，一直支持你！谢谢京东，一直支持你！谢谢京东，一直支持你！,2017-10-09 11:01:11,0,0,5
j***m,银牌会员,好，大屏好，又清晰但无发票，无耳机。,2017-09-27 10:53:45,0,0,5
h***u,PLUS会员,刚才设置升级了，感觉很好。,2017-12-10 16:32:46,0,0,5
武***y,PLUS会员,就是为了大电池，大屏幕，长续航，然后撸王者荣耀！今天试了试，感觉撸王者荣耀大概能撸8.9个小时！十分满意！其他的性能，CPU，外观，摄像头什么的我不关心！因为我有三星s7e！之前用s7撸，一天要充n次电，怕电池撸废了。现在有了max2就放心了！就凭撸游戏没说的，点赞！,2017-06-22 15:22:04,6,0,5
林***4,银牌会员,用着特别爽各方面都非常完美。,2017-11-13 21:01:44,0,0,5
D***都,金牌会员,用了个把月，确实不错，尤其是看电影，我用的是腾讯大王卡，腾讯视频随便看，完全是如虎添翼！！！,2017-07-25 09:39:59,1,0,5
j***o,金牌会员,这个评分是给快递员的，以往买东西就是默认好评，今天我住的地方下大雨，又是下班时间，快递员冯师傅硬是特地跑一趟送过来，暖心，为他打call。,2017-11-13 18:18:46,1,0,5
有***吗,银牌会员,手机还可以，用这不错，非常好,2017-11-07 10:26:43,0,0,5
f***3,PLUS会员,第三方卖家，到货后检查一下确认赠品无疑，手机电池电量大，屏幕比较清楚,2017-11-05 15:53:25,0,0,5
d***0,金牌会员,这款机子非常不错，自打买上用了一段时间了，两天充一次电， 最长一次三天才充一次电。。屏幕特别大，看电影，看书非常好，赞一个，推荐,2017-11-08 12:43:16,0,0,5
s***m,PLUS会员,手机通过官网鉴定是正品，大屏幕用起来也很爽。就是别人都有小礼品赠送，为什么我没有呢？,2017-06-27 10:14:45,0,0,5
j***j,铜牌会员,可以不错快递真快,2018-01-30 16:18:02,0,0,5
l***0,钻石会员,很超值，大屏给老爸用的！,2017-12-02 16:03:23,0,0,5
我***叉,PLUS会员,618买的，卖家买的是正品，全新未拆封的，5星好评！！！！！发货快点就更好了！！！！,2017-06-25 13:01:13,0,0,5
j***7,金牌会员,刚到手下了几首歌，音质可以,2017-10-04 00:17:02,0,0,5
張***千,钻石会员,很好用，大屏打王者贼爽,2017-10-30 23:46:23,0,0,5
r***6,金牌会员,手机不错，验了一下是真品，值了,2017-08-12 17:34:06,0,0,5
j***f,银牌会员,很满意不错???,2017-10-14 09:14:45,0,0,5
k***1,PLUS会员,可以，没有哦毛病,2017-10-27 20:36:20,0,0,5
l***B,钻石会员,产品可以，快递给力。。。,2017-09-17 19:06:26,0,0,5
j***1,银牌会员,非常差，买2天就卡了，发货坏给我，现在叫我重新恢复出厂手机好次还不行，看电视等待响应卡死了，希望你们店倒闭，各位京东好友不要买了，差买天就卡了,2017-10-09 18:24:08,0,0,5
S***小,PLUS会员,不错，发货速度非常快，物流非常给力，商品质量非常好，京东商城服务态度非常好，不错，物美价廉，京东商城一直是我购物之选！,2017-10-11 14:36:24,0,0,5
h***9,PLUS会员,不错，发货速度非常快，物流非常给力，商品质量非常好，京东商城服务态度非常好，不错，物美价廉，京东商城一直是我购物之选！,2017-10-10 10:14:04,0,0,5
摇***y,金牌会员,收到货迫不及待的打开，很漂亮物有所值和想象的一样，反应速度快，手感比较好。值得再买，给爸妈买的老人家很喜欢。,2018-01-10 16:18:54,0,0,5
愿***佑,金牌会员,还不错吧，一直在京东买东西，小米手机不错，价格实惠，物流速度也快，京东值得信赖，支持京东,2017-07-01 11:31:59,0,0,5
你***吗,PLUS会员,为发烧而生，性价比高。配置好。价格低。突出实惠。,2017-06-27 13:29:57,2,0,5
吸***水,金牌会员,满意，物流快，值得信赖！,2017-07-25 18:49:13,0,0,5
a***8,金牌会员,自己挑的当然喜欢。先给好评，过段时间追评！,2018-02-10 23:19:29,0,0,5
j***s,PLUS会员,第七次买小米的手机了。就是喜欢它的一键搬家，省事多了。我买的4G内存手机，搬过来才1.8G可用，为什么会这样呢。,2017-11-02 13:06:30,0,0,5
前***万,银牌会员,非常好，屏幕够大，玩游戏  看电影都非常爽，电池耐用,2017-10-24 22:34:03,2,0,5
便***爸,银牌会员,用了一年，现在还在用。经常磕磕碰碰的，也没见坏。不过有时会出现死机的现象。这个价位可以的，性价比较高。,2018-01-31 14:52:18,0,0,5
f***0,银牌会员,冲着大屏幕去的，果然够大，电池也够耐用。运行快，不知以后装东西多了是不是一样快。,2017-08-05 19:14:09,0,0,5
j***b,铜牌会员,完美的一次购物，手机不错，屏很大，用了一天，挺好的，为京东点赞，???????????????,2017-12-07 16:07:15,0,0,5
黄***0,PLUS会员,只要喜欢就买，手机不错，电池也耐用，电池自带的电量看视频，新闻一天一夜了也就用了一半的电量，不错，过几天在帮家里的掌柜在买一部,2017-11-18 13:36:13,0,0,5
z***8,银牌会员,用了一段时间才评价，买来做备用机的，用了一段时间就后悔了，用了很严重的卡顿感，系统一点不流畅。跟同等价格的华为比起来，差距还是很大的,2017-10-11 11:00:04,0,0,5
j***b,银牌会员,手机是全新机，四G运行只有1.8G，亮度不够亮要开50%音质还可以，只可惜没送保护套，话说回来1分钱1分货，不会拍马屁，只是实话实说,2017-09-22 21:18:11,0,0,5
j***2,钻石会员,屏幕真的很大，用着还有点不习惯，更新了系统，不卡很流畅，安装了需要用的软件还剩40G，暂时没有发现什么问题。物流也很快。,2017-12-18 12:14:06,0,0,5
王***质,钻石会员,商家交给京东配送的，第三天收到，只有电子发票，一直未收到商家短信，问客服要的，买的时候价格比京东自营的便宜200块，还是可以的。,2017-10-30 06:12:19,0,0,5
jd_407002768,银牌会员,一样的好用，因为之前帮爸爸买过一台，屏幕大，拍照也挺清晰的，所以再买一台给我妈妈，希望她也喜欢用！,2018-01-27 21:31:36,0,0,5
落***丶,银牌会员,手机大屏很好  运行游戏也没有问题  缺点是采集信号的能力有些差  屏太大手机壳和钢化膜都只能网购,2018-01-21 08:49:40,0,0,5
j***8,PLUS会员,物流很给力，用了一段时间，运行速度有些卡，屏幕大，不过好像山寨的。还行吧！,2018-02-10 17:40:29,0,0,5
H***比,钻石会员,同事一起买了第三个了，超级好用。电池容量大，屏幕大。就是没有配置的，裸机一个。希望多些优惠活动。,2018-01-20 12:53:16,0,0,5
jd_159851odu,金牌会员,用就两天了，感觉还可以，没有卡顿现象，反应特快！电池也很好，开机就玩了3小时王者荣耀，第二天中午给儿子看变形金刚5才没电！,2017-11-01 09:26:12,0,0,5
h***i,PLUS会员[试用],"刚买的华为荣耀6x,感觉没有华为的速度快，电池用一天就剩一半了。华为的还有百分之七八十。就是屏大，其他没觉出啥好。凑合吧",2017-11-02 12:10:25,0,1,5
r***y,银牌会员,今天刚收到，非常满意，商家还有小礼物开心，还会在来光顾，非常满意的一次购物。,2017-06-17 12:32:53,0,0,5
j***n,PLUS会员,好东西  快递非常的快   手机比想象中的大  非常好,2017-07-02 16:44:14,0,0,5
j***7,银牌会员,东西很不错，外形我很喜欢，又大又薄，就是不知道质量怎么样,2017-06-06 13:19:22,2,2,5
H***1,PLUS会员,京东优惠力度大，配送速度快，值得宅着剁手，足不出门送货到家，轻轻松送逛街不买东西，期待更多品牌加入。,2017-10-12 23:50:56,0,0,5
j***l,铜牌会员,用了几天才来，这手机，看电影电视剧非常爽，不错，我喜欢！？,2017-10-09 18:39:21,0,1,5
梅***花,金牌会员,妈妈很喜欢！样子漂亮，看电视剧方便，内存又大，小米操作界面很省心，超值惊喜！推荐！,2018-03-06 06:01:27,0,0,5
尺***话,铜牌会员,手机不错，屏幕很大，续航能力也不错，挺喜欢的一款手机。快递小哥服务态度非常好，非常耐心。,2018-01-22 18:31:36,0,0,5
D***5,金牌会员,宝贝非常不错，屏幕大，运行快！媳妇很喜欢！就是物流信息稍微有点点慢,2017-07-22 10:49:30,0,0,5
H***3,PLUS会员,非常棒，手机很喜欢，价格也合适，非常喜欢在京东上购物，下次还会再来买,2018-01-04 20:09:46,0,0,5
j***t,银牌会员,我打开包装以看手机大气时尚，给我老爸买的，总体还不错，老人家眼睛不好，大屏手机看得清字？深圳发货到北京4天就到货了，请不错的一款手机，就是不知道用时间长了手机好用不好用？,2017-11-26 21:24:28,0,0,5
Z***Z,银牌会员,手机收到，物超所值，电池耐用时间也好，八点到十二点不停的用电池电量才用了20%很满意,2018-01-23 12:05:18,0,0,5
z***Z,铜牌会员,电池续航强无敌 屏幕大 拍照功能欠缺 其他地方比较完美 是一次比较满意的购物体验。,2018-02-06 22:23:00,0,0,5
小***u,铜牌会员,这是第二次在京东买手机了，外观不错，屏幕很大，信号也很好，用小米手机已经一年了?,2018-02-04 14:06:48,0,0,5
j***v,铜牌会员,不错哦  屏幕很大  很喜欢  我现在就在用  因为没别的手机所以照不了照片   物流也挺快的  服务态度很好,2017-11-02 13:01:00,0,0,5
l***a,钻石会员,京东是个好平台，最喜欢京东买东西，都是正品，家里都是京东的东西了，希望京东可以保持纯正品质！,2017-10-16 23:33:24,0,0,5
a***5,钻石会员,屏幕效果很好，电池耐用，系统流畅，拍照不错。赠品一般。,2017-06-13 08:53:15,1,0,5
g***7,银牌会员,很漂亮，非常棒的手机，价格公道，而且很实用，屏幕超大，，有点怕握不住，，哈哈哈哈，总之很满意。,2017-11-17 19:04:39,1,0,5
l***2,银牌会员,手机用了半个月了，目前没有毛病。只是商家对自已的商品性能不完全了解，还要四处查资料，我也是醉了。,2017-11-04 09:53:12,1,0,5
幻***d,钻石会员,手机收到了，因为没有弄好，所以没评价，挺不错的，网速快，电池耐用，屏幕大。,2018-02-28 08:27:59,0,0,5
j***c,银牌会员,还可以  但是听筒上面有问题  偶尔会有杂音  也不想再寄过去换  给好评吧,2018-02-12 18:11:05,0,0,5
神***头,金牌会员,正品，快递炒鸡快，上午下单，下午就到了。用了很久没问题，屏幕巨大，很爽。,2018-03-05 22:55:05,0,0,5
x***T,银牌会员,我先平下快递小哥。吴佳波，给我送过两次了，好，五星级！！再说手机，挺好的，比我预想的要大，运行很好，声音合适,2017-10-05 09:40:48,0,0,5
j***c,金牌会员,很好，自己用一台，又买一台给家公，再买一台给老公，快递哥哥很给力，服务态度很好,2018-01-18 00:29:40,0,0,5
托***军,PLUS会员,不错，小米越做越好，实惠好用！希望继续努力，多出精品！,2018-02-08 21:21:22,0,0,5
j***0,金牌会员,快递公司很给力，三天就到了。包装很好，里面的小米包装盒没有一点外伤。屏幕就是大，比我原来用的红米大多了。刚开始用，再看几天吧？应该不会错，我信赖小米。,2017-06-16 20:31:46,3,0,5
梦***雨,银牌会员,物流挺快，服务态度也挺好。目前看系统用着很流畅，看视频很享受，就是通话一般，拍照一般，其他的用着再看吧。,2017-10-23 08:28:33,0,0,5
l***w,钻石会员,买到的东西确实不错，值得肯定，小米的东西还是性价比最高的，屏幕大，操作方便,2018-01-20 09:20:51,0,0,5
1***p,PLUS会员,手机质量很好，在京东买东西很放心。手机又便宜又网速快。,2018-01-13 08:01:49,0,0,5
闪***父,金牌会员,快递非常迅速，包装完整，机器速度很快，屏幕也大也清楚，真后悔以前买了7p,2018-01-09 18:40:07,0,0,5
江***9,银牌会员,"小米Max2，真是让我欢喜让我忧！但是谁能做到最好呢？
不错了！",2018-03-07 03:06:59,0,0,5
j***8,金牌会员,屏幕很大，看电视很爽，不过偶尔有点卡，总体不错再用用看，希望能用很久……,2018-01-30 09:27:39,0,0,5
黄***5,金牌会员,"电池足够大,中度使用可以用2天.屏幕大玩个游戏看个视频够爽,要是屏幕密度再高点就没有颗粒感了",2017-12-03 07:16:21,0,0,5
d***f,银牌会员,感觉电池的待机时间没有max的久，其他的都是一级棒，照相要比max的清晰,2018-01-04 09:20:09,0,0,5
j***r,PLUS会员,手机用着不错   外观很漂亮   比官网上还便宜,2018-01-23 20:05:00,0,0,5
化***佬,钻石会员,买了note3感觉不错，又来买一个max2用下，刚升MIUI9未感觉到卡，用后再来追评。,2017-10-04 19:06:47,1,0,5
x***3,钻石会员,很不错，配送很及时，带有正规发票，手机质量小米的品牌不用说，杠杠滴,2018-02-02 14:19:37,0,0,5
m***G,铜牌会员,买了2天 玩游戏4个小时才用了10电  声音起大 比音响还大  反正买了这部手机什么都好,2017-12-15 23:17:38,0,0,5
1***p,银牌会员,手机不错，运行速度快，画面也挺好，重点，千万要买碎屏险，我没买，摔碎了，修屏幕花了600,2017-12-05 12:34:03,0,0,5
f***W,金牌会员,挺好的，特手感，大屏的眼界，在京东买了三部手机，质量很好，值得信赖,2018-01-18 09:25:18,0,0,5
1***p,铜牌会员,质量不错，很大，速度很快，真心满意，超值！很喜欢，正品行货。,2018-02-26 20:18:23,0,0,5
b***d,PLUS会员,手机还不错，性价比挺高的。电池充满能扛两天，比iPhone6用的时间长。,2017-10-26 12:34:44,0,0,5
上***极,银牌会员,还不错，够大。,2017-11-08 21:58:22,1,0,5
n***1,钻石会员,手机不错，运行速度很快，很流畅，一点也不卡顿，性价比还可以，外观很漂亮。,2017-10-19 19:25:08,0,0,5
四***呆,金牌会员,给老人买的，屏幕大，续航持久，已经买了三部了，性价比超级高,2018-02-26 21:01:38,0,0,5
l***9,银牌会员,屏幕的确很大，手小的朋友要双手操作比较合适，物美价廉的确名不虚传,2018-01-11 16:17:10,0,0,5
埃***孚,银牌会员,整体来说可以，性价比很高，比之前用的华为G7plus快多了；支持小米，出更多优质的手机！,2017-11-08 17:55:43,0,0,5
s***M,铜牌会员,可以，很好。就是我想外用U盘下载。可是不知道怎么搞的下载不了。,2018-01-21 14:25:16,0,0,5
海***司,PLUS会员,物流很快，快递员很负责任。东西也不错,2018-03-05 13:32:06,0,0,5
j***s,铜牌会员,机子不错，不过是裸机一个，当时看送手机套，现在查看没有了，还得从网上买！还得等！哎，啥也不说了……,2017-09-19 20:29:20,0,0,5
韦***宏,金牌会员,买了两部了，打开热点很耗电，两小时百分之8左右，其余的还可以吧,2018-01-18 10:59:19,0,0,5
国***室,金牌会员,电池还可以，给老婆买的，之前用红米，升级了小米，充电一次可以用两天,2017-11-15 07:46:38,0,0,5
j***a,银牌会员,是真品，与描述相付，赠品少点，只要手机没问题就好，点赞，五分！,2018-01-08 12:54:33,0,0,5
j***6,银牌会员,用了一段时间了，儿子说感觉有点不一样，他同学的比较重，自己的比较轻，好像是仿品哦,2017-12-23 10:55:29,0,0,5
兰***客,PLUS会员,很好的购物体验，一直信赖京东，还会再来,2018-02-01 18:19:17,0,0,5
j***2,金牌会员,东西不错，符合小米的作风，高性价比，大屏，就是配送略慢一点。,2018-01-15 20:41:21,0,0,5
j***8,金牌会员,此次够物非常满意，机子是原装新机，好用反应快，声音清晰，给95分，所欠缺就是没有钢化膜送,2017-10-10 09:30:20,0,0,5
l***1,PLUS会员,我就贪图一个大屏幕，导航，看纪录片都不错的。机子反应比较迟钝,2017-12-11 09:52:50,0,0,5
j***h,铜牌会员,不错，手机很耐用，电池续航给力。很满意,2018-01-22 18:36:06,0,0,5
H***y,银牌会员,物流很快，第二天就收到了，快递员态度很好，手机也好? 好评,2018-01-04 20:18:52,0,0,5
k***y,金牌会员,物流速度快，和商家描述的一致，宝贝完好无损！手机屏幕大，操控感好，尤其是电池耐用,2017-11-29 23:12:55,0,0,5
可***5,金牌会员,"很好,屏幕大,就是感觉反应没有那么流畅,物流很快,上午下的订单,下午就到了。",2017-12-29 20:02:51,0,0,5
赚***吃,PLUS会员,帮人买的手机，唯一的要求就是大，能想到最大的就是它了。。。,2017-12-14 10:52:23,0,0,5
三***3,PLUS会员,一直京东购物 一如既往的给力 物流又快又好 希望越来越好嘿嘿,2017-11-25 01:18:12,0,0,5
j***l,银牌会员,手机配置匹配手机价格，算是比较良心的了，这次购物较为满意！,2018-01-07 18:52:46,0,0,5
j***斋,金牌会员,用惯了屏手机，用不回小屏的了！不错，支持小米！！就是刚买第二天价格就下调了26元！！,2017-10-25 08:07:33,0,0,5
f***a,PLUS会员,老妈用 超大屏幕 待机4-5天 很满意,2018-01-03 13:09:53,0,0,5
j***k,银牌会员,丢累老母啊  相机闪屏  用一久就好了   质量有点差  建议大家到官网买  ?,2017-11-03 11:18:05,0,0,5
微凉徒眸45,银牌会员,东西到了 出乎我的意料 手机非常漂亮 用一段时间再追评,2018-02-01 14:43:46,0,0,5
活***6,铜牌会员,觉得屏真的很大呦，，也挺薄的，然后系统刚升为九，挺快的，就看一看满电一次能维持多久,2017-11-01 13:07:31,0,0,5
j***p,PLUS会员,屏幕大待机时间长支持国产正常用5天,2017-07-26 09:28:18,0,0,5
x***a,钻石会员,小米手机超大屏，手感舒服，包装完整，游戏用特别舒服。,2018-02-11 12:11:23,0,0,5
微***意,银牌会员,以前买过max    这车买了2代   手感上好了许多   屏大看着舒服   小米MIUI 9也特别快   挺棒的,2018-01-27 23:27:09,0,0,5
福***才,PLUS会员,到货很快，发货很及时，包装很严实，是正品，质量十分不错，我喜欢。,2017-10-09 21:34:49,0,0,5
飞***好,PLUS会员,到货很快，发货很及时，包装很严实，是正品，质量十分不错，我喜欢。,2017-10-09 10:37:01,0,0,5
小***哥,金牌会员,很好，便宜，速度也快，不足的应该就是屏了，不过一分钱一分货。在用，没办法拍照,2017-12-08 23:58:01,0,0,5
雨***兴,银牌会员,宝贝很不错，不过没想象中声音大，挺满意的一次京东购物,2018-02-03 18:37:39,0,0,5
Z***W,银牌会员,好货值得购买，就是没有礼物耳机其他的。使用好用再追加,2018-02-01 20:09:33,0,0,5
j***p,金牌会员,屏幕超大，运行速度很快，性价比高，我的第三部小米手机,2018-01-31 11:24:27,0,0,5
j***e,PLUS会员,小米手机出品！就是好用，屏幕大！手机流畅！物流也很快，老板人也不错,2017-09-14 00:28:50,0,0,5
8***蓓,PLUS会员,买给老爸的，老人家非常喜欢爱不释手，京东买的手机值得信赖！,2017-11-15 09:52:25,0,0,5
