名字,会员级别,评论内容,评论时间,点赞数,评论数,评价星级
n***7,银牌会员,一开始没发货的时候有点焦急 客服不知道怎么一直不说话 不过还是挺快的 两天就到了 机子验过了 确实是真机 却是是快的没话说 多花了一百而已 感觉比较适合 就是外包装有磕碰 不过不影响  具体的使用情况等用几天再来评价吧,2017-11-03 15:23:29,13,9,5
瞎买小萌新,银牌会员,五星好评 亮蓝色的米六想买好久了一直没货 来京东一看 这家有货 还便宜 真的很惊艳没开性能模式16W的分数 很高了 666是正品 没错的 十月份的新机 就是快递真的慢 北京到长沙五天 其中两天停在了广州不知道什么原因 反正就是好评啦,2017-11-08 18:10:42,3,1,5
j***g,PLUS会员,非常流畅，反应挺快的，分身模式挺好使，赞赞赞?,2017-12-18 14:28:47,3,2,5
非天逆道,银牌会员,港真第一次买新手机，而且这手机很拉风，酷炫蓝光由于我手小5.15英寸真的很好，而且我之前买的是红米note5.5英寸感觉大了一点手也不好掌握，而且配件齐全，卖家送的防爆膜钢化玻璃膜还有和原装一样的磨砂电镀防滑手机套真的很好完全透明，而且我现在单手就能掌握手机，风格几好而且原包装上还有个抱住背面陶瓷的一面包装真的很贴心，还有个小探针，前后都有保护膜抱着，手机套很贴身手机百分百相合，后面那张进网许可一定要保存下来，麻麻再也不用担心我不会用小米手机了，因为我买了小米6原装手机充电线就是快充，调转也不怕这逼格不是一般的高因为我用的是从卖家买来的小米6前后双摄，指纹识别人脸识别，堪比嗯国产中的水果手机,2017-10-12 22:41:21,0,4,5
j***v,PLUS会员,很好很好，原装没拆封的，和你们一样不太放心，到手各种查，官网显示5.30才买的，快递了三天到我手上，主要是广州离北京太远了(才发了一天半，无意点到客服界面，客服还帮催)，到了省份可以按京东自营的速度算了，在意跑分的话建议在不发热的时候重启一下再跑。网上都说后盖缝隙大，我这台的确可以放A4纸，但也非常小的，在玻璃和不锈钢的情况下已经很不容易了，贴膜和外壳推荐耐尔金(虽然左右还有一点点白边，2.5d以后也是用过最好的钢化了)和爱绚的。发的京东，快递盒惊现顺丰盒子(or胶布？)，很省电，最近失眠，今天很早醒了，玩了一个钟，掉电很慢，估计是因为835，很好的米6，没有大黑边了，还是秒识别的前置指纹，和p10用的同一种识别。拍照的人像模式比iphone7plus)还好，才两千六，还是很有性价比，希望不摔，用久点，哈哈哈,2017-06-09 09:07:48,27,16,5
j***7,PLUS会员[试用],手机很好啊，新机器，正品。后盖的边缘缝隙还是有点大的，二且贴合不是太严，手按下去有弹性的，这个好像是小米6的通病，与店家无关了。但是店家送的透明硅胶套很差劲的，根本套不上去，有点小了，毛边还特别明显，具体看图吧。还有就是卖家虽然用了气泡的袋子包装，但是袋子的一侧的气泡是空的，所以手机和外包装又一遍上下两个角是被摔过和挤压过的，具体看图，还好手机打开没有发现什么问题。,2017-11-21 15:47:38,4,0,5
e***y,银牌会员,"一直在用魅族pro系列，最近丢了手机找不回来了，就换了个小屏一点的小米6，一开始问客服有没有现货，急着用，一说有我果断下单付款了，没想到还是等了两天。然后可能是北京距离广东太远了，我足足等了这手机一个星期，愤怒的给物流 0分。
然后说说手机，把玩了一会儿手机，断流发热什么的都没有遇到过，性能很强，我开省电模式在撸大湿上跑分居然还能跑到15万，还排在了小米6的第一名，不清楚什么情况。性能方面毫无疑问给个满分。然后到续航，刚拿到手机是上午11点，还有百分之50左右的电，还原软件和使用习惯加上各种设置，摸索后，大约搞了一个下午，到傍晚6点左右还有百分之18的电，续航给个好评！然后到了缝隙的问题，确实有点不堪谈。。。。你懂的。但是也没有网上说的那么夸张。音质就不谈了，没有独立耳放，没有独立解码器，我600块的kc08听着挺一般的，发挥不出耳机的实力。屏幕没有问题，看着很舒服！！！小米6给个好评！！！不错！",2017-09-16 20:02:31,6,0,5
magicwu23,银牌会员,从iOS5用到iOS10，期间还用过安卓4.0的三星，那时候的安卓就一个字：烂！   这几年Google 对安卓做了不少优化，国产定制的ROM也在实用性上超过了iOS。比如短信的分类，截长图，导出各类文件等等。。实在眼馋了，就准备重新用安卓机。。这颗满血骁龙835很不错，对于日常使用绝对性能过剩了，电池的续航也完爆1800毫安时的iPhone。亮蓝色外观很漂亮，对苹果实在有点审美疲劳了，至于iPhone X，并不喜欢Face ID和那个刘海，不考虑。。买个性价比高而实惠的小米6，不失为一个好选择。。毕竟只要自己想，一年一换机也不会心疼,2017-11-10 21:28:12,1,1,5
j***1,PLUS会员,"五星好评，亮蓝色的米6真的好酷炫，之前一直在小米官网买一个亮蓝色的米6,官网上郑州这边一直显示没有货，发现京东商城上这家店里有，而且还比官网价钱便宜100，果断下单，第一天10点多下单，第二天下午就收到了，真的好爽，京东物流也真给力，五星好评",2017-11-10 16:53:59,0,0,5
m***5,钻石会员,老公早就相中这款手机了，一直没舍得买，正好老公要过生日了，本想趁着双十二有活动偷偷给他个惊喜！后来让我生了一肚子气，我是11号晚上买的，看到上边标着双十二活动的标记才买的，但到了12号早上价格就降了30块钱，很是郁闷，本想着收到以后退货呢，看在老公特别喜欢，而且手机也很漂亮，手感不错，算了，不退了。店家送的东西很全，钢化膜，手机壳，透明手机套，总的来说很好，给满分了！,2017-12-13 20:48:36,1,0,5
老***里,银牌会员,昨天收到的手机，快递差不多四天才到，刚刚拿到手机一开机吓一跳，开机居然直接进去主页面了，也就是我这手机有人用过了，最起码是说被人退货的，所以第一反应是这手机不会是不好用的吧，或者是哪里坏的？所以第一件事先查了IMEI是不是正品，还有鲁大师跑分看看对不对。还好都显示真品，然后查是不是屏幕坏点还是啥的，还有电池特意充满电，开着视频使用大概三个多小时，当然并没有把电完全用完，嗯，很久不玩游戏了，所以没有测试玩游戏怎么样，也就是说目前为止没发现有啥问题，指纹解锁也很快比之前我用的小米5s快很多，几乎是放手指上去就解锁了。还有没有发现手机发热很厉害，当然以我之前小米5s为例，并不是每次都发热，偶尔发热电量用的超级快，所以我并不会认为小米6就不发热，嗯，总而言之，目前为止手机不错，送的配件也不错,2018-02-14 09:24:54,0,2,5
j***e,金牌会员,"嗯。很好。昨天刚拿到手机，今天就要840去店里换屏幕，小米真的黑，坑骗欺诈消费者，说好的防水。我只是贴钢化膜的时候用了白边消除液，就进了屏幕了，因为刚买一天，抱着能不能保修的念头去小米之家问，维修的那个人两只眼瞪到天上了。根本不看你一眼，，这就是雷军这个狗宣传的防水？打电话给小米客服投诉，只跟我讲说是什么生活防泼溅，那我贴个钢化膜就这样。防个P,
一个学生，根本承担不起，去小店问价格，小店也要五百多。没钱换，只能这样用着了，，那几个小店还纳闷问我现在越来越少人用小米了你怎么还买
我要是知道小米这德行我才不会买！
看图片知道我有多窝火了，刚买一天。手机就这样，雷军，你破产在即！",2017-11-19 19:52:17,10,1,5
j***i,银牌会员,手机不错挺好用的，一直支持小米,2018-02-19 15:08:26,0,0,5
棋***许,银牌会员,手机是正品，买回来特地下了小米鉴定还有鲁大师，安兔兔验机，都显示是正品，京东的数码3C还是挺放心的。安兔兔跑分20万，至于激活日期没看，然后手机有些预装软件也都能卸载，这个赖不着人家商家，但是商家发货速度挺慢的。拍了两天才给发货。还有就是京东的物流，。太无语了，。北京就4个站，呆了两三天手机也没有网上的一些问题，。WiFi断流什么的，，这个属于系统问题，MIUI修复了，然后手机的后盖也没有那么大的缝隙，。的确是有缝。但是没那么夸张，，不至于塞的下一张纸，指纹也挺灵敏，小米公交的功能挺好，不过稳定版没有支持那么多的城市，，开发版支持的城市挺多,2018-03-05 22:32:32,0,0,5
j***k,金牌会员,手机到手了  客服很不错 小米6速度真的很快，买了小米6我才知道我还是觉得5寸的手机太棒了，这一次购物太愉快了，小米6不仅外观美，同时性能有很棒，十分推荐学生党使用，小米游戏真的可以为所欲为。,2017-11-13 23:28:56,0,1,5
密***G,PLUS会员,"最近打算换手机，本来没看好小米6。一天逛街路过小米之家，偶然进去看了看。真机在手，做工手感都不错，尤其是陶瓷版。恰好看到11号京东第三方可以用券，价格不错，就下单了。
收到货以后没开箱，先到官网查了销售记录。因为我这人比较厚道，没要发票，保修的时候要凭销售日期。官网查的信息是8月30日销售合肥，差十几天可以接受。
开箱以后发现右侧边框与屏幕之间夹着类似橡胶质感的东西，应该是溢胶，不排除是小米做工的问题。如果不是仔细验机很难发现。因为不显眼，跟客服反映了下，也就没计较。
吐槽一下卖家的赠品。手机壳开孔不太准。贴膜质量也一般。
安装运行了一些常用软件之后，没有重启就跑了分。所以分数略低。但我不玩游戏，只要运行流畅就可以。
小米以往给我的感觉是为了追求性价比，重视性能，忽略设计做工。但小米6颠覆了我这个印象，所以选择它也不后悔。",2017-09-14 09:06:42,2,2,5
x***d,金牌会员,对于小米6这款机器我抢了好多次，这次还没到双11就看到老板在搞活动，赶紧下手一台。物流速度还不错。今天上午到手，蓝色真的是非常漂亮，运行速度也是非常快，再官网查了这是新机器，还是挺惊喜的。6G运存基本能剩下3G多余的，玩了一下午没见杀后台。拍照方面比小米5有提升，白天和小米5差不多，晚上提升很大，最后是续航真的很给力，估计玩cf手游能坚持5个小时左右。总之值得入手。,2017-11-12 20:24:19,2,0,5
银***名,金牌会员,"收到马上检测了，用的安兔兔，是正品，亮蓝色的非常漂亮，比黑色好看，比起小米5，屏幕边缘少了那个黑边，顺眼多了，也没有想象中那么沉，手感挺不错。用的送的保护套，高透，不掩盖原来的色彩。
运行了一下，6g内存，开个王者，后台还能再开个游戏，不会被清理掉。值得推荐。",2017-10-09 20:24:13,0,0,5
承***4,银牌会员,终于拿到了宝贝，蓝色很漂亮，正品，跑分杠杠的，性能出众！十一号下的单，今天18号了，有点久！心里还是高兴,2017-11-18 22:37:37,1,2,5
wgx1号,银牌会员,买小米6之前，货比三家，最后选择了这一家，在这家买有比较大的优惠，9月10日正好抢到150元的优惠券，最后价格比官网还便宜，真是赚到了！京东发货一向很快！订了之后第二天就收到了。可以当快递员面开箱验货。手机外形太赞！反面能照镜子！听说手机后壳缝隙比较大，看到实物后觉得也还好，毕竟性价比这么高，能做成这样不错了！,2017-09-14 11:35:07,5,2,5
m***m,钻石会员,快递给力，给一个赞。价格可以，对比了好几家，听说速度很快，使用之后在做评价。,2017-10-06 10:48:33,0,0,5
j***0,PLUS会员,这手机拿在手里，有分量比我的原来的小米4好多了，很漂亮的外观，爱不释手,2017-11-16 12:44:34,0,0,5
j***e,银牌会员,"小米在上周发布了米粉们等待了一年的新产品——小米6。这款新机尽管没有像小米MIX一样带给我们强烈的震撼感，但高颜值加持最新骁龙835，为这款新机带来了强大的市场竞争力，不管之前是不是小米的用户，不少人在看过小米6之后，就已经中了雷布斯的新毒。
虎牙君在第一时间拿到了小米6，并进行了上手体验。配置和参数在网上已经说了很多了，我知道你们已经看烦了，所以我就从这几天的上手体验中来切身谈一谈这款小米新手机实际感受。",2017-08-26 21:54:38,2,1,5
j***q,银牌会员,"：首先性能不用说835加6G完全不用担心 电池的话我算是重度使用 一天没压力而且充电超快 外观上确实漂亮 没有米5的黑边 而且手感很好 不像米5割手 手感偏重而且有点滑建议戴套 拍照的话不能说惊艳 但是日常使用没问题 屏幕不错 而且音乐外放效果很好。 后面小放一张照片
缺点：1 需要万年不变的抢购 2 断流问题 有时候真的很烦人 后面应该会优化 3 按键偏松 晃动手机甚至能听见声音 后盖有缝隙 4 屏幕不错不过偏小 5 相机虽然是双摄 但感觉噱头大于实用 感觉实在没什么亮点 
心得：没有百分百的完美无视那些小问题小米6堪称完美毕竟我们便宜啊
给个五星",2017-10-02 15:35:23,2,0,5
风***云,金牌会员,在8.18时买了，价钱还行，虽说有点小贵，但是硬件摆在那里，也就值了。开机还是很流畅。外形挺美的。大小屋在手里刚刚好。就是物流慢了点4天。从北京发到昆山了，路程有点远，物流也给你个5星吧。,2017-08-23 22:12:46,4,3,5
私***-,银牌会员,手机太好看了，做工精细、相比小米5s好太多了，送的钢化膜质量不错，手机在官方查了一下，是第一次激活验证真机，送的保护套一般，不过原装里面自带保护套。,2017-11-15 16:52:03,0,2,5
j***i,银牌会员,"从昨天拿到小米6把玩到现在，简单说下上手的第一感受吧！

充电速度这方面，虽然搭配的还是QC3.0快充，但是速度还是可以的，至于续航，可以说让我这种中度使用手机的人很满意，昨天拿到手机开始玩，连续玩了好几个小时到早上8点多还有30多的电量。手机刚拿到的时候不是满电，我记得是80左右的电量。
屏幕素质个人感觉相当不错，白天光线很亮的情况下，屏幕依旧显示很清晰，亮度几乎飙到了和iPhone7差不多的亮度。还有就是晚上最低1尼特的夜光屏着实不错，亮度够低，眼睛看着也相对没那么刺眼。
相信大家对于骁龙835的期待都比较大，可以参考下我昨晚的跑分数据，应该会让你满意的，前提是你别拿着去和A10比单核，不然会被虐哭。",2017-11-21 19:20:07,0,0,5
j***l,银牌会员,昨天才到，今天就卡屏，关机都关不了,2018-02-27 19:16:26,0,0,5
磊***4,PLUS会员[试用],说实话还是非常满意的一款手机，鲁大师最后跑了16万分，我就是看到蓝色的后背被圈粉，非常漂亮，包装快递都很棒，但是有小瑕疵，为什么屏幕那张膜上会有脏东西，手机后背有一点小小的指纹。但这都无伤大雅，手机是好手机，很喜欢。原来是用iPhone的，但是用过这个真的觉得以后多支持国产，小米加油！店家加油！,2017-12-06 20:45:44,0,0,5
j***f,银牌会员,"是真机，今天到手，跑分17万多，不得不说小米的性价比杠杠的，客服好评，都说后盖缝隙过大可我看还可以，没有说的那么夸张，四曲面用起来手感很好，
唯一一点，就是京东快递刷新了一直以来在我心中快的形象，物流在距离我不到五百公里的地方停留48小时没有更新物流，到现在也不知道什么原因，反正客服手机都是好评，就是希望京东快递做回以前的京东，",2017-06-15 22:14:09,4,4,5
j***b,PLUS会员,东西不错，态度友好，物流快捷，目前觉得很满意！,2018-02-09 14:56:10,0,0,5
c***y,银牌会员,我是小米的忠实用户呀，家里人都用小米来着，这次双11在小米6和MIX之间纠结了很久，但看到网上的评论，认为米6还是挺靠谱的，性价比也好！拿到手，很小，没有我原来的米3宽，手感更好了，因为有四曲面设计。系统用起来很顺，速度不用说了，因为现在没装太多软件，这个以后再来评论。6G，128G的配置，对于现在而言，足够了！,2017-11-19 14:28:53,0,0,5
腾***宝,银牌会员,手机昨天下午收到总体来说还好   ，试用中，看到蛮多人说手机怎么样怎么样的 我暂时还没有遇到什么情况，还有就是物流比较慢了，八天才到，总体感觉挺好的 官网一直没货，就选择在这家下单了 好评,2017-11-20 12:20:33,0,1,5
j***m,PLUS会员,手机很漂亮，很好很好，原装没拆封的，和你们一样不太放心，到手各种查。小米6+128G蓝色，这个颜色喜欢很久了。卖家发货速度快，性能方面毫无疑问给个满分。有发票。正品,2017-10-30 09:48:53,0,0,5
刘***0,金牌会员,第一次看到蓝色版本的，本机堪称惊艳之作，全身温润如玉，似一个美女一样通体光滑，此荣耀9强太多，升级MIUI9更觉手机**冲天。走在大街上感觉浑身有面，苹果算毛线，我就是米粉，我为小米代言。店家发货快当天下单第二天收到，当拿到办公室，全体轰动了，那场面感觉飘飘然。总体打100分。,2017-09-14 21:05:48,3,1,5
任***1,银牌会员,小米手机性价比高，质量也不错。即使偶尔有质量差的。最起码现在手机都有售后服务，而且价位都在二千上下，已经很不错了？其他同类型品牌怎么也得二千七八百左右。所以还是值得信赖的。,2017-11-24 11:06:33,0,1,5
j***g,银牌会员,刚到 还没拆开看呢 全新包装没开封 感觉还不错 给个好评 快递速度也不错 29号下午4点下的订单 2号下午4点到的 我们这边就属于深圳最南边了 从北京到这整整五天时间 还行 我挺满意的 不过就是不知道是不是真的 还有他们说的有缝隙问题 还没检验呢 新机刚到 待会试试咋样,2017-11-02 16:30:47,0,3,5
加***胡,银牌会员,讲真，一个学生党为了买部2000多元的机子，真的是煞费苦心，我几乎浏览了所有的配置性能，发现适合我的只有荣耀9和小米6，性价比方面他们两个都不错，但是我更喜欢米6的外观，选择了6g64g，这就足够我使用的了，握在手机的感觉真是不一样，快递3天才到，可能是距离北京比较远，今天中午收到了，很满意京东的客服，很贴心，无论我问什么他们都很完美的解决了我的问题，谢谢京东(除了取消耳机孔，让我真的很痛心，虽然是手机的进步T﹏T)祝店家生意兴隆，手机是真机，不会错的，没有用过的痕迹。,2018-03-05 14:01:53,0,0,5
龙***o,银牌会员,发货速度也挺快，刚拿到手就评价了，手机看起来挺漂亮的，客服服务态度挺好的，没有给我发票，联系客服后说48小时给补发票，赞，比较满意的一次购物，等体验几天后继续追评。,2017-09-11 18:03:29,0,0,5
v***9,钻石会员,手机收到了，双十一买的，价格很实惠，就是物流双十一期间有点慢，不过还是可以接受的，还没有插卡，等插卡了试用后再继续追评！给卖家点赞，以后买手机就你家了,2017-11-18 17:54:18,0,0,5
缘***0,金牌会员,帮朋友买的新机！很是好用！外形美观大方！5.15的屏幕！很是适合手感！！朋友连连夸赞！！亮蓝色的很是炫酷拉风！！处理器！内存！运行！都很快！支持国产机！国产机也能有超越进口机那么一天！！对于价格来说很是合理！很是便宜的！！大力支持国产！力挺国产！中国为你加油！！,2017-12-07 10:52:12,0,0,5
j***x,银牌会员,亮蓝色的机身简直帅炸，手机内存也太大了吧，放了好几部动漫，一直在用小米手机这个品牌，很好用，也想一直用下去，在小米官网上看到小米6这款手机，看到它的性能真的超出想象，感觉小米手机越做越好了，今天手机刚到，就试了一下，手感还有性能真的很好，希望小米品牌越走越好，加油！,2017-11-15 09:36:22,0,2,5
D***G,金牌会员,双十一下的单，17号送到手，等得心急啊，手机很漂亮，手感很好看着舒服拿着安逸，手机没问题，鲁大师跑分15万5，现在出的手机还没有以前的手机好用，百度网盘上面的视频破解软件小米6能下载可是不能播放是什么鬼，一直缓冲，小米max就可以，使用一段时间在来说,2017-11-18 10:23:05,1,1,5
天***v,银牌会员,说出来你可能不信，2999的价格再加京东的一个200的优惠券，高配版的小米6官网价格2899，我亮蓝色2799就拿到手了，比官网便宜100元，还送软胶保护套和贴膜。小米6的手感真是没的说，正品，骁龙835的速度和功耗都没毛病，京东物流真的挺牛的，非常不错。,2017-11-05 09:26:33,0,1,5
j***3,银牌会员,不错哦！是正品货，发货快，服务态度很好，点赞！,2017-09-14 10:22:46,2,0,5
l***c,银牌会员,是正品新机 手感很好  程序一点即开 性能杠杠滴 终于搞到喜欢的蓝色了,2017-08-12 11:57:18,24,17,5
W***1,金牌会员,"用着非常好，非常的激动，小米真不错，支持国产，杜绝外国手机，小米好多功能特别强大！真的很棒，今天用了一下午真的很不错，反应快！中国的科技真的是不断的进步！
外观看着也特别好，特别喜欢这个蓝色，带金边的，拿着手感特好！！指纹特别快！！",2017-12-02 21:56:49,0,1,5
j***0,银牌会员,这就是我心仪已久的小米6，当拆开包装的一瞬间我就被它霸气的光泽震撼到了，就像大海一样蔚蓝的烤漆，结实的机身拿在手上超有质感。老板很用心，专门用的泡沫包装，一点没损坏，马上装卡玩了几把王者和cf手游，非常流畅，没压力，质量杠杠的，没毛病。,2017-11-07 21:29:45,0,0,5
j***j,银牌会员,手机很漂亮，屏幕大小正合适可以，装在口袋刚好，卖家服务态度很好，不过物流有点慢，有两天的时间物流连动都没动，后来就很快收到了，手机速度蛮快的，照相很清晰，很好的一次购物。不会贴膜，随便贴了一下，需要好好再贴贴。,2017-12-04 10:17:43,0,0,5
j***q,金牌会员,续航能力也能达到我的预期，刚入手就下载了王者荣耀穿越火线大型手游，玩起来才知道，骁龙835就是骁龙835，完全不卡顿，屏幕不愧是护眼屏，看着就舒服，指纹解锁秒开，小米的崛起让我看到了国产手机的希望！！！！！！,2017-11-24 09:41:52,0,1,5
昌***江,PLUS会员,整体很满意，手机的性价比很高，做工很不错，手感很好。买家发货很及时，包装还是很安全。开机一次性点亮，手机使用正常，送的东西虽然不贵，却也是买家的一个很好的心意。京东的配送还是服务很好，快递员很专业，让人觉得很满意。还有很多等着去发现之后再来评价了！,2017-09-14 23:49:31,1,0,5
D***e,PLUS会员,官网的抢了好几次都不到啊，看着这里的价格挺实惠的，所以在这里下单了。首先是原装正品，手机是全新的，看起来很漂亮，手感也不错，手机的性能挺强大的，MIUI9用起来也很流畅，手机的拍照感觉挺不错的噢，其他的公交卡等功能也很是实用，性价比很高的一台手机啊，好评吧，很愉快的一次购物。,2017-09-17 19:37:13,0,0,5
f***3,PLUS会员,10月25日下的单，盼了好久今天30日终于收到宝贝，物流和包装都还不错，快递员也负责，电话通知并把手机亲自交到手上，拆开看米6果然很漂亮，希望用起来也超棒，待后续评论……。,2017-10-30 10:58:35,1,1,5
j***2,PLUS会员,价格非常便宜，用着非常好，京东品牌，质量信得过……拍照情况来说，对人像模式特别满意，能突出而又不突兀，虚化非常自然，但是夜景毫无疑问，自动模式也就和普通2500左右的手机差不多，而且暂时长曝光也只有1/4s，这算是一个比较弱的点。前摄感觉还不错，我觉得和mi5差距好像不大。拍景物感觉也不错的，在某些时候用人像模式拍景也会取得意想不到的效果。,2017-12-15 21:38:48,0,0,5
j***i,银牌会员,非常好的一款手机亮蓝色是我最喜欢的颜色其中还可以有正规发票送有赠品，客服的态度非常的比较开心的购物京东物流非常的快如果说得对这款手机评分的话我想应该应该是一百分真正的做到了物美价廉想要的请赶快下手,2017-11-22 12:29:03,0,1,5
