名字,会员级别,评论内容,评论时间,点赞数,评论数,评价星级
蝴***3,银牌会员,手机屏幕大，质量不错，性价比高，快递送货快。,2018-03-07 07:06:12,0,0,5
7***钇,钻石会员,小米就是性价比高，好用，实用，全家都在用～,2018-03-09 07:08:20,0,0,5
j***6,银牌会员,还不错，全新手机，没开封得新机，用着也不错,2018-03-09 06:32:40,0,0,5
j***4,金牌会员,这是第二台了，非常好性价比非常高的小米机！,2018-03-08 15:59:45,0,0,5
七***1,铜牌会员,商品很满意，各方面都不错，就是屏幕有点大。,2018-03-07 11:13:57,0,0,5
莫***6,PLUS会员,已经收到货，物流很快,2018-03-09 15:13:51,0,0,5
l***8,钻石会员,屏幕超大，电池也很耐用，老妈很喜欢。。。,2018-03-08 09:00:29,0,0,5
潘***娜,钻石会员,屏大，待机时间长，装了七八个应用运行流畅,2018-03-07 03:17:33,0,0,5
弘***h,PLUS会员,给我爸用的，性价比高,2018-03-06 17:35:45,0,0,5
s***爱,银牌会员,还好吧 就是裸机太裸了 连个耳机都没有,2018-03-09 20:06:11,0,0,5
j***q,金牌会员,待机时间长，好评。用到第二天还有半格电,2018-03-09 10:40:00,0,0,5
逍***q,银牌会员,很好，电池耐用，王者可连续打八小时以上,2018-03-09 08:01:59,0,0,5
心***2,金牌会员,第二次买小米MAX了！！！期待MAX3,2018-03-09 14:10:52,0,0,5
j***7,银牌会员,很不错的手机，屏幕大，性能好，功能齐全,2018-03-08 23:56:32,0,0,5
无***k,银牌会员,还不错  电量挺耐用的  基本满足需求,2018-03-08 05:41:09,0,0,5
8***仑,银牌会员,质量还行，包装很好，希望下次还能来买。,2018-03-06 18:05:12,0,0,5
j***s,金牌会员,很好，很喜欢，照相很清楚，声音也不错。,2018-03-06 17:19:22,0,0,5
j***s,金牌会员,速度很快，买了好多次，京东666666,2018-03-06 14:15:42,0,0,5
j***8,银牌会员,总体感觉不错的，关健是屏幕够大，满分,2018-03-09 11:33:39,0,0,5
j***z,钻石会员,电池超给力，手机屏幕清晰！快递也给力,2018-03-08 20:34:40,0,0,5
蒋***兴,铜牌会员,昨天买起今天就到了还可以就是没得送膜,2018-03-08 18:32:04,0,0,5
j***b,铜牌会员,第一次在京东买手机效率特别快挺不错的,2018-03-08 11:54:50,0,0,5
海***飘,金牌会员,物流快，效率高，质量有保证，值得推荐,2018-03-07 14:43:51,0,0,5
秣***关,钻石会员,很不错的手机，买给小朋友用的，很喜欢,2018-03-07 22:57:15,0,0,5
奶***叔,铜牌会员,手机电池耐用芯片骁龙625日常够用，跟我的荣耀note8比这个除了电池容量高，别的都还是有差距的,2018-03-09 01:12:00,0,0,5
j***l,金牌会员,小米大法好，反应很快，希望继续下去。,2018-03-07 10:11:57,0,0,5
j***z,银牌会员,拍照清晰，屏幕大，性价比高！！！！！,2018-03-06 13:50:58,0,0,5
j***0,金牌会员,非常好，屏幕比想象中大，物超所值。,2018-03-08 20:34:54,0,0,5
可***宝,钻石会员,给妈妈买的，很大很好用，妈妈很喜欢,2018-03-07 19:08:42,0,0,5
依***悍,银牌会员,屏幕真的很大，电池也很耐用，点赞！,2018-03-06 20:53:13,0,0,5
1***p,金牌会员,屏幕非常给力电池能用两天没什么问题,2018-03-06 16:31:27,0,0,5
B***E,铜牌会员,质量不错，快递小哥服务好，谢谢！,2018-03-09 23:38:56,0,0,5
z***7,银牌会员,物流速度很快，机型也挺好，不错。,2018-03-09 21:23:54,0,0,5
j***e,银牌会员,宝贝收到，正在使用中。屏幕够大。,2018-03-08 19:49:28,0,0,5
a***8,银牌会员,此用户未及时评价，系统默认好评。,2018-03-08 12:39:42,0,0,5
j***i,金牌会员,手机收到，还没来得及体验。先存评,2018-03-07 22:41:37,0,0,5
j***o,银牌会员,手机很好，这是第二次购买很好用。,2018-03-07 13:45:19,0,0,5
y***0,金牌会员,外观不错，电池够用，屏幕有点大！,2018-03-06 17:29:41,0,0,5
亿***她,银牌会员,玩游戏都俩天不用充电！哈哈哈哈,2018-03-09 21:22:21,0,0,5
君***人,金牌会员,堂弟买的一直喜欢小米 性价比高,2018-03-09 09:42:34,0,0,5
王***帅,银牌会员,max换max2钟爱小米666,2018-03-09 16:31:50,0,0,5
厚***1,企业会员,屏幕很大，质量很好。标准的米粉,2018-03-08 21:46:19,0,0,5
j***1,金牌会员,这个手机 真心的好用 支持小米,2018-03-08 11:16:16,0,0,5
l***u,金牌会员,买给爸爸用的，很大气，运行正常,2018-03-06 22:23:49,0,0,5
青***瓶,金牌会员,超级大，电池超近耐用，屏幕不错,2018-03-06 20:58:55,0,0,5
j***y,金牌会员,真无语，买了10天就降100块,2018-03-06 19:00:47,0,0,5
f***0,金牌会员,手机很好用，摔坏了，又买了一部,2018-03-06 16:46:33,0,0,5
T***1,注册会员,货收到了，很喜欢，物流也快！,2018-03-09 18:35:15,0,0,5
x***Z,银牌会员,都买两次了，连耳机都不送一个,2018-03-09 11:55:57,0,0,5
j***7,银牌会员,够大，照相还行，看电视很爽。,2018-03-08 15:38:12,0,0,5
j***3,金牌会员,性价比不错，屏幕大，手感不错,2018-03-08 10:49:11,0,0,5
j***1,钻石会员,很好，非常满意，信赖京东自营,2018-03-07 11:29:18,0,0,5
l***l,PLUS会员,挺好的，小米系列确实比红米做工什么好些，机器很薄，屏幕大，给老人用的,2018-03-07 06:05:34,0,0,5
z***3,PLUS会员,第一次买屏幕竟然有坏点，这是我第一次买到有坏点的手机，真是很郁闷，但是京东服务还是很不错的，发回去立马就给我寄了个新的，但是还是浪费了好几天，不过比官网便宜了100，625其实很快，单核有骁龙800的水平，跑分看起来很低，其实用起来一点的不比820慢，除非玩游戏的时候会看出很大的区别，看什么测评真不如买来体验一下,2018-03-08 14:24:19,0,0,5
j***i,金牌会员,一下子买了两台，嗷嗷给力。,2018-03-09 19:48:38,0,0,5
yakuichen,金牌会员,很好的手机已经是第五部了。,2018-03-09 12:51:57,0,0,5
大***碗,银牌会员,很好，快递很快，很好用?,2018-03-09 06:25:09,0,0,5
j***i,钻石会员,商品很满意，以后还会常来。,2018-03-08 22:55:42,0,0,5
l***3,银牌会员,物流很快，手机也很好很喜欢,2018-03-08 22:41:40,0,0,5
h***c,金牌会员,帮老人家买的不知道好不好用,2018-03-08 15:34:46,0,0,5
L***m,银牌会员,屏幕很大，很流畅！！！大爱,2018-03-07 15:09:57,0,0,5
j***n,银牌会员,手机太大了，不过看电影挺爽,2018-03-07 12:32:18,0,0,5
冯***6,金牌会员,还可以才用，用一段时间再说,2018-03-06 20:38:21,0,0,5
j***d,金牌会员,手机壳很好，京东很好。。。,2018-03-06 19:05:11,0,0,5
瀟***楓,金牌会员,很漂亮的手机 适合送爸妈,2018-03-08 16:33:56,0,0,5
j***j,铜牌会员,快递给力，服务挺好速度快,2018-03-07 21:32:08,0,0,5
w***z,金牌会员,不错屏够大，看电影蛮爽,2018-03-09 20:58:11,0,0,5
一***零,金牌会员,还没用京东服务一直很好,2018-03-09 11:58:02,0,0,5
苏***n,金牌会员,非常非常不错的，很可惜,2018-03-09 12:20:46,0,0,5
a***0,钻石会员,手机很大，操作也很流畅,2018-03-08 20:40:57,0,0,5
o***爱,钻石会员,应该不错，给别人买的。,2018-03-08 16:35:59,0,0,5
s***8,金牌会员,一直用小米，从未失望过,2018-03-08 14:07:52,0,0,5
小***千,金牌会员,大家都在用的大屏手机。,2018-03-08 10:30:06,0,0,5
空***窝,钻石会员,不错的商品和服务质量的,2018-03-08 12:38:10,0,0,5
小***灬,钻石会员,手机很不错，家人很喜欢,2018-03-07 17:53:01,0,0,5
我***了,金牌会员,还可以 用了两天还行吧,2018-03-06 20:07:37,0,0,5
z***0,银牌会员,很不错的手机，值得购买,2018-03-06 21:57:05,0,0,5
j***1,钻石会员,大屏，高容量电池，实用,2018-03-06 20:40:11,0,0,5
白***哇,PLUS会员,目前使用挺好。。,2018-03-08 21:07:40,0,0,5
s***y,PLUS会员,价格实惠的老人机,2018-03-08 06:55:26,0,0,5
w***5,金牌会员,屏幕超大，拍照清晰，电池耐用，对于爱拿手机看电视和电影的老公来说，大屏幕是最爱。,2018-03-08 17:50:27,0,0,5
g***1,金牌会员,挺不错的，喜欢。。。,2018-03-07 07:51:13,0,0,5
j***1,银牌会员,非常完美。。支持国货,2018-03-07 02:46:11,0,0,5
j***z,PLUS会员,速度快，质量不错,2018-03-06 21:15:39,0,0,5
l***b,银牌会员,手机挺大，很好玩游戏,2018-03-06 19:57:01,0,0,5
j***j,银牌会员,第二次回购这款手机  相信京东   相信小米  好用大家都能看得见  值得推荐,2018-03-07 19:54:52,0,0,5
j***4,PLUS会员,这个是我从2016年9月到2018年2月买的第三个小米手机了，坏的太快了，是太便宜的原因吗？买的时候是1599，Plus会员里面有满减的券居然不能用，Plus会员一点优势都没有，平时买105都能减5元，货到手没有一个星期就降了100元，问客服，只知道发链接让我自己去处理，又不知道找谁！只能说习惯好评,2018-03-09 08:45:49,0,0,5
j***1,铜牌会员,手机赞的起来很好，就是和别人一起玩游戏，进游戏慢,2017-11-14 19:59:39,0,0,5
j***9,银牌会员,宝贝很好，值得购买,2018-03-09 16:22:50,0,0,5
天***宝,金牌会员,很好用，速度也不错,2018-03-07 10:13:48,0,0,5
j***9,金牌会员,支持国货 信赖京东,2018-03-07 08:40:01,0,0,5
我***哪,PLUS会员,很不错的手机，一直支持小米?,2017-10-06 00:14:40,0,0,5
电***e,PLUS会员,不错，挺好用的，喜欢的可以下手了，买了好几个了?,2018-03-06 18:51:39,0,0,5
谈***生,PLUS会员,物流很快，给老年人买的，屏幕确实很大，正在充电中,2018-03-09 11:52:33,0,0,5
j***z,银牌会员,京东速度就是快，手机也很不错，正在体验中～,2017-09-08 23:05:29,0,0,5
j***8,银牌会员,不能使用数据上网,2018-03-09 16:24:26,0,0,5
紫***影,PLUS会员,还没得拆，到到快。配置合适给老人用。,2018-03-09 17:13:51,0,0,5
z***6,PLUS会员,很好很满意，希望用一段日子依然好用,2018-03-08 21:59:02,0,0,5
有钱任性二手东平台,银牌会员,有点怪怪的亲,2018-03-05 21:28:29,1,2,1
黄***当,PLUS会员,"优点：屏幕很大很大很大……玩游戏看剧很爽。买的金色的，手感一如既往的跟?很相似。磨砂质感的。买给老年人使用，调节成大号字体能看清楚。之前买的note系列，用了2年多花坏了，这次入手小米系列希望能用很久很久很久吧哈哈
缺点就是太大了携带不太方便吧",2018-03-04 19:41:33,1,0,5
云***7,金牌会员,东西很不错，性价比高,2017-11-28 14:08:20,0,0,5
2***1,金牌会员,6.44不是一般大啊，手机玩游戏看视频都不错,2018-03-08 08:42:19,0,0,5
J***t,PLUS会员,不知道会不会卡,2018-03-09 08:58:52,0,0,5
漫***阳,钻石会员,非要值得购买！是从1换到2，希望能更好！,2018-03-07 20:31:35,0,0,5
a***8,金牌会员,正在试用中感觉还不错 过一段时间再来追评,2018-03-07 23:42:19,0,0,5
王***7,银牌会员,手机一天到货，很快。电池毫安够大，还没有玩。内存是64的，虽然说我知道可能有误差，但是就剩下55G了，是不是占用的有点多了。?还有就是这个包装了，好歹也是电子产品，就用一个塑料袋子装着是不是有点过分了，之前也从京东买过几次手机，但是这个是不是有点过分了。真心有点糟心。???,2018-03-07 19:38:22,0,0,5
w***n,银牌会员,机子很好，超大屏幕，物流很快！,2018-03-07 12:43:29,0,0,5
周***9,金牌会员,还好，正在体验,2018-03-09 19:44:49,0,0,5
j***b,银牌会员,超快的物流喜欢,2018-03-09 15:41:16,0,0,5
j***u,银牌会员,物流快，产品好,2018-03-09 11:43:56,0,0,5
j***3,钻石会员,非常好非常好！,2018-03-09 19:39:45,0,0,5
k***0,金牌会员,不错，值得入手……,2018-03-09 00:14:17,0,0,5
j***f,钻石会员,先用用看再说吧,2018-03-07 19:45:40,0,0,5
j***h,银牌会员,手机昨天就收到了，屏幕是比较大，目前没什么问题。同时下单买了钢化膜，可收到的膜上面有瑕疵，审请换货成功，今天就送到了，京东的办事效率很赞。,2018-03-06 21:43:52,0,0,5
j***z,PLUS会员,很喜欢在东东上网购 真的不错的 比其他网店实在 服务好 好喜欢 还会介绍朋友来 非常感谢京东商城给予的优质的服务，从仓储管理、物流配送等各方面都是做的非常好的。送货及时，配送员也非常的热情，有时候不方便收件的时候，也安排时间另行配送。,2018-03-07 16:22:47,0,0,5
j***z,PLUS会员,很喜欢在东东上网购 真的不错的 比其他网店实在 服务好 好喜欢 还会介绍朋友来 非常感谢京东商城给予的优质的服务，从仓储管理、物流配送等各方面都是做的非常好的。送货及时，配送员也非常的热情，有时候不方便收件的时候，也安排时间另行配送。,2018-03-07 16:22:25,0,0,5
D***a,银牌会员,好评尤其是双声道扬声器 和普通手机感受完全两样，上手两天唯一明显缺点就是背面指纹位置不合理因为手机大！真的大！看视频爽！,2018-03-09 01:04:40,0,0,5
1***辉,PLUS会员[试用],产品不错，性价比高，包装好，送货快，在京东买了好几次电器了，感觉不错，以后还会继续支持,2018-02-23 09:51:59,1,0,5
冷***倾,银牌会员,没查真伪，很不错了，省电加快充加屏幕亮加大屏幕，看一天视频不成问题。用着所以照片放不了了，下图本手机拍的。,2018-03-07 08:35:34,0,1,5
游***9,金牌会员,小米的系统优化做的最好，这次就想换个大屏，大电量的，比较了几款，最终还是选择了小米max2，6.44寸的大屏幕体验确实不错，不过天马屏显示效果还是差了些，系统比较流畅，信号不错，本人很少玩手游，所以骁龙625的处理器感觉也够用.,2018-03-07 14:41:32,0,0,5
阿杰哥哥97,银牌会员,"一颗心都不想给，真的**一次购物体验，首先说物流，三天慢死，从上海到杭州，双十一我也就不说了。
其次是小米客服京东客服真的是太**了，一天天的搪塞我，敷衍客户真心恶心，我完了要投诉他们客服，关于碎屏的事情他们不给我处理，手机刚到一天就碎了，他们说提交售后处理一会说24小时，一会到第二天早上，已经五天了，他们真的是太恶心，推来推去没有人给你解决。他们客服就会说一直在给我申请售后，最终还是没人联系我，每次都是这样。就算碎屏是我的问题不会联系我给我处理？给我成本费维修，再就是那个破三轮车物流手机都掉了坏了。我现在也不知道怎么解决，刚买上就出现这样的问题很扎心，老铁。我希望给我解决！！！不是一直在给我申请解决问题没有回复",2017-11-18 01:35:32,9,3,1
s***n,PLUS会员,这个已经是第三个了，给年纪大的用很不错的，用到现在也没死机，看视频打游戏都ok，拍照拍视频也不错，对于年纪大的足够了，而且电量也好足，每次可以用一天，并且是一天大多数在玩游戏，如果一天很少使用还可以撑过两天,2018-03-08 08:34:04,0,0,5
j***s,PLUS会员,质量好 相信京东 以后京东商品都是自营的就好了 都是真货 保证产品质量 京东加油,2018-03-06 17:18:49,0,0,5
明***5,PLUS会员,上次买的丢了，重新买一个同型号的。喜欢的大屏，反应速度也挺快，操作方便，喜欢！,2018-03-07 21:56:57,0,0,5
j***d,铜牌会员,，物流非常快，昨天下午下单，今天中午就到了。手机手感也很好，屏幕够大，使用也流畅。非常满意。,2018-01-29 15:14:57,1,0,5
s***n,钻石会员,给母亲买的，大屏看得清，配置够用，主要系统接地气，杀毒，备份都不用额外下载，物流超快，性价比超高,2018-03-07 21:30:08,0,0,5
港***欣,银牌会员,挺好的，物流也很快，之前手机是5.5的屏幕，刚开始用这个还有点不习惯，现在也用习惯了，挺好的,2018-03-09 18:01:04,0,0,5
j***0,PLUS会员,非常不错，第一次买小米，感觉性价比高。屏幕很大。以后还会买的。,2018-03-07 19:15:56,0,0,5
j***g,PLUS会员,屏真的更大，用了34天，很满意，打游戏看视频很爽，反应很快！,2018-03-08 16:36:15,0,0,5
j***x,PLUS会员,昨天下午下单，今上午就拿到货了。速度快，服务好。原来买的小米4.现在买的也是小米，不过现在容量大了128G。我觉得京东购物是愉快的，还配了充电器。手机在充电中，先好评。,2018-03-03 14:09:45,1,0,5
j***c,PLUS会员,年前买的，物流也快，评价就是有点晚，质量好好的，好评！,2018-03-07 19:36:20,0,0,5
丶***弦,PLUS会员,东西特别好，客服态度亲切，快递神速，支持京东！,2018-03-09 00:58:49,0,0,5
z***6,银牌会员,这些照片是用MAX一代拍的因为被自己摔的不成样子了第一次把一代的屏幕摔碎了换了一个屏幕又被自己不小心摔碎了所以买了二代 一代用下来还可以小米真心不错只有当初买一代是选的内存太小了 现在2代的大了,2018-03-09 09:39:51,0,0,5
j***v,银牌会员,质量挺好的。,2018-03-09 14:46:26,0,0,5
丶***弦,PLUS会员,东西挺好，客服耐心解释，物流很快，支持京东！,2018-03-09 01:18:16,0,0,5
j***3,银牌会员,不错的，早上定下午就到，给快递小哥一个赞，机子没有用，用过再评!,2018-03-09 00:22:08,0,0,5
墨***-,PLUS会员,物流很快，东西是给家人买的他们说还可以挺好的,2018-03-08 23:26:23,0,0,5
帅***倒,钻石会员,帮我妹夫买的,2018-03-07 16:06:55,0,0,5
j***金,金牌会员,我只能说，第二代的手机比第一代还要好。希望一代比一代做得还要好。,2018-03-07 22:59:55,0,0,5
h***咪,钻石会员,给老妈买的，运行速度非常快，嗯，然后屏幕也特别大，妈妈特别喜欢。,2018-03-07 16:35:31,0,0,5
j***a,金牌会员,还不错还不错,2018-03-06 19:42:36,0,0,5
一***枚,PLUS会员,不错很好用，买了第二台了。前面一台给老婆用了,2018-02-28 13:39:11,0,0,5
扫***1,PLUS会员,屏真的好大，反应速度也真的好快，非常满意的网购,2018-02-09 18:27:36,0,0,5
l***5,银牌会员,手机还行单手操作不了，还有一个问题打往下看时卡顿，这一点很不爽不知道是手机问题吗？希望能帮我改善一下。手机刚拿到手速度蛮快的，玩了一段时间就变慢了。其他还行希望能耐用一点。,2018-03-09 08:46:38,1,0,5
l***g,银牌会员,这是我第二个小米max4+64。第一个是金色的，大年十五给弄丢了，随着买了个红米5p，手感还行，就是电池对于用惯了max的我来说很不适应。昨天上午又买了这个黑色的。熟悉的感觉又回来了。,2018-03-09 10:37:23,0,0,5
辉***5,PLUS会员,非常喜欢，帮朋友买的，我自己也用这个杠杠的,2018-03-01 16:24:09,0,0,5
仗***8,PLUS会员,完美，特别好，一次买2部，家里老人很满意,2018-03-09 11:16:07,0,0,5
天***z,钻石会员,给老人买的，比较满意，字体够大，各方面表现都还好。,2018-03-06 18:43:02,1,0,5
心***怪,PLUS会员,"质量非常好，与卖家描述的完全一致，非常满意,真的很喜欢，完全超出期望值，发货速度非常快，包装非常仔细、严实，物流公司服务态度很好，运送速度很快，很满意的一次购物",2018-03-07 09:06:16,0,0,5
瘦***子,PLUS会员,屏幕果然很大，其他手机屏幕没得比啊。,2018-03-06 23:46:31,0,0,5
h***1,PLUS会员,屏幕大，性价比高，看视频的利器。,2018-03-09 07:20:33,0,0,5
j***6,银牌会员,不错不错，大屏爽翻了，物有所值，建议喜欢大屏的买进！,2018-03-08 20:18:38,0,0,5
w***3,金牌会员,综合评比来说，这是我使用的四部小米手机中最贵的一部但是却是最失望的一部，无缘无故的死机，通话时听不见声音是常有的事，希望大家购买时慎重。京东的服务还是很不错的，这一点我还是很满意的。,2018-03-09 03:22:35,0,0,5
丿***烊,金牌会员,手机很好，目前已使用一个月无问题，很满意。,2018-03-01 11:05:51,1,0,5
j***鹏,PLUS会员,这款手机非常非常的好。 很好用,2018-03-09 13:41:56,0,0,5
1***1,银牌会员,给老豆买的，大屏幕，电池耐久，运行流畅，非常棒。,2018-03-06 18:26:23,0,0,5
零***4,金牌会员,东西收到了，快递很给力，暂时给个好评吧!,2018-03-09 17:27:37,0,0,5
愤***鑫,银牌会员,手机总体很好  就是在进游戏的时候闪屏,2018-03-08 15:59:42,0,0,5
j***e,铜牌会员,还可以吧，屏幕挺大，但是配置一般般,2018-03-09 09:34:50,0,0,5
j***-,银牌会员,总体还不错，给家人买的。性能一般，家人日常生活用够用了,2018-03-06 21:03:17,0,0,4
小***我,金牌会员,手机非常不错，买回来当平板玩的。,2018-03-08 17:13:52,0,0,5
胡***东,银牌会员,好大，屏幕看着舒服，好看电影,2018-03-07 18:08:00,0,0,5
j***i,银牌会员,很好，屏幕大，玩游戏一流不卡,2018-03-06 14:06:55,0,0,5
z***n,PLUS会员,轻巧，电量还大。做得可以。,2018-03-10 01:31:28,0,0,4
傻***丫,银牌会员,给手机不错，玩游戏方便。,2018-03-08 15:11:06,0,0,5
艾***芭,银牌会员,屏大内存大。总体不错,2018-03-06 23:05:13,0,0,5
电动男友爱,铜牌会员,振动很强，有3个档位，开个高档把女朋友爽的不要不要的，一晚上做了78次，好久没这么激情过了，差点累的虚脱，可以用来调调情做前戏，太爽了。送的套套也不错，还送了跳蛋和润滑油，跳蛋不敢用，声音太大了。润滑油我也用不上，用来擦皮鞋了。老板你这是怕我塞不进去吗？,2017-11-18 20:12:35,44,13,1
逗***肉,PLUS会员,屏幕真的很大很大真的适合老人适合老人，对了下单的时候沈阳下大学虽然物流信息限时会延误，还是按时到了，辛苦京东小哥了,2018-03-07 11:11:36,0,0,5
相***年,PLUS会员,东西不错，是正品，发货很快，，京东快递真的快，第一天买第二天就到了，点个赞，一直京东购物，支持京东，多，快，好，省,2018-03-06 13:50:05,0,0,5
相***年,PLUS会员,东西不错，是正品，发货很快，，京东快递真的快，第一天买第二天就到了，点个赞，一直京东购物，支持京东，多，快，好，省,2018-03-06 13:49:54,0,0,5
j***9,铜牌会员,手机真的大，拿手上特小心。买的黑色大气稳重，手机反应也挺快的，看中的就是大电量，特意用了一天电量还有一大半，确定耐用，小米手机值得入手,2018-03-09 17:16:55,0,0,5
j***的,PLUS会员,品牌商家，质量信得过！电量一天半一冲没问题，日常使用完全没有问题，就是鞋带有些不太适应！整体很不错！性价比很高,2018-03-09 20:19:54,0,0,5
"j***,",PLUS会员,运行速度好评，屏幕效果好评，手感极佳，还是小米手机最实在，在此也给广大买家提醒记得手机膜问题！此次购机很满意！,2018-03-07 10:47:04,0,0,5
j***n,钻石会员,屏幕等于一个iPad Mini，系统也还好。发热和功效跟平衡，看看视频没问题，4G信号也很稳定。就是屏幕欠缺，适合老人用。,2018-03-07 18:14:56,0,0,5
3***q,银牌会员,好大的屏幕，要双手操作。电池耐用。就是宣称的双卡双待有点坑，一张小卡一张微型卡不说，微型卡了sd拓展卡同一位置，二选一。,2018-03-09 07:17:57,0,0,5
玻***草,PLUS会员,小米Max2 大屏手机 4GB+128GB 黑色 全网通4G手机 双卡双待，性价比高，客服态度很好,2018-03-06 19:58:12,0,0,5
j***9,铜牌会员,挺好的，首次京东买东西，还把自己号码写错了，不然第二天就到了，建议京东在首页就显示无法联系，不然总看着首页总显示配送中…两天后问客服点进去才知道无法联系我,2018-03-08 13:49:16,0,0,5
jd_131133kjg,银牌会员,除了快递单我未见到外够快到货，屏幕够大，查看手机参还可以，运行快比美日机性价比高。现用的是小米MAX一年多感觉超值。,2018-03-08 20:53:03,0,0,5
j***u,PLUS会员,这手机非常好用，电池也非常耐用，给介绍的一模一样，下次摘了吗？物流速度也很快，今天下单明天就到了,2018-03-08 08:23:49,0,0,5
从***我,PLUS会员,米nax2屏幕很大，升级mlul9.0稳定版本后，上网打开网页和视频非常流畅，小米系统优化很好,2018-03-10 00:27:52,0,0,5
桐***生,钻石会员,够大，超喜欢大屏手机，就是电池用的不太给力了，一天百分之五十，要是能用三天就好了，运作内存再大点更完美了，用用再说,2018-03-10 00:01:36,0,0,5
冰***心,PLUS会员,屏幕有点大，运行满流畅的，给老人用，大屏幕，爽的不要不要的，通话清洗，小米值得拥有一个字，牛!,2018-03-06 16:28:20,0,0,5
小***-,银牌会员,我用了两天了，还剩42％的电量，续航能力真的强。内存大，双卡双待，不错挺好的，推荐给那些手机使用不是很厉害的人。,2018-03-07 20:42:41,0,0,5
b***n,PLUS会员,帮同事买的，还没使用，希望不错，说实话，我自己以前也看中了这款小米手机，电池大，屏幕也大,2018-03-09 10:09:21,0,0,5
行***D,企业会员,给老爸买的，速度很流畅，完全满足需要。最主要是屏大啊，调到大字体模式不用老花镜就能看清楚，对老人来说太方便了,2018-03-09 06:14:49,0,0,5
