名字,会员级别,评论内容,评论时间,点赞数,评论数,评价星级
n***p,金牌会员,京东商品非常不错，值得拥有。,2017-12-14 09:36:38,0,0,5
M***P,银牌会员,物流速度挺快了，手机用起来也挺顺手了，满意,2017-12-14 08:38:08,0,0,5
J***n,金牌会员,手机美观，好用，建议大家购买。,2017-12-14 07:12:19,0,0,5
j***兆,金牌会员,好。,2017-12-13 22:39:32,0,0,5
j***c,铜牌会员,手机几好、千多元直得买,2017-12-13 22:02:50,0,0,5
0***q,银牌会员,送货速度不用说，机子目前来说挺好用的,2017-12-13 21:03:16,0,0,5
情***柱,PLUS会员,目前还是很不错的，用了一个星期了，电池用挺久的,2017-12-13 20:53:46,0,0,5
宇***娟,铜牌会员,手机不错，我妈挺满意,2017-12-13 20:53:28,0,0,5
j***j,金牌会员,不错，第二天就到了，手机物美价廉。如果有耳机就好了,2017-12-13 20:08:53,0,0,5
碎***兰,金牌会员,买了3部note4  性价比很高 这次双十一减100  很划算 又给家人买了一部,2017-12-13 19:36:48,0,0,5
种***亮,金牌会员,快到飞起，64G好用。然后，喜欢的亲直接入手就可以，貌似一直这个价，木有活动呀,2017-12-13 19:07:50,0,0,5
大***r,PLUS会员,此用户未及时评价，系统默认好评。,2017-12-13 19:06:56,0,2,5
文***哦,银牌会员,手机特别好 特别满意 小米手机用了几年了 实惠又好用 店家服务特别好  物流挺给力  给店家大大的赞,2017-12-13 18:20:44,0,0,5
V***生,金牌会员,此次购物比较满意，手机质量没问题，唯一不足的没有耳机。,2017-12-13 16:24:31,0,0,4
b***者,PLUS会员,还行，买来给孩子用的。,2017-12-13 15:16:31,0,0,5
x***d,PLUS会员,个人觉得性价比很高,2017-12-13 14:30:18,0,0,5
j***d,铜牌会员,不错,2017-12-13 14:13:48,0,0,5
宝***果,金牌会员,很好好好 木有问题 满意,2017-12-13 13:54:32,0,0,5
东***贩,PLUS会员,给老爸买的，很不错，一直信赖京东,2017-12-13 13:42:49,0,0,5
j***f,铜牌会员,不错的产品。快递也给力,2017-12-13 12:40:29,0,0,5
j***o,银牌会员,刚收到。送货速度超级无敌快！宝贝儿刚打开还没用，看上去很好。,2017-12-13 11:14:21,0,0,5
j***0,金牌会员,给叔叔买的，用了半个来月了吧，还可以吧，之前视屏通话声音不太好，重启了后也没什么问题，,2017-12-13 10:15:03,0,0,5
j***6,银牌会员,帮姐姐买的，质量还行吧，但包装太简单了，就一个充电器，既没有耳机，也没有说明使用书,2017-12-13 10:03:57,0,0,4
1***L,银牌会员,物流很快，上午下单的，下午就到了，手机是新的，用了感觉还不错,2017-12-13 09:41:59,0,0,5
j***6,金牌会员,屏很大，之前也用过小米手机，感觉不错，所以回购，支持！！！,2017-12-13 09:40:23,0,0,5
j***d,银牌会员,手机很好，非带满意，以后还上京东买东西，打个十分,2017-12-13 09:17:49,0,0,5
w***i,银牌会员,一直用小米的手机，真的觉那小米手机很不错。用了几天才来评价，很好！,2017-12-13 06:16:58,0,0,5
j***e,银牌会员,给老公买的，他用得还顺手！挺满意的！,2017-12-13 04:51:59,0,0,5
知***月,金牌会员,好用,2017-12-12 23:44:18,0,0,5
李***转,银牌会员,给我哥哥买的，非常好用，，他之前是三星Note7100，他认为比之前好太多，支持小米，,2017-12-12 21:32:12,0,0,5
l***1,钻石会员,给母亲买的，认可小米品牌,2017-12-12 20:03:55,0,0,5
1***p,金牌会员,而而会自动关机,2017-12-12 19:40:08,0,1,3
K***N,金牌会员,非常喜欢已经买了两个了!,2017-12-12 19:40:06,0,0,5
轲***哦,PLUS会员,给家人买的手机，用着很好，老爸很喜欢，物流也很快,2017-12-12 18:40:06,0,0,5
j***o,PLUS会员,给老人用 挺喜欢的,2017-12-12 18:17:12,0,0,5
荣***辉,铜牌会员,快  真快,2017-12-12 17:25:35,0,0,5
点***球,PLUS会员,小米手机真的不错,2017-12-12 17:13:07,0,0,5
j***2,钻石会员,第二次入手此机  红米5的话电池没这个大  所以还是选购这个,2017-12-12 15:58:54,0,0,5
1***m,金牌会员,原来买过几个小米，感觉还不错，可这次比较失望！按说明卡一用移动，卡二用联通。卡二经常性无信号，有时还不能识别，如去掉卡一，卡二还是放联通卡，这一现象就没了。并且上网还只能是卡一，真是叔可忍嫂嫂不可忍！更可恨的是联系客服，小米推京东，京东又推小米！！！总之，这次购物，失望之极！！！！,2017-12-12 15:31:28,0,1,1
j***b,PLUS会员,豆豆的时候我也是很喜欢的样子。我们的生活方式是什么时候回来呀,2017-12-12 14:13:36,0,0,5
江***z,钻石会员,物流很快，东西也挺好，送老爸用了一段时间，挺好，老爸用的挺不错?……,2017-12-12 13:43:12,0,0,5
j***x,银牌会员,晚上买的，第二天就到了，物流很棒。手机也很好，之前也买了一台这款，是32GB的，现在买台64GB的给我老公用。老公说很好。,2017-12-12 13:05:27,0,0,5
j***8,金牌会员,外观很漂亮，还没用，很喜欢,2017-12-12 12:45:32,0,0,4
j***马,金牌会员,给爸爸用很喜欢，忠实小米。,2017-12-12 12:40:37,0,0,5
谭***云,铜牌会员,小米手机不错，很好，,2017-12-12 11:52:19,0,1,3
2***n,金牌会员,买来就是通话不好，当时想将就一下，后来打电话都反应听不清，没法去修了次没解决，第一次差评，最糟糕的购物体验,2017-12-12 11:14:56,0,1,1
j***m,银牌会员,发货速度很快 手机很漂亮 希望可以好用,2017-12-12 10:53:55,0,0,5
g***U,银牌会员,物流绝对没话说，快，东东也很棒，用的期间很快，触屏感很不错，像素很赞，这个价位的手机性价比还是不错滴。,2017-12-12 10:20:51,0,0,5
j***i,银牌会员,此用户未及时评价，系统默认好评。,2017-12-12 09:53:41,0,0,5
h***2,PLUS会员,小米手机就是会发热，第二次购买小米了,2017-12-12 09:27:39,0,0,4
寒***春,PLUS会员,送人的，用起来还凑合，反正收的人也高兴,2017-12-12 09:19:57,0,0,4
i***i,PLUS会员,感觉不错 有质感 屏幕清晰,2017-12-12 08:13:26,0,0,5
j***g,银牌会员,相信京东自营质量有保障,2017-12-12 02:05:53,0,0,5
j***7,PLUS会员,手机到手了看着很满意，包装也满意。今晚充电，试用后再评论。米粉里的铁杆粉丝。,2017-12-11 21:55:00,0,0,5
o***3,银牌会员,已经用了一个月多，感觉挺不错的。喜欢小米手机，给家人也都买小米手机了！,2017-12-11 19:43:44,0,0,5
j***G,银牌会员,此用户未及时评价，系统默认好评。,2017-12-11 18:00:46,0,0,5
q***5,钻石会员,还可以到了几天在用用看。,2017-12-11 16:28:01,0,0,4
j***暸,PLUS会员,给老爸买的，用起来还不错吧,2017-12-11 14:34:40,0,0,5
小***鑫,金牌会员,给老爸买的很喜欢，老爸说很棒！！！满意京东自营一直信赖！,2017-12-11 14:16:47,0,0,5
q***F,金牌会员,小米手机性价比就是高，很好。,2017-12-11 13:10:11,0,0,5
r***t,PLUS会员,买来送人的，已经买了第二个小米了，性价比高，送家里老人很合适。,2017-12-11 12:58:58,0,0,5
j***j,银牌会员,还不错呢,2017-12-11 12:04:09,0,0,5
一***6,钻石会员,一直用小米，支持,2017-12-11 12:03:30,0,0,5
幽***父,银牌会员,买来给我爸使用的，老爸满意就好！,2017-12-11 11:52:49,0,0,5
X***林,银牌会员,很好，物流也很快,2017-12-11 11:42:14,0,0,5
j***l,银牌会员,收货已经4天，款式漂亮，手机很流畅，电池可以管一天很满意,2017-12-11 10:41:29,0,0,5
屋***会,银牌会员,手机还好，幸好用的是移动的，要不然没注意到合约机就麻烦了，婆婆说充电慢,2017-12-11 10:39:55,0,0,5
燕***9,金牌会员,此用户未及时评价，系统默认好评。,2017-12-11 09:15:43,0,0,5
Z***D,银牌会员,快递太快了，当天下单，第二天马上收到货。店家也服务周到，手机太好用了，上网快，拍照也清晰。直得赞！！非常满意！！,2017-12-11 08:39:46,0,0,5
l***2,PLUS会员,给母亲买的，用的感觉特别好，再去买台给老爸。,2017-12-11 02:47:47,0,0,5
j***z,银牌会员,不想说了。。。,2017-12-11 00:19:52,0,0,5
1***0,PLUS会员,帮别人买的据说很满意！,2017-12-10 21:45:16,0,0,5
w***k,银牌会员,试用机子不错，服务也很好，值得点赞，以后还会继续使用。,2017-12-10 17:43:34,0,0,5
j***d,PLUS会员,货收到了很快，才十几个小时就收到了。,2017-12-10 16:17:03,0,0,5
j***p,金牌会员,好，太好了赞，,2017-12-10 14:55:15,0,0,5
j***p,铜牌会员,赞,2017-12-10 14:48:36,0,0,5
j***p,铜牌会员,好,2017-12-10 14:46:08,0,0,5
m***x,银牌会员,物流很快，手机屏幕也很大，很好，可是手机像素太差，前面头像看不清楚，好模糊，,2017-12-10 10:06:33,0,0,5
千***L,银牌会员,1分都不想给，买了之后电池充不住电，返厂检测确实电池有问题，维修后返回来还是充不住电。我买的是新的手机，电池却有问题，返厂后是换了块电池还是原来的电池修修又寄回来了？都说小米手机好，第一次买却直接寄了个有问题的给我，麻烦你们的售后好一点，尽快帮忙解决问题,2017-12-10 09:36:01,1,1,1
B***_,银牌会员,好用，没有暖宝宝呀，反正我这部没有，就是比较厚。但是其他还是好用的。来自一个学生的推荐。,2017-12-10 09:10:32,0,0,5
j***z,铜牌会员,质量还好吧,2017-12-10 08:59:21,0,0,5
j***d,银牌会员,还可以  网速还好 希望可以好好的用一年就行了,2017-12-10 08:43:05,0,0,5
肖***7,PLUS会员,很满意，物流也很快！下次还来。,2017-12-10 08:04:28,0,0,5
j***k,铜牌会员,总体感觉还不错，就是SIM卡里的号码怎么弄也导不出来，还有没有桌面锁定,2017-12-10 00:31:11,0,0,5
E***m,钻石会员,买了五个了,2017-12-09 23:36:22,0,0,5
l***t,PLUS会员,越高的性价比,2017-12-09 23:27:15,0,0,5
绿***8,金牌会员,很好。我喜欢！用的也顺手！,2017-12-09 22:26:14,0,0,5
j***1,银牌会员,收到货打开看过了，不错很漂亮，拿手上手感也不错，用了一天了，感觉很好用，快递也很快的，快递小哥也很热情，下次有需要还要来,2017-12-09 21:23:46,0,0,5
于***丰,金牌会员,不错,2017-12-09 21:15:06,0,0,5
j***1,银牌会员,这一款手机非常好用，我已经买了很多陪了。,2017-12-09 21:09:46,0,0,5
付***3,银牌会员,用着还不错,2017-12-09 20:19:43,0,0,5
X***3,铜牌会员,好,2017-12-09 20:12:41,0,0,5
L***T,银牌会员,这次处理很满意，手机现在还满开始用，不知道质量怎么样，还有就是这次邦我处理的工作人员服务很好，很周到謝谢了,2017-12-09 19:29:18,0,0,5
E***Y,银牌会员,质量不错，值得买,2017-12-09 19:00:39,0,0,5
冬***石,银牌会员,京东购物还是挺满意的。,2017-12-09 18:30:17,0,0,5
j***p,铜牌会员,好,2017-12-09 18:22:46,0,0,5
十***醉,PLUS会员,希望小米不在发烧烫手了,2017-12-09 15:56:17,0,0,5
零***寂,银牌会员,帮朋友买的，因为我一直用的小米的，所以给他买了这个。用了一段时间朋友说好用,2017-12-09 15:29:09,0,0,5
j***d,钻石会员,给叔叔买的超喜欢。我家全部都是米了。,2017-12-09 15:21:32,0,0,5
j***p,金牌会员,商品很不错，物流也很快,2017-12-09 13:58:44,0,0,5
j***d,银牌会员,还可以,2017-12-09 13:29:57,0,1,3
j***p,金牌会员,手机很大很轻薄，金色是类似玫瑰金那样。快递小哥人很好，速度快服务好，真想单独评满分。,2017-12-09 12:28:24,0,0,5
W***正,金牌会员,不错,2017-12-09 11:28:03,0,0,5
靓***8,银牌会员,帮同事买的，挺满意的，用着不错,2017-12-09 11:25:02,0,0,5
J***友,钻石会员,给爸爸买得，用得挺好，目前没有什么问题，主要是配置实惠,2017-12-09 10:50:43,0,0,5
4***吧,银牌会员,这是我第二次买了，第一次掉到水里了，太舍不得，所以又买了台，好用这款手机！,2017-12-09 10:45:48,0,0,5
j***d,PLUS会员,用过了帮别人买的反应还不错发货快,2017-12-09 09:54:52,0,0,5
f***7,金牌会员,嗯,2017-12-09 09:38:07,0,0,5
3***新,钻石会员,不错,2017-12-09 09:18:32,0,0,5
j***h,银牌会员,买回几天了，刚开始使用，没有自带的手机外壳，一会儿再出去买吧！,2017-12-09 09:14:44,0,0,5
o***g,铜牌会员,充电器充不了电，根本就是个坏的，手机电量不耐用,2017-12-09 08:37:28,0,0,5
超***雨,铜牌会员,不错，第二次是使用了，给你赞,2017-12-09 06:53:49,0,0,5
j***x,PLUS会员,可以,2017-12-09 03:55:52,0,0,5
h***e,PLUS会员,功能齐全，性价比高。设计也大方,2017-12-09 00:20:24,0,0,5
性***物,金牌会员,京东快递还是那么给力，手机正品无疑，非常好使,2017-12-08 23:43:19,0,0,5
名***起,PLUS会员,手机不错，继续支持！希望有更好的作品！,2017-12-08 22:42:56,0,0,5
1***p,金牌会员,买的时候没留意看，合约机，合约机( ￣ ▽￣)o╭╯☆#╰( ￣﹏￣)╯,2017-12-08 22:22:27,0,0,5
蒋***尔,银牌会员,棒棒哒,2017-12-08 20:46:47,0,0,5
l***1,金牌会员,物流送货差,2017-12-08 19:08:33,0,1,1
万***9,钻石会员,手机不错 质量挺好  价格还凑合吧,2017-12-08 18:23:33,0,0,5
j***0,银牌会员,好,2017-12-08 17:12:08,0,0,5
Q***k,银牌会员,性能还是不错的，就是电池感觉不怎么耐用，一分钱一分货吧！,2017-12-08 16:57:49,0,0,5
贼***f,铜牌会员,手机还不错，不过很容易发汤。,2017-12-08 16:33:54,0,0,5
玛***哦,银牌会员,应用市场竟然不是小米软件市场！所有游戏帐号都是小米版的我该怎么办，我也很绝望啊,2017-12-08 16:08:02,0,2,3
M***i,铜牌会员,还挺好用的。,2017-12-08 15:59:07,0,0,5
l***y,钻石会员,给老人买的，用着不错,2017-12-08 15:26:50,0,0,5
j***9,PLUS会员,给父亲买的，自己没看,2017-12-08 14:40:17,0,0,5
大***8,银牌会员,好用，我买了几台了,2017-12-08 14:29:22,1,0,5
尤***婆,金牌会员,很不错，很好用 发货速度 送货也速度,2017-12-08 13:45:46,0,0,5
j***t,PLUS会员,性价比很高的手机，就是感觉电池耗电量快,2017-12-08 13:44:14,0,0,5
j***g,钻石会员,挺好用的，拍照也不错，这个价位很好了,2017-12-08 13:20:09,0,0,5
1***p,金牌会员,还行！,2017-12-08 11:46:23,0,0,5
j***x,银牌会员,好好好,2017-12-08 11:44:23,0,0,5
阳***7,钻石会员,京东的物流确实给力，着急用的东西就应该在京东买，好评,2017-12-08 11:33:44,0,0,5
j***帆,铜牌会员,很漂亮！很好用！就是相机怎么不能关掉快门声音呢？,2017-12-08 10:53:08,0,0,5
j***b,金牌会员,正品吧,2017-12-08 10:48:08,0,0,5
不***你,钻石会员,手机很好用，,2017-12-08 08:25:58,0,0,5
j***d,银牌会员,货已收到还没用感觉不错屏幕蛮大的,2017-12-08 07:59:33,0,0,4
j***7,铜牌会员,不错手感很好充电速度也很快！,2017-12-08 01:24:08,0,0,5
t***h,钻石会员,很好很流畅,2017-12-08 00:23:17,0,0,5
j***1,银牌会员,这款手机非常好用哇，买了好几部了。,2017-12-07 23:09:52,0,0,5
j***2,PLUS会员,手机不错，好使，不卡，挺好用，支持京东购物,2017-12-07 23:07:04,0,0,5
t***r,PLUS会员,手机不错，做工很精致，送货很快,2017-12-07 21:45:22,0,0,5
s***8,银牌会员,非常满意的一次购物体验,2017-12-07 19:41:08,0,0,5
m***3,银牌会员,合约机的问题，不说大家都清楚，只有认了，一分钱一分货。,2017-12-07 19:39:28,0,1,2
3***8,PLUS会员,感觉还可以,2017-12-07 19:11:49,0,0,5
j***g,金牌会员,跑了几个店，都没有配套的壳和膜，急死我了，昨天不小心把宝贝给摔了，多了几处划痕，要是有壳和膜就会好很多，手机电池给个赞，超给力，手机反应也很快，总的说是一次不错的网购，评五星。,2017-12-07 17:35:24,0,0,5
灿***3,银牌会员,我买手机但没有说明书，就是个二手的手机！我是评论就差的！,2017-12-07 16:15:26,0,0,5
x***0,金牌会员,还可以吧，试用没什么问题，过一段时间再追评,2017-12-07 12:20:28,0,0,5
三***生,铜牌会员,挺好的，买给老妈用的，一直挺喜欢小米手机的，就是刚开机有小点慢,2017-12-07 11:11:17,0,0,5
陈***1,银牌会员,之前买过一台同款的用了大半年，被偷了，又买回一模一样的，性价比高！！?,2017-12-07 11:01:03,0,0,5
j***i,银牌会员,货已收到还没用。京东小哥服务很热情，用后再评但如我愿。,2017-12-07 10:19:23,0,1,5
j***j,银牌会员,不错的手机，挺好的值得信赖。,2017-12-07 09:33:44,0,0,5
m***3,金牌会员,新手机速度快,2017-12-07 05:48:20,0,0,5
j***2,银牌会员,货收到了手机很好看手感也快，就是充电的时候充电器发热了不好，物流真的很快快递员态度很好点赞。,2017-12-06 23:06:59,0,0,4
J***d,银牌会员,用了几天卡死了，七小时后又从起了，用用看吧,2017-12-06 22:45:13,0,0,5
今***医,金牌会员,还行能用谢谢,2017-12-06 22:34:06,0,0,5
j***6,铜牌会员,我是用过一段时间之后来评价的，刚开始挺好用的，后来玩游戏有点卡不知道什么原因。总体不错。,2017-12-06 20:55:36,0,0,5
j***h,铜牌会员,不错挺好的给个五星好评！现在用的挺不错的小米不错啊！,2017-12-06 20:04:21,0,0,5
j***6,金牌会员,好,2017-12-06 16:36:12,0,0,5
j***3,银牌会员,給家人購買的,2017-12-06 14:19:44,0,0,5
吃***-,钻石会员,东西不错，帮同事买的，很喜欢,2017-12-06 12:15:38,0,0,5
任***刘,PLUS会员,帮朋友买的，应该还不错,2017-12-06 08:10:30,0,0,5
1***p,金牌会员,很好用,2017-12-06 07:40:32,0,0,5
左***6,银牌会员,手机不错，像素很清晰，很喜欢……配送员态度超级好！！大赞,2017-12-06 07:27:20,0,0,5
李***秋,PLUS会员,相信京东更相信的是京东自营，支持国产，家里所有电器手机车都是在京东够买也都是国产。,2017-12-06 06:58:11,0,0,5
向***庄,银牌会员,好用,2017-12-06 00:02:59,0,0,5
j***2,铜牌会员,为什么手机到了一点电都没有啊，开机都开不了，我以为是坏的呢,2017-12-05 19:00:26,0,1,2
j***9,金牌会员,不错,2017-12-05 18:52:54,0,0,5
j***w,铜牌会员,送货挺快的，赞一下吧,2017-12-05 18:33:51,0,0,5
苹***6,铜牌会员,还不错，双十一买的，便宜，商品用的也不错,2017-12-05 18:11:24,0,0,5
齐***安,银牌会员,很方便很实用,2017-12-05 15:39:10,0,0,5
牟***们,银牌会员,厂家不给开发票货是假了,2017-12-05 12:53:58,0,1,1
心***7,银牌会员,给老妈买的，她很喜欢,2017-12-05 09:38:02,0,0,5
t***8,PLUS会员,超高性价比！小米值得拥有！,2017-12-05 09:16:13,0,0,5
知***m,金牌会员,开机界面蛮好的，就算是不知道运行的就不流畅，还有有几个app图标不好看,2017-12-05 08:37:25,0,0,5
j***o,PLUS会员,挺好用的时候我们一起的,2017-12-05 08:36:11,0,0,5
R***1,银牌会员,买来给老妈用，老人说很喜欢。就是下载软件的时候偶尔有点卡顿，另外，说是64G的其实能用的也就50多G，其他问题还没发现。,2017-12-05 07:58:42,0,0,4
j***a,银牌会员,很满意的一次购物,2017-12-04 21:48:58,0,0,5
j***k,PLUS会员,生产曰期是16年的，和我之前买的小米是一个型号的，里面预安装的程序不一样，没有应用商店，新机没装什么软件有些卡,2017-12-04 21:34:41,0,0,5
j***x,PLUS会员,比本地实体店便宜多了，应该是批发价吧，双十一买的东西有点多，评价内容有些重复。,2017-12-04 20:48:53,0,0,5
j***x,金牌会员,收到宝贝了，快递很给力，东西不错，值得购买！,2017-12-04 19:21:45,0,0,5
j***0,金牌会员,发货非常迅速，买个父母用的，在千元机里算很好的,2017-12-04 19:06:51,0,0,5
兔***称,PLUS会员,挺好的，一直用京东。。。,2017-12-04 17:05:03,0,0,5
巴***鲁,PLUS会员,给爸爸买的手机，挺好用的，一直都用小米,2017-12-04 17:00:47,0,0,5
1***0,银牌会员,相当实惠。,2017-12-04 16:31:27,0,0,5
w***u,钻石会员,国产品牌也是很有特色的,2017-12-04 16:21:21,0,0,5
1***p,金牌会员,便宜，好用，信价比非常高,2017-12-04 15:31:18,0,0,5
你***儿,铜牌会员,收到了，不错，就是膜有点起泡泡了，其他都还可以吧,2017-12-04 13:55:49,0,0,5
j***7,银牌会员,手机收到啦，帮别人买的，已经买两台啦噢，不错，喜欢的朋友放心购买,2017-12-04 09:39:10,0,0,5
j***w,金牌会员,手机还不错  不知道3 G运行内存会不会卡机    反应迟钝,2017-12-04 08:44:50,0,0,5
j***b,金牌会员,首先说快递吧！真的非常给力！从下单到收货不用24小时！还是乡下哦！还送到家门！东西没发现什么问题！使用正常！,2017-12-04 02:05:17,0,0,5
小小小_欧,金牌会员,很好用，上网又快。。。。,2017-12-03 22:33:06,0,0,5
x***3,PLUS会员,手机第二次购买，性价比高。,2017-12-03 20:01:26,0,0,5
j***8,银牌会员,真正的裸机啊！连耳机都没有配。要是质量好也不在乎这些的。暂时没有发现什么问题。外观好看，性价比高,2017-12-03 18:31:21,0,0,5
j***1,银牌会员,好用,2017-12-03 17:52:49,0,0,5
j***2,PLUS会员,不错,2017-12-03 15:46:53,0,0,5
r***r,PLUS会员,正品，很好用。第二次购买，之前买的被偷了，这款性价比高，内存大，用了几个月啦，反应快捷。物流快捷方便，配送员服务态度很好，每次都很满意，老客户啦。。,2017-12-03 15:45:55,0,0,5
寒***时,铜牌会员,不好用，真的，连个说明书都没有，装的盒子那么大，居然连个缓冲物都没有，一拿到手就听见里面哐啷哐啷响，第一印象就不好了，连装个sim卡都得上网找教程，用顶针一捅那个孔，孔的周围就凹下去了？！买个字体重启吓死个人，以为买回来第一天就坏掉了，刚刚用着用着突然就关机不知道怎么回事，开机还慢得要死，唯一满意的只有50来G的可用内存和指纹解锁，要不是这是我爸给我强推的，说实话我觉得还不如我用了好几年的魅族MX4呢，讲真我对手机没多大要求，懒得换了，只要不是坏了就用着先吧,2017-12-03 15:44:55,0,1,3
s***6,银牌会员,挺不错的，不过黄白搭配不太好，本来想要其他颜色的,2017-12-03 14:30:12,0,0,5
玉***0,铜牌会员,晚上买的第二天上午就收到了，挺快挺满意。只是收到后没有电有点尴尬！手机不错上一个买的是Note2都挺好,2017-12-03 14:29:17,0,0,5
狼***团,金牌会员,"差评！差评！
差评！！！",2017-12-03 13:41:12,0,0,5
M***g,PLUS会员,送的,2017-12-03 12:56:23,0,0,5
H***6,金牌会员,手机可以，物流快，我满意还好用。,2017-12-03 12:36:50,0,1,5
b***7,PLUS会员,第二次买这个机器，还不错。,2017-12-03 10:10:58,0,0,5
j***k,银牌会员,手机用着挺好的,2017-12-03 09:36:02,0,0,5
和***5,银牌会员,超级喜欢、第二次购买了,2017-12-03 09:34:48,0,0,5
嗨***明,银牌会员,用着不错哦,2017-12-03 07:43:12,0,0,5
j***n,金牌会员,续航能力强，刚入手感觉还不错,2017-12-02 19:04:28,0,0,5
j***5,铜牌会员,非常不错,2017-12-02 18:00:15,0,0,5
哔***y,铜牌会员,物流超级的快，而且还非常不错，真的特别喜欢,2017-12-02 17:56:59,0,0,5
1***p,PLUS会员,很好，这个价位能买到这么大屏幕，功能齐全的也就小米了，哈哈,2017-12-02 17:53:36,0,0,5
男***授,铜牌会员,好,2017-12-02 17:39:38,0,0,5
龙***伙,金牌会员,前一个丢了，这回又买一个,2017-12-02 17:34:22,0,0,5
n***i,PLUS会员,很好用很好用很好用的产品,2017-12-02 16:51:31,0,0,5
c***o,PLUS会员,质量很好，送货快，这个价位的手机小米的品质很好了,2017-12-02 16:47:28,0,0,5
j***1,钻石会员,买给好兄弟的，他认为还可以，性价比不错，整体满意,2017-12-02 14:41:42,1,0,5
j***m,金牌会员,质量很好，一直使用小米，满意。,2017-12-02 11:02:35,0,0,5
W***W,银牌会员,外观漂亮。好用又实惠我非常喜欢。值得购买。,2017-12-02 09:00:09,0,0,5
5***A,银牌会员,用着挺好的,2017-12-02 03:29:53,0,0,5
文***5,银牌会员,很喜欢以后京东没得说,2017-12-02 01:43:40,0,0,5
x***c,银牌会员,产品还不错，颜值高，反应快，价钱不高,2017-12-02 00:27:03,0,0,5
康***源,钻石会员,外盒包装完好，帮同事买的！应该可以,2017-12-01 22:45:26,0,0,5
j***z,铜牌会员,速度开始蛮快的，质量不错，送货的服务非常好，送到家门口。,2017-12-01 21:11:11,0,0,5
进***刀,银牌会员,挺好的挺好的,2017-12-01 17:32:05,0,0,5
j***m,金牌会员,产品很不错，我喜欢,2017-12-01 16:15:28,0,0,5
x***Z,银牌会员,手机很不错，我家已买4个了，质量性价比比第一！！！,2017-12-01 14:36:36,0,0,5
h***y,银牌会员,不错,2017-12-01 14:27:03,0,0,5
j***d,银牌会员,结自己买的。感觉还可以，用一段时间再追评,2017-12-01 14:17:23,0,0,5
j***r,银牌会员,美观大方，系统也很快。,2017-12-01 14:07:50,0,0,5
经***年,金牌会员,机器还可以，岁数大的人用挺不错的,2017-12-01 12:31:56,0,0,5
k***L,银牌会员,还可以，挺好的,2017-12-01 12:29:25,0,0,5
8***下,金牌会员,给老爸买的，不错,2017-12-01 10:48:15,0,0,5
j***4,银牌会员,我是看了网上性价比排行榜高才买的这款手机，还真不错，红米是国民手机，值得信赖,2017-12-01 10:28:12,0,0,5
周***g,PLUS会员,手机很好，运行流畅，非常棒,2017-12-01 10:13:50,0,0,5
