名字,会员级别,评论内容,评论时间,点赞数,评论数,评价星级
j***a,PLUS会员,屏幕大，电池续航也可以，目前使用感觉可以,2018-03-08 19:08:37,0,0,5
j***8,银牌会员,手机完全没有问题，轻薄好看，单手操作完全没问题。好评,2018-03-06 20:17:27,0,0,5
a***i,PLUS会员,初步满意，还没使用，后续追评,2018-03-07 17:12:28,0,0,5
肥***肥,PLUS会员,大屏，大电量，八核+4G+128G，优点：续航无敌，大屏看着舒服，玩猎魂觉醒换地图轻微卡顿，跑游戏基本没问题。缺点：屏幕色彩偏浅，即使快充也要3小时（5200毫安），男人拿起来也有点大。,2018-03-07 18:40:14,1,0,5
g***8,PLUS会员,续航很不错 以前用红米4X大半天就就电了，max2 5300的电池真不是盖的，用一整天都有50%以上，其他性能都挺均衡的，可以放心选择！,2018-03-07 20:28:16,0,0,5
j***c,银牌会员,还没用，看着很大气，等用后再来评价,2018-03-07 21:12:02,0,0,5
h***8,PLUS会员,这款手机电池是最大优势，相当于带着充电宝呢，屏幕很过瘾，双喇叭很有气氛。,2018-02-24 09:24:37,0,0,5
b***3,银牌会员,各方面都很均衡 总算物有所值,2018-03-07 18:32:46,0,0,5
j***4,银牌会员,手机很大，很给力，单手可握，电池很牛，可比冲电宝，昨天下单，今天收到，啥这么快递牛。,2018-02-26 13:34:06,0,0,5
j***s,PLUS会员,给孩子买的，开始不习惯大屏，用上后很喜欢?。待机时间长，免去了天天充电的麻烦。运行速度很快。喜欢。,2018-03-06 20:09:01,0,0,5
l***d,银牌会员,第一次买小米的产品，送给岳母大人的礼物，方便她与她女儿微信沟通。超级快的顺丰快递和京东的营运团队！???,2018-03-07 20:54:46,0,0,5
菊***锅,PLUS会员,屏幕真的很大，颜色色彩也可以，跑分够用。电池容量也大，有快充，不担心。低配也够用了,2018-02-11 19:39:06,0,0,5
j***r,PLUS会员,这价一天一个变，京东的服务还可以。手机屏幕大了看东西是好很好。希望电量再大点。,2018-03-09 17:39:44,0,0,5
y***春,PLUS会员,给老人买的手机，屏幕大，运行速度也够，超大内存，存照片让老人很满意，照相也很清晰，电池也够棒，总体来说给老人用完全没问题，继续支持国产手机,2018-03-06 22:37:18,0,0,5
g***t,银牌会员,这包装的也是够可以的，不怕摔坏吗？钢化膜也不送，真是够了,2018-03-07 21:29:30,0,0,4
j***3,PLUS会员,物流速度很快，当天拿到。手机使用很流畅，屏幕很大，适合妈妈他们，看字很清楚,2018-03-08 21:35:53,0,0,5
豪and杰,银牌会员,手机蛮不错的  很好用    我们都是小米的忠实粉丝    我们值得拥有   手机很好用,2018-03-08 20:59:37,0,0,5
M***姐,铜牌会员,就这么大，真的是大，太大了。不过室友说用时间长就习惯了。可能吧。不过还是可以的很满意,2018-03-07 13:11:59,0,0,5
j***j,银牌会员,不明白为什么有时候浏览一些软件时会突然卡住，有时候微信或者***想支付的时候也会卡住，不明白是手机的问题还是软件的问题。上一个max2去年九月买的，用的非常好，很通畅，被偷了又买了一个，感觉没有上一个好使。,2018-03-07 19:45:41,0,0,5
糖***哉,银牌会员,用后感觉还不错，一直买小米的，全家都用，这款特别大，用完这个再看米4就小的一点点了，就普通用用，不玩太耗电的游戏什么，电量消耗相对慢点。,2018-03-09 10:16:02,0,0,5
眸***臣,金牌会员,下单的时候，显示是当天到货，下完单，过了半天才有物流信息，说是要从外地调拨，第三天才到货，而且那个小米手环根本用不了，连不了手机也充不了电,2017-08-20 21:05:58,6,4,1
j***g,PLUS会员,第四次购买了。头三次相当给力。希望和前几次一样好用。,2018-03-09 14:36:10,0,0,5
最***l,PLUS会员,屏幕很大   很喜欢  送给妈妈的礼物  妈妈很喜欢,2018-03-04 22:29:41,0,0,5
j***x,银牌会员,手机今天，收到，京东发货，非常快，昨晚下单，今早就到了，一直相信，自莒的东西，拍照也很清淅，电池开机后有一半，用到晚上，也还有电量，非常好，发货给力，快递小哥人也八错，真心点赞！???,2018-03-09 23:01:12,0,0,5
王***6,银牌会员,速度很快，很流畅，性价比超高，握手感很舒服。电池续航方面以后看看再说。,2018-03-08 09:39:47,0,0,5
恋***菲,银牌会员,"感觉还可以吧，买给爸爸用的，他平时喜欢看看电影什么的，小米手机用过3部了，小米2S,小米note3，，都还不错吧，外观也就那样了，运行速度也还可以吧，指纹解锁也是很速度的，用几天在来追加",2018-03-08 20:15:27,0,0,5
月***酪,PLUS会员,超大屏，送家里老人最是合适了，待机时间又长,2018-03-07 15:31:42,0,0,5
liufaming2012,PLUS会员,屏幕大，非常喜欢非常喜欢非常喜欢非常喜欢非常,2018-03-08 20:35:48,0,0,5
cxgcsy,钻石会员,目前，流畅，待机时间长，电池耐用。,2017-10-06 19:28:54,0,0,5
j***g,PLUS会员,不错，屏没想象中大，屏幕看起来比苹果费力，拍照确实不能说那么完美，但是基本需求可以满足，值得购买,2018-03-07 00:03:22,0,0,5
悠***7,金牌会员,去年七月份帮朋友买的，结果最近摔坏，又让我买同款的，打电话多，满意续航能力，屏大。这次选择京东，物流给力，当天就到。,2018-03-06 21:08:51,0,0,5
jd842096tjt,银牌会员,打电话没有噪音看视频声音都不正，有沙沙声，就好像扬声器漏气一样,2017-12-20 23:07:09,4,2,1
死***狗,钻石会员,"不错，这手机性价比超高。以前我用的MAX不错，然后现在老婆要换手机了,所以就给她买了MAX2。不错啊，可以看电影。然后拍照也还算可以吧。尤其是电量用两三天不用充电，续航杠杠的。",2018-03-06 13:55:37,0,0,5
仗***8,PLUS会员,一次买2部，家里老人都很满意，满分,2018-03-09 11:17:00,0,0,5
r***p,钻石会员,拍照不错 指纹识别速度很快 主要是不带耳机 没有nfc,2018-03-07 00:12:41,0,0,5
M***z,银牌会员,宝贝以收到 快递员服务周到  物流快   谢谢店家,2018-03-08 13:10:23,0,1,5
j***9,银牌会员,给力       屏幕大          特喜欢,2018-03-07 17:33:41,0,0,5
j***泷,PLUS会员,续航很给力，系统不错，好评。,2018-03-07 17:10:00,0,0,5
唔***物,银牌会员,大屏幕，反正快，12小时就收到货了，京东就是好！,2018-03-06 18:07:05,0,0,5
荆***聪,PLUS会员,就喜欢大屏的手机！,2018-03-07 14:22:47,1,0,5
h***8,PLUS会员[试用],运行内存大，运行速度很多，系统处理能力和照相功能都很好，等用段时间再看看，主要屏幕够大,2018-03-07 03:43:19,0,0,5
1***p,铜牌会员,"东西昨日中午即收到，包装无损而且邮寄之快，在放了一下午晚上才充了一下电，开机后自已下了一个桌面图片，很滿意，图像清晰
又大，正是为我们退休老人设计的。赞！祝小米手机设计出更多更好适合广大老百姓的产品，在同行业中的王牌企业。",2018-03-07 14:47:53,0,0,5
j***x,PLUS会员,手机非常好，很满意。,2018-03-08 19:09:48,0,0,5
兔***狸,银牌会员,此用户未及时评价，系统默认好评。,2018-03-08 18:59:41,0,0,5
j***e,金牌会员,物流很快，质量也很好，京东靠得住,2018-03-06 18:20:04,0,0,5
j***b,铜牌会员,屏幕有点太大了，挺好的，还行。,2018-03-08 18:33:53,0,0,5
山***翼,钻石会员,屏幕够大，续航时间挺长，就是WIFI好像弱了一点点。总之挺不错，就是不知道用两年后会如何？,2018-03-06 17:27:23,0,0,5
j***d,铜牌会员,挺好的，无论是机器还是物流。,2018-03-09 09:27:17,0,0,5
东***9,金牌会员,性价比高，屏幕大，运行快。,2018-03-08 22:37:52,0,0,5
j***5,银牌会员,喜欢这种机械外观，好评,2018-03-06 20:15:21,0,0,5
小钢的狗粮,银牌会员,一拿到手机各种试，跟预期一样，没有那么不堪。还玩了一把刺激战场体验很好，就是掉了五个电。不知道这算不算费电呢，其他以后再说。第一印象就是这样了,2018-03-09 20:05:21,0,0,5
j***忌,钻石会员,是帮家人买的，喜欢那个特殊的分屏模式，可以一边看视频一边微信聊天,2018-02-24 10:11:26,1,0,5
风***原,PLUS会员,确实够大，手感不错，物流速度快，早上下单，晚上拿到。,2018-03-08 21:16:52,0,0,5
s***s,钻石会员,运行流畅，电池续航能力惊人，外观中规中矩，屏幕显示效果不好不差。给妈妈买的，超大屏配上巨无霸字体，老花眼都看得一清二楚，相当满意了~,2018-03-10 00:29:34,0,0,5
j***r,银牌会员,很喜欢，真的是超大屏大电量了，看视频什么的简直不要太爽，幸福啊，速度也很快，不错，除去手机自带的内存，还剩55g吧，也不错了,2018-03-06 13:50:50,0,0,5
翱***t,钻石会员,很要用啊，之前给妈妈买了一台，现在继续买，也推荐给了朋友，大家都觉得不错呢，运行速度快，屏幕超级大，看电视超级爽的，推荐,2018-03-08 15:29:08,0,0,5
w***9,金牌会员,"媳妇当备用机，看视频，她很满意！自己
感受了一下，反应快，也没有网上说的奇奇怪怪的毛病，电池轻度使用，已经扛到第三天了！",2018-03-07 19:14:49,0,0,5
闲***量,PLUS会员,非常好，非常的适合给爸妈做老人机，反应也比较灵敏。作为爸妈第一次使用智能手机，很满意，很好上手。,2018-03-08 22:41:49,0,0,5
H***m,铜牌会员,手机颜色很好看 各种都不错 只是有一点卡，充电慢了 还有就是64g内存只能用五十多个g 小米自己的内存用了近10个g……但是真心不错?,2018-03-09 22:17:02,0,0,5
j***j,银牌会员,货已收到，正品行货，京东值得信赖！下单时看到十二天后才能收到货，吓死我了，还好3月2号下的单，9号收到必进是山区,2018-03-09 15:34:45,0,0,5
j***u,银牌会员,刚买的还没使用，过一段时间再说吧，就是原来的照的照片显得发黑，不知道是我没调整好，还是啥原因，过段时间再评价！,2018-03-09 17:57:51,0,0,5
随***康,PLUS会员[试用],送货速度非常快，配送员服务态度也很好，包装方面有点欠缺，没有用防撞条希望能有所改善,2018-03-07 19:49:05,0,0,5
j***9,铜牌会员,手机不错   物流很快  非常喜欢   就是纯新手机  不像别的评论说什么二手的  磨损的  根本没有,2018-03-08 00:53:04,0,0,5
h***0,铜牌会员,"用了一天，机子还行。
唯一想吐槽的是保护壳、耳机、充电宝、贴膜这些买手机常见的赠品一样都没有，吝啬！",2018-03-07 09:08:40,0,0,5
j***l,PLUS会员,自己弄那个壳贴了个膜。用着还可以吧！算是这种配置价位比较低的。中通送货一级快。,2018-03-09 09:10:27,0,0,5
j***g,PLUS会员,不错，给老妈买的，她很满意，屏幕够大，显示效果也不错，续航够长，性能也足够用。,2018-03-08 20:08:38,0,0,5
气***康,银牌会员,很大，给人感觉很不错，具体要用才知道,2018-03-08 17:21:22,0,0,5
泪***亭,银牌会员,很喜欢，很大，太爽了????,2018-03-08 15:53:19,0,0,5
大***黄,PLUS会员,给老妈买的，是有朋友买了，推荐使用的，还没开始用，应该不错的，主要是屏幕大,2018-03-08 06:54:02,0,0,5
想***先,PLUS会员,"给父亲买的，他就想要个大屏手机电池大一些
手感待机都还不错的，爸爸很喜欢",2018-03-09 20:20:34,0,0,5
l***7,银牌会员,妈妈很喜欢，分辨率很高，屏幕是真的大，超级大！一级棒，音质啊，拍照效果都很不错，妈妈高兴坏了,2018-03-09 11:18:11,0,0,5
j***b,铜牌会员,这个手机不错，一直用小米，电池特别耐用，给公公买的，看新闻，玩微信，听音乐三天冲一次，棒棒哒,2018-03-08 18:12:21,0,0,5
1***p,银牌会员,这个小米手机是买给老婆用来看电影，是第二次买了手机质量做工很好很好用大家不要错过这款手机。,2018-03-07 17:31:49,0,0,5
m***4,金牌会员,大屏用起来就是爽，放口袋里跟一般大的没什么区别，速度也很快，关键玩王者荣耀不卡啊哈哈哈哈,2018-03-09 17:27:40,0,0,5
G***扬,银牌会员,手机是原封未拆的，音量、通话质量都很清晰，而且大屏幕看着就是爽，比想象中的还要好，实用。,2018-03-09 09:34:50,0,0,5
j***f,银牌会员,一直用小米，这是买的第五个了。帮朋友买的。省电。大屏幕，看电影玩游戏超爽，我是忠实的米粉,2018-03-08 19:54:35,0,0,5
月***e,PLUS会员,奈斯！我奶奶年级大了耳朵不好使，现在用这个手机终于能听清了！感谢小米,2018-03-06 17:48:52,0,0,5
y***i,PLUS会员,给老年人买的，音效很好，但是打游戏就不行了，看电视很舒服，屏幕大,2018-03-08 10:55:10,0,0,5
j***l,银牌会员,"大气,屏幕大,电池不错
摄影一般,垃圾处理器 打开图片,,1分钟才显示清楚
有点失望",2018-03-08 10:57:33,0,0,5
卡***死,PLUS会员,非常棒，已经第二次购买了，jd送货给力，今天大雨还是准时送到了。,2018-03-07 14:43:15,0,1,5
j***o,银牌会员,这手机不错   反应很快   我最喜欢手机放歌的声音很好听   希望这款手机不要下架,2018-03-08 22:02:05,0,0,5
闯***斯,PLUS会员,特意用了几天才过来评论，绝对是性价比高。物有所值快递速度又快。,2018-03-09 09:13:14,0,0,5
科***马,PLUS会员,不错的手机，性价比之王的，在京东上买了好多个了，京东自营相信！,2018-03-08 16:04:30,0,0,5
j***灵,PLUS会员,收到手机，用了一个月了，感觉挺好的，一直用小米，相信小米手机。,2018-03-06 16:55:50,0,0,5
j***b,金牌会员,手机收到了几天，外表好看，功能强大，系统好用，屏幕大，图案清楚，价格合适，超值。,2018-03-09 20:33:45,0,0,5
x***i,金牌会员,用了两天啦，感觉还不错，电池续航能力很强，看了五六集电视剧，电池还有56%，不错,2018-03-08 13:30:51,0,0,5
裕***良,PLUS会员,还没有使用，不过京东的产品应该可以放心。好大的屏幕，很喜欢,2018-03-07 19:49:35,0,0,5
j***4,钻石会员,屏幕不错，色彩挺好的，系统用着挺顺畅，给老婆用的，没事用手机看电视剧，屏幕挺大,2018-03-07 08:10:05,0,0,5
无***i,PLUS会员[试用],电池很经用，屏幕好大好大，也很流畅。小米Max你值得拥有,2018-03-08 13:05:41,0,0,5
jd162276grl,金牌会员,此用户未及时评价，系统默认好评。,2018-01-22 09:34:38,5,0,5
f***W,银牌会员,小米性价比真心高，这部手机给老爸买的，小屏幕的不要非要大屏幕的，看电视带劲。,2018-03-07 14:02:50,0,0,5
百***風,PLUS会员,买给妈妈的，大屏幕很好看(??ω??)??,2018-03-09 20:04:33,0,0,5
京***谐,PLUS会员,用了好几款小米手机了，性价比真不错。屏幕大看着就是舒服,2018-03-07 15:00:48,0,0,5
天***雁,铜牌会员,手机蛮大的，关键是电池容量大，第一时间下了个游戏试玩了一下，感觉蛮流畅的。,2018-03-06 15:32:21,0,0,5
C***o,金牌会员,买了好几个这款手机了，就是屏大，看着舒服~~快递员小哥态度很认真，很严谨，赞~,2018-03-09 10:09:12,0,0,5
蓝***-,PLUS会员,帮同事买的，同事很喜欢，说系统流畅，屏幕大，电量足，,2018-03-07 15:50:52,0,0,5
w***2,PLUS会员,老爹用的这个，老妈用的也是这个，自己儿子用的还是这个,2018-03-09 15:13:26,0,0,5
1***N,PLUS会员,手机刚收到，看好这手机好久了，希望好用，暂时好评吧,2018-03-09 23:45:11,0,0,5
想***部,PLUS会员,给京东先五颗星。又没开发票 电子发票不知道能不能用,2018-03-09 22:01:20,0,0,5
-***-,金牌会员,运行速度还行，玩几个大游戏还是可以的。电池也挺大的，玩一天没什么压力。,2018-03-09 20:39:12,0,0,5
j***v,PLUS会员,还可以吧，感觉没有老公的好，一样的手机?给好评吧,2018-03-08 14:19:44,0,0,5
j***j,PLUS会员,我不玩游戏，只是为了看电子书和电视才买这么大屏的！,2018-03-07 12:41:55,0,0,5
f***1,PLUS会员,给老妈买的，大屏幕方便她使用，京东物流也提给力的,2018-03-09 08:38:27,0,0,5
j***9,PLUS会员[试用],第二次买了，送给爱人的，很好用，一直用小米手机。,2018-03-08 08:46:36,0,0,5
j***6,PLUS会员[试用],很好，买了三个，给老人，给爸妈，屏幕大看的清楚。,2018-03-07 22:01:18,0,0,5
于***3,银牌会员,给妈妈买的大屏手机，6.4寸，妈妈十分喜欢，看视频特别方便，十分开心~,2018-03-08 20:43:25,0,0,5
r***i,PLUS会员,很有性价比的手机，运行很流畅，目前没发现什么问题,2018-03-07 10:07:08,0,0,5
帅***东,PLUS会员,第二台了。送给弟弟的，小米MAX2非常棒，期待3,2018-03-07 00:34:58,0,0,5
J***i,钻石会员,给老婆买的，用习惯了小米大屏手机。外观没变化，运行速度流畅，值得入手,2018-03-06 22:30:20,0,0,5
j***呢,金牌会员,买了送给老妈的，颜色很喜欢，一直喜欢小米的系统，屏幕大老年人用着舒服,2018-03-06 13:50:20,0,0,5
j***a,PLUS会员,东西不错，京东的物流还是一如既往的快，下回再买,2018-03-09 14:02:10,0,0,5
q***0,银牌会员,手机不错，很好用运行很快不卡，屏大清楚电池耐用非常满意全五分好评。,2018-03-07 10:19:44,0,0,5
h***n,PLUS会员,给老人买的，大屏很合适，性能也足够，老人很喜欢,2018-03-07 06:47:12,0,0,5
杨***2,银牌会员,果然小米手机性价有保障，只不过同学们要注意了，这是中卡和小卡双卡…,2018-03-09 13:02:50,0,0,5
j***打,银牌会员,好久没在京东上买手机了，买了又一次满意！家里三八收到礼物好满意！,2018-03-09 06:27:16,0,0,5
y***n,金牌会员,一直用的小米的手机，不错，就是不到半个月就降价100.不开心?,2018-03-08 11:28:39,0,0,5
j***g,银牌会员,运行速度快，拍照清晰，音质也不错，电池给力，发货真快，给京东点赞,2018-03-07 22:33:33,0,0,5
i***e,金牌会员,手机挺喜欢的，就是商家有点抠门啊！啥赠品都没有，起码送个贴膜吧！,2018-03-07 08:29:51,0,0,5
1***p,金牌会员,"手机很好哦！
屏幕大，外观十分大方！
建议购买，哈哈哈。比较中意",2018-03-06 20:05:48,0,0,5
云***景,PLUS会员[试用],很好，运行速度也很快。用过最大屏幕的手机。,2018-03-08 20:35:57,0,0,5
t***w,金牌会员,快递小哥特别好！快递小哥特别好！快递小哥特别好！手机巨大。。。,2018-03-09 19:27:35,0,0,5
极***家,PLUS会员,手机真是出乎意料的大，六寸多的屏幕一个手确实很难拿住把玩，屏幕分辨率还可以，手机正面白色背面金色，很大气，也很好看。金属感很强，拿在手里沉甸甸的，手机开机后运行速度很快，包括拍照，蓝牙连接，wifi链接等 都很好用，系统升级到最新的miui9，整体很流畅，安装好微信等软件使用和切换也都没问题。整体好评，另外，感谢快递小哥，十分迅速。,2018-02-28 09:14:14,1,0,5
g***j,PLUS会员,给老爸买的，他嫌弃有一点大，不好放口袋里,2018-03-09 11:17:34,0,0,5
绝***客,PLUS会员,价格比较低，屏幕非常大，性能挺好的，喜欢,2018-03-07 21:56:35,0,0,5
北***件,PLUS会员,物流很快东西很好，字体很大。适合老年人用,2018-03-07 19:11:55,0,0,5
n***f,PLUS会员,小米手机挺好，买了两个，屏幕大，看着爽～,2018-03-06 23:05:14,0,0,5
j***4,银牌会员,帮别人买的，京东还是一遇既往的快，对方及时收到礼物很满意。,2018-03-10 00:49:50,0,0,5
y***8,PLUS会员,帮亲戚买的，第二次购买这款手机，超大屏,2018-03-07 07:01:12,0,0,5
后***8,PLUS会员,同等价格，这样的硬件，的确是性价比之王,2018-03-06 23:01:14,0,0,5
噢***拓,钻石会员,手机给老婆买的还可以，解锁比我的美酒要快，一部手机换小米了,2018-03-07 12:42:19,0,0,5
天***6,金牌会员,我已购买两部了，因上一部用的很好，现在的小米手机值得拥有！,2018-03-06 15:39:23,0,0,5
傻***煦,银牌会员,物流很快，手机收到了，还没有用，看着倒是挺大气的??,2018-03-09 15:15:30,0,0,5
金***技,PLUS会员,屏幕够大，电池够大，机身轻薄。满意！,2018-03-09 06:28:09,0,0,5
3***情,金牌会员,买了四个了，没啥说的，还是信赖京东，品质什么都没有问题。,2018-03-09 19:16:47,0,0,5
C***N,银牌会员,一开始手机听筒有电流声，但是过一会儿就没了。希望不要中奖,2018-03-07 22:34:16,0,0,5
j***q,钻石会员,超值！做工精细，电池耐用，中度使用，两天后电量还有大半格,2018-03-07 19:47:05,0,0,5
c***i,PLUS会员,给老妈买的，大屏她很喜欢，电池够用。,2018-03-07 07:11:43,0,0,5
j***杯,PLUS会员,买了好几部小米了，用着很好，还便宜。,2018-03-07 14:06:35,0,0,5
_***_,PLUS会员,帮人买的，说还可以?，那就行了?,2018-03-06 20:46:58,0,0,5
虎***大,PLUS会员,前后买了两个，自用和老妈用，性价比高,2018-03-06 18:53:05,0,0,5
j***f,PLUS会员,屏大，系统流畅，性价比高。值得买。,2018-03-09 20:13:55,0,0,5
j***2,银牌会员,还可以，就是屏太大，先用用看吧，电池够用，希望是正品，,2018-03-09 18:25:13,0,0,5
1***购,银牌会员,小米max2真心喜欢，运行速度很快，拍照清晰。很好用。,2018-03-09 18:16:45,0,0,5
jd_182537xlu,铜牌会员,正品，速度快，大屏啊，有运动传感器，不用配手环了，真好,2018-03-09 06:15:13,0,0,5
s***3,PLUS会员,屏幕大，非常大，抵了一个小平板了。,2018-03-09 16:48:35,0,0,5
我***静,钻石会员,给同事母亲买的，用了还是感觉太大了，不过还是挺喜欢的。,2018-03-08 17:11:05,0,0,5
j***l,铜牌会员,服务态度真的是很好，就冲着服务态度再买了一次。非常好。,2018-03-07 21:58:36,0,0,5
圆***织,银牌会员,拍照清晰，像素挺高。屏幕够大手感不错，手机用着挺好的。,2018-03-06 19:25:09,0,0,5
J***X,银牌会员,替别人买的，感觉应该不错，如果能多送点东西就更好了！,2018-03-09 13:13:41,0,0,5
丁***天,钻石会员,非常好用。操作简单。第5个了。都是周围朋友的。都说好,2018-03-09 11:06:05,0,0,5
j***c,金牌会员,手机很漂亮，屏够大，很喜欢。京东物流够快。全点赞！！,2018-03-08 20:04:29,0,0,5
i***0,PLUS会员,手机很大。价格不贵。待机时间长。,2018-03-07 10:50:44,0,0,5
j***w,金牌会员,宝贝收到/正在试用|不知道有没有问题过段时间再来评价,2018-03-07 10:08:51,0,0,5
z***4,PLUS会员,外观不错质量可以特别是电量够大。,2018-03-06 16:33:16,0,0,5
小***3,金牌会员,一如即往的好，京东自营的小米和小米官网品质一样的好。,2018-03-08 20:38:01,0,0,5
j***u,铜牌会员,外形好看，屏很大，看视频，玩游戏超爽，性价比很高。,2018-03-10 00:04:15,0,0,5
1***p,PLUS会员,第二次购买了，支持小米，爱小米,2018-03-09 19:53:29,0,0,5
a***y,PLUS会员,给老人买的手机，感觉挺不错的。,2018-03-08 22:38:46,0,0,5
S***0,PLUS会员,手机还不错，够用了。看电视不错,2018-03-08 16:01:57,0,0,5
j***1,钻石会员,京东上买的还是比较划算的，比外面买肯定是便宜不少。,2018-03-08 18:46:21,0,0,5
小***8,PLUS会员,大屏幕适合老年人使用，挺好的。,2018-03-07 17:07:36,0,0,5
守***人,金牌会员,第一次使用小米手机，感觉上还是不错的，先给5分好评,2018-03-07 08:12:30,0,0,5
j***p,金牌会员,手机不错，运行速度很快，当然啦快递小哥也很给力！,2018-03-07 23:20:40,0,0,5
j***p,PLUS会员,给老爸买的 还不错 他很喜欢,2018-03-07 15:25:02,0,0,5
z***1,PLUS会员,非常满意，物美价廉，非常满意,2018-03-08 09:15:16,0,0,5
小***漆,银牌会员,手机很好，各方面都不错。支持小米，大屏看电影舒服,2018-03-07 12:20:31,0,0,5
小蜗牛昊昊,银牌会员,用了一段时间来评价的 电池好用两天一充 音质也好,2018-03-07 06:40:18,0,0,5
j***2,银牌会员,大屏我喜欢！用了一个星期了。也没有任何问题！点赞,2018-03-07 12:20:42,0,0,5
米***乖,银牌会员,手机真的很大  看视频很安逸的  其他用后追评,2018-03-09 18:57:15,0,0,5
6***z,铜牌会员,机子挺好。一直都在用小米系列的，就是屏幕有点大,2018-03-09 12:08:13,0,0,5
j***v,金牌会员,喜欢用小米的手机，喜欢买京东自营的东西，放心。,2018-03-09 21:41:40,0,0,5
j***d,PLUS会员[试用],还不错，刚买，不知道费电不,2018-03-06 18:57:10,0,0,5
j***x,PLUS会员[试用],真心好   续航能力也不错,2018-03-06 18:15:38,0,0,5
j***t,银牌会员,买这个手机，用了不到一个月，就两个喇叭坏一个。,2018-03-06 20:42:08,0,0,5
j***r,银牌会员,很好电池特别厉害不停的打一天游戏电够用我喜欢,2018-03-09 12:57:58,0,0,5
y***a,钻石会员,东西很大气，颜色也漂亮，为发烧而生，值得购买,2018-03-08 20:26:00,0,0,5
j***1,PLUS会员,挺大气的，用起来不错。。,2018-03-08 10:14:45,0,0,5
j***6,铜牌会员,帮老弟买的，目前觉得还行。发货速度很快，赞！,2018-03-07 23:22:21,0,0,5
j***3,PLUS会员,物流速度很快，屏幕够大！,2018-03-07 14:13:51,0,0,5
