名字,会员级别,评论内容,评论时间,点赞数,评论数,评价星级
j***c,铜牌会员,今天收到了，试了一下还行，充电也没问题，只是快递有点慢，先用着吧，看后面会不会有问题，希望能帮到想要买手机的朋友,2017-12-04 12:13:56,0,0,5
j***8,铜牌会员,手机，还不错，,2018-01-21 14:56:53,0,0,5
x***1,银牌会员,手机发货很快，3天就收到了，手机包装是未拆封的，原包装的，是正品品牌手机，手机是我喜欢的机型，5寸屏，大小正合适，玫瑰金的，颜色也特喜欢，系统运行很流畅，一点都不卡，500多还能买到这么高端的手机非常开心，卖家人很好，给满分,2017-11-04 10:55:41,0,0,5
j***v,银牌会员,手机不错，拍照清晰，手感好。运输过程性出现的问题，联系卖家也很快予以答复解决。为老人购买，值得入手。,2017-10-30 17:21:49,0,0,5
拯***单,PLUS会员,帮妈妈买的，她说很喜欢，她用足够了，聊聊微信，看看视频，用了几个月来评论的。,2017-11-28 23:37:01,0,0,5
橙***大,PLUS会员,"小米4A 红米4A 双卡双待4G手机 香槟金 全网通(16GB ROM)
¥578.00",2017-06-08 19:55:00,0,1,5
l***8,PLUS会员,帮朋友买的，用着差不多吧，只能说不要有太多要求就行，总体性价比高！一下买了好几个，给家人用的！,2017-06-15 17:49:33,0,1,5
U***i,铜牌会员,可以，一般般,2018-03-04 01:17:01,0,0,5
1***p,钻石会员,买来当老人机,2018-03-01 18:38:28,0,0,5
l***u,银牌会员,手机还不错，特地用了几天才来评价，给老人买的，快递员态度很好，点个赞,2018-01-24 12:56:07,0,0,5
j***嘿,银牌会员,速度挺快，大过年的30收到的，可是老人不会弄，划不动屏幕，我又在外地，弄得挺头疼，初一拜年邻居小哥给设置好了，大过年的卖家还给打电话处理，真心好售后，刚开始提出了退货等要求，卖家也没拒绝 真是给卖家添麻烦了，前前后后打了几个电话 ，京东的售后还可以的,2017-02-15 22:44:57,0,1,5
d***9,铜牌会员,手机很好用。,2018-02-18 16:59:05,0,0,5
z***6,金牌会员,手机收到了，给老妈买的，用着觉得还可以，但是忘了选号码领手机卡,2018-02-28 13:30:29,0,0,5
殇***髓,银牌会员,手机非常好用,2018-02-12 09:43:31,0,0,5
陈***存,铜牌会员,不错很好可以,2018-02-09 11:11:25,0,0,5
j***e,铜牌会员,挺好的 满意,2018-02-04 19:34:08,0,0,5
h***9,PLUS会员,不错的 好用,2017-12-20 23:42:46,0,0,5
j***y,铜牌会员,真的是超级好用，妈妈用了好久了，还是一如既往地快，马上就考虑给爸爸也换一部手机，这个性价比真是特别的高,2017-07-17 20:42:46,0,0,5
向***宣,PLUS会员,今天收到了，没怎么用过苹果，系统速度还是快，打开网页很顺畅。很好用。,2017-11-01 01:22:34,0,0,5
j***4,银牌会员,平时买其它东西京东物流是够快的，可这次为了这个手机苦苦等了4天，而且还是自己到终点站领的?！这次不是很满意！,2017-09-21 12:45:51,0,0,4
j***8,PLUS会员,手机刚收到，给妈妈用的，收到开机没什么问题，看用段时间再加评。 不过耳机都没送。,2018-01-04 18:01:30,0,1,3
人***唉,PLUS会员,这是在京东买的第三部还不知道第四部手机了 一开始都不放心在京东买手机 后来是朋友说京东的手机质量没得说 就半信半疑买了第一次 拿到手用了用很放心 这次给我老妈换了个手机 我老妈很开心?,2017-10-24 13:02:08,0,0,5
j***s,铜牌会员,手机收到刚刚使用，外观都很满意，不知用着怎么样，以后再做评价。就是快递员不让打开看。但是还是先给个好评。,2017-02-17 08:24:16,1,1,5
j***e,铜牌会员,手机蛮好的，适合妈妈辈的用，不要太多功能用用微信就好了，字体也可以调整，而且功能也蛮全面的，好评哦,2017-06-01 20:09:48,0,1,5
x***y,PLUS会员,这个买的最后的降了价的手机。哎，现在是不是流行5a了哦,2017-11-04 00:24:13,0,0,5
铁***子,铜牌会员,手机搭上卡，有时候就没信号了，等重新插上一次卡，又有信号了，不知道怎么回事。,2017-10-03 15:39:19,0,0,5
j***g,PLUS会员,电池续航还不错了，给老人用的，她用得很少，屏幕显示还是很刺眼，调成暖色也没用，打开护眼模式也没用，系统还是比较好用，功能太多了估计也不会用到,2018-02-27 19:37:43,0,0,5
p***o,银牌会员,看起来还不错,2017-12-26 14:10:11,0,0,5
美***配,PLUS会员,好用好用好用,2017-07-17 20:50:24,0,0,5
l***8,PLUS会员,帮朋友买的，用着差不多吧，只能说不要有太多要求就行，总体性价比高！,2017-06-15 17:50:02,0,1,5
D***d,银牌会员,非常实用的手机,2017-05-03 15:13:32,1,0,5
j***1,铜牌会员,很快，3天就到了，家人用，目前还不错,2018-02-23 10:52:17,0,0,5
无***w,PLUS会员,物流很快，速度给力。 物流很快，速度给力。 物流很快，速度给力。,2017-06-07 18:53:41,0,1,5
j***3,钻石会员,一直信赖京东，机子虽然便宜，比较好用！推荐买便宜机型的可买！,2017-06-26 10:20:35,0,0,5
j***j,PLUS会员,手机帮朋友买的，第一次在三方卖家买东西，心里没底，手机目前一切良好,2017-04-30 16:25:24,0,1,5
j***手,PLUS会员,不错的手机，备用机很合适，不经常用，就接短信,2017-10-25 00:07:20,0,0,5
无***w,PLUS会员,物流很快，速度给力。物流很快，速度给力。物流很快，速度给力。,2017-06-10 06:39:30,0,0,5
D***r,PLUS会员,手机收到啦，性价比高，外观美丽高大上，好好,2017-10-21 00:08:25,0,0,5
易***r,金牌会员,物流太慢了，手机无贴膜，16GB只是得10GB，但买比老人家用的，就算了,2017-12-30 21:51:29,0,0,4
珅***琪,PLUS会员,手机收到了，物流很快，客服很不错。以后常来,2017-10-06 14:40:17,0,0,5
j***7,银牌会员,目前还不错，用的再追加哈,2018-02-26 21:51:37,0,0,5
j***0,铜牌会员,2017年6月5日购买到2017年7月25日就黑屏用不了啦,2017-07-26 07:40:16,1,1,5
j***6,铜牌会员,手机收到了，在试用中,2018-02-14 13:13:08,0,0,5
春***哥,PLUS会员,京东质量不错，速度很快，很不错的一次购物。,2017-06-11 23:40:46,0,1,5
j***j,铜牌会员,宝贝收到了，姨夫很满意 手机还不错哦！五星好评 客服也很好?,2017-06-24 21:52:50,0,0,5
魑***头,PLUS会员,商品不符合，我当时是看中的是全网通才下单购买的，但是，实际收到货的是后封的移动合约机，所以，完全不是我真正需要购买的版本，商家始终不承认。没办法，申请退货了。,2017-05-06 10:14:24,1,0,5
x***1,银牌会员,好可以吧，触摸屏就是有点不灵敏,2018-03-07 08:18:41,0,0,4
朱***1,银牌会员,速度有点慢，,2017-05-11 17:45:11,0,0,5
A***刘,PLUS会员,东西不错，实惠，快递服务好，赞，下次再来～～,2017-05-05 10:46:19,0,0,5
j***g,铜牌会员,用起来还不错,2017-05-01 20:18:29,0,1,5
d***2,金牌会员,不错很好用。,2017-05-01 08:26:28,0,1,5
j***7,铜牌会员,手机很好用   价格也很划算,2018-02-26 17:24:39,0,0,4
j***4,银牌会员,看着还可以，不过好像不是正版,2018-02-26 17:13:48,0,0,4
喜***n,金牌会员,给爸买的，还没用，不知道怎么样呢,2018-01-20 20:27:14,0,0,4
j***e,PLUS会员,"这么好的手机
品。你不买就是可惜了",2017-06-22 15:43:20,0,0,5
j***s,银牌会员,给老爸老妈卖的我感觉还是很不错的，毕竟是老辈人用。,2017-07-25 13:52:53,0,0,5
j***d,铜牌会员,手机不错，用着挺好的。物流也挺快的。性价比挺满意，以后用着还可以买。,2017-02-25 13:18:31,0,1,5
j***e,PLUS会员,"这么好的收
品。你不买就是可惜了",2017-06-22 15:43:44,0,0,5
于***祥,PLUS会员,手机性价比很好，周边朋友都推荐我买，于是我买了几部弄着玩，试着暂时很真不错，安卓机难免以后会慢，走着瞧吧,2018-02-26 10:47:09,0,0,5
萱***7,PLUS会员,手机质量挺不错的，价格实惠，满意,2017-06-20 16:07:02,0,0,5
萱***7,PLUS会员,手机质量挺不错的，价格实惠，满意,2017-06-20 15:57:36,0,0,5
c***7,PLUS会员,给老妈买的，用的极简模式，字体设的很大，挺适合老年人的,2017-05-31 19:52:53,0,1,5
不***口,PLUS会员,同事要我帮忙买的速度很快不错。,2017-06-20 11:09:14,0,0,5
j***w,铜牌会员,昨晚充电了到现在，很好，第一次用小米的手机，很满意,2017-06-17 05:49:31,0,1,5
扭***弦,铜牌会员,物超所值呢，但是接听或拨打会回音，卡槽也很不好，,2017-06-29 21:07:33,0,0,5
h***y,PLUS会员,外观漂亮手感不错，品质不错。,2017-06-29 12:18:05,0,0,5
8***m,PLUS会员,价格比实体店便宜，不错，好用。,2017-06-09 10:32:50,0,1,5
j***w,PLUS会员,发货快用，物流给力，支持国货,2017-06-01 22:24:51,0,1,5
i***2,PLUS会员,手机还不错，功能全面希望耐用,2017-06-01 19:38:38,0,1,5
龙花格娜,银牌会员,款式非常漂亮，物美价廉，京东购物U保障，全部满分。,2017-05-11 18:45:29,0,0,5
快***子,金牌会员,手机非常漂亮，挺好的，非常满意,2017-07-21 18:55:45,1,0,5
盼***3,金牌会员,"帮家里老人买的，很喜欢。
而且划算。实用。",2017-07-04 15:17:34,0,0,5
褚***豆,PLUS会员,还不错价格不贵挺好的划算,2017-06-12 16:25:02,0,1,5
史***兵,PLUS会员,补寄了发票，挺好的，好评,2017-06-12 14:09:35,0,1,5
栀***3,PLUS会员,还行就奥！价格合理，618过后肯定要涨价了,2017-06-22 13:00:50,0,0,5
j***u,PLUS会员,"质量非常好，与卖家描述的完全一致，非常满意,真的很喜欢，完全超出期望值，发货速度非常快，包装非常仔细、严实，物流公司服务态度很好，运送速度很快，很满意的一次购物",2017-07-17 15:19:35,0,0,5
一***进,铜牌会员,手机漂亮，拿起来又青还可以吧,2017-10-10 15:05:58,0,0,5
1***p,银牌会员,挺漂亮的，送给弟弟的，小伙伴们赶快下单吧,2017-06-25 12:26:02,0,0,5
l***9,PLUS会员,快递速度非常快，好,2017-06-25 10:20:40,0,0,5
jd_ζ???????????ζ哥,银牌会员,应该不错的钢化膜坏了又给补发了个,2017-07-13 20:39:44,0,0,5
t***g,金牌会员,手机还可以，跟预料之中的一样，小米，用习惯了。,2017-03-16 21:37:35,0,1,5
j***5,铜牌会员,物流有点慢，24号下单，1号下午才到。买的时候说的28号24:00前到货，可是并没有。不过总体还是可以的。,2018-03-01 18:13:08,0,0,5
婷***3,铜牌会员,给爸爸买的，感觉挺好的。物流很快，两天就到了，好评,2017-02-07 11:44:22,0,1,5
j***m,银牌会员,本来想买599的但是真没时间去抢，这家价格也不贵，手机也挺好用，用了这么多天才来评价滴。纯待机可以4天，一般看看新闻的话可以用两天。玩游戏多的话一天是没啥问题的。,2017-04-09 22:50:04,0,1,5
刘***0,PLUS会员,这次是公司买的做奖品的，买了好多个！质量很好！重要发货快！按时到达！很好！谢谢商家噢！,2018-02-14 18:22:54,0,0,5
j***5,银牌会员,用了几天了，感觉还行质量很好,2017-07-17 16:50:59,0,0,5
S***n,PLUS会员,价格实惠，东西不错，值得购买！,2017-06-29 21:55:07,0,0,5
l***k,银牌会员,货真价实，物流迅速，值得推荐。,2017-06-26 20:01:56,0,0,5
晨***5,铜牌会员,第一次网上买手机，看上去很不错,2017-06-24 08:03:03,0,0,5
j***k,铜牌会员,商品狠满意！快递很给力！,2017-08-02 20:41:51,0,0,5
j***w,金牌会员,给老妈买的，很好用功能强大！,2017-06-26 22:47:08,0,0,5
陆***_,PLUS会员,买了好几台给家里人用，特别好,2017-06-22 14:22:15,0,0,5
靑***萌,银牌会员,不错不错，我买了，我弟弟也喜欢，他也买了。,2017-02-25 16:51:46,0,1,5
断***泪,金牌会员,给姑妈买的，她非常喜欢。他说实惠又好用。,2017-03-04 13:29:03,0,1,5
爱***6,钻石会员,发货有点慢，手机还可以。,2017-06-23 21:45:10,0,0,5
j***2,银牌会员,手机很好，物流速度也很快，挺满意的！,2017-03-12 14:45:38,0,1,5
前***将,钻石会员,超级实惠的价格，京东的东西好，速度力，用起来很舒服，是想要的东西，速度想当的快，京东物流快，质量好，以后就一直在这里买东西了。,2017-06-10 22:41:24,0,1,5
jd137748rzs,银牌会员,使用了一个礼拜，挺好的，安装了12个app会有点卡。赠送的钢化膜很脆，裂开了，送的透明外壳挺好，。自己花了5块钱又买了一张钢化膜，2块钱买了一个壳。,2017-06-17 20:12:52,0,1,5
谷***晨,PLUS会员,虽然手机很便宜但是用起来挺不错的，系统很流畅.屏幕亮度合适，待机时间比较长，双卡双待，像素也挺好,2017-05-03 21:19:30,0,0,5
j***d,银牌会员,给我妈买了个，用用挺好的,2017-06-07 18:15:50,0,1,5
淡***光,钻石会员,很好，一直信赖京东。。,2017-06-18 08:55:28,0,0,5
星***郎,PLUS会员,非常不错  物美价廉  用着还可以 没啥其他大毛病  就刷刷评论而已  非要这么多字 真心麻烦,2017-08-05 01:49:44,0,0,5
j***0,钻石会员,质量好，用了段时间来评价的,2017-04-17 12:55:05,0,1,5
拥***8,金牌会员,给老大买的，小米就是好,2017-02-10 10:20:18,1,1,5
古***运,铜牌会员,打算送给母亲的生日礼物，可是时间比较晚了，所以就当做是迟到的礼物，想喜妈妈喜欢。但是一直卡机打电话也不太正常。不过一分钱一分货，可以理解,2017-06-23 17:23:23,0,0,5
j***1,铜牌会员,手机不错，性价比很高，功能齐全，容量也够用，京东的快递很快就到了，下次还会选择在京东购物～,2018-02-11 09:31:32,0,0,5
吥***伤,金牌会员,手机真是太好了了，过年给家里老人用的，手机屏幕非常清晰，操作也很流畅，就是运行内存有点小,2018-02-25 22:23:59,0,0,5
欧***象,PLUS会员,东西收到，很满意!!真的是超级好，客服解答疑问不厌其烦，细致认真，关键是东西好，而且货物发得超快，包装仔细，值得信赖!,2017-05-19 20:48:38,0,1,5
j***3,铜牌会员,性能还好，外观也不错,2017-04-17 17:33:17,0,1,5
我***称,金牌会员,"屏幕合适，配件齐全，未开封手机，官网查询是正品。新机反应蛮快，赞一个。
用一段时间再来追评。",2017-06-06 16:34:25,0,1,5
p***r,PLUS会员,可以、支持国产、6666666666,2017-05-02 19:40:26,0,0,5
j***e,PLUS会员,手机用的是真不错，质量非常好，我们都喜欢，下次一定还来买，质量这么好的，非常喜欢，非常好用的手机,2017-10-07 08:47:28,0,0,5
j***5,铜牌会员,"手机可以不错，把我以前的坏手机以
也拿去了，说是**的，到现在还没把ku款打过来",2018-02-23 17:44:23,0,0,5
7***莲,钻石会员,第一次在京东上买手机，还是第三方！不过东西还是很不错的，运行速度很快，！送的东西也挺好的,2017-06-21 12:09:46,0,0,5
y***i,钻石会员,还不错   给别人买的,2017-03-07 12:53:26,0,1,5
sEfzpmFXrEOw,铜牌会员,这家店老板诚实，真的该他发财，手机比实体店少三百多元。全网通和合约机分得很清楚。我觉得这次网购心情愉快。深圳龙岗坪地快递员赵小华服务态度好。,2017-03-04 12:08:39,0,1,5
中***信,钻石会员,性价比高，动作快，非常不错的,2017-06-11 09:30:17,0,1,5
飞***翔,钻石会员,性价比高，动作快，非常不错的,2017-06-11 09:28:12,0,1,5
j***4,钻石会员,之前给老家亲戚家阿姨买了一部，这次她侄女要我给她买一部，觉得京东上的手机质量靠谱儿,2018-01-23 12:40:53,0,0,5
j***8,金牌会员,嗯不错，给家里老人买的，以为年前到不了，没想到到了，好好好，就是没有膜和套套,2018-03-04 13:56:26,0,0,5
孤***爍,PLUS会员,特别满意的一次购物，宝贝质量非常好，朋友们都说不错，推荐大家购买！！！！超赞！！！！,2017-11-30 23:50:01,0,0,5
j***w,银牌会员,手机不好用。买了后悔了,2017-06-19 16:19:55,0,0,4
1***涛,铜牌会员,手机还可以速度还可以,2017-07-03 15:54:23,0,0,4
j***l,铜牌会员,才开始用，手机给老婆用的，看样子挺喜欢的，赠品与下单所描述一样  满意。信号有一点点不好，希望推荐一些信号强大的品牌手机。,2017-03-04 22:30:06,1,1,5
天***依,PLUS会员,价格实惠，发货速递很快，比店里的价格便宜不少呢，快递送货速度很快，服务态度很好，非常满意的一次网购。,2017-06-10 18:40:20,0,1,5
小***b,银牌会员,手机买来之后很满意，颜色很亮丽，大小很合适，手感也很不错，像素运行速度都还可以，这个价格买这款手机很划算，买个老妈的，老妈很满意。,2017-03-10 15:46:59,0,1,5
林***剑,PLUS会员,这个价位经常实惠，老妈很喜欢，我妈妈就聊聊微信打电话，不怎么上网，这款很合适。,2017-11-01 01:06:48,0,0,5
j***0,银牌会员,手机收到啦～挺好的～和图片上的一样～暂时满意！用用再看～希望越用越好～嘿嘿～好了还会光顾哦！五分好评～,2017-04-17 21:08:31,0,1,5
紫***v,PLUS会员,反应很快  很好用  一下买了怎么多 说明真的真的很不错  价格也实惠,2017-12-29 12:09:52,0,0,5
贱***-,PLUS会员,给邻居的阿姨买的，他都不相信网上可以买手机,2017-09-20 17:11:30,0,0,5
钢***管,银牌会员,还好，可是我在京东上买的时候 上面提示晚上十一点前买   ，第二天到账   但是实际上第三天才到    还行吧,2017-07-14 15:11:03,0,0,5
j***4,银牌会员,手机收到了，但是为什么我要的是移动版本给我的却是全网通版本？？差价的20块能给我退回来吗？,2017-12-23 10:51:33,0,0,5
j***妸,钻石会员,手机买给婆婆的，暂时没发现什么问题，就是还不太会用，慢慢教吧，机子还是不错的，速度也挺快，玫瑰金的很漂亮呀！,2017-08-01 08:32:49,0,0,5
j***5,铜牌会员,手机还可以，就是打电话有点问题，有时候打不出，不是没信号，就是还没有打通就自己挂了，然后快递有点烦，还这样的态度，不想说了,2017-04-01 13:15:37,0,1,5
l***a,钻石会员,京东是个好平台，最喜欢京东买东西，都是正品，家里都是京东的东西了，希望京东可以保持纯正品质！,2017-06-10 18:43:07,0,1,5
O***h,铜牌会员,给婆婆买的，用过才来评价的，反应不是很好，不过用来接打电话还算可以,2018-01-22 22:15:02,0,0,5
j***n,银牌会员,还可以，不知道耐不耐用，用一段时间再看，唯一的就是没有刚莫，和手机壳,2018-01-05 21:00:35,0,0,5
j***s,PLUS会员,还不错?效果还行,2017-03-20 11:19:40,0,1,5
彭***5,PLUS会员,买给老人家的，手机小巧价格实惠，运行速度在这个价位来说，满意！好评！,2017-12-01 11:49:39,0,0,5
c***9,PLUS会员,家里的5还都在用呢，苹果系统就是好，用久也不会卡爆，人手一个街机了,2017-12-14 06:19:04,0,0,5
j***8,银牌会员,手机很不错,2018-02-24 13:44:04,0,0,5
2***q,PLUS会员,"红米4A 双卡双待4G手机 香槟金 全网通(2GB RAM+16GB ROM)标准版
¥608.00",2017-05-01 08:34:23,0,0,5
j***d,铜牌会员,很好，给婆婆买的,2017-03-03 15:56:10,0,1,5
j***c,铜牌会员,手机很轻，没有手感，给老妈买的，不安装什么大软件，用着还是可以的,2018-01-18 16:04:09,0,0,5
j***b,金牌会员,不知道为什么颜色不一样里面装的东西也不一样，总感觉是翻新的,2018-02-25 16:34:40,0,0,5
j***0,PLUS会员[试用],用了这段时间，确实很吻合小米一贯的性价比很高的风格，物有所值。上手手感好，发热并不明显。此外，配送员大叔服务态度超赞！！?,2017-02-02 14:09:24,0,1,5
伊***9,金牌会员,手机太轻了，开机就加了很多应用。买后悔了，客服态度不好，这里不支持7天无理由退货吗？真是后悔！还拍了两部！,2017-06-20 21:15:36,0,0,5
独***5,银牌会员,宝贝收到了，感觉很好，很不错，我儿子是小迷谜，我是红米的忠实粉丝，不错，很满意的一次购物，下次还会光临。,2017-06-29 06:11:00,0,0,5
j***o,银牌会员,买给老妈用的，用了一段时间才来评价，总得来说:物有所值！,2018-03-02 16:22:17,0,0,5
樱***6,PLUS会员,手机不错。我着还是比较顺畅。比起同级别的手机。性价比还是可以的。,2017-12-04 22:08:43,0,0,5
j***c,金牌会员,很棒！喜歡,2018-01-27 13:05:24,0,0,5
j***d,银牌会员,这手机不错，500多元能买到这么不错的手机，已经狠满足了。,2018-02-11 00:56:25,0,0,5
j***d,银牌会员,感觉还可以。就去快递太不给力了。用了手机。手感比较轻。产品应该是行货。就是没有防伪码，官网查询了。是行货。没有去客服,2017-03-12 10:03:45,0,1,5
U***U,银牌会员,手机是给儿子买的就是物流的速度太慢了，等了六天才收到，,2018-03-06 09:15:16,0,0,5
蛋***c,PLUS会员,不错的手机,2017-12-22 23:31:12,0,0,5
大***罗,PLUS会员,音质很好，价格不贵，非常满意,2017-05-09 13:26:23,0,1,5
任***潮,银牌会员,东西回来了，还行，商家服务态度也很好，就是物流有点慢了。。,2018-01-28 18:00:41,0,0,5
张***林,银牌会员,商品收到好多天了，由于出门，所以评价不及时！不过，手机已经在用了！给朋友买的，说是用着不错！不过没法拍照片了哦！,2017-03-31 08:13:15,0,1,5
小***烧,钻石会员,老年机中的神机，价格实惠性价比很高，京东快递送货靠谱，好评。,2018-01-08 15:35:20,0,0,5
罗***茶,银牌会员,买给朋友的,2018-01-07 15:36:12,0,0,5
j***、,银牌会员,已经购买3台了，给爸妈用，质量很好，值得信赖，快递很给力。,2018-01-22 07:57:24,0,0,5
j***6,金牌会员,商品不错   目前刚拿到感觉还可以    以后用的好在晒单,2018-01-15 10:13:47,0,0,5
黄***8,金牌会员,东东不错，一直在用，相信京东！！！！！配送态度非常的好，随时提问，都能解答，非常好的配送！！！赞一个！！！,2017-05-06 19:40:06,0,0,5
素***2,PLUS会员,挺好的。。。。，miui8挺不错的，待机也可以很久，好，好，好。,2017-10-27 23:18:45,0,0,5
j***8,银牌会员,东东好，很想哭啊啊啊啊啊啊吧台风，快快来吧我们是一个星期四，空军建军节斤斤计较叽叽叽叽滚滚滚哈哈哈不好好呵呵哈哈哈,2017-02-24 13:03:09,0,1,5
j***d,PLUS会员,买给婆婆的，她就想去买菜扫码支付，回来开心极啦，反应快，,2017-12-21 14:49:20,0,0,5
L***0,PLUS会员,手机不错，是正品，大家可以放心购买。,2018-01-06 21:46:26,0,0,5
j***k,银牌会员,给老人用的很好用，颜色很漂亮，下载了几个软件也没卡，很好用的一款手机，学生老人必选！,2017-10-04 14:30:23,0,0,5
j***6,银牌会员,小米的产品值得信赖，现在全家都在用国民小米手机。,2018-02-28 09:50:36,0,0,5
j***a,钻石会员,还行吧，送给老人家用的。没装什么程序，运行还可以！,2017-08-05 15:15:37,0,0,5
j***r,银牌会员,这次买的手机还好吧，几百块钱的东西能达到这么好已经算是不错了，强烈推荐这部手机,2017-11-04 08:28:49,0,0,5
j***x,钻石会员,"小米4A 红米4A 双卡双待4G手机 玫瑰金 移动版(16GB ROM)
¥569.00",2017-06-11 12:50:34,0,1,5
静***欣,PLUS会员,第三方的快递是慢了些不过东西还是不错  比自营的便宜一点  用过后才知道试试,2017-06-11 02:02:07,0,1,5
贾***黎,PLUS会员,老妈用的不错，适合老人们用,2018-02-27 21:26:09,0,0,5
j***、,银牌会员,这是第三次购买了，质量没得说，商家服务态度很好！,2018-02-12 21:39:45,0,0,5
j***o,铜牌会员,非常喜欢?挺好的一点也不卡挺快的，快递员很热情。,2018-01-28 01:50:46,0,0,5
老***伤,PLUS会员,卖家服务非常好，非常愉快的购物谢谢京东，谢谢卖家，卖出这么好的产品！,2017-08-10 18:25:58,0,0,5
j***j,PLUS会员,物流速度不是太给力，机器还行,2018-02-08 20:39:21,0,0,5
e***2,金牌会员,物流慢得像蜗牛，贴膜一天就掉了，最不如意的一次购物,2018-01-22 17:31:14,0,0,5
j***7,PLUS会员,不错，搞活动的时候给老人买的，非常划算，值得推荐，手机用着不错，一家人都用小米手机,2017-04-10 15:10:13,0,1,5
M***2,PLUS会员,已收到，和卖家描述的一致，发货很及时，很给力，赞一个！！！,2017-10-16 13:02:24,0,0,5
哈***虫,银牌会员,买给妈妈用的机子，用起来还不错，唯一不足的是送的手机套背面被戳了个小洞，其他的比较满意。,2017-07-27 13:43:44,0,0,5
j***x,银牌会员,手机用了几天才来评价，挺不错的，唯一的一点就是本机自带软件太多，其他都很好，棒棒的第二次在京东买手机靠谱！,2017-02-19 17:51:28,0,2,5
j***f,PLUS会员,东东物美价廉，物流给力，谢谢客服的耐心讲解，总之一个字，好！两个字，真好,2017-06-11 19:26:12,0,1,5
荣***a,PLUS会员,小米4A 红米4A 双卡双待4G手机 香槟金 移动版(16GB ROM),2017-06-11 09:46:27,0,1,5
荣***a,PLUS会员,小米4A 红米4A 双卡双待4G手机 玫瑰金 移动版(16GB ROM),2017-06-11 09:45:13,0,1,5
m***5,金牌会员,小米手机就是好啊，价格便宜又实惠，下次还会来买的。支持小米,2017-10-01 22:55:52,0,0,5
