名字,会员级别,评论内容,评论时间,点赞数,评论数,评价星级
j***a,PLUS会员,用了一段时间才来评价东西不错，很满意，待的时间也长。,2017-12-31 17:41:16,0,0,5
杰***斌,PLUS会员,一直上京东商城网购，东西非常不错，价格便宜，物流快，是正品,2017-11-13 22:34:51,0,0,5
j***3,银牌会员,买这部手机感觉划算！电池比以前的手机耐用多了！功能性也不错！音乐好像是立体感的！超棒,2017-09-27 08:01:36,0,0,5
十***糖,银牌会员,用了几个小时，感觉还是不错的。比起新出的红米5plus，有快充，好大。?,2017-12-14 08:20:28,0,0,5
我***x,金牌会员,非常好，很喜欢，这款手机喜欢很久了，正好换手机就换了。,2018-01-10 21:17:45,0,0,5
L***麻,铜牌会员,还可以吧   感觉也不耐电 没有别人说的那么好 喜欢拍照不要买这个 玩游戏还可以,2017-10-23 20:44:45,0,0,5
z***8,银牌会员,收到了还没拆开,2017-10-21 17:56:47,0,0,5
s***0,PLUS会员,屏幕大，省电，耐用，这是最大的优势。缺点是处理器不行吧，性能相对于这个价格来说，很不错了。,2018-02-02 14:14:41,0,0,5
5***韵,钻石会员,很好，正品，第三次买这款机子了，屏幕大，电量大，屏幕画面也清晰，价格也有优势。,2017-10-31 11:23:44,0,0,5
云***8,PLUS会员,宝贝收到了，物流很快，好评！,2018-02-12 14:36:49,0,0,5
j***7,PLUS会员,刚开始的时候不太适应，但是现在真心爽，看直播太过瘾了,2017-12-16 00:31:41,0,0,5
j***7,银牌会员,物流非常满意，只是除了充电线什么都没有配有有点小失望,2018-01-13 08:58:36,0,0,5
j***1,钻石会员,专门用了两个月再来评价，非常好用，超长待机，这是买的第二个了,2017-12-31 10:39:08,1,0,5
风***雷,PLUS会员,还行，黑色出来了，早知道买黑色的了，不过还可以，将就用，,2017-11-09 09:03:15,0,0,5
y***9,金牌会员,大爱，屏大，电池好用，基本上三天一充电，关键价格不高,2018-01-07 10:59:16,0,0,5
明***毡,PLUS会员,东西不错，送人来的！！！！,2018-02-19 19:23:18,0,0,5
j***4,金牌会员,帮别人买的，买之前非常担心质量问题，用了一段时间还没有不好的信息反馈。,2017-12-24 15:53:16,0,0,5
j***l,银牌会员,宝贝很不错，特喜欢，6.44大屏看着不错，第一次用小米，如果可以以后会多考虑的,2017-10-20 08:53:59,0,0,5
j***2,PLUS会员[试用],屏幕大，手感好，用的不错,2018-02-28 12:24:21,0,0,5
b***6,钻石会员,除了太大，电池真心好用。开省电模式可以扛两天，本人不怎么游戏就刷刷新闻而已。,2017-10-29 18:23:40,0,0,5
t***M,铜牌会员,货真价实。又一次很满意的购物，下次还选京东！,2018-02-25 04:27:31,0,0,5
j***5,钻石会员,第二次帮朋友买，都 说不可以，就是商什么都不送！！,2018-01-08 08:45:06,0,0,5
p***n,金牌会员,还阔以，发货速度快，之前用的是一代 现在换二代到手就升级系统了，可以分屏。,2017-11-07 20:45:58,0,0,5
1***m,金牌会员,发货很快，没有网友说的那些问题，就是手机太大了有点不适应,2017-10-16 09:21:29,0,0,5
j***0,银牌会员,这款手机用了近半年了，过年了给家里老人送上两部…,2018-01-30 13:55:21,0,0,5
j***e,铜牌会员,小米max2，不一样的存在。你值得拥有，哈哈哈。货到了，非常不错。,2017-12-31 11:50:30,0,0,5
jd_4767272,PLUS会员,很不错，屏幕超大，看起来很爽,2018-01-09 21:25:59,0,0,5
7***m,PLUS会员,包装不错.没有剪卡器还没用，就是连耳机都没有希望包装里面有个配套的剪卡器就好了,2017-09-22 14:19:16,0,0,5
伊***空,PLUS会员,手机正品，作为奖品发放的,2018-02-03 20:29:33,0,0,5
卡***人,PLUS会员,屏幕无敌大，老爹很喜欢！,2018-02-02 11:02:03,0,0,5
j***9,银牌会员,一直用小米手机，质量很好是正品，希望小米越做越好,2018-01-01 11:18:07,0,0,5
j***1,金牌会员,速递给力，用了几天很不错，相信京东！相信小米,2018-01-30 14:52:11,0,0,5
j***y,银牌会员,手机真的不错。玩王者荣耀不卡。流畅。电池蛮耐用。唯一的遗憾是没送个手机膜,2017-10-29 21:02:30,0,0,5
j***0,银牌会员,宝贝收到，用了好几天，不错。满意。,2018-01-26 19:51:28,1,0,5
鑫***行,钻石会员,大屏，不错，续航手机，反应也快，真的不必比苹果差，支持国产，就是声音怪怪的,2017-10-11 22:20:57,0,0,5
j***h,钻石会员,刚用还可以，速度比较快，具体情况过几天后再说。,2018-01-10 14:33:31,0,0,5
s***g,PLUS会员,一直再京东上买各类生活用品，方便至极，信赖京东,2017-12-11 20:27:25,0,0,5
任***2,PLUS会员,屏幕太大  别的都挺好,2018-02-06 18:14:57,0,0,5
x***v,金牌会员,用了几天评价 电池很耐用  屏幕是真的很大,2018-02-06 13:47:20,0,0,5
j***f,银牌会员,，物流快，屏幕大，电池更持久，玩游戏也很OK，,2018-01-06 09:11:30,0,0,5
j***u,银牌会员,一般般凑合用，什么赠品都没有，耳机也没有配。,2018-01-20 23:19:45,0,0,5
待***格,PLUS会员,京东东西就是好，京东物流就是快，京东就是这么给力！,2017-11-07 07:37:16,0,0,5
uiiii,钻石会员,小米的手机还是比较靠谱，电池够用，唯一的问题就是大了点，但看电影很不错,2017-11-02 19:31:36,0,0,5
j***i,银牌会员,是正品，好满意，黑边没有想象的宽，电池耐用。,2018-01-12 16:19:30,0,0,5
j***x,PLUS会员,机型我蛮喜欢，我要的是标配，咋不给个刚化膜么！,2017-11-27 13:46:40,0,0,5
时***伤,银牌会员,各方面斗都挺好，就是有一点不足之处，没有耳机,2018-01-09 22:18:19,0,0,5
j***h,银牌会员,此款机首次用感觉不错，特别是快递速度惊人之快，态度很好！京东直得信赖。,2017-10-23 11:24:05,0,0,5
马***国,银牌会员,刚买回来几天，用起来非常顺手，很是喜欢，尤其是看电视。大屏幕，更清楚,2017-11-05 10:15:29,0,0,5
y***1,钻石会员,买的时候算便宜的，很大，很好用。用了后再看小手机就没啥感觉了。,2017-12-23 10:03:00,0,0,5
内***o,铜牌会员,物流很快，第二天就到了。手机也很好，屏幕大看的很清楚，价格也很实惠，总之非常棒。,2017-07-31 11:48:11,0,0,5
j***p,PLUS会员,给妈妈买的，大屏幕，高性价比，妈妈不用戴眼镜了,2017-11-20 08:36:16,0,0,5
曹***佳,铜牌会员,用着感觉挺好的，就是屏幕大了，比我想像的大，一只手玩吃力，其他都挺好,2017-11-04 10:21:20,0,0,5
j***a,PLUS会员,手机应该是全新正器，比官网还便宜，开机正常，操作流畅，暂时没发现问题。,2017-10-18 11:33:28,0,0,5
牧***灭,金牌会员,刚到手，确实是大。max，还不知道用着怎么样,2018-01-02 16:35:31,0,0,5
刘***0,银牌会员,还不错，挺好的。外观好看，用着也挺好。但是续航能力貌似没有宣传的那么好,2017-10-17 14:24:16,0,0,5
小***壳,钻石会员,全新原包，送货快，性价比高，下次再来。,2018-02-14 08:26:38,0,0,5
z***i,PLUS会员,max2确实手感，做工都还不错，小米继续加油,2017-11-30 12:55:20,0,0,5
j***x,铜牌会员,到手了，京东快递没的说?手机应该是正品,2018-01-27 18:21:00,0,0,5
j***b,铜牌会员,手机是正品全新，没有耳机，原以为有套或者膜送的，老板有点抠门了,2017-12-12 13:02:52,0,0,5
活***2,PLUS会员,支持国产，但是安卓的系统确实头疼，用一段时间就会卡,2017-10-09 13:05:14,0,0,5
j***f,铜牌会员,大屏大容量，喜欢，就和喜欢客服妹子一样喜欢,2018-01-10 14:13:53,0,0,5
j***孒,银牌会员,小米的忠实粉丝，这款Max2用了一个月，相当的不错，玩农药很嗨,2017-12-06 11:51:37,0,0,5
碧***天,PLUS会员,挺好的不错哦习惯性好评，家里老人用的，习惯了,2017-11-18 07:53:55,0,0,5
j***p,银牌会员,货己收到，正在使用挺满意，物流很快感谢谢京东，以后还会光顾本店,2017-12-02 11:46:43,0,0,5
U***娃,银牌会员,东西不错，很好。下次买小米还会继续购买！,2017-12-17 00:37:32,0,0,5
j***1,PLUS会员,之前的上火车被偷了，再买了一个，小偷太可恶了。,2017-10-31 13:03:48,0,0,5
k***2,金牌会员,挺好 回来用了  应该是新机 物流也挺快,2018-01-12 17:12:23,0,0,5
j***b,铜牌会员,用了还可以就是用惯了前面指纹解锁的，这款是后面解锁有点不习惯,2017-12-15 21:49:43,0,0,5
杨***0,银牌会员,手机不错，手感好，物流快，总体来说很好。,2018-01-09 00:30:30,0,0,5
1***p,银牌会员,一如既往的喜欢在京东购买电子产品成电器，质量保证，送货快，希望越来越好,2017-09-21 10:02:04,0,0,5
j***r,银牌会员,屏幕很大，运行很流畅，看视频很好，不卡。,2018-01-06 18:01:41,0,0,5
j***6,金牌会员,手机还挺好用，屏幕够大，就是快递稍微慢了一点点，总体还是五星好评！,2017-10-21 16:48:07,0,0,5
q***p,PLUS会员[试用],"收到，发货很快，第二个max2,还是不错的手机。推荐购买。",2017-12-22 11:11:23,0,0,5
f***4,金牌会员,买回来用到现在暂时没有发现异常，好评！,2018-01-17 18:55:14,0,0,5
j***3,PLUS会员,除了物流快，还是物流快，物流快，物流快，物流快,2017-11-02 10:58:49,0,0,5
j***x,银牌会员,电池很给力，屏幕大，看视频很舒服,2018-02-28 08:37:42,0,0,5
j***v,金牌会员,收机收到了，打开一看特喜欢，下次还会购买,2017-11-30 10:40:27,0,0,5
j***e,银牌会员,手机很好物流很快非常愉快的一次购物给你一个赞！,2017-10-12 17:10:37,0,0,5
自***哟,银牌会员,绝对真品   大屏用着确实爽   续航也给力  爱不释手哟,2017-12-13 23:24:34,0,0,5
久***武,银牌会员,手机不错 玩游戏很卡 本来就是买来玩游戏的 结果很卡 上当了,2017-11-26 10:55:08,0,0,5
6***峰,钻石会员,一直京东购物 一如既往的给力 物流又快又好 希望越来越好嘿嘿,2017-11-25 01:28:06,0,0,5
御***影,金牌会员,手机很好！外观漂亮实用！支持！,2018-03-05 10:14:25,0,0,5
坐***码,PLUS会员,老人家用不错，屏幕够大！很好！！！！！,2017-12-06 19:48:17,0,0,5
j***o,银牌会员,手机屏幕超大，而且用电量超慢，但是充电也慢，总的来说还不错?,2017-11-05 09:47:18,0,0,5
j***8,铜牌会员,实际内存只有2G，忽悠老百姓啊,2018-03-02 13:59:10,0,0,5
吉***晨,银牌会员,由于我用这个手机拍的照没法拍机子本身 所以拍个外包装。机子很薄很大。玩起游戏看电影比较爽。这种大机子别看大但是一点不笨重。很轻薄。但是打游戏好像分辨率有点模糊。不过其他还好。用用再说吧。没有給发票让卖家补发了。这款手机我觉得得买个壳子因为手机很薄容易磕到,2017-08-04 17:21:52,0,1,5
神***主,银牌会员,挺大的，还没用，看视频应该挺爽的,2018-02-12 17:33:37,0,0,5
啦***巴,金牌会员,电池挺耐用，目前用着都挺不错的,2018-02-26 01:52:57,0,0,5
j***w,金牌会员,小平板电脑。用来玩游戏，大小合适。,2018-01-25 21:40:09,0,0,5
h***g,PLUS会员,手机不错，就是待机还是不尽人意，一天一冲,2017-11-11 11:56:28,0,0,5
f***F,银牌会员,物流很快，产品不错，超大电量。,2018-02-23 08:36:13,0,0,5
M***W,铜牌会员,手机还可以。唯一的不好就是没有赠品送……有点失落,2018-01-09 17:52:08,0,0,5
q***6,PLUS会员,电池大续航能力强，屏幕大视野开阔，好用。,2017-11-09 07:04:11,0,0,5
j***u,银牌会员,老婆很喜欢，成功帮老婆从果粉转为米粉,2018-01-09 00:07:46,0,0,5
j***0,铜牌会员,物流有点慢，质量还是很好的。,2018-03-06 16:38:16,0,0,5
蚊***b,金牌会员,用上手还是不错的 可以的宝宝可以上手,2018-01-05 20:11:08,0,0,5
j***u,银牌会员,此用户未及时评价，系统默认好评。,2018-02-03 03:25:55,0,0,5
j***d,银牌会员,手机用着确实可以电亮超级顶一点也不卡,2018-01-02 10:42:50,0,0,5
j***9,银牌会员,此用户未及时评价，系统默认好评。,2018-01-30 09:15:22,0,0,5
d***9,PLUS会员,给朋友买的。货已经收到了，感觉不错，送货及时,2017-09-29 20:19:30,0,0,5
X***1,钻石会员,买了好几个Max了，性价比较高,2018-02-12 14:19:45,0,0,5
j***f,银牌会员,质量很好，用的放心，物流很快。下次继续购买给一个好评吧。,2017-11-29 03:15:44,0,0,5
j***0,银牌会员,好，就是开始时不知怎么用，，，，，，，，，，，，，，，，，，。,2017-10-11 09:15:39,0,0,5
九***帝,银牌会员,总体还是可以，运行速度也不错，就是听歌的音质不是很好。,2017-12-12 08:37:13,0,0,5
j***5,金牌会员,五星神机，小米的手机真心不错！,2018-02-07 22:17:48,0,0,5
H***比,钻石会员,非常好用的一款手机，超级喜欢这个，用一段时间看看如何？,2017-12-11 13:05:36,0,0,5
冬***雨,PLUS会员,"不错,用券之后还可以，小米大屏，看电视不错",2017-10-09 08:10:08,0,0,5
j***c,银牌会员,手机很好用着一点也不卡，屏幕很大很过瘾！！价钱很公道,2017-12-24 06:28:18,0,0,5
j***e,银牌会员,运行速度很快，拍照很清楚！,2018-03-05 18:54:10,0,0,5
暗***手,PLUS会员,帮邻居买的。小米的确不错。价廉物美啊。。,2017-10-21 09:32:44,0,0,5
1***4,银牌会员,屏幕就是大！！！老婆很喜欢！,2018-02-16 22:35:12,0,0,5
j***j,银牌会员,手机是不错，买的时候没注意看，屏幕太大了！,2017-12-21 10:53:54,1,0,5
夏***怡,银牌会员,真的还不错，准备再买一个送人！,2018-01-31 12:51:55,0,0,5
j***s,金牌会员,屏幕很大，系统运行挺快的。,2018-03-01 14:01:32,0,0,5
l***0,银牌会员,手机4G/128G不错，用起来银顺手，支持小米。不过没耳机，太扣！,2017-08-30 09:42:42,0,0,5
钢***猫,银牌会员,手机收到了试了一下不错，手感好手机轻，速度快，物流也快。,2017-11-14 14:54:17,0,0,5
x***a,钻石会员,给儿子买的，他很满意，速度快。,2018-01-25 17:51:44,0,0,5
g***x,银牌会员,非常漂亮的手机，价廉物美。,2018-02-23 22:53:00,0,0,5
大***师,钻石会员,一直都在用小米的手机，换一个还是选小米。电池大必须的,2017-12-13 12:19:02,0,0,5
流***1,PLUS会员,质量很不错，运行速度快，手感好，特别满意,2017-10-09 13:00:19,0,0,5
j***a,银牌会员,用了2个星期了，是正品总体还不错，就是电池没有说的那么邪乎,2017-10-24 16:31:58,0,0,5
j***x,金牌会员,电量十足，玩游戏不卡  信号好,2018-01-22 16:45:20,0,0,5
莫***苦,金牌会员,手机到了，很好！,2017-10-06 13:54:34,0,1,5
j***s,钻石会员,运行流畅，不卡不死机！！！！,2018-02-05 08:34:50,0,0,5
j***y,PLUS会员,价美物廉不错的。大屏适合老年人用,2017-12-08 23:06:06,0,0,5
j***迩,银牌会员,发货快，屏幕大，有点卡，其它还行,2018-01-06 09:54:14,0,0,5
左***帅,银牌会员,正品，电池非常耐用，性能还可以，非常满意的一次购物,2017-12-24 03:05:54,0,0,5
w***r,PLUS会员,用起来超赞，性价比高，老人用着合适！,2017-11-05 20:02:31,0,0,5
x***2,银牌会员,给老妈买的，屏幕那是相当大，她这回一定能看清楚了。,2017-12-17 09:17:56,0,0,5
j***3,金牌会员,孩子喜欢，一直都用，价格便宜，真的不错。再次购买。,2017-12-17 08:15:05,0,0,5
j***9,铜牌会员,今天刚收到手机，现在看起来挺好的，也好用，挺喜欢的。,2017-11-30 22:14:19,0,0,5
已***说,钻石会员,运输有点久。别的都挺好的。,2018-02-11 07:41:17,0,0,5
j***7,银牌会员,不错，还没有开始用，感觉不错,2018-01-23 18:55:30,0,0,5
翔***埕,PLUS会员,已使用，感觉不错，比较大，适合老人使用,2017-10-08 21:35:09,0,0,5
浩***2,铜牌会员,手机不错！物流也快！满意！,2018-02-06 14:58:04,0,0,5
浪***心,铜牌会员,像素挺高的   续航也很久,2018-02-05 20:56:46,0,0,5
1***y,金牌会员,24小时之内就到了  物流给力,2018-01-06 12:40:53,0,0,5
g***0,银牌会员,东西收到，已经用了几天，很好用，就是物流慢点，信息更新也慢。,2017-09-18 21:36:02,0,0,5
j***e,银牌会员,第一次买小米手机，屏幕大，用起挺舒服的。。。。。。。。,2017-11-02 23:10:55,0,0,5
聆***音,银牌会员,还是信赖小米，超喜欢max2，外形大气，能量满满！点赞！,2017-10-17 21:30:19,0,0,5
j***w,铜牌会员,正版  速度够快  不错不错,2018-01-17 13:54:48,0,0,5
h***3,铜牌会员,手机收到，背后指纹识别不行，什么一碰都能唤醒屏幕。准备换,2017-10-15 13:54:29,0,0,5
z***3,金牌会员,很薄，屏幕很大，给家人买的,2018-01-29 09:45:36,0,0,5
j***d,银牌会员,很好用      物流也快,2018-01-27 16:05:16,0,0,5
城***处,银牌会员,手机很好，就套了个薄胶套，掉了好几次一点事都没有！？,2017-11-13 21:08:47,0,0,5
j***v,银牌会员,非常好的手机商家也很不错,2018-02-10 10:30:51,0,0,5
j***0,银牌会员,手机有问题，经常打电话时候里面会有敲锣的声音，哒哒哒的声音，,2017-09-09 17:50:33,0,0,5
j***a,银牌会员,嗯嗯，还行不错屏幕真大。,2018-02-07 21:27:45,0,0,5
波***r,银牌会员,偏低的价格带来的体验真的超乎想象！用起来感觉很顺手！,2017-11-10 15:45:36,0,0,5
j***s,银牌会员,手机已经用了半个多月了，感说还很好用，谢谢宗东,2017-12-26 21:58:34,0,0,5
u***f,银牌会员,看片有点不顺(气他还可以),2018-01-21 08:15:56,0,0,5
卡***0,银牌会员,很好，第二个了，一直不错的，物流也很快！会一直关注的,2017-11-08 09:09:30,0,0,5
灵***尾,银牌会员,手机屏幕超大，玩起来特别带劲,2018-01-06 10:33:47,0,0,5
叶***武,银牌会员,屏幕很大，电池很耐用，速度很快，性价比很高的一款手机,2017-11-06 16:30:56,0,0,5
n***成,金牌会员,收到货就试用了，感觉不错,2018-02-04 08:59:09,0,0,5
x***5,钻石会员,不错昨天晚上10多下单，今天出门9点多就到货了，支持国货,2017-10-05 17:29:11,0,0,5
h***d,金牌会员,使用了一段时间才评价，确实不错，物超所值，速度也很快。,2017-10-21 10:12:17,0,0,5
j***f,铜牌会员,手机挺快的 比预计时间快了一天  刚拿起用  感觉还行,2017-10-18 18:43:15,0,0,5
j***a,银牌会员,手机好评，系统流畅，充电快速,2018-01-02 14:46:23,0,0,5
j***4,钻石会员,没拆来看，给别人买的！！！我要买的话必须支持华为！！！,2017-10-16 23:11:07,0,0,5
契***师,金牌会员,手机很好，感觉并不是很大，用起来速度快，没滞后感。,2017-11-16 15:48:07,0,0,5
j***z,金牌会员,东西不错，手机挺好用的，电池可以用2天，声音很够大,2017-11-15 23:09:16,0,0,5
l***0,钻石会员,京东一如既往的好和快，手机屏很大，用着也挺流畅！,2017-11-30 23:13:29,0,0,5
小***爱,PLUS会员,商品不错，送货就是快，好评。,2017-11-30 08:19:10,0,0,5
r***n,钻石会员,超级好用，物流超快，品质有保障，以后常来太牛了吧,2017-11-27 14:24:40,0,0,5
z***1,银牌会员,不错，刚拿上就用了??,2018-01-09 17:14:55,0,0,5
h***0,银牌会员,很好，物流很快，晚上下单，第二天就到了，棒棒的,2017-12-11 13:01:27,0,0,5
w***5,银牌会员,物流速度很快，机子是原装正品。比自营店还便宜?！,2017-11-07 08:18:27,0,0,5
1***p,PLUS会员[试用],手机不错，就是玩王者时手机反应速度没有苹果那么快。,2017-11-06 16:14:43,0,0,5
1***p,PLUS会员,还可以，很好。。。。。。,2017-12-21 21:10:55,0,0,5
j***8,金牌会员,为啥连商品清单都没有？,2018-02-02 18:24:40,0,0,5
m***y,企业会员,小米手机确实是很好，特别是大电池，一般可以耐用两天,2017-11-03 21:28:55,0,0,5
j***5,钻石会员,东西不错值得购买，呵呵,2018-01-30 21:09:01,0,0,5
j***s,银牌会员,看中的就是续航和大屏,2018-02-11 11:24:52,0,0,5
火***8,金牌会员,东西很好的，家人很喜欢。,2018-01-12 22:07:00,0,0,5
j***痛,银牌会员,很好东西到手了还可以,2018-02-10 10:28:21,0,0,5
百***娃,PLUS会员,京东活动太给力了，配送速度超快,2017-10-27 21:25:22,0,0,5
j***8,钻石会员,小米手机已经买了六七个了,2018-01-12 08:57:22,0,0,5
酸***羊,PLUS会员,好好好，很大，很实惠，也很好用,2017-10-27 01:50:23,0,0,5
螳***t,银牌会员,手机很喜欢屏幕尺寸大电量充足看视频刚刚好价格优惠值得拥有……,2017-09-07 21:20:35,0,0,5
7***y,金牌会员,屏幕大，物流快，好好,2018-02-04 15:56:40,0,0,5
j***c,铜牌会员,用了一下还可以，就是裸机要是送贴膜或者壳就好了,2017-11-22 08:26:36,0,0,5
孙***伟,金牌会员,屏幕超大，我喜欢，哈哈,2018-01-19 15:03:29,0,0,5
d***k,金牌会员,还不错，性价比很高。,2018-02-01 14:47:10,0,0,5
j***1,金牌会员,还可以，续航能比较强，看电视和玩王者都满意的啦！,2017-11-03 13:43:26,0,0,5
o***7,钻石会员,国产大屏性价比较高的一款手机！还是值得入手的，这价格！,2017-09-16 13:53:04,0,0,5
呵***你,银牌会员,手机用了很不错，手机屏幕很大。?(?^o^?)?,2017-10-31 10:40:10,0,0,5
j***u,银牌会员,手机有预装软件比较多我认为是正品，因为验过机了,2017-11-15 18:04:27,0,0,5
一***逸,PLUS会员,小米手机很不错一直用小米手机,2017-10-31 11:26:14,0,0,5
j***v,PLUS会员,用着不错，下次再买！屏大就是好,2017-10-13 10:59:01,0,0,5
j***3,钻石会员,全金属手感不错，屏幕也大给家里老人买的！,2017-12-30 12:29:25,0,0,5
j***1,钻石会员,比一代强大了很多，手感，性能，都明显提升,2017-12-30 13:08:32,0,0,5
j***情,金牌会员,手机昨天收到屏幕大喜欢反应快电量足五星下次再光临……,2017-10-28 09:00:07,0,0,5
h***0,金牌会员,手机待机时间符合预期，给个赞，其他功能一般,2017-12-13 21:01:04,0,0,5
尹***8,PLUS会员,"质量非常好，与卖家描述的完全一致，非常满意,真的很喜欢，完全超出期望值，发货速度非常快，包装非常仔细",2017-07-29 14:48:10,0,0,5
j***侯,银牌会员,手机收用了二天，还可以,2018-01-07 10:33:52,0,0,5
赤***神,钻石会员,很好用，屏大，速度快，电池耐用，充电特快,2017-12-24 12:04:29,0,0,5
清风_cc,银牌会员,那个分屏怎么搞就搞不懂这个，用了几个星期性能不错,2017-10-22 00:52:34,0,0,5
j***9,PLUS会员,很好用的东西，在用着了,2017-12-05 10:40:18,0,0,5
j***e,PLUS会员,发货时间比预期的快，整体手感还不错，运行速度也不慢，在接受范围内，屏好大，指纹识别挺快的，对得起价格。,2017-06-28 12:05:04,0,0,5
俊***a,银牌会员,京东买电子产品还是可以 手机刚拿到没什么毛病,2017-11-16 22:45:29,0,0,5
3***u,铜牌会员,好用，全新机，就是喜欢屏幕够大。为啥没有发票呢？,2017-10-15 10:46:25,0,0,5
在***受,银牌会员,不错，够大，看着都霸气,2017-12-01 13:14:49,0,0,5
y***5,铜牌会员,很不错得一款，快递得态度也很好，真心不错得,2017-12-03 17:21:41,0,0,5
j***1,金牌会员,手机是帮朋友买的，等他先用一段时间再增加评论,2017-11-14 07:40:47,0,0,5
j***l,银牌会员,小米手机真不错！！！,2018-01-11 20:53:34,0,0,5
j***8,PLUS会员,全新机，做工，材料都很好。,2017-10-24 20:21:21,0,0,5
破***铁,PLUS会员,用到现在了，挺满意的,2017-12-10 19:35:45,0,0,5
莲***丝,PLUS会员,给朋友买的，不错,2018-01-08 01:35:12,0,0,5
r***u,钻石会员,屏幕大，速度不是很流畅，买给老人用的。,2017-12-24 22:07:42,0,0,5
輝***e,钻石会员,不错，细路玩够大够快,2018-01-06 20:36:24,0,0,5
我***懂,银牌会员,手机不错的   很满意 就是屏幕大的过分了,2017-11-23 22:41:19,0,0,5
圣小胖他爸,PLUS会员,手机很不错，老爸非常喜欢。,2017-10-21 11:09:51,0,0,5
t***s,PLUS会员,出乎意料？。。。。。。,2017-11-21 10:11:19,0,0,5
j***h,银牌会员,手机很好用  也是正品 祝老板生意兴隆,2017-12-22 21:10:03,0,0,5
长***俑,PLUS会员,商品不错，物流也给力。,2017-11-20 20:36:18,0,0,5
花***9,银牌会员,我的4年旧手机终于换下来了，小米大屏手机适合我。,2017-10-04 11:27:29,0,0,5
那***里,PLUS会员,真的非常非常好，值得购买,2017-11-04 20:47:40,0,0,5
j***5,银牌会员,我很满意京东快递的服务。买东西上京东。,2017-12-19 20:18:21,0,0,5
T***k,铜牌会员,我对商品非常满意，就是我连不上蓝牙耳机？,2017-12-03 09:50:02,0,0,5
j***s,银牌会员,还可以，看电视玩游戏视频效果不错哈！,2017-12-31 19:33:09,0,0,5
j***y,银牌会员,跟上面说的一样，这手机很好很好用，我是帮朋友买的,2017-09-28 12:19:53,0,0,5
s***X,金牌会员,很好用诶，一直用了好久了，非常支持京东。,2017-11-30 09:18:16,0,0,5
j***8,银牌会员,手机刚回来，用一段时间再来评价吧，送货员服务态度挺好,2017-08-24 06:12:04,0,0,5
j***h,金牌会员,高大上！这样评价一点也不过。而且相机很好照相清楚像素高。,2017-07-20 20:20:36,0,0,5
呐***福,银牌会员,还可以，配送员服务态度很好,2017-12-26 21:57:27,1,0,5
j***b,银牌会员,买给母亲的，后来我女朋友说要和老妈换手机，嘻嘻,2017-10-04 15:22:11,0,0,5
