名字,会员级别,评论内容,评论时间,点赞数,评论数,评价星级
j***c,银牌会员,很好，第二次购买，高端大气上档次。,2017-06-15 18:48:56,0,0,5
j***a,金牌会员,宝贝收到喜欢  不错  物流还行,2017-06-24 09:53:40,0,0,5
妖***姐,铜牌会员,还可以吧！看电视效果不错,2017-08-10 19:46:51,0,0,5
M***a,铜牌会员,收到了！非常感谢我很喜欢这个手机！感谢你们！辛苦快递员在路口特地等我给我快递谢谢！是正品收到了非常喜欢,2018-02-09 12:24:43,0,0,5
j***c,银牌会员,还算可以吧，，,2017-08-03 00:36:07,0,0,5
l***w,铜牌会员,可以，没问题,2017-11-11 00:39:51,0,0,5
黯***_,银牌会员,大屏手机，刚打开挺震撼的，机身手感不错，大容量电池也是很爽，快递比我预算的还要快，客服对我提的问题也解答的挺详细，不多说了，贴膜去。,2017-08-14 11:19:50,0,0,5
s***p,金牌会员,手机下千收到，国庆期间京东物流依然快捷，相比我在其它点上买的东西5天以上还收不了货好了很多，感谢京东物流的快递人员。第一次用小米，感觉上还不适当。不过录取指纹，解锁很快。因为不玩游戏追求这款够了。铃声大，通话声也大。很满意，后续追加使用感受吧。,2017-10-06 17:50:24,0,0,5
j***0,铜牌会员,好是好，可是卖家没送贴膜，没有套套，包装那么大的盒子，害得我瞎激动一场，不过总体来说，我还是推荐的，毕竟东西在哪里摆着，sei用sei知道。,2017-10-07 09:09:50,0,0,4
当***人,钻石会员,6存多的手机，屏幕明显拿在手里就一个字：大。不过手感还是不足，只是仍旧是一如既往地WIFI超级差，其他型号手机，同一个WIFI有3格信号不影响使用，但这款只有一格信号还不是很稳定，小米为什么还是这个鬼。,2017-06-30 09:51:18,1,0,4
R***d,PLUS会员,手机很好用，买的第二次了，朋友看着挺实用的手机，外观也喜欢，就多买了，商家赠送的赠品也很好用，喜欢，支持小米,2017-06-21 17:33:08,0,0,5
S***g,PLUS会员,送给妈妈，挺喜欢。买完才发现可以送plus会员换抵用券，亏了…,2018-02-15 13:01:16,0,0,5
徘***镇,银牌会员,用了一个多月，确实不错，电量充足，两天，轻轻松松，一点问题都没，关键是。同款的手机，网速确实是快，玩王者荣耀非常爽,2017-07-15 10:13:44,0,0,5
灰***鬼,钻石会员,挺不错的一次购物，便宜又实惠，送货速度挺快的，玩王者荣耀一点都不卡，屏幕又大，跑分挺不错的,2017-06-26 01:07:22,0,0,5
大***T,金牌会员,手机是正品，整体来说很满意没有毛病，唯一不好的就是下单标注开发票没有开，开箱就个手机。,2018-01-26 00:59:13,0,0,4
妞***w,钻石会员,质量很好正品,2018-02-07 21:20:28,0,0,5
如***见,金牌会员,不错，挺喜欢,2018-01-20 20:22:31,0,0,5
j***r,铜牌会员,年前刚买的，手机还是蛮可以的，只是偶尔反应会有一点迟钝，电板不是我想象的那么完美,2018-02-20 08:11:01,0,0,4
驿***空,金牌会员,怎么没送耳机,2018-01-12 12:32:04,0,0,5
j***b,银牌会员,不错，还可以,2018-01-03 09:24:28,0,0,5
j***d,银牌会员,第二次买很好,2017-11-11 21:10:29,0,0,5
古***晴,PLUS会员,"服务质量好,态度热情,值得推荐!朋友介绍一起买的，收到了，谢谢了",2017-11-01 21:10:44,0,0,5
骨***龙,PLUS会员,原装正货，把我以前丢失的小米手机数据都恢复了，太贴心了。速度也快，好棒！,2017-06-08 23:28:16,1,0,5
M***s,铜牌会员,很好，这物流速度，不到三天到货,2018-02-19 16:50:16,0,0,5
大***宇,银牌会员,这是第二次购买了，用着真的不错，一定得给个好评,2018-01-23 13:56:01,0,0,5
纯***L,PLUS会员,可以可以说好的4g.运存开机2.4系统真牛逼,2018-02-01 10:02:49,0,0,4
钰***客,金牌会员,还行  物流超快  上午下单  下午就到了,2018-02-11 16:07:02,0,0,5
j***u,银牌会员,很可以，电量,2017-12-27 09:28:09,0,0,5
东***森,金牌会员,手机包装一如既往的好，时尚大方，性价比高。质量很好和描述一致，miui系统使用流畅，反应速度很快，外观和手感握持都很好上网非常流畅，拍照清晰，就是配件稍贵，顺丰快递也快！速度很快，全五分好评。 真心不错，好！,2017-06-19 09:35:47,0,0,5
c***q,PLUS会员,卖家真的很不错哦，没想到第三方卖家也真么好了。服务的年代加油、正品,2017-06-28 09:04:10,0,0,5
j***b,PLUS会员,一直喜欢在京东买东西，感觉京东还是挺好的，信任京东，希望越做越好！,2017-06-30 02:14:41,0,0,5
5***宏,钻石会员,暂时用着还行,2017-11-28 14:23:53,0,0,5
1***4,银牌会员,收到了谢谢！,2017-11-20 18:50:42,0,0,5
f***o,银牌会员,手机质量很好,2017-11-09 08:10:38,0,0,5
j***r,银牌会员,是真的，正品,2017-11-08 16:21:44,0,0,5
j***2,铜牌会员,很满意的手机,2017-11-02 22:32:53,0,0,5
j***e,银牌会员,电池续航超强,2017-11-01 18:16:02,0,0,5
j***v,金牌会员,各方面功能一般般，这个价位有这个效果还可以，够用就好,2018-02-25 19:46:13,0,0,4
j***j,银牌会员,小米max2玩王者荣耀不卡非常流畅，音质欠佳有种隆隆的感觉，显示效果细腻，拍照清晰，不输二千旗舰机，屏幕比我原先的oppor7plus大。就是移动和联通的网络不给力4g信号断断续续的…千元机里的王者，,2017-06-09 22:44:29,2,0,5
法***坤,金牌会员,送货速度快。手机拿上手感很好。这样的价钱，不错了。。。。。。。,2017-11-07 07:27:19,0,0,5
j***5,铜牌会员,刚用上，都很不错，感觉电池用电比较快，毕竟屏那么大！,2018-02-12 10:14:22,0,0,4
j***z,金牌会员,货已收到了，很好，太适合我了，喜欢,2018-01-25 21:10:59,0,0,5
d***s,钻石会员,屏幕很大……很大……,2017-10-01 09:31:02,0,0,5
朦***g,银牌会员,手机很喜欢。,2017-09-29 19:01:26,0,0,5
j***z,银牌会员,东西还行，就是物流有点慢，前几天很快，越是快到了越慢。,2018-01-01 09:07:16,0,0,4
j***z,金牌会员,手机还可以。,2017-09-13 18:40:41,0,0,5
A***1,银牌会员,应送保护壳,2017-10-12 17:56:04,0,0,5
h***8,PLUS会员,手机非常不错，屏幕很大，速度很快，很适合玩儿游戏，而且很薄，感觉非常好，就是快递有点慢，为什么从很远的地方来，不像是京东的风格。,2018-02-11 14:50:24,0,0,5
L***少,银牌会员,这个手机还行,2017-08-13 08:16:42,0,0,5
陈***8,铜牌会员,货物保存得非常好，物流非常快，手机保存得也很好，卖家服务态度良好,2017-08-08 01:42:25,0,0,5
y***1,钻石会员,手机不错 屏幕大电量足。适合喜欢看电视剧的老爸,2017-07-02 18:32:14,0,0,5
A***n,银牌会员,派送速度很快，从深圳到包头仅四天。对手机也比较满意，还没使用。,2017-07-20 12:38:04,0,0,5
j***v,PLUS会员,第一次用小米的，真的不错，超出预期,2017-06-26 23:41:18,1,0,5
j***g,PLUS会员,618搞活动买的，合适，，，把朋友介绍进来吧,2017-06-25 23:05:33,0,0,5
j***0,银牌会员,快递超级快，昨天下午下单今天下午就到我会*你？客服态度超好超好我会*你？已经检验过真伪，是真，已经跑过分60000多我会*你？就会运行内存用得太快，刚开机只有2.3G有点无厘头,2017-06-11 19:18:02,1,0,5
梦***媚,PLUS会员,"质量非常好，与卖家描述的完全一致，非常满意,真的很喜欢，完全超出期望值，发货速度非常快，包装非常仔细、严实，物流公司服务态度很好，运送速度很快，很满意的一次购物",2017-07-08 00:02:10,0,0,5
j***1,银牌会员,手机不耗电，打王者也不卡，网络在山里也流畅，内存也多，充电会发烫，但是也不是很烫，刚好。刚买来6.44英寸觉得太大，但是用了一段时间就不觉得大。总之，这款好手机被我买到????,2017-07-20 09:12:55,0,0,5
j***u,银牌会员,看着挺好的，很满意,2018-01-18 10:31:27,0,0,5
j***b,银牌会员,双扬声器特别好，只有用了才知道，小米没毛病,2017-11-03 19:24:38,0,0,5
放***叔,钻石会员,都挺不错的，很满意，希望再接再厉，好好做服务，好好做产品，我们要的不仅仅是产品，还有功能质量，还有服务，不要情怀，加油，我看好你们！加油加油，你们是最棒的！,2017-07-15 14:20:48,0,0,5
j***b,银牌会员,发货快，京东快递值得信赖，还没用。,2017-12-25 18:31:48,0,0,5
会***3,PLUS会员,屏幕大，速度过得去，功能足够使用,2017-12-11 15:44:26,0,0,4
1***7,银牌会员,用了半个月才来评价。续航能力强，比较适合我，不用整天带着充电宝了。拍照略差，毕竟手机便宜。屏幕很大，还在适应性。用的来说，物有所值。,2017-07-05 08:51:51,0,0,5
j***2,银牌会员,第一眼看上去很大，很霸气，看上去非常的清爽。,2017-06-16 10:00:09,1,0,5
j***a,银牌会员,非常满意，昨天收到的到现在还没充电，电量还有百分之80,2017-06-15 13:21:15,0,0,5
j***m,银牌会员,感觉还行，送的耳机貌似不能通话。手机不错。用几天再看看,2017-06-15 14:29:30,0,0,5
梦***2,金牌会员,不错，正在使用中，就是快递不给力。不给好评别怪我。,2017-12-23 09:45:07,0,0,4
依***n,PLUS会员,很好，很不错，价钱好！,2017-06-29 09:09:20,1,0,5
j***u,银牌会员,感觉还不错！价格和配置！,2018-03-02 11:13:10,0,0,4
j***8,金牌会员,就是喜欢这种背面，大屏幕，电池也耐用，京东值得信赖！,2017-06-26 22:16:05,0,0,5
伍***生,银牌会员,很大，很好用，性价比很高,2017-06-07 14:46:43,1,0,5
j***u,PLUS会员,手机屏幕超级大，送情人合适不？,2017-07-02 12:52:00,0,0,5
蒙***军,PLUS会员,国产神奇啊！强力支持！！！！！,2017-06-21 21:08:54,0,0,5
j***9,银牌会员,低价手机中的一款战斗力,2018-02-25 12:12:15,0,0,4
g***4,PLUS会员,好好好好好好好好好好,2017-06-28 15:02:57,1,0,5
j***a,PLUS会员,很棒111111111111111111111111111111111111111111111111111111111111111111111111,2017-06-28 00:13:12,0,0,5
春***w,银牌会员,非常好。发货快。,2018-02-28 09:02:25,0,0,5
H***I,银牌会员,还不错，就是屏幕有点大,2018-02-11 20:27:55,0,0,4
r***6,银牌会员,网上第一次买裸机，感觉可以,2017-11-28 19:12:52,0,0,5
仔***m,钻石会员,大屏手机就是小米max2，66666,2017-09-07 13:00:08,0,0,5
夏***子,PLUS会员,物流挺快，用了一段时间，电池确实很耐用，运行内存4g，虽然系统占了差不多一半，但玩游戏看视频什么依然很流畅。大屏幕看电视剧打游戏真的爽！小米良心机,2017-06-13 11:04:20,0,0,5
j***7,金牌会员,非常好的手机，流畅，大屏，玩游戏看电影无压力,2017-06-25 13:05:15,0,0,5
j***g,银牌会员,手机很大，配置很好，就是没有耳机，和保护膜,2017-07-06 18:17:14,0,0,5
诛***军,银牌会员,快递慢 停了5天 手机包装完好 深怕被压坏了,2017-11-26 15:58:49,0,1,4
剁***痛,PLUS会员,很好的，用起来感觉良好。,2017-11-22 07:25:20,0,0,4
w***o,金牌会员,刚刚到手，非常喜欢，物流超级快，手机也很棒,2017-06-15 20:50:33,0,0,5
j***5,金牌会员,质量特别好，是正品，用着不错，推荐给大家,2017-06-27 10:11:11,0,0,5
j***8,PLUS会员,手机很好，屏幕大，也很顺畅,2017-10-10 21:22:48,0,0,5
酱***在,PLUS会员,emmmm。。。。手机屏幕太大了。。袋子完全放不下。。但是屏幕确实很好，看戏玩游戏很有感觉,2018-03-04 16:48:04,0,0,5
南***遇,金牌会员,618买的合适，下次再来，介绍给了朋友,2017-06-25 23:33:28,0,0,5
j***2,PLUS会员,赞赞赞赞赞赞赞赞赞赞赞赞赞赞赞赞赞赞赞赞赞赞赞赞赞赞赞赞赞赞赞赞赞赞赞赞赞赞赞赞赞赞赞赞赞赞赞赞赞赞赞赞赞赞赞赞赞赞赞赞赞赞赞赞赞赞,2017-08-01 23:10:33,0,0,5
2***m,PLUS会员,相当给力。看视频好爽，拿到手之后就连续下载了几个电视连续剧，共两百多集，准备旅行的意义路上看，这下不愁路上如何打发时间的问题了。,2017-06-14 18:16:58,1,0,5
羽***3,银牌会员,给弟弟买的，除了快递有点慢之外没什么事情。弟弟说用的也还可以，毕竟现在国产手机质量折磨高，性价比挺不错的。,2018-03-05 16:10:17,0,0,5
义***呐,银牌会员,二手货，里面还有照片   很不满意,2017-11-22 17:29:33,0,1,4
z***8,PLUS会员,发货有点慢，手机还可以，希望下次我的订单能立即发货,2017-07-13 09:10:19,0,2,3
j***y,银牌会员,用了一段时间，还算可以，不知道后面怎么样。,2017-09-06 12:38:25,0,0,4
1***5,PLUS会员,质量很好，运行速度和功能强大。,2017-06-21 16:43:56,0,0,5
j***q,PLUS会员,手机还不错配送员服务态度热情,2017-06-24 10:02:52,0,0,5
怡***瓶,PLUS会员,手机配送很快，当天付款，当天发出！第二天早上就到了，手机屏幕超大，打王者无压力！关键是电池比第一代大了好多！客服不错 有问必答！,2017-06-18 14:32:17,0,0,5
j***i,PLUS会员,手机功能强大。运行速度快。,2017-06-21 16:11:12,0,0,5
j***a,PLUS会员,大牌子的手机，质量有保障。,2017-06-21 16:35:18,0,0,5
玻***-,钻石会员,收到配送员服务态度热情已,2017-06-23 10:34:06,0,0,5
j***7,银牌会员,手机没有别人说的那么夸张，我特意试了一下通话，音质清晰，屏幕也都正常，不知道经摔不，还没有摔，就是没有耳机不满意，总体我很满意,2017-11-07 20:42:43,0,0,5
铁***风,PLUS会员,大而持久。屏幕虽大，但出色的工业设计可一手掌握，最赞的电池，白天几乎告别了充电器，晚上充一个多小时，第二天又是能量满满。,2017-06-29 12:53:40,0,0,5
军***岗,银牌会员,手机已经收到！和小米官方的发货一样未拆封全新！小米官网查了正品！大屏手机就是好！666！今个收到的？继续用希望一切都好！,2017-06-14 18:32:09,2,0,5
j***x,银牌会员,还可以就是物流慢了点,2017-10-14 02:11:24,0,0,4
j***0,银牌会员,手机非常的好用，本人非常的满意，已经用了两个多月了，小米手机的性能就是好，另外，快递小哥的服务真的是挺敬业的，必须得点赞一个，,2017-09-07 07:15:29,0,0,5
j***x,银牌会员,手机才用一天就打电话对方听不到声音，寄过去检测报告说没问题，寄回来还是用不了，我去小米售后检测主板坏了，你们现在说说怎么处理！,2017-08-14 20:10:04,0,0,5
天***东,金牌会员,还可以，性价比还算高,2017-09-29 09:53:12,0,0,4
j***6,银牌会员,买的第2个小米max2了，是正品，除了拍照以外，这款手机满足了我对手机的所有需求，又可以两三年不换手机啦。,2017-08-15 09:20:38,0,0,5
l***o,PLUS会员,屏幕大，电池容量更大。日常使用可以用两天。,2017-06-15 08:58:58,1,0,5
j***x,PLUS会员,续航能力强，充电不发烫,2017-08-30 15:40:00,0,0,4
梅***a,银牌会员,不错，屏幕大字体大，很适合老年人使用，喜欢,2017-12-15 09:42:38,0,0,5
木***材,金牌会员,用起来还可以吧，至少现在还没出现问题，给个好评吧 哈哈哈哈 。电池还算耐用吧……就是打电话 有时候别人打不进来，可能是信号还是什么问题哟我不知道,2018-02-24 11:33:09,0,0,5
j***c,PLUS会员,正品新机，测试了真的是可以，手机的外观也很好看，很喜欢小米的机器，今年最钟爱的手机了，就是不知道耐不耐摔，能在我手上坚持多久,2017-06-08 15:23:05,0,0,5
_***啊,银牌会员,这台小米max2很不错，我跟我朋友拿去玩游戏玩的很爽，屏幕很大，电池很耐用，新手很适合用这种手机。,2017-12-27 15:02:51,0,0,5
韩***u,金牌会员,没贴膜。。。。。,2017-09-17 07:21:37,1,0,4
U***靖,银牌会员,手机收到特意用了几天来评价，给老人买的，大屏炒鸡方便看文字，手机操作也挺快的，反正就是物超所值的一款手机，一百个赞?,2017-08-01 08:37:05,0,0,5
J***哥,铜牌会员,第一次来京东买手机。用了几天啦 手机特耐电 也不错 特别是看电视超大屏幕。爽,2018-01-18 17:14:37,0,0,5
j***o,银牌会员,送货送的也太快了 太满意了 手机贼拉的好 忒别喜欢,2018-02-27 16:21:15,0,0,5
y***3,钻石会员,妈妈眼神不好，买给她用的，字调大一点看起来舒服一点。但是还是担心她的眼睛,2018-02-09 22:04:25,0,0,5
j***d,银牌会员,京东配送速度超快，宝贝质量非常好，很满意的一次购物。好评！,2018-03-03 16:16:09,1,0,5
r***T,铜牌会员,人家买小米手机都送手机壳还有挂绳，还送小音响，我的什么也没送，真差劲。,2018-02-15 22:01:03,0,0,5
北***尘,银牌会员,很棒的手机，5300，625，续航吊炸天系列，官方不好抢，所以在这家买的，居然还是原价，居然还有赠品，好评,2017-06-17 11:31:50,1,0,5
j***4,铜牌会员,还行吧   总体来说  电量还行  网络连接不怎么好 处理器不怎么好,2018-02-12 21:06:11,0,0,5
j***a,铜牌会员,挺好用的 屏幕也大 耗电量也下，买回来到现在，56%的电到现在还有，我看了一晚上电视还没用完，继续用，用完了充电,2017-07-10 11:21:51,0,0,5
j***7,银牌会员,这个手机很满意，很好，拿到手机也也很满意太大了我用着也很好给平价十分我在,2018-01-07 21:08:50,0,0,5
日***虎,金牌会员,给岳父，给自己妈都买了，感觉挺好，屏幕大，声音响，色彩鲜艳，挺好的,2018-02-15 11:05:56,0,0,5
股***扉,铜牌会员,很喜欢小米手机，操作方便，界面清晰，屏幕大，内存大，还能扩展存储内存，运行快，外观时尚。卖家发货快。,2017-09-15 09:05:22,0,0,5
j***凡,金牌会员,手机收到了，打开一看，真的挺大的，很薄，很靓。卖家只送了个便宜耳机及手机扣，有点小气，手机很喜欢，值得大家购买。,2017-06-10 20:14:47,0,0,5
3***智,PLUS会员,"超市】帮宝适（Pampers）超薄干爽 婴儿纸尿裤 小号S164片【3-8kg】
¥161.00",2017-08-04 02:19:39,0,0,5
j***c,银牌会员,我用的一代，感觉很好。给弟弟买的二代，我自己没看到怎么样，不过一直支持小米，相信不会让弟弟失望的,2017-10-10 13:45:37,0,0,5
周***伟,银牌会员,屏幕很大，看视频、读文章特别好。内存大速度很快，不会卡壳。屏幕也比较清晰，照相效果在出色点就更好了！,2017-09-01 20:24:07,0,0,5
z***q,银牌会员,京东就是快,2018-02-12 09:15:56,0,0,5
j***4,金牌会员,手机还可以，只是快递比我想象的要慢的多。同一天购买的手机和壳子，壳子第二天到了，手机四天到货，还是京东快递,2017-06-28 10:33:40,0,0,5
j***1,银牌会员,手机大屏，超薄，很符合原图。物流也较快。就是没有给我开发票？,2018-02-06 18:40:52,0,0,5
逆***n,钻石会员,绝对好评！,2018-02-04 20:49:25,0,0,5
j***f,银牌会员,店家不行，连个耳机都不给，早知道就不买了，手机套也没有，最机本都不到位！给店家评差！,2017-06-25 18:56:48,2,0,5
j***b,金牌会员,发货速度非常快，下单第2天就收到货了，非常给力，价格和服务都非常好，下次还会来哦！,2017-07-02 11:29:36,0,0,5
星***人,钻石会员,用的很好用,2018-01-14 17:38:44,0,0,5
l***0,银牌会员,手机很好用,2018-01-11 23:25:52,0,0,5
轻0808,银牌会员,我觉得非常不错，是正品，未拆封，包装完好！值得购买，大屏玩王者也是非常不错的呢！,2017-06-29 14:49:07,0,0,5
j***9,银牌会员,很大很惊艳,2018-01-01 07:20:47,0,0,5
摇***y,金牌会员,很漂亮物有所值，给爸爸买的，他老人家很喜欢，下次需要再买。,2018-01-10 16:14:24,0,0,5
y***9,银牌会员,6.44的屏真的好大，机子速度也不错，看电影首选！,2018-03-09 18:31:39,0,0,5
王***寒,PLUS会员,可以袄！！,2017-11-21 15:42:24,0,0,5
W***g,金牌会员,机器很好，屏幕大，待机长，字体大，老人家很喜欢！,2018-03-07 13:47:16,0,0,5
熙***熙,钻石会员,小米手机外观精美，京东快递小哥是所有快递公司里最棒的。手机上网很快，视频清晰。,2017-11-22 10:57:33,0,1,5
长***8,银牌会员,手机收到后打开，手机真心是不错，屏幕大，电池大满意手机！就是快递时间太长，六天啊！,2017-10-21 17:50:12,0,0,5
若***n,PLUS会员,还行  一般般  物流太慢了,2018-03-01 22:08:17,0,0,5
j***b,银牌会员,手机还行，看视频很嗨！大啊，好，就是没有配件，太抠了！,2018-01-14 15:39:57,0,0,5
y***2,钻石会员,作为儿子中考成绩不错的奖励，他很喜欢。配置好，特别是小米软件服务十分到位。我也一直用小米手机。,2017-07-08 16:13:43,0,0,5
j***6,金牌会员,手机还是不错的，用着也很好！大是大了点，手小！,2018-03-02 11:25:38,0,0,5
蒋***杰,PLUS会员,嗯。听说评价超过20个字就有京豆，产品不错，你值得拥有，下次还会购买,2017-08-07 14:13:07,0,0,5
贵***姐,钻石会员,手机是正品全新机，很好很强大，没想到商家居然发货了，开心，收到的时候真的是欣喜万分，手机很好哦,2017-06-08 15:03:28,0,0,5
z***z,银牌会员,是正品，屏幕够大，电池也很耐用，运行流畅，好评,2018-02-05 14:33:15,0,0,5
脉***6,PLUS会员,用起来很舒服  大屏超尽兴  感觉不错  很爽  商家服务也很好！！,2017-07-08 11:20:58,0,0,5
j***o,铜牌会员,镜头防抖做得不好，静止拍摄清晰度好，活动拍摄滞影明显，其他都不错，大电量耐用，屏幕分辨率好,2017-06-22 22:28:38,0,0,5
j***b,PLUS会员,大屏续航持久，备机首选,2018-02-16 23:40:37,0,0,5
j***p,PLUS会员,屏幕真大！手机的电量绝对够用，随便玩儿，也一天没问题，符合买的初衷。,2017-06-28 10:02:26,0,0,5
j***u,铜牌会员,手机电量很大，充满电一天就够了，手机是真品,2018-02-14 09:21:09,0,0,5
我***W,铜牌会员,因为手机是帮我朋友买的，感觉用的挺好，给个赞,2018-01-27 15:19:57,0,0,5
Z***爱,铜牌会员,手机挺好的 就是快递慢  其他的都包装挺好,2018-02-09 22:35:55,0,0,5
j***y,铜牌会员,这个真心的是不错不错的是刚好是非常_回家,2018-02-21 16:22:08,0,0,5
七***茶,PLUS会员,东西今天收到 很满意 谢谢老板! 下次会继续过来购买的咯!,2017-08-31 09:25:39,0,0,5
金***0,银牌会员,买给别人的，挺大的，电池耐用，唯一缺点拍照差了点。喜欢小米的东西,2017-12-17 23:47:51,0,0,5
e***o,银牌会员,手机不错，只是没发票，也不知道电子发票在哪。,2018-01-12 15:43:47,0,0,5
f***Y,银牌会员,手机很好，物流也很快，京东很棒，值得信赖！,2018-01-23 04:54:51,0,0,5
h***3,金牌会员,不错，是正品，速度快，指纹相当灵敏，屏幕绝对够大，玩游戏看视频非常爽,2017-11-07 22:04:47,0,0,5
jd_139571muk,银牌会员,不错。包装也严密    是正品  虽然发票未随机寄来  后马上补上  客服很好一,2017-07-31 19:51:55,0,0,5
j***x,金牌会员,小米手机一直在用还可以吧希望越来越好,2018-03-03 20:19:21,0,0,5
j***g,PLUS会员,收到宝贝很兴奋啊，过段时间再来评价，和描述的一样,2017-11-01 07:37:34,0,0,5
无***火,银牌会员,手机用的可以就是耳机孔太靠一边了玩游戏不顺手,2017-12-01 11:43:29,0,0,5
j***之,金牌会员,不错不错，给弟弟买的，说没毛病，比官网便宜点，就是出库速度太慢了，物流很给力。,2017-08-06 23:52:26,0,0,5
j***x,PLUS会员,很简洁大方，款式很新颖，物流好，客服有责任心，基本满意。,2017-08-21 14:55:51,0,0,5
l***9,钻石会员,店家卖的手机是正品，屏幕很大很清晰，反应也很快，打王者也不卡。,2017-07-02 23:51:27,0,0,5
小***了,PLUS会员,手机不错，是小米正品，大屏幕，大电池，玩游戏很好，王者荣耀不卡,2017-07-01 10:02:53,0,0,5
z***9,银牌会员,有点大，拆开后发现后盖有一点磕伤，不知道是出厂就那样还是用过的，问题不大用几天再说。,2017-06-14 12:40:22,0,0,5
P***T,PLUS会员,手机挺好用的，感觉还是很好的，比想象中的好很多，不错的东西,2017-08-08 23:29:34,0,0,5
j***t,银牌会员,老人用后，真心不错！电量，屏幕够大！,2018-02-16 20:14:17,0,0,5
七***6,PLUS会员,还行吧，京东也就搞活动感兴趣抢一下，用用看，这价位的手机也没什么可选，看个人喜好吧,2017-06-26 21:04:40,0,0,5
s***I,金牌会员,不错哎，还以为不是黑色，没想到真的是！,2018-01-30 18:11:47,0,0,5
j***l,金牌会员,已经是家里的第五部小米手机了，支持国货,2018-01-30 21:43:03,0,0,5
j***a,银牌会员,入手一天，使用非常满意，爱死了?,2018-02-27 11:09:08,0,0,5
s***8,PLUS会员,很好很好，還會再來還會再來的。一直相信京東。,2017-11-15 21:21:16,0,0,5
筱***兒,铜牌会员,快递太慢了,2017-12-16 13:21:32,0,0,5
康***鄙,钻石会员,商品质量很好，很满意，配送速度快啊，而且配送员态度也非常好。,2017-07-09 22:11:03,0,0,5
篰***是,银牌会员,很满意很快,2017-12-12 09:05:31,0,0,5
若***晗,PLUS会员,给老妈买的，价格买的时候高了点，不过毕竟急用，又是大屏幕，挺好的,2017-11-09 15:02:54,0,0,5
