名字,会员级别,评论内容,评论时间,点赞数,评论数,评价星级
j***9,PLUS会员,手机外形不错，用得还挺顺手的，暂时觉得没啥大问题，还好吧,2017-10-15 18:24:02,0,0,5
郭***n,金牌会员,还行，给家人买的就是接打个电话玩个微信啥的～,2018-02-13 20:35:39,0,0,5
王***3,银牌会员,大小合适，使用方便，给母亲买的，她很喜欢！,2018-02-26 17:07:16,0,0,5
j***o,钻石会员,很满意，很喜欢，送给老妈用，很合适简单好用,2018-02-21 22:31:58,0,0,5
j***h,PLUS会员,很实惠的手机，几百快的东西，用起来很流畅，不比上干块的差,2017-10-10 19:21:03,0,0,5
D***_,PLUS会员,手机不错，一次性买了两台,2018-02-04 20:06:34,0,0,5
j***4,金牌会员,质量很好，信价比高，非常满意,2017-06-28 08:47:10,0,0,5
幸***8,PLUS会员,手机漂亮，手感好，颜值高，系统流畅。。。。。。。。,2017-11-19 21:56:22,0,0,5
好***呀,PLUS会员,京东很给力，物美价廉，物流也超快，以后还会再来的,2017-12-03 09:32:13,0,0,5
j***j,PLUS会员,不愉快的购物，这机子不是全新的，而且还给了合约机，真的是醉了，还说合约还是全网通都是随机发的,2017-04-29 00:46:08,0,0,5
乔***宁,PLUS会员,手机蛮不错的，给我嫂子买的，物流也快，服务态度也很好,2017-11-01 10:42:20,0,0,5
悠***悠,PLUS会员,一直信赖京东，现在的生活用品都是京东的，多快好省，满意满意满意满意,2017-07-18 10:56:33,0,0,5
B***Y,银牌会员,这个价位对于这个手机来说是可以的，赶紧下手吧！,2018-01-13 13:15:54,0,0,5
j***p,PLUS会员,不错不错，物流也很快,2018-02-24 20:07:21,0,0,5
y***3,银牌会员,支持国货，手机可以用就行了，功能多了不会玩。,2018-01-26 16:22:15,0,0,5
曲***波,PLUS会员,手机非常满意，经济实惠，送给老人家用的，推荐朋友购买。,2017-10-10 19:37:37,0,0,5
斗***鱼,PLUS会员,性价比很不错，送家人很好！,2018-01-09 22:19:09,0,0,5
z***9,PLUS会员,机好用 高通425处理器 打游戏 运行好,2017-08-22 20:32:24,0,0,5
失***妖,银牌会员,手机不错，妈妈很喜欢，我也挺喜欢的，下次打算在买一个，质量也不错，就是没有送手机套，大家可以放心买，不错,2017-02-06 17:01:20,0,1,5
j***9,PLUS会员,东西不错，物流速度也很快。下次有活动再买一个给老人用。,2017-10-07 10:57:25,0,0,5
袁***9,银牌会员,拿到手机很开心，和我预想的一样，用惯了小米，速度，观感都很好，快递人员很好，用心服务。,2017-06-26 15:24:07,0,0,5
神***Y,银牌会员,买给老人用的 用微信 什么的都很流畅 嘿嘿,2018-01-27 19:21:12,0,0,5
z***1,PLUS会员,非常满意，质量很好，发货速度很快，服务很好，价格很实惠～～真心赞,2017-07-04 14:39:46,0,0,5
B***M,铜牌会员,真心觉得不错，很耐电，同样的用法，充一次电，可以用两三天，而别的手机充一次电最多就用一天。,2017-05-12 14:54:33,0,0,5
j***6,银牌会员,还行吧手机,2017-12-31 14:34:29,0,0,5
爲***心,银牌会员,还行吧！送给家里老人用的，没装软件。,2018-02-26 12:40:35,0,0,5
j***猫,金牌会员,手机很不错，物流也很给力，嫂夫人很满意,2018-02-11 19:48:14,0,0,5
迷***5,PLUS会员,手机不错，用了券后价格很优惠，很好，物流速度也快,2017-05-19 08:51:24,0,1,5
j***d,铜牌会员,宝贝收到了，真心不错，屏幕非常细腻，运行很流，拿在手上很顺手，能花这样的钱买到这么好的货值了,2017-04-14 10:27:23,0,1,5
母***君,PLUS会员,京东送货速度快，服务好，售后好，支持京东，一如既往,2017-10-08 07:53:25,0,0,5
涩***0,钻石会员,挺好用～～,2017-12-22 20:48:16,0,0,5
玉***4,PLUS会员,挺好的，系统运行流畅。，挺好的，音质不错，便宜又实惠，性价比高。,2017-06-13 23:22:58,0,0,5
玉***4,PLUS会员,挺好的，系统运行流畅。，挺好的，音质不错，便宜又实惠，性价比高。,2017-06-13 23:22:35,0,0,5
柒***丫,钻石会员,收到了，购买方便，价格也便宜，快递也及时，京东购买不错的选择。,2017-06-29 10:37:37,0,0,5
就***4,铜牌会员,货真价实，我是广西这边的5天多才到，当时我有急用先，只能给一颗星了。,2017-10-19 17:01:26,0,0,5
l***3,PLUS会员,一直信赖京东，物流快！品质放心！京东价格实惠，不出门轻松搞定！,2017-06-28 15:51:25,0,0,5
l***3,PLUS会员,一直信赖京东，物流快！品质放心！京东价格实惠，不出门轻松搞定！,2017-06-28 15:51:02,0,0,5
U***h,铜牌会员,可以呢?,2017-12-20 13:39:52,0,0,5
5***m,钻石会员,性价比较高，公司用，不错。是正品可以保修，,2017-12-04 23:51:52,0,0,5
5***m,钻石会员,性价比较高，公司用，不错。是正品可以保修，,2017-12-04 23:51:41,0,0,5
j***t,金牌会员,挺好的，一直都犹豫买还是不买，最后还是买了，真的挺好的，触摸好，也不卡，网速挺好的，好好好好好,2017-03-16 10:06:14,0,1,5
j***s,铜牌会员,手机很好看，因为是买给老妈寄回家的，所以没有看到手机，但是妈妈非常喜欢，物有所值,2017-07-05 08:51:01,0,0,5
海***杰,PLUS会员,挺不错的，给老爸的，而且挺便宜的，物美价廉～,2017-11-11 13:29:50,0,0,5
j***c,铜牌会员,给妈妈买的，妈妈说很好用，都很好，性价比高，如果有需要还会在这买，感谢你们的付出,2017-06-30 16:26:14,0,0,5
小***多,PLUS会员,宝贝质量还不错，一直用这个牌子，很好用，物流神速，总体满意，好评。,2017-05-08 11:36:38,0,1,5
马***天,铜牌会员,给妈妈买的，没有看见实物，应该不错！,2018-01-29 11:35:02,0,0,5
j***n,银牌会员,刚到货，试了下，还可以，就是16G的储存实际没有那么多，感觉受骗了,2017-10-15 21:45:35,0,0,5
j***h,PLUS会员,好，非常实用的感觉是正品，下次还会再来，店家服务非常好,2017-08-11 07:07:23,0,0,5
j***0,金牌会员,货到的挺快，不错，一切都很好，就是小米手机不经摔，三天，屏幕摔一个拐子，五天，中间开一道裂。,2017-03-12 06:51:56,0,1,5
尚***4,PLUS会员,这价位看上去不错。经济实惠。颜色挺漂亮。照相清晰度也好。好评。,2017-06-03 12:43:25,0,1,5
小***条,钻石会员,东西很好，与描述j的一样好，非常方便，价格便宜，服务热情周到服务热情周到,2017-07-22 17:49:27,0,0,5
g***超,金牌会员,此用户未及时评价，系统默认好评。,2018-02-22 18:12:15,0,0,5
冥***新,PLUS会员,货很好，物流速度很快，服务态度很好，继续加油！,2017-10-07 11:05:47,0,0,5
o***6,金牌会员,一起买了两个！一直是米粉，物流也很快,2018-01-21 03:04:40,0,0,5
j***u,银牌会员,机子用起来很顺手，外壳也很好看,2018-03-02 15:23:46,0,0,5
j***a,铜牌会员,整体来说还是不错的，就是中卡插槽不固定，不知道是卡的问题，还是卡槽的问题,2017-08-15 14:20:08,0,0,5
x***9,PLUS会员,质量很好，包装也很仔细，整体感觉不错，喜欢！,2017-10-13 10:50:20,0,0,5
S***q,银牌会员,很不满意，什么七天无理由退换货啊！差,2018-01-11 18:28:41,0,0,5
X***Z,银牌会员,东西确实不错，就是这个京东物流，本地的太不给力了，到本市整整3天才送的货，真想投诉一下，也谢谢客服的耐心，本来确实挺生气的，人家也有耐心讲解。,2017-11-05 15:18:42,0,0,4
j***d,铜牌会员,用了差不多一个月了，还是可以  没出什么问题！放心购买，  我也是第一次在网上买手机的,2017-04-13 22:32:43,0,1,5
j***s,铜牌会员,发货特别快，物流也很快。一直用小米，挺好的。赞。包装很好。外观也不错。给妈妈买的。希望妈妈喜欢,2017-02-04 15:57:46,0,1,5
莫***8,PLUS会员,好评，快递很快，价格很美丽，永远支持京东,2017-11-06 19:58:45,0,0,5
-***-,金牌会员,今天是有事去了，没交待好，所以如果没出来影响后面产量，他们全部会推在我身上[流汗],2017-05-10 23:46:08,0,0,5
m***n,铜牌会员,可以吧，王者不卡，像素一般，内存也较小，建议游戏专业户不要买。,2017-10-20 06:15:56,0,0,5
j***8,金牌会员,手机还行  刚开始不会用，电商耐心讲解后感觉产品还可以    还好 给老人买的,2017-06-09 23:21:04,0,0,5
j***c,铜牌会员,总体来说还不错了，我妈挺满意的,2018-02-14 21:26:20,0,0,5
刺***3,PLUS会员,帮别人买的 用了券 这价格还要啥自行车？,2017-10-28 16:37:34,0,0,5
j***z,PLUS会员,好用，非常好用，都说好，赞赞赞！！！！,2017-11-12 21:35:34,0,0,5
j***9,钻石会员,手机已收到，应该会比较不错吧,2018-02-24 21:10:16,0,0,5
j***q,铜牌会员,等了几天，今天终于收到，感觉很好！,2018-01-10 15:38:13,0,0,5
w***8,金牌会员,没有以前的手机好了，一般般,2018-03-09 17:42:44,0,0,5
混沌宇宙-,铜牌会员,很好，但是我觉得手机比其他手机厚上一点点，至于性能，还是很不错的,2017-07-05 21:26:00,1,0,5
狼***爱,PLUS会员,用了优惠券，便宜了不少，真的很不错！！！！,2017-10-10 10:40:58,0,0,5
1***4,PLUS会员,东西挺好的，一直在用，还会来的，谢谢，真的不错了，大家可以试试,2017-04-28 11:08:21,0,1,5
3***s,PLUS会员,货快速收到了，比预期的还要快。东西还没用，用了后再追评吧,2017-06-15 19:34:51,0,0,5
1***猫,PLUS会员,618强哥的非常划算，价格也很合适，满意京东物流也迅速,2017-06-29 17:41:04,0,0,5
东***芙,银牌会员,物流太慢，客服也是一直都敷衍的态度，东西是好的，就是服务太差，这是一次闹心的购物！,2017-04-25 09:49:46,0,1,5
j***e,银牌会员,挺好的，哎。。。倒霉的是前几天掉进厕所里去了，如今报废了，想再买一个,2017-08-14 11:00:44,0,0,5
W***天,金牌会员,看着不错，用着也不错，就是不知道咋回事用了快一个月了突然死机了一次,2017-08-31 23:21:13,0,0,5
天***5,PLUS会员,派送员送货很快，质量很不错，款式很喜欢，需要还来买的，,2017-06-22 09:37:36,0,0,5
q***4,金牌会员,宝贝不错，是全新的，送货也挺快。,2018-01-12 19:17:53,0,0,5
q***3,钻石会员,质量还是蛮好的，就是发货速度有点慢，客服服务态度也不错。,2017-11-11 23:38:52,0,0,5
下***愿,银牌会员,感觉还可以，和想象中的有些差别,2018-01-23 22:53:17,0,0,5
j***s,PLUS会员,不错，使用无卡顿，可能是新机，反应也很快,2017-10-08 14:20:45,0,0,5
f***8,钻石会员,小米4A 红米4A 双卡双待4G手机 香槟金 移动版(16GB ROM),2017-07-03 11:32:56,0,0,5
j***0,银牌会员,物美价廉好，超值实用的很,2018-03-07 08:34:50,0,0,5
曾***风,银牌会员,给我父亲买的，说用的很好,2018-03-07 16:07:56,0,0,5
j***o,铜牌会员,收到了，货很好，电池也很耐用,2018-02-05 18:21:40,0,0,5
u***S,铜牌会员,嗯，第一次买，挺不错的，很喜欢,2018-01-20 23:13:07,0,0,5
默***妮,PLUS会员,挺不错的，价格便宜，送货很快呢，赞一个,2017-10-21 16:32:33,0,0,5
j***m,金牌会员,不错，不错，就是不知道能用多久,2018-01-20 13:17:14,0,0,5
j***9,铜牌会员,手机还没用，等用一段时间再说吧。反正保护膜不行太小了没法用。其他的还可以,2017-06-29 16:29:57,0,0,5
j***0,钻石会员,手机挺不错的，上个月刚买的一部手机，这又买了一个，咋还涨价了，无语！,2017-02-16 11:21:36,0,1,5
两***泽,PLUS会员,宝贝已收到 很不错 非常满意 原装正品 京东快递很给力,2017-06-10 12:42:01,0,0,5
j***x,铜牌会员,第一次在京东上购物，相信京东上的质量，不错，店主记得发票，其他的各方面没得说，都没问题,2017-02-28 12:28:35,0,1,5
j***5,银牌会员,物流特别慢慢慢，千万不要买,2018-02-12 21:57:02,0,0,5
霄***霁,PLUS会员,小米手机经济实惠，京东送货很快，不错,2017-10-29 10:47:37,0,0,5
j***x,钻石会员,小米4A 红米4A 双卡双待4G手机 香槟金 移动版(16GB ROM),2017-06-21 21:14:10,0,0,5
付***谦,PLUS会员,正品，流畅，己推荐朋友抢购。。加油!京东快递，神速。,2017-06-20 21:41:02,0,0,5
j***d,铜牌会员,虽然手机好，但是物流有点慢,2018-02-07 19:16:09,0,0,5
此***谐,PLUS会员,手机还不错，疯涨啊这货，有必要花700买这个吗，699的红米4多好啊,2017-02-02 23:45:03,0,1,5
山***6,PLUS会员,手感不错，价格便宜，买给老人使用非常好,2017-10-08 14:19:20,0,0,5
j***o,铜牌会员,外观设计非常好用着挺好的,2018-02-21 11:16:55,0,0,5
i***8,PLUS会员,东西先我哦你看看吧，看起来还可以,2017-11-23 18:24:41,0,0,5
c***o,PLUS会员,比较高端 这个价格很物超所值 我很喜欢,2017-10-06 21:12:21,0,0,5
j***f,钻石会员,小米4A 红米4A 双卡双待4G手机 香槟金 移动版(16GB ROM),2017-06-12 22:36:55,0,1,5
j***5,银牌会员,给我妈买的，老人挺喜欢,2018-03-01 10:58:39,0,0,5
轨***8,PLUS会员,东西不错，一如既往的支持京东,2017-12-17 08:40:35,0,0,5
G***O,铜牌会员,还行比竟只有这个价格！,2018-02-27 00:46:47,0,0,5
j***d,银牌会员,手机已经收到，很好，非常满意,2018-01-13 20:13:19,0,0,5
j***9,铜牌会员,一直用小米品牌，实惠又好用。,2018-01-12 22:29:02,0,0,5
jd_158654jbn,银牌会员,挺好的，性价比还可以，给家里老人用,2017-10-24 17:09:46,0,0,5
l***3,PLUS会员,买了好多次了，真的高性价比，值得购买,2017-10-08 22:34:12,0,0,5
A***k,铜牌会员,好用，一点的都不卡，只是运行内存才1G，其他的软件没问题，玩起来也不卡,2017-06-17 09:42:36,0,1,5
L***k,PLUS会员,很好用，一直相信这个牌子一如既往的好,2017-10-08 00:47:58,0,0,5
止***水,银牌会员,手机不错，为发烧而生！小米系统真是醉了，预装的软件占了一半的内存～～,2017-07-03 19:40:37,0,0,5
小***少,PLUS会员,赞啊，超赞~赞啊，超赞~赞啊，超赞~赞啊，超赞~赞啊，超赞~,2017-06-12 20:23:46,0,1,5
小***少,PLUS会员,赞啊，超赞~赞啊，超赞~赞啊，超赞~赞啊，超赞~赞啊，超赞~,2017-06-12 20:23:46,0,1,5
你***雄,银牌会员,快递很快，手机与京东商城看得一样，手机没有缺点，非常满意。祝京东越来越好。,2017-05-10 20:26:45,0,0,5
j***w,铜牌会员,好好非常好，服务态度也挺好，就是物流慢，送货员态度也挺好。,2017-09-16 11:11:32,0,0,5
只***月,铜牌会员,还不错哦，使用后手感挺满意的,2018-01-02 22:13:08,0,0,5
L***钱,银牌会员,手机还不错，给老人买的。,2018-02-01 00:39:26,0,0,5
周***2,银牌会员,作为备用机已经很好了，,2018-02-11 13:25:29,0,0,5
姚***影,PLUS会员,好好好，真的好 我买给别人用的！嘿嘿嘿我觉得棒,2017-07-07 14:09:24,0,0,5
男人如毒毒刺骨1,金牌会员,买给老人用的。。。。。,2018-02-09 22:40:50,0,0,5
j***i,银牌会员,手机挺好用的，第二次买了，两次都是帮别人买的，反馈还不错,2017-09-25 17:15:58,0,0,5
z***3,PLUS会员,正品行货，这价格还要什么自行车,2017-11-10 21:34:24,0,0,5
周***2,银牌会员,买给我妈用的，应该不错吧！,2018-01-09 10:45:56,0,0,5
z***8,PLUS会员,质量很好了，价格还实惠，不错,2017-06-17 16:57:13,0,1,5
L***G,PLUS会员,质量很好了，价格还实惠，不错,2017-06-17 16:43:58,0,1,5
草***凉,PLUS会员,物流真是最快的，没有之一,2017-12-26 09:39:50,0,0,5
y***z,银牌会员,手机给爸爸买的，很满意，一直都喜欢小米红米的手机，就是快递员有点不满意，态度不太好,2017-02-19 09:26:06,0,1,5
玖***丶,PLUS会员,性价比还是挺高的手机，还是挺满意的,2017-10-06 23:17:09,0,0,5
无***久,PLUS会员,分辨率挺好的，音质也不错，厚度合适，拍照效果满意,2017-06-13 06:45:19,0,1,5
j***f,PLUS会员,价格便宜，买来老年人用足够了,2017-11-20 15:45:55,0,0,5
j***伴,银牌会员,刚拿到，还不知道好不好用？,2018-01-03 21:24:04,0,0,5
中***信,钻石会员,性价比高，动作快，非常不错的,2017-06-11 09:30:44,0,1,5
j***r,银牌会员,可以可以可以  应该可以,2018-01-23 19:37:25,0,0,5
1***山,银牌会员,好好好好好好好,2017-03-02 19:59:47,0,1,5
魔***客,钻石会员,性价比很高，我自己喜欢，系统是吸引我的重要原因,2017-06-23 23:00:34,0,0,5
小***n,PLUS会员,小米一直处于低价高配，赞！！,2017-11-14 13:17:56,0,0,5
十***5,PLUS会员,质量很不错，款式很喜欢，送货很快，需要还来买的,2017-06-21 10:53:20,0,0,5
j***^,PLUS会员,超级划算，超级好用的，非常喜欢,2017-10-28 17:55:50,0,0,5
j***b,银牌会员,手机还可以，性价比还行吧毕竟这个价钱买得手机就这样了。差不多还可以,2017-03-30 00:17:18,1,1,5
j***3,铜牌会员,还可以吧物流有点慢,2018-03-09 14:13:04,0,0,5
j***3,PLUS会员,价格便宜，是一款很适用的老人智能机。,2017-09-07 20:51:29,0,0,5
R***r,PLUS会员,性价比很高的手机，我很喜欢。,2017-11-09 21:52:20,0,0,5
l***5,PLUS会员,小米手机真不错，价格也亲民，用起来感觉陪好，需要再来！,2017-04-12 07:11:40,0,1,5
a***2,银牌会员,可以的，就是手机有点厚,2018-01-22 15:00:02,0,0,5
j***k,PLUS会员,非常好吃手机，支持小米，快递给力,2017-10-06 19:46:32,0,0,5
黑***恋,PLUS会员,还是喜欢黑色的手机，质量还可以,2017-10-21 15:39:48,0,0,5
吴***勤,PLUS会员,东西很棒，我很喜欢，价钱又低,2017-11-05 20:14:44,0,0,5
1***p,PLUS会员,我都不想说了，拍照拍成这样好看,2017-10-18 19:00:11,0,0,5
j***u,铜牌会员,嗯，东西还不错，物流速度挺快的，嗯，客服态度挺好。总体很满意。,2017-07-12 14:27:45,0,0,5
j***1,钻石会员,挺好的，还可以，，，，，，价格很实惠。。。。。,2017-06-08 22:36:47,0,1,5
六***耶,PLUS会员,非常非常非常非常喜欢，很好的手机,2017-10-06 19:41:39,0,0,5
j***l,铜牌会员,商品一般，物流稍慢！,2018-01-27 16:16:19,0,0,5
h***9,PLUS会员,一如既往的不错啊,2018-01-26 11:57:24,0,0,5
m***a,PLUS会员,正品，比超市还要便宜，，，给力的活动，么么哒,2017-06-19 18:29:50,0,0,5
哈***食,PLUS会员,东西很不错，物流配送速度也很快…………,2017-10-08 20:43:46,0,0,5
V***花,银牌会员,东西不错，用了在追.,2018-01-23 09:03:43,0,0,5
j***9,钻石会员,包装完整，是行货新机，老头子用用挺好，发货时间稍微慢了点，基本满意的一次购物,2017-05-03 18:21:00,0,0,5
f***a,PLUS会员,质量不错，价格便宜，不错,2017-11-24 09:14:01,0,0,5
沉***丶,PLUS会员,很好，质量很棒，送货也很快。,2017-10-17 09:09:20,0,0,5
毛***蛋,钻石会员,好。。。。。。。。。。。。。,2017-10-16 13:01:01,0,0,5
j***c,铜牌会员,虽说这款手机在小米中算是最低了，操作还好，但是bug有点多，体验感一般般啦,2017-03-17 13:52:22,0,1,5
j***n,PLUS会员,小米一如既往的性价比之王，赞,2017-10-15 18:06:13,0,0,5
十***5,PLUS会员,送货很快，质量很不错，很喜欢，需要还来买的,2017-06-24 09:20:51,0,0,5
j***m,PLUS会员,做工也好 摸上去手感很好 我很喜欢,2017-08-28 09:14:22,0,0,5
j***w,PLUS会员,小米手机，性价比很高，很喜欢,2017-10-10 11:55:44,0,0,5
jd_159299jbw,铜牌会员,用了几个月感觉挺好的 挺实惠的??(?¯???¯???)?”,2017-02-03 19:29:54,0,1,5
j***z,PLUS会员,"用卷下的，很实惠，很好，是正品，啦啦啦
可以",2017-05-30 13:04:18,0,1,5
j***9,铜牌会员,手机还算好吧  就是太轻了  其他什么都很好,2017-11-08 12:04:05,0,0,5
不***叶,PLUS会员,价格便宜，还算好用，好评好评,2017-10-06 19:08:25,0,0,5
赵***6,PLUS会员,手机挺好的，价廉物美，比官网便宜，是正品！不错的,2017-04-26 12:34:27,0,1,5
蚊***股,PLUS会员,确实很好使，这个东西！！！,2017-10-18 17:05:12,0,0,5
j***a,PLUS会员,买给妈妈，她觉得还不错。,2017-11-01 22:21:27,0,0,5
j***x,铜牌会员,挺好用，儿子很喜欢,2018-01-30 12:31:19,0,0,5
丽***7,金牌会员,一如既往的相信京东,2018-01-30 05:44:58,0,0,5
b***a,PLUS会员,反应有些不太灵敏，便宜咯,2017-10-30 15:20:28,0,0,5
j***f,铜牌会员,今天上午收到的，妈妈很喜欢，先看看用上怎么样。谢谢送的手机膜和保护壳，好评,2017-02-26 20:06:08,0,1,5
虎***淘,PLUS会员,红米4a保护壳 白色ey7amn60bdd,2017-06-03 21:39:35,0,1,5
京***子,PLUS会员,一直在京东购物    值得信赖    正品保证,2017-04-29 15:10:59,0,0,5
j***o,银牌会员,4天收到！,2017-06-13 17:29:05,0,1,5
小***哈,PLUS会员,买来给家人用的，效果不错,2017-10-18 21:26:03,0,0,5
j***x,PLUS会员,保持小米手机一贯风格。方便携带使用快捷,2017-06-26 11:51:35,0,0,5
我***2,银牌会员,哎买贵了。几百啊。以后不想在京东买东西了。买的都不是很好。 亏我相信京东,2017-03-01 09:07:21,0,1,5
j***4,银牌会员,不怎么好   套不起手机   套起来连插口档住啦,2017-09-13 00:11:53,0,0,5
j***d,钻石会员,之前没用过小米，收货后有点不看好，用了后觉得还是蛮称心的,2017-07-07 16:15:11,0,0,5
j***o,PLUS会员,送给家人用的，挺好用的,2017-10-28 14:29:14,0,0,5
译***听,PLUS会员,到货速度很快，东西是正品,2017-10-09 21:08:03,0,0,5
天***6,钻石会员,质量不错，很实用,2017-06-01 11:38:33,0,1,5
y***7,银牌会员,手机上手还可以，对包装比较满意，就是物流快递太慢，真的龟速一样。,2017-04-28 23:17:21,0,1,5
漠***4,PLUS会员,小米手机挺不错的，喜欢！,2017-10-08 20:29:46,0,0,5
慧***i,金牌会员,一直在用，也会一直用下去的，很不错,2017-12-26 00:15:03,0,0,5
j***G,银牌会员,买给妹妹临时用用，用了小半个月，这个价钱来说也算是物有所值了，还是不错的。,2017-02-02 09:21:59,0,1,5
j***2,钻石会员,价格很很实惠，希望能够活动多多，再回购,2017-06-12 14:27:42,0,1,5
j***2,钻石会员,价格很很实惠，希望能够活动多多，再回购,2017-06-12 14:27:26,0,1,5
小***盘,PLUS会员,发货挺快的，就是物流慢了点。手机性能不错，外壳没质感，不过这个价格，很棒了，,2017-05-03 23:33:39,0,0,5
y***4,PLUS会员,好用，发货快，赞一个,2017-11-03 09:17:28,0,0,5
j***8,PLUS会员,非常好用，下一次继续买,2017-10-17 22:30:06,0,0,5
k***c,金牌会员,比想象中好适合送人神器好玩外观漂亮,2017-07-11 15:38:38,0,0,5
t***4,PLUS会员,质量不错，物流很给力的呢，非常满意都,2017-06-20 15:10:20,0,0,5
天***5,PLUS会员,质量很不错，款式很喜欢，需要还来买的,2017-06-20 13:41:31,0,0,5
帅***大,PLUS会员,拿手上很舒服，手感不错，京东快递很快,2017-06-19 08:50:23,0,0,5
p***n,PLUS会员,系统里很多移动的软件，还有小米自带应用商店都不见了，非官方系统。,2017-04-27 09:35:07,0,0,5
付***z,铜牌会员,很快我儿子很喜欢 他说爸爸给他的这个礼物他很喜欢,2017-03-10 17:54:39,2,0,5
j***u,PLUS会员,支持小米支持京东～给老妈买的～,2017-08-06 16:29:29,0,0,5
猜***i,PLUS会员,不错，手机很好用。五星好评，么么哒,2017-07-02 16:05:05,0,0,5
紫色郁金香062736,金牌会员,手机收到了，一家三口小米配起了！很好用！小米值得信奈！,2017-06-29 22:00:14,0,0,5
冰***荷,钻石会员,给妈妈买的，非常喜欢！,2017-12-21 09:27:47,1,0,5
2***孩,PLUS会员,手机很好，卖家发货很快，非常给力，赞,2017-06-11 16:59:31,0,1,5
随***过,金牌会员,手机用起来还可以，外观新颖，整体感觉还不错。,2017-09-16 10:56:41,0,0,5
x***2,银牌会员,帮朋友买的，价格实惠。朋友说他就喜欢廉价机摔坏了不心疼！,2017-06-11 00:19:12,0,1,5
张***0,PLUS会员,手机真的很好，这个价格值了，不错的东西,2017-05-23 22:33:08,0,1,5
陌***衣,铜牌会员,手感不错，外观也很漂亮，运行也快,2017-12-18 22:17:39,0,0,5
jd_642378531,银牌会员,此用户未及时评价，系统默认好评。,2017-12-18 16:33:11,0,0,5
j***2,金牌会员,相信京东，手机不错,2017-11-16 22:13:49,0,0,5
一***6,PLUS会员,手机用着很好，运行快，拍照效果好,2017-07-11 09:11:21,0,0,5
j***7,PLUS会员,非常好，到货快日期新，京东618给力,2017-06-07 13:17:32,0,1,5
j***7,PLUS会员,非常好，到货快日期新，京东618给力,2017-06-07 13:17:21,0,1,5
j***f,PLUS会员,很好的东西，很是喜欢，卖家服务很好,2017-06-23 08:55:55,0,0,5
j***1,铜牌会员,就是能不能在好点，现在很好了，希望以后有排热系统，,2017-07-25 11:07:50,0,0,5
j***w,PLUS会员,"绝对牛b,价格合理！真的好！！！:",2017-06-21 22:36:32,0,0,5
j***a,铜牌会员,手机不错   但是内存只有9g这就是你说的16g呵呵     醉了,2017-03-14 18:11:54,0,1,5
3***9,银牌会员,给妈妈买的，妈妈喜欢，容易上手，质量也很好,2017-09-25 11:50:20,0,0,5
开***8,钻石会员,送婆婆的礼物，还行，特别谢谢快递小哥,2017-11-11 10:09:41,0,0,5
陈***梦,PLUS会员,像数不错，几百块的手机性价比还算可以的了，电池一天一充,2017-06-15 09:31:38,0,1,5
j***q,铜牌会员,快递挺快的，手机拿着好轻，像素不太好,2017-11-05 12:57:57,0,0,5
