名字,会员级别,评论内容,评论时间,点赞数,评论数,评价星级
T***f,铜牌会员,送给老公的，他收到非常开心，他说好用,2018-03-07 18:09:06,0,0,5
j***0,PLUS会员,非常满意！值得信赖,2018-03-07 09:01:12,0,0,5
悟***-,PLUS会员[试用],不错，老爸很喜欢！,2018-03-06 15:08:25,0,0,5
你***么,金牌会员,用起来手感非常好，运行程序速度很快。,2018-03-06 16:06:11,0,0,5
f***梓,钻石会员,大屏。价钱还不贵，用着也还好，继续,2018-03-09 11:58:33,0,0,5
李***9,金牌会员,手机蛮好用的屏目大要薄看电视又爽！,2018-03-09 08:49:25,0,0,5
别***美,铜牌会员,还没拆包裹，小米的商品一定会很好。,2018-03-08 16:43:09,0,0,5
j***1,金牌会员,屏幕大，手感也很不错，性价比不错！,2018-03-08 16:35:49,0,0,5
璀***_,铜牌会员,手机很大，也很漂亮，先用用看，好评,2018-03-07 18:06:38,0,0,5
l***o,钻石会员,屏幕大，系统很好用，物流超快给力。,2018-03-07 08:51:51,0,0,5
r***d,钻石会员,很大很棒的，学习、看视频感觉很好。,2018-03-06 17:37:36,0,0,5
F***3,铜牌会员,京东的物流确实不错   态度还可以,2018-03-06 15:00:41,0,0,5
飘***动,企业会员,一个字 真的大 给老人买的 还不错,2018-03-06 20:24:09,0,0,5
j***x,铜牌会员,手机已经收到，还是挺好的，挺满意的,2018-03-06 19:00:27,0,0,5
h***g,钻石会员,老爸挺开心的，这机器性能也不错。,2018-03-10 00:19:20,0,0,5
j***1,银牌会员,手机可以用着很舒服电池大我很喜欢,2018-03-09 15:08:00,0,0,5
j***l,金牌会员,一如既往的神速，手机也很好！好评,2018-03-08 17:35:48,0,0,5
淡***蛋,金牌会员,还可以吧，看电视什么行，辅机使用,2018-03-08 16:17:13,0,0,5
j***0,钻石会员,除了拍照像素低，其他的都特别满意,2018-03-08 15:06:58,0,0,5
张***夫,钻石会员,第二台max2了，续航天下第一。,2018-03-07 13:53:32,0,0,5
e***d,钻石会员,适合老年人赶时髦的一款米！非常棒,2018-03-07 08:51:26,0,0,5
-***何,钻石会员,比上一代漂亮，小米这款系例很喜欢,2018-03-06 23:08:56,0,0,5
欣***1,金牌会员,此用户未及时评价，系统默认好评。,2018-03-06 22:11:23,0,0,5
j***t,银牌会员,买手机一直是京东，方便，实惠！！,2018-03-06 19:24:07,0,0,5
t***9,钻石会员,屏幕够大，但是有时候感觉有点卡呢,2018-03-06 16:22:19,0,0,5
隨***9,银牌会员,现在是用的这款手机，真的很不错。,2018-03-06 15:45:27,0,0,5
j***c,银牌会员,物流快，服务态度也好，京东还可以,2018-03-06 15:15:00,0,0,5
G***w,银牌会员,爸爸用起来很好～机子真的很划算,2018-03-08 22:36:36,0,0,5
逗***s,钻石会员,很大，非常大，巨大，屏幕太大了,2018-03-08 18:11:59,0,0,5
阳***子,钻石会员,质量不错 价格优惠 非常棒～！,2018-03-08 08:47:51,0,0,5
米***5,金牌会员,手机收到  使用中  看看效果,2018-03-07 17:42:32,0,0,5
暖***影,钻石会员,大屏  续航时间长  很适合我,2018-03-07 15:43:50,0,0,5
j***i,银牌会员,很好，跟我想的一样，我很喜欢！,2018-03-07 12:14:46,0,0,5
j***e,铜牌会员,内存大，物流超快，用的手感不错,2018-03-06 18:40:43,0,0,5
l***o,金牌会员,不错，比较经济实惠的一款机子。,2018-03-06 17:27:34,0,0,5
吴***1,银牌会员,屏幕太大，屏幕太大，屏幕太大！,2018-03-08 05:47:01,0,0,5
时***星,金牌会员,感觉确实太大了，但是续航确实不错,2018-02-16 06:33:28,0,0,5
我***g,金牌会员,黑漆漆的乌漆麻黑看看好不好玩,2018-03-09 19:49:42,0,0,5
1***p,银牌会员,电池没有之前官网一部的耐用。,2018-03-09 21:03:40,0,0,5
j***n,金牌会员,nm京东，刚买几天就降价，c,2018-03-09 07:01:01,0,0,5
侯***池,钻石会员,送给老妈的礼物，老妈很喜欢。,2018-03-09 01:12:44,0,0,5
j***0,金牌会员,应该不错的   还没有用呢?,2018-03-07 17:55:43,0,0,5
爱吃零食99,钻石会员,屏幕大点，看得清楚，很喜欢。,2018-03-07 16:40:34,0,0,5
大***哟,铜牌会员,屏幕很大 很喜欢 电池也很好,2018-03-06 20:19:57,0,0,5
t***8,银牌会员,电池真心耐用，外观挺满意的。,2018-03-06 21:58:55,0,0,5
j***俊,金牌会员,是全新机，好大屏幕，看电视爽,2018-03-06 19:41:41,0,0,5
漠***道,银牌会员,买了第二个了，感觉还可以。,2018-03-07 19:28:50,0,0,5
庙***8,银牌会员,挺好用的，关键是待机时间长,2018-03-06 16:24:21,0,0,5
j***5,银牌会员,还可以，支持小米，支持国产,2018-03-06 14:52:37,0,0,5
j***e,铜牌会员,我问一下微信为什么用不了,2018-03-09 15:04:40,0,0,5
j***9,银牌会员,速度快，拍照好，屏幕大。,2018-03-08 21:31:21,0,0,5
k***n,钻石会员,性价比好，已经好几次买了,2018-03-08 15:10:07,0,0,5
C***o,金牌会员,屏幕很大，操作很流畅，赞,2018-03-07 10:01:25,0,0,5
1***1,钻石会员,第三个小米手机 好用实惠,2018-03-07 11:11:52,0,0,5
胤***寒,铜牌会员,手机很好屏幕很大支持京东,2018-03-06 19:13:58,0,0,5
J***店,钻石会员,好，非常好，特别的满意。,2018-03-06 14:57:52,0,0,5
冰***2,金牌会员,临时用着还不错，习惯好评,2018-03-06 15:07:57,0,0,5
简***C,金牌会员,好用，一直都是小米手机,2018-03-09 22:21:22,0,0,5
y***y,银牌会员,"收到了,不错,五星好评",2018-03-09 23:51:26,0,0,5
苏***你,银牌会员,用起来感觉还是不错的。,2018-03-09 04:47:33,0,0,5
塞***杰,钻石会员,屏大，待机时间长，好评,2018-03-08 19:52:38,0,0,5
j***7,金牌会员,手机老爸用着，很不错。,2018-03-08 14:34:47,0,0,5
i***3,钻石会员,一如既往的好，，贊一个,2018-03-08 10:08:45,0,0,5
j***w,银牌会员,还可以，我喜欢大屏手机,2018-03-07 15:04:56,0,0,5
D***y,金牌会员,非常牛逼太好了推荐购买,2018-03-07 12:54:13,0,0,5
打***年,银牌会员,屏幕很大  我妈很喜欢,2018-03-07 10:02:31,0,0,5
墨***耘,钻石会员,一直信赖京东、信赖小米,2018-03-07 21:12:48,0,0,5
jd_bosco,金牌会员,小米质量很好，继续支持,2018-03-06 18:38:47,0,0,5
G***t,银牌会员,比别的卖家贵了400元,2018-03-06 14:19:01,0,0,5
老***9,PLUS会员,不错，老人很喜欢,2018-03-09 15:20:12,0,0,5
樊家456,钻石会员,手机很好，大瓶就是爽,2018-03-08 22:02:19,0,0,5
沙***张,银牌会员,"手机很好,京东加油,",2018-03-08 18:47:48,0,0,5
阿***纳,铜牌会员,非常满意的一次网购。,2018-03-08 18:55:34,0,0,5
简***y,PLUS会员,屏幕大，用着不错,2018-03-08 07:04:06,0,0,5
c***-,金牌会员,有点大，屏幕挺清晰的,2018-03-07 15:05:12,0,0,5
w***3,银牌会员,屏幕很大，物流很快！,2018-03-07 13:10:33,0,0,5
小***2,钻石会员,屏幕大，给老人用很好,2018-03-07 09:06:48,0,0,5
i***V,银牌会员,还差不多，就是128内存只有118相差有点大。,2017-12-24 08:30:38,0,0,5
f***1,金牌会员,用着还可以吧。。。,2018-03-09 16:17:14,0,0,5
j***u,银牌会员,手机不错，下次还买,2018-03-09 07:11:29,0,0,5
竹***杨,钻石会员,屏幕很大，年会奖品,2018-03-08 15:41:42,0,0,5
j***t,银牌会员,还行，就是有点大，,2018-03-08 11:37:33,0,0,5
j***g,金牌会员,还是一如既往的好用,2018-03-08 10:05:47,0,0,5
m***e,钻石会员,好用，一如既往的好,2018-03-08 10:03:16,0,0,5
水***人,银牌会员,很不错，给我妈买的,2018-03-07 15:17:18,0,0,5
虚***云,金牌会员,用的不错，送老人的,2018-03-07 23:43:05,0,0,5
j***d,银牌会员,实惠大屏爸爸很喜欢,2018-03-07 09:53:06,0,0,5
j***b,铜牌会员,用了之后再评价吧。,2018-03-06 19:00:24,0,0,5
j***o,铜牌会员,电池用得很快，没有现象中那么耐用，,2017-11-16 09:13:12,1,0,5
博***前,钻石会员,很满意。。。。。,2018-03-09 13:56:24,0,0,5
C***i,金牌会员,屏大，用着还可以,2018-03-09 10:53:26,0,0,5
婷***升,银牌会员,还不错，挺好用的,2018-03-08 20:14:34,0,0,5
H***W,银牌会员,不太好反应太慢了,2018-03-08 14:17:20,0,0,5
QbRlbDeuNDaK,银牌会员,很好！最喜欢京东,2018-03-08 13:45:04,0,0,5
j***a,银牌会员,挺好用的，不错哦,2018-03-07 12:37:47,0,0,5
j***9,金牌会员,小米可以的，不错,2018-03-07 12:08:33,0,0,5
J***_,钻石会员,送人的，没有拆封,2018-03-06 19:52:18,0,0,5
京***的,银牌会员,不错哦不错哦屏幕不很大,2017-12-04 13:01:32,0,0,5
M***g,金牌会员,屏幕确实大，看个片儿舒服。处理速度一般应用还跟得上，玩儿高达强袭战线这款游戏时明显感觉出有掉帧情况，基本上属于一直在卡一直在掉帧，但没有那么严重，这机器之当备用机，所以能接受无所谓了。,2018-03-09 09:34:57,0,0,4
j***b,PLUS会员,还行吧，凑合用,2018-03-08 14:22:43,0,0,5
j***c,PLUS会员[试用],用起来还不错。,2018-02-27 15:15:55,0,0,5
j***3,银牌会员,里面没有保护  我都没敢开盒  怕屏幕碎了,2018-03-08 11:25:07,0,0,4
痴***风,银牌会员,很好用，非常好,2018-03-09 23:00:55,0,0,5
j***r,银牌会员,小米手机超值。,2018-03-08 07:55:23,0,0,5
冥***凌,金牌会员,大屏大不同同同,2018-03-06 17:21:38,0,0,5
H***J,银牌会员,手机在用还不知道怎么评价，不过包裹就有点差，还有我记得我是要求发票的，可是我收到的时候却没有发票甚至两小票都没有，这我就不能理解了,2018-03-09 00:10:48,0,0,4
j***色,银牌会员,黑色挺漂亮的，显得挺正规的，质感很好，运行速度很快，多开程序无压力，像素一般中规中矩，跟苹果比是差点，电池好像不像说的那么经用，尤其100%到99%掉的特别快，刚充完电看下QQ就掉电了，待机的时候掉电也挺快的，什么都没干三个小时就掉4%的电，不知道其他人跟我一样不一样。我是为了电池用的时间长，待机时间长才买的手机，要是跟我苹果一样的掉电速度我还不如不买……很愁人。,2018-02-24 10:36:01,0,1,3
翁***伟,银牌会员,声卡杂，下方两口子只有一个有声音，电量消耗极快！本人试用起点听书，而且用蓝牙耳机听的，注意是蓝牙播放！一下午绝对满电降到仅剩下百分之七！！！客服也不用做售后回访了，反正都是***什么正品，什么原厂质量没问题，在京东买东西久了你懂的，和京东认真你京**了！个人觉得在京东买到好的，你赚了……！买到烂的，乖，你就认了吧！我也只能去当地手机店买个其它牌手机用！到于用手机，每天工作，客服，员工安排，绝对不能没有，所以懒得去和京东客服抗议退换货了，京东客服的踢皮球套路早知道了，要是要求换货，你就准备去检测，去开单去……一堆堆下来，损失的金钱足够买十个手机了！我想京东得去换个口号了，叫：“买到好的你偷着乐吧！买到质量差的，正常！看谁耗得过谁”,2017-10-02 19:37:10,8,7,1
q***8,金牌会员,质量不错?,2018-03-09 16:33:59,0,0,5
希***科,金牌会员,很不错的手机,2018-03-09 11:26:30,0,0,5
M***L,银牌会员,手机手感不错,2018-03-09 09:28:19,0,0,5
万***系,铜牌会员,刚用目前还行,2018-03-07 16:59:30,0,0,5
一***贝,金牌会员,电力确实给力,2018-03-06 19:53:16,0,0,5
w***久,金牌会员,非常满意,2018-03-09 19:31:49,0,0,5
V***U,金牌会员,很大一个,2018-03-06 20:55:10,0,0,5
p***4,PLUS会员,还行吧，性价比还是比较合适，当然比华为还是差一点。,2018-03-09 10:11:28,0,0,4
核***验,PLUS会员,好? 老人喜欢 就是声音小些,2018-03-08 23:07:12,0,0,4
j***s,钻石会员,比一代大了，续航一天一充。音质提升不少,2018-03-09 09:33:26,0,0,4
J***y,铜牌会员,还行 刚刚用就卡死了两次 不知道啥情况,2018-03-08 13:08:04,0,0,4
Y***仔,金牌会员,刚开始电池很耐用，性能一般！！！！,2018-03-06 22:34:20,0,0,4
j***l,PLUS会员,商品应该是不错，但是这个包装让我不能接受,2018-02-25 18:20:43,0,1,2
j***y,银牌会员,"电池续航给四星，比以前的手机强，但毕竟新手机，打游戏看视频不间断差不多6小时。
运行内存给3星，比上个手机大1G,但是还是会有卡顿
系统给3星，买回来有一个月，出现过自动重启，黑屏，运行软件无反应等",2018-02-25 11:19:51,0,1,3
s***r,金牌会员,刚用不知道到底怎样，感觉屏幕亮的真慢真难啊，什么设置，点几下都没反应,2018-02-23 14:43:57,0,1,3
Z***g,PLUS会员,大屏 ?,2018-03-07 13:41:33,0,0,5
j***3,PLUS会员,挺好的手机,2018-03-07 10:16:13,0,0,5
混***者,钻石会员,很大很喜欢,2018-03-10 00:33:40,0,0,5
l***9,钻石会员,还可以?,2018-03-09 20:15:37,0,0,5
j***u,银牌会员,爸爸很喜欢,2018-03-09 13:54:20,0,0,5
p***m,钻石会员,大品牌！！,2018-03-09 07:41:50,0,0,5
梁***豪,钻石会员,可以的哦去,2018-03-09 01:08:42,0,0,5
小***豆,金牌会员,老人用正好,2018-03-07 11:06:50,0,0,5
龙***味,金牌会员,不错。够大,2018-03-06 19:26:49,0,0,5
阔***y,银牌会员,骁龙625终归是中端处理器，流畅度一般,2018-03-04 17:59:12,0,1,3
j***j,银牌会员,还行挺好,2018-03-07 10:16:31,0,0,5
X***B,金牌会员,其他都挺好，怎么打电话的功能不好呢？经常时断时续，开始我还以为是信号的问题，可是信号是满格啊！,2018-03-04 15:41:22,0,1,3
阿***3,银牌会员,"真的是好差的体验，后面的那个感应键老是碰到，以为可以设置，结果没有
没有游戏勿扰模式，不小心朋友底下三个键就各种懵逼
打王者的话不要选这个，因为会跳帧跟突然断wifi，就是50ms突然掉到460，不知道为什么，反正以前的手机在同样网速下没试过，也别说我打开其他应用，我连微信都关了，配置调最低也是一样。
偶尔打开网站会卡住提示无响应，以为是新手机要适应一下运行，结果好几次都这样
听说是系统更新没完善，反馈之后也没得到回应，我只能给这样的评价，作为一个想要使用并长期使用小米机的我深表 体验差 望思",2017-12-31 00:23:59,2,1,1
j***i,银牌会员,玩游戏老是掉线，其他还好，4G还经常掉线，不管什么游戏都是经常掉线，掉线掉的烦死了,2018-02-28 21:18:45,0,1,3
a***魅,PLUS会员,还可以吧 给老爸买的 就是要小米账户不开心?? 希望够好用,2018-03-06 20:58:12,0,1,3
p***8,金牌会员,屏幕有坏点，本来想换机，不过在边上的还是将就用了。屏幕大显示效果没那么好。,2018-03-08 12:38:58,0,1,3
j***u,银牌会员,货物收到，物流太不给力了，一直在准备发货，就是东西不来，比以往慢了一天。,2018-02-27 08:14:04,0,1,3
y***5,银牌会员,电池续航挺强，网速也可以，就是用了一个多星期吧 手机卡了，玩王者我已经移动点了一会儿才有反应，就觉得很卡，怎么死都不知道。。。便宜没好货,2018-03-04 20:03:41,1,1,2
f***g,PLUS会员,我觉得也就那样子吧 ，反正就是送人呀。,2018-03-07 23:39:18,0,1,3
我***喔,PLUS会员,手机总体还可以，就是有个游戏老闪退。,2018-03-06 09:09:45,0,1,3
V***B,银牌会员,手机是好，就是没有保护莫，商家太抠门了。,2018-03-01 18:40:02,0,1,3
j***c,银牌会员,看起来还好  要用了之后才知道,2018-03-09 18:04:12,0,1,3
b***1,金牌会员,通话信号不好，通话会突然中断。,2018-02-27 20:38:10,0,1,3
神说要有光之悟空快来,金牌会员,"其实1星都不想给，不是针对小米，是针对京东。
显示买手机得体重秤+米粉卡，赠品为小米自拍杆，连夜拍下，第二天到了只有自拍杆，咨询客服说只有自拍杆没有体重秤。没有就请别写，误导消费者啊。
京东不给说法，只能12306继续维权了。",2017-11-29 21:43:48,5,5,1
闫***生,银牌会员,刚到手，用几天再评价。,2018-02-26 12:19:53,0,1,3
j***6,银牌会员,还可以,2018-03-08 20:40:56,0,0,5
j***f,铜牌会员,还可以,2018-03-08 17:11:34,0,0,5
h***峰,钻石会员,速度快,2018-03-07 11:49:01,0,0,5
j***f,铜牌会员,跟我第一次买的差了点,2018-03-05 15:03:32,0,1,3
j***n,银牌会员,刚买就降价，不开森,2018-03-08 15:29:24,0,1,3
h***l,金牌会员,还可以看似先用用,2018-03-03 09:32:07,0,1,3
j***7,铜牌会员,手机拿来有点卡。有的时候还会出现屏幕不灵，商品包装居然是一个袋子。居然不是盒子。以前买手机还重来没有遇到这样的手机用袋子装，而且除了送充电器，耳机也没有送 。我想说现在买手机都没有耳机了吗？？？？坑。,2018-02-24 09:33:21,0,1,2
R***9,PLUS会员,已经使用,2018-03-08 20:06:49,0,0,5
蒲***帅,银牌会员,挺好用的,2018-03-09 20:59:19,0,0,5
j***p,银牌会员,手机很好,2018-03-09 18:40:22,0,0,5
j***5,钻石会员,正在使用,2018-03-09 14:06:56,0,0,5
你***声,金牌会员,非常完美,2018-03-09 01:44:39,0,0,5
荔***路,金牌会员,非常好用,2018-03-07 14:29:21,0,0,5
j***7,银牌会员,还可以，,2018-03-06 20:16:04,0,0,5
jd_158417ghx,铜牌会员,好几个应用都反应很慢，也是郁闷，来的时候外包装就有变形，不知道是摔得原因还是系统的原因，,2018-01-06 00:19:18,1,1,1
j***c,银牌会员,才来两天就自动确认收货了，京东你也是没有谁了？？？手机不卡充电微热就是跟图片不一样，太丑了！,2018-03-07 08:33:37,0,1,2
你***c,银牌会员,快递包装盒太埋汰人，京东差包装盒还是咋滴，将近两千的手机装在一个破旧的盒子里,2018-03-07 08:47:15,0,1,2
h***k,银牌会员,还行吧? ，卡顿是最大问题了，嘿嘿,2018-02-26 00:52:20,0,1,2
j***o,银牌会员,电池电量消耗的很快这是为什么？,2018-03-07 12:26:55,0,1,2
j***4,铜牌会员,还行，觉得不错，具体再看看,2018-03-04 20:12:44,0,1,2
M***g,金牌会员,屏幕垃圾gff贴合，有很高的机率进灰。在小米之家，小米官网，京东前后买过5台Max2，不是到手拆开包装就发现屏幕里面就有灰，就是用不到一周就进灰。不建议购买，小米的性价比=缩水。,2017-12-30 13:32:21,1,2,1
j***8,铜牌会员,刚用了几天，今天突然在家里房间就没有移动网络信号了。怎么搞，昨天晚上还视频了一晚上都没事情。卡没问题。换个手机装上一样能正常访问移动网络。我也是醉了。才买几天啊,2018-03-01 18:51:32,0,1,1
周***诚,PLUS会员,"京东快递太差劲,没有按时送货,并且安排其他同事送货,今天收到货物后发现包装破损,京东快递员说他拿到货就是这样,货物如果有问题,肯定退货",2018-03-05 20:31:48,0,1,1
j***g,PLUS会员,非常好,2018-03-09 23:17:13,0,0,5
j***g,PLUS会员[试用],很不错,2018-03-07 10:31:37,0,0,5
j***x,铜牌会员,我不想说了，我本来有个小米五的没用好久但打王者看视频电量不经用，就又买了这个，结果拿到大把王者卡的不要不要的，我是学生党我的过年钱啊，坑啊,2018-03-03 12:54:07,0,1,1
t***i,PLUS会员,外观不错，但是容易卡，买回来一个星期就卡了7.8次，摄像头也是个渣，渣，白天勉强，晚上就废了，就屏幕大，看视频可以。,2018-02-26 16:26:57,0,1,1
j***w,银牌会员,还可以,2018-03-09 20:38:03,0,0,5
d***4,钻石会员,还可以,2018-03-09 09:43:50,0,0,5
j***p,银牌会员,非常好,2018-03-09 08:56:53,0,0,5
乘***浪,铜牌会员,挺满意,2018-03-07 13:50:42,0,0,5
j***4,铜牌会员,非常好,2018-03-07 07:44:35,0,0,5
玉***风,钻石会员,屏幕下方有黑影，一开始没有发现，等发现时已经过了15天了，想换也不给换了。就只能这样将就着使用了～～,2018-03-03 12:58:27,0,1,1
乾***天,银牌会员,好评,2018-03-09 19:12:43,0,0,5
j***7,铜牌会员,喜欢,2018-03-09 06:28:19,0,0,5
j***4,铜牌会员,还行,2018-03-08 19:55:12,0,0,5
有***低,金牌会员,好用,2018-03-07 18:09:22,0,0,5
j***6,金牌会员,垃圾！垃圾！垃圾！不停断网！网络信号非常好，一分钟之内都可能断，建议不要购买！,2018-03-04 02:33:53,0,1,1
肖***2,钻石会员,不知道为什么每次在京东买的小米都是听筒沙哑，第二次买了还是这样，京东物流就是快,2018-02-27 09:41:37,0,1,1
5***3,金牌会员,"草。。。。买成1.5.9.9...刚刚买几天就降了1oo,太机八坑了",2018-03-04 11:57:06,0,1,1
战***号,银牌会员,前后摄像头效果都不好，图片大小不能设置！一张照片大小都只有2～3M！,2018-03-02 10:35:01,0,1,1
张***旋,金牌会员,买了还没一个月降价了，降价了降价了！,2018-03-06 12:07:41,0,1,1
j***b,银牌会员,卖个手机连防暴膜都没有。第一次见,2018-02-28 15:08:01,0,1,1
gedLkWsAfwvq,银牌会员,真心垃圾，屏幕按下面就自己黑屏,2018-03-08 22:38:21,0,1,1
j***r,银牌会员,价格贵，在也不在这里买东西了,2018-03-02 12:25:11,0,1,1
j***v,金牌会员,一颗星都不愿给了配送太差劲,2018-03-09 17:52:58,0,1,1
j***9,铜牌会员,哼，连一个耳机都没有，讨厌,2018-03-09 09:59:43,0,1,1
j***4,银牌会员,手机有问题  售后不敢恭维,2018-03-06 19:37:37,0,1,1
大***熊,金牌会员,商品折扣夸卷100不给返，,2018-03-06 16:36:54,0,1,1
Z***X,银牌会员,手机经常自动重启开不了机,2018-03-02 14:34:11,0,1,1
l***萄,银牌会员,垃圾，触屏为什么不行的,2018-03-01 21:49:49,0,1,1
j***4,银牌会员,怎么没有给我开发票,2018-03-04 13:50:52,0,1,1
j***5,银牌会员,不错,2018-03-09 16:45:27,0,0,5
A***萧,金牌会员,好,2018-03-09 13:50:33,1,0,5
j***4,钻石会员,经常重启，哎,2018-02-27 12:41:15,0,1,1
i***w,PLUS会员,不错,2018-03-08 05:08:04,0,0,5
j***d,PLUS会员,真的,2018-03-08 00:03:46,0,0,5
j***z,金牌会员,很好,2018-03-07 14:09:30,0,0,5
w***6,PLUS会员,好,2018-03-07 19:13:19,0,0,5
爱***凯,金牌会员,太大了，,2018-03-09 13:23:09,0,1,1
王***y,银牌会员,还好,2018-03-06 07:40:50,0,1,3
j***0,PLUS会员,好,2018-03-08 16:19:14,0,0,5
j***4,银牌会员,好,2018-03-08 22:20:00,0,0,5
j***心,钻石会员,好,2018-03-08 20:13:01,0,0,5
j***m,银牌会员,赞,2018-03-08 11:57:19,0,0,5
宿***草,PLUS会员,大屏大电量，不过国产天马屏，差评，电量是真的够足啊。,2018-03-08 00:04:55,0,0,5
邪***欲,PLUS会员,不得不给个差评，也算忠实用户了，这次有点失望快递晚了这就算了，居然换卡针都不给，我怎么换卡，让我去手机店换吗？,2018-03-07 22:34:10,0,0,4
彦***芯,银牌会员,好评给配送员，差评给包裹，一点防撞措施都没有，直接丢进纸盒里，京东的包裹一直这样，哎……,2018-03-02 11:00:52,0,1,3
j***x,钻石会员,"十几天，也没磕过也没啥的，又黑屏又死机，现在还让我等好久。差评！生气！耽误一堆事
没几天还降了200",2018-02-27 12:51:05,0,1,1
x***4,银牌会员,差评。手机收到了里面发票都没有。而且开不了机。一点电量都没有、冲了半小时电才开到机,2018-03-05 19:37:13,0,1,1
侧***4,银牌会员,差评 双十一有活动 便宜了一百块 要求返差价 却不予理会 很生气,2017-11-22 20:04:54,0,1,1
g***1,金牌会员,屏幕很大，电池也很耐用，挺好。,2018-03-05 21:30:02,0,0,5
有钱任性二手东平台,银牌会员,有点怪怪的亲,2018-03-05 21:28:29,1,2,1
j***d,银牌会员,手机很好，屏幕很大，看视频就是好,2018-03-05 21:21:43,0,0,5
z***j,金牌会员,性价比好！不过老妈还是难得学会,2018-03-05 20:32:27,0,0,5
周***诚,PLUS会员,"京东快递太差劲,没有按时送货,并且安排其他同事送货,今天收到货物后发现包装破损,京东快递员说他拿到货就是这样,货物如果有问题,肯定退货",2018-03-05 20:31:48,0,1,1
C***G,金牌会员,屏大，用着顺手，老婆很喜欢,2018-03-05 20:24:34,0,0,5
j***8,PLUS会员,手机收到了！屏幕确实大，但是为什么无线网连接距离不远，而且像素不怎么样,2018-03-05 20:22:35,0,0,5
j***8,金牌会员,物流很快手机用着还行,2018-03-05 20:22:06,0,0,5
林***志,钻石会员,挺好，京东的东西还是不错的，目前京东没问题,2018-03-05 20:19:11,0,0,5
胖***树,银牌会员,外观很大气，质量很好，这是第二部了，值得拥有！！！大家可以考虑购买！！！,2018-03-05 20:18:10,0,0,5
A***n,钻石会员,可以的，美滋滋。京东还是不错的。,2018-03-05 20:12:46,0,0,5
中***哥,金牌会员,非常快，好评。，，，快递打一百分。,2018-03-05 20:10:59,0,0,5
李***9,铜牌会员,刚用 可以,2018-03-05 20:03:23,0,0,5
紫***王,PLUS会员,手机拆封以后感觉外观很大气，机身很薄，已经使用了二天电池很耐用，看视频可以用十个小时以上，正常待机可以用三天没问题，这个价位非常划算。,2018-03-05 19:59:42,0,0,5
A***i,PLUS会员,老人机很好，给爹妈买的,2018-03-05 19:57:19,0,0,5
k***8,钻石会员,不错，为什么么有耳机，也没有发票,2018-03-05 19:50:09,0,0,5
x***4,银牌会员,差评。手机收到了里面发票都没有。而且开不了机。一点电量都没有、冲了半小时电才开到机,2018-03-05 19:37:13,0,1,1
伦***_,金牌会员,帮别人买的，非常不错，一如既往的支持京东，加油！！,2018-03-05 19:33:06,0,0,5
C***0,PLUS会员,不错哦,2018-03-05 19:32:21,0,0,5
l***i,金牌会员,大气，用着感觉很爽，值得了。,2018-03-05 19:31:34,0,0,5
