名字,会员级别,评论内容,评论时间,点赞数,评论数,评价星级
F***t,银牌会员,哇，真的超好看的说，第一次买华为，比图上还惊艳，真的好喜欢，打王者没的说，开最高不卡，就是注册华为账号有一点麻烦，嗯，决定了，以后都买华为了，没毛病老铁!,2017-10-09 19:37:07,294,98,5
1***m,PLUS会员,屏幕大小较舒服，比较高逼配置一般够用了。,2017-09-29 00:20:00,131,19,5
繁***光,PLUS会员,帮朋友买的，对方很欢喜，老年人玩玩微信足够了，虽然我不认为此机的性价比高，无奈，人家只认华为，人家喜欢什么我就帮人家买什么，不落埋怨，就这吧，都是乡里乡亲的，我不看好这个手机，可是人家喜欢，无奈啊！机器是2017年9月的，很新,2017-10-25 16:10:07,51,72,5
li随风,金牌会员,很棒的手机，质量杠杠滴没话说！速度也还可以，外观没啥大毛病，很不错的购物体验，京东，一如既往地值得信赖,2017-10-28 21:28:05,27,9,5
诗***马,PLUS会员,"荣耀手机二百块优惠券：【 ynh.在线/8Q 】复￥制括号内内容。到浏￥览器中￥打开领取，昨天刚收到的，把玩了一天，觉得还不错，今天上手体验一番，看看这款千元机到底怎么样？值不值得购买？
【机身外观】
1.荣耀8青春版整体而言，颜值非常高，同价位手机里算是佼佼者！
2.机身采用双面2.5D玻璃设计，中框是纳米级注塑而成，按键也是注塑而成，整机视觉效果特别好，尤其是阳光下，非常漂亮。
3.机身正面，采用5.2寸屏幕，覆盖2.5D玻璃，手感没得说。测试的荣耀8青春版屏幕是天马的，我想屏幕厂商还应该有京东方。
4.机身背面，也是采用2.5D玻璃设计，类似镜子一样的玻璃，玻璃是2.5D弧度设计，手感不错！
5.机身顶部，顶部左侧分别设计了降噪麦克风和耳机插孔，如图：设计到左侧，简洁大方。
6.机身底部，分别设计了对称式音腔，中间是U**插口，这里说明一点，右侧是音腔，左侧不是，左侧音腔内设计了送话器！
7.边框左侧非常整洁，没有过多的开孔，只有一个卡槽孔，如图
8.边框右侧，按键键延续了荣耀8的设计，按键反馈适中，没有生硬或
9.机身正面上方，这里简单说一下，布局虽然没什么变化，但是将感光器做",2018-01-03 09:06:05,189,30,5
j***b,银牌会员,手机呢我是用了5天左右才来评价的。说说优点，价格合适，手机颜值还是比较高的，运行没有发现卡顿、很流畅，手机不大感觉很舒服！再说说不足，因为是黑色，手机很容易沾染指纹，尤其后面还是玻璃材质的，电池电量感觉有点小，个人不长时间玩游戏，也就是是聊天，上网，一天一冲，如果游戏玩的时间长的话那就不止一冲了(我玩的是王者农药)，因为手机本身带弧度，我买的还是全屏的钢化膜，贴完后那个大白边，那个揪心！当时和荣耀6x比较了一下感觉都不错，现在再用6x！感觉还是适合大家去购买的，不亏！有什么在追加吧！,2017-10-08 09:49:31,68,30,5
jd186036erk,银牌会员,"荣耀8蓝色款刚上市的时候我就想买了，但是刚开始抢不到，慢慢的就放弃了，母亲手机进水了，所以就给老妈选了这台荣耀8青春版。外观还是那么漂亮，海思655 cpu 中高档完全够用了，老妈一就是微信，斗地主！再说说内存，4G运存，可惜是DDR3的。如果是DDR4就更完美了。现在很多人还没认识到运存的具体参数，所以只关注大小，但DDR3的运存在这个价位的机器里也勉强接受了，新机器没装什么软件，开机后还剩2.8G左右，(如果系统自带清理内存功能，剩余内存就完全够用不用担心会卡顿了)。再说说64G存储，32G开机后剩余26G左右，可这-64 的开机还剩48G居然吃掉了10多个G。老妈换手机要求像素，因为她用手机就是打电话，微信，照相。她怕照相不好，但这个机器我也试了一下，照相选择自动模式(因为老人不会调节那些手动参数，所以只参考自动模式) 照相效果也接受！很清晰。
注意了！    好处说完了，说缺点！！我这机器有个缺点，想调节桌面图标位置时候需要按住那个图标选定后移动，可是我按住图标再移动的成功率很低，很难选取成功！不是没反应就是桌面动。不知道是手机屏幕的通病还是我这机器的问题，这点要扣分！",2017-07-12 09:53:18,720,119,5
黎***洪,钻石会员,荣耀8青春版优点主要体现在物流迅速、包装、内存、外观、相机、品牌，具体如下:1、物流。超快，当天10点多下单，下午2点多就到配送点了，4点多就到手了，因为仓库就在当地不算远。2、包装。瓦楞纸盒，还有充气垫，防震防压防损坏。白色包装盒，撕开外面的透明塑封，里面就是手机。3、内存。手机32G，我个人比较够用，是购机必要条件之一。4外观。个人认为还是挺的，不过本来想买蓝色的，却没有货，就选择了金色的。手感不错，光滑细腻，触感舒服，机身不厚，7点多毫米，不沉。5、相机。前置800万，后置1200万，差不多。屏幕还是挺清晰的。6、品牌。值得信任。7、性价比不错。个人认为不足主要有电池、运行内存、手机屏大小、CPU，具体如下:1、手机电池3000毫安，个人认为还是不够经用，不过又要手机厚度又要电池大，确实不太容易兼顾，也可以理解。2、运行内存。3G，本来想选个4G的，价格又会上浮，的确好平衡。3、屏幕。5.2英寸，看管了5.5，看上去还是要小那么一点点。4、CPU。海思8核，千元机很普遍配置。跟爸妈买的，,2017-10-16 16:18:24,692,28,5
宋***驹,PLUS会员,挺好的。荣耀8 蓝色特别好看。哈哈哈哈哈哈哈哈。骚骚的,2017-11-20 13:15:49,3,29,5
专业抬专业抬价,钻石会员,现在千元以下的国产机真是各方面都强大，做工，手感，系统的流畅度，硬件配置。祖国你好。,2017-11-02 10:52:49,16,0,5
杨***0,银牌会员,京东在我们家隔壁，但是没想到太快了。上午定的吃了个饭就到了。。。能给三十二个赞吗？,2017-10-12 07:59:24,151,6,5
A***2,银牌会员,不错今天买今天到了 手感不错 挺好用 懂我用一段时间再来评价 哈哈,2017-11-22 19:29:20,6,0,5
j***h,银牌会员,非常漂亮，很给力，昨天买的今天就到了，手机比图片上还要漂亮，手感很不错，买给家人的，一收到货都想自己用?，简直爱不释手，等家人用了再来追评！,2017-11-08 19:54:19,5,0,5
r***o,金牌会员,之前给家里人买过华为手机用了快两年了，还是很好，正好自己的NEXUS5电池续航只要俩小时，还是换了，喜欢荣耀8蓝色的外观和配置，到手感觉非常棒，我的要求不高就平时做生意打电话上上微信和fb，待机和分辨率都够了。另外拍照也不错，下面是我拍的自己家的车，效果还是蛮好的。最后我想说两句，关于现在有些年轻人的消费观，买之前看过许多人的评价，说买这款手机当备用机用，当然，这是你的自由，我无权干涉。我呢85后多岁，靠自己打下一片家业，但我手机从没买过2000以上的，衣服都是网上上买，偶尔挤挤地铁。请动不动说千元机这那，哪这，备用，有了别墅有了图上的车再来*，*不是靠什么东西，而是考实力靠的是内在美。要不然，别拿着几千块的手机，穿名牌上街去*你就很厉害了，请老老实实的挣钱上班，孝敬父母，父母养活你不容易。好了到这吧。,2017-05-05 15:02:46,4338,1628,5
j***d,金牌会员,给老公买的，他说还不错，电池很耐用，嗯机子也很好看，可惜为什么他只送了后壳，没送膜呢，之前买的很多手机都是标配有耳机充电器，他这个没有耳机，还需要自己配，自己在京东又买了膜和后壳，总体来说很满意，所有的，电器数码之类的都在京东买的，信赖京东,2018-02-07 11:33:00,8,0,5
茹***忧,银牌会员,"不好意思，差点忘了评价了，手机是帮别人买的，听她说用着还可以给个好评吧，买手机我还是喜欢在你们京东这边来买的，京东这边的服务态度我也是很满意的，但是这次的服务不是很满意，答非所问他说双11咨询人数较多回信息会慢一点那也不是这样子的啊，回信息慢一点可以理解，但不要我问这个，你答那个，这样会让人很恼火的，希望能改进。其他的还是挺好的,听她说挺好用的,还有在这里提个建议，就是手机的发票。能不能改进一下不要默认那个电子发票，给自己买就没事帮别人买电子发票，怎么拿给他呀手机如果没出什么问题那没事，如果出了什么问题，那不是很麻烦吗？",2017-11-23 21:47:32,3,4,5
0***0,PLUS会员,屏幕大小还行，就是按键设计的很naocan，放到屏幕里面，不仅不方便，还占地方，现在真正显示内容的地方感觉矮胖矮胖的，截图会把按键也截进去，不爽。手机预装了好多软件，拿回来第一时间能卸的全卸了，目前还算流畅，希望能保持，不要像渣米一样，系统装好多乱七八糟的软件，还卸不掉，真到了那一天，华为也就快完蛋了。第一次开机，手机体检88分，华为你这是自己打自己脸么，而且我连SIM卡都没装呢，通讯录也没导入呢，你就给我预装一堆黄页，这么多电话号码，我就想问问你们收了多少广告费？屏幕弄成个2.5D，膜也贴不了，无所谓了，不贴也行。百度zhazha的输入法卸不掉，强制记录步数真的好吗？真不是故意来找碴的，是真恨铁不成钢。真的很想用一个干净的安卓机，没有捆绑，没有强制推荐，没有强制升级，系统简洁流畅，哪怕你再贵个300～500也行。也就拿来当个备用机吧。不是针对这个手机，是所有安卓机的现状。最后的最后，京东也开始做房产中介了？,2017-12-20 14:54:13,4,4,5
猫***瓢,PLUS会员,指纹非常快，，买给我母亲的这是我第二次买华为的手机壳。之前买的坚果质量真的有问题，华为不错。声音还是比较大。还送了个后盖,2018-02-02 19:44:43,5,0,5
爱***堂,PLUS会员,很棒！！！！！京东自营华为荣耀okokokokokok!!发货快速，服务态度好，店主态度好好，快递员又有爱心，昨天下单今天到达，已经买N次啦！！！！！！！！！！！！,2018-01-07 12:39:56,16,6,5
j***c,银牌会员,手机很漂亮，头一次在网上买手机，现在在升级系统，感觉还不错，只是指纹只能录一个，不知道玩游戏顺畅不，总体来说还是不错,2018-02-11 11:09:03,4,2,5
a***7,金牌会员,东西挺好的用的还行是真品,2018-02-09 23:03:50,1,0,5
青***侯,金牌会员,用了几天了，很好没有任何问题，之前买的荣耀8，这个给妈妈买的 ，荣耀8用了一年半了，没有然后问题，所以这次还是选择了荣耀的。包装比之前好，打有密封袋。送有一个四边的手机壳。希望一如既往的好用。音量也够大。录屏才是60%音量。足够满足妈妈用了，喜欢，刚开始拿到内存可用到3G，我的荣耀8平时是2到2.8。之前陪朋友去实体店，别的机子新机才是2.5左右,2018-02-26 05:50:53,1,0,5
j***d,金牌会员,很喜欢?手机都是上京东买的，价格比店里的要好,2018-02-26 19:27:31,0,0,5
r***o,PLUS会员,帮朋友买的第二台了，主要运行快，手感好，外观时尚，做工精致。,2018-03-02 10:21:13,1,0,5
H***涵,金牌会员,给婆婆买的，都挺好的，要是能送个全包边的外壳就好了,2018-02-04 11:16:57,4,0,5
j***z,银牌会员,给老婆买的，手机反应挺快的！就是waifi信号不是太好，总体来说还可以吧！了一天有些槽不得不吐: 第一，之前用5.5的手机，屏有点大，单手不好握，所以这次选了个5.2。问题是你才5.2还这么大的额头和下巴，是想显脸长吗？玩游戏感觉画面效果都不是一个档次的，唉，还是怪自己太天真。 第二.触屏有偏移。写评价的时候发现的，我点3星总是往4星上碰，试了下大概50%的几率，呵呵呵呵我换个手机评！！ 第三.本来就有个大下巴又搞个虚拟home键，操作界面更小了……虚拟键还不好点……实际操作的屏幕占比简直……唉…… 优点也是有的吧，机子漂亮（但是怕摔怕摔怕摔），一个手能握住（我可以不要大额头和大下巴么），便宜…… 其他的也就那样吧，之前一直用三星，目前还没感觉出荣耀比三星好在哪儿，操作习惯差很大，别扭了一天了，捆绑软件太多，想卸都卸不掉，短信和通知放一起，看个短信都得点两级进去，简单点不好吗？都得慢慢适应……烦躁。 哦对了，照相不错，比我那个三星的好。 自己入的坑，哭着也要适,2017-07-01 03:56:09,46,9,5
向***n,银牌会员,买来当公司手机用的，不错，用了一个多星期了，没有任何问题，只是刚收到货就看见掉价，心疼了一下，其他都满意，比实体店便宜一百多块钱,2017-11-15 15:54:53,6,5,5
2***n,银牌会员,真棒，国产华为现在做的是真的好，1000块钱还买啥，配置赶上三星2000得了。跟苹果4差不多厚。屏占比可以。手机手感很好，塑料外壳。轻。性价比高。适合我这种穷人。,2018-01-18 04:59:29,3,2,5
j***y,金牌会员,快递给力，服务态度好，手机很快，已帮别人够第五部了,2018-03-08 21:42:02,0,0,5
j***y,铜牌会员,京东自营华为荣耀手机，发货快速，第二天就到货，好用运行快，款式颜色喜欢。,2018-02-08 08:01:39,2,0,5
l***4,银牌会员,昨天买今天就到货了，京东速度是很快的，主要给儿子学习用，刚才看了一下里面还有学生模式，这样可以有效控制他玩游戏时间。真的挺不错，买的时候还在想会不会买了后悔，小孩子没有控制力，就怕玩了手机不要学习了。,2018-02-18 12:43:50,0,0,5
j***7,铜牌会员,不错很好，手机又轻又好看。屏幕还好不知道电池续航怎么样。流畅度可以。,2018-02-09 15:13:36,1,0,5
郭***0,金牌会员,宝贝收到，京东商城的手机，一如既往的好，发货很快。,2018-02-20 02:17:14,1,0,5
下***雨,金牌会员,用了一段时间了，暂时没有发现问题，家人用的，毕竟用的少，就接接电话啥的，应该没问题，希望质量杠杠滴??,2018-03-04 11:08:49,1,0,5
j***z,银牌会员,非常好用的手机，一直信赖华为，第二次购买了~,2018-02-20 15:30:20,0,0,5
j***e,铜牌会员,是正品，真货，值得购买！五星好评,2018-02-12 14:50:32,0,0,5
不***蕊,铜牌会员,不错  给老爸买的   外观很好看也很轻薄要是能送我一张钢化膜就更好了  ?,2018-02-25 15:31:04,1,2,5
晓***哥,银牌会员,用了今天才来评价，手机很好，下了很多东西也很流畅，重要的是直播王者特效全开都不卡。想买的赶紧下单吧！！！,2017-10-03 12:00:19,7,6,5
j***i,PLUS会员,不错，很省电。目前用起来非常流畅，功能也很人性化。还送了一个背壳。等3个月后再追评。握感和大小都很合适，做工不错。作为千元机很超预期。收到货以后猴急地把膜贴上了，照片里的不是原机的样子。,2017-09-30 16:16:24,6,2,5
A***2,银牌会员,第二次买了，这次是买给家人的！非常好用！而且晚上下单第二天中午就到了！很棒！！！,2018-02-10 12:28:16,2,0,5
北***星,PLUS会员,头天晚上拍的，二天下午就到手了，很好用运行很快，款式颜色很喜欢，好评。,2018-01-29 11:55:40,1,2,5
雪***深,金牌会员,特别漂亮，买给我爸用的，手感很棒，触摸屏也很灵敏，反应速度都很快，拍照很清晰。看他老人家爱不释手呢！,2017-12-21 20:31:52,2,2,5
_***子,银牌会员,真的很不错 华为手机很良心 这么便宜 性价比很高 给父亲买的 以后给父母买手机认准华为了 赞一个,2018-02-17 19:52:23,0,0,5
d***6,PLUS会员,感觉还挺不错，物流也很快4个小时不到就收到了,2018-02-22 15:46:28,3,0,5
j***n,金牌会员,给老妈买的，这手机颜值很高，屏幕也不错，配置也很不错，系统反应也很快，待机也很好，手机拿在手里很温润，我都有点爱不释手，可能是用久了苹果和不变的外观，一下被这手机吸引了，虽然是青春版但老妈用足够了，支持华为......,2017-12-04 22:46:09,2,0,5
yuan02110217,金牌会员,"用了一天后的评价，可能不是很客观，不是很深刻，但是是这一天我最直接的感受！
优点：1，外观漂亮，尤其黑色熄屏的情况下，浑然一体，有    种惊艳的感觉；
2，配置虽不及旗舰版荣耀8，但就这个价位也算是良心了，我不是超级游戏党，一般程序和不大的游戏运行流畅！开多个程序也无卡顿；
3，发热小，相比之前我用的某米，发热真的可以忽略。
缺点：1，木有陀螺仪，看不成vr，这个有点遗憾；
2，木有快充功能，充电时间较长，但可能是软件方面的优化，待机时间还是很理想。",2017-04-11 21:59:21,12,3,5
j***g,银牌会员,看错屏幕尺寸了，不过5.2也够用了，看视频也高清。得赶紧贴膜上保护套看着很怕摔的样子。,2018-03-02 16:48:43,0,0,5
二***子,钻石会员,这是帮亲戚买的，自己用的手机还是荣耀6，推荐给其他亲戚用的手机都是华为或者荣耀的，身边用华为荣耀手机的人也越来越多。越来越觉得华为的手机越来越好了，是整体越来越好了，特别是外观设计真的进步很大。这款荣耀8青春版真的非常非常漂亮，实物图比效果图好看很多倍啊！双镜面玻璃的设计真的太漂亮了，一看到这部手机就喜欢上这部手机了，完全无法自拔！外观给满分！说到性能，其实也足够用了，4G全网通，想用什么卡就用什么卡。处理器是麒麟6系列，足够我用了，反正不是游戏党，完全够用。3+32的配置才是完美组合，也足够用了。屏幕看起来很舒服，1080p的显示效果确实很好。之前纠结V9play，最终还是买了荣耀8青春版，主要就是因为外观和麒麟芯。京东还是一样给力，物流速度超快！支持华为！支持京东！,2017-10-17 16:54:10,4,0,5
暴***a,PLUS会员,手机指纹解锁很快，外观也精美，京东购买放心实惠，手机解锁速度比苹果还快，希望以后不会卡机，新手机暂时没有发现毛病,2018-03-02 09:29:20,1,1,5
三***忍,铜牌会员,用了一段时间，手机不错，第一次买华为，性价比很高，京东小哥服务态度就是好，速度快,2018-02-23 14:36:24,0,0,5
王***福,金牌会员,物流确实快，昨天晚上10点多买的，今天上午不到十点就到了，现在刚拆，确实比较不错,2018-02-21 10:32:10,0,0,5
j***r,铜牌会员,不错！买给爸爸用的，希望好用，物流速度快，好评！等用几天再看看吧,2018-01-27 17:24:22,1,0,5
g***6,PLUS会员,昨晚下单，今天就到货了。速度快，买给家人的。,2018-02-22 13:35:28,0,0,5
j***0,银牌会员,京东快递必须给赞，商品跟描述的一样一样的，用起来也很好。,2018-03-01 20:50:48,0,0,5
j***8,金牌会员,给别人买的，用的还可以，符合千元机的标准，这个价位华为是首选之前买了完这个又买了个1099的白色的，运存比这个小一点，总体来说还不错，一共买了两台，手机电子设备都在京东买，品质有保障，光手机就在京东买了7，8个了,2017-08-15 13:39:34,1,0,5
乘***c,PLUS会员,试用中，具体还要等下一段时间看看,2018-02-27 22:19:41,0,0,5
j***你,铜牌会员,在用了 还可以 给家人买的 颜色好看,2018-02-19 11:16:47,1,0,5
a***6,铜牌会员,很喜欢，快递速度很快，用一段时间在评价,2018-02-09 16:51:29,0,0,5
想***闹,铜牌会员,手机收到了，这款好喜欢,2018-03-05 21:43:09,0,0,5
n***t,铜牌会员,充电速度溜溜得没话说,2018-02-21 09:40:32,0,0,5
j***G,银牌会员,手机用了一个多月了，物超所值！第一次在京东买手机。不错，是正品。反应速度超快，拍照很清晰，电池能用好几天，比我的苹果5S强多了。??????,2017-08-07 21:52:55,4,0,5
j***i,PLUS会员,还可以   流畅  先用用看  过后再评价,2018-03-03 22:15:07,0,0,5
j***c,银牌会员,很好，手机也可以,2018-02-25 14:35:46,0,1,5
j***b,铜牌会员,还好还好，挺OK,2018-02-13 20:22:48,0,0,5
l***6,PLUS会员,手机非常不错，很好用，和逾期一样，这个价格买到这个手机真的可以了，好看的外观，好的手感，还挺流畅的系统，日常使用没问题，都挺好的，我这个手机是买来送人的自己看了都喜欢上了，特别是指纹解锁比我的6spuls快多了，出汗也能解锁，完全是属于秒杀，着实是震惊到我了，要知道这手机可不贵啊，手机的流畅程度说实话也让我非常意外，你说800元的新手机能做到这样的流畅，系统优化的也还行，还好用，真的没有什么不满意的，价位摆在这了，要的就是性价比，华为良心厂商，支持国货！！特别轻巧使用也灵巧的手机,2018-02-08 10:39:19,0,0,5
z***4,银牌会员,机子很漂亮，手感也很好，送给家人，很喜欢。,2018-03-01 13:03:31,0,0,5
h***8,PLUS会员,昨天下单，今天上午就到了，京东给力！手机不错，手感很好！支持华为！,2017-03-23 11:06:06,19,5,5
l***3,金牌会员,手感特别好，很轻巧，总体来说蛮不错,2018-03-04 13:34:37,0,0,5
1***p,银牌会员,还是可以，给老爸买的,2018-02-03 10:50:12,1,0,5
jd_137516nnk,银牌会员,"京东的物流除了618太慢，其它日子真的是没得说，昨天傍晚拍的，今天早上就到了。
宝贝包装很好，一点磕碰都没有，而且还送手机壳，反应也很快。对了，还送了暴风影音的3D眼镜！这次购物真的很愉快。
手机买给我老婆的，看她用得怎么样再追加评论！",2017-07-07 23:51:57,6,3,5
蓝凌勇,金牌会员,"OPPO  vivo  魅族  都用过，上台机子是小米note。第一次接触华为是几年前的华为荣耀4A。这次入手荣耀8 青春版看重的就是颜值。
真心觉得这款机子漂亮，手感很不错
4+64GB全网通 配置也算可以，整体来说这机子在千元机里还算是亮点蛮多的，配置中规中矩，但是毕竟华为的品控和稳定性比小米 魅族和乐视之流好点，同等价位配置的话完虐OV",2017-09-22 10:26:02,5,2,5
乖***7,银牌会员,不错 可以 掂靓 买 劲,2017-10-03 12:44:01,5,0,5
j***2,金牌会员,一次买了两部，都是最高配置的，老婆一步幻海蓝，我一部黑色，对京东的自营手机一直很信赖，希望京东越做越好！。。。耳机还没拆，不过这款耳机看着比较中性，我和老婆都比较喜欢。。。反正京东上自营的华为很让人信得过，现在我们全家四个人全部都是用华为机。。。,2017-06-17 21:05:36,6,4,5
沐***a,银牌会员,挺好的，颜色什么的都很精致，主要是想show一下我的骚当,2018-02-27 22:44:50,1,0,5
可***j,铜牌会员,初次使用华为荣耀手机，先试用了还可以，只是不知道可以用多久…我希望是很多年??,2018-02-11 22:19:14,0,0,5
走***9,PLUS会员,双11大促期间为同事下单抢购，荣耀8青春版是2017年年初问世的一款机器，现在购买性价比是蛮强滴，颜值又好看，手感又强，功能实用，关键是到手价格实惠，虽然处理器比起荣耀8有所降低，但是够用，物超所值！先给好评，后期用用再追评，谢谢辛苦服务派件的京东物流快递小哥的热情服务，点赞！,2017-11-21 01:01:43,2,0,5
j***x,铜牌会员,很不错，手感很棒，滑的时候很是顺畅，第一次用华为手机，还在体验的过程中，慢慢感受与体验吧?。同时，送配员很可爱，服务态度很不错，非常感谢他大过年的还给我送货，?,2018-02-18 10:35:01,0,0,5
j***d,铜牌会员,现在用着还行，试用中，以追加,2018-03-02 12:40:11,1,0,5
j***n,银牌会员,很溜，爸爸很喜欢～手机真的很漂亮。,2018-02-13 19:38:29,0,0,5
莳***琉,铜牌会员,"手感很不错，滑滑的一体机，但是就是颜色没以为的那么深，还是白色比较好看叭。可惜那时白色没货了。下单下的不是时候，本来预计25到的，结果26晚上才到。拍照的话不知道怎么说，因为还没出门拍过，也不清楚效果，不过2976×3968也是挺好的了。内存很大，运行也顺畅，但是如果设成默认SD卡而SD卡太小的话就会卡。然后什么也没有送，除了一个硬邦邦（没错）的手机壳。
说真的，在手机还没到之前看评论看得我莫名恐慌，但是到了后检查并没有评论中的种种情况才心安了的，当然还是建议“货到付款”，到了后拆外箱检查一下手机盒子是否有损的好。不评论了，太糟糕了京东",2017-06-28 10:58:41,20,5,3
j***m,钻石会员,不错，性价比高，值得购买,2018-02-09 20:55:02,0,0,5
