名字,会员级别,评论内容,评论时间,点赞数,评论数,评价星级
极***f,PLUS会员,给婆婆买的手机，颜色很赞，系统运行很顺畅，试玩过两天，总体很满意，手机大小，系统运行，以及手感都很满意，这是在京东买的第三个手机，以后还支持京东,2018-02-27 21:52:08,0,0,5
水***土,银牌会员,感觉还是不错的，但不知和荣耀8的区别是什幺,2018-03-06 09:05:02,0,0,5
狼***9,钻石会员,挺好的，手感不错，运行很快，外观好看，赞一个,2018-02-13 18:48:28,0,0,5
q***l,金牌会员,给老人买的机器，想买荣耀8的，不过没货，不喜欢大屏的，只能买这款了，不打游戏，日常使用够用！要求不多，本来可以买更好配置的红米，但是听说有通话不清晰的毛病，对于父母来讲基本的通话清晰稳定，运行流畅就行！花里胡哨配置可以放一边,2018-03-06 15:44:48,0,0,5
坚***9,金牌会员,东西不错，很美观，除了有点小贵，其它都满意,2018-02-13 18:05:22,0,0,5
j***z,金牌会员,宝贝很好   已经用过了   质量棒棒哒,2018-02-24 23:25:03,0,0,5
j***f,金牌会员,产品还可以但是优惠活动要继续做就更好了,2018-03-07 17:26:15,0,0,5
一***_,金牌会员,机子是不错的  给我妈买的 但是这快递哦  京东什么时候不送货上门了？哪怕在楼下 我下楼也不说什么了 跑物业门口   我跨越大半个小区去取   京东是不是飘了开始,2018-02-10 20:57:32,0,0,5
j***i,银牌会员,屏幕分辨率可以，没用过高级电话。这个不赖,2018-02-20 11:37:36,0,0,5
j***c,银牌会员,商品很好呀，东西不错，不错，很喜欢呀，很好呀，开心呀，蓝色的，也很高贵，很喜欢，很是舒心，舒适，舒服,2018-02-21 12:26:59,0,0,5
韩家韩小二,PLUS会员,替朋友买的，经常在京东购物，速度绝对一流，朋友说这个手机地速度反应也非常不错。,2018-03-04 14:47:51,0,0,5
j***e,金牌会员,使用中，暂时还没发现问题，送了两个手机套,2018-02-13 19:36:16,0,0,5
j***h,银牌会员,"质量非常好，与卖家描述的完全一致，非常满意,真的很喜欢，完全超出期望值，发货速度非常快，包装非常仔细、严实，物流公司服务态度很好，运送速度很快，很满意的一次购物",2018-02-15 10:11:04,0,0,5
花***c,银牌会员,快递很快，手机不错，满意，会介绍给朋友买,2018-01-26 17:33:19,0,0,5
j***p,铜牌会员,真心喜欢，不错以后还在京东买手机！,2018-03-09 12:30:47,0,0,5
汤***9,金牌会员,运行速度很快，屏显效果也很好，华为的机子现在真的越做越好了，秒杀很多千元国产机。家里人全部都用的华为，质量非常好，反应速度也很快，颠覆了以往对国产机的认知。,2018-03-05 13:26:11,0,0,5
a***y,金牌会员,下单第二天就收到了，仔细检查标签很完整，已用了IO多天，升了两次级，目前很满意。朋友说买贵100。,2018-02-10 22:38:39,0,0,5
j***a,金牌会员,手机还可以，就是不理解为什么没有耳机，难道是标配免了，就是在价位上蒙蔽顾客？问客服不搭理我！唯一安慰的就是春节期间京东的快递速度与工作人员的辛苦付出，感谢！,2018-02-26 07:36:43,0,0,5
迷***杜,银牌会员,送货速度非常快！手机挺好！非常满意！,2018-02-21 19:37:27,0,0,5
j***b,银牌会员,还行 又买了一个荣耀9 希望也很好,2018-03-06 15:12:16,0,0,5
m***2,金牌会员,这款手机电池一点也不耐用其它还行，,2018-03-06 08:49:20,0,0,5
苏***9,银牌会员,拍照清晰，物美价廉，用起来还不错，,2018-03-02 08:46:49,0,0,5
小***e,金牌会员,还是挺满意的，颜色喜欢，用起来还可以,2018-02-13 13:03:24,0,0,5
s***3,钻石会员,收到手机了，为啥塑封是京东呢？。。。,2018-02-11 08:02:04,0,0,5
j***d,银牌会员,手感可以，看着飘亮，送老爸的，很好,2018-02-25 13:49:04,0,0,5
诚***n,PLUS会员,性价比高，物美价廉,2018-02-10 06:28:25,0,0,5
w***w,钻石会员,用了多天才来评价，一切正常！赞一个！,2018-02-09 08:17:32,0,0,5
j***9,金牌会员,给爸买的手机。还觉还不错。挺好用的。,2018-02-08 20:21:39,0,0,5
j***r,铜牌会员,买了送给姐夫的，姐夫挺喜欢这个颜色,2018-02-23 10:40:33,0,0,5
j***8,PLUS会员,手机很好，这个买的第二个了，送给一直辛苦的自己，前一个送给老爹了。很喜欢这款手机，青春版，质感很好。,2017-12-11 22:40:16,0,0,5
z***d,银牌会员,先不说东西怎么样，估计没问题，快递员的态度和速度是真的值得点赞的，我估计得快中午送来，没想到早晨九点就来了，还特别好的把我们家门口的垃圾给拿下楼了，点赞点赞,2018-02-20 09:32:53,0,0,5
h***0,银牌会员,挺满意，性价比确实高，价格也不高,2018-02-28 12:04:52,0,0,5
j***a,金牌会员,手机用了一段时间各方面性能都很好！,2018-02-13 20:52:54,0,0,5
j***★,银牌会员,此用户未及时评价，系统默认好评。,2018-02-27 12:12:56,0,0,5
狼***S,钻石会员,挺漂亮，正品手机，价格比实体店便宜，京东物流快，晚上下单，第二天就到了，很给力，五星好评！！！,2018-02-08 23:09:25,0,0,5
j***l,金牌会员,给女儿买的，放假了才能评价！好用,2018-02-22 19:02:39,0,0,5
家***6,PLUS会员[试用],挺好的，家里长辈很喜欢，价格便宜,2018-02-22 14:14:26,0,0,5
j***3,钻石会员,手机刚用没什么问题，就是物流说的20号送货结果21号下午还没送到，等着用就自取的了,2018-02-21 16:06:17,1,0,5
u***j,金牌会员,手机正的很不错，送来还有半格电，用了一下午。触屏也很灵敏。标配有带手机套，手感很好。满意。,2018-03-07 17:51:21,0,0,5
j***v,金牌会员,不错是正品，快递给力，正在试用,2018-03-06 11:11:34,0,0,5
岩***啦,铜牌会员,好好好，就是没送膜。。。。。。,2018-03-04 12:55:55,0,0,5
j***x,铜牌会员,收到货啦，手机很漂亮很喜欢，价格合适 送货也快 配送员服务也好。只是有一点，赠品少了些，只有手机 电源 数据线 卡针其他都没有了，也可以吧挺满意的五颗星,2018-02-14 01:37:14,0,0,5
x***8,钻石会员,大小合适，系统流畅，妈妈很喜欢,2018-02-25 00:20:58,0,0,5
z***5,金牌会员,物流很快，非常好用，很满意。,2018-03-08 11:02:27,0,0,5
a***输,铜牌会员,还好，不错，很快物流,2018-02-21 08:05:56,1,1,5
t***4,金牌会员,感觉还不错，送货速度还蛮快的,2018-03-04 19:15:56,0,0,5
萝***顾,金牌会员,颜色太深，其他跟我5C差不多,2018-03-01 21:45:43,0,0,5
j***心,金牌会员,什么也不说了，大家看图吧，京东客服打了不下五次电话，客服专员说解决不了让我去华为手机售后中心，因为在北京上班，五一假期结束去了公主坟附近的华为售后，人家服务态度不错说过了十五天了可以免费检测换屏，华为售后说这种情况确实属于生产过程中出现的问题而且京东有权利也有责任去解决，回头再联系京东客服，得到的结果是只给检测没有问题不予换货，我要是维修我就去华为售后了，关键我买的是新手机，还没怎么用就去拆机检测，要是你你能接受么？偶然在北京图书店看到一本东哥的自传我的管理模式，完后成了京东的粉丝，物流速度确实快，可是快有什么用，东西有瑕疵的就给发出来了，是不是还有好多有问题的都给发出来了，只是大家没有注意没有细心看呢，失望死了，天地良心啊！,2017-05-09 22:03:52,89,23,1
低***雅,银牌会员,已经使用还不错，手感也很好！,2018-02-26 16:39:41,0,0,5
j***g,银牌会员,颜色好看，上网超快，照相清晰。,2018-02-11 23:05:59,0,1,5
淋***晨,PLUS会员,快递很快，包装完整，头天下单第二天都到了，京东物流棒，是正品，很满意！,2018-02-10 22:46:37,0,0,5
离***a,金牌会员,还不错，给家里人买的，很满意,2018-02-24 10:46:08,0,0,5
我***宝,PLUS会员,快递很快，包装完整，头天下单第二天都到了，京东物流棒，是正品，很满意！,2018-02-09 23:55:37,0,0,5
j***z,金牌会员,"妈妈说还挺好用的
关键是好看",2018-02-23 18:33:22,0,0,5
j***p,铜牌会员,宝贝不错，物流给力一天就到了,2018-02-22 18:17:42,0,0,5
m***d,银牌会员,这个是今年过年买的第二台华为手机，之前买的还不错，于是给妈妈也买了一台，满1399减200，4G运行内存，很实惠的，手感也不错，赞?物流也很给力！,2018-02-20 16:05:07,0,0,5
会***6,银牌会员,用了一段时间来评价的。指纹解锁灵敏度打90分，颜值打80分，启动软件速度较慢打70分。双卡一个4G一个2G，价格还是尚可，总体来说还是可以用用的。,2018-03-01 01:08:50,0,0,5
橙***y,金牌会员,拿到货以后很满意，和想象的一样一样在京东上，包装、速度，外观质量以及服务都选择京东。几乎所有的手机都是在京东上买的。个别有瑕疵，但总体还是不错的。,2018-03-07 08:20:49,0,0,5
v***r,银牌会员,很喜欢的一款机器很实惠好评,2018-02-23 18:03:03,0,0,5
j***3,钻石会员,感觉还不错，就是声音太小了,2018-02-21 09:27:22,0,0,5
j***q,银牌会员,手机操作很流畅手感也很好,2018-03-06 21:44:14,0,0,5
j***z,铜牌会员,非常的时候买到非常好的产品,2018-02-19 13:22:35,0,0,5
j***n,金牌会员,快递挺快的！买来送人的，外观挺好看，送的时候还比较有面子，而且也不是特别贵！朋友用起感觉也很不错！打王者荣耀很顺畅，终于不再听到他怪手机卡的抱怨了！,2018-02-08 22:19:45,0,0,5
一***抛,钻石会员,很薄，美形，电池不是很给力,2018-02-11 15:20:15,0,0,5
刘***3,银牌会员,质量不错，我女朋友非常喜欢,2018-02-11 12:45:41,0,0,5
j***r,银牌会员,这款手机真不错，太值了。,2018-02-24 18:30:39,0,0,5
D***鼠,钻石会员,挺好的 支持国货 支持华为,2018-02-10 04:20:45,0,0,5
j***c,银牌会员,还不错?！性价比很高！,2018-02-21 13:56:29,0,0,5
b***n,钻石会员,给老人买的。用着还不错。,2018-02-21 16:51:30,0,0,5
雀***4,钻石会员,"快递慢得一踏糊涂；货到配送站点后二天都没人派送，害的我自己去配送站点取货。
导致货没人送的原因是因京东派送员辞职造成的，为啥辞职了？。。。。。。",2018-02-22 09:17:16,0,0,5
远***索,PLUS会员[试用],"手机很好,运行速度很快.  就是电量有点问题啊, 我就看看微信和QQ和起点,没有玩游戏和听音乐,电话也少.2天就没有电了.",2018-03-04 08:50:31,0,0,5
千***雪,金牌会员,手机还行，蓝色的怪好看,2018-03-01 11:05:20,0,0,5
l***g,PLUS会员,配置还可以，大小合适，赶上搞活动价格也不贵，大品牌质量应该不错（用上一段时间才有发言权），购买方便，到货或快，总的来说满意。,2018-02-13 11:32:32,0,0,5
j***i,铜牌会员,送给老爸的 希望他会喜欢,2018-02-12 13:34:28,0,0,5
j***i,金牌会员,华为手机，已买n部了！,2018-02-26 20:46:34,0,0,5
好***我,银牌会员,前后玻璃。看着很有逼格，边框是塑料材质，手握起来有些些难受，要是金属边框那就奈斯。性能什么的老人家没过多要求，总体感觉还是不错的，为国产点赞！,2018-02-26 14:03:48,0,0,5
2***s,银牌会员,比想象中的还要漂亮！赞个,2018-02-08 12:35:41,0,0,5
我爱斗地主123520,PLUS会员,屏幕不灵，如果有深感同受的点赞，证明华为荣耀8青春版这款手机有质量问题，而且打游戏说好的不发烫呢，还是不样的发烫，1099还没得快充，华为手机也该退出市场咯，废物辣鸡，    毁我青春，耗我钱财。,2017-04-29 00:21:10,317,61,1
C***l,银牌会员,刚刚拿到啦  很开心  感觉挺好用的 比起之前用的 现在用起来心情舒畅很多 刚开始一直纠结要32G还是64G 如果不太要玩游戏可是选择32G哦,2018-02-20 12:48:03,0,0,5
纯情2哥,银牌会员,买回来用了一段时间了感觉挺顺畅的，系统自带的输入法不好用，自己下了个搜狗输入法。还有玻璃后盖沾指纹沾灰。本想买v9的，但本地区没货。将就一下了。,2018-02-10 13:15:57,0,0,5
2***4,钻石会员,东西非常不错下次还会买,2018-02-14 16:45:58,0,0,5
j***u,铜牌会员,给老爸买的青春版基佬紫，外形看起来还不错，长辈用也就是那几个功能，目前觉得还可以,2018-02-23 21:01:01,0,0,5
董***生,PLUS会员,"外观设计漂亮 屏幕显示清晰 我玩个游戏没卡过。像王者荣耀 极品飞车 虚荣 没卡过 远行速度块。 
缺点：电池有点不耐用 其他都相当不错。 
心得：魅海蓝这个镜面效果确实漂亮。手机运行速度更快指纹解锁也很快。大小作为备用机跟适合。很值得拥有。体验了一天感觉不错价格合理性价比超高第一次用荣耀手机以后就选择它了。
缺点就是快递包装太差，就一个塑料袋装着，也没有保护的措施，来的时候盒子都扁了，辛亏没伤到手机",2018-02-18 08:25:03,0,0,5
j***蓉,PLUS会员,很好，手机速度快，外观好看，颜值高 ，比实体店便宜 支持京东,2018-02-21 10:03:30,0,0,5
s***9,PLUS会员,给老妈买的，不错。好看,2018-02-05 20:42:47,0,0,5
出***安,金牌会员,老婆很快就上手了，大小正好，系统还可以，就是几个按键还不习惯，老婆来点了个赞�,2018-03-06 18:23:25,0,0,5
j***n,银牌会员,手机还行，就是没有耳机?有点落差，然后最气的是快递，京东之前的合作公司都挺好的，这次发的EMS服务态度之差，而且还要自己去取，都不送货到门,2018-02-25 15:11:26,0,0,5
j***p,金牌会员,东西不错送货速度很快,2018-02-17 17:51:11,0,0,5
战***火,金牌会员,老爸在用看看使用情况吧,2018-02-02 22:13:12,0,0,5
j***9,金牌会员,用起来还行，毕竟是新机。就是刚开始两天有出现SIM卡没有信号，重起了直到现在就没出现过。电池一般吧，我也没玩游戏，两天一充。我直充到八成九成的电量。一千多元的手机也就这样吧。信任华为产品，支持国货。,2018-03-05 16:58:04,0,0,5
j***r,铜牌会员,特别喜欢颜色也喜欢,2018-03-06 14:19:45,0,0,5
f***凤,金牌会员,给姐买的她说很好用,2018-03-02 15:09:20,0,0,5
q***l,金牌会员,没想到京东服务会那么差，一直在京东购物，很少退货，因为信任京东所以这次选择在京东购买手机，收到后不是自己理想中款式，想退货，一直没处理，马上过年了，看来过年都没法用上新手机，说什么无理由退货，骗人的～,2018-02-11 17:07:29,0,0,5
j***0,金牌会员,给老妈买的，以前给她买过一款运行内存2G的，说是卡的厉害，这不满足一下她的心愿，换了部运行内存大的手机了，华为荣耀挺不错的。第三部荣耀手机了,2018-02-27 13:59:22,0,0,5
a***班,金牌会员,"买的荣耀8青春版,包装不错，不过没打开之前摇了摇有响动，估计是充电头没固定好。",2018-02-09 13:28:37,0,0,5
j***5,PLUS会员,手机看着确实漂亮，价格还实惠，华为的品质又有保证。值得买,2018-02-23 23:58:16,0,0,5
小***9,银牌会员,拍照好，满意，拿起来手感好，电池容量先用着看一下怎么样，到时会推荐朋友买的,2018-03-09 10:39:23,0,0,5
h***7,银牌会员,宝贝昨个就收到了，颜色很漂亮，包装严密，在京东买手机电脑值得信赖的，保质保量。快递也不错，下了这么大的雪也没耽误，态度好，送货快，谢谢,2018-03-09 15:59:34,0,0,5
j***f,铜牌会员,手机还不错我用了一下目前挺流畅的，不卡，手感也不错，颜色好看，然后宝贝和客服说的一样，就是少了几个套餐，有钢化膜和全包的手机外壳就好了,2018-03-07 00:26:24,0,0,5
j***u,银牌会员,手机不错唯一的缺点就是手机屏有一点坡度，膜不太好贴，京东物流非常棒！推荐购买！,2018-01-13 20:20:18,0,0,5
你***a,金牌会员,给老爸买的手机，屏幕清晰待机时间长，开始老爸用不惯现在慢慢习惯了很好用,2018-03-07 22:25:56,0,0,5
j***m,银牌会员,现在用的就是这款，这次是帮别人买的，比当时便宜二百。屏幕大小合适，运行内存和物理内存都不小，反应速度挺快。机器超薄，颜色也很时尚。,2018-03-05 12:30:41,0,0,5
l***_,银牌会员,给老爸买的手机，性能挺好的，手机的颜色也比较好看，但是手机里面自带的手机壳，感觉没什么用。刚买上就给老爸下载了很多东西，老爸用的很好。,2018-02-18 09:01:59,0,0,5
j***l,金牌会员,手机是送给老爸的，老爸比较喜欢。可以上网啦！可以经常和孙子视频，很开心。老公用的也是这款。性价比较高，价格也不贵。京东快递速度很快。,2018-02-08 09:26:20,0,0,5
s***0,金牌会员,买的第二部了，老爷子很喜欢，千元机这个做工已经很不错了，系统也很流畅。,2018-02-21 13:17:11,0,0,5
j***a,PLUS会员,颜色不错，很喜欢，可以加卡，听歌，上网用起来都不错,2018-02-19 12:00:14,0,0,5
j***d,钻石会员,外观简洁很好看，尺寸大小刚好，拿到手里刚好，屏幕清楚，系统运行流畅。,2018-03-05 20:00:49,0,0,5
馒***肉,PLUS会员,帮朋友买的，之前有买过同型号的，非常好用，同等价位的机子这个性价比算高的，通话ok，上网，看电影也很好，不卡,2018-03-06 07:57:47,0,0,5
犹***夏,PLUS会员,外观不错 64G用起来也流畅 华为国产好货 赞赞,2018-02-27 09:32:30,0,0,5
小***4,PLUS会员,物流很快，手机是正品，运行很快，性价比很高，点赞,2018-02-26 11:25:59,0,0,5
再***痛,钻石会员,给女票的老爸买的，到货速度很快，虽然是两年前发布的手机了，但是到手使用感觉还是挺流畅的，品质还行，至于使用时间嘛就得看华为的优化了,2018-02-27 17:18:15,0,0,5
谁***s,银牌会员,此手机外观漂亮，感觉反应有点慢，用一段时间才知道好不好，还有就是不像华为其它手机随便摔，感觉这款手机掉地上会翠屏，总体还是满意的！,2018-02-13 17:44:13,0,0,5
K***C,银牌会员,昨天早上订的货，第二天下午就拿到了，还是在农村 不得不说京东的快递杆杠的。手机也看到了，是全网通，不是和移动的合约机 后续追评。,2018-03-02 20:27:41,0,0,5
j***t,银牌会员,手机不错！用起来很顺畅，外观也很漂亮！华为 你值得拥有！,2018-03-09 13:14:12,1,0,5
涛***上,PLUS会员,价格很实惠，质量很不错，适合学生使用，青年旗舰！,2018-02-18 14:33:27,0,0,5
o***k,PLUS会员,手机帮邻居买的，邻居没说手机什么不好，应该不错吧,2018-02-19 08:36:30,0,0,5
安***婧,金牌会员,在用，机身干净漂亮，只是自己选择的内存小了，可能影响有点卡机，不过大些内存，价格有贵几百，呜呜，搞活动减免150买的，图很清晰,2018-03-01 15:41:27,0,0,5
j***a,银牌会员,刚买不到三天，放在裤子荷包里，也没有收到任何挤压和硬物磕碰，竟然变形这么严重，联系售后回答超过24小时不退货，用了这么多手机，从来没出现这种品质情况，第一次买华为，也是冲品牌去的，质量和售后太令人很失望！,2017-04-04 13:17:43,313,157,1
天***h,银牌会员,效果很不错，,2018-03-08 20:23:49,0,0,5
宴***桃,钻石会员,"物流很快，手机运行非常快，手感很滑很舒服，薄小巧！
音质像素都很棒",2018-02-22 14:12:55,0,0,5
仑***一,钻石会员,外观很漂亮，运行速度也很快。拍照色彩方面感觉没有努比亚的真实，但跟苹果6差不多。现在国产手机拍照比苹果好多了，一直坚持用国货。,2018-02-22 22:17:56,0,0,5
垂***7,银牌会员,用过之后才来评价。包装非常简单，就一个白盒子，只有简单的京东的封条，怀疑是退换机。外观好看，手感不错，屏有点小，但也够用。之前买的时候看到有评论说这款机会出现触碰不灵的情况，我没在意，但是……结果我也遇到了，用了两天以后确实会触碰不灵，没反应，要摁很多次，而且要用力摁，其他的方面还好，一般般，是千元机的配置。没有亮点，但也不算太差。快递服务好评。,2018-02-11 22:48:14,0,0,5
j***8,PLUS会员,不错不错，物流超快，晚上11点购买第二天上午10点就到货，而且还是过年，手机是买给侄女的新年礼物，超喜欢。,2018-02-14 18:56:36,0,0,5
许***0,银牌会员,手感还不错，运行正常，收到时包装盒的一个角被撞扁了，不过没有影响到里面机器，能正常使用，电池目前比较耐用，再使用一段时间看看,2018-02-27 09:20:28,0,0,5
永吾忆爱,钻石会员,手机非常不错，不要听受一些人的误导。自己喜欢就行，反正我这个没有质量问题，颜值也好看。自己喜欢就行，千元机里面也算是不错的了。,2018-02-13 08:10:21,0,0,5
快***籽,金牌会员,使用感受不错,2018-02-24 18:37:08,0,0,5
海豚碗,PLUS会员,"帮忙朋友买的手机,过新年了应该用新东西了,现在买价格还差不错,买的太早这价格就是瞎扯淡!京东快递小哥不错!",2018-02-12 14:38:55,0,0,5
吃***僧,银牌会员,手机手感很好，屏幕是真不抗划，没贴膜放兜里一天左上角就有细微的划痕了，充电器不是快充看电影直播不拖影，一千块钱的东西，很不错了,2018-02-10 12:53:30,0,0,5
郭***1,PLUS会员,手机很好 物流很快  隔天到达  就是包装不敢恭敬,2018-01-08 00:37:55,0,0,5
卍***卍,金牌会员,性价比可以。,2018-02-17 10:32:40,0,0,5
安***7,PLUS会员,商品很好，物流非常的快。用着挺好的，没有什么毛病。,2018-01-04 00:13:28,0,0,5
l***3,金牌会员,手机拍照还不错，给老人买的，可以用，先好评！！！！！！！！！！！！！,2018-01-16 22:04:28,0,0,5
j***z,PLUS会员,用了一段时间才来评价的，物流挺快，配送人员认真负责。这款外观设计漂亮大方，手感不错，运行流畅，值得够买,2018-03-01 23:02:56,0,0,5
乄***情,金牌会员,很好用，不错，很喜欢，买的是幻夜黑的，还送了一个手机硬壳，好评,2018-03-01 14:05:13,0,0,5
l***m,PLUS会员,第二天就到货，速度快，价钱很实惠，很不错，很喜欢，一直支持京东,2018-02-27 17:26:45,0,0,5
超***蛇,金牌会员,虽然不是最新款，外型我满意，速度我满意，从个人方面，这个机子满足我的需求了。电子产品，建议大家买新不买旧，特殊喜好特殊对待,2018-02-28 08:05:37,0,0,5
杨***壹,银牌会员,照作业贼tm清楚,2018-03-09 17:56:30,0,0,5
a***g,钻石会员,在京东买的第二个手机，质量没得说，送货还很快，上午下单下午送到,2018-02-23 09:09:58,0,0,5
严***刘,PLUS会员,这个手机是买给老公的，，因为是过年手机坏了，急着用，比平时还要贵一点不过京东快递还是快的，总体满意吧,2018-03-07 13:23:01,0,0,5
m***d,钻石会员,东西很好赞一个！,2018-03-03 18:44:15,0,0,5
l***O,铜牌会员,"昨天买的，今天就到了，特别迅速，手机很好，我相信宝宝们肯定都去实体店看过所以就不对比多说了?
包装也很不错，没有破损。",2018-03-03 12:36:57,0,0,5
3***0,钻石会员,超级给力的一次网购，一直很信赖京东。手机手感很棒，画面很美。,2018-03-01 22:05:02,0,0,5
d***1,PLUS会员,给老人买的，很好用，很够用！要想用时不卡，一定要选大内存的。电池一般，一般使用强度，有时撑不了一天。,2018-03-01 23:15:33,0,0,5
J***随,PLUS会员,"之前自己用的荣耀8, 老妈手机老卡，想着给她买了个荣耀8青春版。相比荣耀8，青春版应该也不会差到哪去。",2018-02-12 23:11:10,0,0,5
j***f,银牌会员,很棒:京东自营华为荣耀，发货快，服务好好，昨天下单今天到达，手感不错挺好用，非常漂亮，买给家人的，他说很喜欢！！！！！！,2018-02-24 09:53:41,0,0,5
j***9,金牌会员,京东自营买的手机！用了一个月，屏幕摔一下就裂了，有手机壳，有钢化膜，我也是醉了，拿到华为门面店，结果人家说这是一台翻新机！翻新机！翻新机！屏幕不是原装的！屏幕不是原装的！屏幕不是原装的！,2017-07-29 16:42:37,48,6,1
浅***兮,PLUS会员,买给妈妈用的，妈妈很满意，性价比高，点赞,2018-02-21 20:51:47,0,0,5
p***5,PLUS会员,挺好的，便宜好用，反应挺好的，手机跟不错，拍照没毛病，内存也够用，主要价格便宜，千元机性价比很高了,2018-03-08 21:38:39,0,0,5
j***w,银牌会员,这个机子已经买过一个了，千元机中最好用的机型之一。上一个给了我女儿了，她说非常流畅，从不卡顿，颜值高性价比高，值得入手。,2018-02-23 11:03:49,0,0,5
j***4,银牌会员,手机收到了，查询了下真伪是正品。送货速度也特别快，昨天下的单，今天就到了。京东送货就是快，下次购买就来京东。,2018-03-02 20:40:15,1,0,5
