名字,会员级别,评论内容,评论时间,点赞数,评论数,评价星级
J***1,银牌会员,手机还不错！手感较轻,2016-12-06 08:18:46,1,0,5
W***o,银牌会员,手机不错，老爸喜欢！双摄像头！缺点是，侧面有点儿割手！,2018-02-24 22:53:29,0,0,5
蓝***莓,PLUS会员,选择这是第二款产品啦，第一部送老爸，这部白色送老姨，她们操作简单快捷方便，待机时间长，皮实耐用。,2018-01-31 14:00:30,0,0,5
j***v,金牌会员,信号还可以，，就是做工有点，，，,2016-11-18 01:42:31,0,1,5
梦***蓝,钻石会员,首先，京东快递员非常有礼貌，其次，早上下单，下午就收到了，送货很及时。然后评价一下手机，可以调24小时时间，通话音量也正常，就是塑料感很强，掂在手里没有半两重。但是，这种老年机就很好了。电池续航有待考证。,2017-10-14 17:01:25,0,0,5
华***h,PLUS会员,买给爸爸用的，诺基亚就是信仰，可以开机画面不是经典的手拉手,2017-11-28 23:38:36,0,0,5
丿暮栀楠,PLUS会员,给老爸用的.....但是拆开来后感觉不如以前的......,2017-11-26 11:50:27,0,0,5
绽放星生,PLUS会员,给爸爸买的，之前的触屏手机他不愿意用，就是习惯这样的诺基亚，没法，稍后再晒图吧?,2017-06-01 22:56:44,0,0,5
时***e,钻石会员,京东自营的快递就是快，非常感谢快递兄弟热情周到的服务，诺基亚信号稳定，质量很好，值得信赖，满意的一次购物，下次还会光临。,2017-11-01 11:48:27,0,0,5
s***v,PLUS会员,MM买给老妈用的  还可以  信号一般般  毕竟不是以前那个诺基亚了,2017-08-20 20:29:12,0,0,5
j***m,PLUS会员,还不不饿吗？我在你面前可以,2018-03-06 12:26:08,0,0,5
l***5,银牌会员,还没装卡，不知道信号好不好，京东物流牛啊，速度给力,2018-02-03 14:56:03,0,0,5
a***8,钻石会员,给家里老人买的，如果不是操作简单的话就不买这个了，这个价，智能机都能买了好吧。话说两个摄像头，你在右边设一个自拍快捷键干甚，能放一个拍照快捷吗？锁键盘也换了。,2017-05-30 22:26:53,0,0,5
Y***t,金牌会员,给老爸买的，说实话做工很一般，边上金属有点割手！,2018-02-12 11:21:27,0,1,5
j***9,PLUS会员,手机很轻薄，质量也没以前好,2018-02-21 20:33:04,0,0,5
a***伟,PLUS会员,给妈妈买的，还不错，易患疟疾呀,2018-01-22 12:21:25,0,0,5
j***9,PLUS会员,给爷爷买的，屏幕很大，爷爷很喜欢，物流也很快，一直在京东买东西,2017-09-19 23:35:02,0,0,5
葡***哈,银牌会员,京东这次快递太让人失望了     为什么不是京东快递    离我地址还有一两百里     放在那一个星期都不送  最后还是自己掏钱让人家带过来的    手机还可以    就是快递拉吉  拉吉 真拉吉  ！！,2017-08-19 14:04:59,0,0,5
离***磊,PLUS会员,做工还可以，待机时间长。,2017-08-29 18:26:19,0,0,5
招人凡的孩子,钻石会员,640xl玩开片了，换了个230，无论如何都能玩几年吧！做为像素200万的功能机，固化一个自拍快捷键实在多余。外放声音没640xl大，音质也相差了不少，打电话，收短信，手电筒，计算器，听音乐，收音机，看时间，闹钟日历，其实功能可以，可惜，有个新浪微博实则根本不能用！能用几年？,2017-05-30 10:15:16,0,0,5
x***3,PLUS会员,老人很喜欢，挺实惠的！,2018-03-06 20:23:56,0,0,5
36一度,金牌会员,"很喜欢在京东购物，自营物流没得说，一个字：棒！
诺基亚品质非常高，狠耐用。",2017-11-05 11:39:09,0,0,5
袁***生,PLUS会员,还不错的宝贝，物流超级快，按键有点不方便。质量很好。,2017-11-20 09:29:33,0,0,5
合***仔,PLUS会员,给岳父买的。手机很轻，感觉后盖的触感不是很好！功能菜单感觉设置的相当不好，都是图标，不能自己调整大小和汉字。终于明白诺基亚为什么被淘汰了。不过这个当做老人机，还凑乎的用吧！,2017-11-27 16:24:08,0,0,5
i***g,PLUS会员,买给老妈用的手机，感觉还ok，非常可以的，诺基亚老人机，分钱分货，认准京东，认准正品，使用起来还是很有安全感的,2018-01-01 16:32:54,0,1,5
非***吗,钻石会员,按键手感反馈还行，但是有指甲去按就有些不舒服，没有硅胶的按着舒服，用做备用机了。但是如果为了情怀，买1050 105还好着。上面的应用都是鸡肋。,2017-08-07 17:59:34,0,0,5
j***i,钻石会员,适合老年人用 只是界面和原来的诺基亚不一样了 锁键盘开键盘有点鸡肋,2017-12-25 18:44:04,0,0,5
追***K,金牌会员,速度一如既往的快，快递员很好。就是现在京东的包装太凑合了吧。最起码是手机，不用盒子装可以，最起码用减震袋子吧，结果外面就是最普通的塑料袋子装着的。太省钱了。。。。,2018-03-01 04:33:11,0,0,5
j***n,钻石会员,给家里老人用的，很不错，还是诺基亚靠谱,2018-01-06 09:21:06,1,0,5
郭剑亮,金牌会员,东西很好！京东的服务也一如既往的好！支持支持！东西很好！京东的服务也一如既往的好！支持支持！,2017-06-10 08:58:14,0,0,5
S***手,金牌会员,物流快递超快，给个赞，手机单薄了点，还可以，,2018-01-29 17:14:10,0,0,5
j***x,银牌会员,东西很好，老人很满意，快递小哥服务也超好。,2018-02-11 12:29:52,0,0,5
j***s,金牌会员,宝贝已收到，物流超快，颜值高，手感很轻，越南产，刚到手，用一下再评论，对比了一些功能机，就这款俱佳！,2018-02-26 11:20:35,0,0,5
h***o,钻石会员,送货速度很快，收到手机后评价一下，外观不错，对于老人机来说按键稍小，再大一点就更合适，手机设置方面做的不够好，左右键的功能应该可以调就好些，操作方面对于老年人来说偏麻烦些，电量方面用一段时间后再评价。,2016-10-13 23:05:46,1,0,5
l***v,铜牌会员,已到手，次日达，给力，给老爹买的，老爹一直是诺基亚的忠实用户。一定喜欢,2017-11-10 14:16:37,0,0,5
E***0,PLUS会员,手机屏幕够大 充一次电用5天 大概是备用机 就这么省电吧操作少 感觉和老诺基亚差别好大 看logo就有一种温暖的感觉 好像回到了 高中时代 总体来说还是不错的,2017-04-23 12:06:01,0,0,5
m***e,PLUS会员,手机好轻哦！一点手感也没有，而且里面没有内存，没有背景，想存点壁纸告诉我内存不足，呵呵。。太简单了，真对得起这个价格。接电话声音很空旷，老感觉里面有回音，哎。。凑合用吧！,2017-10-20 09:55:36,0,0,5
j***0,PLUS会员,小巧方便携带，基本功能齐全，适合老人使用。,2017-12-15 23:05:34,0,0,5
张***你,钻石会员,物美价廉 诺基亚手机质量还是杠杠的,2018-02-28 22:49:07,0,0,5
j***l,PLUS会员,"不错的机子，通话质量比我的三星c9pro强多了
       用联通卡可以比较多的出来!诺基亚不愧名牌,我的选择是正确的!",2017-04-19 16:35:57,1,0,5
N***C,PLUS会员,卖家服务态度很好，物流很给力，真是物超所值。,2017-11-15 17:42:39,0,0,5
纸***f,银牌会员,总体来说还是不错的，就是结合处有些隔手,2018-01-29 08:20:42,0,0,5
j***8,铜牌会员,声音小！感觉都不是诺基亚手机！假的！没有像网上所说的那样！不过快递还是挺快,2017-06-04 12:20:33,1,1,5
W***C,银牌会员,平时老爸只会用按键手机，所以就给他买了个诺基亚，中老年人使用起来比较简单，不过手机壳背部做工稍微有点粗糙，有倒刺感，拿上手感觉容易划伤，功能方面暂时没什么大问题，还是可以接受的，不过性价比不高,2017-09-10 18:10:03,0,0,5
j***z,银牌会员,价格有点贵，上网也不行，当备用机还可以，但愿能像诺基亚以前的品质一样，结实耐用！,2017-07-01 08:10:26,0,0,5
曜***芒,金牌会员,2G网络仅支持900MHz、1800MHz两个频段，850、1900不支持。不支持电信CDMA，且联通的3G网络可以支持通话，很多地区2G逐渐退网清频，所以此机只适合移动用户。等VoLTE普及，2018年5G部署，移动2G也会清频退网，所以……,2017-12-31 15:25:02,0,0,5
j***8,银牌会员,拍照，屏幕满足作为备用机的很好。,2018-03-02 10:59:48,0,0,5
j***4,PLUS会员,手机已收到，还好吧,2018-01-31 17:12:57,0,0,5
j***天,PLUS会员,特别棒，会想到年轻的时候，不过现在有点不会玩了,2017-10-11 22:33:31,0,0,5
j***j,银牌会员,老人用着不错，字体也不小，不怕摔,2018-02-24 11:34:47,0,0,5
刻***石,金牌会员,手机不错，屏幕大，老人用的也好，现在功能手机没什么选择了，当年的信仰。虽说现在诺基亚不是当年的，总比杂牌强，希望以后这种手机还有,2017-10-02 12:09:43,0,0,5
wobeiqi,钻石会员,这机不识老sim卡，结果到沟通100补张新卡就能用，显示效果有点差，反光。信号也没有想象中好，不太移定，在信号一般情况下通话经常丢字，不知道对方说什么，体验一般，没有当年诺基亚的通信技术和扎实,2017-08-18 01:12:13,0,0,5
依***姜,PLUS会员,比其他的好，这个不错，还能照相，还是前后都能，虽然空间小，但是也能存两张，真的是两张，个头小，放着方便，携带方便，这么便宜的东西，不挑剔,2018-01-19 15:33:47,0,0,5
d***强,银牌会员,手机很好用外观很好看我家也很喜欢,2018-02-14 18:42:20,0,0,5
v***8,银牌会员,京东值得信赖 物流快 手机质量毛问题,2018-01-15 18:10:51,0,0,5
j***p,银牌会员,物流快，前天下午下单，昨天中午就到手！上午充满电到今天中午电量满格，手机感觉还可以，作为备用机就接打电话用，电池容量待机时间够长就好！！,2017-07-05 12:04:34,0,0,5
未***司,PLUS会员,挺好的，先用着吧。分辨率就那样了，不能要求太高了！,2017-08-21 08:18:16,0,0,5
铭***G,银牌会员,此用户未及时评价，系统默认好评。,2018-02-03 17:02:17,0,0,5
j***9,金牌会员,给老妈买的。还是难舍诺基亚的情结。,2018-01-17 21:33:14,0,0,5
潇***y,钻石会员,家里老人用不习惯智能机，送货很快,2018-01-29 17:58:50,0,0,5
j***8,银牌会员,买个父亲的，他爱不释手，高兴的不得了，刚刚到货，暂时没有坏的地方，有的话再追加,2017-06-09 21:24:16,0,0,5
j***n,PLUS会员,质量很好，很满意的一次购物，服务态度超级好！！！,2017-08-21 15:17:42,0,0,5
j***g,铜牌会员,手机第二次充满电，装上s i m卡无电话往来待机十七天左右；如有电话往来，视个人电话多少通话长短而定；通话和闹钟的声音比以往的诺基亚功能机都要响亮；美中不足的只是手机两边的边角有点割手，待机时只有显示日期，没有显示星期，总体还可以。真实感受。,2017-01-09 16:45:10,0,0,5
g***1,银牌会员,发货的速度特别快，当天下单第二天就到了，京东的速度真的很快。服务态度也好。这个老人机的外形很好看，比较薄，适合不喜欢用厚手机的老人。操作也比较简单。,2018-02-25 10:35:45,0,0,5
W***2,PLUS会员,"质量非常好，与卖家描述的完全一致，非常满意,真的很喜欢，完全超出期望值，发货速度非常快，包装非常仔细、严实，物流公司服务态度很好，运送速度很快，很满意的一次购物",2017-10-26 10:32:18,0,0,5
迷***世,PLUS会员,给爷爷买的，诺基亚的品质确实不错，怀念,2017-10-31 18:06:53,0,0,5
j***g,银牌会员,内存不大，还得再装个内存卡，其他的都还好，手感我感觉不错，还算比较满意吧！,2017-06-03 23:05:22,0,0,5
小***年,PLUS会员,很好的手机，老人用简单实惠。,2017-12-28 05:43:45,0,0,5
波***8,PLUS会员,通话清晰，就是铃声与按键小点,2017-12-26 15:40:01,0,0,5
h***3,钻石会员,京东的物流没得说，这诺基亚的手机不太值这个价拍照功能不能用，因为存储空间不足，一张也拍不了，必须按外置卡，无语，两边还有剌手的感觉,2017-07-03 22:35:27,0,0,5
j***j,银牌会员,用着不错，给老妈买的,2018-01-02 18:13:10,1,0,5
l***1,PLUS会员,买给奶奶用，屏幕够大，按键面积大，键程适中，很适合老人用，好评！,2017-08-09 10:36:45,0,0,5
j***k,银牌会员,手机是给老人买的，还比较不错，省事好用，操作方便,2017-12-14 17:37:31,0,0,5
jd_180800hlt,铜牌会员,总体来说是很不错的，铃声和听筒声音都较大，不错的老年机，期待信号和待机能像以前诺基亚的品质就完美了。,2017-11-27 13:24:53,1,0,5
j***2,金牌会员,手机用着还可以吧，毕竟不是以前的诺基亚了，但是当老人机还是不错的，赞一个吧，希望诺基亚还能再现辉煌。,2017-11-23 18:09:44,1,1,5
c***s,PLUS会员,经典手机 就是经典 值得购买,2017-12-05 09:55:10,0,0,5
G***5,银牌会员,就是买个情怀吧 没感觉了,2018-01-29 10:29:30,0,0,5
j***u,PLUS会员,给老人用的，声音大，字体也大。,2017-11-14 17:32:05,0,0,5
K***t,金牌会员,刚到手。字体大，适合老年人使用，希望诺基亚能保持以往经久耐用的品质！,2017-06-20 19:51:46,0,0,5
七秒盛夏,钻石会员,除了价格贵之外，一切都还好!,2017-06-18 08:01:25,0,0,4
流***鱼,PLUS会员,比那个3310强多了，就是后盖太难拆。小心指甲盖啊！放着养卡呗，别忘了拿出来充电就好?,2017-07-03 15:31:31,2,0,5
北***护,PLUS会员,不错，给老年人用的，还可以,2017-12-04 15:20:40,0,0,5
j***x,钻石会员,是自己挺大的，然后声音也很大，就是以前诺基亚的6300，挺划算的,2017-07-15 23:38:19,0,0,5
A***r,金牌会员,没有划手 屏幕分辨率不高 可以玩游戏 自带打砖块 双卡联通移动没毛病 总得来说 性价比不高 不是以前的诺基亚系统,2017-05-08 13:58:31,2,0,5
j***l,金牌会员,买来给老人用的，感觉挺好的，声音大小也足够了，手感不错，非常适合。,2017-06-26 09:11:50,0,0,5
s***5,PLUS会员,诺基亚经典，备用机，还是那个味,2017-10-31 22:59:31,0,0,5
3***4,钻石会员,手机给老人用的，挺好。,2018-01-27 20:15:01,0,0,5
S***界,PLUS会员,老人非常喜欢，京东商品加油,2017-11-28 10:57:18,0,0,5
lovelyxwk,PLUS会员,帮老妈买的，妈妈手机刚好在双十一坏了，Nokia老品牌了，做这种老人家还是相当不错的，测试了通话效果很不错的。379入手也不算贵，京东购物也很方便！,2017-11-16 23:10:06,0,0,5
j***a,银牌会员,手机公公很喜欢，手感很好,2018-01-05 23:41:27,0,0,5
坤***2,银牌会员,还不错，给老人用的,2018-03-05 08:02:38,0,0,5
o***-,金牌会员,外观挺精致的手感也不错，挺适合老年人使用的。满意的一次购物,2017-08-20 22:36:35,0,1,5
N***7,PLUS会员,拍照一般般毕竟只有200万，但待机确实不错充一次电一般可以用3天。手感尚可就是太轻了点。作为一款备用机基本可以胜任。,2018-03-01 16:55:34,0,0,5
j***你,PLUS会员,买给家人的，不知道用的怎么样啊，诺基亚的应该还可以，值得去买。,2017-07-10 22:47:31,0,0,5
尚***j,金牌会员,手机很轻便，相信诺基亚还是一如既往的好用,2017-12-30 12:52:45,0,0,5
j***水,金牌会员,和以前的老诺不一样了，不知道质量咋样，希望和老诺一样耐用,2017-08-24 21:40:55,0,0,5
j***6,PLUS会员,话质清晰，功能方便。给孩子用的，就是希望傻瓜型的，最好游戏能卸载。,2017-05-30 18:41:29,0,0,5
j***帝,PLUS会员,给老年人用，还算可以吧。。。。。。。。。。。。。。,2017-10-05 16:57:23,0,0,5
j***个,金牌会员,给家里老人买的，感觉非智能机还是诺基亚好，等用段时间再来评价,2017-07-15 09:58:58,0,0,5
j***4,银牌会员,手机很轻，不过声音很大，很适合老人用！爸爸很喜欢?,2017-09-13 10:31:38,0,1,5
j***r,银牌会员,400元，差不多了，只是按键有点小。声音不够大，很轻，没有以前诺基亚那种霸气，摔不烂的质量了,2017-11-28 17:21:53,1,0,5
C***5,银牌会员,适合老人用，挺好的,2018-02-07 11:32:18,0,0,5
马***月,银牌会员,京东就是发了个质量有问题的手机不处理找各种理由来搪塞不退货我会一直在每个可以曝光的平台去曝光你们，包括315直到更多人知道你们的内幕,2018-03-09 00:14:28,0,2,5
z***i,金牌会员,购买真是方便，而且便宜，京东快递送货很快，值得再次购买。,2017-08-01 22:20:52,0,0,5
陈***琴,PLUS会员,老人机不错的选择,2018-01-02 09:42:39,0,0,5
r***T,金牌会员,感觉拿在手里还可以,2018-01-30 22:15:33,0,0,5
j***a,铜牌会员,京东物流快，服务态度也很好，最重要的是有耐心，东西收到了，不错,2017-06-08 15:58:21,0,0,5
打***将,金牌会员,不知道怎么样。家里人用。自己不在家。打电话都好使，就是来电铃声相对老年机来说小了些。买了就后悔，看到一款飞利浦的电池更大，其他功能大同小异吧。具体的吗不知道。买都买了，不麻烦了,2017-08-04 18:53:39,0,0,5
h***8,PLUS会员,京东的商品不错，物美价廉，快递非常快，我家所有消费几乎都在京东，售后服务非常到位，退货换货非常方便，不愧为是多快好省,2018-01-31 19:06:14,0,0,5
j***2,PLUS会员,买给妈妈用的，相比智能机轻小很多，妈妈很喜欢。,2017-10-13 22:05:42,0,0,5
天***子,钻石会员,"给家人买的老人机，家人很喜欢。
缺点就是屏幕小，分辨率太低，拍出来的相片效果不大好。这也是塞班系统的诟病！！！！",2017-08-27 09:34:09,0,0,5
x***8,钻石会员,买给老爸用的，希望好用吧！次曰达，物流真是飞一般快！,2017-08-21 15:30:31,0,0,5
J***t,铜牌会员,给奶奶买的，奶奶平时用习惯了老人机。手机忽然坏了，点名要买诺基亚的。我就立刻在京东赶在11点前下单买的。奶奶用得顺手，跟其他老人机一样的用法。不过老人觉得按键的字有点小。,2017-09-29 21:17:03,0,0,5
c***1,金牌会员,给妈妈买的，使用的都是情怀，不过微软的质量不敢恭维，屏幕一般了能用，声音不是很大，铃声不如以前的老诺基亚了，让我再选一次我会说:不买,2018-02-28 00:18:09,0,0,5
温***月,钻石会员,手感细腻，三段式设计有档次，前后摄像头像素不是太渣，按键体验爽到爆，塞班系统和市面上的妖艳贱货不一样，居家旅行，送礼自用不二之选。,2018-03-04 18:54:02,0,0,5
L***笑,钻石会员,手机收到了，目前使用还行，没有早前诺基亚“味道”,2017-10-18 23:30:24,0,0,5
1***4,PLUS会员,东西不错，做工也很精致，我还是很喜欢这个黑色，我非常的棒。,2017-06-24 17:37:31,0,0,5
何振国,钻石会员,还行吧。安上电池拿在手里感觉挺轻的 做工还好。,2017-09-29 11:18:00,0,0,5
jd_078725697,钻石会员,手机还好老人用合适，屏幕2.8寸的，看着清晰。,2017-09-27 09:56:29,0,0,5
j***z,金牌会员,发货速度快，早上下单，下午就收到了，特别好用，简单容易操作。,2017-06-05 13:58:45,0,0,5
李***鹏,金牌会员,功能齐全，话说，现在的手机都很高大上了。,2017-11-12 15:59:54,0,0,5
j***y,银牌会员,挺好的，包装完好，手感也不错，用用看吧,2017-11-23 09:40:11,0,0,5
好***人,PLUS会员,挺好的 电池可以用一周以上 老人很喜欢,2017-06-10 18:54:44,0,0,5
刺客红,钻石会员,诺基亚老牌子，适合老年人用，家里老人都用诺基亚，很好！快捷信赖京东！,2018-02-28 21:33:08,0,0,5
j***h,PLUS会员,初感还不错，希望不会让我失望,2017-08-25 14:01:17,0,0,5
暖***方,PLUS会员,诺基亚手机收到了，还是不错的！,2017-08-08 18:48:49,0,0,5
C***n,钻石会员,老人机，声音稍微有点小，，，，，，，，，，，，，,2017-08-24 17:17:23,0,0,5
j***2,PLUS会员,给家里老人买买的，好久不用功能机，扣后盖装电池都研究了半天，手机有点厚，感觉没以前诺基亚质量好，不过适合老人。,2018-02-03 14:17:46,0,0,5
j***y,金牌会员,用上了，还不错，智能机用惯了，还稍稍有点不习惯了。[?,2017-06-30 19:41:35,0,0,5
b***1,铜牌会员,很不错的手机，爸爸很喜欢。,2017-11-17 19:06:02,1,0,5
c***7,金牌会员,已收到，东西还可以，老年人用正合适,2017-12-01 20:30:06,0,0,5
r***t,PLUS会员,屏幕大，一如即往的品质！简单易操作！,2017-11-14 15:22:01,0,0,5
w***7,PLUS会员,收到，想起曾经拥有诺基亚是多么荣耀的事啊,2017-10-12 21:59:43,0,0,5
j***k,PLUS会员,一如既往的好用，外观也漂亮，老人用很好,2017-10-25 14:10:02,0,0,5
达***1,PLUS会员,简单好用，屏幕比普通键盘老人机大一些,2017-06-01 10:46:27,0,0,5
j***0,PLUS会员,给老爸用的，很轻，没有当年的厚重感,2017-06-06 19:07:40,0,0,5
y***5,金牌会员,给爷爷买的，屏大，字大，方便携带,2017-11-30 10:04:58,0,0,5
g***8,金牌会员,还行，真不如以前的机器了。内存卡都没得送,2017-09-26 20:31:41,0,0,5
1***4,PLUS会员,还是像诺基亚质量这么好，电池港港的ok啦 ，做工不错,2017-06-19 15:32:30,0,0,5
d***8,PLUS会员,帮朋友购买的，真的很不错，老人用很好,2017-05-16 10:35:31,0,0,5
Z***H,PLUS会员,一次性买了6台，京东配送很快…,2017-07-20 17:12:20,0,0,5
嘿嘿rc,金牌会员,买回给老家农村送舅舅的，京东快递确实越来越给力了。选择京东买是因为老家的东西真的太多劣质且假，最重要还很贵！！支持京东，京东加油！！,2018-01-04 12:39:32,0,0,5
浪***水,银牌会员,做工没有以前好了，不知道质量这么样物流非常快如果能用微信就好了,2017-04-06 21:22:41,1,0,5
真***悬,铜牌会员,机子挺小巧的，就不知道还像以的诺基亚耐用不了。,2017-08-04 09:50:12,0,0,5
丁***华,金牌会员,配送员服务非常好，非常感谢她。,2017-12-09 13:41:38,0,0,5
c***8,金牌会员,给娃儿买的。。。。。学生机，实用,2017-11-19 11:27:03,0,0,5
正***王,PLUS会员,感觉不错，比商场便宜多了，物流很快，应该是正品。,2017-07-13 14:51:52,0,0,5
v***9,钻石会员,诺基亚功能机秒杀全场，一星期一充。,2017-10-31 23:54:37,0,0,5
徐***风,PLUS会员,做工不是太好，是越南产的，价位也不太低，不知道质量怎么样，刚用还没有多久，给单位买的，用过一段时间以后再发表评论吧,2017-11-01 21:38:25,0,0,4
j***x,PLUS会员[试用],不错，适合老年人用 ，买给老爸得，他不会用智能机，这个很适合，待机时间长，操作简单,2017-04-21 20:52:08,0,0,5
殇***雪,金牌会员,还不错，感觉还可以吧，手感还是和以前一样，轻的要死。,2017-06-05 12:21:14,0,0,5
j***g,PLUS会员,送给老妈的母亲节礼物，质量不错。,2017-06-01 22:08:37,0,0,5
爱***灯,银牌会员,首先手机边框有严重的划手的现象，庆幸的是塑料材质，若是金属材质估计要流血，还有就是前后摄像头我感觉就是多余的，专注做好手机品质就好，手机插卡后没有运营商名称，信号跟音谱一样一跳一跳很不稳定，还有屏幕图标我感觉很杂很乱很多。至于使用时间我只能呵呵！我也不知道。,2017-04-24 08:26:45,2,1,3
j***6,铜牌会员,老爸一直用诺基亚手机，这个手机买回来老爸很喜欢，声音挺大的，很不错希望给以往的一样用的住，信心满满的后期用过再评。,2017-05-17 04:51:03,0,1,5
jd_皇甫昊,PLUS会员,感觉没有以前老诺基亚的手感，总之还值得购买。,2018-02-04 13:17:44,0,0,5
蒜***铁,PLUS会员,买的第二个了，老爸用着习惯了，挺好的！,2017-04-08 15:55:11,0,0,5
s***Y,金牌会员,还行吧，做为老年人使用，字体上只有标准和大字体两种可选，希望有特大字体，和更多老年人使用的功能，毕竟消费群体是老年人中不合适使智能机的人，很多功能设计不实用,2017-10-07 01:41:05,0,0,5
g***e,金牌会员,非常好，轻巧实用,2018-03-01 16:25:12,0,0,5
8***N,铜牌会员,哇，京东速度真给力，大半天就送到。就冲这个就要点赞了！,2017-05-04 09:12:28,0,0,5
t***e,钻石会员,给家里老人买的，不习惯用大屏智能机，总是充电不说，还不会操作。直板键盘手机一直选择诺基亚，这款手机外形小巧时尚，待机时间长，字体也大，非常适合老人用。,2017-11-15 08:31:20,0,0,5
j***来,PLUS会员,这部手机很好用，希望下次再有这样的手机,2017-09-09 10:23:57,0,0,5
p***0,PLUS会员,非常好，很轻薄，屏幕也很大，美中不足就是边框处理的有一点粗糙,2017-04-05 07:17:12,0,0,5
t***u,PLUS会员,物美价廉物美价廉物美价廉,2017-07-20 19:06:47,0,0,5
j***0,银牌会员,虽然和以前的诺基亚手感上有差 但现在用作备用机还是很不错的 Q Q可以下载（JA VA S60 2012 网上找这个版本可以用）电话本可以通过蓝牙从iphone上导入很方便 整体不错 待机时间用段时间再说,2017-04-30 19:54:45,1,0,5
9***B,钻石会员,手机非常棒 东西挺好的，就是没有发票，我要的是纸质发票，可是来时是电子发票，哎，希望下次能给纸质发票。,2016-12-26 15:15:37,0,1,5
黄***8,金牌会员,相信品牌的力量，买来送长辈的，的挺好看的,2017-08-22 15:53:45,0,0,5
