名字,会员级别,评论内容,评论时间,点赞数,评论数,评价星级
Y***Y,铜牌会员,拍照还行吧，电池使用时间长，外形漂亮，,2018-02-26 19:20:44,0,0,5
幸***8,钻石会员,质量好，通话清晰，这手机老爸老妈用不错的哦，值得购买,2017-12-30 22:21:13,1,0,5
z***2,PLUS会员,还好吧，一周充一次电。,2018-01-22 20:02:44,0,0,5
亮***哥,钻石会员,满意的购物，非常喜欢。值得好评,2018-02-06 12:35:53,1,0,5
k***3,PLUS会员,送货很快，当天买当天就收到了，就手机来说感觉还可以吧，毕竟现在买功能机都不知道改买什么好了。为信仰充值，为情怀买单，Nokia你值得拥有?,2018-02-04 22:15:28,0,0,5
彭***宜,PLUS会员,老品牌，价格合适，服务好，发货快，特别满意,2017-12-15 17:52:27,0,0,5
T***e,PLUS会员,很不错的手机，买来送给母亲，她也不会用现在的智能机。拿到手的第一感觉回到了十几年前，当初这样的诺基亚要一千多块钱。,2017-09-12 22:04:37,0,0,5
d***n,金牌会员,物流配送很满意，值得购买，质量很好。,2018-02-10 15:45:51,0,1,5
j***n,金牌会员,很漂亮，铝合金后壳。屏幕很大，找到了当年诺基亚的感觉。就是有点小贵。,2016-10-17 15:27:27,1,0,5
d***g,PLUS会员,手机很好，声音大，清晰，电量也用的时间长，很不错的一次购物,2017-07-15 10:02:32,0,0,5
此***弃,金牌会员,机子挺好的，给我奶奶用的，我觉得还可以，我奶奶眼睛耳朵都和正常人一样，按键稍微有点小，对我们年轻人来说正常，不过她用了一段时间也熟悉了键盘，按起来也方便,2018-03-03 20:09:12,0,0,5
游***8,银牌会员,还是不错的，满满的情怀，春节回家给爸妈用,2017-11-12 19:10:40,0,0,5
r***C,银牌会员,哎，我只能用遗憾来形容啦，按理来说东西是越出越好才对啊，可是没想到反啦，越出越差啦，现在的诺基亚跟过去的诺基亚比那简直就是天上地下啊！不打电话信号一般正常，可是只要是不论打还是接电话，都是一格信号，甚至还会没有信号！我就服啦，我一共买两个诺基亚手机都是这个毛病，所以说我很后悔啊，，，，，，！！！！,2017-12-03 01:28:57,0,0,5
曾***曾,钻石会员,上一次在京东买诺基亚手机是五年前了，上次那个诺基亚用了五年！给老人用挺好的！,2017-07-02 14:02:08,0,0,5
l***9,金牌会员,给我老爸买的，老品牌值得信赖,2018-03-03 09:08:42,0,0,5
s***8,金牌会员,因为京东所以京东,2016-10-14 10:51:29,0,0,5
j***o,铜牌会员,手机收到后出现一点小问题，商家很快就换了一个新机，这款手机中的相机很棒很清晰！虽然开机没有诺基亚手拉手的画面，其它功能和诺基亚以前一样一样的！还有这款手机电话簿很大，可以存储1000个号码，对业务多的人很实用，还有手电功能也很实用！我最大的看点是这款手机永远不会中病毒！信赖诺基亚，信赖京东商城！,2017-12-28 23:27:24,0,0,5
温***金,银牌会员,可以，很好！感觉不错。,2017-05-04 07:45:08,0,0,5
肖***7,金牌会员,还没用，感觉好轻巧呀！,2018-01-25 10:14:55,1,0,5
你***呜,PLUS会员,手机实物比图片好看多了，看起来很简洁大方。手感不错，开机使用了一下没有问题。,2017-06-17 05:22:37,0,0,5
j***1,金牌会员,备用机而已，没有对它太多要求，不过没有以前诺基亚经典了,2017-12-07 12:26:58,0,0,5
j***c,钻石会员,老牌子，确实不错，好看好用,2018-03-03 13:18:57,0,0,5
b***5,铜牌会员,感觉对于老人过于复杂，不太适合，质量是肯定没有以前好了,2017-06-26 09:42:34,0,0,5
5***V,银牌会员,诺基亚已经不是以前的诺基亚了，感觉变了味道，开机没有捂手动画。,2017-07-09 16:27:50,1,0,5
张***w,金牌会员,买给老爸的，外观做的非常好，比较轻，质量也好，老爸喜欢。,2017-11-07 21:35:03,0,0,5
黑***女,金牌会员,东西不错，物流特别快。喜欢。,2018-01-29 17:20:10,0,0,5
春***j,铜牌会员,实用的手机，情怀满满，总体感觉机器轻，机体可利用空间很多没有用大电池是遗憾，后壳与前盖之间有明显割手感觉，主界面左右快捷键无法重新设置没搞懂呢，声音够大，带个套更合适，这手机真心值一百六十元，嘻嘻，祝大家，新年快乐，万事顺意！,2018-02-15 09:24:20,0,0,4
y***c,PLUS会员,苹果信号不好，就买了个诺基亚，信号杠杠的，待机久,2017-07-25 12:08:07,0,0,5
j***t,钻石会员,手机质量还不错，唯一有些不足之处就是扩音器声音有点小。,2017-11-13 11:00:25,0,0,5
N***T,银牌会员,物流老师傅我要给满分，态度好,2018-01-19 20:36:01,0,0,5
职***价,钻石会员,手机不错，屏幕大，字体也大，给老人用，很不错的。,2017-12-16 08:39:15,0,2,5
j***2,铜牌会员,还不错，物流超快。赞?,2018-02-06 09:52:53,0,0,5
j***7,银牌会员,比以前的诺基亚轻好多，外观挺漂亮，正在使用中，希望能像以前一样不怕摔，快递值得点赞,2017-05-02 17:01:28,0,0,5
j***d,银牌会员,手机收到了，很是喜欢，爸爸装着也比较容易，小而精致，好评,2017-09-27 20:06:05,0,0,5
陈***辉,银牌会员,挺好的，买给老爸的。虽然没有以前的诺基亚耐用了。看着不结实。,2017-05-30 09:59:32,1,0,5
矮***皮,金牌会员,挺好的，没有qq没有微信，也不能运行java 不过接打电话挺好的,2017-07-12 21:13:37,0,0,5
简***简,PLUS会员,给老年人买的，感觉还可以！,2017-11-13 07:43:07,0,0,5
j***y,PLUS会员,情怀手机 用起来手感好 铃声清脆 竟然前后都有照明 给力,2017-08-23 14:10:11,0,0,5
j***5,PLUS会员,还不错已经使用了，通话声音清晰！！,2017-09-08 11:34:14,0,0,5
最***想,PLUS会员,还行吧，总体来说比那些山寨机强很多，但是虽然是诺基亚牌，但却不是原来的诺基亚了！缝隙真的有点大！,2017-05-28 23:19:33,1,0,5
宇***2,金牌会员,手机收到了！包装很好，手机很轻，拿着手感很好！,2017-11-04 13:21:06,0,0,5
d***d,PLUS会员,用惯了诺基亚，质量还是很好的。。。。。。。,2017-06-18 15:34:14,0,0,5
不***年,钻石会员,还可以，只是感觉没以前的诺基亚好用了，希望能和以前一样耐用！,2017-06-21 21:08:29,0,0,5
j***z,银牌会员,只要你的智能机可用的基本都可以，网速就是2g老年机足够用杠杠的,2017-06-06 17:14:59,0,0,5
j***y,金牌会员,给婆婆买的，还没用，还是觉得蛮好看的！,2017-12-13 14:49:11,0,0,5
a***处,金牌会员,手机已经收到，外壳有点味道，目前使用还算正常。,2017-07-13 01:54:24,1,0,5
j***8,钻石会员,好多年没有用过诺基亚了，这次买个给老妈用，老妈很喜欢...,2017-06-24 15:04:40,0,0,5
Z***7,PLUS会员,买给老人家用的，屏幕大，声音清晰。,2017-07-26 15:22:09,0,0,5
何***1,银牌会员,备用手机  老年手机  今天刚到货  用过以后在评价,2017-08-12 14:05:00,0,0,5
w***6,钻石会员,还不错，开机正常，没装卡试，应该没问题，送人的,2017-09-15 21:53:46,0,0,5
一***头,PLUS会员,还是那么贵，就是老人不会用智能机，！,2017-06-21 19:12:38,0,0,5
黄***廷,PLUS会员,********，这手机太难看了质量不行,2017-10-21 16:21:52,0,0,5
朗***生,钻石会员,购买前认真看了其他买家的评论，收到后结论如下：1.塑胶边确实有点刮手，但在可接受范围内。 2.声音比较大，适合老年人用。 3.是正品，说明书明确是富士康出品。 个人认为手机还是不错的，作为备用机或者给老人家用挺合适。,2017-06-07 12:05:36,0,0,5
l***2,PLUS会员,老人机适合老人用，包装不错，但快递太慢,2017-05-16 22:58:45,0,0,5
剑***7,铜牌会员,确实是正品，收到就迫不及待地打开验证了。诺基亚，真的是在卖一种情怀阿。打开后盖装上电池，拿到手里感觉很轻，比我以前的6300差远了。而且边缘确实割手，做工真的不行。可能是价格的因素吧，怀念过去的诺基亚。虽然不舍但是过去的只能让他过去，微软真不应该再做这样的手机，这是要彻底砸烂诺基亚这块招牌的行为,2017-07-06 21:24:11,0,0,5
飚***飈,PLUS会员,挺好的，还是喜欢3310,2017-08-29 16:37:38,0,0,5
g***1,银牌会员,手机收到了   不错  很满意,2017-09-29 09:51:27,1,0,5
j***x,PLUS会员,字大，屏幕清，家里老人其他电话嫌字太小，这个正适合,2017-06-25 07:33:28,0,0,5
大***狼,钻石会员,买给家里老人用的，能接打电话就行，别的无所谓。,2017-07-26 18:46:07,0,0,5
乜***贝,PLUS会员,很轻，前后置摄像头，前后加闪光灯!,2017-05-22 07:25:34,0,0,5
jd_6bfc964f48453,金牌会员,经典款，大爱诺基亚。老妈喜欢的手机，希望好用！,2017-07-19 13:03:08,0,0,5
z***s,金牌会员,很不错手机，做工还是比较好，买之前担心手机太厚，到手感觉还可以，常用的功能也齐全，总之很满意，自己动手后盖贴了一张红色的膜，很洋气。,2016-11-16 20:18:28,0,0,5
七***尼,PLUS会员,非常感谢京东商城给予的优质的服务，从仓储管理、物流配送等各方面都是做的非常好的。送货及时，配送员也非常的热情，有时候不方便收件的时候，也安排时间另行配送。同时京东商城在售后管理上也非常好的，以解客户忧患，排除万难。给予我们非常好的购物体验。,2018-01-14 14:02:15,0,0,5
原***瓜,钻石会员,专门买来打电话的，还不错。,2017-12-21 13:19:26,0,0,5
j***x,银牌会员,首先，如前面网价的优缺点一样。其次实物到手还不错了。,2017-05-23 23:32:43,0,0,5
九***伙,PLUS会员,挺好用  信赖诺基亚  希望不会是假货。,2017-04-27 13:24:23,0,0,5
t***杰,金牌会员,一如既往的相信京东 和诺基亚 给老人用 妥妥滴,2017-06-24 11:44:16,0,0,5
m***1,PLUS会员,太贵了。看完了你们的评价，我关掉了手机，语重心长的吸了一根烟，再走到阳台后拿了一瓶青岛啤酒，猛喝了2口，来到窗前，看着外面细雨绵绵，此时我也控制不住自己的情绪，对着天空大吼一声：这T.M写的什么玩意啊…屁大个事你也要写个评价！,2016-11-22 14:54:17,21,0,5
j***4,钻石会员,老人机用用可以，但价钱有点贵了，屏幕分辨率和照相烂烂烂！,2017-04-30 17:15:46,0,0,5
王***7,PLUS会员,给老爸买的，只喜欢用键盘机。所以就买了这个，塑料感有点强，不过也就三四百块钱。,2017-11-15 19:42:51,1,0,4
请***问,PLUS会员,给妈妈买的，最靠谱的老年机或备用机，京东快速放心,2017-06-04 14:44:52,0,0,5
h***u,PLUS会员,一直用诺基亚的手机打电话 做备用机 很好用,2017-04-24 20:29:31,5,1,5
豪***扬,银牌会员,东西还好，就是声音太小，老妈几乎都听不到铃声,2017-06-14 21:39:12,0,0,5
黑***9,金牌会员,这款手机非常好，找到了当年N73的感觉,2017-08-02 21:02:18,0,0,5
张***堂,银牌会员,手机还可以，电很耐用,2017-12-11 14:52:46,0,0,5
i***5,金牌会员,字大清晰，通话通畅，外形简洁，喜欢,2017-08-20 08:33:16,0,0,5
超***2,PLUS会员,非常好，京东值得信赖，满分！,2017-04-29 11:58:20,0,0,5
爱子wmy0416,钻石会员,手机不错，屏幕大，使用方便，黑色最钟爱颜色,2017-06-08 16:37:30,0,0,5
心***2,PLUS会员,拿回来感觉还行，一看信息发现是个旧的，里面还有短信,2017-04-10 14:40:49,0,0,5
l***5,银牌会员,开机没有牵手的画面，其他的没什么说的,2017-07-15 16:05:21,0,0,5
j***1,钻石会员,已经是第二个了，之前的那个黑屏了也不知能不能修v,2017-04-10 21:53:51,0,0,5
j***k,银牌会员,宝贝不错，老人家喜欢,2017-11-12 20:21:55,0,0,5
j***4,钻石会员,买到家给老爸的，自己在外地。信任。。。再追加！,2017-04-08 23:01:46,0,0,5
j***l,钻石会员,还可以，上完电池，重量还行，够用了,2017-07-07 10:29:48,0,0,5
j***d,钻石会员,非常漂亮，买了好几个诺基亚了。质量杠杠的。,2017-05-02 16:22:02,0,0,5
f***o,PLUS会员,挺好用的，老年人用，用着很舒服，上下左右键按着也可以，没有想象中的很硬，键盘使用也不错?,2018-01-26 14:35:57,0,0,5
如***伴,金牌会员,物美价廉，服务周到,2017-11-08 15:56:59,0,0,5
J***k,金牌会员,超级实用。老人很喜欢，因为待机时间很长。,2017-05-01 19:51:35,0,0,5
j***c,钻石会员,感觉这手机有点贵，不值这么多钱,2017-07-11 15:23:31,0,0,5
z***2,银牌会员,物流非常快，第二天就到了，手机也不错，打电话发消息完全够了，已经买了好几个诺基亚的功能机了，很不错！,2018-01-23 16:02:42,1,0,5
七***3,金牌会员,试用可以，京东就是快，值得赞。,2017-07-04 09:54:26,0,0,5
子***爹,PLUS会员,买来给爸爸用的，屏幕大，还有200万像素的前后摄像头，非常满意！,2017-08-17 18:34:38,0,0,5
j***8,钻石会员,给公司使用的，员工公差使用很好,2017-06-28 16:36:11,0,0,5
仲***伟,PLUS会员,朋友说不错、很好、,2017-10-14 23:18:03,0,0,5
o***o,PLUS会员,还不错，帮亲戚买的，希望用的住,2017-06-19 07:07:41,0,0,5
u***2,钻石会员,这款屏幕大一点，老人家很喜欢，虽然操作比以前繁琐一些。但是信号依然很好。,2016-11-06 00:16:23,2,0,5
l***光,金牌会员,还没用 诺基亚质量应该没有问题的,2017-05-28 15:53:23,0,0,5
一***8,钻石会员,这个牌子我非常信任，经常买，,2017-06-26 20:05:27,0,0,5
简***e,金牌会员,非常不错！做个备用机棒棒哒！,2017-06-19 10:56:57,0,1,5
j***8,钻石会员,给公司买的，员工出差使用。,2017-06-28 16:37:00,0,0,5
J***2,PLUS会员,用着不错   好,2017-08-15 07:51:04,0,0,5
b***l,金牌会员,挺好的，诺基亚的质量很棒,2017-04-22 16:15:14,1,0,5
j***4,银牌会员,很不错的手机挺好使的！,2017-06-26 02:38:42,0,0,5
q***g,金牌会员,23号下单，27号才到，慢，以前上午下单，第二天能收到，现在占领市场了，就无所谓了？,2016-11-28 14:03:19,3,0,5
j***2,PLUS会员,东西很不错，这里的服务还是一如既往的给力，头一天晚上才下的单，结果隔天就到了。商品种类确实很多，和其他网站相比选择余地也就大了很多。 而且可以用同类商品做比较。商品的价格也不贵，性价比挺高的。这次的商品针对是很不错，很满意这次在這裡的网购。,2017-08-23 14:58:09,0,0,5
丶***淡,PLUS会员,希望耐用点吧，做工一般,2017-05-31 13:04:50,0,0,5
完***行,钻石会员,而在前些日子，这台NOKIA 230 DS忽然开卖，我也是通过微博里一些科技类微博以及电商平台才得知相关消息，最终抵不住诱惑下单购买了一台，看看究竟是不是还具备诺基亚的血统——宣传里主打了优秀做工以及长续航以及双摄像头。,2017-10-26 10:50:48,0,0,5
j***z,银牌会员,还未使用，相信诺基亚,2017-06-11 08:44:44,0,0,5
h***9,金牌会员,速度一般，使用还行，,2017-06-08 11:51:24,0,0,5
l***a,金牌会员,货收到了，像素太低了，还没有内存卡，还有一点点电，没有屏保，有不地道。,2017-08-21 19:38:24,0,0,5
大***界,银牌会员,之前老款诺基亚一直使用，这次拿给老丈人用。感觉还不错，双卡双待，只是没有以前诺基亚那种感觉，总感觉好像是国产的。,2017-10-26 09:18:56,1,0,5
s***1,PLUS会员,很好的一次购物，诺基亚还是一如既往的漂亮，拿在手里就是感觉不一样,2017-04-19 21:55:32,2,0,5
n***n,PLUS会员,给老人买的，老人坚持要实体按键长续航的，选来选去还是选了诺基亚，希望新诺基亚能像以前一样给力,2017-11-29 15:48:21,0,0,5
群***包,PLUS会员,京东，只为品质生活。在京东购物，享受的不仅仅是高品质的商品，更是高品质的服务。商品琳琅满目，满足各级别需求。配送快捷高效，比实体店更省事儿。售后及时到位，免去后顾之忧。已经习惯了在京东购物，生活离不开京东,2017-08-24 18:55:57,0,0,5
j***7,金牌会员,很好    和描述一样,2017-04-29 17:28:55,0,0,5
j***2,银牌会员,东西很好，细节以及做工没得说！声音特别大，给爸爸买的，他很喜欢！,2017-08-02 06:37:14,0,0,5
你***呀,PLUS会员,【京东超市】京东海外直采 西班牙 爱如 · 蝶之语甜桃红起泡葡萄酒 750ml【京东超市】京东海外直采 西班牙 爱如 · 蝶之语甜桃红起泡葡萄酒 750ml【京东超市】京东海外直采 西班牙 爱如 · 蝶之语甜桃红起泡葡萄酒 750ml,2017-07-08 13:49:11,0,0,5
AK_China,PLUS会员,买给爸爸用的，爸爸用惯了有按键的功能机，看上了这个型号！唯一感觉不够好的地方是右上角的第一个按键是“自拍”键，这个键竟然不能自定义按键功能！！！！谁会无聊到整天玩自拍啊！？而且还是用这么差的手机摄像头玩自拍！！！怪不得诺基亚会没落…！,2017-08-03 10:58:07,0,0,5
t***2,金牌会员,这部手机总体来说还是挺好用的 可以上网而且速度还可以接受 逛逛贴吧啥的就很轻松了 续航说实话有点不行 可能是我用的多 大概4天就没电了 还有个小问题 如果壁纸使用的文件比较大 在桌面的运行速度就会变慢很多,2018-02-09 12:17:38,0,0,5
j***7,金牌会员,帮爸爸买的，为什么要选诺基亚呢？因为情怀啊,2017-05-04 23:48:53,3,0,5
tianfeilx子牧云,PLUS会员,诺基亚已经不是以前那个熟悉的诺基亚了。买这个机子主要是为了情怀吧。家里有一部诺基亚6300还可以用，但是这个功能比以前的机型要丰富，还是入手了。只是感觉质感没有以前好，做工也没以前到位了，不过用起来也还不错的，毕竟只是备用机，重点是电池耐用就好。价格也算合理，快递业快,2017-09-12 15:52:51,1,0,5
j***e,PLUS会员,久违的诺基亚，久违的熟悉铃声，非常适合当备用机，性价比高，待机时间长，通话清晰，按键手感一般，中间的导航键经常会误碰，操作性不太好，另外仅支持2G网，联通手机的2G信号不太好，经常会没有信号，适合移动号码的手机。,2017-11-01 21:01:58,0,0,5
j***j,PLUS会员,声音够大，操作简单，就是没有锁屏按钮，只能等屏幕自己息，不太习惯,2018-01-08 12:48:40,0,0,5
L***8,银牌会员,刚刚开始用，以后再评价吧，不过这款机对它好有信心，老人家用的,2017-07-25 12:54:23,0,0,5
我是非主流子,金牌会员,我还以为铝合金后壳多重呢原来这么轻就是塑料的,2016-11-07 15:46:55,0,0,5
D***p,PLUS会员,还可以吧，功能机要求不能太高，只是因为当年Nokia的情怀,2018-02-02 15:24:30,0,0,5
小***5,银牌会员,物流很快早上就收到了，诺基亚老品牌，送给婆婆的，方便简单，声音也大，很适合,2018-02-27 12:00:31,0,0,5
r***l,PLUS会员,京东商城网购便捷 京东快递小哥给力 此诺基亚非原诺基亚 不过汉字输入法还是比其他老年机方便  熟悉的诺基亚,2017-05-24 21:08:15,0,0,5
海***a,铜牌会员,上手很轻，电池只有一块（照道理应该多送一块的，也不知道现在的诺基亚续航能力是不是还跟以前一样）内存卡也没有送（可能我想太多还以为会送的），手机有联网功能，这个正是我所担忧的，我怕他乱按西按的就把互联网给打开了，这就麻烦了话费都要被扣完了,2017-08-21 08:09:19,0,0,5
大***悦,PLUS会员,嗯，老年机诺基亚还可以，嗯，比较轻，方便老年人使用ok了,2018-01-27 19:06:36,0,0,5
l***0,铜牌会员,物流很快第二天中午就收到了；快递员服务态度也很好，手机上手也好用。,2018-01-26 10:23:00,1,0,5
b***k,金牌会员,不错哦，帮我爸买的，之前买的是216，他觉得不好用，就退货了，所以这次是冒着试试的心态又买了这台，他说很满意，比之前的好用～,2017-05-12 17:48:26,0,0,5
威***梅,银牌会员,很好?????。。,2017-11-26 18:46:43,1,0,5
逍***9,PLUS会员,就是当备用机买的，但诺基亚确实今非昔比！冲着情怀给4星吧,2017-07-02 18:13:03,0,0,4
流***格,钻石会员,简单实用，毕竟诺基亚是当年按键手机的霸主，老人家用着习惯。,2017-06-13 17:32:06,0,0,5
j***m,钻石会员,手机昨天中午就收到了，手机很小巧，信号不算很好。很讨厌送快递的，签收的时候，问我里面的是什么，然后叫我拿着快递要拍一个照片，是我和快件一起的照片，说什么怕签收了又说没有签收，这是什么行为，我在京东购物这么久了，还是第一次遇到。,2017-10-03 09:50:25,0,0,5
立***3,PLUS会员,用了一个月才评价，通话大声，信号好，京东售后也是最满意的,2017-06-19 13:55:44,0,0,5
j***x,银牌会员,看着还不错，不知道能不能的住，感觉跟最初的诺基亚已经不能比了，很轻……,2018-03-07 23:25:37,0,0,5
S***n,PLUS会员,还行，爸用的挺方便，不过做工不如以前诺基亚了。,2018-03-04 17:34:51,0,0,5
W***米,PLUS会员,还行吧，希望好用吧。现在这种手机外面买不大到了,2018-03-02 18:30:56,0,0,5
g***2,银牌会员,嗯，很不错，手感也很不错，很满意的一次购物，支持京东会继续关注你们,2018-03-02 21:44:34,0,0,5
b***j,PLUS会员,给老人买的，使用是原来诺基亚手机的感觉，重量有点轻飘飘的了。,2017-05-07 11:54:01,0,0,5
j***0,铜牌会员,给我妈妈买的还好,2017-04-30 12:08:55,0,0,5
颜***墨,金牌会员,刚刚上手感觉还不错！手机很轻，按键操作比较简单！就是不知道电量怎么样！,2018-01-17 17:07:01,0,0,5
老***g,PLUS会员,给父亲买的  用着还可以  赞一个,2018-02-27 20:34:09,1,0,5
镜***年,PLUS会员,不错，买给我爸的，用着挺好，就是感觉太轻了,2018-03-09 12:57:05,0,0,5
j***a,金牌会员,手机做工精致，老爸很满意。,2016-12-23 23:44:47,0,0,5
b***科,银牌会员,"给自己父母买的，
银灰色的感觉不错，键盘很顺溜。但是白色的键盘不行，感觉特别粗糙！总体感觉还可以吧，一分价钱一分货！京东快递特别快，昨天下午提交的订单，今天上午就送到了，京东自营还是非常靠谱的！赞一个！！！网购首选京东！",2017-10-03 13:49:35,0,0,5
p***y,PLUS会员,很好，声音大质量好，适合老年人！,2018-02-21 14:44:40,1,0,5
月***色,PLUS会员,湖北无货，从北京调货过来，送给老人的，结果地址默认错了，找客服改地址，无法解决，后来给配送小哥说了这个问题，人家说，你放心，教给我来解决。隔天就到老爸手里了。非常感谢京东配送小哥。手机没看到，不知道咋样，好评吧,2017-06-21 15:41:44,0,0,5
j***4,PLUS会员,诺基亚老品牌，虽然做工什么的比以前差多了，但是依然相信品牌的力量。,2017-12-20 10:46:43,0,0,5
j***京,金牌会员,给老妈用的，各方面满足了期望,2016-11-13 23:41:51,0,0,5
r***h,PLUS会员,给在老家小地方的亲戚买的备机，续航能力和通话质量来讲，nokia一直是可靠的首选,2017-08-26 08:51:02,0,0,5
s***4,金牌会员,东西很不错给别人买的    诺基亚  昔日帝国依然很强,2016-10-15 20:44:23,0,0,5
邪恶的林大师,钻石会员,物流非常快，上午拍，下午到，手机很好父母很喜欢，尤其是背壳是金属的超赞，诺基亚不愧为最耐用手机，没有之一,2017-04-23 21:48:59,1,0,5
丶***y,PLUS会员,"质量非常好，与卖家描述的完全一致，非常满意,真的很喜欢，完全超出期望值，发货速度非常快，包装非常仔细、严实，物流公司服务态度很好，运送速度很快，很满意的一次购物",2018-02-22 19:41:25,0,0,5
l***x,PLUS会员,没办法老人家还是要用这个，只是打电话。,2018-02-26 00:15:19,0,0,5
g***6,PLUS会员,信号挺好，手机很轻，略贵,2016-12-07 07:57:07,0,0,5
y***i,钻石会员,还行吧 给老人用 不行 再换!,2016-10-19 08:54:32,0,0,5
阿***0,钻石会员,不错，有自带手电筒。,2016-12-30 14:39:19,2,0,5
t***7,PLUS会员,国民手机，做备用机不错,2018-01-17 09:07:18,0,0,5
N***志,银牌会员,拿到手以后，第一感觉就是质量变差了，屏幕外层很软，可以直接按到内屏，这个价格高了。没有以前的质量好了。,2017-07-15 13:54:55,0,0,5
G***7,PLUS会员,产品很好经济实惠。京东老用户，天天来买东西，经常回购，给父母也是经常来买，现在京东快递服务送货到村口，太方便了，父母年纪大了，有了京东确实很省心.又方便。强烈推荐此款产品，良心价又好用。,2017-11-23 12:18:04,0,0,5
相***灵,PLUS会员,230（RM-1172）429元入手，价钱高低没关系，就因为它是诺基亚！又听到了诺基亚经典铃声。操作还是那么简单，便捷，我相信老爸很快就能熟练操作了。,2016-12-09 13:43:58,0,0,5
j***k,银牌会员,要是送个保护膜和套就完美了，一下子买了两个，什么都没送,2018-03-08 10:28:54,0,0,5
j***n,PLUS会员,通话质量很好很清晰，包装是京东专有的，快递也很快第二天就到了喜欢?,2017-10-22 10:57:38,0,0,5
j***d,PLUS会员,诺基亚的情节，买给老人用的。看着还行！,2018-02-03 20:58:16,0,0,5
