名字,会员级别,评论内容,评论时间,点赞数,评论数,评价星级
米***村,金牌会员,手机还可以，老爸喜欢，信号还行，声音也大，字体还行。,2017-06-22 20:29:10,0,0,5
阿***j,金牌会员,不错物流很快，就是背后的标志不怎么样,2017-10-22 11:31:19,0,0,5
j***y,PLUS会员,以前都是用的诺基亚，爸爸说用新的。希望耐用。买现在的智能手机也不会用。还是用老款。用过再评吧。,2018-02-17 07:04:58,1,0,5
梦***佳,金牌会员,还行给妈妈买的！,2018-03-03 22:34:15,0,0,5
n***w,PLUS会员,给家里老爸买的，现在还没装上用呢，不过之前在评价里看有人说和之前的诺基亚不一样了，期望能有好的使用效果。,2018-01-27 19:43:28,0,1,5
嗯***_,金牌会员,"电池续航等过几天再追评。手机拿到手，第一个感觉太轻！！！没用过这么请的诺基亚。感觉像玩具，质量不敢评测，感觉应该没有以前的诺基亚好。功能方面都没什么问题。试用几天再来评测。给老人用的，别出大问题就行。
另外想问一下屏幕右上角的白点什么意思？？",2018-02-14 23:06:37,0,0,5
热***娃,钻石会员,不错不错，功能机这么大的屏很爽了，待机也够长，关键还是双卡，而且有蓝牙！值得推荐?????????,2017-08-21 22:18:01,0,0,5
阳光霹雳豆,银牌会员,"手机特别好！超级满意！照相在功能机里面绝对的王者，前后双摄双闪在智能机里面都是不多见的，这点值得大书特书！最后3个字，赞一个?
回答问题，来电话时不会自动报出号码哦，那个功能是国产老人机才有的功能，诺基亚真正的定位是功能机，还是有点差别的哦(´-ω-`)",2017-06-17 00:32:40,1,0,5
j***w,银牌会员,好好好好好好好好,2018-01-08 12:51:22,0,0,5
如***-,PLUS会员,还行，外观还算漂亮，老人用也不错，非智能机里算是不错了的。,2017-06-22 08:29:02,0,0,4
傲***-,PLUS会员,给爸爸买的，他用习惯这种手机。手机铃声大，通话声音清晰，手机很轻便！照相也挺清晰的。功能齐全，适合老人用,2017-12-22 15:41:14,1,0,5
随***安,PLUS会员,对于诺基亚，保留一份记忆。不管今日智能机江山如何。师兄忘不了，直板机，手指党，还有多年前那个时代的拼音连打，键盘密码锁，诺基亚手机的皮实耐用，让我以为手机都是结实耐用的，然而我错了。如今一年换几次屏幕的我已经醉了。,2018-01-28 07:41:55,0,0,5
z***1,PLUS会员,是大卡的，给老绝使用，应该够大声的，2017.10.20出厂的还剩一格电，有问题再联系客服吧,2018-01-14 20:49:09,0,1,5
S***7,钻石会员,信号稳定 备用机 字体大 正常用5天待机时间长,2017-08-22 19:42:10,0,0,5
a***5,金牌会员,还行！铝合金后盖和塑料接触的周围有点咯手，自己用刀背刮了一下，舒服很多！待机还不错，三天掉了一格电，所以还行吧,2018-01-25 12:01:48,0,0,5
笑***呵,金牌会员,不错的,2016-09-10 12:02:51,4,1,5
王***学,金牌会员,发货速度快，宝贝很满意。,2017-08-15 22:05:30,0,0,5
平***8,铜牌会员,质量一如既往的好，结实耐用，也是我曾经的回忆吧！现在主要是给老妈用的。虽然我也很喜欢,2018-01-31 17:26:47,0,0,5
j***g,银牌会员,怎么说呢，反正已经不是当年诺基亚的制造了，手感一般，反正花399很不值，手机里面连个qq基本的应用都没有，后盖盖不紧，心伤，还不如入手红米,2017-08-27 11:06:37,0,0,5
QC150*****891,金牌会员,双十一当天为父亲买的，到手后他非常喜欢，一天用下来感觉也很不错！字大，屏幕也大，像素也非常高，非常值得购买！,2017-11-13 17:32:49,2,2,5
j***3,PLUS会员,喜欢这小直板，做工精细，不错，信任京东商城,2017-01-21 22:14:26,0,0,5
靜***雅,金牌会员,手机里装了一主卡和一上网卡，买过来装工作号码用的，功能各方面使用都可以。就是屏幕太不耐划，两手机装一起，几天就刮花了,2017-09-06 15:33:10,0,0,5
l***5,PLUS会员,非常不错！好久没用过功能机了，刚开始有点不大习惯！哈哈！样子好看！就是拿着有点轻，而且后盖有点割手！！！,2017-04-06 18:26:22,1,0,5
d***e,钻石会员,缺点：第一，里面有一些上网应用且不能卸载，然而谁会用这个手机上网？！第二，主屏时间显示居然不支持24小时制？！第三，右上角 返回键 居然改成了 自拍！优点：双卡双待，支持音乐和视频，超长待机！总之，这是一款定位错乱的手机，一个老人机，搞什么上网 和 自拍，自拍还是主键，我也是醉了。,2017-06-13 21:07:46,2,4,2
u***e,PLUS会员,经典就是经典，不过这个应该是电商或者什么代工的吧，和原来的并不太一样，但是依然很好！京东的快递真给力，两省交界出的农村，坐个公交车都要跑到7公里处的街上，京东给送到门口…哇咔咔…,2018-02-26 07:32:22,0,0,5
j***a,铜牌会员,总体满意，没有10年前那个诺基亚重了，拿在手机轻薄了不少，后盖是铝的，个人感觉如果是铁的或钢的更好。,2017-11-05 22:26:19,0,0,5
P***m,金牌会员,还是老机子实用，声音很响亮，振动也很大，机子很轻巧，人家打电话过来跑不掉。,2018-01-02 16:30:17,0,0,5
A***9,钻石会员,宝贝收到好久了，比较忙评论晚了，东西质量不错，铃声比较响亮，通话声音也比较清楚，比较适合老年人的一款手机,2017-08-24 22:09:36,0,0,5
墨***6,银牌会员,手机挺不错的，诺基亚200万像素是真不错，给老人用正好,2018-02-04 19:11:51,1,0,5
6***q,企业会员,还是京东靠谱 发货快 原封包装,2016-10-31 11:13:45,0,0,5
7***强,钻石会员,铃声较大，通话比较清晰，功能方面还是没有以前的老诺基亚设计的好。,2018-01-24 08:40:08,0,0,5
念先生,PLUS会员,昔日的王者，今日已经没落了，感觉心酸。再次入手却已无法昨日重现。,2017-12-11 20:30:00,0,0,5
鎂***蚁,PLUS会员,诺基亚，这款老年机键盘要是再大点就更好了，后壳材料不错！用一段时间再看看！,2017-09-09 22:05:28,0,0,5
山***凡,PLUS会员,正品行货，质量不错，搞活动买的，非常好！,2018-01-03 10:21:03,0,0,5
g***3,钻石会员,老妈用不惯智能机，又心疼流量费，所以给她换了这个：铃声大，屏幕大字体也大，前置200万很强悍，要是后置能到300万或500万就好了~~不知道待机是否真能达到22天~~,2016-02-23 10:34:31,1,0,5
j***e,银牌会员,还可以，性价比还是挺高的,2016-10-14 11:55:37,0,0,5
f***7,金牌会员,帮老人买的，非常喜欢，诺基亚值得信赖，以后还会继续支持,2018-02-02 18:27:55,0,0,5
j***店,银牌会员,"物流好快，手机装起来用着挺好
希望诺基亚不会让我失望，挺好的一个国际品牌，希望你能越来越好",2017-06-07 21:41:10,1,0,5
黑***z,钻石会员,帮爸爸买的 能用就行 看起来不错 就是打开电池不是很方便,2018-01-11 22:12:26,0,0,5
迈***滚,PLUS会员,这个价格真的不值得，是老爸就中意这个诺基亚，但是现在的诺基亚很明显不是原来的。,2017-06-22 12:33:36,0,0,5
非***1,银牌会员,东西收到了，虽然从外地调货有点慢，但是爸爸还是很喜欢,2018-02-05 09:33:59,0,0,5
8***平,钻石会员,nokia品质，值得信赖！,2017-06-15 18:51:05,1,0,5
江***w,钻石会员,老品牌，值得信赖。不过很好奇，为什么厂家不是微软了，换了个没听说的品牌，诺基亚又被倒卖了？,2017-08-06 17:53:39,0,0,5
j***5,PLUS会员,小手机挺好用的，声音够大，电池待机时间还长，值得购买。,2017-11-22 20:59:37,0,0,5
j***c,金牌会员,手机比较轻，后壳是铝的，声音和字体都算大，老人用还是挺好的，不知道会否像以前诺基亚那么耐用。,2017-06-27 18:44:16,0,0,5
J***1,金牌会员,质量不错，待机时间待测试。整体还是不错的。,2018-02-08 12:30:18,0,0,5
j***a,银牌会员,很喜欢这款诺基亚手机，收到是全新的。,2018-02-28 18:45:07,0,0,5
k***n,PLUS会员,拿到手了一直还没有用，期待质量还不错，用一段时间,2017-10-20 10:13:52,0,0,5
F***4,金牌会员,手机不错，轻巧方便，能上网，能拍照，能听歌，双卡双待，待机时间长，我喜欢的类型。,2017-07-01 09:56:27,0,0,5
h***i,银牌会员,目前看外观还可以，就是不知道电池耐不耐用了！给妈买的，看着这个自己都想买一个了,2017-07-06 11:29:03,0,0,5
石***流,PLUS会员,手机质量一般吧感觉很轻与以前的诺基亚不太一样，画质还算清晰字体可以调节大小，声音虽然没有其它杂牌老人机大但音量在吵闹的地方也听得见，而且音质不错清晰没有杂音这点很好，目前没有发其它质量问题希望以后也不会有就OK了。,2017-12-26 09:53:24,0,1,5
c***6,钻石会员,帮老人家买得，挺好的，电池好用，轻轻的小巧！,2017-12-20 07:25:51,1,0,5
j***j,钻石会员,物流快，当天就到。手机还可以,2018-02-27 21:58:06,0,0,5
j***1,金牌会员,东西收到，看起来还不错哦！诺基亚,2018-01-16 13:14:18,0,0,5
j***h,银牌会员,给老人买的，特别喜欢，声音大，文字也大，准备再买一个个婆婆,2017-10-21 20:25:41,0,0,5
淼***7,PLUS会员,我相信诺基亚诺基亚不错不错，给父母买的，附魔会喜欢，父母，很喜欢。,2017-05-03 19:13:33,0,0,5
敏***2,PLUS会员,买来当备用机，拿着手感很好，系统运行很流畅。,2017-08-22 11:34:23,0,0,5
j***6,银牌会员,刚收到，京东物流挺快，外观还可以，有点轻，用一段时间再评。,2017-07-04 19:06:05,1,0,5
山***凡,PLUS会员,正品行货，质量不错，很喜欢！,2017-12-06 12:14:36,0,0,5
y***0,钻石会员,价格便宜也就不能要求太高了！,2018-01-02 19:49:22,0,0,5
皇***7,金牌会员,物有所值！给老人买的，老人很喜欢，目前现在用着很给力，没有其它毛病。物流也很给力！,2017-04-27 21:38:41,0,0,5
j***9,金牌会员,久违的感觉～接打电话挺好的～感觉没有以前的诺基亚结实～,2017-10-08 18:53:48,0,0,5
B***U,银牌会员,手机还可以吧，系统不伦不类，除了logo找不到诺基亚的影子,2017-06-03 12:25:48,1,0,5
q***i,金牌会员,以前买过，现在又帮朋友的家人买一个送给老人用，还不错，年纪大了，不会用智能机，用这个挺好。,2017-10-24 15:47:59,0,0,5
q***8,银牌会员,手机不错很好，与实物照片一样可惜没送一张内存卡。,2017-11-03 12:16:06,0,0,5
农***有,银牌会员,几百块的东西没什么可比性，能接打电话，声音大点就行,2017-10-11 12:25:31,0,0,5
酷***活,银牌会员,物流很快，手机很漂亮，唯独的缺点就是找不到诺基亚的经典和感觉了！,2017-06-04 21:12:09,0,0,5
j***1,银牌会员,包装很精美，按键也很灵活，颜色是想要的，总体来说还不错！,2017-08-07 15:30:07,0,0,5
某***5,金牌会员,诺基亚手机还是不错，功能太多根本没必要,2017-07-10 13:49:43,0,0,5
j***g,金牌会员,外观比较好看，但系统没有以前的诺基亚好用。自带打砖块游戏。,2017-07-01 12:00:09,0,0,5
j***2,金牌会员,诺基亚的手机质量不错，给老人买的，用起来很方便，很实用！,2017-07-07 10:56:28,0,0,5
棋***卒,钻石会员,不错手机，很漂亮,2018-02-20 13:23:57,1,0,5
游***楚,银牌会员,找不到当年的感觉，做工也不去当年。还是很满意的,2017-09-14 15:22:55,0,0,5
小岑先森,钻石会员,自营就是快  很好很实用  这几年用智能机习惯了突然用回按键机感觉不太习惯 不过只是打电话而已没事啦,2017-07-13 18:46:34,1,0,5
吻***里,PLUS会员,好用，声音大，但是不知道是塞班那一个版本的软件能装……,2017-07-05 09:54:22,4,1,5
H***粉,钻石会员,"还行。可以可以。高三了。不玩智能机了……
天。。。拜拜my Internet phone",2017-08-05 13:08:08,1,1,5
丁***b,企业会员,手机老人用不错，屏幕也还好挺清晰的。希望结实耐用,2017-07-18 20:42:33,0,0,5
j***k,铜牌会员,手机已到。看着还行。给爸买的，先用着看，好评,2017-08-13 11:24:25,0,0,5
朱***莞,钻石会员,诺基亚手机好好好好好好好好好好好好好好好好好好好好好好好好好好好好好好好好好好好好用，下次再来买,2017-09-12 16:21:28,0,0,5
l***k,银牌会员,给老人买的，他说好用，适合老年人。比较重。,2017-08-03 19:16:29,0,0,5
s***狗,PLUS会员,不错‘备用机首选‘,2017-07-17 23:03:36,0,0,5
j***t,铜牌会员,物流超快的第二天早上就到了，手机非常轻拿在手上没什么重量，感觉老妈会喜欢的！刚待机两天希望电池能像介绍那样耐用?,2018-03-01 08:02:06,0,0,5
j***3,PLUS会员,很好，虽然不是智能机做工没得说，感谢京东,2017-01-21 22:12:02,6,3,5
j***r,PLUS会员,用了一段时间再来评价的。总体感觉还是不错！现在市场上针对儿童用的非智能手机太少，这款产品没有那么老年化，儿子比较喜欢！就是没有了记忆中诺基亚手机可以敲核桃的那种厚实感。,2017-05-05 15:58:33,0,0,5
j***0,PLUS会员,联通卡插上去没反应，只能用移动卡，而且确实像很多评论所说，后盖两边有缝隙，有点锋利，总之不是以前青春记忆中的诺基亚啦,2017-12-28 15:15:09,0,0,5
z***7,金牌会员,物流超快，实用，外观漂亮，声音大。,2017-08-01 21:17:48,0,0,5
吴***0,金牌会员,挺好用的 给爸爸买的 为了。怀念按键手机 ?  就是卡一槽偶尔读取不出sim卡,2017-11-22 22:18:36,0,0,5
j***0,金牌会员,东西还好吧，不知道充电器为什么不原装的呀,2017-05-27 11:39:35,0,0,5
m***v,钻石会员,当备用机的，没想到还可以下载一些java的应用和小游戏蛮好玩的哈哈不愧是诺基亚,2017-11-21 19:33:42,0,2,5
s***1,金牌会员,速度很快，第二天就到，备用机还不错。,2017-06-26 14:02:15,0,0,5
k***e,PLUS会员,发货速度因为调货了不怎么快，货品完好，挺不错的,2017-04-10 20:53:50,0,0,5
梁***明,钻石会员,经典中的经典，要是无线功能就更完美了，,2017-05-23 17:16:03,0,0,5
j***s,金牌会员,怀念诺基亚，但是被微软收购后，质量感觉变差了，好轻，没有蓝牙，没有qq，没有微信，只有打电话 发短信 有个微博是真的 跑业务的可以买，其他人员不建议,2017-07-18 21:01:01,0,0,5
依***少,金牌会员,性价比超好高，作为备用机很合适。,2017-06-02 17:25:39,0,0,5
政***A,PLUS会员,诺基亚的质量是值得肯定的，功能性和人性化方面会差点，总体来说给老年人使用还是不错的。,2018-01-18 19:44:15,0,0,5
空***瓦,银牌会员,诺记就是不错，但是被微软收购后做得没那么好，手感不是很好,2016-11-27 22:16:32,1,0,5
毒***特,银牌会员,通过拆机发现做工上诺基亚已失去原来的完美和强大，但希望深圳的现任生产厂家能继承它原来不朽的灵魂。,2018-03-08 07:25:02,0,0,5
國***席,PLUS会员,京东商城顶呱呱，有钱只在京东花！,2016-12-04 14:37:21,1,0,5
j***2,银牌会员,"神一般的速度，物流很快。
除了后盖比较难打开，其余都很好。声音够响亮，按键略有点小，充电比较快。",2018-03-01 09:38:41,0,0,5
高***1,PLUS会员,刚拿到手，确实比想象中的要轻巧好多，后盖也是铝合金的，没有以前的诺基亚做工细致，后盖跟前壳相接处，很明显得划手，至于其他方面还得摸索摸索才清楚。,2017-06-20 20:58:57,0,0,5
j***o,金牌会员,京东一如既往的好，快。节前还是很给力，诺基亚老品牌，值得信赖。谢谢了，祝忙了一年的大家春节快乐！,2018-02-12 12:17:09,0,0,5
j***茨,PLUS会员,给老爸买的，机子特别轻，不知道有没有以前坚固耐用了，那个后壳设计的不好，不好取,2018-01-19 16:04:53,0,0,5
3***2,金牌会员,给家里爷爷买的，他用的蛮习惯！老人家也不怕按错键额外收费，以前也买过一个便宜的，拍的照片好模糊。这个像素就高些，拍出来的照片清晰些,2017-07-05 22:55:30,1,0,5
b***0,银牌会员,"挺好的
多少年了，还是诺基亚熟悉的声音！
就是手感太轻了，后盖有点划手！",2017-08-20 13:04:24,0,0,5
a***t,PLUS会员,很不错的品牌和质量的手机让微软给做垃圾了，再也没有原诺基亚的品质了，后壳和机身缝隙很大，贴合度很差,2017-06-07 10:55:27,0,0,5
镶金边儿的牛,PLUS会员,真是好轻啊！屏幕大了，没有1100的省电，拍照，内存卡，双摄像头，都支持，缺点就是左键不能单独设置，不太方便，按键还是比较舒服的！,2018-02-10 08:39:53,0,0,5
j***1,钻石会员,第二次购买了,2017-09-19 19:58:03,0,0,5
j***c,PLUS会员,手机超级轻，像素不高，字体挺大。没有了以前诺基亚的质感了，用起来还不错,2018-01-25 19:42:29,0,0,5
r***0,银牌会员,"1、手机的质感不强，很像玩具，太轻了。
2、严重脱离NOKIA的品牌，没有手拉手。
3、外观设计与NOKIA不一致，没有挂绳的孔，不便于老人携带，设计考虑不周全，脱离市场的变化。
4、键盘没有凹凸感，既然宣传老人机，就应该考虑老人用机的感受和感觉！
5、不满意的NOKIA复出",2017-07-14 12:42:23,18,6,1
又***2,PLUS会员,老爸之前用的手机总是没有信号，打不通，就想着重新给他换一台，之前用的是诺基亚，现在还是打算给他买台诺基亚，怀旧情绪——看中了这款，直接寄给老人，听说还不错，说比之前那款看着高大上，慢慢摸索中……京东快递太神速啦，头天晚上下的单，第二天中午就到了，关键还是小县城，而且还有双十一刚过，厉害?,2017-11-17 15:04:04,0,0,5
用***称,PLUS会员,"好：包装未开封，电池全新触点无痕迹，充满电用一天电池显示满的
不好：已经不是原来的诺基亚了，边缘有点割手，2.8寸确实不适合这个分辩率，重量太轻，系统像简简简版的s40，很多设置没有，不能自定义快捷键，浏览存储卡的方式和以前s40也不一样。给老年用还行。",2017-06-13 22:34:43,0,0,4
HLKKY,PLUS会员,东西收到 诺基亚的经典直板 看着不错 就是比较轻 老人先用着看,2018-03-02 22:03:58,0,0,5
j***雨,金牌会员,冲着诺基亚品牌情节去买的，但是跟印象中的诺记做工要差点，尤其是背部的nokia标志很咯手不舒服，其他的还算行吧。。。,2017-10-17 16:07:52,0,0,5
j***m,金牌会员,大品牌，质优价廉，一代人的经典手机，老人家超喜欢。,2017-06-04 15:21:18,2,0,5
风***蓝,PLUS会员,很喜欢在东东上网购 真的不错的 比其他网店实在 服务好 好喜欢 还会介绍朋友来 非常感谢京东商城给予的优质的服务，从仓储管理、物流配送等各方面都是做的非常好的。送货及时，配送员也非常的热情，有时候不方便收件的时候，也安排时间另行配送。同时京东商城在售后管理上也非常好的，以解客户忧患，排除万难。给予我们非常好的购物体验。,2018-03-08 10:07:00,0,0,5
H***n,PLUS会员,给老人的，因为对诺基亚手机的质量推崇备至！这一款又超长待机!希望可以解决老人的问题。,2017-11-24 20:02:18,0,0,5
宋***金,金牌会员,物流速度很快产品用着挺好的，诺基亚老品牌，很划算，经济实惠，京东自营的商品都蛮好的，应该不会差到哪里去，而且配送速度很快，么么哒,2017-05-07 09:52:01,0,0,5
j***i,银牌会员,很好用，功能齐全,2017-07-06 00:11:41,0,0,5
j***h,企业会员,神机到手，不知道用起来咋样，纯接打电话用用！！希望电池耐用点。,2018-02-22 10:51:49,1,0,5
j***7,金牌会员,买了两个了，挺好的给爸妈用的，比老年机耐用。配送员态度也很好。,2018-02-22 15:44:46,1,0,5
j***2,PLUS会员,就是买来备用的,2017-08-30 21:10:14,1,0,5
j***5,银牌会员,满满的回忆，就是感觉比以前的诺基亚轻好多，没什么手感，不过用起来还是很顺手的，买来给老人家用的，不错,2017-11-20 17:22:27,0,0,5
j***y,PLUS会员,这个确实很不错，给老爸买的，老爸感觉很好，很耐用！,2018-02-26 11:24:20,0,0,5
斗***吧,钻石会员,机器很好用 京东值得信赖 发货速度也很快,2016-10-31 11:21:33,0,0,5
唐***精,银牌会员,宝贝刚收到，打开看了东西还不错。给老爸买的，老爸非常开心说比他以前用的要好，只希望东西能用久点,2017-12-16 20:38:44,0,0,5
D***Z,PLUS会员,给妈妈用的，老人家不会用智能机。对诺基亚有特殊的情怀，说是好用，操作简单,2017-12-25 07:40:34,0,0,5
j***3,PLUS会员,高贵大气上档次，泡妞隐藏身份必需品，朋友很喜欢,2018-02-26 09:18:43,0,0,5
jd_8420165,PLUS会员,手机可以，老人很喜欢，老人机应该做大点,2017-10-29 13:08:56,0,0,4
1***镇,金牌会员,给老人买的，还是比较信赖诺基亚的，就是不太懂为什么把自拍单独弄一个键而且还不能改，后盖是铁质的。比较锋利，总体来说还行吧，质量好电池耐用就可以。,2018-02-26 21:14:19,0,0,4
Y***8,PLUS会员,手机很好，给老妈买的，她很喜欢，,2017-06-16 23:45:31,0,0,5
j***z,PLUS会员,京东自营的很快，上次京东自营没货在第三方买的，没意思，用的不好，这次有货了果断在买一台,2017-08-01 00:04:40,0,0,5
毁与悔2015,PLUS会员,手机感觉太轻了，希望质量不会比以前的差吧！,2018-02-24 19:21:47,0,0,5
j***f,PLUS会员,东西好，速度快，价格优惠,2016-12-23 08:54:59,0,0,5
s***q,PLUS会员,价格公道，物流很快！给家里老人用挺不错的！,2018-02-05 09:05:20,0,0,5
d***e,金牌会员,诺基亚老年机质量很好，音量大字体大电池禁用界面简单方便一直信赖诺基亚。京东物流真是快,2017-12-24 19:04:44,0,0,5
蓝***瞳,PLUS会员,东西很好，是正品，备用机首选,2016-11-10 09:38:53,1,0,5
顾***8,金牌会员,很好用的手机，已经买了第二个手机了，这个是送人的，信赖诺基亚,2018-02-20 11:53:41,0,0,5
W***7,PLUS会员,不错，做工依然那样，用的过,2016-11-21 14:43:43,1,0,5
j***5,金牌会员,和十年前的诺基亚没的比。越南产的轻飘飘 滑溜溜，许多人性化的功能没有了和之前的诺基亚功能差了不少,2017-09-18 06:52:30,0,0,5
周***9,金牌会员,这个老年机也还不错啊，老人用字体还挺大的，老人年龄大了，不会用那个智能手机啊，还是这种好,2017-11-02 07:45:45,0,0,5
l***4,PLUS会员,还行吧 爸爸不喜欢用智能机,2018-02-26 17:26:03,1,1,5
z***5,铜牌会员,京东快递就是快，昨天晚上买的，今天就到货，速度没得说，手机收到很满意，以前就用过，还是一如既往的好用，没得说，五颗星的评价，五颗星的手里！,2017-05-21 17:33:52,3,0,5
j***o,PLUS会员,有点小贵，在有优惠就好了。。。,2018-01-14 18:39:25,1,0,5
W***呆,PLUS会员,送货速度快，正品保障。,2016-11-10 09:21:05,0,0,5
小***粒,金牌会员,算是现在诺基亚直板机里较贵的，和以前的诺基亚225除了外形，别的都差不多，价格还贵些,2017-11-01 06:58:53,0,0,5
花***者,PLUS会员,给老妈用正合适 铃声大,2018-02-21 14:46:15,1,0,5
网购达人耀,钻石会员,买诺基亚直板机是一个情怀，老人家用起来还是不错的，找回以前的感觉。但手感比以前脆了些。,2016-10-10 22:50:59,0,0,5
w***0,钻石会员,不赖，还是熟悉的诺基亚,2016-10-12 11:24:00,0,0,5
n***1,钻石会员,给爸爸买的老人机，续航待机相当不错，铃声和通话声音很大，值得购买。。。,2017-08-24 18:19:32,0,0,5
将***务,PLUS会员,给老妈买的，老妈不会用智能机，这款手机是个不错的选择，就是待机时间有待考验,2017-04-29 16:36:41,1,0,5
j***7,铜牌会员,用了15天了，手机很好用，正品。物流太给力了！五星好评,2018-01-24 09:44:20,0,0,5
F***8,钻石会员,诺基亚的忠实粉丝。给爸爸买的，他还比较满意。,2018-03-05 22:33:47,0,0,5
j***6,PLUS会员,给我妈妈买的，总体感觉还可以吧！,2018-01-01 14:52:04,0,0,5
s***l,PLUS会员,帮同事带的，他没说有问题，诺基亚老人机，应该可以！,2017-12-13 14:28:45,0,0,5
我***r,PLUS会员,看着还行，但是跟图片真的low很多，现在的诺基亚跟以前的已经变味了 感觉,2017-06-18 18:25:40,0,0,5
我***伟,PLUS会员,京东就是快，东西正品，服务好，满意，最近买了很多东西了都很快到货,2017-08-20 22:56:05,0,0,5
_***_,PLUS会员,东西收到了，没有原来的感觉了……情怀已逝，老人机给老人用还不错,2018-01-14 11:09:31,0,0,5
J***绵,银牌会员,大小适中，单手正合适，就是功能少，只能打电话！,2017-12-20 17:36:14,0,0,5
中***n,钻石会员,老人机！开机试机一天也没充电，电池仍有1/3多。轻便，备机应该不错,2017-12-15 20:19:47,0,0,5
涅***4,PLUS会员,质量很好，待机时间长，系统流畅，功能齐全,2017-08-21 13:50:22,0,0,5
j***o,银牌会员,手机缝隙有点割手，不过几百块钱还能买到这么经典的手机！真是物超所值！,2017-11-20 10:27:51,0,0,5
