名字,会员级别,评论内容,评论时间,点赞数,评论数,评价星级
老***哥,金牌会员,收到货，确实比较轻，做工确实比不上以前的诺基亚水平，全五分好评只为心中那记忆中的诺基亚，在这个连情怀都被老罗用坏的年代，我们这些岁月的旅行者只能静看风云变换，不期待，因为期待也没用，就像苹果那时候没有乔布斯就破产了一样，一切顺其自然，且用且珍惜，全五分好评奉上，希望诺基亚一切安好。,2016-01-27 12:57:28,33,4,5
j***6,钻石会员,"开机画面没有大手拉小手，只有Nokia的字。后盖确实是铝的，双卡，卡槽是标准大卡，iPhone的小小卡芯片对准触点也可以用。240*320的分辨率放在2.8寸屏上有些颗粒感，但是字还算大，这个分辨率配2.4寸及以下屏幕应该会好些。铝盖一侧边缘跟侧面塑料挨着的地方稍有划手，应该是严丝合缝的问题。配件有充电头、数据线、电池，不带耳机。电池BL-4UL,1200mAh。自带软件有收音机，但是需要插耳机才能用。自带的新浪微博和必应，根本没法用，就是个Opera浏览器的快捷方式，不是app，2G网络超级慢，基本等同没有。用这个手机别想太多，只能接打电话发发短信。前后200万像素摄像头，期望也别太高，Led灯可以当手电。内置游戏只有一个打砖块，没有贪吃蛇。充电头上有Microsoft字样，但说明书里有声明鸿海富士康已经接手，除了外观，已经看不到原先诺基亚的影子，当备机还不错。",2017-06-04 23:06:11,193,31,5
佳***腰,钻石会员,刚出场厂1个多月，现在给年纪人选手机还挺不容易，要简单，铃声大，字大，能照相，不能上网玩游戏的还真不好找。但这个来机后还是有上网的图标，好在不是智能系统，上网不好用。为了不让小孩抢老人的手机玩游戏，特意找功能简单的。本来  看上105了，但屏幕太小了，这个字还大些。后盖是金属的，手感不错挺轻巧的功能机，好用，赞！,2017-08-14 11:50:43,15,7,5
v***3,PLUS会员,"用了好多年的大屏智能机，突然用回诺基亚，感觉轻得握不稳。。。。。手机中规中矩吧，相比于今时今日这价格确实有点贵，但由于不喜欢智能机的繁杂，只是想纯粹要能打电话和收个信息而已。还有，手机明显包装前有人留下了指纹，不知是退货的，还是包装人员，但质量没出问题，算了。

今年，我32岁。",2017-05-31 16:53:31,66,12,5
北***i,PLUS会员,毕竟是信仰  没有了当年的感觉 手机用着感觉回到初中时代,2017-10-31 21:41:41,8,0,5
宝***钻,金牌会员,小巧轻便经济使用|老牌子的手机用了以后有点怀旧的感觉,2017-11-07 09:37:28,9,1,5
开手扶的一超,PLUS会员,90后，你还记得曾经的诺基亚吗？熟悉的按键手感，熟悉的铃声，熟悉的操作界面… 当年上初中那会，诺基亚卖得并不便宜，那时候诺基亚那么漂亮，我却买不起，印象最深的，5310XM，N78，N81…等到我买得起了，如今诺基亚却变成了这样。好多人认为此诺基亚已非彼诺基亚，这款机子做工不如从前，金属机身却不如曾经有分量，但我仍愿意相信它还是从前的诺基亚，今年过年打算不回家，当作年终礼物了。,2016-01-23 23:36:58,6,6,5
飞翔7891,PLUS会员,手机正品，给老爸买的，用着方便，在老家自己录的视频告诉我手机不错，快递也给力,2017-11-03 19:23:55,2,0,5
萌***姐,铜牌会员,手机很不错，通话声音挺大的，手感也很不错,2017-11-06 15:13:59,4,5,5
范***风,PLUS会员,特别不错的备用手机。,2018-02-05 12:24:12,1,0,5
H***n,PLUS会员,不错，拿来当固话用，功能还挺多的，可以下软件，哈哈,2017-11-15 13:19:41,0,0,5
柯***0,金牌会员,非常好   老年人特别喜欢    ！,2018-02-25 12:27:59,0,0,5
R***w,铜牌会员,很轻便，电池续航时间不知道多久，因为一收到就来评价了，生产日期是2017年8月15日，但一开机是2015年10月1日，希望是正品不是二手,2017-09-20 15:53:43,5,1,5
随意的小熊,钻石会员,买了个套，贴了膜，准备带回家给家人。,2017-12-04 00:04:40,2,3,5
j***k,金牌会员,还行吧，跟描述的差不多，满意,2018-02-24 14:38:05,0,0,5
j***a,PLUS会员,不错，打电话，发消息够了，没没毛病,2018-03-06 13:55:31,0,0,5
j***1,银牌会员,手机很好，值得购买,2017-12-14 10:06:44,0,0,5
XYYM晨曦,银牌会员,一直很看重诺基亚，曾经的功能机的N0.1，耐用！可是这款微软出的与我期望中的样子有很大差距，拿在手里很单薄，轻飘，包括电池看上去也单簿，整个手机拿在手里没有份量，疑似没有强度。铃声音量也小。只能说此诺基亚非彼诺基亚！曾经的诺基亚己经远去了，只能回忆！,2016-01-27 08:46:38,6,2,4
z***8,PLUS会员,质量一般，物流超快,2017-12-02 19:00:27,0,0,5
1***p,金牌会员,物美价廉，值得拥有,2017-10-19 11:05:46,0,0,5
j***小,金牌会员,手机质感挺好的，有点像以前的C5。手机后盖稍微难拆一点。可能新机有点生涩的关系。后盖为金属材质。然后。开机挺快的，整个界面也挺清爽的。就是不知道耐久度如何。还能手机砸开山核桃吗？京东快递继续给力。第二天必达。整天好感度挺好的。,2017-08-07 15:14:04,2,1,5
j***z,钻石会员,用起来还可以吧,2018-02-01 22:48:59,0,0,5
j***v,铜牌会员,还不错，挺轻，就是发货速度有点慢了，具体看图吧！,2017-08-28 16:25:32,5,1,5
厕***了,PLUS会员,不错，挺好使的，太高端，可惜我只用来打电话了，有点儿屈才了，上面竟然有新浪微博，真的是吓着我了,2017-01-06 23:14:59,39,12,5
j***懂,钻石会员,买来给老爷子用的，到手用了一下刚开始不习惯，用一会感觉太好了。只是现在诺基亚的品质较以前直接没处沾边啊，手感太轻，不扎实。前后双射带闪光灯亮瞎眼，惊了。试了通话，清晰无杂音。日常都能用到的功能很方便。还能查看天气，比较满意。,2018-03-01 21:14:56,0,0,5
j***3,PLUS会员,正品太棒了赞一个信任京东商城超快送货上门,2017-11-19 22:42:44,0,1,5
薛***旭,银牌会员,不错，很好。,2017-07-24 15:00:10,4,0,5
n***4,金牌会员,没有三之前的质量了，功能机张就好了,2018-02-25 14:23:53,0,0,5
緣***妳,银牌会员,买这个手机是给老年人换手机的，首先送货是挺快的，试机发现有以下问题，开机没有诺基亚手机经典的握手图片，拿在手里重量很轻，用*＃0000#查手机出厂日期显示是2017-01-19的，后盖上标示的日期却是2017/08/15的，开机时显示的时间却又是2015-01-01的，还有铃声已不再是以前经典的铃声，铃声声音不大，请问大神们现在的诺基亚手机是越南生产的吗？我买到的是正品诺基亚手机吗？,2017-11-11 19:58:33,1,3,5
jd_138272qkz,铜牌会员,今次是失望的一次购物经历！以往在京东买自营产品都很快送货的！这次购买的父亲节礼物很失望！父亲节前几天购买下单的足足等五天父亲节过了才到货！但是送货的很给力晚上十一点还送货给他一个赞要不是看到送货的那么卖力当晚都拒绝收货退款了！对京东越来越失望，产品试一用了几天信号不算强手机太滑不好拿，照相非常差！电力可以用三天！！！,2017-06-23 22:52:40,5,0,5
一起就有可能,PLUS会员,诺基亚，怀念以前的诺基亚，质量真心有保证，做工精细，非常棒。颜色也漂亮。声音响亮，来电声音大。价格优惠便宜，比店里卖的便宜，物流速度很快，隔天就收到了,2017-05-16 14:31:38,7,1,5
允***齡,银牌会员,"昨天刚到手；系统比之前15年10月份给我妈买的215ds多了天气和应用商店。但手感比215ds差多了。抛开主观感受；最大问题是右边边框膈手，左边边框割手。也就是说左边边框和后盖尺寸相差太多。我妈那个215ds聚碳酸酯外壳摸上去又圆润又不容易滑手。HMD不走心啊。不知道3310的外壳会不会承袭传统优点。还好老爸皮糙肉厚能适应。难道用旧后包浆了能好起来？哈哈哈哈?
    
    电池有待多日使用再看看。",2018-02-21 13:23:09,0,0,5
R***4,钻石会员,商品质量还不错，铃声也算比较大，通话声音一般，老人耳背的话就得开免提了。,2017-11-19 16:19:10,0,0,5
h***4,金牌会员,预约了大半个月，终于拿到手了！！！,2016-09-08 12:51:52,4,1,5
j***仙,铜牌会员,昨天晚上买的，今天中午就收到了，挺快的。给妈妈买来用来打电话的，妈妈不会用智能机，看起来还行吧，很轻，感觉没有以前的诺基亚夯实，不知道耐不耐用！,2016-11-08 14:40:36,16,7,5
q***3,钻石会员,拿到手轻的象儿童塑料手机，诺基亚真是作死的节奏，微软做出这货，还408元，我看就值200元。除了老人不会用智能机，否则别买！这个和东哥无关，东哥还是好样的！,2016-11-15 13:21:59,26,4,5
熊***贰,银牌会员,没有想过有多好，分辨率差，做工也差，真的是会割手，信号也不咋地,2016-09-09 08:47:17,68,10,5
y***g,PLUS会员,222确定使用是个退货的正品，没有什么大问题，只是做工材质等等远不如以前的诺基亚了，屏幕大要是有Wifi加网络软件视频聊天功能就好了,2017-12-17 17:37:25,1,0,5
小***堡,钻石会员,"一直钟情诺基亚，这款的键盘很好，屏幕大，字体也不小，功能还挺全的，打开一看竟然还预装了微博
好不容易盼到新款按键机啊，老爸的手机屏被压坏了，终于有的换了，要是有挂绳口就完美了",2016-01-29 19:24:11,2,0,5
总裁小鬼,PLUS会员,做工精细    设计合理   多快好省   物有所值     建议购买,2017-04-17 20:37:25,0,0,5
不***D,PLUS会员,手机用着还行，电池耐用，就是质感和老诺基亚相去甚远，备用。,2017-10-14 13:13:45,3,1,5
十***晨,银牌会员,简单，轻巧，清静。特意找了一款功能机来代替智能机，智能机让人眼花视力模糊，手关节累痛颈椎僵硬。这款手机不错，颜值妙杀一大半千元内的智能机，功能还是顺手但可能不是当年的系统了，材料也没当年的厚实，毕竟一分钱一分货。不过相对于一般功能机来说已经很好了，快递今定明到送货也快。希望这款手能让人感到轻松自然。,2017-09-16 18:33:21,2,2,5
j***2,金牌会员,很好??,2018-02-07 13:04:21,0,0,5
1***8,金牌会员,不错，家人很喜欢，诺基亚还是很棒的，以后会大力支持的京东物流很棒很快，以后大力支持,2018-02-18 12:49:04,0,0,5
j***明,钻石会员,NOKIA还是这个NOKIA的logo，可惜没有了大手拉小手，这就意味着如今的诺基亚已不再是昔日的诺基亚了，不管是做工与质感都大大不如从前了！不过一分钱一分货，大家就见仁见智了！做备用机还是很不错的！,2017-07-15 12:10:04,1,0,5
x***5,PLUS会员,还可以，买来给老爸用的，物流快还给送货上门，?,2017-05-16 12:37:56,2,0,5
T***l,金牌会员,给老人买的手机，小巧轻便，老人很满意，就是自拍键不知道怎么取消。,2017-09-01 07:19:28,0,0,5
永远看不懂的雕像,银牌会员,京东快递速度公认的快！！备用机。相信诺基亚的品质，到手后还是那么的硬朗。快递员辛苦了。,2016-09-04 22:21:40,3,0,5
d***3,银牌会员,诺基亚还是那么经典，屏幕也大了很多，前后拍照还都带闪光灯，就是电池有点久2016年出的，别的还可以，还是支持一下诺基亚！,2018-03-03 13:48:49,1,0,5
平***氏,银牌会员,如今的诺基亚已经没法和当年的比了，拿到手里塑料感十足，按键手感也没法比了，给老人买的，只求个稳定吧。总体来说与价格相当。,2018-01-08 20:03:42,0,0,5
b***e,PLUS会员,给老爸买的，老爸还不会用智能机，习惯了诺基亚手机，就这款合适，不过价格其他老年机或者与红米、魅蓝大屏智能机比起来，已经没有啥优势了，性价比不高。但是优势是待机时间长，质量还不错的。适合喜欢诺基亚的老用户，想要性价比可以看看华为、飞利浦老年机,2017-09-28 19:34:10,1,1,5
gaoyhwz,钻石会员,昨天给爸爸买的，可惜不能导入电话本。和以前的诺记比，拿在手里感觉有点儿飘，没有那种实在感了。铝制后壳估计不耐摔，另外没有放手机绳的地方。能送个手机壳什么的就好了。大屏和大字比较适合老人用，不过要是能连接WIFI就好了。,2017-09-22 09:14:21,1,0,4
j***p,铜牌会员,比较轻，不知道质量怎么样,2017-10-04 21:01:47,0,0,5
z***8,钻石会员,手机很不错 老人用很合适 不会接不到电话了 京东的服务和售后真的越来越好 一直很信赖京东 希望你们越做越好 特别是送货真的很快 很让人满意,2017-10-12 21:32:27,0,0,5
jd_186769zwr,金牌会员,"用了几天了，这个手机呐，首先
第一点，信号不是很满意
第二点，手机的通话声音不是好
第三点，手机在手上没什么质感
第四点，为什么没耳机
第五点，感觉上手后不是很值又怕麻烦就不退了
综合五点，本次购物不是很爽",2017-11-14 12:57:54,2,1,3
s***n,金牌会员,手机塑料感强，不放电池的时候真的十分轻，正面键盘很容易沾指纹，屏幕显示效果清晰，适合当作备用机。另外这个手机居然可以通过蓝牙导入其他手机的通讯录，连接iPhone6sPlus导入成功，不用手输电话了，简直要被感动哭了?五星好评！,2017-06-15 12:41:57,2,1,5
j***z,银牌会员,一如既往的快，给老人买的，看着手机回想到以前用诺基亚回忆，赞?,2018-02-26 13:56:52,0,0,5
小***4,PLUS会员,物流很快，隔天就送到了，给老人家买的，操作简单，系统使用起来还是很顺畅的。只是内存太小，需要另加内存卡～,2017-08-18 22:47:28,0,0,5
蓝***莓,PLUS会员,诺基亚送给老爸智能型学不会还是简单款吧，以前那款用了五年，电池续航不灵啦，太知足了。希望这款和以前质量一样杠杠的，不过待机时间还是这样的好三天五天充一次省心省力。小巧玲珑看起来有点像玩具哈哈。,2017-11-25 05:26:29,0,0,5
jd_150452bjp,PLUS会员,非常好，一直在京东购买 大家电，小家电，价格实在，而且很是抗用，质量非常好,2017-09-17 13:48:57,0,0,5
s***n,钻石会员,"手机有些轻，处观尚可，比想象的要长一些，像个小号的遥控器，做工太烂，图中红色部分，都可以看出接口，后盖手感好，键盘手感不错，但中间的方向键不怎么好。屏幕显示不错，其他地方效果尚在试用中。

看中超长待机，得用用才知道效果怎么样。",2016-03-04 12:10:16,2,0,4
轻狂年少----已是曾经,PLUS会员,坚信诺记耐摔核桃的坚硬品质，也为了情怀，买了两个，一个225一个230，给老妈和叔叔用的，感觉没有诺基亚的感觉了，玩具的感觉，声音略深而小,2016-10-15 16:34:46,14,8,3
d***3,银牌会员,包装盒的一个角变形了，可见对待快递的存放一般！,2017-05-20 08:11:39,1,0,4
j***2,金牌会员,手机收到了。好几年没用过诺基亚了，发货挺快的。早上下的订单下午四点半左右到了。,2017-07-22 16:21:23,1,0,5
c***g,钻石会员,是诺基亚。做工质量非常好，懂的人自然会懂。就是还想再买一个却没货了。,2016-08-20 23:11:43,1,0,5
j***r,PLUS会员,原封末拆，京东自营的东西就是放心，手机不错给老人用的电池赖用，很好,2017-07-17 21:44:17,0,0,5
秋***灬,金牌会员,一般吧，不值399，包装都像是临时做得密封，凑活用吧，反正是个备用机,2017-11-13 20:20:27,0,0,5
丿***爸,钻石会员,机子不错，一起用过216，机型基本一样，用着不错，习惯了，上手很快，系统也熟悉，感觉棒棒的，快递小哥服务也很到位，选的到付，京东服务很不错，缺啥都京东了，放心舒心。,2017-06-11 10:54:41,10,1,5
点***新,PLUS会员,手机很不错，外观很漂亮，操作也流畅，备用机首选。备用机还是诺基亚好用，字体也很大。最赞的功能要属于蓝牙了，居然可以从苹果手机里导入电话本，这功能一定要赞。苹果手机不能把电话本写入SIM卡里，想要把两三百电话本存到功能机上，太麻烦，这蓝牙导入电话本，简直是解决了这一难题。很不错！！！,2017-10-22 22:52:10,0,2,5
澎***4,PLUS会员,手机不好！一直在京东买电器和电子产品，很信赖的！回农村老家，给家里买了洗衣机、冰柜，买了这个老年机。洗衣机、冰柜送到家，都是美的的，膜没贴好、电线有污渍划痕等小问题，没有在城市里买的好！手机让自己去镇里取货，内屏外屏之间有白色污渍，下面4条，上面一条一点，擦不掉的！退货换货麻烦，而且就放几天假回来，还得教老人操作，根本没有换来换去的时间，就忍了。反正农村购物比较失望！,2018-02-28 12:04:37,0,0,5
小***3,PLUS会员,帮别人买的，还不错，同事反映很好。没毛病。,2017-09-03 22:17:27,0,0,5
淹***鱼,钻石会员,这手机系统功能强大，还能下载大部分Java软件（jar格式的）可以在3g门户上下载，能发彩信，有蓝牙功能，相机像素高，屏幕很大，很棒的手机！,2016-10-16 16:06:21,15,19,5
m***8,PLUS会员,给老爸买的，重量轻，手感好，还有高大上的微博，诺基亚品质值得信赖,2017-07-13 06:59:25,0,0,5
j***b,金牌会员,没有想象中的完美，或许是时代因素。买它纯粹是八零后对过去的一种情怀感！此款手机添加了通话录音功能，至少比我的iphone5s强（因为5s没有通话录音功能）。手感还可以。没有配置耳机。内存卡没送，或许是送完了！总体感觉还行吧！推荐那些有怀旧感的朋友们应该入手一部。很值?京东值得信赖！希望NOKIA日后能够为用户开发出更多的新产品。??,2016-01-25 12:44:35,2,1,5
j***b,银牌会员,一直答应给奶奶买个手机，后面国庆放几天准备回家就果断选择它了，以前也一直用诺基亚手机，包装非常好，刚刚下班拿回来就充电了，等明天带回去给她试试效果??,2017-10-01 01:31:05,0,0,5
Y***8,PLUS会员,给老妈买的，她很喜欢，,2017-06-16 23:46:41,0,0,5
j***t,PLUS会员,太轻太轻了，配件：手机，电池，电源头和数据线，几百块钱凑合用，音量刚刚好，就是真的是太轻了,2018-01-07 14:23:29,1,0,5
墨***r,金牌会员,漂亮啊，前后摄像头，而且前置补光灯，高大上啊，399就是实惠！！！还是诺基亚结实，但是不防水。这手机的后盖，手感真好，Nokia标志还是浮雕的！铃声够大！早上下订单，下午就送到了，这个速度要点个赞！！此处省略一万字，顺便凑个字数！！,2016-08-29 16:12:00,2,1,5
佘***遇,PLUS会员,诺基亚230的声音挺大的，感觉比最新款105大。然后有前后摄像头，闪光灯也是前后都有，卡槽设计的不错，非常适合剪卡的小卡拼装后容易放入。,2017-08-28 08:21:02,0,0,5
陶***5,金牌会员,送货速度快得惊人。晚上下单早上就到了，惠州到潮州。诺基亚已经不是以前的诺基亚了，但还是挺好的。老人很满意。,2017-05-28 19:26:49,0,2,4
七***月,钻石会员,诺基亚，为经典致敬，超实用备用机，你值得拥有。给老爸买的，小巧精致，携带方便，手电筒功能很实用，超长待机，待机小王子，厉害厉害很666,2017-08-19 07:37:58,0,0,5
j***i,钻石会员,很好老人很喜欢在京东购物超爽,2016-10-31 10:52:25,3,1,5
jd魏鑫15,钻石会员,说实话后盖铝合金不跟边框有点硌手，总体来说还不错。备用机挺好的。,2017-10-02 15:01:49,0,0,5
红***3,银牌会员,给老爸买了一个，真的感觉不错，以前我父亲一直用诺基亚手机，现在在买一个给他。京东平台很好。老百姓的平台。,2017-12-10 20:08:44,1,0,5
j***2,金牌会员,发货速度很快的，给我岳母买的，老年人不会用触屏手机，她一直用的是按键手机。她说就诺基亚好用，因为她在昆明我在郑州没法拍实体图，我拍个别的图片赚个京东豆。,2017-05-21 15:06:09,10,6,5
玉***6,铜牌会员,能简单照相，待机几天。就照这标准选的。,2017-08-13 16:36:19,0,0,5
麻***吃,PLUS会员,用了几个月才来评价的，给老爸买的，声音和字体都很大，全新的简单实用！！！,2017-07-11 14:53:46,2,0,5
f***暖,铜牌会员,没有之前诺基亚的感觉了，轻轻的拿在手里不习惯，个别软件显示是英文也不知道是什么功能，总体还算可以吧，毕竟一分价格一分货， 物流非常给力，昨天下午下单今天上午就到手了,2017-06-14 14:40:30,1,0,4
小***轩,金牌会员,用了几天了 手机好用 通话质量好 缺点就是手机缝隙太大 灰尘很容易就进去了,2017-08-31 14:39:40,1,0,5
云***猫,银牌会员,下单第二天就收到了，很轻。就是不知道信号如何，待机时间如何，等用几天后再来评,2017-07-17 10:52:49,1,0,5
跃跃猪,铜牌会员,手机很快就收到了，是送给爸爸的礼物。声音挺大，字体也很大。,2017-12-05 17:31:41,1,0,5
小***晶,银牌会员,待机还行，就是太轻了，桌面图标没有设置显示文字吧。有些图标看着都不知道是什么，通话也比较清晰,2017-05-22 21:55:16,0,0,5
l***4,钻石会员,图表很多 没嘛用 还不如只有电话 短信呢 还省空间 依旧诺基亚的感觉,2017-11-17 09:59:48,0,0,5
韦***刚,PLUS会员,比想象中的轻，我以为是金属壳呢，原来是塑料壳。感觉没想象中那么好。手机屏幕也太亮了，不适合老人家，屏幕看起来花花的，都看不清楚屏幕上的字，内置的屏幕壁纸都是花花的，一点也不好看。,2017-09-02 19:36:24,0,0,5
j***z,金牌会员,刚收到货就迫不及待的打开了，用着还不错，当备用机使，一直信赖京东。,2017-11-10 18:39:35,0,0,5
龙***外,钻石会员,买给岳父的，买回来打开还不小心摔到了地上，还好没摔烂！！！心惊胆战了一下！,2017-08-19 22:06:35,0,0,5
灯***灯,PLUS会员,致敬经典，买来做台备用机挺好的。我觉得还是键盘机好用。,2017-05-16 18:05:41,1,0,5
C***r,PLUS会员,"拿到手太轻了，没有了诺基亚厚实踏实感的感觉了，信号减弱，电量目前还不知道如何。
做工感觉太毛糙了，没有认真做的感觉，和杂牌有得一拼。五星是给曾经的诺基亚，现在的，两分",2017-10-10 23:16:17,0,0,5
里***哈,PLUS会员,诺基亚虽然现在没以前那么好了，但还是质量可以，买来用完全没有问题,2017-10-05 21:43:35,0,0,5
E***0,银牌会员,给妈妈买的，  把所有字体调到最大，音量也调到最大，用起来还不错。 但是后盖的那个字的确会割手，  所以用了个透明胶布贴上去。试了蓝牙，用我手机把音乐传送过去，但是文件打不开。再试试再说吧,2017-08-19 15:36:04,0,0,5
嘀***嘀,PLUS会员,物流贼快，但是诺基亚手机感觉没以前做工到位了，希望直接能好吧。,2017-06-26 16:43:40,1,0,5
Y***w,钻石会员,京东晒图的图片大小不能超过6M，照片太大，只好一一截图上传。键盘比预想的小，本来是以为是N72之类的大键盘的，然后现在老人家按陌生手机号码不方便。方向键小框小小小小，就是各种小。换机过程看到一个信息，有点质疑是否是诺基亚正品了。毕竟现在这样的机型快被淘汰，越来越少了。手欠，时间设置上按了自动更新，然后百度上也找不到重设时间的方法，最后我还是倒回来JD找客服了。不应该选择为自动更新的，关了之后能重置。然后手机基本内存不大，放了一两张照片就爆满了，然后给老人家装上16G内存卡听听歌，存点儿女亲友的照片闲来无事看看~~最后还是给他留下一台5.5寸的智能手机，意识到这个诺基亚的只能满足他打电话而已，听歌照片的还是留给智能机来发挥好了。得了，之后再给他换个小屏幕一点的智能手机好了。望耐用,2017-06-06 16:34:15,1,0,5
不***惧,PLUS会员,这样一款老人机，这个也是，蛮贵的了。没有什么功能，无线也连不上。看中的就是经久耐用，还有那个诺基亚的情怀吧！家里老人，还蛮喜欢，整体好评吧。,2017-12-05 14:05:55,0,0,5
w***0,PLUS会员,还没插卡，做为备用机，这个样子可以了。比较轻薄，不知道待机时间跟信号如何，后续使用再做评论。然后，里面竟然有微博，，，，有opera浏览器，有必应，，。。,2017-05-16 12:00:57,1,0,5
感***2,钻石会员,原来是送给婆婆的母亲节礼物，因为太畅销，要调货，是迟来的礼物，包装很好，屏幕清晰，按键灵敏，适合老人家使用，等婆婆使用了看看怎么样，还有好多朋友说也想买给家人用,2017-05-17 16:31:37,0,0,5
空***歌,钻石会员,买给家人的，凑合用吧，没有以前诺基亚的感觉了！,2017-08-18 19:38:21,0,0,5
