名字,会员级别,评论内容,评论时间,点赞数,评论数,评价星级
h***0,钻石会员,虽然价钱摆在这里，但是也要保持一定的流畅性啊。貌似没找到怎么把软件安在sd卡里，充电有点小热，但是充电速度还可以。只是有三百米四星吧,2018-03-06 09:10:45,0,0,4
j***7,铜牌会员,手机确实很漂亮，超出想象，这是我第六个酷派机子！,2016-12-14 11:42:03,1,0,5
m***8,金牌会员,有时没有信号，电话打出入都不行，这个电池也不行，早上冲了电，下午就打了2个电话，到晚上就没电了。虽说便宜，呃．．．,2018-02-05 09:04:03,0,0,4
梦***心,PLUS会员,外观什么的整体还不错，性比价还是比较高的。快递也比较给力。总体很满意。,2018-03-03 22:29:19,0,0,5
X***8,PLUS会员,每次电器都是在京东买的，这次手机外观下还不错！等过些日子用了看看吧！,2018-03-07 15:20:19,0,0,5
小***8,PLUS会员,快递太快了，东西也很好，送人的，很喜欢，以后有需要还来，快递小哥辛苦了,2018-02-06 16:32:36,0,0,5
苏***6,PLUS会员,手机挺好的，,2018-03-06 12:58:18,0,0,5
a***3,PLUS会员,反应有点慢，,2018-02-09 16:53:26,0,0,5
z***e,PLUS会员,外观挺漂亮的，屏幕尺寸很给力。手机是给妈妈买的。方便她看的清楚，声音也是可以。运行速度没有仔细试过，如果下载东西少的话感觉还是可以的。因为老年人就需要字大声音大，其他的倒是无所谓了。,2018-03-06 10:57:28,0,0,5
佈***心,金牌会员,看起来还可以   这个价位能买到这样的已经很不错了  没啥要求买给老人家用的,2018-03-02 19:56:19,0,0,5
海***开,金牌会员,这个价格已经可以了，就去买来上微信的，其他的等用了一段时间才知道怎么样,2018-03-08 15:44:36,0,0,5
j***f,PLUS会员,手机一直在用  总的来说还可以  反应有点点点慢  可以忽略  摔了几次没摔坏  还是挺经摔的  款式很大方简洁  像素。。不行。。。信号还可以  山沟都有信号  电量。。基本九个小时左右就没电了,2017-12-27 07:45:17,0,0,5
j***d,PLUS会员,帮别人买的，还没有使用，不过对得起这个价格！,2018-02-01 14:57:40,1,0,5
j***风,PLUS会员,屏幕吓死人，只有一个角度能看清整个屏幕。还好只是用来，果然价格说明一切。,2018-02-13 15:11:06,0,0,4
雪***l,银牌会员,用了一段时间，没出现什么问题，这个手机作为备用手机，挺好，要是用送个手机贴膜或保护套就更好了,2018-02-12 06:30:54,0,0,4
j***6,PLUS会员,非常不错的一款老人智能机 奶奶很喜欢,2018-03-02 12:14:09,1,0,5
j***8,银牌会员,挺好的，感觉,2018-03-07 20:04:22,0,0,5
t***8,金牌会员,一分钱一分货,2018-03-06 15:23:37,0,0,5
j***d,铜牌会员,服务态度可以,2018-03-04 21:57:51,0,0,5
1***3,金牌会员,用来做测试机,2018-03-04 09:26:04,0,0,5
jk唯爱丝,金牌会员,买来开热点的,2018-03-03 18:36:29,0,0,5
j***u,铜牌会员,非常快隔天到,2018-03-01 13:25:32,0,0,5
m***3,银牌会员,手机运行很快,2018-02-20 22:35:59,0,0,5
U***Q,铜牌会员,值这个价格啦,2018-02-20 14:35:41,0,0,5
j***v,PLUS会员,物美价廉，比在实门店里好，反应快，快递给力,2018-03-05 02:31:41,0,0,5
l***2,金牌会员,一分钱一分货,2018-02-18 01:58:43,0,0,5
h***p,银牌会员,很好，谢谢！,2018-02-13 13:50:20,0,0,5
j***8,银牌会员,老妈用的还行,2018-02-08 09:22:44,0,0,5
j***l,金牌会员,还可以，不错,2018-02-05 11:49:35,0,0,5
j***o,铜牌会员,速度超级快，,2018-02-04 22:18:07,0,0,5
1***p,金牌会员,还可以手机,2018-03-04 17:33:58,0,0,5
l***7,铜牌会员,还不错，够用,2018-02-03 12:06:28,0,0,5
j***s,PLUS会员,酷派手机该不错，给爸爸买的，功能不多好掌握,2018-02-16 10:36:41,0,0,5
a***9,PLUS会员,买了二个，在摸索着，现在暂时几好。,2018-01-23 13:09:10,1,1,5
冀***9,PLUS会员,速度很快，质量很好，以后还会继续购买,2018-03-06 14:16:06,0,0,5
j***p,金牌会员,外观很漂亮。就是买给老妈！老人模式不很突出。其它都可以。,2018-02-25 07:35:28,0,0,5
小***-,PLUS会员,电池持久，运行内存还行，对的起这价格,2018-02-22 19:15:35,0,0,5
j***5,银牌会员,好评，漂亮大方，经济实惠，服务好，速度快，下个还会购买,2018-03-06 19:56:52,0,0,5
e***1,银牌会员,这手机不错的，买来给老妈用，到了之后用了一下，没什么问题。,2018-02-03 10:31:14,0,0,5
数码快照55,金牌会员,不错不错，京东一直比较给力，白条买了上万的电器电子产品,2018-03-03 17:20:03,0,0,5
沙市筆亞,金牌会员,价格很实惠，配置很一般，用起来很卡，只能说勉强够用。大部分内置的app可以删除，但是会有一些，莫名其妙的广告跳出来,2018-03-01 19:50:18,2,0,4
j***x,PLUS会员,帮朋友买的，快递就是快，支持京东,2018-03-08 16:13:45,0,0,5
蔣寧靜,金牌会员,买给爸爸的手机，老爸很喜欢。电池续航还行，触摸精灵。,2018-03-04 17:52:33,0,0,5
j***0,金牌会员,手机孩子正在用499元只能是个呢货，玩王者都玩得起。,2018-03-03 19:45:29,0,0,5
z***3,PLUS会员,不错，当老人机用，反应还算比较快的！,2018-02-02 13:10:39,0,0,5
y***弃,PLUS会员,好好好好，东西很实惠，一直信赖京东,2018-02-11 20:24:46,0,0,5
徐***降,银牌会员,用了几天，不卡，信号也正常，很满意，一般应用都能使用。,2018-02-11 11:33:04,0,0,5
南***8,铜牌会员,价格比较便宜，但屏幕清晰度不够，不过这个价位的手机有这样的配置已经不错了,2018-02-24 11:36:32,0,0,4
e***l,铜牌会员,第二次购买了，如果再加送钢化膜或手机壳就更好了哈哈,2018-02-27 19:40:45,0,0,5
j***t,PLUS会员,发货速度非常快，机子没有问题,2018-03-07 13:53:23,0,0,5
c***9,PLUS会员,这个手机还是可以的，给小孩用，,2018-02-12 16:51:23,0,1,5
j***s,钻石会员,还可以吧！必竟价格在这里。不玩大型游戏就好了。,2018-03-09 11:47:49,0,0,5
小***子,PLUS会员,金色的显气派哈，喜欢，下次还来,2018-01-31 21:40:15,0,0,5
j***6,铜牌会员,还可以吧，就是反应慢了点，不过作为备用机足够了,2018-02-23 15:15:25,0,0,5
酸***儿,PLUS会员,东西很好，很喜欢，物美价廉,2018-02-03 11:40:53,0,0,5
穷***3,铜牌会员,第二天早上就到了，很快。机子还可以，就是电耗太快了，还好只是买给老人用，还有实际内存和标准内存不符，内置应用太多了，感觉像1G+8G。。。但还是要支持，酷派加油！,2018-02-22 13:04:48,0,0,5
j***c,铜牌会员,还行，老人很喜欢。如果有需要还会来买的。,2018-02-27 12:48:58,0,0,5
瑾***沫,铜牌会员,挺好的，物美价廉，给妈妈买的，用着还不错,2018-02-25 17:26:56,0,0,5
路***p,PLUS会员,"非常好,与卖家描述的完全一致,非常满意真的很喜欢,完全超出期望值,发货速度非常快,包装非常仔细、严实,物流公司服务态度很好,运送速度很快,很满意",2018-02-02 10:51:01,0,0,5
w***2,金牌会员,还不错。给老人买的，物美价廉，值得购买。,2018-02-06 11:04:37,0,0,5
飞***3,PLUS会员,先好评，等用后追评！,2018-02-02 22:01:21,0,0,5
逍***0,金牌会员,手机屏幕清晰度好，手感超好！物流配送快,2018-02-09 20:16:52,0,0,5
爱***乐,钻石会员,很漂亮速度够快，服务员好，最主要快,2018-03-09 13:30:00,0,0,5
j***l,银牌会员,给父亲用的，总体还可以，价格便宜。,2018-03-08 14:49:11,0,0,5
不***7,金牌会员,之前用过酷派大神，支持酷派。性价比之王,2018-01-17 22:56:51,0,0,5
z***x,PLUS会员,便宜，快递快,2018-02-01 21:42:26,1,0,5
一***1,钻石会员,这个装了软件可以，送个膜就完美了,2018-02-10 15:02:36,0,0,5
m***米,银牌会员,"该机子是买给我老妈用的，老妈先前用的那部旧安卓机的系统都完全瘫痪了，死活都不愿意换，非要我帮她买T.T
总之，这个手机是非常很适合老人用的。价格非常便宜。",2018-02-02 19:49:30,0,0,5
v***7,银牌会员,产品挺不错的，老人用挺好的啊！,2018-02-23 17:07:29,0,0,5
l***2,钻石会员,很好用价格特别实惠，看着不错,2018-02-20 23:29:58,0,0,5
j***z,PLUS会员,以前在1号店买，被收购后忘记用户名了，改京东买了，除了几次不小心买错成私营店铺购物不满意外，京东自营的商品和服务目前都还是满意的。,2018-02-07 15:10:39,0,0,5
j***a,铜牌会员,值得购买，物有所值，好评。,2018-03-04 14:12:09,0,0,5
j***d,金牌会员,东西物有所值，京东值得信赖！,2018-02-14 23:17:50,0,0,5
j***7,金牌会员,给我妈妈买的挺好，用用看,2018-03-09 14:58:36,0,0,5
d***g,PLUS会员,公司当公用电话用，还可以~,2018-03-07 11:24:29,0,0,4
z***3,铜牌会员,一般吧，显示屏效果不是很好，反正老人用，凑合吧……,2018-02-15 10:41:15,0,0,4
j***7,PLUS会员,屏幕大小合适，用的还可以！,2018-02-13 12:02:29,0,0,4
j***l,钻石会员,手机可以，电池不给力～很快就没电了，懒得换算了,2018-02-02 20:49:19,0,0,4
d***g,PLUS会员,电信备用机，随便用用~,2018-03-07 11:16:45,0,0,4
j***c,金牌会员,手机很好物流也很快给赞,2018-02-06 15:35:27,0,0,5
j***7,银牌会员,手机刚到手，试用一下，质感不错，系统运行也算可以，16G到手有9G多，可以接受，就是安装应用较慢，过段时间再评价,2018-02-02 11:43:30,1,0,5
陌***l,PLUS会员,给老爸买的，适合老年人。京东物流非常棒，送货速度快，服务很好。已经习惯在京东购物，会继续支持，非常满意，好好好！！！！,2018-03-03 14:27:48,0,0,5
j***f,金牌会员,速度还可以 手感也好,2018-02-11 20:14:13,0,0,5
j***y,铜牌会员,价格便宜，手机还可以吧，老年人用用挺好,2018-02-08 19:47:08,0,0,4
j***l,铜牌会员,质量差，关屏按几下才关的了，好咔，,2018-03-09 11:04:36,0,0,4
q***0,金牌会员,用了这么久，质量不错,2017-12-13 07:47:34,2,0,5
m***8,铜牌会员,还可以吧 给家人用的 只用来打电话。,2018-02-06 11:52:00,0,0,4
沪***炎,钻石会员,安装四个APP就明显反应速度慢。,2018-03-06 10:01:27,0,0,4
估***夕,钻石会员,做备用机用，好用，第二次买了。,2018-02-28 13:12:31,0,0,4
j***1,金牌会员,这个价位能是智能机，能上微信。,2018-02-12 12:28:38,0,0,4
j***w,钻石会员,只能说还可以用吧，老人用的,2018-02-23 20:39:21,0,0,4
j***u,银牌会员,手机用了一段时间再来评价的，这手机是給老丈人用的，到目前为止还没什么问题，速度也挺快的，蛮好的，下次再来京东，京东的东西就是放心,2018-02-09 16:52:22,0,0,5
j***k,金牌会员,拿到快递打开，手机居然开不了机，充电一会后能开，但充电十分缓慢，不知道是不是电池有问题，手机反应也慢，观察观察，不行申请退货,2018-02-24 19:00:37,0,0,5
L***珊,铜牌会员,用了一个星期左右，没有明显不好的地方，就是分辨率低，看视频的高清等于别人的标清，像素很差，要前置拍照视频的就不要买了，前置摄像头完全没用好模糊！电池还好，充满电只待机没使用三天没电。,2017-11-30 20:48:56,1,0,3
兰***金,银牌会员,给老人用的，感觉还不错,2018-02-25 13:19:30,0,0,4
野***y,铜牌会员,不得不说，真的是太垃圾了，对于我来说…超级卡，而且那个返回键，有点失灵…没有拍到照片，因为是买给我妈用的�配张我自己3图上去吧…,2018-02-08 14:47:29,0,0,5
D***7,PLUS会员,这个价位买到这样的手机也没什么好说的，2g运行内存也还可以,2018-03-08 18:38:09,0,0,4
j***笑,金牌会员,还行吧，一分钱一分货,2018-02-07 09:46:10,0,0,4
j***4,金牌会员,公司用的，挺好用的,2018-03-05 16:54:00,0,0,4
j***c,银牌会员,明明是送货上门，而现在却变成要去自提点拿货真的太闹心了。京东快递真的越来越不怎的了。商品没用不知道还行吗？是送人的。,2018-02-05 06:53:16,0,0,5
j***e,PLUS会员[试用],外观和手感很炫，给妈妈买的，还可以切换到到老人机模式，几百块钱的手机感觉还值了，给个好评,2018-03-06 19:52:17,0,0,5
y***1,银牌会员,电池正常能用一天，反应也好，就是曲屏没图片的效果，京东物流绝对五星，春节期间速度照旧，晚上下单，第二天就拿到了,2018-02-11 23:23:53,0,0,5
我***鲸,铜牌会员,应该还行吧。给妈妈买的，要求不高，这个配置用得也还可以。就是太宽了……这个手机的价格算是对得起这个配置吧。反正就是微信、电话这样使使，完全可以满足。但其他的就不能奢求更多啦。,2018-02-26 21:26:22,0,0,4
嫌***l,银牌会员,商品很好，发货速度令我惊讶，但配送员让我等了一个多小时，本来是提前配送的，不过对配送员总体感觉还是不错的。,2018-02-26 18:41:21,0,0,5
鲸***0,PLUS会员,手机不错，毕竟价格在那里放着，很是流畅厉害???????????,2018-02-08 21:51:35,0,0,5
j***q,PLUS会员,200多块钱的东西咱就别说了 话筒还时好时坏的 结果我妈用了不到一个月直接掉水里了,2018-03-09 21:50:31,0,0,5
jd_Legend Boss,金牌会员,不是无理由退货吗？跟我玩拉锯战，申请退货，快递员收了，审核不通过，给我退回来，快递员又给送来，我拿来干嘛！,2018-02-04 14:56:59,0,0,5
j***5,钻石会员,这个手机外观好看，运行快。价格实惠。物流发货快。性价比高。快递员态度很好。很满意。,2018-02-19 16:48:29,0,0,5
唐沐木,银牌会员,手机是买给老爸用的，这手机是即实惠又美观，说实话，刚看到这价位时还以为手机不咋样，没想到还挺意外的,2018-02-12 22:48:52,0,0,5
M***v,铜牌会员,还可以，手机也挺新的，联网下载也没问题的，就是买回来只送一个充电器，耳机，蓝牙都没有，能多送东西吗,2018-02-08 14:02:04,0,0,5
j***5,PLUS会员,速度快，性价比最高，刚收到不知道用一阵子会怎样，总体感觉不错，但是好像不是新机,2018-02-02 11:19:13,0,0,5
J***8,金牌会员,第三次购买这机型了，这次是帮朋友买的，见我之前买过两台，她也要订一台春节回家送公公。好儿媳啊！！,2018-02-02 13:45:49,0,0,5
远***上,银牌会员,手机看起来很漂亮，时尚，很有质感。500元内能买到这样的手机，不错。只是UI设置做的不够易用,2018-02-16 10:55:39,0,0,5
简***2,金牌会员,虽然手机几百块钱，但还是挺好的，适合老人家使用，性价比ok。微信运行流畅,2018-02-06 22:01:48,0,0,5
k***a,PLUS会员,发货速度非常快，包装非常仔细、严实，运送速度很快，很满意的一次购物.,2018-03-05 15:47:03,0,0,5
k***a,PLUS会员,"质量非常好，与卖家描述的完全一致，非常满意,真的很喜欢，完全超出期望值.",2018-02-02 01:33:55,0,0,5
G***u,PLUS会员,手机给妈妈买的，她不会用触屏手机的，这次尝试一下。便宜又好用。很棒！,2018-02-22 09:09:11,0,0,5
j***a,铜牌会员,感觉不太理想，脖子太长了，屏幕感觉小了点，配的东西也不齐全，连耳机都没配，数据线太短了，,2018-02-23 21:20:10,0,0,5
炮***8,PLUS会员,好用，速度快，好看，京东送货速度快，没毛病老哥，值得推荐，值得信赖！,2018-02-15 08:55:26,0,0,5
封***则,PLUS会员,便宜看得见，京东大促实惠多多，家里常备，有助于身体健康，喜欢京东,2018-03-10 00:24:10,0,0,5
j***x,铜牌会员,不得不说京东是真的快啊，昨天晚上下的单，今天下午就到了感觉不错不错，还会回来购买的！,2018-03-06 17:35:30,0,0,5
幻***梦,PLUS会员,不错，刚到手，安装软件，收拾了半天，还算流畅，给老爹买的，也就上个微信看个头条，够用了……,2018-02-11 09:50:38,0,0,5
筱***5,铜牌会员,手机外观还可以，质量等用过才知道呢，这个价钱买到这么大屏幕，还是16g的已经不错了,2018-03-07 19:13:22,0,0,5
j***6,钻石会员,老妈用的，说还可以，毕竟就是接打电话看看短信什么的，想要上网就算了，没有下载的地方,2018-03-07 09:15:13,0,0,5
第***林,PLUS会员,挺划算的手机360挺好的，性价比挺高的  物流也是非常的快没话说。,2018-02-08 22:01:27,0,0,5
槿***9,银牌会员,手机外关闭不错，有优惠的时候买的，多划算的,2018-03-03 21:26:43,0,0,4
j***9,铜牌会员,还可以，就是安装软件太慢，下载东西也比较慢，外观还可以，电也比较经用。所以给个好评,2018-03-01 18:22:38,0,0,5
F***c,PLUS会员,商品不错，物美价廉，京东的物流是超赞的，会经常来京东买东西噢。,2018-02-23 11:07:02,0,0,5
陈***6,钻石会员,运行速度挺快，使用也比较方便，唯一不明白的是不知道软件商店在哪里,2018-02-06 05:30:50,0,0,5
j***t,银牌会员,手机很好用，拍照效果挺好，手机自带的软件还可以卸载，省了不少空间，非常满意，感谢京东,2018-02-04 16:11:14,0,0,5
基***人,PLUS会员,不错挺好的,2018-02-23 10:47:08,0,0,5
j***s,PLUS会员,宝贝还是很不错的，性价比很高，物流也很快，很满意的一次购物,2018-03-09 09:56:47,0,0,5
天***路,PLUS会员,物流很快，手机也可以，就是不知道怎么设置某个软件不能用流量上网,2018-02-06 20:47:09,0,0,5
黎***霞,铜牌会员,感觉还不错?,2018-02-19 19:11:14,0,0,5
j***业,PLUS会员,给朋友买的，在外打工很寂寞，，这个手机好玩不贵，朋友喜欢！,2018-03-02 23:47:22,0,0,5
j***g,PLUS会员,不错，续航还行，给家里老人买来用是真的可以的了，反应挺快的,2018-03-02 15:42:32,0,0,5
木***昕,PLUS会员,质量很好，包装严实，价格实惠，运行很流畅，上档次。非常满意！,2018-02-13 17:38:08,0,0,5
j***i,PLUS会员,质量不错?适合老人用，声音大 续航时间也长，性价比超高！,2018-02-24 10:44:27,0,0,5
q***8,铜牌会员,比实体店便宜快一倍，年二九下单，正月初四收到货，其他快递正月都停了，值得点赞。,2018-02-24 22:28:04,0,0,5
樱***2,PLUS会员,使用还不错,2018-02-06 21:51:41,0,0,5
l***n,PLUS会员,一直在京东上买东西，正品，值得信赖，快递员也特别好，必须力挺,2018-02-06 22:26:36,0,0,5
k***A,银牌会员,还好挺不错的。,2018-02-04 20:17:51,0,0,5
小***7,PLUS会员,蛮好的，这么便宜，当老人机用很好的。京东快递就是快。满意的。,2018-02-03 08:51:36,0,0,5
j***c,金牌会员,给长辈买的，刚拿到手看着不错，运行挺快的，与描述相符，期待以后用着也没问题吧！,2018-02-05 15:59:32,0,0,5
己***在,金牌会员,不错，价格变动立马就补给我了，值得购买，值得信赖，买给老人家用的，所以要求不高,2018-02-03 18:55:16,0,0,5
a***n,钻石会员,买给长辈的礼物，不错，速度就快，用微信就足够了，拍照也很清晰，适合老人家用,2018-02-26 18:46:00,0,0,5
d***v,铜牌会员,晚上11点下的单第二天下午五点就到了，回来打开一看不错用了几天还不错，好评,2018-02-23 20:42:20,0,0,5
fengrongwilson,PLUS会员,屏幕很大，送货都很快，买来送朋友的，据说非常喜欢这个手机,2018-02-06 22:27:50,0,0,5
j***o,铜牌会员,手机真不值这钱，只是懒的退货，屏幕不清晰，反应太慢！后悔买了！爸爸用将就了！！！,2018-01-07 22:00:18,0,0,2
j***i,PLUS会员,很好，给妈妈买的，不错，不错，不错，漂亮，不错，很好。,2018-02-24 04:21:56,0,0,5
你***j,PLUS会员,拍照效果挺好的，感觉和单反有的一拼，很棒棒，物美价廉,2018-03-03 00:11:21,0,0,5
e***6,PLUS会员,当天就送到了 手机还是不错的 只是拍照功能稍微差了点,2018-02-25 06:59:55,0,0,5
衣***行,金牌会员,不错  不错  真心不错   暂时哈    给老人买的  用一段时间在评,2018-02-24 15:57:27,0,0,5
愿***猪,银牌会员,你一直信赖京东自营，但是它次的手机真的不怎么样，手机反应很卡，还不配送耳机,2018-02-04 22:57:16,0,0,5
j***d,金牌会员,外观不错，就是会有点卡，然后就是网络信号不是很好在农村地区。其他的还行,2018-03-01 19:24:11,0,0,5
鹧鸪夜飞,金牌会员,很好很好，虽然流畅度达不到我要求，给老人家用，足够了很喜欢！！！good,2018-02-04 19:59:13,0,0,5
徐***汐,PLUS会员,手机很好用，适合老人家，价格便宜，运行速度还是挺快的,2018-02-03 11:05:41,0,0,5
s***4,钻石会员,现在的手机性价比越来越高了，外形也好看，给老人用或者留在家里备用都可以,2018-02-14 13:55:21,0,0,5
教***U,银牌会员,帮朋友买的，这是第三部，外观靓艳，单手把握洽好，上网看新闻，视频流畅。,2018-02-11 09:11:11,0,0,5
迩***东,钻石会员,老人用，从原来的按键手机转换到安卓手机，比较顺利。价格实惠，酷派不错。,2018-02-10 19:36:00,0,0,5
哇***萝,PLUS会员,买给小朋友用的，小盆友很喜欢，待机时间不够长。,2018-03-09 23:07:05,0,0,5
尼***王,PLUS会员,给爸爸买的，很喜欢，用起来 可以 ，对得起这个价格,2018-02-07 22:43:58,0,0,5
该***寳,PLUS会员,外观不错，对得起这个价。物流也很快，机子还没用，有没有问题后期在评吧……！,2018-02-20 23:27:33,0,0,5
路***草,银牌会员,"屏幕够大，老年人使用，完全可以，分辨率差一点，
其它的还不错，好评",2018-03-05 10:06:01,0,0,5
范***城,铜牌会员,物流快递速度非常快，第一次使用京东，感觉比其他网购网强多了，以后常用～,2018-02-03 12:27:36,0,0,5
睿***i,金牌会员,东西非常好，物流也很快。密封合适，样式新颖，特别棒。新新的，很薄。,2018-03-02 19:12:24,0,0,5
较***歪,PLUS会员,质量很好，物流到货速度也很快，非常喜欢，给个赞,2018-03-01 22:02:27,0,0,5
1***6,PLUS会员,非常经济实惠，使用功能基本覆盖常用需求，推荐。,2018-02-28 20:03:15,0,0,5
q***y,钻石会员,给老人用的手机，手机居然自带不和谐内容，污眼睛，无法删除，莫名其妙,2017-08-27 14:58:10,109,15,1
老***7,PLUS会员,买来送人的，价格算是便宜，要求不高凑合着用。,2018-03-09 21:09:29,0,0,5
j***1,PLUS会员,给奶奶买的，用着还行，反应也挺快，功能齐全！,2018-03-08 21:55:02,0,0,5
逍***宝,金牌会员,一分钱一分货，这个价钱已经不错了，主要使用蓝牙功能，其他的不怎么用,2018-02-22 17:06:29,0,0,5
J***m,铜牌会员,手机适合老人用，玩微信什么的还是稍微有点儿卡。。接打电话就没问题！,2018-02-19 08:18:53,0,0,5
小***9,PLUS会员,不错，京东物流又快又好，服务也好，支持。还会再来,2018-02-02 11:21:36,0,0,5
嗳***宿,铜牌会员,帮朋友买的，他急用，物流很快，早上下单下午就到了，朋友说用着不错！,2018-02-11 22:08:41,0,0,5
昵***0,金牌会员,给老人用的   还可以吧  虽然是有点卡不过这样的价格也就这样了,2018-02-25 18:32:26,0,0,5
j***r,铜牌会员,买给家婆的，她很喜欢，金色外壳很高大上，她只要求能上微信就行。,2018-03-08 21:16:19,0,0,5
w***4,钻石会员,"酷派的系统越越做越烂了。。。。怀念大神。。。。
用原生的系统吧。",2018-02-22 16:03:23,0,0,5
断***5,PLUS会员,手机很漂亮，很不错，妈妈很喜欢，功能比较全,2018-03-03 10:03:09,0,0,5
一***血,PLUS会员,物流很快 服务好 手机上网速度快 我很满意,2018-03-01 12:20:11,0,0,5
j***a,铜牌会员,内存虽然不大，但通讯方便还能上网，并且发货的质量和效率都很好，赞,2018-02-12 09:19:17,0,0,5
G***3,金牌会员,物有所值了,2018-03-09 21:49:33,0,0,5
l***8,铜牌会员,不错，好评,2018-03-06 19:04:20,0,0,5
E***g,钻石会员,价格便宜，,2018-03-03 12:05:27,0,0,5
j***o,金牌会员,手机还可以,2018-03-03 00:11:56,0,0,5
j***z,金牌会员,不错，性价比高，功能齐全，完全不输某些品牌，给长辈用很好?,2018-03-02 11:28:26,0,0,5
东***海,银牌会员,东西还不错,2018-02-28 07:27:42,0,0,5
梧***区,PLUS会员,拍照片非常清晰，速度与激情非常快质量很好,2018-02-27 11:47:22,0,0,5
梧***区,PLUS会员,拍照片非常清晰，速度与激情非常快质量很好,2018-02-27 11:46:49,0,0,5
4***q,金牌会员,物流速度非常快，隔天就到货了，东西正在使用中，感觉还是不错的,2018-02-26 08:30:53,0,0,5
j***8,PLUS会员,很好啊很好，连个耳机都没有，真的很大气?,2018-02-10 13:16:08,0,0,5
a***6,金牌会员,很好很快，这手机2016年的，应该是库存货，几百块也只能这样了,2018-02-09 20:05:37,0,0,5
1***p,银牌会员,还没用，好,2018-02-23 08:41:22,0,0,5
i***4,银牌会员,拿给我爸爸用，还是可以的，虽然价格很便宜，但是性价比还不错。,2018-02-23 11:20:10,0,0,5
j***a,铜牌会员,收到了不错,2018-02-22 09:02:53,0,0,5
b***d,金牌会员,给老人用的，打电话发短信拍拍照片玩，目前用着还行，希望能用住,2018-02-21 07:31:53,0,0,5
j***h,PLUS会员,有的确定了票据我所知前提高级数据我所知,2018-03-07 12:35:33,0,0,5
g***g,PLUS会员,好看，给老年人用用还行，就是掉电快了点,2018-03-04 09:11:41,0,0,5
