名字,会员级别,评论内容,评论时间,点赞数,评论数,评价星级
j***2,银牌会员,用了一段时间了，感觉不怎么样，电池不行。,2018-02-24 19:30:34,0,0,5
j***z,金牌会员,给朋友买的，还不错，全网通，还双卡双待！,2018-02-23 15:28:55,0,0,5
哲***梦,银牌会员,工作号，只能用电信卡，手机不错，挺值得！,2018-02-22 20:44:05,0,0,5
j***2,银牌会员,京东就是放心，和描述的一样，满意的购物。,2018-02-20 20:00:20,0,0,5
y***e,铜牌会员,这手机没手电筒，也不能截屏！也不配送耳机！,2018-02-04 06:27:01,0,0,5
钟***煌,铜牌会员,这价位的智能机就这样了，给老人用还可以,2018-03-05 11:25:57,0,0,5
比***饰,PLUS会员,使用了一下，拍照效果一般，使用的效果还是不错，给母亲买的，毕竟这个价格还是不错的。,2018-02-06 18:27:07,0,0,5
j***s,金牌会员,用了一段时间，暂未发现异常！继续保持下去！,2018-02-02 11:17:54,0,0,5
流***3,钻石会员,东西收到了，还行吧，这个价也就这效果了,2018-03-01 19:10:56,0,0,5
a***F,铜牌会员,手机收到了，手机开机按键不好用，很用力按,2018-02-11 21:30:21,0,0,5
我***雅,钻石会员,质量很好 给公司买得 不愧为大品牌值得信赖 棒棒哒。下次有需要再来,2017-11-29 15:41:54,0,0,5
尘***戏,钻石会员,手机还行吧，一分钱一分货爸妈用的可以了，,2018-02-10 21:07:35,0,0,5
内***炸,PLUS会员,还行，凑合着用用先。,2018-02-09 10:02:22,0,0,5
w***Y,铜牌会员,帮同学买的，同学挺喜欢的，也觉得挺划算的,2018-02-12 08:19:31,0,0,5
j***m,银牌会员,苹果系统用习惯了，感觉不适应，挺好的谢谢,2018-02-08 12:35:52,0,0,5
j***g,银牌会员,反应有点慢，也只能打打电话，微信视频了,2018-02-22 23:40:13,0,0,5
j***n,钻石会员,很好   给孩子买的  算是过年的礼物吧,2018-02-08 06:58:06,0,0,5
张***3,金牌会员,发货及时，快捷，服务贴心。商品很好！,2018-03-06 20:50:57,0,0,5
1***p,银牌会员,还不错，没想象中的那么卡。给老人用的，,2018-02-20 16:21:00,0,0,5
教***所,钻石会员,简单的打电话，发短信还可以，老人可以用,2018-02-18 08:36:55,0,0,5
l***0,PLUS会员,这个手机，很便宜，,2018-02-28 10:16:02,0,0,5
H***Y,铜牌会员,电池不奈用，待机都不超过三十六小时。,2018-02-27 09:13:59,0,0,5
j***y,银牌会员,感觉应该还可以吧，还没有开始使用！！,2018-02-24 20:25:00,0,0,5
z***9,钻石会员,很不错的东西，很好用，不错的一次购物,2018-02-25 20:31:03,0,0,5
j***0,金牌会员,外观漂亮，价格实惠，老年人用用挺好,2018-03-09 13:57:06,0,0,5
j***c,银牌会员,京东还是一如既往的让人满意，手机很漂亮,2018-02-08 09:55:07,0,0,5
j***t,银牌会员,运行速度不错，老人用着挺好！性价比很高,2018-02-06 12:47:27,0,0,5
h***g,PLUS会员,目前看起来没有问题,2018-02-20 12:04:57,0,0,5
w***y,铜牌会员,还行，就是有点卡，充电要很久，用电快,2018-02-20 09:08:52,0,0,5
帅***爸,PLUS会员,老人机，只打打电话,2018-02-20 07:50:10,0,0,5
j***b,铜牌会员,手机外观不错   但运行速度太慢了,2018-03-06 22:59:06,0,0,5
j***d,银牌会员,给老爸买的.还不太会用!白色挺好看的!,2018-02-05 21:25:05,0,0,5
h***q,铜牌会员,好评。到货很快，很好用。很惊喜哦。,2018-03-03 15:09:50,0,0,5
叶***6,钻石会员,手机很便宜，实惠啊，买给老人用不错,2018-03-02 09:11:23,0,0,5
jd_188150yhs,铜牌会员,电池不存电，和平常买的一百块的差不多,2018-02-10 20:26:24,0,0,5
叶***淑,铜牌会员,还好还好，毕竟价格在那放着呢，哈哈。,2018-02-09 23:07:37,0,0,5
jd_yhl123hihi,铜牌会员,手感舒适，操作简便，电池续航时间满意,2018-02-09 22:46:18,0,0,5
j***s,钻石会员,手机便宜，使用方便，三网通，很实用,2018-02-23 09:41:01,0,0,5
残***美,银牌会员,服务太度真心不错，能在第一时间处理！,2018-02-08 14:07:19,0,0,5
j***a,金牌会员,还可以299的13345864664,2018-02-06 21:42:11,0,0,5
1***p,钻石会员,买了这个手机作为备用的，还不错吧,2018-03-05 08:25:14,0,0,5
浪***5,金牌会员,给老人用，相机效果差点，其它挺好,2018-03-04 09:53:38,0,0,5
j***w,金牌会员,给老爸买的，他很喜欢，性价比很高,2018-03-03 12:26:42,0,0,5
j***v,铜牌会员,手机运行一般，界面滑动不灵敏，卡。,2018-02-16 21:37:59,0,0,5
j***l,铜牌会员,收到货了，正在使用中，基本还可以,2018-03-03 09:26:08,0,0,5
j***p,金牌会员,一分钱一分货，凑合着用，给老妈买的。,2018-02-02 13:27:13,0,0,5
j***d,银牌会员,没有钢化膜，其它都还可以，份量不重,2018-02-16 09:18:17,0,0,5
j***2,PLUS会员,非常好非常好非常好,2018-02-03 20:59:29,0,0,5
M***u,金牌会员,此用户未及时评价，系统默认好评。,2018-03-02 21:50:50,0,0,5
j***l,金牌会员,买来做备用手机，没有安装什么软件。,2018-02-15 20:36:15,0,0,5
j***p,铜牌会员,手机很差很卡，打电话有时候听不到,2018-02-27 11:45:35,0,0,5
j***t,金牌会员,当老人机，备用机用还是用处多多的,2018-02-28 01:25:33,0,0,5
j***0,银牌会员,屏幕有延迟，反应慢，不过价钱摆在那,2018-02-12 07:40:32,0,0,5
j***l,铜牌会员,可以，昨晚下单，今天就到了。么么哒,2018-02-11 19:45:30,0,0,5
雪***妆,铜牌会员,声音再大点就好了，总的来说还不错,2018-02-24 08:01:56,0,0,5
j***h,钻石会员,"价廉,老人机，老人打电话配置够用了",2018-02-09 21:00:22,0,0,5
jd_790553,金牌会员,此用户未及时评价，系统默认好评。,2018-02-22 14:44:04,0,0,5
j***f,铜牌会员,手机还可以，只是耗电快，性价比一般,2018-02-07 20:23:32,0,0,5
j***e,银牌会员,给老人买的，用着不错。一起买两个。,2018-02-07 07:10:07,0,0,5
1***w,银牌会员,非常好物有所值，给老人买的很喜欢,2018-02-20 18:37:41,0,0,5
司***事,钻石会员,买来送人 价格合适 老人用着正好,2018-02-20 17:19:36,0,0,5
B***糖,银牌会员,物流挺快的，只是关机后总是自动开机,2018-02-03 10:50:46,0,0,5
j***惜,PLUS会员[试用],刚收到货，总体还可以，物流很快，,2018-02-17 14:18:13,0,0,5
偶***子,银牌会员,此用户未及时评价，系统默认好评。,2018-02-16 17:18:57,0,0,5
j***3,铜牌会员,电话己收，各方面都满意，新年快乐,2018-02-15 15:57:34,0,0,5
j***4,铜牌会员,不错，可以开热点，还是全网通的,2018-03-01 09:46:05,0,0,5
j***g,金牌会员,很好?，用来只打电话的，不错,2018-03-01 01:05:20,0,0,5
j***c,金牌会员,到货及时，真心感谢，有京东真好。,2018-02-10 21:51:30,0,0,5
l***t,金牌会员,感觉不错，给老妈用的，感觉挺好,2018-02-24 21:51:58,0,0,5
郑***飚,金牌会员,此用户未及时评价，系统默认好评。,2018-02-08 16:37:11,0,0,5
匿名使者bkp,铜牌会员,此用户未及时评价，系统默认好评。,2018-02-08 14:36:50,0,0,5
j***2,铜牌会员,买来备用的，挺不错的，支持哦！,2018-02-23 00:33:19,0,0,5
沫小乖紫凝,铜牌会员,买给公公用的，不知道好不好用！,2018-02-21 18:04:31,0,0,5
J***d,银牌会员,收到还没放卡，开机后感觉还不错。,2018-02-06 21:03:04,0,0,5
j***c,金牌会员,还不错，用来接电话一点问题也没有,2018-02-06 21:06:21,0,0,5
杨***s,银牌会员,给老公接打电话 工作用 挺好用的,2018-02-06 11:20:02,0,0,5
j***2,钻石会员,给老妈用的，暂时还不错，希望耐用,2018-02-06 12:31:23,0,0,5
j***q,铜牌会员,速度超级快，东西也不错 经济实惠,2018-02-05 17:52:41,0,0,5
徐***彬,钻石会员,买给老妈用的，这个价钱可以了,2018-03-06 06:29:53,0,0,5
j***s,银牌会员,手机收到，外观还看得，性价比高。,2018-02-04 10:10:46,0,0,5
o***G,银牌会员,买给老人用，非常实用。老人很喜欢,2018-02-04 23:03:55,0,0,5
柚***妹,银牌会员,挺好的，还不错，用着好，便宜,2018-03-05 13:21:55,0,0,5
石***天,银牌会员,酷派这款手机还行适合老年人用,2018-03-04 16:23:17,0,0,5
j***p,金牌会员,对于这个价位的手机  很不错了,2018-02-15 19:35:24,0,0,5
呼***-,钻石会员,外观时尚 价格实惠 性价比高,2018-02-28 22:39:08,0,0,5
j***u,铜牌会员,给父母买的的，还不知道怎么样,2018-03-01 08:51:21,0,0,5
j***r,铜牌会员,给我妈妈买了这一部手机。说还好,2018-02-12 10:47:38,0,0,5
看看咯_啦啦啦,金牌会员,性能一般，但是屏幕看着很难受,2018-02-27 00:13:15,0,0,5
w***3,金牌会员,挺好的，给妈妈买的，老人用的,2018-02-28 20:46:22,0,0,5
s***m,钻石会员,手机不错，基本满意，实惠好用,2018-02-24 17:50:53,0,0,5
j***e,金牌会员,配送速度太快了，非常赞赞赞赞！,2018-02-08 10:28:06,0,0,5
H***3,银牌会员,很好，运用价值高！性价比高,2018-03-08 08:05:34,0,0,5
w***3,PLUS会员,手机很不错，款式也漂亮，速度快,2018-02-06 12:14:03,0,0,5
S***H,银牌会员,东西还可以，老爸用着还行。,2018-03-06 09:36:38,0,0,5
j***d,企业会员,送货很快，京东物流和商品都点赞,2018-02-04 12:30:31,0,0,5
j***y,金牌会员,刚收到货冲不了电过两天又可以了,2018-02-04 19:16:18,0,0,5
u***h,铜牌会员,手机有点小电池有点鼓不太好,2018-03-05 12:37:47,0,0,5
O***0,金牌会员,物美价廉，适合家用，送货速度快,2018-02-03 16:13:39,0,0,5
j***v,银牌会员,屏幕够大，分辨力稍有欠缺，,2018-03-04 12:08:40,0,0,5
c***b,银牌会员,物有所值吧，一分钱一分货。,2018-03-03 17:55:40,0,0,5
j***u,银牌会员,机子都挺好，就是声音太小。,2018-03-02 22:44:27,0,0,5
z***1,钻石会员,还是可以。还是可以。还是可以。,2018-02-05 19:16:05,0,0,5
e***6,银牌会员,挺不错的，下次还会再次购买,2018-03-01 08:52:10,0,0,5
薄***6,铜牌会员,还行吧就是说送东西怎么没送？,2018-02-14 15:19:34,0,0,5
圆***冬,金牌会员,还没开始用，但应该还可以吧！,2018-02-12 15:29:02,0,0,5
超***限,铜牌会员,手机用几天就坏了，还经常闪退,2018-02-11 15:15:39,0,0,5
j***p,铜牌会员,用了一段时间才评，还行吧!,2018-02-24 12:02:45,0,0,5
j***5,铜牌会员,送货超快，当天下单，隔天就到,2018-02-09 19:57:56,0,0,5
j***f,铜牌会员,速度快，服务态度也很好，行,2018-02-23 16:10:02,0,0,5
Q***e,钻石会员,好好。。。。性价比高！！！！,2018-02-08 20:37:59,0,0,5
j***c,铜牌会员,手机反应太慢，卡的不要不要的,2018-02-08 16:15:14,0,0,5
中***C,银牌会员,产品不错，适合老人使用。,2018-03-09 05:30:17,0,0,5
i***o,钻石会员,用来装电信卡的，可以正常使用,2018-02-06 19:04:50,0,0,5
w***d,金牌会员,这样的价位，用着还不错，值了,2018-02-06 08:55:39,0,0,5
h***5,银牌会员,宝贝款式漂亮，字体大，给家里老人买的，比较理想的一次购物，老爸挺喜欢，希望耐用，待追评，,2018-02-04 19:54:32,0,0,5
W***J,金牌会员,免强可以用，这个价钱合理,2018-03-04 08:45:25,0,0,5
j***p,金牌会员,用了一下对老年人还是可以的！,2018-02-02 13:43:58,0,0,5
1***4,铜牌会员,服务快递态度超好。赞赞赞,2018-03-02 14:34:49,0,0,5
电***你,铜牌会员,一分价钱一分货，还行吧！,2018-03-02 06:10:33,0,0,5
j***f,铜牌会员,手机内存小，外表还可以。,2018-02-28 18:30:04,0,0,5
jd_151157mjg,铜牌会员,手机挺好的，老妈很喜欢。,2018-02-28 13:33:22,0,0,5
j***t,钻石会员,给爸爸买的，够用了，很好,2018-02-28 12:14:26,0,0,5
尚***4,银牌会员,性价比够用～没啥要求哈哈,2018-02-28 09:54:23,0,0,5
从***后,PLUS会员,款式很喜欢。机身轻，待机时间长还可以。反应速度很快，老年人用够了,2018-02-27 10:23:05,0,0,5
兰***修,钻石会员,挺好的。不错?。。。。,2018-02-25 11:38:06,0,0,5
V***J,铜牌会员,好、快，只有两个字形容,2018-03-09 20:06:17,0,0,5
J***T,银牌会员,好用。。帮爷爷买的。。,2018-03-08 21:23:39,0,0,5
g***r,铜牌会员,商品满意物流服务非常好,2018-03-08 20:34:24,0,0,5
l***7,铜牌会员,还没有怎么用，不过应该不错,2018-02-06 22:13:03,0,0,5
零***t,银牌会员,外观可以，就是特别卡！,2018-03-07 13:56:20,0,0,5
黄***坤,金牌会员,"啊哈哈哈哈哈
哦呵呵呵呵呵",2018-02-05 13:11:24,0,0,5
j***d,银牌会员,还可以，只能用来打接电话用,2018-02-05 14:16:16,0,0,5
s***7,银牌会员,用着不错，老年人很喜欢,2018-03-05 06:28:34,0,0,5
浪***3,银牌会员,老年人用的还行吧??,2018-02-16 23:03:38,0,0,5
谁***经,银牌会员,差不多，z就这个价格了,2018-03-02 13:19:53,0,0,5
纯***3,铜牌会员,看起来不错，用过再来评价,2018-02-15 19:35:19,0,0,5
j***u,钻石会员,一般，收信息很久收不到,2018-03-01 23:55:21,0,0,5
F***j,银牌会员,一分钱一分货，物流还行！,2018-02-15 16:39:06,0,0,5
麦***武,银牌会员,这个价格，可以了，有点卡,2018-02-13 15:50:46,0,0,5
斯***凡,钻石会员,像素太低了…果然就是299…,2018-02-13 09:54:04,0,0,5
太***脏,银牌会员,还可以吧反正就打打电话,2018-02-27 21:41:43,0,0,5
j***5,银牌会员,备用机，对的起这个价格,2018-02-26 20:55:29,0,0,5
阿***6,钻石会员,还行  做老人机挺合适的,2018-02-08 20:12:55,0,0,5
苟***8,银牌会员,还可以，只是感觉内存不够,2018-02-08 12:31:39,0,0,5
lmz061,银牌会员,速度比较快，老年人适合,2018-02-21 18:10:18,0,0,5
心***撼,银牌会员,用的不过，老人们很实用。,2018-02-06 22:25:10,0,0,5
u***C,铜牌会员,还可以吧 不过手机很轻,2018-02-21 02:24:17,0,0,5
赵***0,银牌会员,手机反应慢，电池容量小，,2018-02-06 08:40:50,0,0,5
t***R,铜牌会员,还是不错了 但物流慢了点,2018-02-06 17:33:25,0,0,5
w***e,钻石会员,非常好看的，值得购买的呢,2018-02-04 20:29:27,0,0,5
华***帅,铜牌会员,很好，非常好，而且速度块,2018-02-03 16:28:22,0,0,5
中***0,PLUS会员,小飞飞的地方刚刚,2018-03-01 13:34:18,0,0,5
x***g,PLUS会员,不错的，可以用的,2018-02-28 21:30:06,0,0,5
f***轩,银牌会员,手机还不错。给老人用。,2018-02-13 15:28:27,0,0,5
Z***J,铜牌会员,发货速度很快，物有所值,2018-02-12 16:24:48,0,0,5
j***1,金牌会员,还行，老人用，可以了,2018-02-26 23:27:09,0,0,5
j***年,铜牌会员,整体还行，对要求不高的人还是可以的，备用机使用，能挂微信，接打电话就不错了。。。,2018-02-26 20:32:36,0,0,5
w***9,钻石会员,备用手机而已，物流很快,2018-02-10 20:01:21,0,0,5
y***o,银牌会员,老妈使用感觉还可以了。,2018-02-10 14:30:34,0,0,5
宋***之,铜牌会员,还可以就是声音不够大,2018-02-24 15:43:25,0,0,5
l***i,金牌会员,可以 备用机 还不错,2018-02-23 16:28:18,0,0,5
j***x,金牌会员,送货速度快，用的还行,2018-02-23 11:47:15,0,0,5
爱***熊,钻石会员,买给老妈用的，还可以,2018-02-22 18:19:09,0,0,5
j***c,铜牌会员,产品还可以，耗电快。,2018-02-22 08:44:02,0,0,5
n***c,银牌会员,还行，就是不是一体机,2018-02-21 20:35:27,0,0,5
小***5,金牌会员,老年人用将就，有点卡,2018-02-20 15:22:21,0,0,5
蘇***4,钻石会员,物有所值，不错的手机。,2018-02-05 10:59:12,0,0,5
j***k,PLUS会员,感觉真不错，够大够薄，清晰声音大，上网??力，价位实在没话说,2018-02-05 06:05:48,0,0,5
猫***3,铜牌会员,给妈妈买的不错还可以,2018-02-19 07:21:04,0,0,5
m***W,铜牌会员,外表可以就是触感差点,2018-02-18 20:52:04,0,0,5
W***j,铜牌会员,电池电有点不太耐用！,2018-02-15 20:40:36,0,0,5
j***7,金牌会员,看着不错，用过才知道,2018-02-14 11:47:11,0,0,5
r***I,铜牌会员,屏幕手感太差反应太慢,2018-02-14 07:52:21,0,0,5
j***j,银牌会员,手机不错  不卡不顿,2018-02-12 17:27:38,0,0,5
s***a,PLUS会员,还可以 挺实用的,2018-02-11 18:52:40,0,0,5
d***1,银牌会员,就是慢一点  挺好的,2018-02-11 14:35:59,0,0,5
1***6,银牌会员,还可以，用着还不错。,2018-02-09 18:12:41,0,0,5
p***4,银牌会员,昨天下午下单，今天中午收到，挺快，打开试了试，软件多，运行慢？价钱在这呢？,2018-01-11 17:38:24,1,0,5
迷***使,金牌会员,还不错啊  老人机,2018-03-09 20:29:17,0,0,5
s***g,金牌会员,老人家用，要求不高,2018-03-08 13:52:42,0,0,5
小***0,钻石会员,不错   爸妈够用了,2018-02-05 20:55:02,0,0,5
j***d,金牌会员,东西实惠，快递很快,2018-03-06 14:16:29,0,0,5
j***b,银牌会员,反应有点慢，有点卡,2018-03-06 14:49:10,0,0,5
j***m,银牌会员,买给老妈用的，还可以,2018-02-04 18:56:27,0,0,5
1***p,钻石会员,给朋友买的，他说好用,2018-02-04 18:29:32,0,0,5
c***e,钻石会员,低端机，一分钱一分货,2018-02-03 11:57:59,0,0,5
N***M,金牌会员,还没有用物流速度快,2018-03-02 20:46:08,0,0,5
欲***烧,PLUS会员,应该不会让我失望，物流很快，下午就收到了，支持京东,2018-02-01 16:49:20,1,0,5
猜***妳,PLUS会员,买给老人用还行吧，界面厚大，触屏可以，附上手机设置,2018-02-01 10:58:41,1,0,5
z***G,铜牌会员,还可以，给老人买的,2018-03-01 10:39:38,0,0,5
水***来,金牌会员,手机收到了，还不错,2018-02-28 20:05:28,0,0,5
给***眸,银牌会员,不错，用的挺好的。,2018-02-28 11:15:37,0,0,5
j***a,银牌会员,非常好用，谢谢京东,2018-02-25 17:35:31,0,0,5
Y***o,金牌会员,家里老人用的，还行,2018-02-24 20:12:41,0,0,5
漠沙00,PLUS会员,这手机简直值大了，外表惊艳，且价格实在，反正就是相当不错，,2018-02-06 17:23:08,0,0,5
木***易,钻石会员,还不错，比较便宜。,2018-02-21 00:06:31,0,0,5
j***d,铜牌会员,物有所值，值得购买,2018-02-20 11:49:56,0,0,5
j***m,铜牌会员,非常完美物流也给力,2018-02-18 14:23:15,0,0,5
刘***3,银牌会员,手机还行，给老人买的，也就是聊个微信，斗个地主啥的满够用的，买太好的老人嫌贵,2018-02-19 15:46:57,0,0,5
弈***艮,银牌会员,还行吧，给父母买的,2018-02-10 09:37:47,0,0,5
高***间,银牌会员,"屏幕够大，配置一般，但是对于老年人来说足够使用了。
快递给力，服务态度很好！",2018-02-09 21:01:04,0,0,5
陈***虔,金牌会员,父母亲在用，凑合吧,2018-02-08 10:32:52,0,0,5
无***士,银牌会员,先用试试，又下一单,2018-02-07 18:55:35,0,0,5
平***好,铜牌会员,给老妈买的，直接送到村里，真好，以后买东西给父母就上京东了，真方便！大爱！,2018-02-21 16:13:46,0,0,5
l***7,铜牌会员,一天就到货了，真好,2018-02-06 14:22:38,0,0,5
y***5,银牌会员,用起来顺畅，不错。,2018-02-02 23:05:06,0,0,5
A***g,金牌会员,买给老爸的生日礼物，手机很漂亮，用起来速度也挺快的，很喜欢，赞一个！,2018-02-26 21:58:04,0,0,5
j***5,铜牌会员,还行，有点卡,2018-02-24 16:28:59,0,0,5
y***y,钻石会员,美价廉 非常不错,2018-03-02 16:05:08,0,0,5
d***r,铜牌会员,备用机，物美价廉,2018-02-28 17:59:11,0,0,5
j***8,铜牌会员,给老人用，将就。,2018-02-26 19:30:30,0,0,5
j***a,铜牌会员,物超所值！五星！,2018-02-25 15:05:24,0,0,5
h***F,铜牌会员,很不错，值得买。,2018-02-20 13:04:05,0,0,5
j***e,PLUS会员,曾经的王者。现在也只是备用机了。,2018-02-01 20:46:44,1,0,5
辛***5,银牌会员,有点卡，安软件慢,2018-02-14 16:52:46,0,0,5
h***g,金牌会员,备用机还是很好的,2018-02-12 21:37:13,0,0,5
v***V,铜牌会员,还行，声音有点小,2018-02-12 12:08:52,0,0,5
e***b,银牌会员,还可以下次再买吧,2018-02-08 13:39:40,0,0,5
w***4,银牌会员,收到了还行挺不错,2018-02-08 14:54:18,0,0,5
j***6,钻石会员,物美价廉，送货快,2018-02-04 14:49:40,0,0,5
1***p,银牌会员,货已收到物流很快，以前买过，这次一下买了两个，,2018-03-01 15:34:55,1,0,5
m***0,钻石会员,很喜欢在东东上网购 真的不错的 比其他网店实在 服务好 好喜欢 还会介绍朋友来 非常感谢京东商城给予的优质的服务，从仓储管理、物流配送等各方面都是做的非常好的。送货及时，配送员也非常的热情，有时候不方便收件的时候，也安排时间另行配送。同时京东商城在售后管理上也非常好的，以解客户忧患，排除万难。给予我们非常好的购物体验。,2018-02-08 16:49:24,0,0,5
j***e,钻石会员,很好，不错，还可以。用着还行，不信你试试就知道，真的好,2018-02-06 23:03:00,0,0,5
j***x,PLUS会员,做个备用机，挺好的，用着不卡,2018-02-06 12:45:57,0,0,5
j***o,PLUS会员,手感挺好的，买来当备用机的,2018-02-20 15:02:36,0,0,5
j***b,PLUS会员,很轻，还不错。,2018-01-09 14:37:36,1,0,5
R***p,银牌会员,已经不是第一次在京东买手机了，京东值得信赖,2018-03-08 11:06:06,0,0,5
j***a,铜牌会员,性价比特别高的产品，外观漂亮，老爸很喜欢！,2018-02-27 11:39:24,0,0,5
水***香,金牌会员,待机时间很长！充满电，只打电话，不上网……可以用上3天到4天！作为一个备用机，非常满意。必须点赞?,2018-01-08 22:27:33,1,0,5
j***o,银牌会员,手机已经收到了，才在用，还不知道怎么样，,2018-02-11 09:22:10,0,0,5
黄***A,金牌会员,在京东最失望的一次购物，今天2017.9.17中午刚刚到手的手机，试用了一下，手机非常卡，试下载了几个软件，竟然更卡，反应太慢了，后来系统更新，手机才到手2~3个小时，手机现在已经不能开机了！！！！！！刚刚开机，马上关机，反反复复！心都凉了！之前买的酷派手机挺好的，为啥现在的手机这么差劲了！好失望啊！,2017-09-17 17:02:24,32,5,1
任***f,PLUS会员,不错，挺满意的,2018-02-10 10:38:26,0,0,5
j***r,金牌会员,运行比较卡顿，但是价格在这儿，也就这样吧,2018-02-06 21:05:41,0,0,5
j***4,钻石会员,很不错的手机，运行很流畅，很值得购买。,2018-02-20 18:09:09,0,0,5
灰***8,铜牌会员,很不错 性价比很高 样子也很好看,2018-02-26 15:08:22,0,0,5
j***8,金牌会员,老人用，总体还行！,2018-01-16 13:47:54,2,0,5
j***3,金牌会员,货已收到，感谢快递小哥节日送货,2018-02-15 20:07:53,0,0,5
j***6,银牌会员,外观挺不错的，手机运行也很流畅,2018-02-13 08:36:48,0,0,5
j***a,银牌会员,手机很不错。快递员也很敬业,2018-03-08 20:47:05,0,0,5
蓝***9,钻石会员,宝贝收到了，用着感觉还不错！……,2018-02-20 21:25:53,0,0,5
r***0,金牌会员,质量不错，物流非常快，很好,2018-02-24 12:59:03,0,0,5
j***i,铜牌会员,挺好的打电话肯定没什么问题的,2018-02-09 14:04:55,0,0,5
L***玥,钻石会员,质量非常好，速度也快，太棒了,2018-02-07 20:57:31,0,0,5
7***2,金牌会员,东西很好。包装很精细。正品,2018-02-10 09:40:18,0,0,5
z***8,铜牌会员,已经使用近半个月，当作热点机使用，其他一切正常满意，就是电池很糟糕，半天剩30%，不知道随机的是不是原装电池，本想电池重新购买换掉，不知是否有用。优点价格便宜好评吧。,2018-02-04 19:31:41,0,0,4
j***p,铜牌会员,不好用，卡卡卡,2018-03-06 11:58:48,0,0,5
k***u,银牌会员,想退货，不好用,2018-03-06 10:04:37,0,0,5
j***2,铜牌会员,非常好，很不错,2018-03-04 21:29:22,0,0,5
j***9,铜牌会员,非常好。。。。,2018-03-02 19:26:13,0,0,5
j***e,铜牌会员,不错，挺好用的,2018-03-02 11:50:04,0,0,5
j***g,铜牌会员,手机用着还可以,2018-03-01 16:52:53,0,0,5
j***a,铜牌会员,两天开不开机了,2018-02-27 19:26:26,0,0,5
****F,注册会员,还不错，挺好的,2018-02-26 15:47:15,0,0,5
j***1,银牌会员,快递服务相当好,2018-02-26 11:51:58,0,0,5
j***f,银牌会员,一分钱一分货。,2018-02-24 10:33:50,0,0,5
S***K,银牌会员,还可以这个价位,2018-02-15 01:08:13,0,0,5
让***l,金牌会员,嗯，值这个价钱,2018-02-09 19:14:08,0,0,5
j***g,铜牌会员,还可以，挺快的,2018-02-08 12:47:18,0,0,5
好***笑,钻石会员,老妈试用了一个月，感觉很不错，够便宜，声音很大,2017-08-01 21:43:08,1,0,5
胖***2,银牌会员,手机不错价格便宜,2018-03-02 11:27:06,1,0,5
死***界,铜牌会员,看起来不错，先玩几天再说吧,2017-12-09 15:00:55,1,0,5
红***奇,银牌会员,手机还可以，用久了不知道会怎样,2018-02-20 15:08:29,0,0,4
j***y,铜牌会员,昨晚22:54分下的单，今天早上11点多就收到货，试用效果挺满意，也基本能满足要求。就是拍照像数差点，不过，这个价格不能要求太高。,2018-02-21 17:03:31,0,0,5
s***j,PLUS会员,极简版，感觉老年人用或者当移动Wifi用还是可以用用，但感觉其实这个价格对比这个配置也不算很便宜！可以再降点,2018-03-03 17:58:04,0,0,5
花***X,银牌会员,虽然和想象中的有点差距，不过还行吧。就是左滑的新闻很难受。 充电很慢，续航还可以,2018-02-19 21:25:20,0,0,4
j***c,金牌会员,宝贝收到，非常好，买给父母用了，买了两部，用过才来评价，真心不错。以前我也用过两部酷派的手机，样子好看，价位合适，物美价廉,2018-02-03 17:20:29,0,0,5
