名字,会员级别,评论内容,评论时间,点赞数,评论数,评价星级
j***r,银牌会员,刚刚加入锤子用户行列，之前对锤子了解不多，直到最近才开始关注pro2酒红色手机，前些日子预约都没抢到，可见大家对这次老罗的新品还是比较认可的，终于在第三次预约并成功拿到手机。 迫不及待地打开手机后一下就被整体外观惊艳到了。酒红色色彩很正，而且是玻璃质感的平面，在灯光的反射很透亮。手感不是太重，但也不轻，重量正好。正面（未开机状态下）非常简洁，只有顶部中央一个1600万像素摄像头，支持面容解锁，简约实用大气！背部logo与指纹识别融合到一起是一大创新。机身侧面一圈金线个人觉得并不突兀，手机侧斜着看还挺有设计感的。侧面按钮都是小圆型钮，与机身一体，整体感好。 至于操作体验只是开机小试了一把，smartisan OS有很多特色的功能，例如One Step、Big Bang和闪念胶囊，感觉挺好用的，体验一段后可再来续评。 另，pro2 很苹果一样没有设专门耳机插孔，包装有附送3.5mm的音频转接头，减少了插孔，这应该是个趋势。 总之，这款手机性价比很高。应该是国产机中的良心出品！,2018-03-04 23:46:04,1,2,5
j***v,铜牌会员,非常不错等待测试使用后给于追加,2018-01-14 15:53:48,1,0,5
潇***洒,PLUS会员,实在是好用极了，屏占比非常高，系统好用，外观好看！赶紧买吧！买了绝对不亏！比pro1好太多，为了别人看得到，给个一星吧！,2017-11-08 16:53:29,797,343,1
罗***r,PLUS会员,闪念胶囊功能卡住不动。重启还是一样卡住。跟官方售后聊了，让我自己倒腾一下，恢复出厂就好了，发我线下的地址让我自己去找线下铺子修。不告诉我15天之后就无法换货，然后拖延到无法换货，告诉我你超期了只能申请维修。哈哈哈，挖得一手好坑。,2017-12-03 19:56:55,71,15,1
_***i,PLUS会员[试用],并没有按键松动好吧 也没有屏幕失灵 真是锤黑的影响真几把大,2018-03-06 20:17:10,0,0,5
守***虎,PLUS会员,外观设计很成功，手感不错，运行流畅，硬件方面没的说！系统软件方面除了一闪爆有特点，其他易用性和选择性还不足，骚扰拦截基本没有，还要向某粮学习，但别把广告学来。总之坚果pro2性价比高，较成功仍需努力，支持老罗！,2018-03-07 11:03:17,0,0,5
j***4,银牌会员,第二批用户，双十一等了五天，刚好使用一个月，简单发表意见。作为深度手机控用户，12年开始关注手机资讯蛮多的了，始初接触锤子科技，是在互联网新起的那片天，锤子并不抢眼，可以说是异类。现实中锤子用户，少之又少，买它的人可以说是种情怀。促使我购买最大的意愿，是我一眼相中，果断下单全款预定，可以说，坚果pro2的工业设计，是我开始接触锤子的重要因素！废话多了，说下体验。图一二是简单性能测试，标准骁龙660，单核多核的也跟ov差不多，就不放图了，闪存用的是emmc5.1，除了256GB版本有惊喜外。图三四是拍照水准，分别代表白天夜间，表现般般，没什么亮点，前置1600万像素，成像不错，人脸识别也很快，虽然是2D识别并不安全。游戏方面，性能在那里，没什么好说的，支持王者荣耀高帧率模式，最卡的时候掉到42帧，一般稳定55帧以上。美中不足之处有两点，一点是最致命的！屏幕边缘触控不灵敏！起初这个问题被王者荣耀玩家反馈，官方两个推送更新包更新，但效果不明显。王者荣耀手速太快，偶尔技能按不出来！最近发现，QQ消息左下角，想抹除消息数量，试了三四次才行！触控真心垃圾！系统臃肿也是锤子手机一项特色，电池续航短,2017-12-16 11:59:48,14,5,1
小***-,银牌会员,用了一段时间才来评价，手机是年初四买的，初五就到了，物流真的很快，各方面很满意，不满意的地方是什么东西都没赠，连手机壳都没给一个，可能京东都是这样的吧。,2018-03-07 16:42:36,0,0,5
s***0,银牌会员,"失望至极，用了天十来天的手机就出现闪屏。一开始说是手机可能系统有些bug.可能有些app不兼容。等到更新新系统后还是这样 ，而且更加频繁了。简直没法用了。线上处理要大概30天。要过年回家了只能去线下授权店修。师傅换了新屏幕还是有问题，排除了屏幕的问题，当天还拿不到手机，今天有可能还是拿不到……
刚好20天只能保修，新的手机就这样了。一天几十公里来回维修点跑，改天还得去。商家从不会体谅你，反正你就等着呗。作为消费者真是有苦说不出。",2018-01-22 13:22:53,19,6,1
晓***妞,金牌会员,手机到手大概试了一下，整机的手感还是相当不错的。蓝色的外表也很漂亮，手机速度也很给力，连开十几个软件也不卡，游戏很流畅。手机是1699买的，比女朋友的米6好看我觉得。身边的两个朋友也受我影响买的一个黑色一个银色，刚好这次可以凑齐哈哈哈。上一个用的，用了一年6个月，联发科处理器的。很满意，这次买的同意很满意。先用着看。后续看看有没有啥问题。”,2018-03-06 20:27:04,0,0,5
M***雄,银牌会员,买这款手机纯属情怀，不过送货的时候当着我的面手机包裹掉地上了，好在没摔坏。,2018-03-09 00:48:58,0,0,5
北***东,PLUS会员,pro2的外观美得说，很漂亮，屏幕显示效果也美得说。已经是买的第四个pro2了，这次是白色限量版，但是屏幕右侧外屏和保护框间不知道夹了什么东西，试了试也没弄出来,2018-02-25 22:14:21,1,2,5
j***u,金牌会员,搞不明白这是个什么，买了这么久了，钢化膜刚到，今天贴的时候就遇到黑点了，怎么擦都擦不干净。,2018-01-06 11:09:35,18,1,1
x***o,PLUS会员,"1. 摄像头在夜晚和室内灯光时拍出来的照片噪点严重，根本没法看
2. 音质很差。
3. 背板玻璃材质手感廉价。
4. 包装材质比*差。
5. 屏幕还不错，没有出现漏光骗色现象。
6. 系统流畅度很好，特别是大爆炸，和一步功能太好用了。",2018-03-07 22:46:48,0,0,4
布***爱,银牌会员,首先，我给锤子给予肯定，正常用时真的不卡 一步闪念胶囊大爆炸很实用，壁纸风格我很喜欢，充电超级快 续航能力强，另外，颜值真的高的令人窒息，漂亮死啦，有个不解的缺点，玩游戏卡飞 王者荣耀，吃鸡，cf都是，有时候玩着会闪屏，6G运行内存，真的没想到玩游戏卡，嗯，就这些，想剁手的可以参考下,2018-02-27 12:44:50,1,1,5
小***j,钻石会员,"刚刚加入锤子用户行列，之前对锤子了解不多，直到最近才开始关注pro2酒红色手机，前些日子预约都没抢到，可见大家对这次老罗的新品还是比较认可的，终于在第三次预约并成功拿到手机。
迫不及待地打开手机后一下就被整体外观惊艳到了。酒红色色彩很正，而且是玻璃质感的平面，在灯光的反射很透亮。手感不是太重，但也不轻，重量正好。正面（未开机状态下）非常简洁，只有顶部中央一个1600万像素摄像头，支持面容解锁，简约实用大气！背部logo与指纹识别融合到一起是一大创新。机身侧面一圈金线个人觉得并不突兀，手机侧斜着看还挺有设计感的。侧面按钮都是小圆型钮，与机身一体，整体感好。
至于操作体验只是开机小试了一把，smartisan OS有很多特色的功能，例如One Step、Big Bang和闪念胶囊，感觉挺好用的，体验一段后可再来续评。
另，pro2 很苹果一样没有设专门耳机插孔，包装有附送3.5mm的音频转接头，减少了插孔，这应该是个趋势。
总之，这款手机性价比很高。应该是国产机中的良心出品！",2018-01-31 14:26:28,3,0,5
不***火,钻石会员,"外观完全没的说！识别度超高的外观设计，极简主义的设计理念真是让人爱不释手。唯一一点让人有些纠结的是背板太过光滑，很容易脱手，对于我这种裸奔党来说，确实不方便。系统方面就不多赘述了，罗老师在发布会上已经说得很详细了，个人也很适应并且已经回不来了(上一个手机是T2)简言之就是爽。不过有一个BUG，不知道是不是只有Smartsion OS才会这样，就是B站的APP后台运行的情况下，会随机变成后台播放，有一次刚刚挂断电话，结果手机传出视频声音。有其他一样经历的小伙伴可以来交流一下。总的来说非常满意！
Ps:看图的小伙伴请原谅我拍照水平",2018-02-25 08:43:48,0,0,5
e***y,PLUS会员[试用],"刚刚拿到。
这是继T2之后的第二台锤子手机。
给老人用。
刚刚完成开机，升级，安装常用软件～
工艺没有T2好！
屏幕的四个倒角真的喜欢！
虚拟键在软件界面是可以隐藏的！非常棒呦！
拍照对焦速度快！目前没有合适的样张。
等老人用过一段时间后再来追评！",2018-02-09 16:57:07,1,0,5
天***3,银牌会员,手感不错，外观也喜欢，也很轻薄，比较流畅还有很多骚操作，就是有时候手速快了灵敏度不够，官配只有充电器和耳机转换头，连钢化膜和壳子都没有，然后这边都没有实体店买不到只能在网上买有点麻烦,2018-03-08 14:47:14,1,0,5
卖***鸟,银牌会员,其实很早就就想买锤子了，后来买了努比亚Z17s，结果那手机太厚了太重了，所以现在还是买锤子了，屏幕看着也舒服也不是很重，运行也很流畅！,2018-03-07 19:54:31,0,0,5
卖***机,钻石会员,"#漂亮的不像实力派#
给别人安利洗脑过来以为闪念胶囊好用，入手，锤粉还没成为，直接变成锤黑一生黑了，原因如下:
1.新手机开机就提示联网激活，不然无法测试，销售页面提示一经激活，则不可以七天无理由退货（罗胖满满的套路）
2.新机开机后屏幕偏暖，不太艳，联网后离路由5米左右，WiFi断流严重，农药更新半天不行，后来离路由1米远时更新完成，开黑，都不敢离开WiFi远点，一路460.最后竟然直接掉线，分都扣完了（坑）
3.使用第三天，王者农药游戏过程，机身底部闪念键经常误触，造成游戏体验不佳，故掉转横屏后，使用一晚上，莫名屏幕右下角黑斑一块。申请售后。
4.那是一个心凉，锤子般的态度，带暗示与阴阳怪气的语气告知这个黑块到时检测要是进液是不保的，如果不他们检测没问题，要本人亲自拿上到其它地方检测，真是锤子一生黑，本人后面翻看评论区，和百度以及贴吧，N多的中招客户，或贴膜时进液的，或者吃面水蒸汽弄到的，或者冲凉房水蒸汽弄到的，还有洗完手未全干时进液的，总而言之，使用这手机，你得夏天尽量不要出汗，不要下雨天带出，不要洗完手使用，远离液体，不然分分钟，你的锤子手机就真成锤子手机了，售后可不管的。",2017-11-28 23:52:15,37,44,1
尹***小,钻石会员,"我是T1的老用户，没用三个月就换了，就是手感太差了，太割手了，又买不到完美的手机壳，过年喝醉酒 把小米mix摔碎了   手机寄回官方修理    临时买的4＋32，下单减了105,到手价格1694,送了黑色原装壳，壳的手感很棒，正面id很棒  简约，中框不满意   磨砂金属    卡槽  扬声器   充电口    都感觉糙了一点，带上壳感觉好得多，系统易用性还是比小米差了一点，不过够用的，比较流畅，就是王者荣耀不满意，普工有时候没反应，不知道是优化问题还是屏幕问题，这个价位入手还是很满意的",2018-03-07 21:31:21,0,0,5
r***8,银牌会员,买回来也用有了一段时间了，首先是系统，锤子的系统还算不错，运行流畅，目前没有过卡顿。660的u打开应用速度也是很不错的。不过相比于魅族，还有小米的miui。还是有一些小功能的缺失。比如没有网速显示，没有游戏模式等。坚果pro2拿起来不会觉得硌手，但是底部充电接口处的边比较薄，会割到小拇指。关于拍照，只要你不对他有期待，就会有小小惊喜，别给太大的期望。他只会给你失望。因为他真的不咋滴。用背景虚化模式经常会把你的衣服给虚化掉。系统占用内存比较多。打开一两个应用，就用到了3g多。为什么会选择这个机子？主要是因为性价比高。4+32在京东优惠后1450都不到，比优惠后的360n6pro还便宜有木有，而且还送了耳机，套套。,2018-02-15 10:45:50,0,0,5
X***Z,PLUS会员,好看，好用，好的艺术品，不追求什么，只为认真对待一个产品。用心之作，如孩子一般的产品。,2018-01-15 22:34:18,1,0,5
闪***a,银牌会员,到目前为止用了不到20天，在第12天时候手机在办公桌上磕了一下也就10cm高度（屏幕玻璃裂了一条缝）不过还能正常使用，申请售后，客服要换屏幕费用就不说了大家都知道；又用了一周触屏直接不能使用了（备注：这段时间手机没有经过任何碰撞）这个质量啊，都不知到该怎么描述了！很失望?啊！,2017-12-16 20:18:29,12,7,1
恒***渐,金牌会员,昨天买的，今天收到，整体感觉不错，可是又大又方正就觉得有点咯手，面部解锁也不是很好用，如果有个双击亮屏的小功能就好了，还有就是拍照不够多样性，没有滤镜之类的东西，感觉太过单一，并且刚收到的手机就提示让升级系统，还有就是字体偏小，弄大的又觉得不好看。闪念胶囊和一步还不太会用，正在摸索阶段，好的一点就是充电很快，待机也还不错，总体来说还是值得购买的。,2018-03-06 23:23:30,0,0,5
刘***8,金牌会员,用了一段时间了，感觉可以评论了。老婆的mix丢了，我的mix2直接上交了，之前看过老罗的演讲，加上等不上mix2s，所以直接给了锤子一个机会。一直听说目前的手机cpu多么的性能过剩，所以从835降到660还有点期待，没想到啪啪打脸。开应用开始有卡顿了，连微信转账验证指纹那一步都卡的以为死机了，由奢入俭难啊，所以同价位的话还是推荐835的手机，这660真的就是厂家要利润的选择。还有屏幕较mix2窄一些，对于我这种单手用户很友好，但是如果双手全键盘模式的话会感觉挤得慌。软件上没什么可吐槽的，各有各的风格。总之就是想尝个鲜的话可以试一试，不过没有那么亮眼，所以下部手机不太会继续选择这个品牌了,2018-03-08 09:26:09,2,0,5
j***d,银牌会员,"太差了，玩个王者全程460,发热太厉害！还不如旧的运行3g内存的手机！",2017-11-19 14:31:02,20,19,1
j***3,钻石会员,感觉拍照很清楚，外观很精致，很喜欢。,2018-03-07 16:12:42,0,0,5
j***u,银牌会员,手机很不错。物流也非常快，可以说是安卓中的苹果。就是不知道怎么把手机下面的返回的震动取消。,2018-03-06 15:55:21,0,0,5
j***4,银牌会员,嗯！外观一如既往的好看，从坚果Pro到现在的Pro2，emmm…  什么时候出Pro3啊~  相机问题解决的很不错，赞一个。其他还在试用中…,2018-03-06 19:31:09,0,0,5
哲***宝,银牌会员,本来想买诺基亚的，选择了这个最终，外观很不错,2017-11-08 08:47:46,69,18,5
s***g,钻石会员,观察很久，终于下手，成为锤粉！拍照还不错，成像效果很好！电池续航强大！人脸识别、指纹识别速度很快！系统用着比较顺手！屏幕大，音质很好，整体外观设计用心！外观色泽细腻，玩游戏也还好，不卡顿！,2018-03-08 17:27:53,0,0,5
j***g,铜牌会员,京东物流真是快!就算外面是冰天雪地。手机到手之后很兴奋，尤其享受拆包的过程，这也是我没在转转上买二手机的一个原因，此刻还没有开机是因为外面和家里温差大，手机冰凉还有雾水，很愉快的一次购物。,2018-03-08 10:15:01,0,0,5
斗***鬼,银牌会员,用了一个多月，哪里都很满意，！！重点！！只吐槽一个地方 玩游戏边缘触屏有很大的问题 点四五次没反应，举例 王者荣耀 左边买装备的金币那个位置，右边提醒队友测退进攻防守那个位置  终结者2不自定义键位的情况下 右边跳跃和蹲都有问题 还有很多app边缘都有问题 到手到现在更新了三次系统都没有解决 其他的就不说什么了,2017-12-30 12:16:32,10,1,1
L***泉,金牌会员,大家请看图，发布会第二天抢到的，到今天用了不到半个月，正常带套使用，无摔，无碰无撞击，然后昨天发现手机弯折了，我不知道是怎么造成的，可能是放在屁股口袋坐的时候压到了。但是本人并不胖好嘛，还很瘦，173，60kg。打电话给客服，说虽然在15天包换时间内，但是无法更换，这是人为原因，不是产品质量问题。我也30好几了，用了手机不止7-8部，从来没出现这种问题，这pro2到手不到半个月就在出问题了，你说这不是质量问题？弯着的地方刚好是胶囊键那个位置，很明显是此处强度不够。大家可以自己看照片，机子没有任何磕碰，甚至在弯曲之后连屏幕都是完好的，但是**手机就是弯了。作为老罗的粉丝，为老罗的情怀和理想买单的消费者对这个处理方式并不满意。不求退货，但是在15天的更换期内，请给我换货。,2017-11-21 15:05:46,121,137,1
j***0,银牌会员,"我T1用了两年半了，本想撑到老罗放大招，结果还是买了Pro2。买之前犹豫了很久，觉得照片里机型并不好看，最后还是相信锤子的做工和设计买了，发现真是tMD好看，怎么会比照片好看那么多，朋友一看也觉得非常不错，再也不用指着T1去辩白锤子的各种优点了。
1.坚果优化了很多，首先就是电量，应该是比较经用的。音量也变大了，拍照强了很多但是还是感觉可以更好（由于以前用索尼），这三个是之前的锤子手机硬伤都改进了很多，发热目前玩的不多所以还不清楚
2.锤子吸引人很大一部分是他的个性化的各种设置，一些贴心让人用的方便的小细节，这些都有优化，比以前更好用。
3.外观是真***漂亮，质感触感也是没得说，但是我用手机不爱惜，就怕又没过多久被我弄的零零散散的
那时大学手机被偷手上没钱找了个国产看起来不错的买了T1，经常听到周围人的嘲笑和质疑，手机电量不够，容易发热，音量小，像素差。。。等等，但是我也是一个追求完美的人，独特的人，所以一样和T1产生共鸣，尽管他作为初代有非常大的缺陷。现在的Pro2让我真正为锤子开心，也许再出两款，再优化一些，锤子能够做到最好，我也肯定相信锤子能够有一天干掉洋货。来自深夜辛苦的手打",2018-03-09 00:03:28,1,0,5
洋***医,钻石会员,难以置信，非常不错的一款手机，颜值很赞。原来的手机是6s，入坑锤子以后发现，虽然没有突然的惊艳，但伴随使用始终惊喜不断。感谢感恩，希望这个手机可以伴我度过这段最困难的日子,2018-02-04 18:22:48,1,0,5
水***1,银牌会员,表示本次购物非常不满意，刚买一个月，不过一直没用，一直放那待机，因为原来的小米5以为坏了，最后发现没坏.然后就一直没用，想等到元旦后再用，一共充了三次电，第一次晚上充的电没留意充多久充满的，第二次充了4个小时我就有点怀疑，这次直接充不进去了。什么鬼东西,2017-12-26 13:58:56,9,6,1
j***w,金牌会员,在头条，百度，京东，看了好几天，最后才买，一到手迫不及待打开，外观精美，还真是有点庆，买了原厂膜和壳，严丝合缝。操作起来非常容易上手，我觉得比我原来的mx6好，字体大小可以调节了，其它的慢慢摸索吧，反正一句话，挺好的。,2018-03-08 15:50:55,1,0,5
jdwtlyxl,PLUS会员,手机很赞，仅次于iPhone X的手机。除了手机本身用心，主要还是为了老罗买的，从罗黑到罗粉，仅用了5年前两场发布会。,2018-03-06 16:46:33,2,0,5
老***勒,金牌会员,真的挺不错哦，颜值很满意，双面玻璃手感也很棒，挺轻的，系统也很好用。第一次买锤子没让我失望,2018-03-08 12:19:30,0,0,5
L***H,PLUS会员,手机还不错，挺好的，18:9全面屏还是有些不一样，指纹和logo二合一很喜欢，也很有创意。京东快递依旧很快。,2018-03-06 14:38:43,2,0,5
X***6,金牌会员,收到了手机，挺好用的，但是发现一个问题，今天下午的时候打王者荣耀，1.30在打的，忽然卡死了，卡到现在五点钟，说什么system无响应，关机也关不了，退出也退不出去，无语了，第一次用一个手机能卡4个小时的，退也不退不了。。。。真是个坑。,2017-12-17 17:11:28,8,5,1
w***7,PLUS会员,第一次使用锤子手机，出众的外观设计即使和iPhoneX放在一起也不落下风，但细节做工就差的太多了，但价位差了四五倍比较也不公平。系统新颖且另类，有人性化和易用性的地方也有不完善和通话界面太难看的地方。。。充电超快和超长待机太爽了（和X比），买的官方保护壳太滑还是裸奔舒服。。。两千六的价格性价比高，希望手机质量不错，不然售后店铺太少实在不方便。。。,2018-03-06 16:27:10,2,0,5
S***影,金牌会员,"1品控一般，屏幕两个机子一个天一个地
2音量键还可以，电源键松松垮垮
3四个按键一个样，盲触易按错
4亮度调节需要按按键出来调，用惯苹果安卓都不适应
5手机还是搁手，加上重量比较轻，手感一般
6后置指纹无明显段差，位置也不好，容易误触
7经常SIM卡无法识别，不知道什么鬼
8相机防抖功能一般
9发货速度确实太慢了，等了一个多星期……",2017-12-09 23:41:40,10,7,1
j***y,银牌会员,用了几天才来评价，感觉手机流畅。并没有出现网上所说的各种不良问题！值得购买！,2018-03-09 17:09:41,0,0,5
s***记,金牌会员,发货速度很快，锤子确实令人惊艳，实在是不想套上手机套?,2018-03-06 22:55:34,1,0,5
渐***活,钻石会员,第四台锤子手机了，自己用，也推荐身边人用，锤子手机系统很吸引人，外观做工也越来越好，真心好用，期待锤子继续推出新的更好的产品。,2018-03-06 17:23:39,0,0,5
b***x,金牌会员,其实很久以前就已经被老罗的设计和执着所感动，现在终于买了老罗的手机，心里非常的激动啊。 起初第一眼看见这个手机的时候，就已经被它的设计吸引了，简直完美 这就是我想要的手机， 那个屏幕的比例和那个隐藏在logo后面的指纹识别，都让我惊艳无比！ 还有 这简直就是我们强迫症的福利啊！让我看见强迫症都给我治好了！ 经过这几天的使用，用的非常顺手，特别是一步、大爆炸、Smartisan桌面、闪念胶囊 这些标新立异的功能，非常适用。 最后，感谢老罗，感谢锤子，感谢坚果pro2！,2018-03-08 06:26:29,0,0,5
j***f,金牌会员,用着还行，就是系统跟小米有点点不一样，物流快，好评。,2018-03-07 21:41:04,0,0,5
jd137091uks,金牌会员,不说了，我这人不喜欢评论。一般差不多都是五星好评，我直接上图你们自己看。还有这个听筒简直了，简直听不到，还好我听力好。罗永浩这部手机我应该寄给你总部。  后续我会检测这部手机。,2018-01-26 11:30:18,7,5,1
z***3,金牌会员,手机挺漂亮的，也很好用，老公很喜欢,2018-03-07 10:29:27,0,0,5
j***p,PLUS会员,外观是不用说的，漂亮得就像是手机！pro1已经买了用过，电池续航能力很好，锤子的系统更是用习惯了！这次做活动，毫无犹豫入手2，期盼很久了，值得购买！支持老罗！继续努力，期待下一代产品的来临！,2018-03-07 00:52:12,0,0,5
摩***c,钻石会员,运行很流畅，情怀加持。运存够大，流畅不卡。锤子的系统还是很流畅的，看起来也很舒服。双面玻璃，手机更脆，〒_〒建议买碎屏险，血的经历，买来第四天，屏幕碎了。碎屏险买京东和锤子自己的都可以。快充很好用，十几分钟能冲个60多的电。电池优化有待加强，基本一天一冲，重度使用，一天两到三冲，我原先使用的三星a9100，重度使用，也就一天一冲，很少两冲。指纹识别速度很快。拍照很清晰，但是，不知道是不是不支持防抖，拍照经常会花。侧边栏，经常误触截图。但是有很多组合快捷键，很方便。大爆炸和一步，没有想象中那么好用，有点小失望。总体来说，两千+买这个手机，还是很不错的。,2018-03-04 08:52:36,1,0,5
j***a,铜牌会员,以前没听说过锤子手机，同事说的，我的上部手机是红米note2手机没法用,2018-03-07 17:18:14,0,1,5
雨***醉,PLUS会员,手机不错，终于拿到了。就是用s7edge习惯了，这个目前还需要适应。,2017-11-22 20:31:29,1,0,5
