名字,会员级别,评论内容,评论时间,点赞数,评论数,评价星级
jd_151139fwv,银牌会员,转换头能在好点吗,2018-01-11 13:11:25,4,1,1
j***2,银牌会员,手机很漂亮，手感超赞，由于本人日常使用只是打电话，刷微信，配置基本够用，全面屏效果超乎想象,2017-11-27 15:58:37,1,0,5
j***u,PLUS会员,老罗就是情怀 支持锤子 好用 比想象的要好很多 手感各方面都很好 系统流畅 一步 大爆炸都很有特色 有待琢磨,2018-03-06 21:44:27,0,0,5
Q***-,银牌会员,"电池续航时间长,系统流畅稳定。没有很硌手，配原装手机套，颜值很高。",2018-03-06 23:53:29,0,0,5
老***仔,PLUS会员,用了一整天，外观够的上一流档次，系统流畅度也行，尤其是我在户外工作，网络比较给力，比某些品牌强很多。唯一没整明白的是后台音乐始终关闭不了，不知道为什么。整体评价，90分。,2018-02-06 20:08:55,0,0,5
有***矣,金牌会员,颜值在线，比我用的mix2好看点！系统流畅度不错，就是信号不太好,2018-03-09 07:57:17,0,0,5
吴***启,PLUS会员,非常流畅，买的最大的，真是爱不释手，非常满意,2018-03-09 10:51:04,0,0,5
G***徐,金牌会员,入手这个手机完全是情怀 2000左右价位的 也没什么好选的  所以买了这个    主要想体验一下系统。  屏幕天气冷就拖影 电池待机续航还行 重度使用可以用一天 整体来说还行,2018-03-07 14:13:56,1,0,5
w***3,铜牌会员,电池耐用   充电真的贼快 没想到有那么快          拍照感觉给我的T2秒了     目前两个手机都是锤子感觉好用,2018-03-09 16:46:34,0,0,5
小***4,金牌会员,手机用了一个月了，就是刚开始新手机就已经出现卡顿的情况了，当然它其中有一些功能还是非常不错的，但是卡顿这个可能还需要再改进,2018-03-07 22:50:25,0,0,5
小***_,金牌会员,外观还行，速度也不错，屏幕好看，不过边角的地方触摸不太灵感觉,2018-03-07 11:58:05,0,0,5
S***0,银牌会员,使用了一段时间，总体体会不错，原来用的是华为，设置上和这个锤子有些不同，适应一下就习惯了，目前系统流畅，信号良好，满意,2018-03-07 12:03:10,0,0,5
m***r,金牌会员,昨天下单两部手机，一个骚红，一个细黑线，这是给同事买的，也是第三次购买锤子手机啦，一如既往的好，工匠之心，值得拥有！,2018-03-08 14:33:18,0,0,5
j***c,银牌会员,指纹和面部识别真的很方便，但插耳机时要用转接线就有些崩溃，至于待机方面，应该可以接受，正常使用1天半应该是可以的。,2018-03-08 16:12:34,0,0,5
走***机,银牌会员,自己是去年发布的第二天在官网就买了，这次我兄弟的手机被偷了，于是推荐他买了这款，我给他买我比他还紧张，真他么好看。,2018-03-09 22:10:08,0,0,5
一***心,PLUS会员,拍照一般，它也不是一台拍照手机啊，就手机而言，手机很不错了。电池不玩游戏可以支持3天左右。。。,2018-03-06 19:26:10,0,0,5
灰***敌,PLUS会员,不错的手机，价格比较便宜。很好。,2018-03-07 20:31:54,0,0,5
枫***2,PLUS会员,第一次用这牌子的手机，网上爆出弯曲啥的。自己用到现在还没出来这种情况。系统也挺好用的。挺快的,2018-03-09 10:56:25,0,0,5
j***u,金牌会员,电池续航杠杠的，充电速度非常快。很喜欢有棱角的设计。看到同事买了一个pro很漂亮，就顺手买了一个pro2！,2018-03-08 11:02:13,0,0,5
大***人,银牌会员,物流依旧这么给力，刚用上，感觉还不错。具体的手机性能得用一段才能说，外观满意，要是能配套个耳机就完美了。,2018-03-09 21:30:38,0,0,5
j***a,银牌会员,手机真的不错！唯一的缺点就是卡槽太难打开了，卡针搞弯都没能弄出来…系统之类的还在摸索当中，第一次买锤子，希望没买错！,2018-03-08 13:48:09,0,0,4
大***夜,银牌会员,老罗家的手机是第一次用，最开始吸引我的是它那与众不同的外观，可等到手机到手后，更是惊艳到我了，外观开来无可挑剔，背面的玻璃设计也十分惊喜，当然手感也是不错的，再加上正面那霸气的屏幕和相得益彰的前置摄像头，简直是完美。打开手机里边的软件也是不掉面，外加四个角弧形的设计与精湛的切割让整个手机屏幕看起来漂亮极了，再来说说手机的反应速度和流畅性吧，那更是只能用稳定，狡猾的无话可说。还有一点很深的体会就是，这款手机的信号接受真的是强到逆天，总之手机满意，有看上的朋友就马上动手吧。,2018-02-27 22:14:06,3,0,5
jd_150965myw,银牌会员,手机运行可以，也很好，还送了转接头，可以！103分，多一分宽容，多一分理解，多一分爸爸对你的爱??,2018-03-07 19:57:31,0,0,5
小***书,银牌会员,总体好评，指纹解锁不如人脸解锁好用。,2018-01-27 18:40:21,1,0,5
1***p,银牌会员,老婆的情怀，开心了一晚上，国产机首选锤子,2018-03-06 16:47:59,0,0,5
j***f,银牌会员,晚上看到有优惠就下单了，第二天下午到的，发货很快。用到现在有一个多月了。手机系统反应很快，不亏是660处理器。相机提升明显，照的照片很清楚，全屏幕看电影爽呆了。,2018-03-06 21:32:01,0,0,5
-***r,银牌会员,去年7月买的pro1，厚一点，但是很好看，有质感，然后和老公一起换了pro2，一黑一红当情侣手机，我觉得很好用，系统也好使。指纹和logo的完美结合越看越喜欢,2018-03-07 21:09:59,0,0,5
j***8,银牌会员,本人之前手机是5.7寸屏，本手机是5.99寸屏。与原来手机整体一比，惊喜的是还小了一圈呢，因为这款手机几乎全面屏，边框很窄！手机很薄，双面玻璃手感润滑！最好还是配个指环，抓握手机太紧了容易握到屏，影响操作。再说说系统，最喜欢 一步 功能，很方便快捷！闪念胶囊也是不错的创意！手机有组合快捷键，感觉很方便，闪念胶囊键加锁屏键是截屏，闪念胶囊键加音量键分别是手电筒和一步。手机还有人脸识别开机功能。整体使用体验良好！,2018-02-26 01:01:35,0,0,5
井***羽,PLUS会员,"终于收到我需要的宝贝了，东西很好，价美物廉,感谢又是一次满意的一次购京东提供的优质服务! 说实在，物。无论是卖家的态度还是对物品,我都非常满意的。有问必答，回复也很快，我问了卖家态度很专业热情，这点我表不少问题，都会认真回答我，他都不觉得烦，收到的时候示由衷的敬意。再说宝贝，正是我需要的,打开后让我惊喜的是，宝贝比我想象中的还包装完整，要好! 不得不得竖起大拇指。下次需要的时候我还会再到时候麻烦给个优惠哦!",2018-03-10 00:05:28,0,0,5
w***a,银牌会员,买锤子不是因为我是罗粉，偶然看到实物，感觉很喜欢，偶目前用了一周，用的感觉还是挺不错的，爱不释手,2018-03-09 19:39:32,0,0,5
丶***贵,钻石会员,体验很好，系统也很棒，速度很快，暂时没什么毛病，唯一的一个小缺点就是上方的小孔容易进灰不好打理。,2018-03-07 23:26:47,0,0,5
西***巷,银牌会员,对于坚果PRO2的设计基本是毫无抵抗力，细红线值得嘚瑟。660完全够用，6G内存运行的毫无压力。,2018-03-08 19:22:04,0,0,5
l***y,PLUS会员,颜值一流。好看。正常使用续航一整天还有多。指纹锁秒解。不知道久了以后会不会卡,2018-03-06 22:41:56,0,0,5
木***宅,钻石会员,集齐三色，能召唤什么出来！,2018-03-03 17:39:32,1,0,5
猥***浪,银牌会员,给妈妈买的  看着用着还不错      今天试了试    除了手机轻点用着没手感 就没什么问题了,2018-03-06 16:52:31,0,0,5
p***1,PLUS会员,屏幕显示不错，外观很好看，颜值很高，锤子的系统不错，很多都很有人性化，推荐,2018-03-07 06:09:20,0,0,5
c***6,银牌会员,"主要看上锤子手机的一键功能。手机手感很好，用起来也挺方便的。
不好的一点就是，全面屏容易误触。",2018-03-09 09:21:17,0,0,5
j***e,PLUS会员,非常满意，特别是锤子的系统第一次用，很好上手。我这种商务为主的，特别满意,2018-03-09 19:55:29,0,0,5
咦***机,金牌会员,手机上午买的，下午就到了。京东特别快，服务特别好，手机还没用，不好评论，用一段时间再来评价,2018-03-08 16:34:02,0,0,5
l***求,银牌会员,拖影根本不影响，暖和就好了，也不像锤黑说的这里不好哪里不好的锤子还是可以的，就是系统不大会用,2018-02-22 11:43:28,0,0,5
阿***o,银牌会员,还行吧，挺喜欢的???,2018-03-08 22:30:27,0,0,5
j***9,银牌会员,宝贝很好，原装，快递也给力！,2018-03-08 10:56:20,0,0,5
王***1,金牌会员,屏幕特别好看 尤其是黑屏状态,2018-03-08 14:33:43,0,0,5
生***c,金牌会员,满意，起初听筒有点小声，买了个手机壳声音被包裹住就大声了，最爱的设计就是记忆胶囊，特别是还款，每个月都是固定日子可以一直重复使用，还钱了打个勾就行，月底了又可以重新把勾去掉，不用重新编辑，对于记忆不好借钱又多的我很是喜欢?，我买这手机就是因为这个功能，给设计者大赞啊,2018-03-07 09:30:15,0,0,5
山***的,PLUS会员,电源键太松 手机很滑 用了几天 感觉手机变弯了,2017-11-17 10:13:17,25,26,1
天***吗,PLUS会员,还不错！！！,2018-03-07 18:41:22,0,0,5
g***o,PLUS会员,手机和好，第一次用这个品牌的手机，真心不错，就是大家不知道而已,2018-03-07 22:54:23,0,0,5
a***4,钻石会员,"手机试用了一段时间才来评价，给大家一个参考：
1.硬件方面：工业设计，配置方面基本没得挑，唯一不足的是摄像方面，个人感觉不是太好，主要体现在成像效果和拍照时间。
2.软件系统方面：没得挑，目前安卓里用得最好的一个系统。
3.性价比：非常高，这个价非常值。考虑这个价位的朋友入手后绝对不会后悔！
总体来说4.5分以上，非常满意！为老罗的情怀打call！做手机真的只是为了交个朋友…",2018-03-01 00:10:24,1,0,5
e***2,钻石会员,非常赞的手机！运行速度很快，反应敏捷，显示清晰细腻，就是没有3.5耳机略显不便。,2018-03-08 14:18:11,0,0,5
j***t,银牌会员,很不错，买了酒红色和碳黑色两个，很流畅，手感好，款式很喜欢，最遗憾的是没有耳机,2018-03-08 11:26:57,0,0,5
苹***莓,PLUS会员,帮弟弟买的，他说还不错，质量等待时间验证，相信京东的品质！,2018-03-08 09:53:08,0,0,5
就***b,注册会员,快递特别给力，昨天下单今天就到了，手机质量也特别好，第一次用锤子，感觉爽歪歪,2018-03-09 21:18:06,0,0,5
咖***棒,银牌会员,这手机真的是赞不绝口，很喜欢这风格，老罗真会玩，前面用着三星已经被你圈粉了。,2018-03-08 18:30:28,0,0,5
a***c,金牌会员,性价比不错，比以前的锤子进步很多，性能够用了，操作系统简单，比其他厂家做的好,2018-03-08 15:22:31,0,0,5
丿***o,银牌会员,物流什么的还好，就是配送的时候太慢l，手机用着不错，就是不知道时间就了会怎样,2018-03-07 09:59:03,0,0,5
王***l,PLUS会员,很喜欢，运行流畅，电池续航一般，时间天气设置不太习惯。,2018-03-08 07:38:51,0,0,5
j***v,银牌会员,和图片一样外观漂亮，手感很好，内存也很大，看重它的运行速度，打游戏非常棒。,2018-03-07 11:09:23,0,0,5
晴***蛉,银牌会员,帮朋友买的。好不好用不知道，但是外观真的好长，截屏都比别的手机截的图片长,2018-03-09 10:31:35,0,0,5
小***哈,钻石会员,手机很流畅，系统很好用，感觉很棒，唯一缺陷就是大音量时整个手机都在抖。,2018-03-08 22:52:58,0,0,5
j***n,银牌会员,声明:1?是为了引起足够的重视，跟大伙分享有几点感受。1.首先讲到不满的原因，有意买pro2的，请务必看下漏光问题，漏光 漏光 漏光。据我所知是非常普遍的现象，有些换机后寄过来的依然是漏光的，有人说不是什么大事，但大家都不希望新买3天夜间启动的时候机身四周龟裂纹一样，自带闪光效果吧。况且有人说漏光是没有粘牢，可能比其他机器更容易进水，进水后电路问题主板坏了可就没那么轻松了。2.服务不一致，售后沟通不顺畅。从年前和客服网上沟通手机问题，到打客服电话，实地跑维修点，联系京东取货，到现在约15-20天，不通畅的环节很多，各方口径不一致情况也时有发生，耽误了很多时间。3.京东和进驻商锤子的配合问题，一，京东上门取货无法自行修改地址，周五和周末寄送，单位和家庭住址不同的就要听完冗长的客服自动播报，接通人工，才可以修改，然而客服系统的修改又并不会及时根据新地址安排取件员，因此只能多等两天工作日取件，相当于做了无用功，为了快速退单而不嫌麻烦找客服修改，到头来反而是无用功。二，京东取件员认为手机有可见轻微划痕说可能需要拍照上传，可是又不管上传，必须重新联系网上客服，由于这种情况，加上第2条说的问题，和,2018-03-06 22:22:46,0,1,1
青岛花蛤蜊,金牌会员,1月份购买，已经使用一个多月，挺好用，一步，大爆炸，闪念胶囊很好用。,2018-03-06 23:01:41,0,0,5
白***年,PLUS会员,屏幕边缘的确不是很灵敏，不过很喜欢这个手机呀！,2018-03-09 21:34:17,0,0,5
j***8,金牌会员,充电很快，性能很平衡，就是屏幕触控的时候感觉有点不灵敏，尤其是边角,2018-03-09 15:56:35,0,0,5
妮***i,PLUS会员,用了快两个月了，感觉还不错，这一台坚果值得购买,2018-03-08 22:19:38,0,0,5
j***i,银牌会员,还行，就是有个缺点64g的到手拆开内存只有49g了不知道缺的去哪了,2018-03-06 18:56:17,0,0,5
a***m,PLUS会员,挺好用的，很流畅，电池还好吧，对得起这个价格,2018-03-09 18:17:37,0,0,5
j***j,PLUS会员,手机是正品，京东值得信赖，家里都用这款手机！,2018-03-08 08:44:54,0,0,5
jd_183178btx,银牌会员,"买的手机第二天早上就到了，非常快,手机是真品，上电信设备进网管理上面查了是真的，锤子手机用的不错，好多黑科技，好多都没用过的",2018-03-06 16:02:34,0,0,5
h***o,钻石会员,手机运行非常流畅，操作体验很惊艳，完美，不负所望，锤子，值得拥有,2018-02-27 21:11:59,0,0,5
逃***丶,银牌会员,刚拿来的时候才发现，屏咋那么大，有点小意外，不过手机是真的好。,2018-03-08 19:35:51,0,0,5
笨***伟,银牌会员,手机很漂亮 也很喜欢，一直想买这款手机的  ！发货速度也很快！,2018-03-07 12:36:16,0,0,5
不***物,PLUS会员,买的第二个了 因为好 所以推荐给自己的妹妹,2018-03-06 21:46:43,0,0,5
追***门,银牌会员,运行速度很快，使用感觉不错。不知为什么有时候看微信发黑闪屏。,2018-03-08 16:16:41,0,0,5
风***0,银牌会员,很不错的一次选择，-锤子操控感很好，性价比高，京东配送也快！,2018-03-08 11:42:29,0,0,5
逍***子,PLUS会员,产品收到，不错的产品，外观好看，用着不错,2018-03-08 16:38:01,0,0,5
T***r,钻石会员,还不错挺好看的 ，游戏略卡，可以接受。一个月后再追评一次！,2018-03-09 18:50:27,0,0,5
j***9,银牌会员,手机不愧是性能怪兽 虽说差点苹果 但是在安卓里已经很牛逼了,2018-03-07 17:35:20,0,0,5
清***4,PLUS会员,朋友说挺好用的，就是电池可能不是太耐用,2018-03-06 20:49:14,0,0,5
Z***4,金牌会员,只能说因为罗永浩买的  之前一直用苹果 安卓的正在试用中,2018-03-08 16:35:48,0,0,5
r***o,银牌会员,第一次买锤子的手机，在小米note3和这款里面挑了很久最后还是选了这款，毕竟全面屏almost哈哈哈哈哈。使用感还是不错的，值回票价。就拍照还是弱项，不过就两千三也不要求什么了。 还有就是自带的软件有点多，28个卸载了20个。,2018-03-04 23:22:15,1,0,5
南***i,金牌会员,给朋友买的，她说还不错，唯一的遗憾就是还是比较厚！！！,2018-03-08 09:42:28,0,0,5
j***4,PLUS会员,很好用  黑色要不要高哈哈哈哈哈哈,2018-03-07 23:08:18,0,0,5
l***v,钻石会员,用了一段时间，比较快，不卡，其他功能正在摸索中，呵呵。,2018-03-07 08:24:13,0,0,5
j***0,金牌会员,用了几天，基本满意，反应速度可以，电池再大点就更好了。,2018-03-07 10:52:22,0,0,5
小***2,钻石会员,冲着系统去的，之前想买m1l没货买了小米5s，后来一直想刷锤子系统，刷不了，这下好了，直接上坚果pro2，系统更新直接更新，用着那叫一个舒服，偶尔跟女儿视个频，美颜不错，又年轻了，后置摄像头很少用，扫码没毛病，感觉拍照也够用，还行。补充一点指纹解锁快，那是真快，用过小米5s的我都有有点不适应了，小米5s现在备用机，这个主力机，双机在手，天下我有！,2018-03-02 23:26:17,1,0,5
安***糖,PLUS会员,手机用了两天，系统很快，颜值很高,2018-03-07 11:52:43,0,0,5
s***s,PLUS会员,刚买完手机就搞活动，好生气呀！,2018-03-09 21:01:10,0,0,5
木***5,PLUS会员,目前用着还不错 。。。。。。。,2018-03-09 17:17:37,0,0,5
j***0,银牌会员,东西很好，很满意！性价比出众！期待完美的用户体验！,2018-03-09 22:11:01,0,0,5
凉***X,PLUS会员,质量很好，物流很快，值得购买,2018-03-08 20:17:15,0,0,5
P***E,PLUS会员,用起来很舒服，外观也很漂亮。,2018-03-08 16:35:19,0,0,5
c***i,PLUS会员,好评，虽然手机已经出二手了。,2018-03-08 00:15:05,0,0,5
G***狂,钻石会员,匠心之作，良心产品，非常好用。虽然是安卓的系统。,2018-03-07 20:42:48,0,0,5
孔***禄,PLUS会员,还不错，帮同事买的，挺好用的,2018-03-07 21:57:50,0,0,5
j***d,银牌会员,"外观漂亮，手感好，酒红色非常好看。返回键和多任务键，可以根据自已的习惯来设置，物流很快，服务态度好，坚果pro2的外包装特别好看，但是我第一次买这种手机，里面的系统不熟悉，也用不惯，所谓的大爆炸对于我来说，是空气，自已带的软件太多，要的站内存，希望后期不要无缘无故机身弯曲。
喜欢这款手机很久了，希望自已不要失望。

希望锤子科技以后越来越好",2018-03-04 12:17:00,1,0,5
M***n,金牌会员,不错，很流畅。非常漂亮。确实老罗出品款款经典。,2018-03-08 16:07:15,0,0,5
j***b,金牌会员,前天下单昨天就到了，玩了一天才来评论。感觉还是不错的，充电真的快充电的时候有一小点的发热。其他的还可以。满意,2018-03-08 11:39:17,0,0,5
j***p,银牌会员,手机卡，刚用了就这样，有时候点了没用,2018-03-07 11:47:20,1,0,5
秦***w,PLUS会员,手机除了像素 其他都还好,2018-03-09 12:55:35,0,0,5
爱***茄,金牌会员,朋友买了一个，用过后又回购一个，真的是很好！,2018-03-08 21:42:43,0,0,5
j***6,银牌会员,还不错吧，对手机要求不高，还以为会自带耳机呢,2018-03-07 18:42:58,0,0,5
j***x,银牌会员,手机很不错，做工也挺好，配置中规中矩，没有太大的短板，酒红色的手机颜色很靓，男女都可以用，强烈推荐一下。,2018-03-09 08:27:54,0,0,5
j***j,PLUS会员,手机很漂亮，运行速度很快,2018-03-06 18:31:57,0,0,5
拍***盖,PLUS会员,买给老爸的 老爸挺喜欢的,2018-03-07 01:28:17,0,0,5
清***4,金牌会员,不错的啊哈哈哈哈，给人一种不一样的感觉哈哈！,2018-03-08 10:37:49,0,0,5
j***8,钻石会员,手机收到不错，很漂亮，不必苹果差，值得推荐,2018-03-08 14:10:59,0,0,5
j***9,金牌会员,好好用，颜值也高，京东配送一如既往的快！！,2018-03-07 23:41:28,0,0,5
龙***o,钻石会员,帮朋友买的，运行速度可以，推荐购买。大瓶。,2018-03-07 23:27:59,0,0,5
j***i,金牌会员,手机运行十分流畅，做活动买的，价格不错。,2018-03-08 18:24:19,0,0,5
1***p,PLUS会员,东西不错，发货速度快,2018-03-08 08:58:23,0,0,5
雅***布,银牌会员,运行速度还是不错的，玩游戏时间长点会发热,2018-03-07 11:03:42,0,0,5
j***l,银牌会员,怎么没有给耳机那，不是买手机都要送耳机吗,2018-03-07 13:28:14,0,0,5
z***0,银牌会员,用了一个月不到发现手机变弯了，而且很严重,2018-03-06 19:27:51,0,0,5
j***l,银牌会员,刚刚拿到手 以前用苹果 现在不是很习惯,2018-03-09 12:05:49,0,0,5
z***s,银牌会员,不错的手机，性价比高，运行速度也很快！,2018-03-07 18:32:15,0,0,5
j***e,银牌会员,裸机还是很漂亮的，就是用不惯黑科技啦。,2018-03-07 17:13:45,0,0,5
j***h,银牌会员,手机已用上了，是我喜欢的样子，比较好用,2018-03-07 13:37:38,0,0,5
j***z,银牌会员,感觉很喜欢这个手机，用起来挺好的，不过还是期待锤子手机再下次发布会能在拍照和音响方面有更大的提高！,2018-03-06 21:55:32,0,0,5
冬***默,金牌会员,买给弟弟的，他很喜欢，比图片要好看。,2018-03-08 13:05:55,0,0,5
m***r,金牌会员,昨天下单两部手机，这是啥给同事买的，也是第三次购买锤子手机啦，一如既往的好，工匠之心，值得拥有！,2018-03-08 14:32:26,0,0,5
l***2,金牌会员,我真无语了，原本送给我母亲手机，那字体小的我都看不见，所谓的修改字体只能在设置里能看出来，其他app全是小蚂蚁，你这是要弄瞎我们啊，比vivox20的字小二分之一，到底能不能改，这是历史遗留问题吧，能不能有点诚意，会把眼看瞎的，眼睛稍微差点的都看不到时间，更别说年纪大点的人，也不能插入挂件时间，想改为原生态安卓系统，结果小的连图标都看不到了，其他的先不管，好歹能看到电量数字也算，我用放大镜才看到，我不是黑也不是粉，实事求是，这连正常使用都费劲，更别提老人了，希望系统抓紧升级，要不这个手机就白买了，给老人买的朋友注意了，不适合！！,2017-11-26 19:23:01,11,10,1
1***p,银牌会员,手机不错，外观跟性能都好，用起还行,2018-03-07 07:58:15,0,0,5
j***j,PLUS会员,外观很大气，尤其是酒红色很时尚。系统速度快，期待国产手机越做越好,2018-03-06 13:40:04,1,0,5
狮***格,银牌会员,刚刚买到手，现在用的非常流畅，感觉非常不错。而且京东次日达，确实是次日达。这是系统做得非常流畅。而且相机有所改善整体也在说用着还是比较舒服。但是屏幕有一点点刺眼。其他的方面用再说吧总体在说十分的话，可以打上9分半。,2018-03-06 16:31:44,0,0,5
刘***8,金牌会员,手机很好，速度很流畅，满满的情怀,2018-03-08 11:14:45,0,0,5
魔***1,钻石会员,此用户未及时评价，系统默认好评。,2018-03-08 10:55:54,0,0,5
人***6,钻石会员,手机还是比较惊艳，速度还可以！,2018-03-08 17:15:20,0,0,5
乐***1,钻石会员,大小刚合适，送达及时，无损坏！,2018-03-08 13:15:47,0,0,5
王***9,钻石会员,手感棒棒的，就是倒东西挺费劲。,2018-03-08 07:10:35,0,0,5
j***u,银牌会员,拍照效果很好，手机手感也不错。,2018-03-07 11:27:24,0,0,5
j***5,金牌会员,用了一段时间，通话经常自动中断,2018-03-06 19:10:36,0,0,5
爆***_,银牌会员,非常强大就是没耳机  裸机一个,2018-03-06 18:50:09,0,0,5
j***q,银牌会员,手机给我感觉很好。很精致的锤子,2018-03-06 16:29:24,0,0,5
m***5,PLUS会员,用了几年的魅族手机，这次突然换了锤子手机，首先感觉做工方面非常强大，系统也好用，半夜面部解锁识别也很快。后置摄像头差魅族pro7一点点，前置要比魅族好一点。骁龙660跟联发科差不多，我不玩游戏，不好评价。感觉用腻了一种手机，突然换一个牌子，体验非常棒！最后，配送员非常棒，送货特别及时。下雨也爱护包裹。特别感谢！,2018-03-07 02:15:44,0,0,5
龙***屑,PLUS会员,拍照效果如图所示。纯白色超级漂亮，不打算戴手机壳了，因为裸机太漂亮了！,2018-03-07 03:53:32,0,0,5
a***2,银牌会员,第一次用锤子，希望有好的表现,2018-03-09 22:40:47,0,0,5
不***爷,银牌会员,黑色金线版送给老爸的新年礼物,2018-03-09 20:01:57,0,0,5
哈***串,金牌会员,用着体验还可以，速度挺快的。,2018-03-09 10:59:07,0,0,5
路***玮,金牌会员,坚果就是好，第二次买了，很好,2018-03-08 12:10:38,0,0,5
从***给,金牌会员,正在用。不过颜值很高，很期待,2018-03-07 14:05:17,0,0,5
j***v,PLUS会员,颜色非常完美，手感好，运行流畅，反应快，是一个不错的手机，下次还要买,2018-03-07 23:55:15,0,0,5
j***刀,金牌会员,很不错的手机，比T2强悍多了,2018-03-06 21:06:50,0,0,5
4***9,钻石会员,手机已收到，京东正品，喜欢，相信京东，物流快服务也好，支持京东，以后还会光顾的,2018-03-05 19:11:26,1,0,5
冯***儿,PLUS会员,之前买了某大牌手机，一天没用呢，直接变砖了！第一个锤子，希望锤锤锤！,2018-03-03 20:57:11,0,0,5
