名字,会员级别,评论内容,评论时间,点赞数,评论数,评价星级
S***M,金牌会员,"手机收到后,外观确实很惊艳,摄像头做的让人看了还想看。
后面的logo也很漂亮。买的时候手感膜还没到。现在玩起来确实有一点硌手。后置摄像头进光率不是很强。拍出来的照片总是比其他手机暗一些。特别喜欢大光圈虚化这个功能，指纹解锁还没试用。因为我的大拇指脱皮了。系统方面，刚玩两天的时候。出现过一次蓝屏大概有3秒左右。期间玩的时候也卡住过一次。但是感觉并没有什么大碍，讯飞输入法语音识别能力很高。一步也很好用。提高了办事效率。很喜欢大爆炸这个功能。闪念胶囊在右上角的时候感觉很容易误碰，最最满意的就是电池。重要的事情说三遍，电池，电池，电池。晚上充好一次电。中度使用一天还剩下60%。第二天还能用一天。晚上回家还剩17%。续航简直无敌。手机，没碰见过什么发热。",2017-05-20 13:50:11,6,0,5
浮***走,PLUS会员,手机还不错，外观比较漂亮，里面的系统也很好，简洁大方，看着非常的舒服，系统运行杠杠滴很流畅，最重要的是手机内存128G，实际剩余有108G左右，是非常充足的，可以下载足够多的视频和音乐了，再来说说照相吧，虽然后置是双1300万的镜头，但是拍出来的效果并没有达到理想的效果，前置1600万像素也是浪得虚名，总之相机是硬伤咯，电池3500mah，充满电玩一天是没有任何问题的，话又说回来，毕竟是一千三百元的价格，也不能给予太高的期望，对于不自恋，也不怎么玩大型游戏的手机控我来说，有这个手机就足够了，处理器是高通骁龙626的，属于骁龙中端处理器，如果没有特别的要求，还是推荐大家购买的！,2018-01-29 10:29:12,1,0,5
j***9,PLUS会员,"还在试用中，要吐槽的就是说明书上有其它品牌手机的一键*换机功能，进去后却没有，咨询了锤子的微信客服等了给了才说没这功能，建议用第三方APP或电脑解决，抓狂！！（本来想截屏的，聊天记录居然没有了！！）
可能是新机的缘故吧，感觉还挺流畅～",2018-02-26 19:59:02,2,0,5
范***邪,钻石会员,系统比较简单，大爆炸跟闪念胶囊比较不错。手机还可以吧。比较人性化,2017-10-13 15:48:42,79,8,5
崔***生,PLUS会员,手机收到了，其实买这个价格的手机，还是需要一点信仰的，价格偏高了，讲道理就是一个放大版的苹果五而已，但是手机收到后，锤子os流畅度不输miui8，系统流畅度太快了，屏幕材质还不错，相对于小米闹特标准版搭载的JDI屏幕，差不多。为啥要买这个牌子的手机呢，就是因为抢了好多次小米6抢不到，刚好看到锤子坚果pro发布，而且是128g才2299，虽然不是性价比吧，但是小米5尊享版没货，小米5s128g版本也是没货，5sp又太大，最后我买了ZUK PRO，但是很无奈，人品不行，刚好遇到残次品，退了。买到这个坚果pro手机，真的是万般无奈中买的，但是到手之后，还是感觉非常值的，这个设计，符合我。我喜欢这个，我现在真的成了锤粉了。不知道这个手机能不能用两年，希望能用吧。,2017-05-11 18:49:04,9,4,5
j***2,银牌会员,电子产品送货还是比较快的，隔天就到了，手机收到了，操作方式不太习惯，后面用的再看效果吧,2018-03-01 10:05:55,0,0,5
起***砖,金牌会员,看了网上评论吓的我根本不敢买，可是他的几款专业工具真的是让人很喜欢，所以入手了，很好的手机，真心不错，原以为不如全面屏，实际上超出了预想的好看，功能很大气，随机软件很便利卸载，一个商务学习运用者的好选择，真心不后悔，闪年胶囊用的最多，很方便，大爆炸很适合学习。本人不玩游戏，所以无从评论，希望大家看到。真的很不错。一定买个保护壳，手机太滑，很容易坠落，小心爱护。,2018-02-01 20:34:51,3,0,5
S***举,PLUS会员,"屏幕大小合适，系统操作挺好。手机很轻，整体质感和手感不错。操作流畅性还是很好的。很多功能可用。
一、对内存要求高的还是选择6G或者以上的好（针对锤子系统）
二、用于打电话，存照片，上QQ，微信等一些简单聊天软件的购买这款也是够用的。
以上整体使用感觉良好（体验上与其他安卓系统有明显的差别）
---------------------------------分割线---------------
以下说一下我在使用过程中遇到的不太友好的地方：
1、所有按键质感较差
2、开关机键与音量键靠近且开关机键在中部经常操作会按到音量。
3、升级系统后内存占用率巨大（未打开任何应用情况下占用了3g多，原本只有4g而已），再开个应用就内存消耗完毕了，也没玩大内存的东西所以没有体验被占有完是什么感觉。
4、在锤子应用商店下载的或应用宝下载的软件有一些打不开，点击以后闪烁一下屏幕就没有了。",2018-02-10 10:16:19,0,0,5
V***V,银牌会员,巧克力色的外表真的没辜负我的期待，而且也很少撞的。用一个月录视频下软件什么的内存剩一半了。小功能真的神奇，谁用谁知道，然后闪念胶囊还可以录语音的相当于一个小录音机也可以。运行速度也行的，充电时候强迫症那个版本真的看得好爽。充电刚开始几天要两三个小时，现在一两个小时充满。但是！！！！我想说真的耗电快。一天一充最起码了，还有过夜非常掉电，有时候差不多掉二十。然后，不要摔它，我说真的。,2017-11-08 21:49:34,5,0,5
j***w,PLUS会员,手机还是不错的，就是这次购物体验不太好，一个订单的货手机膜和手机分开发的货只有一个物流信息编号，手机膜两天就收到了，手机居然不知道哪去了，已经发货订单也取消不了，等了十来天终于收到了，作为一个老用户我不想责怪任何人，只希望贵公司可以吸取经验认真改善这个问题避免再次发生，有时用户体验比产品本身更重要！,2018-02-27 21:11:50,0,0,5
p***q,铜牌会员,"机器很漂亮，运行也飞快，这次的活动买到128G超值啊！
就是系统第一次用，很多东西都不太习惯，正在摸索中！",2018-02-10 11:01:05,0,1,5
j***g,金牌会员,挺好的手机，用起来好多功能人性化。性价比高。快递还是那么的快。,2018-03-02 20:27:33,0,0,5
jd_303458836,PLUS会员,手机漂亮手机运行很快触摸屏灵敏照相像素也可以就是图标有点小了有点不适应主题上面没有时间显示又下载不了主题,2018-02-08 15:38:09,0,1,5
邪***宝,PLUS会员,很不错的手机，虽然是老款pro，但是配置绝对够用了，给家里爸妈用的，性能要求不高，看着还很美观,2018-01-24 19:13:36,1,1,5
1***p,PLUS会员,第二台了个人感觉流畅度蛮好的性价比高。值得入手,2017-11-26 14:26:13,8,5,5
楠***倒,PLUS会员,"用了快一周了，来说说感受。
首先，我是锤子手机M1用户，从锤子手机一出市就关注，由于对前几代手机不太认同，从M1才有好感并使用。
1，锤子OS没得说，已上瘾，并且是越来越好！用了这几天偶尔有卡顿，不知是7.1的缘故还是新系统适配的bug，用m1半年多从来没有过卡顿！
2，坚果pro这款千元机已经是良心价了，性价比无出其右！
3，外观还凑合，在普遍圆润的时代是一个锐利的异类！我还挺喜欢。屏幕黑边很大，下巴有点长，背面两段式并且手感膜还不能全覆盖，有点不能苟同！好在买的酒红色挺高档的，没那么土。
4，充电不算快，没感受到快充的优势，可能是我期待值太高。但是续航真的很棒了，比M1好很多！
5，其实坚果pro本来就不是主力机，自己定位都是能给iPhone充电的。其实，这次我是期待T3的！而不是为了出量的坚果pro，没办法，谁让我已经中毒锤子os，并且也还能接受坚果pro，为了NFC就买了128G，希望挺到T3能保值一点。
最后，这是我买过的手机最多字的评论了，希望老罗继续坚持，做更多有品质并且良心的产品！",2017-05-14 17:03:12,15,0,5
长***引,金牌会员,第一次泳，锤子的手机，系统确实很人性化，机身设计也很漂亮，屏幕比苹果的iPhone要差一点点，电池很耐用。现在已经是我的主力机了，最大的优势就是相对于苹果而言，它可以双卡双待。,2018-03-09 10:04:59,0,0,5
白开水36度frl,铜牌会员,关注锤子很久了，亲自上手后，确实不错，在现在同质化严重的今天，锤子的个性化设计真的是很有可玩性。而且京东自营快递确实快,2018-02-08 07:03:28,0,0,5
有***好,金牌会员,不错啊，随后又买了个，可以扫白条付款,2018-02-05 21:46:02,8,2,5
j***咲,PLUS会员,机子屏幕很大漂亮，居然还有强迫症选项噗嗤，那个充电条真的很巨大哈哈哈，指纹识别比苹果的灵敏！造型好看，那个sim卡针也好看！安卓机子不知道能使用多久,2018-01-04 11:56:04,13,0,5
j***c,银牌会员,一个圆形实体键和整体设计模仿早期的苹果，但外观更好看，男人味十足的硬朗风格。有人说边角割手，但是我想说那只是感觉而已，因为已经做了切割处理，不戴手机壳比较好看，但是玻璃后盖容易有指纹，手机如果摔了就恨不得扔了，装手机壳又体现不出美感！系统比较简单，没有miui那么复杂，简单来说就是简装和豪装的区别，少了很多花哨的东西，资源占用比较少，适合比较低调的人和商务人士。内置软件可以卸载，我不玩游戏，不需要的东西全干掉了，4+128看电视电影绰绰有余！锁屏壁纸可以更换，桌面壁纸不能，可能是因为系统桌面设计限制，我觉得还是可以设计成可修改。有人喷大爆炸，闪念胶囊和一步等功能，我想说的是那只是一个功能而已，你不用就好了。还有人喷那唯一的仿苹果圆形实体键，说什么触摸返回、按一下到桌面、按两下显示后台程序的设计反人类，我倒是想问一下如果不是这样设计，怎么能够在安卓手机上只安排一个按键还要同时实现三个按键的功能？最搞笑的是喷按键误触的，我想问你中间一个按键会误触，左中右三个按键的误触率是不是更高？性价比高，1299价位只能买到红米5 plus 64G，对比不同就是坚果电池小一点，红米屏幕大一点。,2018-02-17 22:27:40,3,2,5
你***i,金牌会员,"今天收到第二部锤子手机，外观的确漂亮得不像那啥啥……
系统界面没有任何变化，所以并没有欣喜感，但拿着手感还好！
希望能比第一个用的时间长一点儿！京东物流一流！大赞?！
我只想知道在哪里插耳机？哪个孔是能够插耳机的？?????",2018-03-01 13:35:07,0,1,5
小***-,PLUS会员,#漂亮得不像实力派#第一第一眼看起来非常有质感，用玻璃设计的手机容易留指纹，这是这种机型不可避免的一个问题，这块儿还是能有一点那个感觉的就是在金属和玻璃过渡之间能感觉到，高度上的有点不同，不过的确漂亮。机身由于上下不同材质，整个机身略微长了一点。硬件吧，锤子手机屏幕显示效果上一直都还是比较有保证的，在整个的一个功耗控制，还有gpu表现，还有cpu这个了，这个性能表现上都比之前的锤子有了一个明显的提升，而且功耗表现方面其实应该还不错。本人并不是专业的测评的，坚果也是我第一台买的锤子手机，本人使用过全部的小米手机，vivo，Zuk（可惜了），一加等等应该超过50部手机。吐槽一句，小米手机真难抢。,2017-05-11 14:29:00,13,5,5
爱***棒,钻石会员,一直都是锤子手机的忠实粉丝 我之前有T1 这个是我第二个锤子手机 喜欢 一如既往的好,2018-02-02 17:32:58,2,0,5
jd_593629152,金牌会员,"太背了，新买的一个月的锤子这个坚果。正常把手机揣在了牛仔裤兜里坐下。悲催的是，站起来以后发现手机折了。他竟然底下折了。现在手机已经报废了，无法开机了。第一次遇到手机揣兜里然后坐下竟然能够折的。这个真是太奇葩了，这块怎么设计的呢？上下它不是一体的。不知道这算不算设计缺陷呢?我只是把它揣兜里，然后坐下了，他竟然能够折,我到底用了多大力量啊？????",2017-10-15 17:52:05,176,72,1
学***哥,金牌会员,买了两部，最大两点就是一步功能，确实给工作带来非常大的便利。其他优点别人都说了，我就不一一累赘了。,2018-03-02 11:37:25,0,0,5
王***山,PLUS会员,首先给京东物流点赞，没影响送人计划！手机做工不错，5.5屏大小也可以，就是新系统用起来不太习惯，性价比不错。细红线也不是红色，是咖啡色。,2018-03-02 14:01:43,0,0,5
w***o,PLUS会员,"#漂亮的不像实力派#只用过T1的老用户，T2、坚果和M1都去看过真机，不符合审美观没下手，等到坚果Pro才出手。上手一天，来谈谈新感受。

1、外观和T1神似，红色很骚，真骚，背面很好看，前面还有改进空间。细红线版后面好看，前面感觉怪怪的，最终定了红色，骚起来。

2、配置均衡，内存再大的就完美了。担心骁龙626性能的同学可以看看卖2799的OPPO R9S用的是625，而且它的销量是2017第一季度全球销量冠军，从可得知，无需对其性能担心，除非是对性能十分苛刻的游戏。

3、系统好用，其中One Step、闪念胶囊和图钉（尚未发布）功能确实是我的刚需，锤子科技实质上是一家软件公司。

4、nfc功能有待改善，只有128g才有nfc，坑啊，要不然已经用习惯了nfc，买64g性价比最高，我觉得。而且目前系统还不支持模拟公交卡，只能待后续升级了。

5、手感略微咯手，如果后背弄一些弧线就更好了。

总的来说，在这个价位，是一个性价比高，很好用，颜值高，能显示一定逼格的手机！",2017-05-12 12:11:21,372,9,5
j***7,铜牌会员,颜色挺好看的 物流也很快 系统和别的安卓的不太一样。但也挺好的   。手感也挺好的 跟苹果五的手感很一样。自己贴的刚化膜没太贴好 总体来说还不错。也是看了评价说很不错才卖的这个手机。而且价格也很便宜。内存也是很大的。,2018-03-05 13:58:21,0,0,5
l***8,PLUS会员,第一次用锤子手机流畅度还可以，系统还是不太习惯，用段时间看看吧。,2018-03-04 19:39:59,0,0,5
王***6,钻石会员,物流很给力，一天就送到我手上了。手机包装很美现大气，没带耳机，手机屏幕虽说是5.5的但感觉很大。机型方方正正的，系统还没用，之后评价。,2018-02-03 16:15:56,1,0,5
z***一,PLUS会员[试用],"用了一个星期再来评论，1399入手，128G,实际能用的是105G。电池和以前用了手机一样，每天充一次，到目前运行不卡，下载完应用安装很快。",2018-02-27 20:04:38,4,1,5
w***k,银牌会员,晚上拍照比较好的，收到这款手机真心比较喜欢，唯一感觉不足的就是物流包装的气袋漏气，没有起到任何防护的作用（如下图），不过，好在手机没有任何瑕疵，如果真的喜欢就去买一台吧，反正那好的产品就是值得拥有，不问在刚刚你看了我拿了很多手机，你你们简单的感受一下，这是除了坚果以外，目前老罗最好的手机了！因为坚果我给我爸爸用了，某些企业说坚果Pro真的可以达到一个旗舰机的感觉了，我觉得确实他们家的产品非常的值得拥有!良心作品，挺你老罗,2017-05-14 00:33:06,10,0,5
j***1,金牌会员,屏幕有点大，可能是我用惯了小屏的，先试试吧,2018-01-02 18:08:17,10,1,5
j***8,银牌会员,"收到货后直接打开     四四方方    拿着虽然不是很舒适，但系统不错。反应迅速，不卡， 待机时间老牛逼了，支持，年后在入手个坚果2代

总之性价比非常不错的手机，支持老罗",2018-02-07 18:21:17,2,0,5
j***o,PLUS会员,总体上还可以，就是外观不是很好看，音质比较差，手机主题有待提高，毕竟是不是老品牌，在这价格上己经算得上可以了。,2018-02-13 13:28:15,0,0,5
e***8,PLUS会员,搞活动提前十天就下单，到了感受了下，系统还是做得很用心，有很多实用的功能。手机做工还可以，新手机就是好看,2018-02-01 20:35:34,0,0,5
h***g,银牌会员,"给爸妈买的新年礼物 认认真真拍了照片 等他们用完之后再来评价 
手机屏幕大电池容量足 
手机到了之后我测试了一整天
系统更新也很快 不过有些功能老人家可能不会用 但是挺有亮点 
大爆炸和胶囊年轻人应该会更喜欢
手机性能方面也做了测试
王者荣耀 qq飞车 高画质高帧率模式完全吼得住
但是荒野行动终结者这些就显得CPU和GPU稍有不足
枭龙625作为新一代低功耗核心 家人日常使用足够 
综上给予??????????好评 
另出一个锤子原装耳机
g：huangzhangzhang_",2018-02-23 12:33:10,0,0,5
落***兔,PLUS会员,"喜欢在东东上网购 真的不错的 比其他网店实在 服务好 好喜欢 还会介绍朋友来
非常感谢京东商城给予的优质的服务，从仓储管理、物流配送等各方面都是做的非常好的。送货及时，配送员也非常的热情，有时候不方便收件的时候，也安排时间另行配送。同时京东商城在售后管理上也非常好的，以解客户忧患，排除万难。给予我们非常好的购物体验。
Thank you very much for the excellent service provided by Jingdong mall, and it is very good to do in warehouse management, logistics, distribution and so on. Delivery in a timely manner, distribution staff is also very enthusiastic, and sometimes inconvenient to receive the time, but also arranged for time to be delivered. At the same time in the mall management Jingdong customer service is also very good, to solve customer suffering, overcome all difficulties. Give us a very good shopping experience",2018-02-02 14:49:40,0,0,5
慢***牛,PLUS会员,"喜欢在东东上网购 真的不错的 比其他网店实在 服务好 好喜欢 还会介绍朋友来
非常感谢京东商城给予的优质的服务，从仓储管理、物流配送等各方面都是做的非常好的。送货及时，配送员也非常的热情，有时候不方便收件的时候，也安排时间另行配送。同时京东商城在售后管理上也非常好的，以解客户忧患，排除万难。给予我们非常好的购物体验。
Thank you very much for the excellent service provided by Jingdong mall, and it is very good to do in warehouse management, logistics, distribution and so on. Delivery in a timely manner, distribution staff is also very enthusiastic, and sometimes inconvenient to receive the time, but also arranged for time to be delivered. At the same time in the mall management Jingdong customer service is also very good, to solve customer suffering, overcome all difficulties. Give us a very good shopping experience",2018-02-02 14:41:01,0,0,5
落***心,PLUS会员,"喜欢在东东上网购 真的不错的 比其他网店实在 服务好 好喜欢 还会介绍朋友来
非常感谢京东商城给予的优质的服务，从仓储管理、物流配送等各方面都是做的非常好的。送货及时，配送员也非常的热情，有时候不方便收件的时候，也安排时间另行配送。同时京东商城在售后管理上也非常好的，以解客户忧患，排除万难。给予我们非常好的购物体验。
Thank you very much for the excellent service provided by Jingdong mall, and it is very good to do in warehouse management, logistics, distribution and so on. Delivery in a timely manner, distribution staff is also very enthusiastic, and sometimes inconvenient to receive the time, but also arranged for time to be delivered. At the same time in the mall management Jingdong customer service is also very good, to solve customer suffering, overcome all difficulties. Give us a very good shopping experience",2018-02-02 14:38:13,0,0,5
一***牛,PLUS会员,"喜欢在东东上网购 真的不错的 比其他网店实在 服务好 好喜欢 还会介绍朋友来
非常感谢京东商城给予的优质的服务，从仓储管理、物流配送等各方面都是做的非常好的。送货及时，配送员也非常的热情，有时候不方便收件的时候，也安排时间另行配送。同时京东商城在售后管理上也非常好的，以解客户忧患，排除万难。给予我们非常好的购物体验。
Thank you very much for the excellent service provided by Jingdong mall, and it is very good to do in warehouse management, logistics, distribution and so on. Delivery in a timely manner, distribution staff is also very enthusiastic, and sometimes inconvenient to receive the time, but also arranged for time to be delivered. At the same time in the mall management Jingdong customer service is also very good, to solve customer suffering, overcome all difficulties. Give us a very good shopping experience",2018-02-02 14:33:40,0,0,5
s***u,PLUS会员,"喜欢在东东上网购 真的不错的 比其他网店实在 服务好 好喜欢 还会介绍朋友来
非常感谢京东商城给予的优质的服务，从仓储管理、物流配送等各方面都是做的非常好的。送货及时，配送员也非常的热情，有时候不方便收件的时候，也安排时间另行配送。同时京东商城在售后管理上也非常好的，以解客户忧患，排除万难。给予我们非常好的购物体验。
Thank you very much for the excellent service provided by Jingdong mall, and it is very good to do in warehouse management, logistics, distribution and so on. Delivery in a timely manner, distribution staff is also very enthusiastic, and sometimes inconvenient to receive the time, but also arranged for time to be delivered. At the same time in the mall management Jingdong customer service is also very good, to solve customer suffering, overcome all difficulties. Give us a very good shopping experience",2018-02-02 14:23:30,0,0,5
jd_167172371,金牌会员,用了两天，还没用装卡，不知道信号以及通话怎样。说说体会。1.系统流畅；2.操作方便；3.分辨率还可以；4.不显示实时网速，这一点让我很不爽；5.不能在屏幕上添加挂件，天气无法一目了然；6.相机着实一般，这一点Pro2有所改进，但这款手机相机是真的太一般，爱自拍的建议看看别的；7.屏幕亮度在下拉列表里没用，只能依赖自动调节；8.大爆炸和一步等都是很好的创意，可以感觉到老罗是在用心改进人们的生产工具，我也是因为这一点，才选择锤子，一开始看评论是担心质量问题的，后来转念一想，既然老罗在用心做手机，质量应该是没问题的，个别出问题都是正常现象，品控不可能100%过关，再有，激活不能退，在一定程度上，也降低了返厂机，翻新机，问题机等等的几率。,2018-01-27 02:58:33,1,2,5
j***e,银牌会员,"机子挺好。
轻。
运行挺顺的。
续航一般吧。",2018-03-01 16:52:21,1,0,5
k***a,PLUS会员,儿子的礼物，收到之后，外观就觉得很惊艳，玩游戏流畅，无卡顿，好评,2018-02-08 19:25:59,3,0,5
留***日,金牌会员,一直想买一个锤子。双11如愿以偿。喜欢上锤子不是因为它的性能，不是因为它的功能。只是因为它的外观。我偏执的性格，就喜欢他这品质的做工，真是又美得不像实力派。买它，就像买一个朋友，买一个，属于自己看着舒服的东西，我不在乎，你能不能用，我只在乎你，能不能与我搭配。,2017-11-20 17:02:35,12,4,5
阿***吧,银牌会员,"说实话发布会一开始那个椭圆机把我吓到了，憋了半年多不会就是这么一坨东西吧？！坚持看到os部分，感觉罗胖和锤子越来越注重客户体验和智能易用性了，心理暗暗为锤子和罗胖感叹:在中国这个大环境里只依靠os很难存活下去的。但根据对罗胖的直觉罗胖的ID绝不会是这一个椭圆！是不是后面T3跟着一块发布呢？坚持着看到最后，真像浮现！感觉全场高潮了！！！正好22点多一点，赶紧上官网，why？没有！突然想到了，京东！哈哈，果然在这里！点点点，买买买！9号正在出差，今天回家正好手机也到了！赶紧拆箱，一个字:漂亮！下面是:4S,M1L,PRO",2017-05-11 20:16:01,6,0,5
