名字,会员级别,评论内容,评论时间,点赞数,评论数,评价星级
2***W,PLUS会员,很好，锥子手机，都说是锤子手机，重要的事情说三遍锥子手机，甩苹果六条街，高端大气上档次，,2017-11-07 17:00:52,21,1,5
F***丶,银牌会员,拿到手上第一感觉像OPPOr1c那款手机，头次买锤子，整体感觉还行，与普通安卓机的操作还是高档一些，大爆炸，胶囊可能很多人用不习惯，我也用不习惯……手机边框衔接处不是很紧凑，边有点割手这是大家都知道的，可能上个壳子好点吧。4+64这个价这样的锤子，已经很不错了。,2018-02-07 21:42:51,7,2,5
b***e,银牌会员,"买回来迫不及待开封。好：1，京东物流超级快，下午收到货，已经用上！2，买过T1,还是要赞pro.3整个手机其实就是白金版加上一个后壳【因为备课贴上原来的后壳就看不到了】。4，京东送了前钢化膜和京东自己碎屏险，锤子自己网站送充电宝。选择哪个后面的大仙自己考虑。5，支持下老罗，不是说1799不怎么赚钱吗？所以多花三百买点周边。说点不好的，看评论，这个碎屏险是京东和其他方面合作的吧，可能服务不太到位，比如说维修时间，寄送的邮费也报销，流程简化等。总之，支持老罗让赚点钱就买个增值版，不支持就买个1799版，反正他赚不到啥钱，关键东西好物有所值啊！亏死他吧",2017-08-28 19:22:22,66,32,5
永远的顺服,PLUS会员,用了几天，感觉挺流畅，我喜欢一步功能，指纹解锁很快，home键很好用！我买锤子主要是因为我前几个月400元买了个二手锤子t1，体验很好，第二就是现在128g的降价啦，值得入手，第三就是我的现在用的手机（不说牌子，免得被喷黑子）屏幕在下雨天接电话都是问题，划不动烦死我了，左右键经常失灵，耗电也快，使用体验还没备用机锤子t1好，所以我买了坚果pro，支持下老罗！,2018-02-08 16:20:52,1,0,5
兰***1,银牌会员,"用了一阶段才来评价。
首先说一下外形吧。个人比较喜欢那种方方正正的感觉。嗯我感觉是漂亮，但是朋友他们说外形比较难看。
比较喜欢它下面那个小按键，还有指纹。
这样我感觉比较喜欢的就是他里边的一些小功能大爆炸啊，还有闪念一步都比较实用，给我的感觉就是比用苹果方便功能都比较人性化。那个关机的时候直接就可以支付。
要说游戏性能的话，这个是属于骁龙626。性能上要比625好那么一丢丢，把王者荣耀的话，暂时没发现什么卡顿。有两次无响应，其他的软件没有这种情况。
现在系统有人脸识别功能。这个功能用的不多，还一般吧，黑天的时候识别不出来。
说实话，我真没有想到我带来的感觉比我预想中的要好很多。第一次用锤子手机。整体来说，带给我的感觉比较好，有点路转粉。当时买的时候也没有想到他会这样。如果要知道这个系统这么人性化的设计的话，就买pro2了。
摄像功能一直没怎么用过，但是给我的好像是一般般。
平时也不怎么拍照片。也就无所谓了。
续航能力了来说可以。平均如果高频率使用的话，一天最多冲两次。
充电大约在一个半小时左右就可以充满。
最后说建议买2，如果5月份他不出新产品的话，我就入手2。",2018-02-20 08:52:03,0,0,5
j***m,银牌会员,昨天刚收到，感觉罗的手机运行非常流畅，不比苹果慢，快递速度也给力。很满意。,2018-03-02 10:23:24,0,0,5
j***7,金牌会员,"除了手感差，还没发现其他缺点。手感是真的差。用过手机中最差的，另外系统没有Miui贴心易用，不过，这个价格买这个配置的手机，而且是作为备用机，性价比很高了。

最不能忍的是前摄像头，效果太差了，虽说是1600万，简直不忍看。要是摄像头效果能再好点就完美了",2018-02-08 21:02:18,0,0,5
爱***子,PLUS会员,"听了那么多场老罗的相声，这次终于冲动地买了一台！支持老罗，祝大卖！
第一次接触SmartisanOS，用了一天之后才来说一说。
首先颜值高，真机看起来就和宣传视频里一样美！手感惊喜，明明158g，端在手里真的很轻，比S7E轻！然而方正的代价也很明显，双手打字的时候小手指压的生疼。
OS方面，下拉快捷方式效率太低，右划菜单很棒很好用！最难受的是进后台和先后程序间切换太不方便，简直不敢相信这是SmartisanOS的后台体验，分分钟崩溃！当然大爆炸&闪念胶囊非常棒！onestep也不错。
另外，全功能的nfc居然无用武之地，睁着月亮大的眼镜盼望赶紧出个锤子钱包，当然最好还能当公交卡刷?
硬件方面，双摄惨不忍睹，毕竟想要出S7E的效果还需要时间。加油！
最后吐槽一下，配件只有官网能买，好多很快就售罄了，遗憾。下单的一整天了都还没发货，可怜了我的小拇指?
最后，感谢老罗和锤子科技！也许会是家伟大的公司，别膨胀哦~",2017-05-12 20:20:01,10,0,5
b***6,PLUS会员,老罗的手机从T1我就在关注了，几次一直以为他要撑不下去了，最后还是挺过来了，我冲情怀考虑买的这手机。再说手机吧。我一直用的小米手机，米3是移动版的，不用了是因为我成电信用户了，米4不用了是因为16G内存真心没法用微信，小米Note不用是因为触摸屏不定时定位不准，售后检测不出问题来，米5S正在用的原因用的很不爽，抢了3次米6都抢不到。而且去过2次小米之家。服务真心感觉不好。我老妈去了一次小米之家，打电话跟我说，他们服务不好，让我以后换别的牌子手机（全家的手机都是我给买的小米）。小米的情怀差不多消耗的不多了吧。锤子手机硬件不了解，系统的噱头还是有的。外观做工上还是很讲究的，我觉得男人用东西“讲究”很重要，品味是一点一点培养出来的。祝所有用锤子手机男人都越来越有品味。也希望老罗手机能继续走的更远一点！老罗加油！,2017-05-10 09:44:42,194,49,5
我***卖,PLUS会员,手机还没用，不知道咋样，但是，快递员，那就绝对要给他一百个赞。碰巧今天下午在开会。手机调成静音了，他打了八个电话没有接到，听保安说，他在外面等了半个小时，开完会给他一通电话，他说马上就给我送过来，实在是好样的，兄弟谢谢你。???????,2018-02-28 17:57:04,3,0,5
钱***f,铜牌会员,第一次买的锤子手机，坚果pro真是太好用了，目前我用了几天从未卡过，系统也流畅，我很喜欢前置指纹解锁，不喜欢其他手机的后置指纹解锁，这外观真漂亮，指纹解锁速度比苹果手机快多了，大拇指一触碰home健就秒解，赞赞赞！,2018-01-30 11:24:24,9,7,5
大***u,银牌会员,用了三天，感觉还行，没有网上说的那么吓人，但是小bug还是有的，在可接受范围内，不能用手机防水袋就太烦了，会提示请勿遮挡光线传感器，官方客服说后续补丁会调整，希望能把锁屏界面也设置成可以取消，移动信号没什么问题，WiFi信号也没什么问题，王者荣耀低画质是一点都不卡，通话的音量开到最大绝对够用，外放一般，和之前用的乐檬x3是没法比，感觉和一加3差不多，但是用耳机听歌很好比想象的好太多了，就是转接头麻烦，屏幕显示还行，不知道是不是可视角度的问题，直视看屏幕会出现中间白上下边缘微发黄，要是把下面前倾就变成了下面白上面发黄，之前买的魅蓝e2是同样情况，是成本受限吗？但是坚果成像看着舒服些，适应了还好，大爆炸一步还有胶囊就不说了，外观除了下巴都还好，换腰圆键也会很好看吧，至于割手的问题嘛，他就是锐利的他就是割手的，又不会死掉，我是戴套了，前后玻璃翘边是有的，但是贴膜后看不出来，我贴的是官网膜，挺好的，相机简单试了下，日常拍摄没问题，还有还有朱萧木同学啊，你能不能练练口才呀，你看老罗，吗的叨叨叨嘴多好使，直播摔得你也活该，长点心吧，京东锤子这边的客服太差，最后祝罗老师大卖，因为坚果Pro是好手机。,2017-07-15 18:23:52,13,4,5
j***w,银牌会员,刚拆的机，拿在手机感觉好有分量，外观给力，一看就喜欢，就不知道内在怎么样，毕竟第一次用，用过了才懂。,2018-02-23 15:47:14,0,0,5
宽***E,PLUS会员,为什么手拿6s还是买了坚果Pro，因为爱，因为老罗所做的每一个创新，都是特别实用的，特别实用的，比如 One Step，操作的便捷，比如 闪念胶囊，这个是让我非常感慨的，我就需要这样实用的功能，特别棒！老罗说了 锤子是一个软件驱动的公司，这点，我表示深刻的赞同，友商靠的是堆积硬件，只能靠硬件吹嘘，而老罗带给我们的确实每一个痛点的解决方案，我们买锤子不是简简单单的说靠情怀，更重要的是老罗在认真做事儿，我们在认真听，认真理解！,2017-05-10 11:41:35,113,22,5
伊***小,金牌会员,一直想入手锤子手机，对系统感兴趣，正好赶上优惠活动，950到手。总体不错，确实有点割手，用惯了苹果，手感不大喜欢锤子的棱角分明。很滑很滑很滑，重要的事情说三遍，第一天就摔倒地上了，辛亏没碎。系统没让我失望，买来当备用机的，感觉绰绰有余。价钱在这摆着了，性能对得起这个价钱，拍照比较弱。同时买了坚果和红米，红米我妈用，见过我用。使用后同价位还是推荐小米的红米5plus，不解释。价钱都是999。京东快递速度还凑合。,2018-01-26 16:51:29,4,2,5
喂***鱼,金牌会员,手感不错，系统流畅。指纹解锁快，就係面部识别，比较差，仲有待改进。,2018-01-31 16:13:42,1,1,5
s***g,钻石会员,2018秒杀了两台，从锤子t1转到坚果pro。不带手机壳手感非常的好！因为之前有摔过，屏幕碎了。所以这次不带手机壳，坚决不敢用。今天拍了手机壳，等手机壳到了再用吧。手机的面部解锁还是挺快的。我感觉比指纹解锁快。系统方面不用多说因为锤子优化的特别好，我用的是锤子一代，现在用着还是很流畅的，就冲这一点也要支持一下老罗。,2018-01-18 15:31:26,38,36,5
j***g,金牌会员,第一次用锤子手机，金属机身手感锐利，指纹收集器并非浪得虚名，屏幕色彩不错，用了一个多月系统没有卡顿，不玩游戏的话性价比很高。,2018-03-03 00:06:39,0,0,5
jd_npz3,PLUS会员,买一个给老爸，主要需求就是打电话，存号码。也可以给家人拍拍照。之前移动公司送的都很垃圾，很卡，老爸就只能用老年机，拍照也叫不可能。字体设置最大，声音震动都是最大，保留计算器等基本功能，其他附加软件都被我删除了，简化使用界面。让我老爸也能看看新闻，用起智能手机。不错。等待进一步使用。,2018-02-27 17:23:46,0,0,5
战***天,PLUS会员,速度不用说还是一如既往的快，开机速度比我的HTCU11+速度快，其他的待使用用再说，,2018-03-02 21:26:31,1,0,5
秋***爷,银牌会员,手机很完美！手感非常舒服、帮朋友买的。朋友很喜欢,2018-03-05 13:21:23,0,0,5
jd_159510ehb,银牌会员,京东自营快递速度的确没得说，当天就到。但是手机质量真的不敢恭维。1、如视频所示手机屏幕底边存在这样的缝隙，不管是否影响使用，但给我的感觉就是垃圾。2、待电时间巨短。我不知道是不是天气原因，这个手机从我买来基本就没怎么玩，主要就是晚上下班回家打打游戏，每次回家手机的确是很凉很凉，不知道这是否会导致待电时间变短。不要说什么轻重度使用的区别，谁还没用过几个手机啊，轻重度使用我自己不知道么。明天我会把手机充满电，放在家一天，测试待机一天会耗多少电,2017-12-11 23:08:32,26,20,1
j***儿,PLUS会员,"本来没打算买这手机的 因为我觉得这pro没有达到我的配置要求，谁知道我的前任手机提前下岗了。买之前的前两天一直纠结苹果7，一加5,最后还是选择了坚果pro。
    体验几天下来，非常满意，远超我的想象。给我的感觉就是老罗真的是在用心做手机。
   1.系统体验那是非常流畅，开了很多软件，不清后台也毫无卡顿.
   2.一直渴望已久的一步功能，大爆炸功能，胶囊功能，图钉功能，用完之后几乎离不开了，还有拨通电话后我发现通话面板还把便签也贴在了上面，方便边打电话边记录，真的是太贴心了，一种感动突然涌上心头！感动了
   3.照相和摄像我用的少，不参与评论。
   4.电池非常耐用，不玩游戏的情况下，亮度够用的情况可以一直用10来个小时还有电量，很棒
   5.我看到很多恶意评论，是我一直未买这手机的主要原因，现在我也想建议犹豫还没买的朋友，这手机真的值，特别是系统，用着特顺心，非常满意的一次购物。终于找到心仪的手机
    6.支持老罗，支持锤子科技，希望继续为用户体验做出更好的手机，当然做工再更上一层楼就更完美啦",2017-08-02 15:40:02,44,12,5
重***1,PLUS会员,运行速度还可以，感觉没有我这个魅族的快，反应有点慢。性价比很高，有一点割手，还好能接受。手机挺滑的，举着打电话一会就要滑下去了。双面玻璃，放到桌子上有些人估计都拿不起来。还有人脸解锁挺高级的，很新颖。不过这个大黑边真的是很累眼，没有那么大黑边就好了。,2018-02-03 17:14:32,0,0,4
我***名,金牌会员,用了十天左右才来评价的。每天使用导航比较多，一部手机又打电话，又导航，实在不方便，就入手了这部坚果。之前使用过两部锤子，都还比较满意，这次双十一降价，入手了坚果Pro。首先颜值肯定是不低，双面玻璃，纯黑色，超喜欢，系统也流畅，看着也顺眼，电池大，超耐用，一天重度使用下来，还有将近百分之四十的电，最不满意一点就是我感觉买到了二手货，拆开指纹处有一块胶，擦了老半天才擦掉，有图有真相！！！,2017-11-11 03:12:14,9,2,3
美心303354535,银牌会员,手机不错的，系统感觉需要学习一下魅族吧，看看魅族的home键有哪些功能吧，下拉需要从屏幕顶部才行，上拉不是多任务，需要连点2次圆键才行！优化一下系统吧，圆键少用点吧。拍照还可以，图中有夜拍，航拍有玻璃（有点花）隔着，吃鸡啥的完美运行吧，反正128g随便安装软件，存那种电影，你懂的！我有资源哦！手机开机和联网就激活了，不能退货了！细节有图:屏幕左右两边不平行，看图吧。客服要我去检测一下，手机我还要用啦！不去不去了！话说没有保护套装的，找客服要吧！这个还不错哦！我慢慢熟悉锥子的系统吧！,2018-03-07 10:53:11,0,7,1
天***习,PLUS会员,"下午刚收到,昨晚十点拍的,买给我老爸的,之前我朋友是罗哥的粉丝,一直给我推荐锤子,然后我爸刚好要换手机就给他买了一个。
1.系统很棒,体验了一下大爆炸,一步还有闪念胶囊,其中感觉一步这个功能超棒,很赞!给英语老师点个赞!
2.外观也很好看,设计很棒!可能下次我就会选择锤子了?
玩了两个小时把系统熟悉了一遍,其中有一个问题,就是在看网易云音乐视频的时候(不开全屏)控制音量键的时候会出现媒体音量,电话音量,以及屏幕亮度三个选项,并且调节之后会有一秒的淡出效果,对于这点感觉很不爽,把屏幕都挡住了...可能系统里面有这个设置我还没发现~
希望锤子越来越好,综合分数如果十分,我给八分~这个价位感觉很划算了。",2018-02-25 20:28:13,5,2,5
希***惠,PLUS会员,"第一，首先感觉锤子坚果的屏幕摸起来很舒服，和小米机子差不多，外观和曾经经典的苹果4S颇为相似。
第二，同样的用红米Note3的机子，红米屏幕淡黄色，锤子还行，声音也大。摸起来比红米5plus舒服多了。也比荣耀7X的屏幕舒服！
第三，无线连接锤子没有断过，红米就会时不时的断开一会儿。
第四，锤子的应用商店里面只有360换机助手可以用，换机精灵安装不上去。不过还不错两个手机?用了十几分钟倒了资料。
其他的用法还在摸索！感觉挺好的！希望国产黑科技手机干翻外国品牌！",2018-03-01 22:00:31,4,0,5
k***r,银牌会员,中午到的，总体不错，使用后后台退出不知道哪里，摄像清晰，色彩淡，音质没有以前用的vivo好，，在研究中，，，，,2017-12-18 17:19:43,12,5,5
虎***丶,铜牌会员,我很喜欢人性化设计 直面外表也是我一直追求的 64G足够使用  其实是54G，卸载一些不常用的。手机足够流畅，割手不存在的，总之不错。快递员杠杠的,2018-01-25 13:13:22,12,4,5
地***蓝,PLUS会员,运行很流畅，很漂亮的机子，系统很好用，类似苹果系统，简洁高效。唯一觉得不爽的就是，秒杀时1199元，第二天不秒杀还是这个价，还多送官方原装手机壳和钢化膜。这秒杀等于骗小孩。,2018-03-06 15:24:28,0,0,5
j***c,银牌会员,东西总体来说，还是不错的，买过来是用来备用的，一千多，感觉还行，最主要双卡双待，蛮好，外观是不错，但是是有点割手，平时用的苹果，突然用这个手机感觉很新鲜,2017-11-22 22:10:50,19,4,5
安***熊,钻石会员,给老丈人买的 ，还没使用，送货速度很快，用过之后再来追评吧,2018-03-03 11:08:50,0,0,5
枫鑫无敌,PLUS会员[试用],"有点：
1,屏幕清晰
，2,外形方正，
3,1300+我觉得很超值，4+128良心商家 。
4,配色在千元机里属于上等  
5,系统流畅
6,界面苹果风，所以我听习惯

缺点：
1,用惯5 再用这个手机出克打字不好用，
2,照相机镜头比较一般，
3,两边玻璃不耐磨，一周出现细小条纹.
屏幕周围黑边还是比较大，稍微隔手，但是没有太大区别 ，没用过圆润的手机，所以感觉没问题  
4,输入文字效率其实不高。可能是我还没用惯。
总体推荐，相比于红米5plus 和魅蓝我更中意这个外观，但是摄像头和花屏不带磨玻璃。要思考一下了  夜拍能力请看样张，全景渣到爆 视频请看我拍的",2018-02-27 12:17:16,1,0,5
f***i,金牌会员,"入手新手机@坚果手机 坚果Pro，体验感受非常好:
1.指纹识别秒杀苹果、三星几条街，太速度了。2.外观惊艳，我的是巧克力颜色，当时看网上图片丑的不得了才买的（目的是不想太依赖手机，买个自己讨厌的颜色，戒掉手机瘾）没想到到手后发现真漂亮，比网上宣传图片还漂亮，现在手机都不离手
3.闪念胶囊、一步、大爆炸等应用非常人性化，很适合我的爱好。
4.拍照效果很漂亮，以下照片就是今天在花店测试的。
5.相比我之前的三星s6edge耗电量都没法比，三星s6edge一天到晚都离不开充电器，同样的玩法坚果Pro充满一次基本上用一天。",2017-09-24 12:15:09,47,23,5
jd276988blr,金牌会员,挺好，运行速度快，老罗开发的一些系统挺好用的,2018-03-09 14:13:11,0,0,5
北***哥,PLUS会员,一次性买了两个，一个是128的，是64的，质量非常的好，系统也很流畅，128的下了好多好多的电影，很赞很赞,2017-11-17 23:35:15,13,4,5
侯***超,PLUS会员,"锤子手机我从一代，坚果，没用过t2,买的锤子m1l，锤子手机系统还是很不错的，系统越来越流畅，功能越来越完善，昨天晚上在发布会直播的过程中，当时弹幕中有人说定了，我赶紧到京东和锤子官网来看，发现京东紧锣密鼓在开卖，颜色还没发布，我看到三款，一开始我看酒红色很吸引我，我先拍了，后来看发布会过程中还有线条红，尽管贵点，但我还是很动心，我比较崩溃了，赶紧试着把酒红色64g的退了，赶紧定了128g线条红的，尽管加了500吧，晚上又有点犹豫，图钉功能也没发出，我本来就有两个以上手机，去年首买的苹果7plus，女朋友留下来苹果6，我做销售两个手机号就够用。因为之前买的锤子m1l高配版本的，连碎屏险一起3199，最后二手卖了1800，晚上想了半天，我又做了个决定，又决定申请退了吧，两个手机够用了，以后再说吧。早上醒来，想了一下，快递已经到家门口了，想了想定一个吧，要不白看发布会了，把别的手机能处理处理了，或者卖了或者给家人，既然看好了，就定了，好好用，锤子的人性化我觉得给我生活会带来很多便利，之前给父母的坚果手机的远程协助我很认可，每次都支持锤子，支持锤子也是支持自己，这是我第一次写评论，想好就定吧",2017-05-10 09:54:38,210,36,5
l***1,金牌会员,手机非常的惊艳，这五分是给老罗的，在最初的时候，当时只是系统的时候，就非常关注锤子，那么现在入手了，锤子，结果没让我失望，手机非常的漂亮，在千元机里面这个价位绝对超值，电源也非常的给力，昨天晚上关机充电至百分之百，今天早上7点到晚上6点。开热点，共享wifi，一天时间，还剩下33%的电，电池还是很给力，就是不知道未来怎么样，在蜂巢柜中取出快递，包装破损！包装破损！包装破损！包装破损！,2018-02-03 17:58:37,1,1,5
的***l,PLUS会员,"嗯，第一次看老罗的直播，也第一次买锤子手机,下面说说我的感受.首先，外观漂亮的不像实力派,呵呵?！坦率的讲，外观有这么漂亮，你还要我怎么样！各位镇定一下，第一，它的续航能力超强，大爆炸功能很适合商务人士好，想高效写作的人和高效利用时间的人，one step一步到位,方便。已读搜图和以文字搜文字！还有各种小功能，比如模拟来电，还有回复退订，还有图钉功能！最重要重要重要的事，嗯，还有闪念胶囊功能，这个功能很好用，但是只是试验版的，我用了一下，注意注意注意这个闪念胶囊功能反应还是不够灵敏啦所以算一点点小不足了，说了那么多，我也不是锤粉，只是实话实说而已，供大家参考！",2017-05-12 08:00:29,10,6,5
-***首,钻石会员,一下子买了五台的，自用一台，其他送家人，黑色的那款送人就没开封，但是都一样的，只是颜色不一样而已，这手机性价比真的很高，比同价位同级别的国产其他品牌都好得多，我也是听了身边其他人的评论之后再三斟酌才买了坚果，没让我失望。我用俩手机，还有台自用的美国某果6sp，同一时间和坚果一起跑分，居然分数才十几分之差，可想而知性价比了。也很喜欢这个系统。千元机这是不二选择！,2018-03-06 16:30:03,0,0,5
j***2,PLUS会员,一直想试试锤子的系统，今天和同事一人买了一个，使用了半天下来，感觉系统非常流畅，功能强大，赞一个。,2017-11-02 15:19:11,21,2,5
lissa9273,银牌会员,在老罗发布会那晚就下单了，用了快一个月，来说说我的感受。首先，赞一个京东的快递速度！睡前下单，睡醒就到啦！包装很漂亮，可以看出花了心细，手机边缘有点割手，买了个手机壳，完美解决。说个小缺点，夜间屏幕太亮了！要自己手动调节亮度，但是调适前已亮瞎狗眼了啊！这点和苹果有一定差距！手机开机速度不错（或许是新机子的缘故），关于充电问题，第一次充了八个小时才充了百分之二十的电，这不科学啊！于是我换了苹果头充，一小时充满妥妥的！后来我才发现是电压的问题，充电头很重要！我这个手机重度患者，苹果一天至少3充，坚果倒给了我惊喜，一天用下来只要充一小时就够了，如果不常玩游戏的人一充用两天是没有问题的！还有home 键的触摸返回功能真的qiao好用好嘛！原本担心苹果转安卓要有磨合期，后来发现自己完全想多了！一锤入手，脱不了手！说实话，我不是锤粉，仅仅只是喜欢看书，喜欢码字，于是看到了坚果，觉得值得买就买了！！噢！忘了说信号接收问题！比苹果略差啊！很多时候同一个位置，苹果打开网页无压力，可是坚果不行，不过价格毕竟摆在这儿了！总之对于国产机来说！我很满意！,2017-05-31 12:53:34,4,1,5
