名字,会员级别,评论内容,评论时间,点赞数,评论数,评价星级
淡***浓,PLUS会员,"品锤有感！
慢慢讲，T1首发用户，T2先后入手两台，坚果Pro用的时间并不久，玻璃与金属的硬刚确实不能让我这样的部分用户所接受。够用的配置还是悄悄逊了那么一点点。
全新Pro2虽然不是首发第一批也仅仅拖了两三天时间。
一：全新外观，正面玻璃曲度很小的几乎全面屏达到国内主流偏上水准，正面几乎无开孔，顶端居中前摄，左侧隐藏式光感，右侧极难发现的距离传感器，顶端玻璃切割掉一块小小刘海放置扬声器。圆角屏幕配合圆角机身完美。
二：背面玻璃面板曲度略大于正面颜色纯正，配合指纹识别LOGO创意满分。大小摄像头的搭配也符合罗老调性。就是简约！
三：边框就仁者见仁智者见智喽，这条线有点反强迫症的意思，比如我。因为它不能全部贯通，比如SIM卡槽。四个天线注塑点的细节略有瑕疵。扬声器与麦克风的底部开孔不如正圆形来的精致，扁长椭圆是为了与数据充电口相搭配？
四：系统与软件相信是大伙选择锤科的理由之一，至于好不好用只有你自己来评判。个人用起来比某些835旗舰要流畅，后台杀的没那么及时。
字数有限说说不满意的地方：铝合金中框喷砂略粗，手感与观感都不是很精致。屏幕边缘触摸不灵敏。三大天王期待手势方案。
打完收工",2017-11-11 23:11:06,1194,564,5
G***s,钻石会员,京东到货真心快，昨晚看老罗发布会，过程中看到弹幕说京东已经开卖，马上去京东抢了一台，这是我的第二台坚果了，无关情怀，单谈做工，两个字，完美。就像工艺品，网上有讨论红线不好看的，建议你们看看真机。说说体验，本人数码控，之前一直用果7，由于下半年智能手机兴起了全面潮，就想买一台感受一下，刚上手感觉有点大，不过全面屏（almost～哈哈）的显示效果确实棒，续航和快充的性能还没有测试，之前就特别喜欢闪念胶囊的功能，这次在机身的侧方加了实体按键，更方便了，点个赞。锤子的系统，不用说了，这次又特别关注了视力障碍的人群，真的是非常的暖心。外观加系统，趋于完美。感谢锤子科技一直用心的设计，感谢老罗不放弃的品质，追求完美的精神。祝京东越来越好，祝坚果pro2大卖！照片拍的有点糊，各位看官将就看一下哈。,2017-11-08 14:12:30,987,317,5
M***t,钻石会员,"#漂亮得不像实力派#16号预定23号到货，上手几天后来说说个人使用感受。
1、系统:对于老锤用户来说不多讲，没有一鸣惊人那种惊艳却有着使用过程中惊喜不断，哇哇直叹的感觉。像一步，大爆炸，闪念胶囊，系统贴心小设计很棒，建议初次接触的朋友们可以搜索视频(smartisan 细节集锦)会有更直观的认识。
2、外观:上手握持感不错，轻了点，四周做了圆润带有弧度的过度，不像上代这么锋利割手了(参见图8)。酒红色双面玻璃有种晶莹剔透感觉，正面上下边框都是酒红色，要更骚了。
中间的金线起到种画龙点睛的感觉，这个设计值得点赞，很特别。金线＋边框在特定光线下还能产生反亮光。
侧面实体按键有种索尼既视感，指纹识别+LOGO二合一那个区域平整光亮，玻璃的，没有凹凸，纹理。
3、使用几天的过程没有出现死机，很卡的，660的处理器+6G大内存估计保证了系统的流畅性。
4、拍照依旧是弱项，但也足够满足生活所需。前置美颜的加入扩充了受众人群。就譬如我。
需要特别说一点:大家注意到屏幕下方那三个虚拟键是可以完美去除隐藏的，买张智能前屏贴膜贴上就可以实现导航键下移到下巴边框上，科技满满，强迫症完美的不二选择坐等京东上线",2017-11-28 21:07:41,471,171,5
沧***鸽,PLUS会员,"刚刚加入锤子用户行列，之前对锤子了解不多，直到最近才开始关注pro2酒红色手机，前些日子预约都没抢到，可见大家对这次老罗的新品还是比较认可的，终于在第三次预约并成功拿到手机。
    迫不及待地打开手机后一下就被整体外观惊艳到了。酒红色色彩很正，而且是玻璃质感的平面，在灯光的反射很透亮。手感不是太重，但也不轻，重量正好。正面（未开机状态下）非常简洁，只有顶部中央一个1600万像素摄像头，支持面容解锁，简约实用大气！背部logo与指纹识别融合到一起是一大创新。机身侧面一圈金线个人觉得并不突兀，手机侧斜着看还挺有设计感的。侧面按钮都是小圆型钮，与机身一体，整体感好。
    至于操作体验只是开机小试了一把，smartisan OS有很多特色的功能，例如One Step、Big Bang和闪念胶囊，感觉挺好用的，体验一段后可再来续评。
    另，pro2 很苹果一样没有设专门耳机插孔，包装有附送3.5mm的音频转接头，减少了插孔，这应该是个趋势。
    总之，这款手机性价比很高。应该是国产机中的良心出品！",2017-12-05 13:21:07,76,43,5
h***k,PLUS会员,菠菜说：听了一场老罗的发布会，在小米Note3与坚果之间选择了坚果pro2，主要是备用机，选了4加32的，主力机建议64起步，赞下京东锤子节1700减150加上满1000减150，1449入手，送了心动耳机和49的壳，660加AL全面屏独此一家。大方向体验就不说了，有选择困难症的去看科技美学fview小白大米评测。看了那么多视频，总结下对比小米NOTE3，拍照是痛点，对系统稳定性，售后，耐摔性手感有需求的选小米；全面屏是痛点，喜欢锤子外观，想要用手机处理些文字编辑的选锤子，荣耀9的话就更水桶机一点。说些细节体验，1面部解锁，白天很快（关闭桌面动画），比指纹略慢，识别率高，昏暗灯光识别率低，基本不可用。2外观金线其实不用纠结，大部分场景都比较难察觉，只是在某个角度能看到，好不好看见仁见智。3系统误触率较高，主要是手势操作的逻辑导致的，为什么苹果X底部有条细线是经过很多考量的，但是手势操作习惯了后给好评。4屏幕识别率对比mate10低。5拍照，白天能用，色彩倾向于还原真实，虚化用了虹软算法观感不错，虚化质量一般，暗光环境噪点很多，特别是前置不好用。6外放听人声中频还行，电影声大低频会爆音。,2018-02-09 11:02:39,68,31,5
l***z,钻石会员,昨晚发布会坚果pro2展示那一刻就被外观深深吸引，logo和指纹的完美融合这才是工匠之美，目前也算是全球首创啊！捶子科技真的是做到了把不可能变成可能。直播时看到有人说京东捶子旗舰店已经可以预订购买了，直播没看着立马就去京东逛果然有现货，那当然是马上下单。下完单显示第二天就能收到手机，昨晚是期待了一晚上兴奋到都失眠了。但捶子果然没让人失望，今天收到货马上开箱，见到真机那一刻不能用开心来形容，外观惊艳无比，简洁的美让人感觉这是手机吗明明就是件艺术品，太喜欢了。目前还没激活试用，就写评论了，其实是想在第一时间和捶粉们分享我此刻的愉悦心情也希望捶子科技越来越好。后期试用后再追加用后感受。,2017-11-08 13:20:27,368,101,5
山***奇,钻石会员,真的是漂亮的不像实力派。之前特抵触安卓系统。从苹果4S 用到苹果X。中间用过一次三星。用了两三天 爱嘛这给我卡迪。从那之后就一直用苹果。而这次看了老罗的相声 反复的看了闪念胶囊 一步 大爆炸等介绍 终于按耐不住了。其实我都不知道锤子出新手机了。看到这几个功能搜了一下 发现刚出新手机。就买来试试。刚上手 发现几个功能挺实用的 解锁也很快 但还是害怕用久了会出现卡顿的情况。总知这手机挺好。是个实力派。,2017-11-20 11:36:17,147,52,5
芒***嘎,PLUS会员,已经很久没有用过安卓手机的，这次为了体验一下老罗的黑科技特地买来试用一下。首先是外观，真是做的很出色，明亮，手感好但是细节方面有待提高，没能做到精致，还是带上原装套吧，免得启用碎屏险；体验了两天系统，速度惊人，感觉碾压了iPhone8，一些特有的功能也很有意思，“闪念胶囊”、“一步”都很有自己的特点，但是系统的耐用性是由时间来考验的，这次收入坚果pro2就是要这次感受一下安卓这么多年有没有进展，追评肯定是要做的；最后说一下充电，原装配有快充适配器，从1%的剩余电量到充满用了一小时左右，充电速度确实不错，3500mah的大电池目前使用一天不成问题。照相功能等追评时补充吧。,2017-12-07 00:35:42,26,4,5
w***a,PLUS会员,作为坚果pro一代的用户。在看到坚果pro2代的，手机发布会后，仍然忍不住又订购了一台。拿到手机后，果然没有令我失望，一代存在的一些问题基本都解决了，首先，一代手机感觉比较厚重，拿在手上有坠手感，对于女孩来说还是太大，不好，一手掌握。作为成都人，锤子的图标干净简洁。我不觉得这个名字有什么问题，毕竟各花入各眼，你心里有什么你就把它看作是什么？不是吗？坚果pro2代的体积仅仅比我的荣耀八大了一点点，但是设计却非常好看。具体功能等试用后我再来追评，初步外观评价非常满意。不到两千元的手机，性价比已经是非常可观了。支持锤子支持罗永浩。,2017-11-08 13:32:50,196,58,5
1***p,银牌会员,关注锤子手机已好久了，坚果pro1本想入手，忍住了，这次双11入手了坚果pro2浅金色，浅金色太美了！面部解锁太给力了！指纹也给力！老罗加油！期待T3的更大惊喜！加油！加油！加油！,2017-11-16 14:09:32,39,14,5
g***p,PLUS会员,挺不错的...我算是成功被老罗忽悠的苹果用户转化成安卓用户的人...提前一直用苹果手机.没买过任何安卓手机用..今天算是正式加入安卓阵营..确实手机做的很不错..但是作为苹果用户..安卓的输入法习惯很不适应.,2017-11-08 11:19:30,92,42,5
美***为,金牌会员,"手感不错，支持老罗！
屏幕黑边还是比较严重，不过这个价位已经很满足了。
人脸识别还要把按一下侧边按钮，多此一举吧，按下的功夫可以指纹识别了。建议加一些手势操作。",2017-11-14 13:46:58,56,47,5
j***f,金牌会员,看了多年的相声，第一次使用老罗出的手机。使用了一晚上近4个小时只用了百分之十几的电。就这一块是完全没有问题的。当初买手机时也是考虑到它的系统，还有外观。外观的话当然没话说了，大家也能看得见，确实很漂亮。（其实男的用红色也挺好的） 他这个系统对于偏极客用户来说是非常有吸引力的，有很多新颖的点，而且确实很多地方很实用的。我昨天手机到了拿着琢磨了一晚上，确实还是蛮有趣的，相比于其他一些，不管说是苹果也好，还是其他安卓手机有趣的多。Good job 老罗！,2017-11-18 11:47:49,11,1,5
jd小呆珠,PLUS会员,"说以下几个方面吧
1.手机外观真的很漂亮，很薄，有金线后更好看了
2.性价比很好，属于那种高配低价的手机。这种配置这个价位还是不多的
3.锤子对系统的优化可见一斑，低耗能，很流畅，几个特色的应用都很好用。
4.购买建议吧，对于那种对手机要求极大高的，可以考虑再加些人民币，毕竟一分价钱一分货。没有两毛钱的钻石。
5.手机系统还需要进一步优化，可能是新系统，还有需要向别人学习的地方。总之，已从果粉转为锤子粉，加油，我们的情怀。",2017-11-10 15:10:22,23,5,5
h***1,PLUS会员,#漂亮得不像实力派#，双十一晚上十一点多才下的单，买的128G版的，之前用的苹果5s用了三年了，是该换换了，性价比最高的应该是64G版本，不过应该还得抢，深受5s 16G版内存不够用的困扰，这次直接上手128G版，可以存些小姐姐的视频了，哈哈?，第一次用锤科手机，本人对手机没什么很高的要求，更是很少拍照，相信这款机子会令我满意。,2017-11-14 14:09:17,33,6,5
K***8,金牌会员,已经很久没有为一款手机冲动消费了，这次我光看宣传海报就有购买的欲望。4+64暂时是最有性价比的版本，推荐大家购买。骁龙660加持的pro2安兔兔跑了波分115562，玩了把荒野行动没什么压力，王者荣耀也支持高帧率，很流畅。很喜欢人脸识别功能，很实用。开始看别家评测还觉得中款。部分的细红线挺丑的，拿到真机后还能接受，还蛮有特色的。反正上手把玩后这个价位各方面无敌。最后祝老罗大卖,2017-11-08 21:10:50,20,11,5
赵***_,金牌会员,面部识别挺快的，用惯了苹果，偶尔换一下好久没用的安卓挺好的，主要是电池啊，全面屏啊，本来想买酒红色的，没货，送货速度真的特别快，早晨五点多下单，下午三点多就到了，好久没在京东买东西了，算是给自己的生日礼物吧。,2017-12-09 19:01:41,12,5,5
M***L,PLUS会员,一这几天忙，忽然发现pro2发布。赶紧去京东。前几次都买不到。一直提交订单。终于成功ing。第二天到货。看了网上的发布会。确认很用心！手感和上一代比有很大提升。一个摄像头和上一代比确实美观了。希望照相短板补齐。配置我选择6GB 64的。绝对够用。屏幕接近全面屏。指纹logo合二为一。支持老罗，必大卖！,2017-11-11 12:07:54,6,0,5
承***i,银牌会员,perfect！完美！真是漂亮！之前看上了坚果Pro想买的，但是要出新品了就忍着等着Pro2出来，现在出来了大量缺货！想买别的都没有，想死的心都有了！第一次使用锤子坚果Pro手机，感觉挺不错的！手机我还得慢慢研究！喜欢得不得了，我老妹说好漂亮，她也好想买！,2017-11-10 14:32:38,13,16,5
j***4,金牌会员,外观不错，手感也很好。运行速度很快很流畅，玩农药和吃鸡无压力。指纹解锁也很快，唯一觉得显示效果还差那么一点，毕竟一分钱一分货吧。支持锤子手机，期待下一代T3，希望带给我们惊喜！,2018-03-09 17:12:46,0,0,5
j***m,银牌会员,买手机的朋友们！千万注意了！我买了，倒霉死了！后面松动！前面贴膜是用了液！进液了！他叫我换屏要钱！800！我买了碎屏保险2年的！居然说不行！还有后面摄像头角落松动！我昨天下午才开封的手机！这么倒霉！看照片！看视频吧！,2018-03-08 10:40:35,1,0,5
喜***得,银牌会员,#漂亮的不像实力派#今天早上拿到的，下午开机看了会，总体来说，这款手机很不错，罗老师，太厉害了，你们的研发团队niu66哒，配置上我用安兔兔只测了10万多分，不算满意，还好我不玩大型游戏。给你们点个赞。?,2017-11-16 16:46:24,7,4,5
范***吽,PLUS会员,在光线良好的条件下，Pro2面部解锁和iphonex有的一拼。也试了一下，在较暗的环境下也能解锁。但是在全黑的环境下就无能为力啦。手机刚上手，流畅度还不错。手机四周的金线是内凹的，时间久了不知道会不会积灰。相比较手里的小米mix一代和iPhonex的话，pro2握在手里的感觉会比较轻飘飘，总体来说还是不错的。,2017-11-08 12:01:43,47,20,5
夏***铖,PLUS会员,"不得不说坚果PRO2是锤子完成度最好的一部手机，之前纠结了很久要不要等T3,最终还是没忍住啊，相比坚果PRO手感好的不是一点，这次锤子可能真的要成了。",2017-12-05 19:32:02,7,3,5
Z***I,金牌会员,物流很给力，晚上十点半下单第二天早上就收到了，外观颜值很高，玻璃质感很滑腻，拿着不重挺舒服的。但是，“但是”还是来了，我之所以没给五星，是因为扣掉的一星是屏幕，屏幕在斜对角倾斜看会泛白，使用过程中也觉得屏幕有拖影，长时间用着真的有点晕车的感觉，我两年前的pro5这种屏都不会这样，不知是个案还是因为这个天马屏的素质就这样，反正激活也不能退了，外观啥的也挺满意的，试着用用吧，毕竟颜值即正义。,2017-11-23 08:23:44,9,2,4
爱***8,钻石会员,先说缺点，指纹识别反应不是很灵敏，没有荣耀快，但是可以接受，指纹键做的偏了，后背是玻璃的，盲解的时候会有按不准地方的情况，其它都不错，最好的地方是后盖的缝隙，比荣耀9做的强，最大的优点感觉就是屏幕够大，机身够窄，第一次用锤子，感觉不错。顺便说下菜单栏的任务键好小…,2017-11-12 13:54:55,9,3,5
s***a,金牌会员,"双11买买买！买了1999红色版真心漂亮！
1,全面屏颜值很高！指纹和标志合一的设计，正面隐藏感应器等设计赞！摄像头有突起，不过隐藏小摄像头设计也值得赞！指纹收集器！
2,后盖不肯定是不是玻璃，也比较收集指纹。单手握持还ok可以接受。由于设计多棱角，还是有轻微割手。屏幕到边框过渡还算自然，割手感其实来源于轻微比屏幕宽一点的边框。有点滑，不戴套比较危险。
3,屏幕显示效果还不错，显示细腻。18.9真心长，看视频一流。外放声音够大，没明显破音。界面滑动流畅顺滑，不知道660用起来怎样？
4,虽说同价位上配置并不有太大优势，不过胜在颜值！系统也值得期待一下下。
5,配件快冲加数据线，快冲最快高12v,1.5a。还有5v,3a。9v,2a。以上就是开箱感受。",2017-11-13 20:26:16,10,7,5
骑拖拉机上华山,金牌会员,物流速度非常快，手机没什么新意，像苹果4的加长版，自带软件太多了，占用了很多内存，流畅度敏感度都不好，新机就流畅度这么差，用三两个月还不卡死，总体评价**手机一部，建议不要这款，而且我拍的是运行内存6的都这么卡，,2017-11-11 18:37:52,288,380,1
s***0,PLUS会员,摄像头上方好大一条缝，充电发热，屏幕与边框结合处缝隙较大，做工和i7p还是没法比的。不过这手机让我改变了对国产手机的看法，还是小小的惊艳了一下下，备用机足够了，使用一段时间之后再来评价,2017-11-26 16:25:58,10,14,5
匿***凯,银牌会员,给女朋友买的，物流很快，第一次入手坚果，入手的第一感觉很惊艳，外观是用过的手机中目前最完美的手机，运行比较流畅，因为刚拿到，还有很多功能不知道怎么用，总体来说红色比较适合女孩子，满分,2018-02-27 15:51:05,3,0,5
高***谦,银牌会员,第一次买坚果，朋友说好用就买来试试，真的挺好用，面部解锁很快，背后的这种屏简直是指纹收集器，拿了两三分钟后面已经花的不成样子了，明天贴个膜去，总得来说挺好的，便宜，学生党的我也买得起。,2018-03-09 15:26:34,0,0,5
JD-L-xu,银牌会员,"作为一个纯白色的pro2买家，我放弃了但是红色和黑色赠耳机和手机壳的诱惑，毅然决然地选择了这一款纯白色。
的确，纯白色漂亮的不像实力派。从3月2号，开始用了一周，直到今天倒水的时候不小心弄上了吓一跳，但是即使擦干后却安然无恙，我觉得是时候可以评价了。
手机的速度比较快，大屏也给人很好的视觉感官。关于有些人说的屏幕漏光，进水，手机断裂的问题都没有，而且觉得达到这种目的也不容易，极大程度是人品问题，或者人为因素。京东方的屏。大爆炸，一步也比较好用。主要特点还是美，纯洁美要成为老罗的粉丝啦?
但是手机也存在一些问题。第一，用电真的很费，而且后台也不怎么彻底的关，关了还在运行。第二，有的时候wifi连上用不了，要多连几次才行，不知道别人是不是。第三，就是太美了，诱人犯罪的美感。万一哪天因为太美走丢了，你们锤子是不是要负责任呀！?",2018-03-08 13:09:49,1,0,5
四***黑,银牌会员,给姐姐买的，续航据说不怎么样，掉电快，不过快充充电也很快。自己把玩了一两天，说说感受。首先手机确实很漂亮，颜值满分，指纹和logo融为一体这个想法非常棒。其次系统相对于其他国产定制系统真的好用很多，闪念胶囊，大爆炸，一步真的领先别的厂商很多，工匠精神的表现。拍照方面在同价位也算中规中矩，前摄像头面部识别使手机使用效率更高。最后说说比较大的缺点，手机激活前屏幕底部两端有两个小黑点，不过激活后会消失。还有就是屏幕圆角给人的感觉不是很圆润，仔细看总有点瑕疵。pro2给我一种当年乔帮主在iPhone上的工匠精神！看好即将更名的锤子科技。,2018-01-23 21:16:48,4,2,5
摇***羽,钻石会员,我买了这个手机以后就被老婆抢走了，只能给她先用着吧。,2018-03-09 15:45:15,0,0,5
轻***丶,金牌会员,运行流畅，分辨率高，质感不错，第一次用锤子，系统摸索中。性价比高，外观好看，漂亮的不像实力派！?,2017-12-07 21:11:13,10,1,5
ohoho777,钻石会员,#漂亮的不像实力派#虽然以前从来没有用过锤子科技的手机，但是一直有关注老罗和他的产品，这次看了坚果pro2的发布会后心中长草，后来又去线下体验店体验和把玩了真机，终于决定入手。京东物流一如既往的迅速，到手之后已经使用了近半个月，不得不说，坚果pro2是锤子科技有史以来最均衡的手机，不仅解决了上一代产品令人诟病的短板，各方面的实力也在同价位的手机中出类拔萃，再加上出色的外观设计，以及简洁却易用的系统，罗哥这次要成！这个朋友交得值！,2017-12-07 21:46:25,14,2,5
bryanvae,PLUS会员,"颜值不用说了，网上舆论基本能给到8-9分（满分10分）。优点:太多了，主要是指纹和锤子logo完美的结合到了一起，正面边框控制得比x和mix2窄，本来以为6寸屏会很大，和m1比了一下发现差不多，刚到手的机子不要太流畅。缺点:只有6+256g版本有nfc,不支持扩展,logo稍微有点大,拍照估计还是一个硬伤，不过会好起来的,虚拟键，正因为你是锤子科技，这一点我不能接受，希望后续版本有一个更好的方案",2017-11-08 15:01:21,8,7,5
吃***儿,PLUS会员,#漂亮得不像实力派#今天终于拿到了这台坚果pro2，一代的时候当时没买到红色很遗憾，这次终于买到了红色，前面板也是红色，非常好看，不同光线下不同的颜色，这次的坚果外观设计也是一流的，非常简洁，除了摄像头，别的硬件都隐藏了，指纹也是别具一格，融合logo形成一体，面部识别速度也是挺快的，识别率也高，虽然安全度不如指纹，但是日常使用足够保护隐私了，处理器660对目前app和游戏来说非常足够，只是不能达到富余的水平，而且14纳米功耗可以控制的很好，3500毫安电池一天半使用完全没问题，4g运存对我来说足够了，总的来说，这款机非常超值，各方面比较均衡，加上爆表的颜值和超越第一代的手感，基本挑不出缺点来！,2017-11-26 20:10:56,1,0,5
j***s,银牌会员,不错吧。还没开机。。看着很帅。。嘿嘿。,2018-03-07 13:21:59,0,0,5
1***0,PLUS会员[试用],心心念念了很久，前段时间才终于下单了。用了半个月左右来分享一下心得。这是第一次用锤子手机。说实话和其他的安卓系统有点不一样。需要付出一定的学习成本来适应SOS，个人没有发现其他的什么大缺点，性价比很高，拍照够用，作为不玩大型游戏的我骁龙660处理器也绝对够用，屏幕如果滑的特别快的话好像稍微有一点拖影。我感觉唯一的一个缺点就是没有NFC，但256G的又太贵了买不起（摊手.JPG）。之前也没有用过什么四五千、五六千的苹果、三星、华为等高端旗舰机，感觉这个已经够好了。,2018-02-11 17:14:00,6,2,5
j***6,银牌会员,质感很好。玩了一下午，没咋耗电。京东快递无敌！农村都给送！！！一万个赞,2018-03-09 18:10:42,0,0,5
西***主,金牌会员,说实话，自从有了小孩，真的是没有闲钱卖手机的，PRO2发布的时候就说要支持老罗，可以囊中羞涩，一直没出手，知道老婆说她手机屏幕破了，我才找到一个难得的理由，果断的买了PRO2。京东神速，头天下单，第二天中午就收到了。废话不多说，直接上图！！,2018-01-21 23:30:51,19,10,5
o***8,金牌会员,老罗的这个作品给中国制造提气,2017-11-17 15:37:13,52,7,5
C***_,银牌会员,全新没有用过，本来买给爸爸的，他不要，还是用回他那个索爱，低价转出，低价出售！,2018-03-04 14:07:39,3,2,5
B***e,银牌会员,很好用，买了半个多月了，一点也不卡，我算是锤子的新用户，红色好惊艳啊，喜欢！希望老罗越来越好！,2018-03-07 21:09:49,0,0,5
