名字,会员级别,评论内容,评论时间,点赞数,评论数,评价星级
j***q,铜牌会员,买回来很满意。很好用,2017-10-01 17:55:37,0,0,5
j***f,钻石会员,好好好好好好好好好好好好,2017-09-19 12:44:17,0,0,5
j***9,铜牌会员,第二块魅蓝note手机，用一段时间再来追评,2018-03-06 19:23:40,0,0,5
骑***速,PLUS会员,不错不错，值得拥有,2017-10-21 19:05:52,0,0,5
林***廘,铜牌会员,收到手机，挺好的！,2017-10-11 00:20:26,0,0,5
j***s,金牌会员,不错、送了好多礼品,2017-10-09 06:38:43,0,0,5
j***4,铜牌会员,买了个多月啦  总体感觉还是OK的 就是觉得前置摄像头拍照不是很清晰,2017-11-22 00:50:44,0,0,5
y***i,银牌会员,京东的物流还是贼快的 昨天下午下的单 中午就到了。手机先着感觉很不错的。,2017-10-23 12:34:46,0,2,5
如***初,金牌会员,用了几天不错，很好用，值得购买，很漂亮，很好看，下次还回买。,2017-10-25 22:29:08,1,0,5
m***6,银牌会员,手机用着还不错，拍照也可以，屏幕也挺好,2018-02-01 22:40:38,0,0,5
j***7,铜牌会员,手机就是好看，又好用，就是没给我发到耳机,2018-01-07 10:24:17,0,0,5
辉***8,铜牌会员,手机不错，很满意,2017-12-07 19:36:36,0,0,5
丨***度,PLUS会员,不错，性欲比高，可惜只有16G,2017-09-18 13:08:08,2,0,5
e***d,铜牌会员,手机非常好看，我非常喜欢，京东东西很真，以后买东西都在京东买。谢谢京东,2017-09-21 11:51:59,0,0,5
f***i,金牌会员,这款手机还不错，这个价格值得！性能都不错。大家支持，魅族手机性价比,2017-10-20 15:52:38,0,0,5
K***q,铜牌会员,东西非常非常不错,2017-12-04 11:58:27,0,0,5
小***3,钻石会员,手机质量确实很好，关键比专卖店便宜的多，下次介绍几个朋友来买，值得推荐,2017-09-15 22:02:56,0,0,5
j***9,银牌会员,运行贼快，玩游戏贼爽，灰常满意,2018-03-04 15:27:38,0,0,5
赵***奇,银牌会员,手机还行，是正品,2017-11-20 13:32:45,0,0,5
j***v,银牌会员,手机还不错啦，就是耳机感觉是用过的，壳子都坏了！还是五星吧,2017-12-06 14:09:27,0,0,5
S***i,银牌会员,不错，之前用的魅蓝现在还是用的魅蓝我会一直支持魅蓝的,2017-11-09 23:55:08,1,0,5
k***总,金牌会员,很好用 速度很快,2017-11-14 11:21:55,0,0,5
樱***间,银牌会员,帮朋友买的还可以,2017-11-12 09:35:29,0,0,5
悬***蓝,金牌会员,整体还不错，就是充电接口是usb的，不是Type-C的，比较可惜。,2017-09-21 09:42:06,0,0,5
谁***了,钻石会员,帮朋友买的，价格比外边便宜不少,2018-02-19 15:33:41,0,0,5
蒋***6,银牌会员,非常好，值得购买,2017-10-30 07:32:23,0,0,5
宁***杨,银牌会员,挺好的，手机用着还真心不错哦。,2018-02-06 22:59:37,0,1,5
R***3,钻石会员,系统流畅，外观漂亮，性价比高。,2018-02-04 21:00:56,0,0,5
j***r,铜牌会员,很好用，拍照清晰,2017-10-19 09:22:53,0,0,5
R***U,银牌会员,很好的一次购物，魅蓝note6很给力！反应速度好！,2017-12-31 12:04:54,0,0,5
一***深,PLUS会员,手机做工很好，拿到手里很扎实，不错,2017-11-14 12:02:36,0,0,5
唐***柔,钻石会员,物流速度快 一直在用魅族 不错 双摄现货完美...,2017-09-18 09:27:03,1,0,5
T***G,银牌会员,收到手机，非常好，主要是系统蛮太强大了。,2017-09-13 12:25:03,2,1,5
大***轩,银牌会员,使用了一晚上来评价的  我觉得值这个价,2017-12-16 10:02:01,1,0,5
j***6,银牌会员,开始还不习惯，朋友一直在用，用了一个星期很顺手！,2017-12-12 08:57:55,0,0,5
j***2,银牌会员,"不错
挺好的赞",2018-02-28 13:23:33,0,0,5
风***城,金牌会员,手机两天到的，顺丰快递。包装很好，用一段时间再追评,2017-11-09 10:14:10,0,0,5
3***南,钻石会员,俺们全家用的都是魅族，京东上买的，是正品，物流超快,2017-11-07 15:25:16,0,0,5
Thomas北斗星空,金牌会员,手机三天到的，感觉还不错那，朋友很喜欢,2017-11-07 12:20:58,1,0,5
M***y,金牌会员,充电很快，电很多，像素还行，指纹解锁很快，不错^ ^,2017-10-05 12:44:22,0,0,5
m***Z,银牌会员,手机好看速度快,2018-01-24 11:04:45,0,0,5
j***n,铜牌会员,指纹怎么录不上,2018-01-23 22:17:52,0,0,5
闲时莫谈人非,银牌会员,用了半个月来评论:   手机在网上看没什么起眼 拿在手上肉眼就才是王道非常棒   卖家是好人诶 官方卖1099 他卖1115还包邮就收运费钱都不够 还送那么多东西 亏本做生意 蹭热度的吗？ 总之这是福利遇见的是福气别错过了好货也别冷了卖家的热心  有其他问题可以联系我qq2909753821,2017-09-28 10:14:07,0,0,5
草***9,金牌会员,使用上跟两三千的手机没什么区别，性价比极高,2017-09-11 21:11:55,1,0,5
j***7,铜牌会员,不满意颜色都给我发错了我靠了,2017-10-13 12:42:00,2,0,5
无***神,铜牌会员,个人使用感觉良好 就是flyme 6系统bug比较多 特别要注意这家店不是京东自营 我就犯了这个错误 不过还好 手机是正品 续航方面强无敌 摄像成像快 没有特殊需求不用买4+64的 因为3g运存在Flyme6系统已经绰绰有余了 需要注意的是暂时不要升级系统,2017-11-01 20:46:52,1,0,5
LT靈饕888888,钻石会员,总体来说还可以感觉使用起来还没有魅蓝E2那么流畅,2017-10-09 16:00:02,0,0,5
H***女,银牌会员,商品很好看    手感很好,2017-10-24 12:14:38,2,2,5
s***o,银牌会员,非常满意，配置也高，正合介格,2017-12-24 22:30:22,1,0,5
清***s,银牌会员,魅族手机挺好用的，用了这么久才来评价，不错,2017-11-23 17:12:13,0,0,5
唐***柔,钻石会员,物流速度快 一直在用魅族 不错 双摄现货完美...,2017-09-18 09:28:12,0,0,5
雅***哥,金牌会员,很不错的手机，性价比高，新款值得入手。,2017-10-01 10:58:04,1,0,5
w***g,银牌会员,用了一个月多点，暂时没发现啥大问题。,2017-12-18 23:44:01,0,0,5
背***p,银牌会员,东西收到了挺好的物流也很快，快递小哥风雨无阻,2017-10-03 14:46:53,0,0,5
j***y,银牌会员,用了好几天才来评价的！性能都挺好的！,2017-11-16 16:12:40,0,0,5
o***S,铜牌会员,就是发热，太厉害了，其他还可以。,2017-12-16 21:51:41,0,1,5
龙***皮,PLUS会员,发货速度很快，第一次使用魅族手机，用了一天才来评价。有的手机功能还待继续摸索，电池容量大，待机时间也长，拍照的画面清晰度也不错。手机运行流畅,2017-10-09 22:52:45,0,0,5
兴***佬,银牌会员,快递速度杠杠的，希望好用，实用，耐操。,2017-10-10 18:21:27,0,0,5
黄***章,金牌会员,挺好的！给别人买的，手感不错，用着也挺好,2017-09-11 20:07:40,0,0,5
w***孩,银牌会员,有美观有好看有大方网速还快???,2017-09-20 21:32:27,0,0,5
j***逝,铜牌会员,感觉还可以。希望用着舒服吧,2017-09-23 11:29:23,1,0,5
g***g,铜牌会员,还没到就急着打电话去了  刚好到  拿回来看还可以就是用了多少后台运行内存多少不能显示出来  这是缺点玩游戏有时卡  刚买回来就这样  我还不容易攒钱买来的手机太令我失望了  像素很好  买后来后有些程序没开过第一次开有点慢  以后开都很快,2018-02-21 20:43:41,0,0,5
j***a,银牌会员,跟描述一样，就是还没有插卡，不知性能怎样，用后再补追评。,2017-09-04 15:45:35,4,5,5
邪***月,铜牌会员,非常好的手机，很快很好,2017-12-21 18:10:25,0,0,5
噬***皇,银牌会员,机子挺好的，就是快递有点慢,2017-11-02 13:55:27,0,0,5
陕***1,银牌会员,拿到手感觉还可以，毕竟价钱就这么多，有一处小划痕领我很不爽，玩联盟开团会卡，性能没那么强，拍照能力千元机找不到对手，送的钢化膜很垃圾，耳机不想说啥了自己体会去，保护套很油的那种感觉，总体上我给75分，建议大家不要带保护套使用，影响手感,2018-03-03 21:17:20,0,0,5
z***n,铜牌会员,机子挺好的，比实体店便宜……,2017-11-11 09:33:32,0,0,5
2***X,铜牌会员,很好，也很好用,2017-11-30 23:25:27,0,0,5
夜***寥,银牌会员,屏幕还行，正面看着有质感，蓝色的没有图片上看起来那么突兀，整体还是比较和谐的，4+64G，日常软件运行还算流畅。,2018-02-23 20:34:56,0,0,5
j***n,银牌会员,手机收到了，外观很满意，这个价位也合适，上个手机用的是魅蓝note3，1099买的，用了一年半，屏幕烂了，别的都没有什么毛病，所以这次也选择了，魅蓝，关注这个手机很长时间了，年前下的单，过完年初六才送到，理解，毕竟快递员也要回家过年！,2018-02-26 13:18:26,0,0,5
x***9,钻石会员,不错，手机不错,2017-11-21 23:00:00,0,0,5
我***6,银牌会员,非常好用好看，满意,2017-12-17 00:49:06,0,0,5
祖***J,银牌会员,给别人买的，还不错,2017-12-14 17:18:30,0,0,5
西***斯,银牌会员,之前一个手机就是魅蓝，要换了，也用惯了魅族系统，就换了又一个魅蓝，虽然没有想象中的这么好，但还是很让人惊喜的了。,2018-02-21 01:32:39,0,0,5
x***p,银牌会员,好用的一款手机,2017-11-10 19:33:04,0,0,5
s***2,金牌会员,很好，非常好。,2017-11-10 12:24:11,0,0,5
j***f,银牌会员,刚到货，送女朋友的,2017-09-13 18:53:30,1,0,5
细***氵,银牌会员,东西可以，赠品不怎么,2017-10-15 13:54:32,0,0,5
夏***鹏,银牌会员,还不错 手机挺重的,2017-11-14 21:20:56,0,0,5
彼***解,金牌会员,买了了就给我降价，说好的送耳机，结果有没送，坑我，送的手机套还这么烂，手机暂时还没发现什么问题。,2017-11-05 22:28:44,0,0,4
j***9,铜牌会员,这手机有个问题，中间的按键有时候会卡住，按不下去，手机定位也定位不准，摄像头照的照片我只能拉大两次，一点都不清楚，还不如我之前用的三年多了的手机，但是新手机还挺快，不会空间不足，我也很少用摄像，就是定位有些坑，物流我催了好多次,2018-02-11 19:35:35,0,0,5
j***i,铜牌会员,手机是正品，还不错，就是包装太差了点也没有泡沫保护物流还很慢。,2018-02-20 12:39:53,0,0,4
李***生,钻石会员,手机绝对的正品保障，到手后官网查验正品且第一次查验，手机颜值高，喜欢魅族的系统，卖家发货快，物流也够流，卖家值得信赖,2017-10-09 22:34:17,0,0,5
陈***斯,PLUS会员,一个月前在魅族商城1699抢购了一台。现在一下子就便宜了200.。。套路啊。。不过话说note6的拍照效果在2K以下没有敌手了!电池也非常的耐用。中度使用2天一冲。想打王者的话还是买660以上的U吧。。高帧率开起来真的是不一样。,2017-11-30 01:50:58,0,0,5
j***2,银牌会员,用了几天，我不玩游戏。进某保和京东比较卡，毕竟是一千多块而已。屏幕看起来很OK。和note3比好了很多。不玩游戏，日常浏览的话够用了。如果你想用一千多买很好的手机我只能说你想多了，note6我觉得是千元机性价比最高的手机。还有就是正面指纹完美！！！,2017-11-12 00:49:09,0,0,5
j***v,铜牌会员,手机收到二天了，感觉不错，电话音量大，反应快。值得拥有，支持京东，下次还会再来购买,2018-01-01 08:53:30,2,0,5
九***7,铜牌会员,手机还可以，喜欢,2017-11-10 18:10:40,0,0,5
e***键,铜牌会员,可以快递两天,2017-10-08 01:02:30,0,0,5
j***a,银牌会员,非自营的京东物流还是一般。手机还可以。但是现在京东1299减150，这家店力度还是比不过自营的,2018-01-19 22:20:36,0,0,5
j***u,铜牌会员,手机很不错,2017-11-01 23:04:41,0,0,5
月***留,金牌会员,"买的64G内存，刚拿来可用内存就只有48点几个G,都不知道是不是真货。刚拿到的时候看视频没声音，还老是卡，重启了几次才可以，说好的送钢化膜是半屏的，结果拿来还是错的，发的不是这款手机的钢化膜，根本用不了，送的手机壳是超级薄的，根本没用，拿来直接丢了。",2017-11-30 00:56:44,0,0,5
j***a,金牌会员,从魅蓝note1用到魅蓝note6，相信魅族手机真心不错希望以后越做越好，外形也千万不要学苹果，因为魅族是有自己的想法做手机的，比那些模仿苹果外形的强的多。,2017-09-04 15:10:24,9,1,5
倾雨潇丨,银牌会员,手机拍照续航都很好，颜值也OK，唯一的缺点就是信号不太好，这也是魅族的通病，1500档选择魅蓝note6还是没毛病的,2017-11-04 20:21:47,0,0,5
3***c,PLUS会员,顺丰包邮，，，好评，骁龙625好评，，3G+16G适合单卡玩家，双卡玩家用3G+32G好些，，，给老爸买的，，，给老妈买的小米5X，，，小米5X和魅蓝note6属于姊妹手机感觉，，，都不错，，，美滋滋,2017-09-19 13:12:45,0,0,5
R***S,银牌会员,第三台了，好用,2018-02-25 18:06:15,0,0,5
陈***雪,银牌会员,手机性能不错，4000毫安的电池真的久，完全够用了，内存还比较大，价格也很实惠,2018-02-12 14:02:26,0,0,5
世***4,钻石会员,是正品挺不错的,2018-01-22 22:36:19,0,0,5
江***怪,铜牌会员,买这个很值，比去年买的OPPO都好用，送的钢化膜是小了一点，可以自己年后再买,2018-02-11 16:42:00,0,0,5
j***o,铜牌会员,手机倒是货真价实，第二次在网上买手机，还是值得信赖的，不错不错，就害怕那种发二手货给我们了，这家信誉不错,2017-11-14 23:09:45,0,1,5
j***a,银牌会员,感觉非常的好。嗯，拍照也非常给力，希望大家考虑。我相信你们绝对不会失望。,2018-03-03 11:28:16,0,0,5
j***c,金牌会员,手机可以呢，反映可以，比线下体验机流畅，通过设置把该关的关，看了下相机，也还好，充电器可以，做工可以、音质不算差，现在来说千元机首选之前是红米note4x，再过几天等红米5系列出来后它还是不是首选，那就不得而知了... 加油吧，魅族,2017-09-08 11:53:48,0,2,5
j***i,金牌会员,做为一个煤油  和发烧友     给同事推荐了这款手机  拍照厉害   和我的三星s7e拍照差不多都是索尼imx362     很赞?   虽然手持一加5说是煤油   以后魅族用高通最新处理器  我还是会选择魅族  魅族雄起,2017-10-18 01:30:51,0,0,5
s***2,银牌会员,看图片了。真机送的膜耳机软胶套，都是一般货，不提了。机子本身好，正面黑反面蓝，好看！用了几天，第一天早七点断电，重度使用，用到第二天晚上十点左右吧，一般使用两天绝对无问题，正常使用三天也可以撑的住。一句话，物超所值！挺魅蓝！,2017-10-21 15:35:12,0,0,5
小***休,PLUS会员[试用],全新未拆封，挺好用的，快递也很快，好评！,2018-02-24 15:38:44,1,1,5
l***6,PLUS会员,一直用魅族，质量做工都不错，下次还买，京东信得过。,2018-02-14 15:00:31,0,0,5
j***7,银牌会员,手机很好，刚收到货的时候还挺高兴的；运行很顺，没卡顿。赞。但物流有点慢。,2018-01-26 14:06:18,0,0,5
l***t,PLUS会员,还不错，正品全新，值得够买，爸妈很喜欢！！！！！,2018-02-22 14:48:32,0,0,5
哦***盒,银牌会员,手机玩着不错,2018-03-07 18:20:05,0,0,5
j***s,铜牌会员,手机很不错，,2018-03-04 14:17:22,0,0,5
j***y,银牌会员,这次购买发货很快，可美中不足自己亏了一条耳机，按再次购买没注意细节，虽然耳机不多钱，对再次购买的客户不厚道,2018-02-15 03:34:41,0,0,3
JYUfCpFWlWzD,铜牌会员,可以很不错。,2018-02-22 17:45:32,0,0,5
Z***遥,PLUS会员,还不错 挺好的，就是连个耳机都不带，有点小抠！,2018-02-03 00:35:52,0,0,5
j***o,铜牌会员,很喜欢这部手机啊！一直就支持魅族系列的，价格便宜，很很耐用，谁说便宜没好货了，魅族手机，你值得信赖。,2017-09-16 09:11:04,0,1,5
尘***言,银牌会员,手机还是蛮不错的，用了一段时间才来评价 ，性能还可以，这个性价比应该是很好了，就是送的钢化膜大小跟屏幕根本不对称，这个不太满意，不过也没去再找，嫌麻烦，还是希望商家能实在一点，谢谢了。,2018-02-13 14:05:24,0,0,5
j***b,银牌会员,为什么我的钢化膜是碎的，能给个解释吗,2018-01-23 20:06:21,1,0,5
1***1,PLUS会员,国产的手机现在真是厉害，不服不行啦，厉害了我的国,2017-09-22 06:42:42,3,0,5
1***p,银牌会员,货到付款。一周到货，送的屏贴很厚，保护套有点松动，耳机沒试过。拍照上对光源的处理很不理想。声音上比不了海信手机。屏幕打开护眼才敢看。信号不错。音质不太好。冲着拍照功能买的，手机有点大，不大好拿。有点小失望。,2017-12-28 22:43:36,0,0,5
我***v,铜牌会员,试了试拍照，确实比前几代好用，都是给家人亲戚推荐买的，从1到现在的6，越来越好用。,2017-11-06 17:52:32,1,0,5
j***k,铜牌会员,"好看
，有气质
外观看起来还可以不知道，
用起来怎 么
样？",2018-03-04 15:19:32,0,0,5
t***6,PLUS会员,外面套了手机套了，内存大，就是屏幕有点黄,2018-02-23 10:45:10,0,0,5
千***花,PLUS会员,应该是正品无疑，比官网的便宜的多，很值！,2018-02-18 00:48:27,0,0,5
j***7,铜牌会员,手机很不错，用了两天，越用越喜欢，物流很给力，送货人员态度很好，知道我急用手机，没说别的直接用行动证明服务态度，大冷天的晚上直接给我送到家门口，心里暖暖的，很感动，感谢京东每一个员工。,2018-01-14 13:13:25,0,0,5
j***d,铜牌会员,首先申明我不是为了几个豆子来发的好评  我知道  网购有风险 来买手机不去实体店  在网上买  确实就相当于赌博  没有这个胆量就别来赌  免得赢得起输不起  反正我赌赢了  我收到的  是好货  所以我给好评。,2017-10-12 21:32:25,0,0,5
j***9,银牌会员,手机到手机，颜值很好，就是快递太慢了，总体来说，买的很值,2018-03-04 18:44:36,0,0,5
j***a,铜牌会员,手机好看 冲着魅族的系统买的 但是买来发现用的很不习惯 可能之前用的华为换了之后还没习惯吧 摄像感觉一般吧 听音乐音效感觉不太好 不太舒服的感觉 就好像那种沙哑的感觉 说有外壳送呢但是没见到,2017-11-25 16:27:00,0,0,5
h***a,银牌会员,这快递的速度杠杠的没话说！手机也不错！就是送的壳跟膜太廉价了！,2018-01-18 10:43:32,0,0,5
j***h,钻石会员,*鸡峰自找麻烦帽子扣在美国细沟科学客观新款细沟看看各种状况个朱刚控制开关,2017-09-12 07:49:40,0,0,5
y***A,铜牌会员,手机有点垃圾，拍照不行，网络链接也不行，感觉京东现在也不是都卖好东西，买个魅蓝Note6连魅蓝3s都不如，诶，算了自认倒霉，下次买手机一定要去实体店买，网购水深～～失望失望～～,2018-02-14 19:19:34,0,0,5
6***生,PLUS会员,手机很好。。,2017-11-07 07:32:57,0,0,5
一***o,银牌会员,特别喜欢，就是过年的时候物流慢了点，等的有些急了。,2018-03-01 18:24:00,0,0,5
j***2,银牌会员,手机很不错，待机时间是最满意德，但拿我以前的乐2手机对比，感觉屏幕的色彩处理不是很好，玩游戏也不卡。但是快递要了四天，，，，总的来说很不错。还有，送的东西基本没用，质量太差了，手机好评。????,2017-11-06 08:35:56,0,0,5
朱***8,PLUS会员,很好的卖家。谢谢喽。我的同事们都很喜欢呢。下次再来哦,2017-12-30 19:42:52,0,0,5
j***5,铜牌会员,我现在用的还不错，如果手机没那么发烫就好啦,2017-10-10 23:18:04,0,0,4
无***i,PLUS会员,基本和以前的手机差不多，有点重,2018-01-25 15:53:13,0,0,5
中***爷,PLUS会员,漂亮啊！美呀!超级喜欢!,2018-02-13 17:40:50,0,0,5
益***3,金牌会员,东西是好。但送的东西没能用。买魅蓝NOte6送华为保护壳和钢化膜。,2017-10-15 18:11:01,1,0,5
h***7,PLUS会员,速度反应还算快！屏膜很垃圾，透光不好！,2018-03-08 23:09:02,0,0,4
h***p,银牌会员,手机挺好的的,2017-12-15 17:30:43,0,0,5
大***0,PLUS会员,价格实惠，质量不错，服务很满意！！！,2017-11-29 16:22:08,1,0,5
午***寒,金牌会员,查询为正品，比自营便宜将近2百，只是没有发票，这是第三方的通病。刚上市时给老婆买过一个3+32的，那时贵啊，现在4+64的都比3+32的便宜，希望能用个一两年。,2018-02-11 16:24:10,0,0,5
j***0,金牌会员,千元机够用了,2017-12-04 20:11:32,0,0,5
j***j,银牌会员,刚拿到看着还可以用一段时间再来评论呢,2018-03-02 07:45:24,0,0,5
岁***老,PLUS会员,帮妹妹买的！早就看中这款手机！妹妹要买手机，就建议她买这款！,2017-12-30 09:57:03,0,0,5
j***m,银牌会员,手机还行运行流畅不卡顿，头一次用魅族手机机，感觉挺好的，但送的东西是真的差,2017-09-10 13:59:12,0,1,5
k***T,金牌会员,给别人买的！,2017-11-21 09:54:28,0,0,5
g***n,铜牌会员,有时会黑屏哦,2017-11-17 22:09:18,0,0,5
闲***8,金牌会员,好电池很耐用,2017-11-08 19:43:23,0,0,5
M***子,PLUS会员[试用],note6用着蛮顺手。还比较满意.另外店家也很耐心解答问题。总体很满意,2017-09-21 12:11:35,0,0,5
j***d,PLUS会员,今天拿到货了，试用一下系统流畅 拍照清晰 一次愉快的购物,2017-10-22 10:00:21,1,0,5
j***4,银牌会员,一直喜欢魅族手机，这款性价比很高，一收货就用了，暂时感觉都不错,2017-11-21 18:50:19,0,0,5
晚***儿,银牌会员,给媳妇儿买的,2017-11-02 20:11:35,0,0,5
看***目,银牌会员,不错，很喜欢,2017-10-28 15:11:34,0,0,5
碎***觉,铜牌会员,还可以吧 看到的运存和内存都偏低,2018-02-21 16:17:34,0,0,5
g***8,银牌会员,外观还是不错的。想到颜值高电量高那么厚度也就不挑剔了。mback使用起来真心不错。图标上第二页还有优化美化的空间，离主页相比差一大截。系统字体上设计上与ipnone相比还可以更美观一些。,2017-10-10 15:55:34,0,0,5
财***S,银牌会员,手机还是不错 质量还是魅族品质 要用一段时间才能有好的体验,2017-12-08 17:58:03,0,0,5
麦***l,银牌会员,手机很好很棒 打王者最高画质流畅的一批 唯一可惜发货比较慢,2017-09-17 10:30:15,1,0,5
j***w,金牌会员,手机收到了！给孩子他买的很满意！,2018-02-16 08:57:33,0,0,5
jd_152844kgj,铜牌会员,手机非常好，送的东西也一应俱全，包装也非常到位，非常值得信赖的卖家,2017-10-03 10:53:41,0,0,5
w***s,金牌会员,很不错，帮家人买的，拍照也很棒!,2018-02-09 22:48:23,0,0,5
C***U,铜牌会员,卡，网络不好,2017-10-10 19:38:14,0,0,5
j***z,铜牌会员,挺好的挺喜欢,2017-10-08 10:23:00,0,0,5
j***-,铜牌会员,手机用着挺好的，但是知道了自营和非自营的区别，自营的如果购买近期内发生降价可以补差价非自营的是不可以的，商家客服也是很热情告知了我这一点我很开心，购物很愉快,2017-12-23 18:14:35,0,0,5
j***b,铜牌会员,还可以接受！,2017-10-02 14:33:13,0,0,5
l***9,金牌会员,一如既往的好,2017-09-29 23:14:19,0,0,5
L***C,金牌会员,感觉还不错，相机比较好，电池也大，内存加了内存卡，还可以比较不错的,2017-09-14 10:32:26,0,0,5
w***8,铜牌会员,非常好用，我用了一个月才来评论的，电池比千元机好了不止一倍，玩游戏也很流畅，功能很多，我最喜欢的功能就是自动亮度 ，手机根据周围的亮度而自动调节手机亮度而且光很柔和不是很刺眼。,2017-12-01 23:27:28,0,0,5
j***y,铜牌会员,手机不错，外观简单大方。送妈妈，很喜欢。,2017-10-19 20:42:18,0,0,5
j***f,PLUS会员,我在官网查了，是真货，手机左右边框很窄，，符合黄金比例,2017-09-15 12:34:51,1,2,5
富***司,钻石会员,千元机带双摄，拍照效果很不错。,2018-01-29 06:06:12,0,0,5
j***f,铜牌会员,挺实惠的，也挺好用的，总之一句话:实惠多多超好用！,2018-01-21 20:00:17,0,0,4
j***j,银牌会员,刚拆包装，感觉应该是正品，就是发货慢，物流慢,2017-11-20 21:23:59,1,0,5
j***0,银牌会员,物流还挺快的，服务态度非常好，下次换手机，还在这买,2017-12-19 17:47:34,0,0,5
j***h,银牌会员,勉强用吧，毕竟千元的东西。,2018-02-12 19:06:26,0,0,4
j***0,银牌会员,货真价实希望质保也如此,2018-02-23 18:16:59,0,0,5
silent001v,金牌会员,挺好的，刚开机上网一直显示证书错误，更新系统后一切正常，半年在这家店买了两部手机了，一个魅蓝6，一个魅蓝note6，快点把礼品给发过来吧，多发点我也不嫌多的，哈哈。。。,2017-12-11 19:23:11,0,0,5
U***脸,银牌会员,手机到了不错，毕竟是个千元机，游戏不卡。不满意的是手机回来内存为毛居然只要50G那14G你们黑了？而且快递速度不行。第一天使用还不错,2017-10-29 17:01:02,0,0,4
丨***丨,银牌会员,使用起来挺好的  目前没有卡顿现象 总得来说还好,2017-11-23 19:24:19,0,0,5
y***4,铜牌会员,用了很多天了，感觉还可以，如果说手头上没有太多钱，想换手机可以考虑一下，可是如果有充足的钱，可以去买更好的。反正我没有哈哈哈哈哈哈,2018-02-23 22:03:50,1,0,5
j***2,银牌会员,挺好，很实用，很喜欢，功能也多。就是钢化膜太小了。,2017-11-05 18:14:57,0,0,5
