名字,会员级别,评论内容,评论时间,点赞数,评论数,评价星级
j***e,金牌会员,手机收到了，很好看，暂时没有其他问题，先用着看看，过几天再来评价,2017-05-20 01:10:32,0,0,5
j***3,金牌会员,还行，挺漂亮的，就是外观有点瑕疵。像素一般。,2017-05-19 18:35:31,0,1,3
j***j,银牌会员,手机很好，做工好，没毛病，王者玩起来爽！！！p20加魅族手机的优化，绝对好用！！！,2017-05-15 01:49:22,2,0,5
你***铭,PLUS会员,魅族青年的良品，帮我表弟代买的，很适合他这种17，18岁的小年轻，商家服务也很好！要是赠品能再给个就更好了！,2017-05-14 16:15:51,0,1,5
j***r,金牌会员,超赞，很喜欢，手感非常好，性能各方面玩农药没毛病。,2017-05-12 09:16:46,0,0,5
j***9,PLUS会员,手机用了一段时间还不错，物流速度快，发货第二天就到了。,2017-05-10 13:31:06,0,0,5
e***o,PLUS会员,还不错，在这家店给家人买好几部手机了，是正品的。以后还会来的。,2017-05-09 09:56:09,0,0,5
我***了,PLUS会员,颜值蛮高的，系统也很流畅，拿着手感不错，闪光灯的设计很有特色，非常喜欢,2017-05-09 09:14:01,0,0,5
熊***排,PLUS会员,用着还不错，比我之前的note3好多了，操作都很习惯，就是联发科的U打农药团的时候偶尔还是会卡顿，希望魅族早点上骁龙！,2017-05-08 13:07:49,1,0,5
9***x,钻石会员,收到用过几天了 外观看起来不错 玩游戏一点也不卡  咨询客服回复及时 好用会推荐给朋友,2017-05-10 13:33:34,0,0,5
辰***森,PLUS会员,整体还是很满意的，金属后壳，弧面玻璃，上手手感很好。开机运行速度还是蛮快的，指纹解锁试了几次没毛病，系统用起来也不错。就是充电的接口不是那么好插，其他都还好。,2017-05-08 13:14:20,0,0,5
