名字,会员级别,评论内容,评论时间,点赞数,评论数,评价星级
i***N,铜牌会员,很不满意，快递太慢，,2018-01-31 15:30:43,5,2,1
开***8,铜牌会员,物流真的慢,2018-01-31 15:13:50,0,0,5
x***5,金牌会员,还好了，就是这样的吧,2018-01-31 13:52:25,0,0,5
j***2,PLUS会员,手机很好，家人很喜欢，好评,2018-01-31 12:59:13,0,0,5
f***天,金牌会员,很好很不错，刚到货，送货到家，快递员态度很好，很不错，第二次买手机了，在这个店里，上一次买的米6，这次给家人要的,2018-01-31 12:55:29,0,0,5
j***2,银牌会员,很好！,2018-01-31 11:08:57,0,0,5
H***v,铜牌会员,使用起来还不错，感觉手感还可以，看起来像s8，挺不错的,2018-01-31 10:49:58,0,0,5
1***1,PLUS会员,收到货了非常满意物流速度也非常的快我喜欢谢谢你,2018-01-31 10:29:44,1,0,5
G***t,铜牌会员,还可以吧。只是后面的字不是meizu,2018-01-31 08:21:32,4,5,5
爱***4,PLUS会员,好用,2018-01-31 08:10:32,0,0,5
j***j,铜牌会员,有点真的慢物流不过手机特别好,2018-01-30 20:19:38,0,0,5
黑***牙,铜牌会员,刚用感觉还行,2018-01-30 19:53:46,0,0,5
j***f,铜牌会员,可以,2018-01-30 16:57:06,0,0,5
雄***2,PLUS会员,挺好的不错的机器 很好用,2018-01-29 20:50:29,0,0,5
电***6,PLUS会员,挺不错的,2018-01-29 20:40:59,0,0,5
纵横光明,金牌会员,我就喜欢魅族，终于又改回小圆点,2018-01-29 18:30:55,0,0,5
j***o,金牌会员,挺好的,2018-01-29 18:27:51,1,0,5
j***8,铜牌会员,非常好，非常好，非常好，主要的事情说三遍。手机杠杠的，指纹识别很快，玩游戏很流畅。总之，没毛病??,2018-01-29 18:09:01,2,0,5
J***质,银牌会员,不错    值这个价钱,2018-01-29 13:16:22,0,0,5
j***p,铜牌会员,手机收到了 虽然快递因为大雪耽搁了几天  但是服务态度还是很不错的  手机颜值很高 运行流畅 手感顺滑 很棒！还送了很多小礼物 ！,2018-01-29 13:10:19,14,1,5
凯***3,金牌会员,店家态度特别好，手机也好，买手机就从这家店买，良心品质，极力推荐！,2018-01-29 12:57:32,0,1,5
洪***琴,银牌会员,手机手感很棒！指纹解锁很快！充电速度也快！三星处理器是最大的亮点，总体来说还行吧！,2018-01-29 12:28:15,5,0,5
貌***丶,铜牌会员,手机很喜欢，外观也好看，虽然是3G运行内存，但是如果玩王者荣耀或荒野行动一点也不卡，魅族粉必备。,2018-01-29 11:56:08,0,0,5
j***f,银牌会员,手机很好不卡,2018-01-29 10:01:15,0,0,5
包***以,铜牌会员,不怎么理想吧，还有左右电源与音量键握着不怎么舒服，截屏也不方便，还有虚拟键说重压退回桌面，轻压返回，觉得重压这设定不好，老是弄不了，经常开启语音助手。其它还可以,2018-01-28 20:50:19,0,0,4
w***林,金牌会员,还不错，就是不知道能用多久了,2018-01-28 15:29:22,4,0,5
y***5,PLUS会员,非常好,2018-01-27 23:04:39,0,0,5
j***g,铜牌会员,其他都好，就息屏不灵敏，有时没用,2018-01-27 22:23:40,0,0,5
战***佬,银牌会员,拍片就不发了，这手机玩了一下午，什么都好就是屏幕不够清晰，这毕竟价钱摆在那里,2018-01-27 17:32:59,1,0,5
_***瀚,银牌会员,真的很棒,2018-01-27 14:15:44,0,0,5
x***2,金牌会员,很好,2018-01-27 13:31:13,0,0,5
K***N,铜牌会员,手机游戏兼容有问题 显示不全 图标比较小  最重要的是他是720p显示器要求高画质的请绕行,2018-01-27 13:29:30,1,0,5
PXgRZnhdCHSi,铜牌会员,除了内存只有24GB，其他的感觉还不错,2018-01-27 13:27:38,1,0,5
尘***吖,PLUS会员,好用，经济实惠，玩王者荣耀很流畅,2018-01-27 09:26:52,0,0,5
j***i,铜牌会员,差评,2018-01-27 00:31:22,0,0,5
蠱***N,银牌会员,手机很爽，第二台魅蓝了。,2018-01-26 22:23:13,1,0,5
名***9,银牌会员,快2年没用魅蓝了   这次的全面屏加上侧指纹解锁   把我吸引了    黑色很漂亮    不带手机套    手感非常舒服,2018-01-26 22:06:47,3,1,5
学***些,银牌会员,刚收到，还没使用,2018-01-26 11:53:15,3,0,5
沧***生,金牌会员,"东西很好，物流太慢，用了六天，平时就两天左右
我看的屏幕其实和5寸1080P没啥差别，除非用放大镜！
电量之前有些担心，到手和扎克Z2相比还好些，够用了。GPU跑分和Z2没得比，卡的幻灯片一样，不过实际打游戏时因为分辨率低，不差。
主要看中外观，支持魅族创新！",2018-01-26 01:03:20,14,2,5
J***z,铜牌会员,手机非常流畅，一点也不外表好看,2018-01-25 22:16:24,0,0,5
星***亮,铜牌会员,挺好的,2018-01-25 22:04:07,0,0,5
j***s,银牌会员,机器颜色不正，屋子里是粉色的，拍成照片成紫色的，信号也差的很，想退货也不行，需要检测什么的，麻烦的很，还好不贵，就当扔掉算了，第一次用魅族，也是最后一次。,2018-01-25 19:37:59,5,6,1
Y***u,铜牌会员,超好看，摸着特别舒服,2018-01-25 19:07:58,0,0,5
j***t,铜牌会员,我很喜欢，第二次买了。,2018-01-25 15:54:25,0,0,5
s***g,铜牌会员,手机还可以，但是送的耳机还有支架的唉，简直不敢想,2018-01-25 15:18:40,2,1,3
q***p,钻石会员,三星的处理器配在S6上让万年联发科的魅族加分许多，真的非常流畅，没感觉一点卡顿，指纹解锁秒开。不支持电信新开的低频800MH的4G网，满意 速度快 手感好 非常喜欢。,2018-01-24 23:14:54,0,0,5
z***h,PLUS会员,魅粉必入，物超所值，很喜欢，做工扎实，外观靓丽，很不错哦，希望能用久一点。,2018-01-24 23:10:12,5,0,5
绿***酱,钻石会员,"颜值爆表，手感非常不错。系统很流畅！从魅蓝3s换过来的。3g加32g基本够用吧，不乱装东西的话。
比较遗憾没有4g内存的，用个一年当备用机应该没问题。",2018-01-24 19:13:19,3,0,5
买***手,钻石会员,很不错得手机,2018-01-24 19:13:07,1,0,5
M***苼,铜牌会员,非常满意！很满意的一次购物，一直使用魅蓝产品！,2018-01-24 16:54:10,0,0,5
尚***莱,银牌会员,手机收到了，不错，物有所值。,2018-01-24 16:15:34,0,0,5
0***流,铜牌会员,买了32内存的   怎么到手看配置只有29gb    运存反应也不是太好,2018-01-24 13:02:40,2,2,1
j***b,PLUS会员,还不错,2018-01-24 08:51:10,1,0,5
吴***7,PLUS会员,首先必须说一点物流真的很快，昨天十点下的单，然后今天早晨八点就到了，然后是这个手机，手感真的特别好，侧边指纹解锁也很方便，因为我一直不喜欢前边指纹解锁的，觉得特别丑，然后这个就特别和我心意，哈哈哈，而且这个小圆圈也可以充当返回健，也很方便，第一次用魅族手机，反正就是挺满足的，特别好,2018-01-23 23:13:53,1,2,5
妍***的,PLUS会员,第一次买魅族手机，体验挺好的。720的屏幕够日常使用，照相方面欠佳，这个价位性价比已经很高了。王者平均55帧率，一把15电。跑分9w，原来的vivox9p也才10w，那些想999买果x心态的人不得不说你们很狗。[图片][图片],2018-01-23 22:55:21,15,2,5
j***m,PLUS会员,顺丰的速度非常快，第一天买的第二天手机就到了，因为朋友有用魅族的说的挺好，我也就买了一台，准备送给妈**新年礼物，收到手机就赶紧拆开试了一下，手机系统运行很快，挺流畅的，最让我惊讶的是指纹解锁相当快，我感觉比我苹果的快，这是**买东西最满意的一次，魅族加油,2018-01-23 22:34:02,5,0,5
c***n,金牌会员,第一次购买魅蓝的手机，不得不说手机确实是挺好的，侧面指纹识别很快，还是全面屏，虽然说是720P的屏幕，但是屏幕精细度还是不错的。运行一些常用软件和常玩的游戏，像王者荣耀等都不会卡，都挺好的。,2018-01-23 20:00:46,1,0,5
洲***候,钻石会员,千元全面屏手机不错的选择，好看的外表。游戏，拍照，音乐都挺好的。物流很快，第二天到手。,2018-01-23 19:20:53,0,0,5
摩***i,钻石会员,这款魅蓝S6是给女儿买的，她非常喜欢，手感非常适合，18比9的全面屏好看，系统也好用。,2018-01-23 19:15:48,0,0,5
a***5,金牌会员,手机还不错，指纹很快，屏幕还算清晰，总体不错,2018-01-23 18:19:10,1,0,5
j***b,银牌会员,還可以吧,2018-01-23 15:14:48,0,0,5
9***3,PLUS会员,一直在京东买东西，到货快，快递员服务还好，比实体店都放心。,2018-01-23 11:02:49,0,0,5
Q***B,PLUS会员,一直在京东买东西，到货快，快递员服务还好，比实体店都放心。,2018-01-23 10:49:35,3,1,5
j***w,PLUS会员,王者荣耀平时60，打团50多，偶尔掉45。吃鸡中特效，高帧率流畅打。基本不卡。崩坏3外传竟然几乎不卡，媲美820。   本人游戏控，对所有评测负责。请开高性能模式。分辨率就那样，正常看可以，10厘米左右会觉得不爽。    游戏可以入，电影也能行。看小说的感觉绕道，他不适合你。 最强千元机，没有对手。性能达到653，可惜耗电量恐怖，和苹果6sp耗电一样快，并不完美。,2018-01-23 00:02:51,40,28,5
我***t,PLUS会员,等了一天终于收到包裹，首先手机外部结构有变化，音量键在左边去了，右边增加了一个指纹感应键，锁屏下也能直接感应解锁，感应速度挺快，剩下一个电源键不多说。 然后我开机，屏幕正面取消了home键，变成了类似悬浮球的虚拟键，当然，另外还是有个悬浮球。 说实话，对于home键位置的虚拟按键，刚开始用还是有点不习惯，点屏幕最下面的东西老是误触。 上一款手机我用的魅蓝note3，感觉不错继续使用魅族，希望魅族在手机体验越做越好，千元机不求太高档，用着顺手就好。,2018-01-22 18:21:44,4,1,5
小***2,PLUS会员,质量没问题，运行挺快，价格很实惠。,2018-01-22 15:34:27,1,1,5
去***4,PLUS会员,发货很快，整体看起来不错，质量没问题，运行挺快，价格很实惠。,2018-01-22 15:30:53,2,1,5
陈***7,PLUS会员,发货很快，整体看起来不错，质量没问题，价格很实惠。,2018-01-22 15:27:43,1,1,5
x***3,PLUS会员,发货速度挺快的，质量不错，反应很快喔。。。。。。。,2018-01-22 15:23:43,1,1,5
1***6,PLUS会员,发货速度挺快的，质量不错挺喜欢的。。。。,2018-01-22 15:18:33,1,0,5
r***W,铜牌会员,非常好  可以  帮我朋友买两个,2018-01-22 12:40:14,3,0,5
