名字,会员级别,评论内容,评论时间,点赞数,评论数,评价星级
M***1,钻石会员,香槟金 全网通公开版,2018-02-22 12:32:43,0,0,5
j***5,铜牌会员,再也不买魅蓝了，哈哈,2018-02-18 07:49:44,0,0,5
z***n,银牌会员,挺好，这个价钱就很好,2018-02-17 09:58:51,0,0,5
赵***了,银牌会员,给我妈买的，还可以。,2018-02-15 00:18:10,0,0,5
3***4,银牌会员,买给家公的  挺好的,2018-02-13 22:44:36,0,0,5
j***8,铜牌会员,手机很好，背面很漂亮,2018-02-11 10:11:14,0,0,5
糊***5,金牌会员,给老人买的，使用简单,2018-02-11 07:10:28,0,0,5
j***a,铜牌会员,货收到但少了一件耳机,2018-02-09 18:55:13,0,0,5
天***外,金牌会员,电池可以，不错的手机,2018-02-09 00:47:59,0,0,5
h***4,金牌会员,很不错，家里人很喜欢,2018-02-07 20:18:10,0,0,5
l***a,钻石会员,很好，比想象中好。,2018-03-07 12:31:10,0,0,5
j***8,钻石会员,价廉物美，值得购买,2018-03-07 09:27:41,0,0,5
j***c,金牌会员,好用不错的一次购物,2018-03-06 02:32:55,0,0,5
j***n,银牌会员,配送很快 宝贝不错,2018-03-02 20:55:13,0,0,5
星***9,金牌会员,第三次买了，很好用,2018-02-22 20:17:22,0,0,5
咱***的,钻石会员,满分不错的手机推荐,2018-02-11 17:15:19,0,0,5
n***q,金牌会员,挺好的一次购物体验,2018-02-09 21:14:07,0,0,5
黑***籽,银牌会员,这是第二部，除了重量有点区别，用起来还不错。,2017-10-31 07:51:51,0,0,5
P***c,金牌会员,一直使用这个牌子，手机不错，款式好看，关键是价格合理,2017-08-25 12:16:59,0,0,5
R***丶,铜牌会员,手机拿来后没有想象中的那么好 第一天上网玩游戏就卡顿 手机待机没有那么长时间 看电视的时候会卡屏 中间的home键有事按还不灵 说真的朋友们不要买真心的,2017-03-29 16:56:00,40,15,1
j***y,银牌会员,手机不错，还会购买，服务一流。。。,2017-11-30 06:45:10,0,0,5
1***p,银牌会员,小玩意还挺好的。,2018-02-25 22:16:21,0,0,5
j***6,铜牌会员,还可以，电池耐用,2018-02-25 19:28:39,0,0,5
h***5,钻石会员,很好用，屏幕很大,2018-02-24 19:37:31,0,0,5
j***c,银牌会员,感觉用的还可以，,2018-02-14 01:04:53,0,0,5
1***7,钻石会员,非常好  很实用,2018-02-11 20:33:33,0,0,5
W***K,铜牌会员,慢啊送了5天才到,2018-02-08 10:39:46,0,0,5
连***C,金牌会员,屏幕大 系统流畅  物有所值,2017-08-30 09:51:46,0,0,5
花***浮,金牌会员,第二次买手机真心补错,2017-09-01 18:09:48,0,0,5
b***8,PLUS会员,好，第二次买了,2018-02-08 17:24:32,0,0,5
逆袭光棍法,银牌会员,这次是真的没办法给满星了，麻耶的我上次买的运行都没毛病，这个刚买一个月多的运行内存不足严重的不足，同样是3G运行内存，为什么运行一个王者农药就不行了？随时没那么卡但是偶尔还是卡了一下！我那台买了一年多的运行一个王者农药和天天酷跑都没问题QQ微信也一样运行着！,2018-01-08 16:27:28,0,1,3
j***1,金牌会员,很好，推荐使用,2018-03-04 13:02:59,0,0,5
激***动,铜牌会员,运行很快，好评,2018-03-04 12:00:26,0,0,5
x***F,铜牌会员,物流速度就是快,2018-02-11 09:56:06,0,0,5
a***4,铜牌会员,怎么没有耳机啊,2018-02-09 14:27:40,0,0,5
d***G,银牌会员,挺好用的，不错,2018-02-09 10:42:50,0,0,5
q***5,银牌会员,很不错 实用！,2018-01-03 15:43:38,0,0,5
j***s,铜牌会员,自带助手时间是2016年1月1号  生产日期是2016年12月29日    不知道是不是翻新机,2018-01-10 14:09:17,0,1,3
乖***5,银牌会员,"手机还好第二次购买这次是给妈妈买的
手机唯一缺点就是电池耗电大用不了多久就没电
将就的用吧",2018-02-25 09:43:57,0,0,4
卢***1,金牌会员,很好，不错。,2018-02-28 08:15:55,0,0,5
p***9,金牌会员,不错的手机。,2018-02-28 10:25:36,0,0,5
j***2,金牌会员,外观上档次，做工也不差，象素高，图象清晰，充电快，屏幕灵敏。但外放声音小，音质欠佳。,2018-02-13 16:19:29,0,0,4
j***0,银牌会员,快递员非常好,2018-02-13 04:51:13,0,0,5
苦***路,银牌会员,还不错吧,2018-02-13 12:21:50,0,0,5
孑***3,银牌会员,手机试用了一段时间，能够满足一般使用需求。至于其他的还看后续使用情况。,2018-02-15 22:06:58,0,0,4
j***e,银牌会员,魅族系统是真的难受，处理器卡的一批，相机一般，特别是电量，4000毫安完全是假的，根本不耐用，快充也是假的，充满用了两个多小时，唉没办法，1000多的能买到什么好手机啊，关键是不能造假啊，这电池明显是假的，差不多3000多毫安而已，还有就是赠送的钢化膜真是乐色，根本贴不整齐，一圈白边，伤心,2017-11-04 20:10:36,0,1,3
东***u,金牌会员,同样的配置，这款机子还是划算的。但一直以来买手机都有耳机，为什么魅族不配耳机呢？遗憾。,2017-10-14 09:32:09,0,0,4
B***1,银牌会员,贴了层钢化膜屏幕就不灵了，不知道咋回事。,2018-02-07 22:00:18,0,0,4
佛***自,金牌会员,指纹不灵敏！！！很严重。。。,2018-02-08 20:44:39,0,0,4
莫***哥,PLUS会员,魅族的品质比国产其他品牌还是差一点，我一个老妈一个岳母一个帮别人买一个，这一个摄像头拍不清老模糊调不好，我用的半年左右指纹识别坏，中标率50%,2018-02-24 15:30:22,0,1,3
j***6,金牌会员,速度很快。,2018-02-26 21:04:02,0,0,5
夜***1,金牌会员,很好，喜欢,2018-02-23 12:08:05,0,0,5
j***3,银牌会员,挺好的手机,2018-02-17 09:00:07,0,0,5
j***i,铜牌会员,手机还可以,2018-02-15 17:57:10,0,0,5
y***n,银牌会员,给妈妈买的……看着还不错,2018-02-08 08:23:46,0,0,5
叶***7,铜牌会员,买了没多久，发现note6搞活动都和note5价格差不多了。还有除了手机及充电器什么都没有送，手机膜还有字阻挡视线，有点失望吧。,2018-01-09 14:57:19,0,1,3
j***6,铜牌会员,手机反应还可以，但是充电比我原来的要发烫得多，电池耗电快，拍照一般般！一分钱一分货！,2018-01-24 17:12:18,0,1,3
jd_182001bbj,铜牌会员,感觉没有我之前买的好用  声音太小了  网也不好   而且来耳机都不送的！！！！！！,2018-01-18 08:42:47,0,1,3
j***p,银牌会员,微信试了下视频通话。回响声杂音很严重。其他还满意。毕竟千元以下的手机。性价比不错。,2018-01-08 16:00:27,0,1,3
高***4,银牌会员,样子还可以，用起来有些卡顿，充电发热比较严重，收到的时候，感觉一层灰！一般,2018-02-06 07:11:04,0,1,3
我***路,PLUS会员,"因为最近忙装修房子，原来的手机电池不够用，所以京东上随意买了个魅族手机，当天买回来HOME键有问题，直接换货，耽误我几天，换回来以后第一天就感觉信号不好，同样的地方，别人打电话根本不用说第二遍，魅族经常无法接通，4g 网经常变成E ,每次重启后有4g ，过一会就消失，我在我们闹市区，客服居然说要有4g 覆盖，真逗，在家好好的无线网连得好好的突然断掉，种种迹象，是魅族手机的问题，枉费我崇尚国产的一片心意。",2017-12-18 18:53:41,4,3,1
98小栋,金牌会员,手机电池不耐用，充电非常热。。。担心用不住。。不过机身还挺好看的,2017-06-05 09:23:45,6,1,1
允***葵,金牌会员,还行吧，感觉没那么灵敏。怕怕,2018-02-13 06:07:19,0,1,3
j***n,金牌会员,速度比较慢，以后不买这种手机了,2018-01-12 09:52:23,0,1,3
j***c,银牌会员,很不错,2018-02-13 22:24:31,0,0,5
c***p,钻石会员,手感和工艺比以前的机型提升了。但是，系统越来越差，以前魅族2时，系统简洁好用，现在繁琐复杂，并且每一个应用都需要授权一大堆权限，例如，你一个计算器要什么联系人、电话、网络权限？并且如不对应用授权，应用就直接退出，不能使用。,2018-02-02 13:01:12,0,1,2
s***7,金牌会员,这个破手机耳机都不送，去配手机壳到处都没有，说魅族手机不好用，所以壳都不好上。我用了两天确实不怎么样，首先说图标显示是方的，看起来很不舒服。第二信息来了在图标上也不显示。总之感觉不如别的手机。,2018-01-24 12:19:36,0,1,2
j***x,银牌会员,不错商品,2018-03-01 13:58:18,0,0,5
j***a,金牌会员,非常好用,2018-02-27 12:46:34,0,0,5
j***h,银牌会员,挺好的！,2018-02-08 18:54:06,0,0,5
胖***舟,铜牌会员,本来用着还可以的，但是一直没有下载游戏玩。今天下载了游戏，老是玩着玩着就闪退或者刚进去就闪退 好生气,2018-01-11 22:39:41,0,1,2
叶***诺,银牌会员,客观评价，快递很给力，但产品一打开背面就脏脏的，貌似是别人退货的机子，系统还挺好用，就是有点慢。,2018-01-29 15:24:26,0,1,2
j***a,铜牌会员,给老公买的，用了之后有时候电话会打不进来，有时候通话中听不到声音我不知道是不是只有我这个会，,2018-02-13 09:19:26,0,1,2
j***1,银牌会员,感觉手机太卡,2018-01-29 21:16:14,0,1,3
j***8,银牌会员,玩游戏有点卡,2018-01-07 20:10:55,0,1,3
宋***见,银牌会员,相当一般啊，这个机子不行，不像是真的，可能是翻新机,2018-02-03 23:10:05,0,1,2
x***2,银牌会员,4000毫安的电池，没怎么用，一天都没到头就没电了,2018-02-01 19:05:00,0,1,2
L***-,铜牌会员,"手机不能连接隐藏wifi,手动添加无法识别",2018-01-31 10:39:31,0,1,2
j***6,铜牌会员,我去，，用不到一天就没电了。有点接受不了,2018-01-16 11:42:25,0,1,2
j***l,银牌会员,不到五天屏就碎了，质量太差,2018-02-26 12:38:32,0,1,2
j***g,金牌会员,不好，反应迟钝，不如红米好用,2018-02-08 11:36:13,0,1,2
小***只,银牌会员,很不错,2017-11-11 12:27:59,0,0,5
j***o,银牌会员,手机用了不到一个月、冲不了电、找售后，让我返厂维修、请问手机两个月就维修、合适吗？我建议还是不要从网上买了、万一有问题返厂麻烦还生一肚子气！京东的服务态度再一次刷新对京东的认识！,2018-01-16 18:20:57,0,1,1
j***l,铜牌会员,很糟糕的一次购物，对京东很失望卖家的服务态度很差，昨天刚买的手机899隔一天就降价了100也不返差价想问下客服可是发信息基本不回这是我在京东最差的一次购物，对京东很失望……希望大家谨慎考虑这家店！售后真的非常差！小心购买！！,2018-01-28 18:43:57,0,1,1
j***，,PLUS会员,魅族太容易碎屏，给我爸买的第二天就碎屏了，坐在凳子上从裤子兜里掉出来就碎了，一米都不到，我妈用的也是碎屏，前天碎的，我老公的屏幕也碎了，魅族也太爱碎屏了！,2017-05-30 21:57:46,2,1,1
j***z,银牌会员,除了长的好看没有任何有点，问他又没我活动，说没有，转眼降了一百块，售后服务就那回事，买的上一个才三个月，充电器已经坏了，我谢谢你，真的。,2018-02-05 11:24:53,0,1,1
j***2,金牌会员,挺好用,2018-02-27 10:24:22,0,0,5
j***7,金牌会员,还不错,2018-02-26 02:29:22,0,0,5
1***p,铜牌会员,挺好的,2018-02-25 14:07:52,0,0,5
g***4,银牌会员,还可以,2018-02-21 22:17:34,0,0,5
j***a,银牌会员,还可以,2018-02-21 18:06:44,0,0,5
j***华,钻石会员,好评。,2018-02-19 14:17:51,0,0,5
j***0,铜牌会员,可以的,2018-02-17 12:30:11,0,0,5
3***4,金牌会员,很不错,2018-02-11 15:34:16,0,0,5
l***x,铜牌会员,昨天才到了货，今天手机突然就卡住了，一点反应都没有，一直卡着这画面，我也是醉了，质量真差劲，特别的失望。绝望，很想退货,2018-02-08 16:05:32,0,0,1
j***v,银牌会员,别在上面买了，我刚买过手几天屏就摔坏了怪我霉，但手机出问题了就说人为的要检测，都说的废话，还是在实体店买有保障些,2018-03-07 18:36:48,0,0,1
j***p,铜牌会员,手机买回没办法用  每天都自动关机好几次  还特别卡  微信根本 打不开 白花了一千块钱,2018-01-23 12:17:24,0,1,1
猷***求,PLUS会员,去年9月份买了一台，跟这台对比，这台屏幕明显差很多，屎黄色的,2018-02-07 23:19:44,0,1,1
1***z,金牌会员,手机速度是挺快的，但是什么都没有说，手机加充电线和头，哪怕是手机套都没有一个，真伤心,2018-01-12 13:05:12,0,1,1
j***1,PLUS会员,买了1个月，降了100多，麻了个吧的，感觉亏了一个亿,2018-01-29 21:51:33,0,1,1
j***6,银牌会员,手机一般般，可以应付打电话。就一个裸机，啥都没有，良心商家。,2018-02-04 08:34:34,0,1,1
j***7,铜牌会员,坑啊，前几天买还899，现在打开足足差了一百块钱。也是醉了,2018-01-30 21:38:29,0,1,1
j***n,铜牌会员,太卡了，一点都不好，而且一玩王者就卡的很厉害，肯定是山寨机,2018-01-05 22:04:22,0,1,1
K***g,银牌会员,用着还可以就是降价有点快，买完后闹特6就降价了很亏,2018-01-10 21:55:54,0,1,1
j***r,铜牌会员,手机还行，就是什么东西都没有送，失望?,2018-01-07 23:12:18,0,1,1
j***r,钻石会员,手机很差，特意用后评论  很卡,2018-01-11 11:30:45,0,1,1
h***E,铜牌会员,裸机，什么都没有,2018-02-25 08:44:28,0,1,1
g***K,铜牌会员,也没有赠品，哎,2018-01-10 12:17:09,0,1,1
第***称,银牌会员,很不错,2018-02-09 08:41:03,0,0,4
亦***生,PLUS会员,不错,2018-01-14 11:52:59,0,0,5
j***g,铜牌会员,用我账户刷单,2018-02-06 14:52:56,0,1,1
赵***巍,PLUS会员,不错,2018-02-10 15:12:30,0,0,5
守***9,银牌会员,很好,2018-03-05 13:19:12,0,0,5
j***f,铜牌会员,可以,2018-03-04 17:14:29,0,0,5
x***2,银牌会员,挺好,2018-03-02 11:29:47,0,0,5
j***e,银牌会员,可以,2018-02-28 18:45:33,0,0,5
j***e,银牌会员,还行,2018-02-28 17:04:10,0,0,5
公***3,银牌会员,很好,2018-02-27 20:14:36,0,0,5
j***m,铜牌会员,还行,2018-02-24 14:54:00,0,0,5
Y***7,银牌会员,还行,2018-02-23 07:11:10,0,0,5
怀***头,银牌会员,不错,2018-02-21 08:02:58,0,0,5
j***c,银牌会员,还行,2018-02-19 18:58:30,0,0,5
j***b,铜牌会员,不错,2018-02-17 20:57:49,0,0,5
井***9,铜牌会员,好评,2018-02-09 15:29:57,0,0,5
张***1,钻石会员,可以,2018-03-05 08:12:12,0,1,3
无***柔,钻石会员,好,2018-02-18 22:43:59,0,0,5
A***r,银牌会员,好,2018-02-13 11:37:51,0,0,5
j***0,金牌会员,好,2018-02-09 15:32:17,0,0,5
j***d,铜牌会员,不好用,2018-03-04 20:41:48,0,1,1
昌***5,银牌会员,好,2017-12-03 00:20:41,0,0,5
9***爱,银牌会员,说好的6号到 结果九号到 天气不好 这也就算了 打电话询问快递员 居然一直挂我电话  服务态度超级差 后来询问客服 态度还可以 总之  非常不满意的一次购物 给差评  至于手机 整体还行 最接受不了 就是一直挂我电话  还有 快递包装里面的  充气袋  居然破了 拿到快递的时候  一晃就一直响 快递盒也有破损  送货速度就不说了  我理解 是天气原因  之后换的配送员 态度还行  总之 不满意 很生气,2018-02-10 13:49:06,0,0,4
j***0,铜牌会员,不好,2018-02-23 20:47:46,0,1,1
j***p,银牌会员,可以,2018-02-05 12:56:57,0,1,1
T***P,金牌会员,手机还可以，就是也太抠了吧，没要求你送东西，就连最基本的耳机也没有，抠得很，差评,2018-02-02 12:54:51,0,1,3
雪***7,钻石会员,机器很漂亮的，屏幕摄像头机身都挺好，电池也强。但是799的价格，干不成低不就。小说16G，真心不够用。再说CPU，游戏不玩，仅仅装qq，微信，快手，新浪微博一些软件，运行还是有点慢，大家买的时候，一定加一百块，比如魅蓝E2，CPU上一个档次，流畅度就好很多了！整天手机不离手的，不玩买！给差评，系统很多预装不能卸载，随便啥软件，比如计算器都要求联网读通讯录的权限，很liumang！应用软件自己的升级被应用商店劫持！差评！后悔了。,2018-02-09 23:25:53,0,0,1
冷***荷,金牌会员,差评！死机黑屏，应用还会闪退，不知道有没有人看见，看见的最好别买了,2018-02-02 08:38:14,0,1,1
B***l,铜牌会员,什么东西呀，耳机没有，钢化膜没有，不好，差评,2018-02-16 18:58:33,0,0,1
3***子,铜牌会员,差评吧买不到一个月降价一百，这什么鬼，不靠谱,2018-02-04 14:25:55,0,1,1
j***a,铜牌会员,总得来说还可以,2018-02-05 12:41:52,0,0,5
独孤V不败,PLUS会员,用了几天了，感觉这款性价比超高了，速度也够,2018-02-05 12:07:23,0,0,5
芦***杰,金牌会员,此用户未及时评价，系统默认好评。,2018-02-05 12:05:47,0,0,5
S***e,银牌会员,配送了7天！哈哈，七天,2018-02-05 12:03:40,0,0,4
j***u,铜牌会员,第一次给嫂子买这款手机魅族品牌，手感不错，京东购买的好喜欢，比店铺优惠，京东快递就是快第二天下午到货上门！这么冷天气特别感谢快递哥哥！非常不错！祝老板生意兴隆！,2018-02-05 11:48:15,0,0,5
l***哥,金牌会员,虽然换机等了一周时间，但对新机还是很满意,2018-02-05 11:39:26,0,0,5
j***z,银牌会员,除了长的好看没有任何有点，问他又没我活动，说没有，转眼降了一百块，售后服务就那回事，买的上一个才三个月，充电器已经坏了，我谢谢你，真的。,2018-02-05 11:24:53,0,1,1
P***f,铜牌会员,手机连个膜都没有，服务不到位，手机连Wifi都搜不到,2018-02-05 10:48:41,0,0,5
M***6,PLUS会员,京东不错 支持京东 发货快 服务好 支持支持,2018-02-05 10:19:37,0,0,5
j***d,银牌会员,用了一周才来评价，都一个样好,2018-02-05 09:39:27,0,0,5
风***3,金牌会员,和店里看的一模一样 正品,2018-02-05 09:34:40,0,0,5
l***e,金牌会员,外观很喜欢，工能很多，物流快，声音大。,2018-02-05 07:59:38,0,0,5
刘***7,银牌会员,用了这几天质量很好，是正品，电池耐用,2018-02-05 07:59:16,0,0,5
j***j,银牌会员,买给妈妈用的…她说挺好用的，屏幕也好大！,2018-02-05 01:56:08,0,0,5
0***k,钻石会员,一直都在京东买东西，正品行货，值得信赖，手机反应快，画面清晰，,2018-02-04 22:21:07,0,0,5
j***e,银牌会员,没有手机壳与手机膜了！失望！同款第二部手机了啊！??,2018-02-04 22:13:47,0,0,5
多***l,银牌会员,物品已收到，物流超快，大冷天的给送货大哥点个赞，感谢他们为我们的付出。手机包装完美，看着应该是正品，不过试了一下，运行速度没有想想的迅速，千元机应该也就这样的水平了，喜欢魅族的外观，先试试后续有什么情况再反馈，支持魅族，支持京东。,2018-02-04 22:07:39,0,0,5
j***5,铜牌会员,挺好的,2018-02-04 20:38:47,0,0,5
z***1,银牌会员,东西不错，我都用这是第二个了,2018-02-04 20:00:20,0,0,5
j***s,银牌会员,目前看还行，没发现什么问题，用一段时间在来,2018-02-04 18:44:26,0,0,5
j***p,银牌会员,手机很好，速度很快，功能很好用,2018-02-04 18:30:53,0,0,5
j***d,银牌会员,还不错哈哈哈,2018-02-04 17:10:14,0,0,5
D***A,银牌会员,在京东自营买东西就是快，今天23:00前下单，明天就发货，而且快递员服务态度特别好，灰常满意。。。,2018-02-04 16:25:09,0,0,5
开***嗒,铜牌会员,虽然快递慢了点   但是手机还是挺好   过年货物多  我能理解  好评,2018-02-04 16:13:55,0,0,5
j***r,铜牌会员,不错，第二次买了，反应很快了了了了了了了了了,2018-02-04 15:59:31,0,0,5
j***岩,金牌会员,经典机型，感谢小米，魅族才能更优秀，京东物流确实给力！,2018-02-04 15:21:27,0,0,5
j***8,钻石会员,买了两个魅族好用值得购买。。。。。。。。。,2018-02-04 15:16:00,0,0,5
心***8,银牌会员,有评价说是退货机，估计是恶意评价，看评价真的是什么都不要买了，我怀着忐忑的心情买了2部手机都是新的，并不是有些人说的是别人用过的退货机。在说这部手机，分辨率很高，电池冬天用也挺好，价格实惠很满意，京东质量把关还是很好的，放心买吧没错的！,2018-02-04 14:43:03,0,0,5
沙***峰,金牌会员,很不错的，之前用过note3，刚买一星期就被老师收了。这一次，哼,2018-02-04 14:34:39,0,0,5
3***子,铜牌会员,差评吧买不到一个月降价一百，这什么鬼，不靠谱,2018-02-04 14:25:55,0,1,1
j***j,铜牌会员,手机目前感觉还不错,2018-02-04 13:40:59,0,0,5
P***p,银牌会员,东西很棒，发货速度很给力，以后需要再次购买,2018-02-04 13:39:46,0,0,5
j***7,铜牌会员,很快，很好,2018-02-04 12:28:44,0,0,5
冰***天,PLUS会员,很不错，包装完好，很用心。是正品，质量好，速度也快，相信自己的眼光，下次还会再来的，实惠又安心的jd,2018-02-04 12:27:34,0,0,5
t***g,铜牌会员,给妈妈买的，评价不错，送货也很快！,2018-02-04 12:19:35,0,0,5
老***了,企业会员,还可以，老人用足够了,2018-02-04 12:02:34,0,0,5
j***星,金牌会员,第三次买了...,2018-02-04 11:57:48,0,0,5
j***a,银牌会员,挺好的，用起来很合适。,2018-02-04 11:31:56,0,0,5
1***p,PLUS会员,东西可以,2018-02-04 11:29:50,0,0,5
1***p,PLUS会员,速度可以,2018-02-04 11:29:20,0,0,5
心***1,银牌会员,手机太差劲了，我是趁大电量来的，结果充一次电只管半天，太垃圾了,2018-02-04 11:16:15,0,0,5
j***x,金牌会员,此用户未及时评价，系统默认好评。,2018-02-04 11:12:06,0,0,5
方***6,PLUS会员,挺好的,2018-02-04 09:41:24,0,0,5
向***斗,钻石会员,手机还不错，很好用的,2018-02-04 09:40:46,0,0,5
G***呵,银牌会员,很好用,2018-02-04 09:14:27,0,0,5
j***g,铜牌会员,就是快递慢了点，手机还行。,2018-02-04 09:04:59,0,0,5
j***6,银牌会员,手机一般般，可以应付打电话。就一个裸机，啥都没有，良心商家。,2018-02-04 08:34:34,0,1,1
j***5,金牌会员,支持京东，在京东卖了很多个手机了，,2018-02-04 07:38:35,0,0,5
j***7,PLUS会员,不错，给看人买的，挺好,2018-02-04 07:36:21,0,0,5
j***q,PLUS会员,手机价格实惠，性价比高，系统流畅。,2018-02-04 02:12:41,0,0,5
宋***见,银牌会员,相当一般啊，这个机子不行，不像是真的，可能是翻新机,2018-02-03 23:10:05,0,1,2
j***x,PLUS会员,好评，就是好评，不要问为什么,2018-02-03 22:58:10,0,0,5
姣***张,金牌会员,一般不评价，但是这次在京东合作商家那里被骗了，哎，看来不能盲目奔着大品牌的平台。,2018-02-03 22:43:23,0,0,5
t***r,PLUS会员[试用],给妈妈用的，屏幕大看得清,2018-02-03 22:31:54,0,0,5
j***w,钻石会员,一直在京东买东西，自营的东西都很不错，性价比很高，质量有保障，物流也很快。,2018-02-03 22:02:18,0,0,5
9***c,银牌会员,没有耳机，，，,2018-02-03 21:37:15,0,0,5
星***泣,铜牌会员,不错，手机不错，物流快，快递员态度好，,2018-02-03 21:34:29,0,0,5
康***子,钻石会员,第二个note5，这次还是高配版比原来那个还便宜100，电子产品真是贬值快。还是很满意的,2018-02-03 21:18:43,0,0,5
b***y,银牌会员,手机拿到了，和预想中差不多，快递很给力，头天买，第二天中午就到了，还没有怎么用，目前没发现什么问题,2018-02-03 20:22:03,0,0,5
j***q,PLUS会员,京东的送货速度真的无话可说，太快了，买的都是正品，值得信赖，包装好。,2018-02-03 19:20:42,0,0,5
j***s,银牌会员,手机收到，一家四口，四部魅族，支持国货，魅族加油↖(^ω^)↗,2018-02-03 19:19:52,1,0,5
j***j,银牌会员,这个送货速度特别快东西还满意。,2018-02-03 19:10:37,0,0,5
湖***g,PLUS会员,给老爹买的，暂时未发现有问题,2018-02-03 18:52:03,0,0,5
啊***杜,金牌会员,京东的送货速度真的无话可说，太快了，买的都是正品，值得信赖，包装好。,2018-02-03 18:46:47,0,0,5
j***泡,PLUS会员,京东的送货速度真的无话可说，太快了，买的都是正品，值得信赖，包装好。,2018-02-03 18:22:16,0,0,5
Z***c,银牌会员,退掉某note4x换了这款，感觉还行。颜值可以，但是拍照和流畅度还是差点气候。不过这个价格也就这样了。。,2018-02-03 18:15:39,0,0,5
土***色,银牌会员,快递很快，东西也不错,2018-02-03 18:12:20,0,0,5
小***D,金牌会员,发货速度快，包装完好！,2018-02-03 18:05:41,0,0,5
j***t,铜牌会员,可以,2018-02-03 17:42:25,0,0,5
j***b,银牌会员,第二次购买该品牌手机，物有所置，很好，值德买。,2018-02-03 17:29:34,0,0,5
嫩***六,银牌会员,机子不错。速度也很快。老人用足够了。,2018-02-03 17:21:58,0,0,5
9***6,银牌会员,此用户未及时评价，系统默认好评。,2018-02-03 17:19:16,0,0,5
1***7,钻石会员,不错，又快又好，相信京东,2018-02-03 15:57:25,0,0,5
j***8,银牌会员,此用户未及时评价，系统默认好评。,2018-02-03 15:39:36,0,0,5
天***城,金牌会员,千元手机，用的还满意,2018-02-03 15:14:44,0,0,5
清***f,PLUS会员,手机电池耐用，性能可以满足需求，系统流畅666,2018-02-03 15:12:46,0,0,5
蓝***少,金牌会员,不错的手机，就是没有耳机！！！！！！！,2018-02-03 14:25:43,0,0,5
d***t,银牌会员,还行，性价比很高，用起来很流畅，过段时间再看看,2018-02-03 13:20:30,0,0,5
x***1,金牌会员,挺好的，老妈很喜欢,2018-02-03 12:47:42,0,0,5
木***t,PLUS会员,帮别人买的，用了一段时间没出现什么问题,2018-02-03 12:44:32,0,0,5
