名字,会员级别,评论内容,评论时间,点赞数,评论数,评价星级
J***张,金牌会员,还行，就是开机动画太差了，关机动画也是，还没有note5的好,2018-02-16 21:08:38,0,0,5
J***8,钻石会员,不错。手机很漂亮,2018-02-12 23:29:37,0,0,5
x***-,铜牌会员,卖家发货神速，顺丰包邮好评，物流超快，送的膜套不行，耳机还可以，手机上手感觉很好，屏幕显示很棒，闪光灯很漂亮，黑色的颜值很高，再用几天回来追评,2017-10-14 10:50:12,1,0,5
j***o,银牌会员,和传说中一样超出了千元机的拍照水平，机子很漂亮系统很流畅，支持魅蓝note6棒棒哒！！！,2017-11-05 04:53:13,0,0,5
喵***眯,银牌会员,不错的，续航还不错，玩了一天半还有35的电，屏幕也不会发绿呀，但是和2000左右的手机比是要差些，但价格摆在这里，中规中矩啦！最后吐槽一下    64+4   实际只有51+3.5    ，是不是少太多了，电脑配件要是这么卖，早倒闭了，望改进,2018-01-25 12:59:23,0,0,5
y***健,银牌会员,真心觉得这个手机不错，感谢卖家的贴心服务，物流贼快，那天晚上买的，第一天晚上就来了，,2017-12-02 20:41:59,0,0,5
魂***界,银牌会员,一直都是用这个牌子的手机，性价比超高，而且用着比较顺手。京东快递还是一如既往那么快，第二天就到了。快递员服务也挺好了。,2018-02-02 20:24:30,0,0,5
j***水,银牌会员,手感不错，围观也很好的,2017-09-13 20:09:21,1,1,5
j***牜,金牌会员,手机真心不错，续航时间挺久的，正常使用两天肯定没问题,2018-03-06 11:05:02,0,0,5
j***e,银牌会员,比实体店便宜接近200块钱 而且还有赠品 是正品没毛病,2018-02-17 21:00:25,0,0,5
j***c,铜牌会员,发货速度挺快的，手机不错，运行速度很快，家人很喜欢！,2018-02-27 15:23:05,0,0,5
j***c,金牌会员,手感不错，比5代好很多了不卡不死机了，电池也够用一天，中度微信使用，不玩游戏，照相一般可能我技术问题，还有红包提醒功能了,2018-01-01 13:17:33,0,0,5
t***0,金牌会员,速度，拍照都还不错，性价比高，柔光双射照亮我们的美！,2018-02-24 20:54:13,0,0,5
j***0,铜牌会员,用了马上一个月了魅蓝note6真心不错王者荣耀也不卡真的很好下次下次一定在来,2017-12-20 12:24:18,0,0,5
u***u,铜牌会员,打开一看就很喜欢，使用了两个月后再来评价。感觉很好,2018-02-21 08:39:11,0,0,5
j***h,金牌会员,我家快成了魅族的粉丝了，手机质量也不错！支持魅族,2018-03-06 19:56:18,0,0,5
j***3,金牌会员,以前用过note5，有新版了，就换个新款的，体验一次,2018-02-03 22:44:32,0,0,5
j***x,银牌会员,帮老爸买的   用过魅族手机   感觉性价比蛮高,2018-02-28 18:24:20,0,0,5
按***7,铜牌会员,手机手感挺不错  也不卡  麻烦尽快帮我维修  刚买  一个月不到  屏幕摔坏了,2017-10-31 20:09:56,0,0,5
山***敌,金牌会员,手机运行速度很快，电量充足，一天下来不用担心电量不够,2018-01-30 16:37:11,0,0,5
青***吃,铜牌会员,给弟弟买的。总体来说性价比还不错。玩游戏挺流畅。,2018-02-27 14:56:39,0,0,5
白***8,PLUS会员,物流很给力，机器也不错！,2017-09-15 11:08:01,0,1,5
壹***k,PLUS会员,"昨晚下单今天上午就到了！这速度非常棒。！
         手机的反应也不错。！",2017-10-12 23:52:09,0,0,5
m***s,金牌会员,贴了膜，带了套，齐活了，挺好，过年带回家给老爸用，这么几款app足够了，空间大点可以多拍拍照片，足够了,2018-01-26 15:52:50,1,0,5
j***j,银牌会员,"从note3到note6,每种都买了，支持魅族",2018-02-24 16:38:49,0,0,5
j***p,铜牌会员,手机不错，很好用，大家也可以买来试试就知道了,2018-03-08 11:44:52,0,0,5
雪***檬,银牌会员,我买了这个手机后，打王者把把遇到挂机什么情况,2018-03-02 00:48:30,0,0,5
g***1,金牌会员,店铺服务很好，半夜都还有客服，态度很好，发货速度也很快，京东物流也很给力，手机是正品，下次还会在店家买手机！,2018-01-31 22:42:30,0,0,5
张***1,银牌会员,还好  总得来说 还不错 用了好几个魅族手机的了,2018-01-29 20:07:06,0,0,5
****Y,注册会员,高品质的手机，国货越来约给力。谢谢店家，谢谢顺丰,2018-01-28 21:22:26,0,0,5
i***a,铜牌会员,经过4天的等待终于到手了，以前就喜欢魅族的，一直没机会换，今天终于把它捧在手里了，外观很好看，运行流畅，妥妥的好评。先用些天试试。,2017-10-02 12:26:39,1,1,5
l***h,银牌会员,手机刚收到，外观还可以，还没用等过段时间再评论吧！,2018-01-12 12:23:03,0,0,5
j***8,铜牌会员,手机还不错，就是有时候会音响发出滋滋的声音。,2018-02-22 11:55:34,0,0,5
麦***轩,银牌会员,觉得还不错    不过充电好像要两个小时吧     挺喜欢这个手机的,2017-10-08 17:36:30,1,0,5
h***S,银牌会员,第一次在网上买手机，用了一段时间才平价，可以。,2018-02-05 22:09:17,0,0,5
w***j,铜牌会员,手机还可以，刚刚用，看这不错，不知道用这怎么样,2018-02-05 16:06:25,0,0,5
寒***水,金牌会员,使用中，具体效果目前不好说，以后再发补充。,2018-03-06 09:18:44,0,0,5
轩***言,银牌会员,还可以，物流，快，速度好，我只按摩爱你，，钢化膜，也不错，希望下次再来，,2017-11-21 19:25:58,0,0,5
j***n,银牌会员,在我的千呼万唤中终于到了，说实话比直营店的快递慢，打开包装以后看到包装变形，一看就是包装跌了，但看密封包装没拆，就是有点不舒服，这是我买的第三部魅族手机了，除了机身变金属机身外，别的没什么变化，双摄像头还可以吧，用用在说。,2017-09-16 23:41:21,0,1,4
j***a,铜牌会员,手机很不错，非常喜欢，快递发货也都是可以的,2018-02-28 10:27:20,0,0,5
j***b,铜牌会员,给我家哥哥买的，哥哥很喜欢，下单的时候出了点小问题，还好有贴心的客服??,2017-10-06 22:25:01,0,0,5
j***z,铜牌会员,这是我用的第三个魅蓝手机了，钟爱魅蓝。,2018-03-07 20:17:27,0,0,5
j***v,银牌会员,终于收到了期盼多时的的这款手机，实物直观感佷好，很经典，手感也好，加上赠品手机武装齐全，非常滿意，谢谢了！,2018-01-08 12:30:04,0,0,5
j***a,铜牌会员,手机外观漂亮，包装也很完好，物流给力！赞！,2018-02-03 12:58:04,0,0,5
j***t,金牌会员,用起来很流畅 ，我帮朋友买的 ，到时候有朋友要买的还是会把这款介绍给朋友,2017-10-20 20:58:17,0,0,5
海***落,PLUS会员,卖家服务挺好的，京东物流确实没得说，昨天下单，第二天早上就已经送到！这是第二次买魅蓝NOTE6，因为前面那个被被人偷了，暂时只是挂失了手机，所以就顺便重新买了个32G的。我个人是不怎么玩游戏，只是日常使用聊天看看网页视频什么的，这个手机配置足够了，用起来也挺流畅，说实话这个价格很不错，以后会继续支持我们魅族，希望越来越好！！,2018-01-13 00:35:52,0,0,5
i***N,银牌会员,以前用的魅蓝e，还不错，但是note6卡的要死啊，真后悔买这款手机,2017-12-01 17:09:08,0,0,5
p***r,银牌会员,手机被我女儿锁住了开不了锁了，要怎么开,2018-02-28 07:59:00,0,0,5
吊***x,铜牌会员,机子还可以，就是赠品有点差劲。还希望店家能改进一下。也祝店家生意兴隆。,2017-10-13 22:57:00,0,1,5
踏***痕,铜牌会员,不错不错，给朋友买的，真心不错，一直信赖京东，也信赖魅蓝。。。。,2017-12-02 17:30:17,0,0,5
j***9,铜牌会员,感觉挺好的，就是运行内存好像不够4G,2018-02-25 01:12:55,0,0,5
j***x,银牌会员,手机刚完感觉 还可以，但是送的东西都是坏的，真怕手机在玩段时间也坏了。,2017-10-07 14:15:33,0,0,5
U***W,银牌会员,这是我第三部note系列的手机，魅族我已经买了67部了。是个好品牌。,2017-10-19 21:20:39,0,0,5
j***v,钻石会员,手机不错，用起来很流畅，姐姐很喜欢～,2018-02-11 13:23:42,0,0,5
j***a,银牌会员,手机很实用，声音很大，系统也很流畅,2018-02-24 22:08:36,0,0,5
j***9,铜牌会员,这个价位还是可以的，手机，推荐一下,2018-02-21 11:49:13,0,0,5
j***p,银牌会员,很好看啊 本来在别家预定的 但是好久都不发货 就退了 买了这家的 手机拿到查了查 应该是真的 用的不久 所以还没发现什么问题 好评！,2017-09-11 19:12:02,0,1,5
j***5,铜牌会员,东西特别好，物流也快，妈妈很喜欢,2018-03-07 09:33:45,0,0,5
jd_182331seh,铜牌会员,手机还不错，可惜没赠品连个膜都没,2018-03-06 09:44:04,0,0,5
涩***少,铜牌会员,这个手机很好，下次还会再来买的。,2018-03-04 11:49:47,0,0,5
j***6,铜牌会员,手机可以 很合适 挺流畅买之前还有所顾及 现在拿到手了 很满意,2017-11-17 20:08:19,0,0,5
j***9,金牌会员,优惠促销活动，价格便宜值得购买。,2018-02-28 12:13:06,0,0,5
Y***o,银牌会员,手机今天刚到，等的有点着急，但终于了愿！手机不错，是正品，刚开始下单还真的有点害怕，嘿嘿，可能是网购经验不足吧。总体来说魅蓝手机不错，很值得购买。这次购买note因为它搭载了骁龙系统。另外，值得一提的是店主的态度很好，中间因为物流更新延迟和店主聊了几句，店主都很耐心的解答。总之，店家和手机都很不错。。。。（店主该不会生气吧。。。。。）。下次购买手机还在这家店购买。,2017-11-23 15:13:25,0,0,5
j***0,铜牌会员,这款产品用起来还挺好，以前就用的魅族，魅族手机性价比比较高。,2017-12-02 19:21:28,0,0,5
流***风,银牌会员,使用两个星期的心得：4000毫安电池只是虚头，不玩游戏不看电影只偶尔看网页聊微信，一天就没电了~运行速度还没我前一部手机两年前买的红米NOTE3快~短信银行信息阅读格式自动变换一个框的格式，原本只占1/5屏幕的短信立刻占了1/2，想看以前的短信就变得特麻烦，而且此格式不能转成普通阅读格式~客观来说，中规中矩，一分价钱一分货~,2018-02-07 11:29:05,0,0,5
j***9,银牌会员,手机收到是收到但有点不满意就是屏幕画质太过爆了手机也有点重。,2017-09-12 16:06:15,1,0,5
小***菡,PLUS会员,双11速度还不错、就是手机是移动4Ｇ+的，不过我用的就是移动！,2017-11-14 13:27:42,0,0,5
容***锋,银牌会员,手机外观挺好看，配置也算还可以。给妹换的手，反正她是挺满意?,2017-11-11 10:35:09,0,0,5
j***d,铜牌会员,还不错，手感很好，网速也不错，,2018-03-10 00:10:22,0,0,5
w***j,铜牌会员,质量！服务！性价比！都非常好！,2018-03-08 09:55:21,0,0,5
T***B,铜牌会员,手机收到了，现在在用紧，都几好用的,2018-02-02 12:47:40,0,0,5
j***a,铜牌会员,手机性能还行，荒野绝地很流畅，电池耐用，一局30分左右的王者也就4格电，不知道接下来表现如何,2018-02-15 21:34:45,0,0,5
j***9,银牌会员,就是像素不高，其他还行，不吃吧,2018-02-27 21:16:37,0,0,5
o***3,银牌会员,第一次用魅族，希望好用，送的小东西还可以，以后购物还是选京东。,2017-10-28 10:54:49,0,0,5
牛***吃,铜牌会员,手机很好用！颜值特别高！客服态度特别好，之前送的手机壳被压坏了。跟客服一说马上又重新发了一个过来！很赞哦！,2017-09-25 19:09:19,0,0,5
Q***s,银牌会员,说好的4G运行内存，64G机身呢！手机其他方面还可以，就是这里太坑了！各位买手机应该考虑考虑这方面的问题！,2017-09-20 12:37:57,14,1,5
送***8,银牌会员,魅族的系统 一直都不错，电池也给力，加油吧，感觉不错的一次购物之旅,2017-09-18 17:04:03,0,0,5
靠***h,银牌会员,很好用，反应非常块，内存大。,2018-02-27 22:56:21,0,0,5
j***c,银牌会员,此用户未及时评价，系统默认好评。,2018-01-25 19:25:59,0,0,5
j***8,银牌会员,坑，为什么上一个移动卡和联通卡，联通的网就不能用了呢？,2017-12-03 10:53:29,0,0,5
x***分,银牌会员,可以，清晰够，而且还速度快,2018-02-25 15:57:32,0,0,5
衿***歲,钻石会员,不错，续航能力强大，反应快,2018-02-24 16:58:56,0,0,5
j***哥,银牌会员,发货速度太慢，跟商家交涉无数次无果。送的耳机简直差到极致，不送还不影响心情，而且还是个坏的。还没有收货就降价了，这真让人无语了。客服敷衍，每次都是那些话，没有考虑客户的感受。包装简陋，都把我吓到了，还好没摔坏。我是个从来不喜欢说别人坏话的，这次真的伤心了。我有聊天记录，我是怎么失望的可以自己去看看记录。手机没有啥说的，我认可魅族的手机。用过最多的也是魅族。,2017-12-18 19:35:45,1,1,5
m***o,金牌会员,真不想说什么了，比杂粮机有良心多了，特别是拍照，不是一般的好。,2017-09-19 15:46:09,6,2,5
T***u,铜牌会员,手机是正版的，但这个手机壳有点忽悠人了。,2017-10-04 13:17:19,8,0,5
j***d,银牌会员,手机不错，很漂亮，拍照效果也很好，期待了很久，终于买了魅族的手机，超级开心的，第一次用魅族，希望能带给我不一样的体验,2017-11-06 13:26:56,0,0,5
j***d,铜牌会员,物流很好手机流畅电又耐用,2018-02-27 18:57:06,0,0,5
尬***7,银牌会员,挺不错的 ，给你五星好评吧，加油谢谢你会做的更好的。,2017-12-04 02:16:26,0,0,5
j***o,铜牌会员,物流不敢恭维，手机不错,2018-03-06 21:45:25,0,0,5
E***S,铜牌会员,收到就试了，感觉不错！,2018-03-06 10:08:48,0,0,5
C***O,银牌会员,商家发货很快、物流也给力。,2018-02-01 14:25:58,0,0,5
j***d,银牌会员,刚收到还没有用，物流很快。,2018-02-01 11:57:27,0,0,5
j***n,铜牌会员,绝对正品，用了一个月才评价的,2018-01-05 09:20:27,0,0,5
j***e,银牌会员,可以 没有让人失望 可是说好的发票没有  还要过几天申请,2017-10-04 21:06:27,0,0,5
丑***g,银牌会员,可以，是正品，很好用，就是有点厚了，实用,2017-11-18 20:19:52,1,0,5
爱***9,银牌会员,可以，手机，不错，值得购买呀！真的棒棒哒,2017-11-15 10:55:05,1,0,5
j***7,PLUS会员[试用],很不错的手机，值得买,2018-02-22 16:15:52,0,0,5
4***m,金牌会员,"9月18号收到的手机，从包装上看应该是全新的。拿到手机后，简单看看屏幕、后盖，试了试各项功能。
9月26日突然发现音量键上方的金属边框凸起（见图），但手机可正常使用。
9月27日，与卖家客服沟通，客服说需要检测，才能办理退换。",2017-10-03 06:57:14,1,0,5
l***5,银牌会员,魅族良心新机，给家人买的，好评，希望魅族做的越来越好！,2017-10-10 10:20:13,0,0,5
d***1,铜牌会员,手机收到，感觉还不错,2018-02-20 22:56:33,0,0,5
n***T,银牌会员,看着还可以，用了再说。,2018-01-29 18:04:00,0,0,5
稣***洲,金牌会员,手机挺好的这个价位用使用也不错，就是赠品太差还不如不送,2017-09-21 06:28:17,0,0,5
d***9,银牌会员,手机不错，正在用，应该还可以,2017-11-01 21:14:05,0,0,5
v***h,银牌会员,很好    非常好,2018-02-27 10:41:07,0,0,5
玲***儿,金牌会员,帮别人买的，据说用起来不错，给个好评,2017-11-15 10:31:47,1,0,5
身***僧,PLUS会员,很不错 双摄效果还比较满意,2017-11-14 21:53:57,0,0,5
方***喜,铜牌会员,很好用，很好的产品,2018-02-26 16:07:52,0,0,5
j***4,铜牌会员,物流很快 手机试了试 很不错 一次完美的购物,2017-11-30 14:16:10,0,0,5
j***1,金牌会员,真心不错，值得购买,2018-02-25 23:06:45,0,0,5
j***1,钻石会员,还可以吧！已经买第二只,2018-01-11 13:05:41,0,0,5
戰龍将,铜牌会员,还不错，就是快递慢,2018-02-21 18:43:08,0,0,5
n***8,银牌会员,非常好用的手机 经济实惠帮哥哥买的 很满意,2017-12-11 12:51:39,0,0,5
D***8,PLUS会员,很流畅，很好，手感挺好的，做工真的不错，有点像苹果哦,2017-09-18 17:32:07,0,0,5
j***l,银牌会员,外观精美，运行很快,2018-02-16 10:51:52,0,0,5
j***9,铜牌会员,手机不错   第一次用魅族   以前用vivo的  系统不一样虽然玩的有点不习惯  总体来说还可以。,2017-10-03 15:12:16,1,0,5
梦***花,钻石会员,收到的东东很喜欢，所以一定要好评！有需要再来！！,2017-10-17 23:58:03,0,0,5
j***c,铜牌会员,手机挺好用的，打王者又不卡，又便宜又好看,2017-12-19 02:28:06,0,0,5
何***文,铜牌会员,收到手机，经过官网查询是正品，己使用几天，系统流畅，千元机中的胶胶者，值得购买,2018-01-31 07:16:35,0,0,5
啦***_,铜牌会员,快递很给力，手机也非常棒，而且比别的店家便宜,2017-11-13 13:46:50,0,0,5
可***了,银牌会员,这个手机外观不是怎么很好看，不过挺实用的,2017-12-13 11:14:42,0,0,5
N***c,铜牌会员,手机还行，感觉挺好，就是有点重，有点耗电，易发热,2017-10-11 07:43:48,0,1,5
朱***华,金牌会员,手机感觉还好，不比苹果手机差，京东服务也到位，,2017-10-20 08:23:34,0,0,5
l***4,PLUS会员,给家人买的，用着非常流畅，很好值得这个价位,2017-11-18 20:04:29,0,0,5
邱***康,铜牌会员,不好意思 比较忙忘记来评论了 手机用着挺好的,2017-10-25 13:45:12,0,0,5
我***使,PLUS会员,手机还是不错的，速度很快。,2017-10-07 20:31:28,0,0,5
j***f,银牌会员,很好，拍照也比较清晰，外表又漂亮，是值得购买,2017-10-15 22:04:36,0,0,5
大***羽,银牌会员,没抢到京东的，就买了第三方的，还行吧用着还顺畅。,2017-09-13 19:26:34,0,0,5
G***5,银牌会员,在京东买的第三部手机了。,2017-10-13 19:22:45,0,0,5
j***f,银牌会员,手机还是很不错的，只是不知道为何偶尔有点卡！,2017-10-13 13:37:45,0,0,5
最***6,银牌会员,"到手后第一时间查询sn,正品无误。
就是物流速度不是很快，估计商家仓库不多",2018-01-24 14:37:59,0,0,5
李***9,钻石会员,还没用，用了就来评价吧，反正从外观上看还可以,2017-10-02 18:23:11,0,0,5
苏***杰,钻石会员,性价比很高，给父母买了两台，很好用。,2017-11-23 15:29:21,0,0,5
j***7,钻石会员,特意用了一段时间才评价的，质量不错。,2017-11-22 09:02:21,0,0,5
j***f,银牌会员,很好，手机很不错，适合玩游戏，一点都不卡,2017-10-19 14:06:44,0,0,5
吾***生,钻石会员,魅族手机一如既往的好，性价比高。,2017-12-20 20:17:53,0,0,5
折***葬,银牌会员,手机有点发烫，偶尔卡机，一般般了,2017-09-26 16:09:35,1,0,5
j***7,金牌会员,手机很好，很漂亮，系统很流畅，非常喜欢。,2017-10-09 14:37:45,0,0,5
快***3,PLUS会员,很好，不错，我很喜欢，好评。。。追评用一段时间再追加,2018-01-07 17:19:10,0,0,5
爱***帽,金牌会员,魅蓝note6很好用，机身也很好看,2017-11-22 10:30:08,0,0,5
j***1,银牌会员,帮朋友买的不知道怎么样，以后追评谢谢。,2017-10-19 19:57:30,0,0,5
g***g,钻石会员,帮朋友买的，很好，比实体店便宜,2017-12-20 16:31:24,0,0,5
夜***亮,金牌会员,非常好！正规商家。正品手机！满意。,2017-11-19 08:31:40,0,0,5
j***x,金牌会员,手机很不错，物流还行，总体很不错,2017-11-27 19:33:53,0,0,5
Y***U,金牌会员,挺实惠的，不好意思，很久没有确定,2017-11-26 16:37:04,0,0,5
无***殇,银牌会员,看着还行，先用着，到时候再来追加评论！,2017-10-09 14:12:44,0,0,5
g***n,银牌会员,好很好，额姐姐嗯呢就到家阿胶浆揭瓦揭瓦,2017-10-07 09:30:12,0,0,5
j***1,银牌会员,东西特别好，配的东西也很齐，不错好评,2017-10-15 16:39:49,0,0,5
潇***2,金牌会员,好用，下次还来买,2018-03-08 10:11:49,0,0,5
j***k,银牌会员,手机挺好！颜值高！就是物流慢，乡镇服务一般，,2018-02-06 19:49:25,2,3,5
m***e,银牌会员,还不错。还不错。还不错。还不错。,2017-11-14 20:16:50,0,0,5
翁***亮,银牌会员,非常好用，就是像机没有那么清。,2017-11-22 14:13:59,0,0,5
为***1,金牌会员,可怜死了。刚到手就把屏幕给摔了。。。,2017-10-04 17:05:37,0,0,5
n***E,铜牌会员,"质量不要太好啵
跟专卖电店的一样好",2017-10-12 23:16:25,0,0,5
h***Q,银牌会员,我刚到的手机耳机孔有问题，接触不良,2017-10-11 00:12:29,0,0,5
j***9,PLUS会员,魅族，坑   爹货，掉价货,2017-12-11 09:37:33,0,0,5
黄***8,银牌会员,物流快，手机像数差，,2017-10-31 10:44:47,1,0,5
-***叔,金牌会员,手机很喜欢？？？？？？！！！！,2017-10-25 08:15:55,0,0,5
j***s,银牌会员,价格不错，而且正品，性能强大,2017-11-09 17:44:14,0,0,5
j***m,金牌会员,挺好的挺喜欢的下次继续光顾,2017-11-23 09:59:23,0,0,5
北***1,银牌会员,是真的，两天就到了，也很快，满意,2017-10-05 12:50:38,0,0,5
你***批,银牌会员,又便宜了手机壳送来的很大很松,2017-11-05 21:15:39,0,0,5
枫***Y,银牌会员,不错，手感非常好，打游戏不卡,2017-11-04 23:18:43,0,0,5
p***1,金牌会员,真是不错呢，用起来都说好。,2017-11-19 20:42:06,0,0,5
x***G,银牌会员,前几天终于忍不住下单了，手机很不错跟网上说的一样好，照相一流外观也很漂亮。很满意。,2017-10-03 11:53:58,1,0,5
f***法,银牌会员,手机很好 但送但那些东西太差,2017-11-02 09:27:39,0,0,5
j***k,银牌会员,系统流畅，存储空间大，还送了钢化膜和透明套。用多几天再追评,2018-02-13 19:35:39,0,0,5
j***0,铜牌会员,第一次充电一个晚上还不满，,2017-11-11 08:00:49,0,0,5
冰***影,铜牌会员,外套漂亮，拍照神奇，非常满意！,2017-10-10 07:38:12,0,0,5
j***b,铜牌会员,手机很好不玩王者荣耀就玩下cf。我觉得现在cf是比王者荣耀要吃内存了的。对流畅度要求也高。在高画质下有轻微卡顿，来到中画质很完美。高帧率模式完美。还有屏幕什么的没有什么区别我怀疑那些说屏幕不好的都是黑子。一些小bug不升级系统就没有问题。第一次用魅族手机，以前都是用小米。魅族没让我失望???,2018-02-16 12:57:30,0,0,5
j***p,银牌会员,魅蓝手机第一次买，如果好用还买,2017-10-04 21:37:18,0,0,5
大***0,PLUS会员,价格实惠，质量不错???，买了很多次了，服务很周到！！！,2017-09-14 15:28:46,1,1,5
j***e,银牌会员,很不错 流畅好用！以后还会支持,2017-09-26 23:22:41,0,0,5
铁***沁,金牌会员,手机没问题全新正品  说实在的 东西整体给人感觉一般 赠品简直拉低了商品效果 不如不送 送的膜遮不住黑边 耳机包装盒破旧 左耳机电线裸露在外  四星吧 手机还是不错的。,2017-10-14 11:49:54,0,0,4
j***0,金牌会员,妈妈很喜欢 服务态度一流,2017-11-07 21:03:28,0,0,5
j***m,银牌会员,系统流畅，备用机首选，好评,2017-10-22 09:42:08,0,0,5
苏***嘚,铜牌会员,不要在这里买了，你们会后悔的,2017-10-05 11:27:11,0,0,5
j***3,铜牌会员,很好，配置高，颜值高，屏幕大,2017-10-05 00:49:15,0,0,5
V***t,金牌会员,很漂亮又时尚且光泽，爱不释手！,2017-09-18 17:57:42,0,0,5
爱***狂,银牌会员,手机是好的就是没有发票给我,2017-10-20 09:19:36,0,0,5
j***9,银牌会员,性价比比较高的手机，,2017-12-04 11:19:13,0,0,5
l***0,银牌会员,包装的挺好，物流有点慢,2017-11-17 18:45:40,0,0,5
j***u,铜牌会员,一直以来都用魅族，这次魅族note6真心不错，而且商家还送手机套，钢化膜，耳机，真的很棒。,2017-09-13 13:01:49,0,0,5
K***4,金牌会员,不错不错，京东买了两次了,2017-10-27 10:05:36,0,0,5
智***P,铜牌会员,感觉还不错，有点小清新。配置够用flyme也挺好用的。价钱摆在这边，不能奢求太多。,2017-11-09 20:40:56,0,0,5
注***者,银牌会员,手机很好用，都很喜欢,2017-11-24 18:43:23,0,0,5
I***D,铜牌会员,都好几天了，什么时候到货啊,2017-10-06 09:04:39,0,0,5
上***你,银牌会员,手机收到了，非常爽反应很快颜值也很高很喜欢这款手机，就是内存买得小了一点！,2017-10-16 10:03:23,1,0,5
H***-,银牌会员,可以 挺好的 不错,2017-12-15 08:09:12,0,0,5
s***b,PLUS会员,很好，为什么要6个字,2017-11-08 09:43:01,0,0,5
j***d,铜牌会员,还不错。。。。。。。。。,2017-10-05 19:41:50,0,0,5
j***4,铜牌会员,收到了，我弟给推荐的，拿到的和他一样，很赞,2018-02-01 20:44:45,1,0,5
jd_130710wew,钻石会员,物超所值，手机非常好,2017-11-01 14:09:29,0,0,5
b***2,金牌会员,给老妈买的，老妈满意,2017-10-31 20:46:20,0,0,5
j***n,金牌会员,手机收到，满意！！,2017-11-23 18:21:15,0,0,5
家***g,铜牌会员,今天刚到货，电池续航方面还不知道，外观是我喜欢的,2018-02-09 19:18:12,0,0,5
H***c,铜牌会员,第一次用魅族手机，希望很好用吧！手机配置在手机怎么看不到啊！无语了。。。,2017-12-13 18:16:05,0,0,5
j***9,铜牌会员,飞常漂亮??一天半就到了很快(⊙o⊙)哦,2018-03-06 13:38:10,0,0,5
赵***7,银牌会员,物流相当快，手机不错,2017-10-05 11:05:12,0,0,5
h***l,金牌会员,很满意，颜色也好看,2017-11-03 16:26:59,0,0,5
