名字,会员级别,评论内容,评论时间,点赞数,评论数,评价星级
z***1,铜牌会员,今天收到手机了感觉还是蛮不错了  因该不错用用陆续评价   喜欢,2018-02-03 12:44:01,0,0,5
丨***s,PLUS会员,买给妈妈用的！妈妈说挺好的！,2018-02-03 12:42:30,0,0,5
j***.,银牌会员,还不错，手感还行。,2018-02-03 12:15:00,0,0,5
时***偷,金牌会员,手机不错，给亲戚买的，,2018-02-03 12:13:54,0,0,5
j***l,铜牌会员,手机用起来不错,2018-02-03 12:13:54,0,0,5
j***w,PLUS会员,不错,2018-02-03 11:55:29,0,0,5
6***贝,银牌会员,手机收到了，款式很好看，质量等用了以后再来追评下,2018-02-03 11:14:23,0,0,5
X***g,铜牌会员,这才是快递，太快啦！上午订的手机，晚上就到了，刘宝小哥那么晚还在工作，辛苦了，诚信+速度，京东有你这样的勤快员工，好，给京东给小哥点赞！,2018-02-03 09:52:09,0,0,5
x***7,金牌会员,简单大气，外观漂亮，运行流畅,2018-02-03 09:47:17,0,0,5
小***5,金牌会员,不错的手机,2018-02-03 09:45:44,0,0,5
一***六,PLUS会员,可以的哦，很强大，很赞,2018-02-03 08:59:30,0,0,5
j***d,铜牌会员,手机很好，外观飘亮，反应挺快，,2018-02-03 08:47:51,0,0,5
昨夜之后,银牌会员,我用魅族好几年了感觉挺好的！,2018-02-03 08:36:08,0,0,5
1***动,PLUS会员,支持京东，京东物流我买东西哦！手机超好用我,2018-02-03 08:35:06,0,0,5
j***y,金牌会员,给老爸买的，不知道咋样，感觉还不错,2018-02-03 07:54:33,0,0,5
j***7,钻石会员,买了第二个了，非常好用的大手机！一直信赖京东,2018-02-03 07:36:15,0,0,5
j***2,银牌会员,很不错，不管是外观还是摄像,2018-02-03 07:03:22,0,0,5
j***4,铜牌会员,怎么没耳机。,2018-02-03 04:58:59,0,0,5
时***S,PLUS会员,不知道为什么金色的便宜这么多。,2018-02-03 01:12:21,0,0,5
仙***凡,PLUS会员,这款是大容量电池，续航能力强，运行顺畅，屏幕分辨率不错，照相清晰,2018-02-03 01:01:28,0,0,5
j***3,铜牌会员,手机收到了 就是不知道好不好用 过几天再来评论吧,2018-02-03 00:50:06,0,0,5
陈***辉,PLUS会员,非常实惠，而且配送速度也很快,2018-02-02 23:26:21,0,0,5
l***Z,银牌会员,还可以手机不卡，玩王者不卡，音质好,2018-02-02 22:29:44,0,0,5
j***m,金牌会员,还行吧，配置也挺好的，然后价格挺亲民的，就感觉，还能用吧？就是希望这个就是，能够装一个好一点的系统就好，不过这个价格也能买了这个，样子的手机已经算是比较好的了,2018-02-02 22:28:53,0,0,5
b***5,PLUS会员,活动价买的超便宜的，物流配送很及时，隔天就到货了。活动价买的超便宜的，物流配送很及时，隔天就到货了。,2018-02-02 22:16:56,0,0,5
李***好,PLUS会员,第四部魅蓝note手机了   操作系统非常好   性价比很高,2018-02-02 21:52:49,0,0,5
姜***雄,钻石会员,电池容量很大，续航能力强，屏幕效果好，运行稳定,2018-02-02 21:36:24,0,0,5
y***a,PLUS会员,不错，用着还可以，一直买魅族的。,2018-02-02 21:31:25,0,0,5
末***射,金牌会员,第二次购买了，非常好用,2018-02-02 20:57:27,0,0,5
福***2,PLUS会员,挺好的,2018-02-02 20:29:02,0,0,5
M***l,钻石会员,不错用了一段时间才来评价的,2018-02-02 20:16:59,0,0,5
朵***天,PLUS会员,发货速度非常快，包装非常仔细、严实，运送速度很快，很满意的一次购物.,2018-02-02 20:11:32,0,0,5
好***抱,PLUS会员,"质量非常好,真出乎我的意料,包装非常仔细,非常感谢 ,祝生意兴隆!",2018-02-02 20:09:46,0,0,5
z***1,银牌会员,这是一款超薄手机好用，质量好,2018-02-02 20:09:42,0,0,5
白***o,PLUS会员,"质量很好,性价比很高,快递速度也很快,以后会继续购买.",2018-02-02 20:09:01,0,0,5
北***年,PLUS会员,"质量非常好,真出乎我的意料,包装非常仔细,非常感谢 ,祝生意兴隆!",2018-02-02 20:07:42,0,0,5
卡***k,PLUS会员,"质量非常好，与卖家描述的完全一致，非常满意,真的很喜欢，完全超出期望值.",2018-02-02 20:06:13,0,0,5
j***5,金牌会员,帮朋友买的   朋友说很好用,2018-02-02 19:43:32,0,0,5
j***5,银牌会员,很好，拍照也清，物流也快…,2018-02-02 18:54:01,0,0,5
圣***斯,银牌会员,还不错，挺好的,2018-02-02 18:35:05,0,0,5
j***c,银牌会员,宝贝收到，手机还不错，不知道用起来怎么样！,2018-02-02 18:21:23,0,0,5
轩***哥,金牌会员,帮朋友买的，朋友很喜欢！非常赞！,2018-02-02 18:18:58,0,0,5
j***5,银牌会员,用着不错，反应很快，也不卡，手机正品,2018-02-02 18:18:56,0,0,5
j***w,银牌会员,给儿子买的，他很喜欢，物流超快，头天下单第二天就到了很满意的一次购物,2018-02-02 17:53:25,0,0,5
过***子,金牌会员,京东自营的魅蓝Note5全网通公开版3GB+32GB手机5.5寸屏幕值得拥有，只是声音有点单调偏小了点，其它还不错啦！,2018-02-02 17:45:42,0,0,5
j***h,银牌会员,刚刚拿到货 就是没有礼品,2018-02-02 17:31:18,0,1,5
j***m,金牌会员,质量很好，越来越相信京东了,2018-02-02 17:15:38,0,0,5
巫***哥,PLUS会员,手机很不错，价格实惠，给家里人用的！好东西，赞一个！,2018-02-02 17:06:31,0,0,5
Q***0,铜牌会员,晚上买第二天直接到，速度很快！快递小哥也很热情！虽然头一次在京东买东西，但是给我感觉是真的很好！,2018-02-02 16:55:55,0,0,5
半***颜,银牌会员,不错呦   下次还会购买的,2018-02-02 16:44:02,0,0,5
7***喜,钻石会员,反应快，照相清析，非常完美的一部手机。。。。。。。,2018-02-02 16:31:18,0,0,5
阴***3,银牌会员,合理。在千元机中算不错了。小小的遗憾，没有配送耳机，我一直理解的标配是手机充电器耳机，魅族刷新了我的理解能力?不过买来送长辈用的，用了几天，没卡机，反应也挺快的，当然3G的运行内存肯定比不过4G的，但是总体还算可以了。好几个朋友都用的魅族机，推荐给我买的，感觉没被坑。哈哈。京东快递哥哥服务态度很好，就是等的有点久，0.7公里的距离硬生生送了4个小时。。。绕了一大圈?,2018-02-02 15:50:58,0,0,4
周***9,钻石会员,太好了,2018-02-02 15:43:49,0,0,5
我***丶,PLUS会员,"东西收到，质量不错，与卖家描述的完全一致，非常满意,真的很喜欢，完全超出期望值，发货速度非常快，包装非常仔细、严实，物流公司服务态度很好，运送速度很快，很满意的一次购物。使用之后再来追评！！！",2018-02-02 14:56:27,0,2,5
j***x,铜牌会员,买了第二个了，这个价格还是值了,2018-02-02 14:28:26,0,0,5
邓***7,金牌会员,已经买第二台了，同一个产品，同一家店，快递不错，产品也不错，腿脚,2018-02-02 14:25:11,0,0,5
c***p,钻石会员,手感和工艺比以前的机型提升了。但是，系统越来越差，以前魅族2时，系统简洁好用，现在繁琐复杂，并且每一个应用都需要授权一大堆权限，例如，你一个计算器要什么联系人、电话、网络权限？并且如不对应用授权，应用就直接退出，不能使用。,2018-02-02 13:01:12,0,1,2
T***P,金牌会员,手机还可以，就是也太抠了吧，没要求你送东西，就连最基本的耳机也没有，抠得很，差评,2018-02-02 12:54:51,0,1,3
j***o,银牌会员,此用户未及时评价，系统默认好评。,2018-02-02 12:48:01,0,0,5
j***t,金牌会员,买的第三个note 5了，用着还不错，推荐亲戚朋友买，内存够我用的,2018-02-02 12:19:54,0,0,5
上***中,银牌会员,裸机连个耳机都没有,2018-02-02 11:44:52,0,0,5
j***m,钻石会员,还不错，爱不错，谁用谁知道,2018-02-02 11:00:21,0,0,5
t***6,银牌会员,真是神速哈！昨天下午买今天早上就到了！一家人都用这个手机！用起不错！价格也好公道！,2018-02-02 10:24:20,0,0,5
冷***荷,金牌会员,差评！死机黑屏，应用还会闪退，不知道有没有人看见，看见的最好别买了,2018-02-02 08:38:14,0,1,1
j***1,银牌会员,刚刚拿到手机，还不很熟悉，暂时没什么问题，,2018-02-02 07:29:32,0,0,5
勤***淘,银牌会员,试了试，很流畅,2018-02-02 05:20:46,0,0,5
j***l,铜牌会员,运行速度还可以，就是感觉手机像素都没有note3的好，最重要的是从外地调拨，一共4天才到手上！！！手机实际可用的内存一共才20多不到25G，手机也就这样吧,2018-02-02 03:23:20,1,0,5
l***u,银牌会员,买了两个  感觉很好,2018-02-02 01:59:17,0,0,5
j***d,金牌会员,用了几天，感觉还不错，不玩大一点的游戏比较适用！物美价廉！充电口比较紧，外放喇叭口的设计不是很喜欢！,2018-02-02 00:51:50,0,0,5
6***蔡,PLUS会员,为什么要让我评价啊 一点都不想评价,2018-02-02 00:42:49,0,0,5
c***o,PLUS会员,799 的价格还是可以的 对得起这个机器,2018-02-02 00:38:08,0,0,5
嘻***鑫,钻石会员,京东不错 发货快 服务好 支持京东,2018-02-02 00:06:42,0,0,5
开***家,银牌会员,给父母用的，还不错！,2018-02-01 23:58:07,0,0,4
枫***淤,PLUS会员,第二次在京东买手机啦，手机很漂亮，买来给老爸用的，一直信赖京东??????,2018-02-01 23:30:59,0,0,5
世***4,铜牌会员,很好这是我用的第二个,2018-02-01 23:28:00,0,0,5
0***0,金牌会员,很不错！！！！！！！,2018-02-01 23:12:23,0,0,5
V***V,PLUS会员,非常不错的手机，满意的,2018-02-01 22:05:06,0,0,5
j***7,铜牌会员,手机还可以，千元机里性价比最高的,2018-02-01 21:58:01,0,0,5
阳***热,PLUS会员,帮别人买好几个了,2018-02-01 20:46:40,0,0,5
l***7,PLUS会员,手机用起来很好，做工优秀，系统流畅,2018-02-01 20:23:16,0,0,5
j***0,金牌会员,送人的，还不知道怎么样，应该不错，相信京东。,2018-02-01 20:12:57,0,0,5
b***o,铜牌会员,物流快，手机也好用,2018-02-01 19:49:26,0,0,5
x***2,银牌会员,4000毫安的电池，没怎么用，一天都没到头就没电了,2018-02-01 19:05:00,0,1,2
j***u,铜牌会员,只能用29G，不过还可以,2018-02-01 18:30:10,0,0,5
j***p,钻石会员,手机送老人的，可是没送发票来呢,2018-02-01 18:12:27,0,0,5
李***o,银牌会员,非常好,2018-02-01 16:13:09,0,0,5
正***百,银牌会员,屏幕大，电池续航能力强，京东发货快，包装好，值得拥有，没有耳机哦！待使用一段时间后再来评价……,2018-02-01 15:07:51,0,0,5
j***t,PLUS会员,很好,2018-02-01 14:27:33,0,0,5
l***6,PLUS会员,很好，便宜实用，功能不错，好呵呵哈哈哈,2018-02-01 14:25:00,0,0,5
j***u,金牌会员,京东好，物流快，好，非常好。非常好，不是一般的好，而是很好。手机也好用,2018-02-01 14:20:17,0,0,5
j***1,PLUS会员,给老爸买的手机，直接送到了老家，据说挺好用的,2018-02-01 13:55:10,0,0,5
冷***吧,银牌会员,"手机收到是外包装边角有压痕,开机验货电量显示是52%,装卡后更新系统和安装应用时是1小时.电量就剩7%了.掉电有点恐怖.知道是不是手机在库里放久了的原因.别的都还满意.先自己充满电用段时间再来评价.",2018-02-01 13:53:58,0,0,4
K***R,铜牌会员,物流很给力，第二天就到货,2018-02-01 13:00:49,0,0,5
爱***华,金牌会员,一年前给我妈买了一个反映还不错，又给我爸换一个，续航不错，价格实惠，性价比不错！,2018-02-01 12:57:38,0,0,5
A***e,银牌会员,续航好，屏幕一般，其他也没什么问题,2018-02-01 12:36:26,0,0,5
枫***下,银牌会员,京东的物流确实没得说，甩开别的物流好几条街呀，正品行货，值得信赖，刚开始用还不错哦，不知道能用多久不卡。只能由时间来评定了！,2018-02-01 12:27:29,0,0,5
j***h,铜牌会员,这款手机非常超值，性价比高，电池4000毫安，刚升级得系统用起来流畅度太好了。京东商城的东西质量不错。香槟金这款性价比最高。799,2018-02-01 12:18:31,0,0,5
j***0,铜牌会员,挺好用,2018-02-01 11:59:17,0,0,5
王***4,PLUS会员,东西不错，下次再买！！！,2018-02-01 11:55:09,0,0,5
j***f,PLUS会员,手机不错，物流很快，给好评！,2018-02-01 11:29:07,0,0,5
j***k,铜牌会员,因为下雪的原因 物流速度慢了点 手机还可以 没有什么破损的地方,2018-02-01 11:25:13,0,0,5
aiyst2014,金牌会员,试用几天还不错，充电特别快,2018-02-01 11:24:27,0,0,5
幸***响,金牌会员,总体性价比还不错，发货挺快的,2018-02-01 11:16:40,0,0,5
j***2,银牌会员,东西还不错，:,2018-02-01 11:14:48,2,0,5
宇***U,银牌会员,我用3都用了一年半了，还是很6！电池感觉很强大！刚好看到活动，索性再买个,2018-02-01 10:47:53,0,0,5
j***e,铜牌会员,手机外观看起来挺好的，手感也不错。整体都很好，物有所值，值得购买。,2018-02-01 10:11:58,1,0,5
罗***d,金牌会员,可以的手机，第二次购买了，最给力的是京东快递！,2018-02-01 09:18:31,0,0,5
月***h,银牌会员,此用户未及时评价，系统默认好评。,2018-02-01 09:16:12,0,0,5
j***y,金牌会员,第二次购买了。电池容量大，待机时间长。快充功能很强大。好评！,2018-02-01 08:38:54,0,0,5
漫***煌,钻石会员,包装完好。物流速度飞快。配送员服务真贴心。,2018-02-01 08:02:57,0,0,5
j***b,铜牌会员,金属感很好  父亲很喜欢  性能也特棒,2018-02-01 06:59:31,0,0,5
P***d,铜牌会员,非常的满意，物流快,2018-02-01 06:28:12,0,0,5
L***U,铜牌会员,很满意，就是没有耳机和屏膜,2018-02-01 01:28:51,0,0,5
j***b,铜牌会员,挺好的手机，大屏清晰，上午买下午到,2018-01-31 22:42:18,0,0,5
j***z,银牌会员,此用户未及时评价，系统默认好评。,2018-01-31 22:26:37,0,0,5
1***8,铜牌会员,买来儿子就玩上了，说性价比很高！上网也快。,2018-01-31 21:57:51,0,0,5
苦***冰,PLUS会员,给老妈买的手机。先感受下还不错。,2018-01-31 21:01:30,0,0,5
j***d,铜牌会员,挺好用的我喜欢,2018-01-31 19:12:40,0,0,5
j***n,银牌会员,不是有赠品吗？发票？都没看到……?,2018-01-31 18:37:17,0,0,4
3***彬,银牌会员,手机已收到，快递是真给力，就是手机的开机键反应太慢了，指纹识别不好用，同样的手机就不一样，前段时间在手机店里买了同一款手机用着很好用，这个不行，不知道是不是毛病。,2018-01-31 18:35:54,0,0,5
j***g,银牌会员,手机很好用，再购一部。,2018-01-31 18:25:56,0,0,5
叫***M,PLUS会员,东西很不错，配送速度很快，以后再来买，很信任京东买到的东西,2018-01-31 17:52:03,0,0,5
A***号,PLUS会员,不错！,2018-01-31 17:14:59,0,0,5
1***p,铜牌会员,"不玩游戏可以.玩游戏卡,发热,总体来说不错这个价位",2018-01-31 17:06:37,0,0,5
j***4,铜牌会员,此用户未及时评价，系统默认好评。,2018-01-31 17:00:32,0,0,5
j***b,铜牌会员,"5月份买了一部note5,这次是给老妈买的，很满意，魅族手机性价比高，一直信赖！",2018-01-31 16:18:25,0,0,5
周***6,钻石会员,给父母买的，打电话，看视频都可以,2018-01-31 16:11:52,0,0,5
萌***丶,PLUS会员,买来当备用机，挺流畅的，价格也可以,2018-01-31 15:08:44,0,0,5
j***j,PLUS会员,很好,2018-01-31 14:27:25,0,0,5
H***B,钻石会员,帮朋友买的！,2018-01-31 14:10:59,0,0,5
独***n,银牌会员,手机还好，就是没有送配件,2018-01-31 14:10:25,0,0,4
爱***天,金牌会员,很不错，已经买了好几个了，帮别人买的，很好,2018-01-31 14:02:09,0,0,5
南***1,铜牌会员,第一次在京东上面买手机，觉得还行！,2018-01-31 13:34:03,0,0,5
j***2,金牌会员,此用户未及时评价，系统默认好评。,2018-01-31 13:12:17,0,0,5
y***8,PLUS会员,质量很不错，很满意好评了！,2018-01-31 13:09:33,0,0,5
j***g,金牌会员,快递很快就收到了，799这个假值了，在实体店 1千多，总的来说很不错，一次满意的购物，,2018-01-31 12:50:17,0,0,5
j***d,银牌会员,物流超快，款式新，用后才追坪，799元的价格超优惠,2018-01-31 12:06:12,0,0,5
j***e,铜牌会员,很满意，就是没有手机壳,2018-01-31 11:28:51,0,0,5
倩***笑,银牌会员,产品包装完整，手机触感很不错,2018-01-31 11:03:18,0,0,5
L***-,铜牌会员,"手机不能连接隐藏wifi,手动添加无法识别",2018-01-31 10:39:31,0,1,2
张***哞,PLUS会员,魅族的这款手机性价比很高，青年良品手机，系统也很流畅，好评，物流也很迅速。,2018-01-31 10:19:55,0,0,5
在***b,PLUS会员,魅族手机，青年良品手机品质很不错，系统也很流畅，物流迅速好评。,2018-01-31 10:09:53,0,0,5
在***b,PLUS会员,魅族青年良品手机系统很流畅，品质也很不错，很好的一次购物体验，好评，下次还来。,2018-01-31 09:56:12,0,0,5
z***9,金牌会员,给婆婆买的，手感不错，799真不错，待机网速等还没试用好，以后再追评,2018-01-31 09:34:14,0,0,5
就***氵,金牌会员,第三次买了,2018-01-31 09:24:57,0,0,5
j***3,金牌会员,买了2台手机，魅蓝note5，iphone7，说真的苹果使用体验真差。,2018-01-31 09:21:58,0,0,5
万***8,PLUS会员,做工不错，运行流畅，物美价廉，值得购买！,2018-01-31 09:02:00,0,0,5
刘***2,银牌会员,给妈妈买的很好用，又订了一个给老丈人用,2018-01-31 08:45:55,0,0,5
j***f,银牌会员,这款手机不错，便宜嘛，买来玩玩听听音乐就可以了,2018-01-31 08:38:34,0,0,5
e***b,铜牌会员,手机确实不错，如果有机会下次还要来买！客服服务非常好！,2018-01-31 07:38:25,0,0,5
x***e,银牌会员,很好,2018-01-31 03:34:44,0,0,5
L***2,银牌会员,手机挺不错的，物流也比较快,2018-01-31 01:46:08,0,0,5
花***6,PLUS会员,非常感谢京东,2018-01-31 01:10:16,0,0,5
想***哒,PLUS会员,挺好的选择,2018-01-30 23:40:56,0,0,5
j***4,银牌会员,帮老爸买的手机，用到现在还不错，功能也挺多的，还送了副耳机。只是看到现在价格只有799，感觉亏了100多啊！,2018-01-30 23:22:44,0,0,5
力哥,金牌会员,给老妈买的，她说很满意，我觉着还行吧。,2018-01-30 23:04:36,0,0,5
h***e,PLUS会员,物流很快，第二天就到了，五星好评,2018-01-30 22:22:11,0,0,5
j***c,铜牌会员,手机不错 挺便宜 当备用机足够了,2018-01-30 22:15:08,0,0,5
青***哥,金牌会员,满意，一直买魅族手机。,2018-01-30 22:04:07,0,0,5
j***a,金牌会员,首先说东哥的物流还是相当给力的，两日内到手，这款手机的性价比还是挺高的！,2018-01-30 21:43:03,0,0,5
j***7,铜牌会员,坑啊，前几天买还899，现在打开足足差了一百块钱。也是醉了,2018-01-30 21:38:29,0,1,1
j***v,金牌会员,手机像素非常好，使用流畅，外观美，非常喜欢，看着别人用挺好才买的,2018-01-30 21:35:02,0,0,5
1***1,银牌会员,此用户未及时评价，系统默认好评。,2018-01-30 21:20:05,0,0,5
j***w,银牌会员,第二次购买，真心不错。,2018-01-30 21:02:42,0,0,5
史***聪,银牌会员,智能手机一直用的魅族，漂亮 好用,2018-01-30 20:48:38,0,0,5
j***g,PLUS会员,很满意的一次京东购物，感觉还不错，和想象的一样。下次需要还来。,2018-01-30 20:47:47,0,0,5
o***i,银牌会员,给老人买的，等过几天回老家了再装卡试试,2018-01-30 19:42:21,0,0,5
j***0,金牌会员,此用户未及时评价，系统默认好评。,2018-01-30 19:38:45,0,0,5
j***7,银牌会员,手机也不给个耳机,2018-01-30 19:16:40,0,0,4
Y***8,金牌会员,去年买了note5，用着还不错，这次给家人买了同样的型号，便宜了三百多，很是划算，物有所值,2018-01-30 18:39:15,0,0,5
j***f,金牌会员,给老妈买的 她非常喜欢 性价比很高的一款手机,2018-01-30 18:30:07,0,0,5
糊***句,银牌会员,不错，还行,2018-01-30 17:57:12,0,0,4
滔***8,银牌会员,京东商城买东西已经很多次了，这手机买给小孩用的，价格优惠而且配置够用，魅族手机做得已经不错,2018-01-30 17:36:58,0,0,5
青***g,钻石会员,没有发票，京东太差劲了,2018-01-30 17:26:15,0,0,5
j***s,银牌会员,买几天，就降100，哎！幸好手机不错，用着手感好,2018-01-30 16:23:24,0,0,5
h***1,PLUS会员,这机做工当然是好，魅族手机本身也不差，加上是京东自营，就拍了一台，用了下真心不错,2018-01-30 16:16:00,0,0,5
卑***哥,钻石会员,手机不错  物流也快,2018-01-30 15:32:46,0,0,5
w***u,PLUS会员,送货速度快，质量售后有保障。喜欢在京东网购。,2018-01-30 13:54:56,0,0,5
高***帅,金牌会员,是新的，物流挺快的，晚上下单第二天下午到货，屏幕挺好的，因为女朋友之前就是这个手机她说挺好的！好评下次再来,2018-01-30 12:43:55,0,0,5
j***r,银牌会员,第二次购买，还可以,2018-01-30 12:20:35,0,0,5
j***j,铜牌会员,挺好的。,2018-01-30 12:03:26,0,0,5
j***六,PLUS会员,质量不错，大小合适，满意好评了！,2018-01-30 11:42:13,0,0,5
够***人,金牌会员,此用户未及时评价，系统默认好评。,2018-01-30 11:06:05,0,0,5
张***哞,PLUS会员,青年良品手机，性价比真的很高，手机系统也很流畅，好评。,2018-01-30 11:04:13,0,0,5
j***s,钻石会员,第二买这个机子了，这次买给爸爸用，希望好用,2018-01-30 11:03:13,0,0,5
j***0,银牌会员,说好的内存32G可是内存只有24g，是欺骗消费者吗？少了10g内存，送了20元现金券，有用吗？请买手机的用户，看清楚再买，不要再上当受骗了，,2018-01-30 09:56:53,0,0,5
j***u,铜牌会员,手机邮老家去了，老婆很喜欢，希望可以用两年吧，快递快的太快了，感觉嗖一下就到手了?，以前在京东买了个中兴，没想到用了三年还没坏，就是配置低了，玩游戏不行，接打电话还是没问题的，相信京东这次也不会让我失望,2018-01-30 09:53:29,0,0,5
叶***顺,金牌会员,很好用和新的没区别，用了一个多月才来评论，特别好用，,2018-01-30 09:43:36,0,0,5
j***v,金牌会员,物流很快，宝贝不错,2018-01-30 09:41:13,0,0,5
西***冠,PLUS会员,帮朋友购买，东西好，实惠，好用，便宜,2018-01-30 08:10:35,0,0,5
山***长,PLUS会员,京东配送速度就是快，在大雪影响下仍然1天送到，赞一个！,2018-01-30 05:57:00,0,0,5
j***d,金牌会员,正品！到货很快！就喜欢京东物流,2018-01-30 01:28:41,0,0,5
5***强,PLUS会员,非常满意，要疯的节奏啊，太棒了,2018-01-30 00:20:57,0,0,5
j***仔,银牌会员,还行,2018-01-30 00:09:04,0,0,5
j***u,银牌会员,相当不错，相信魅族，相信京东！,2018-01-29 23:15:29,0,0,5
何***8,银牌会员,已经第二次购买了前面那一台用了一年多。觉得还可以！电池好用以前一直用小米，现在觉得魅族还可以。推荐买魅蓝,2018-01-29 22:45:57,0,3,5
j***0,PLUS会员,发货超级快，特价用券购买，非常实惠，希望都做这样的活动，我会第一时间参加的！,2018-01-29 22:36:41,0,0,5
j***d,PLUS会员,虽然是去年的机子，但还是挺好用的，尤其是电池很给力,2018-01-29 22:33:29,0,0,5
紫***秀,PLUS会员,很不错的手机，质量很好，在京东购物非常方便和快捷，送货速度也非常给力，不错的平台，值得信赖,2018-01-29 22:13:45,0,0,5
自***8,银牌会员,手机收到了，今天试了一下，运行速度还可以,2018-01-29 22:13:24,0,0,5
学***8,金牌会员,很不错的手机。799买回来很好。买了第二个了。千元机也很赞。为国产加油,2018-01-29 21:57:19,0,0,5
j***1,PLUS会员,买了1个月，降了100多，麻了个吧的，感觉亏了一个亿,2018-01-29 21:51:33,0,1,1
古***庚,银牌会员,手机还是不错的，目前买回来一切都还好，用一段时间再看看效果,2018-01-29 21:38:58,0,0,5
z***9,金牌会员,帮着别人买的手机，应该没啥问题，以前也买过5的，比较好用。,2018-01-29 21:20:07,0,0,5
j***1,银牌会员,感觉手机太卡,2018-01-29 21:16:14,0,1,3
橙***子,金牌会员,很不错的宝贝，很喜欢，魅族的忠实粉丝，同样也是京东的老老老老顾客，信赖京东,2018-01-29 20:49:22,0,0,5
j***2,PLUS会员,京东的快递很给力，服务态度也很好(?▽?)，爸妈买的一样。我爸用的差不多，看看我妈用的情况,2018-01-29 20:33:41,0,0,5
C***l,PLUS会员,快,2018-01-29 20:12:30,0,0,5
崔***妮,金牌会员,上手感觉挺好，第一次买魅族，挺意外的。不比我的小米华为差。,2018-01-29 20:11:02,1,0,5
w***1,钻石会员,不错，挺好用的、价格适宜值得购买！,2018-01-29 20:10:45,0,0,5
2***2,钻石会员,宝贝到了，外观挺好的。不知道质量怎么样。用一段时间再说,2018-01-29 19:29:53,0,0,5
S***C,银牌会员,一直都觉得不错,2018-01-29 19:09:10,0,0,5
奔***s,PLUS会员,还可以吧，出了很久的了,2018-01-29 18:50:54,0,0,5
随***行,PLUS会员,手机非常漂亮 运行流畅 价格便宜 发货速度 好评,2018-01-29 18:25:29,0,0,5
j***p,银牌会员,手机不错，物流挺快，昨天下单，今天就到了。,2018-01-29 18:00:36,0,0,5
我***啤,PLUS会员,快递速度快，质量很好是正品,2018-01-29 17:54:32,0,0,5
q***航,PLUS会员,这个产品不仅经济实惠，还非常好用。我强烈推荐这款产品，真的是物有所值，值得大家购买。,2018-01-29 17:47:39,0,0,5
w***6,企业会员,头天买的第二天就送到了真是太快了,2018-01-29 17:44:44,0,0,5
