名字,会员级别,评论内容,评论时间,点赞数,评论数,评价星级
_***_,PLUS会员,系统不错，功能都挺顺手。正面home键很好用，指纹识别加返回等功能合并到一个键上还是比背面指纹指别方便多了。但是，低端手机的档次感还是很明显的，比799的红米note 4X感觉整整差了一个大的档次，可实际上才差100块而已。最后，最不好的是插耳机有明显电流声以及车载蓝牙播放音乐断断续续这两个严重bug，看魅族论坛，各种魅族的机型都有不少用户反应这两个问题，居然一直都没有得到解决，真是无语了。幸亏只是拿来当个iphone的备用手机用，如果要买来当主力手机的用户，建议慎重加慎重。,2017-08-23 09:11:28,0,0,5
j***l,铜牌会员,挺好的，给爸爸用,2017-08-23 09:10:40,0,0,5
小***啊,银牌会员,666还可以吧,2017-08-23 07:43:16,0,0,5
s***光,铜牌会员,性价比很高，质量很好，用了一段时间了，使用比较顺畅，刷微博微信都ok,2017-08-22 17:31:43,0,0,5
j***o,金牌会员,帮人买的 反应有点慢咯 发热厉害～,2017-08-22 16:56:19,0,1,5
j***e,银牌会员,满意满意满意,2017-08-22 15:08:55,0,0,5
密***猪,银牌会员,本商品是合约机，大家一定看清楚，这款手机到货以后不能用流量，客服让出厂设置，他还不负责恢复出厂设置以后的任何问题，大家说刚买的手机就让我恢复出厂设置，可想这款手机差到哪里去了，建议大家千万不要买,2017-08-22 14:53:01,0,1,1
退***胧,银牌会员,用着呢，感觉不错，挺好用的,2017-08-22 13:23:05,0,0,5
小***牛,银牌会员,很好，性价比很高，玩超大型游戏都不卡，必须给五星好评！,2017-08-22 12:45:21,0,0,5
j***p,银牌会员,手机不错，支持支持支持国产，手机都是在京东上买的，支持支持,2017-08-22 11:58:03,0,0,5
今***0,银牌会员,已经第二次够买了感觉这款给我之前那款功能不太一样啊,2017-08-22 09:22:18,0,0,5
y***S,铜牌会员,还可以，就是玩久了手机特别烫，耗电有点儿快,2017-08-21 22:40:39,0,0,5
j***m,铜牌会员,手机很好，用了段时间才来评价。值得购买,2017-08-21 22:19:31,0,0,5
张***3,银牌会员,还可以，用了几个星期了,2017-08-21 21:20:57,0,0,5
j***g,银牌会员,手机发货到货都很快  包装也很好 买了一个黑色 一个金色的 还赠送了手机膜和壳,2017-08-21 19:31:49,0,0,5
j***g,银牌会员,手机发货到货都很快 包装非常好  一下买了两部  性价比不错 推荐购买,2017-08-21 19:26:49,0,0,5
j***d,金牌会员,很好，实物比照片有质感，系统也挺流畅。,2017-08-21 15:47:54,0,0,5
j***d,铜牌会员,这个手机买妹妹的，她挺喜欢说还不错,2017-08-21 13:59:43,0,0,5
jd_好美梦成真,铜牌会员,手机收到了真的物超所值，非常棒谢谢卖家，非常守信用的商家，以后需要还来买的，全五星好评,2017-08-21 13:47:12,0,1,5
W***情,银牌会员,颜值高，包装好，防摔，魅蓝的第二款，很是喜欢,2017-08-21 12:38:50,0,0,5
2***3,金牌会员,手机真是差，买了两天回来就闪屏，退又不给退，后来说要我寄过去看看，有问题了只能换个，一等就是十几天，才给换了个，寄过去的邮费还要自己出，真是太坑太坑,2017-08-21 10:49:24,0,1,1
青***s,银牌会员,满意，第二次购买,2017-08-21 10:37:34,0,0,5
傻***3,金牌会员,手机不错。不过送的钢化模是坏的了。不满意,2017-08-21 10:08:04,1,0,5
jd_qydizv,银牌会员,这款手机，我是看了很久的，价钱也不错，818京东白条6期免息，给家人买的，这个价位也够用了，刚回来就用这个耍了一把王者，感觉还不错，能运行起来，还是很给力的,2017-08-20 18:50:47,0,0,5
j***6,铜牌会员,挺好的，非常满意,2017-08-20 17:10:57,0,0,5
j***7,铜牌会员,速度还蛮快，有问题店家都给以明确处理?,2017-08-20 15:45:10,0,0,5
北***_,PLUS会员,给母亲买的  很喜欢  性价比挺高,2017-08-20 14:44:27,0,0,5
a***C,银牌会员,给弟弟买的，用着不错反应快，一点不卡，给力！！！,2017-08-20 14:09:21,0,0,5
j***d,银牌会员,手机整体还行吧！用了再说。,2017-08-20 11:37:46,0,0,5
m***O,铜牌会员,很好，物超所值。,2017-08-20 11:18:05,0,0,5
L***X,铜牌会员,一般般，手机发热快。,2017-08-19 19:34:47,0,1,2
j***q,铜牌会员,非常漂亮，快递很快，,2017-08-19 13:58:06,0,0,5
同***n,银牌会员,先用段时间再看,2017-08-19 11:04:34,0,0,5
灏***a,银牌会员,挺好的挺好的哟啊,2017-08-19 10:00:52,0,0,5
1***p,铜牌会员,很好用，和网上的一样，而且快递态度好,2017-08-19 09:51:50,0,0,5
u***x,银牌会员,手机?拿到了了！很好,2017-08-18 18:58:28,0,0,5
舍***光,银牌会员,还是挺不错的 价格也不贵 物有所值,2017-08-18 18:19:57,0,0,5
a***K,银牌会员,宝贝收到很满意,2017-08-18 16:52:15,0,0,5
空***恩,银牌会员,手机非常满意,2017-08-18 15:07:58,0,0,5
H***p,银牌会员,客服态度差手机回来卡死了估计是翻新机，手机超级卡，王者容易打不成，大家不要在买了真的是被骗了希望大家不要上当了,2017-08-18 14:05:10,0,2,2
D***e,钻石会员,买的第六个手机，非常好用价格便宜,2017-08-18 13:51:27,0,0,5
D***e,钻石会员,买的第七个了，非常好用的手机,2017-08-18 13:50:53,0,0,5
j***l,银牌会员,手机很好看， 值得拥有。,2017-08-18 08:10:56,0,0,5
j***3,铜牌会员,真后悔没看评论就来了这间店买了这手机，说厂家售后网点检测无故障，跟她说了拍了手机的故障视频叫她给Q邮箱接收还不给！还叫我自己去找厂家网点处理，说得好像不关她们事似的！这个店只管卖，售后网点没把故障检测出来她们就不管你的了！只能自己吃哑巴亏！在这个店买手机你得做好会后悔的心理准备！,2017-08-17 14:16:17,0,1,1
j***5,铜牌会员,挺满意的，物流速度挺快的,2017-08-17 12:57:39,0,0,5
h***1,金牌会员,运行速度值得期待,2017-08-17 11:14:11,0,0,5
l***J,银牌会员,手机还行，是给朋友买的，只是后面有点小卡，其他人都蛮好的,2017-08-17 10:26:04,0,0,5
缘因友,银牌会员,不错，很好的一款手机，很好用！,2017-08-17 02:58:14,0,0,5
j***风,银牌会员,还不错，没什么毛病，就是钢化膜和手机不是很贴合，边上有空隙，手机发热比较大，不影响使用。,2017-08-16 16:31:46,0,1,5
j***9,银牌会员,照相不错，用起来方便。,2017-08-16 09:35:55,0,0,5
明***翊,金牌会员,给孩子买的，很喜欢，大小也合适，以前用的也是这个品牌的手机，因为用习惯了，所以这次还是定了这款手机,2017-08-15 20:44:07,0,0,5
j***q,铜牌会员,老婆说反应慢，点几次都没反应过来,2017-08-15 18:47:59,3,1,1
j***z,金牌会员,手机非常好用  但是因为手机钢化膜  给三星  这个钢化膜完全就盖不上  虽然是送的  太不像样了 拿来就是开封,2017-08-15 17:01:44,0,1,3
灵***呵,铜牌会员,还可以挺喜欢,2017-08-15 16:40:07,0,0,5
静***丶,金牌会员,还可以 就那样,2017-08-15 15:11:05,0,0,5
w***8,铜牌会员,手机很酷  颜值满意  运行快  但是WiFi这方面时好时坏 有点让我头疼  还有就是内存卡不能插  其他方面都不错  卖家送的膜也还不错  总得还是比较满意,2017-08-15 11:45:26,0,0,5
k***R,铜牌会员,很满意，快递员，非常好！,2017-08-15 10:15:43,0,0,5
skkikKWOXrmY,银牌会员,手机很满意，就是送的钢化膜不好，贴了后有白边，难看死，快递哥哥很棒哦，等我10分钟还没有脾气，给快递哥哥一个大大的赞,2017-08-15 09:14:04,0,0,5
一***羊,银牌会员,用了几天才来评价的，物流很快，手机也满意，比店里买的优惠点，性价比高。收到手机就拍了几张相片效果满意,2017-08-14 22:26:39,1,0,5
j***p,银牌会员,音量太小了！难道标配里面没有耳机吗？简直是龟速。,2017-08-14 13:52:53,0,0,5
j***e,铜牌会员,收到了，魅族一直非常给力！,2017-08-14 11:10:25,0,0,5
让***7,钻石会员,老爸很喜欢，手机挺不错！,2017-08-14 10:23:42,0,0,5
j***e,银牌会员,送的钢化膜是碎的，拍的放到最大有点不清晰,2017-08-14 06:09:31,0,0,4
杨***i,铜牌会员,手机蛮不错的，就是那个像素不怎么好呀，那个操作还不错，我买了有那么久了，我现在才来评价，现在也还不卡机了,2017-08-13 20:57:36,0,0,5
T***x,银牌会员,手机拿到快递很给力，下单2天就到了。这个价位的手机反应还是很快的,2017-08-13 19:48:06,0,0,5
j***w,铜牌会员,看着很不错，刚开始不会弄，客服也很耐心的解答。,2017-08-13 18:32:43,0,0,5
孟***伟,银牌会员,手机很好用，给家人用的……,2017-08-13 17:34:48,0,0,5
9***宁,银牌会员,还行吧，就是上网有点卡，,2017-08-13 15:46:35,0,0,5
B***N,银牌会员,大家千万别买！买了就后悔！这手机只能打电话！想玩别的就别想了！超级卡！还不如买个老人机！千万别买！只能打个电话！我是被坑了！大家不要上当！！这不良商家,2017-08-13 15:42:04,0,2,1
j***d,铜牌会员,不错的，值得拥有,2017-08-13 13:34:17,0,0,5
j***u,铜牌会员,物价所值！我是买给老妈用，她说手机不错。无论是手感还是软件打开都相对比较快，赞赞赞??,2017-08-13 10:26:52,0,0,5
J***R,银牌会员,产品好用物流够快好满意,2017-08-13 10:24:40,0,0,5
j***a,铜牌会员,手机很快 运行也不错 也不会卡 应该是正品的还没进行查伪 不过手机是真心赞,2017-08-13 09:57:04,0,0,5
D***C,铜牌会员,买了几天了，感觉非常好用，又直播又打游戏都不卡，手机性能挺好的，手机外观真的好看，又便宜，又好用，超喜欢一部手机的。,2017-08-13 09:56:32,0,0,5
加***1,钻石会员,运行非常流畅，拍照清楚，发热量，满意,2017-08-13 06:47:59,0,1,5
j***d,银牌会员,不满意，一点不好玩,2017-08-13 00:43:27,0,0,5
j***z,银牌会员,还不错，以后再追评,2017-08-12 21:36:58,0,0,5
j***d,银牌会员,麻蛋不给我耳机,2017-08-12 21:27:13,0,0,5
j***1,铜牌会员,高清亮丽，非常好看。,2017-08-12 20:56:35,0,0,5
j***8,银牌会员,非常好,2017-08-12 16:45:54,0,0,5
j***4,金牌会员,第二次买了，给朋友买的，据说还行,2017-08-12 14:30:07,0,0,5
呼***粥,银牌会员,这个手机性价比真的好。具有很多高价格手机也具有的功能，而且漂亮耐用。很好,2017-08-12 13:58:36,0,1,5
j***f,铜牌会员,好慢，有好卡。,2017-08-12 10:03:50,0,1,1
j***8,铜牌会员,很好。很好用。,2017-08-12 08:51:41,0,0,5
江***北,金牌会员,除了是移动定制的，其他都蛮好……,2017-08-12 03:25:20,0,0,5
4***w,银牌会员,"没别的，非常棒。
支持国产。
没毛病！",2017-08-12 02:06:09,0,0,5
Z***E,银牌会员,手机还可以，就是说好要开发票，结果卖家忘掉了，真是不够专业,2017-08-11 18:21:01,0,0,5
j***n,银牌会员,手机屏幕划好几下才有反应，用了一个月给出的评价，我不在乎是不是翻新机，给老人用，能用就行，结果老人打电话说玩消消乐划半天才行，不然没反应,2017-08-11 15:10:11,0,1,1
s***宋,金牌会员,衣服热火所锁屏,2017-08-11 11:40:05,0,0,5
j***1,铜牌会员,好用，这个系统好。,2017-08-11 11:08:55,0,0,5
感***m,铜牌会员,手机用了几天了，反应快，电量续航也还行，反正也不玩游戏，平时用用足够了！像素也不错，整体很满意！,2017-08-11 10:52:13,1,0,5
1***p,钻石会员,用了很多台魅族，这是给老妈买的。一般般吧,2017-08-11 10:23:49,0,0,5
j***d,铜牌会员,这款手机非常不错，反应也很快，很有手感，但是外面的钢化膜有点不合适，希望能有所改进???,2017-08-11 06:19:37,0,0,5
H***S,银牌会员,魅族手机很好用，我家现在四部魅族，一直都是好评～～,2017-08-10 21:06:08,0,0,5
j***7,金牌会员,，你们的支持，,2017-08-10 20:07:52,0,0,5
w***9,银牌会员,手机很好用，送的钢化膜和手机壳，总体来说还不错，但是钢化膜不能把屏全部覆盖。,2017-08-10 18:56:13,0,0,5
J***8,银牌会员,物美价廉 物有所值 包装完善 快递便捷。很好 完全满意！,2017-08-10 18:30:15,0,0,5
e***N,银牌会员,刚拿到手机开不了数据，不知道怎么回事？??,2017-08-10 18:29:07,1,1,1
那***门,金牌会员,还行！！！！！！！！！！！！！！！！！！！！！！！！！！,2017-08-10 16:45:14,0,0,4
A花空,金牌会员,嗯，用用还是不错的，速度挺快，魅族一直在用。也便宜，值得拥有,2017-08-10 15:06:11,0,0,5
7***0,钻石会员,东西很不错，一直在用魅族手机,2017-08-10 14:58:55,0,0,5
1***p,铜牌会员,挺好的很喜欢！,2017-08-10 10:21:42,0,0,5
j***0,金牌会员,差评wpjwgw.wmtm.,2017-08-10 10:19:58,0,1,1
j***x,PLUS会员,可以！！！！！！！,2017-08-10 05:47:28,0,0,5
E***_,银牌会员,给老爸买的。手机还不错。 就是送的膜吧。本来就是送的也不值什么钱。也不至于送个坏的膜吧。贴上去才知道是翘的真无语,2017-08-10 00:54:39,0,1,3
j***9,银牌会员,价格优惠，服务态度好,2017-08-09 20:46:39,0,1,5
j***m,金牌会员,一般一般一般一般,2017-08-09 19:28:51,0,0,5
与***老,银牌会员,质量很好，给弟弟买的，玩游戏使，感觉还行，质量可以,2017-08-09 17:22:08,0,0,5
j***h,银牌会员,好，值得购买！,2017-08-09 16:30:16,0,0,5
j***l,铜牌会员,手机是很不错，但是这快递真的得好好查看怎么回事了，在这么多年来，我在京东买的任何东西都是很不错的宝贝加很不错的速度，一向有今日买，明日到的速度，但是这次我真的很失望，所以最后一星没有给是不给快递，而不是给店家，所以大家考虑考虑，看准买，谢谢！,2017-08-09 14:36:44,0,0,4
jd220649rbm,银牌会员,手机很好，还送了钢化膜和保护壳，希望大家可以支持。,2017-08-09 13:48:06,0,0,5
w***4,金牌会员,整体来说还是不错的。,2017-08-09 12:39:16,0,0,5
j***d,铜牌会员,很好，和店里一样,2017-08-09 11:03:11,0,0,5
j***7,铜牌会员,物流很快，手机完全超乎想像，这个价钱很值。,2017-08-09 10:12:30,0,0,5
麥***D,金牌会员,可以的买给长辈的。。。,2017-08-08 20:07:38,0,0,5
j***2,铜牌会员,很好，物流也很快，用起来不卡，画面清晰，音质也不错,2017-08-08 19:51:29,0,0,5
j***k,银牌会员,之前买过这个系列的手机，非常经用，所以又买一个，希望能用久一点,2017-08-08 19:26:30,0,0,5
a***5,银牌会员,大小刚好 送给朋友 外观可以,2017-08-08 15:53:11,0,0,5
I***m,银牌会员,很好。。。。。,2017-08-08 15:07:36,0,0,5
X***L,金牌会员,还可以，价格挺实惠，也挺好用,2017-08-08 13:34:17,0,0,5
j***b,银牌会员,很好，这次已经是第三台买了，买给老妈用的，并且运行很快，操作也简单，老妈喜欢。,2017-08-08 11:38:27,0,0,5
新***帝,银牌会员,这款手机，嗯非常好用，嗯，白的比较好，好看，然后性能又好，所以说，价格还是比较适中的那种，之前换了，换了几台手机，也是用魅族的,2017-08-08 10:37:37,0,0,5
j***d,银牌会员,挺好用的，到目前为止，没有问题，满意,2017-08-08 08:35:47,0,0,5
j***b,铜牌会员,用着发烫的   有点色差,2017-08-07 18:48:30,0,1,2
j***l,钻石会员,使用了一段时间以后才来评价，用起来很顺手，一点不卡，很愉快的一次购物,2017-08-07 14:50:27,0,0,5
J***S,铜牌会员,还算是满意吧，暂时没发现有什么不好的地方。,2017-08-07 11:44:30,0,0,5
C***祥,钻石会员,说的是全网通！给我发的移动定制版！我两个号码，联通用来上网，根本无法切换！详情中也没有任何标注！真是够了！！！,2017-08-07 10:30:53,0,1,1
j***a,铜牌会员,外观很漂亮，像素一般般，总体来说挺不错的，就是手机充电的时候会发烫，玩久了也会发烫，快递员的服务态度很好！,2017-08-07 08:18:10,0,0,5
坚***雪,金牌会员,挺好用的挺好用的,2017-08-07 00:45:37,0,0,5
j***f,钻石会员,手机很棒，价格实惠,2017-08-07 00:07:20,0,0,5
卉***1,金牌会员,还可以吧，不过玩游戏就很容易卡了,2017-08-06 19:35:34,0,0,5
j***f,铜牌会员,手机很好，快递又快，我很喜欢,2017-08-06 13:40:16,0,0,5
I***B,铜牌会员,刚拿到手 还不错 外观也可以,2017-08-06 13:23:24,0,0,5
jd_152784syt,铜牌会员,还行，不错的魅蓝5,2017-08-06 12:22:18,0,2,5
易***彬,钻石会员,可以，不错??,2017-08-06 11:05:20,0,0,5
唐***姐,铜牌会员,昨天下的单，今早就打电话过来让我去领取快递，这物流没得说太给力了！很满意的一次购买，第一次在京东购买手机，手机很不错，是正品，包装也很好，很喜欢，五星好评！,2017-08-06 10:51:39,0,3,5
刚***宇,银牌会员,手机不错，挺好用，反应快，五星哦,2017-08-06 09:45:54,0,0,5
拾***味,银牌会员,差评...差评...差评...很不满意的一次购物...手机刚买回来就发热...而且是越发的热???,2017-08-05 18:54:42,0,4,1
T***u,铜牌会员,手机特别好，给爸爸买的，他很喜欢，特别符合我对手机的预期。给老爸配了同色的手机壳??,2017-08-05 18:52:25,0,0,5
无***州,银牌会员,非常棒非常棒非常棒，重要的事情说三遍，推荐,2017-08-05 14:12:24,0,0,5
m***a,铜牌会员,很满意。很好用！！！,2017-08-05 11:53:25,0,0,5
aNTgGZfMSQwT,银牌会员,手机用着还不错，，就是声音有点小，有时候来电话都听不见,2017-08-05 09:25:59,0,0,5
j***1,铜牌会员,还可以，能玩王者荣耀。,2017-08-05 06:17:38,0,0,5
j***z,金牌会员,挺好的，买这个就是接打电话用的，待机时间很长，一天去了8%,2017-08-04 22:59:04,1,0,5
j***c,铜牌会员,很不错呢，物流很快，快递负责，手机买给妹妹的，很适合学生。还有送透明的壳，和钢化膜。很实惠。,2017-08-04 20:29:10,0,0,5
z***1,银牌会员,用了一段时间感觉还不错，没啥毛病，运行速度也挺快。以后继续支持吧！,2017-08-04 20:17:23,0,0,5
jd_182661kno,铜牌会员,我拍的公开版，到货后发现是移动版，还美其名曰“移动公开版”，你看看这是什么开机界面？还有卸载不了的移动软件！商家还怪我不看详情，那我问问你，我拍的公开版，凭什么给我发移动版？你要是想卖移动版你直接再开一个选项不好了？欺诈消费者！送的这钢化膜边缘都贴合不上，不喜欢,2017-08-04 17:31:48,1,2,1
随***6,银牌会员,还可以吧，物有所值,2017-08-04 16:02:43,0,0,5
j***c,铜牌会员,给妈妈买的手机，很满意,2017-08-04 15:24:03,0,0,5
D***鱼,铜牌会员,还没用，快递太慢减一星,2017-08-04 14:41:01,0,0,4
乖***多,银牌会员,给母亲买的，手机不错，外观和功能都够用，赞一个,2017-08-04 14:12:50,0,0,5
j***8,铜牌会员,非常感谢满意,2017-08-04 10:43:40,0,0,5
j***q,银牌会员,商品价格公道，商品质量好，送的小配件也很实用，对本次购物很满意。,2017-08-04 07:19:05,0,0,5
L***r,银牌会员,商品还可以，物流也快，快递员态度很好。值得信奈,2017-08-04 06:49:00,0,0,5
j***2,铜牌会员,感觉着部手机还不错,2017-08-04 00:53:16,0,0,5
漫***独,钻石会员,很不错，看起来很漂亮,2017-08-03 21:20:30,0,0,5
j***i,银牌会员,手机，小巧轻盈，适合女孩用，运行速度很快，移动版,2017-08-03 20:27:53,0,0,5
龙***骄,铜牌会员,手机很棒，全网通的，用着很流畅，颜色也是我想要的，已入手，发货挺快,2017-08-03 18:45:45,0,0,5
鱼***呦,银牌会员,触摸不灵敏，有时候按不到，得用力点安才行，别的不错,2017-08-03 17:46:31,0,0,4
再***遇,铜牌会员,不失望也不惊喜,2017-08-03 16:42:34,0,0,4
Y***v,铜牌会员,物流真的好快，速度没得说，一天就可以收到，手机还可以，同价位的手机，值了。,2017-08-03 14:52:37,0,0,5
j***a,铜牌会员,刚刚收到，还没验证，应该是正品的,2017-08-03 14:40:14,0,0,5
j***f,铜牌会员,破手机一点都不是正品，开机死慢，赠了个钢化膜一点屁用没有，贴都贴不上，服务态度极其烂，发货5天才到，从来没见过京东还返现，这是第一家，返现的店跟一样肯定不是什么好东西，千万别买，别上当,2017-08-03 11:13:54,0,1,1
j***d,铜牌会员,不错！！！！,2017-08-03 10:21:39,0,0,5
j***b,铜牌会员,感觉可以。整体好评吧。,2017-08-03 09:52:04,0,0,5
j***j,铜牌会员,挺好的一次购物，包装的也好,2017-08-03 09:27:45,0,0,5
j***b,银牌会员,手机不错哟，可以，很喜欢，已经是第二台了，准备再给老妈也买一台。,2017-08-02 20:35:05,0,0,5
小小瑩火虫,银牌会员,说好的32G内存，明明只有29G，不相信魅族了,2017-08-02 19:28:39,0,4,3
z***g,银牌会员,送给家人的，还没看到，物流很快！！！,2017-08-02 13:30:31,0,0,5
z***g,银牌会员,送给家人的，还没看到，物流很快！！！,2017-08-02 13:30:31,0,0,5
马***4,银牌会员,给老父亲买的看着不错，初步印象，具体等用后评价，给个好评初步,2017-08-02 13:06:58,0,0,5
s***t,铜牌会员,手机性能不错，不卡，就是原配钢化贴上去不行，控制不了。还得自己买一个钢化膜。,2017-08-02 13:05:10,1,0,4
1***p,银牌会员,挺实用的，价格也合适，已经买了四个了，支持魅族,2017-08-02 12:57:22,0,0,5
S***P,铜牌会员,手机很好，带电挺好，要买的快点下手,2017-08-02 09:27:29,0,0,5
j***7,银牌会员,选到移动定制版！内置软件多，其他的都没有什么不好的！,2017-08-02 08:54:44,0,0,5
上***敌,PLUS会员,买来是送人的，物流也挺快，然后送的人他也挺喜欢。,2017-08-01 21:14:05,0,0,5
j***d,铜牌会员,手机收到是那种移动全网通 用联通卡 经常断网 最主要充满电看视频只能用一个小时就自动关机了 没电了 找客服 说报服务 申请维修 结果几天了 都没人了,2017-08-01 21:11:44,0,1,1
d***H,铜牌会员,收到了手机还不错，就是里面少了个耳机，买给老爸用的，反正他也用不着，有没有其实无所谓。不过就是心里面不怎么舒服。,2017-08-01 19:30:30,0,0,5
G***f,银牌会员,感觉还可以，给父亲买的,2017-08-01 17:59:45,0,0,5
j***7,铜牌会员,手机轻巧可爱，屏幕也够大，就是不知道玩游戏效果怎么样，用过后再评价,2017-08-01 17:52:18,0,0,5
转***5,铜牌会员,手机好看，是我理想的手机，最重要是好用，价格也实惠！,2017-08-01 16:55:18,0,0,5
1***雷,银牌会员,可以,2017-08-01 16:42:16,0,0,5
j***7,银牌会员,用的很流畅值得入手,2017-08-01 12:53:32,0,0,5
j***7,铜牌会员,不错，挺好用的,2017-08-01 10:36:09,0,0,5
j***3,铜牌会员,手机卡，突然黑屏，半天才反应过来，充电掉线，发热充不进去电。与客服留言无回复！买后第一天的评价,2017-08-01 09:29:10,0,1,5
-***壞,银牌会员,手机还不错，值得赞扬,2017-08-01 06:12:16,0,0,5
j***c,铜牌会员,很满意非常满意,2017-07-31 18:12:50,0,0,5
jd_156610zny,铜牌会员,给爷爷买的，爷爷很喜欢??,2017-07-31 14:36:13,0,0,5
幽***神,金牌会员,从下单到收货仅仅3天就到了物流很快的，到货之后魅族手机感觉就是物美价廉，较高的品质，低廉的售价使用起来系统处理器很流畅的,2017-07-31 13:20:44,0,0,5
l***j,银牌会员,一身的小毛病，屏幕灵敏度极差，熄屏状态下的手势根本不灵，信号差，几天不知道又给我唱了哪出，4G信号没了，4G总是闪了一下就没了，好不容易稳定了现在居然还不起作用了，完全跟没开数据一样。,2017-07-31 13:00:57,1,1,1
菲***倩,银牌会员,用了近10天了，感觉像素太差了，电池也很差，只接几个电话待机只有一天多，建议别买。,2017-07-31 08:00:46,0,1,1
D***e,钻石会员,非常不错，帮同时买的第四个了，信号又好，手机又好用,2017-07-30 20:15:55,0,0,5
j***f,铜牌会员,好用还漂亮，貌似真的是正品，但是没得发票,2017-07-30 19:10:21,0,0,5
我***Y,银牌会员,给朋友买的，听她说还不错~~~,2017-07-30 19:02:07,0,0,5
左***开,铜牌会员,手机用了两天了，送了膜和套都用了很省心。挺好。,2017-07-30 14:56:16,0,0,5
j***f,铜牌会员,快，物流非常快,2017-07-30 14:11:56,0,0,5
j***b,铜牌会员,功能可以，性价比低是一款不错的手机值得拥有,2017-07-30 10:33:20,0,0,5
j***e,铜牌会员,手机不行，有点发烫真的不好，大家别买，玩王者荣耀勿选这款,2017-07-30 10:24:35,0,1,3
l***3,银牌会员,一般般吧，像素不是很好，差不多能用,2017-07-30 10:18:55,0,1,3
j***8,金牌会员,很好的手机,2017-07-30 09:53:43,0,0,5
j***8,银牌会员,给媳妇买的，她说挺好的，实惠又便宜,2017-07-29 18:57:30,0,0,5
j***v,金牌会员,东西早已收到，用过一段时间后才来评价，魅蓝手机总体来说还行，不错，反应灵敏度够快，就是用过一段时间后会有点发热，全五分好评。,2017-07-29 15:51:28,0,1,5
周***9,银牌会员,因为是给别人的所以没有照片，手机不错,2017-07-29 15:37:11,0,0,5
j***d,铜牌会员,还可以吧，就是保护套不好,2017-07-29 14:13:26,0,0,5
