名字,会员级别,评论内容,评论时间,点赞数,评论数,评价星级
n***s,钻石会员,魅族的这个NOTO6，比E2的使用体验提升不少,2017-12-02 20:57:45,0,0,5
j***f,铜牌会员,感觉不错，物流送的快,2018-02-13 00:02:41,0,0,5
月***雨,金牌会员,好像没5屏幕亮，而且4g感觉没有5的3g快,2017-12-27 08:38:02,0,0,5
1***w,银牌会员,刚取回来，感觉还可以，,2018-01-23 12:28:56,0,0,5
j***i,银牌会员,款式漂亮，价格实惠,2018-03-06 18:13:11,0,0,5
元***素,PLUS会员,手机物美价廉，系统流畅不卡顿，店里服务态度非常好。,2017-10-21 10:06:27,0,0,5
j***g,银牌会员,移动卡连接数据总是拉断！去售后修了一次，仍然是！,2017-11-02 13:19:07,0,0,5
j***b,铜牌会员,还好的，就是手机的打字的没法用，其他都还好。,2018-01-03 17:50:16,0,0,4
j***帅,PLUS会员[试用],十分 好！与官方发出来的一模一样，是正品。是3+32gb的运行CPU是高通晓龙六二五我帮我同学买的，他买后十分满意。,2018-02-21 18:06:50,0,0,5
u***h,银牌会员,拍照是很给力，玩视频了天有回音，嗓音太大，不知为什么,2017-09-18 11:38:57,0,0,5
j***b,铜牌会员,手机很溜用起来很爽，打字快玩游戏不卡，照相清楚很6,2017-10-01 12:43:50,0,0,5
大***说,银牌会员,不确定是正品，反正有点小毛病，时不时微信听筒模式没声音，重启就又好了。其他毛病没啥，安兔兔查了一下查不到是不是正品。用了一个多月才评价。没图。,2018-01-03 23:03:48,0,0,5
qTIBHUguxPUI,银牌会员,手机很可以就是充电的时候会发热    不知道正常正常,2017-09-12 14:34:58,0,1,5
j***o,银牌会员,速度ok 京东就是快，手机刚到还没开，还不知道行不行,2017-09-09 12:07:02,0,1,5
j***c,钻石会员,比起蓝绿的手机，魅蓝还是要逊色一点，毕竟它长得不像苹果，呵呵！,2017-09-04 16:32:25,11,3,5
p***w,PLUS会员,国民手机，就是16G有点小了啊,2017-09-18 13:12:08,0,0,5
j***f,金牌会员,从note2变note6非常漂亮，上手很快,2017-11-16 23:38:01,0,0,5
r***b,银牌会员,手机不错，但配件不太好，店家服务很好，手机后置没有想象中的给力。,2017-10-31 10:22:51,0,0,4
戆***佬,金牌会员,????????不错不错,2017-11-28 10:53:14,0,0,5
j***4,铜牌会员,可以。该有的都有，没让我失望。625处理器很棒,2017-10-10 20:31:19,0,0,5
j***n,银牌会员,就是钢化膜不好，花的，希望可以再赠送一块,2017-11-18 16:49:32,0,0,5
j***h,银牌会员,好用，这个价格实惠 千元机的精品 ，你值得拥有,2017-10-01 12:43:57,0,0,5
影***在,PLUS会员,手机屏幕颜色好淡，比我note3屏幕淡好多，app图标直接颜色都变了，其它拍照还行，一直用白色的，现在换黑色的也好看，就是容易留指纹,2017-10-29 11:01:19,1,0,5
j***h,钻石会员,发的都是后封机器la鸡店铺,2017-09-18 12:31:16,0,0,5
超***轰,钻石会员,手机比小米千元机做工好一些，特别是屏幕。小米阴阳屏偏多，这点让人不爽。可以看到，充电非常快，还不热。前置指纹更加方便一些，第一次用魅族手机，还不错！,2017-09-04 18:45:07,2,1,5
望***快,银牌会员,只想有个解释这是怎么回事,2017-09-22 08:14:13,2,1,5
i***K,铜牌会员,还不错，是正品，而且机子都是完好无损的,2017-11-08 20:28:42,0,0,5
罗***F,PLUS会员,很不错的手机 正品我喜欢,2017-09-17 17:19:28,0,0,5
蝴***海,银牌会员,"手机是不错的，不过已经非常完美了，希望有4G加32G的，电池不耐用是真的，在不用的情况下也会掉电，没有华为优化的好，值得购买
，16G老人用可以，年轻人别买，太小了。",2017-09-11 09:40:52,0,1,5
w***s,钻石会员,用了两天来评价，包装完好，用大气泡塑料薄膜包装，整体速度流畅，充满电用一天，今天升级完系统感觉不太费电了，赠品还不错，下次可推荐朋友来买。,2017-11-01 16:33:35,0,0,5
听***0,银牌会员,手机不错  快递也挺快的  次日达,2017-11-18 15:00:01,0,0,5
3***强,钻石会员,"商品质量也相当不错。太喜欢了,谢谢!好卖家,真有耐心,我终于买到想要的东西了...最近没上网,!所以评价晚咯,卖家的货很好噢2 老板人很好,很耐心!所有问题都解决",2017-09-17 21:39:11,0,0,5
j***9,铜牌会员,刚刚拿到，用着很好，暂时没有问题,2017-11-25 18:29:54,0,0,5
D***0,铜牌会员,从魅蓝note入坑，note用了3年，最近摔碎屏才决定换手机，魅蓝note6特意用了一个星期才来评论，只能说物超所值，性能比市场上一些三四千的手机还好，路转粉！,2017-09-28 10:03:15,0,0,5
网***哎,铜牌会员,好 千元机中的佼佼者 相机?不比一些旗舰机差  625+Flyme那还用说  不过还有一些小细节没优化好（我用的系统是出厂的版本）,2017-11-24 08:05:23,0,0,5
j***c,铜牌会员,查过了，是正品可以放心购买?,2017-12-04 10:10:09,0,0,5
j***h,银牌会员,一直信赖魅族的颜值，大电池好给力,2017-11-17 15:47:58,0,0,5
j***m,铜牌会员,手机总体来说真的挺不错的，不管是自拍还是拍照，都十分的清晰。相比其他品牌手机，比如OPPO来说，十分的强悍，价位也比较合理，我很喜欢，为魅族点赞！！！,2017-09-13 09:32:17,1,0,5
j***w,金牌会员,一直听朋友说魅族手机可以，不管是性能还是性价比都很占优势，自己看了note6的发布会，觉得挺不错的，这次给妈妈买的，用着挺好，！以后换手机会关注一下魅族的！,2017-10-18 17:42:18,0,0,5
SsD锦州号,PLUS会员,赶上活动买的.价格适中.相信京东品质.买了两年质保.希望不要出什么问题.其他的我用过以后来补充评价.,2018-03-09 10:45:04,0,0,5
暱***確,银牌会员,很好，很美观，不卡，电量很耐用,2017-11-19 15:21:36,0,0,5
苏***7,银牌会员,给家人买的，很流畅，方便实用,2017-11-28 11:56:00,0,0,5
在***i,金牌会员,电池很耐用，玩王者荣耀也不卡,2017-11-28 10:20:56,0,0,5
大***9,银牌会员,玩起来不卡，性能可以。这个价位买到这样的机已经很不错了，魅族以前用过，真的很不错了，改进很大。唯一缺点，拍照再提升 。,2018-03-08 16:04:31,0,0,5
j***3,铜牌会员,手机还是不错的，良心商家,2017-12-23 22:53:56,0,0,5
k***8,PLUS会员,很好不错的购物体验,2017-09-18 13:37:41,0,0,5
j***r,金牌会员,手机挺好的！我非常满意！.,2017-12-06 00:42:22,0,0,5
j***o,银牌会员,好好好，魅族粉丝，大爱魅族,2017-11-29 15:52:37,0,0,5
牵***海,PLUS会员,东西很好外形很好看非常满意,2017-11-27 11:09:27,0,0,5
G***B,铜牌会员,手机是我从发布会开始那天就期待了很久很久的，拿到之后也是觉得超级棒，店家送的耳机出了一点小问题，可是店家很快就补发了，客服也是超级有耐心的 玩游戏也不卡呢,2017-09-23 15:40:09,0,0,5
j***j,铜牌会员,手机还可以，用了两天才来评价。下了几个大型游戏玩了，也不卡。摄像也还可以电池还挺狠能用过一段时间再来追加评价。物流也很快,2018-02-02 18:02:02,0,0,5
h***6,铜牌会员,手机很不错，手感很好，颜值高，总体来说比较流畅，但是送的钢化膜，手机套还有耳机实在太次，这个耳机估计也就十块钱不到，给五星吧,2018-01-01 21:36:52,0,0,5
秋***人,银牌会员,是正品。就是那绿油油得屏幕受不了。同价位千元机屏幕最差无争议，拍照也就那样，没发布会吹的牛。照片放大后全是各种涂抹，国产厂商就会吹牛b。没有对比就没有伤害,2017-09-14 09:49:36,0,0,5
R***u,金牌会员,可以的，很快，一天就到了，很快,2017-10-11 16:17:11,0,0,5
h***4,金牌会员,用了两天遇到过死机,2018-02-14 00:35:55,0,0,4
y***8,金牌会员,全家都用魅族，几年来一直都是魅族的忠实粉丝，这个手机电池超耐用，开车导航充满一次电可以导航5个小时左右，超级满意！正常使用，可以全天不断电！,2017-12-21 10:04:37,0,0,5
j***i,银牌会员,非常好，老爸点名要魅族,2017-11-30 08:58:04,0,0,5
j***e,铜牌会员,东西真不错，各方面都可以。,2017-10-25 22:15:22,0,1,5
j***j,PLUS会员[试用],一直在用魅族，感觉很好用，外观漂亮，续航高，性价比也很好，用起来很顺手，支持魅族！,2018-02-28 12:16:19,1,0,5
j***8,银牌会员,手机我看不出有什么毛病，但我想问一句为什么比魅族官网上便宜两百块钱左右，是不是手机被翻新过呢，有点担心这个问题，为什么鲁大师也检测不出来这个手机,2017-11-03 14:27:57,0,0,5
Z***7,PLUS会员,速度快，服务好，货早就收到，用了一段时间才评价，手机做工精致，系统反应快，电池大快充很实用，，双摄像头拍照清晣，性价比高推荐购买。,2017-09-07 18:07:51,0,0,5
叫***丶,钻石会员,帮我同事买的第一台还行，给我老爸买的电池不行，结果因为我不小心磕了一下退不了，我老爸又不喜欢，只能当二手亏一点卖了，后来买了华为v9,2017-11-17 19:11:28,1,1,5
1***p,银牌会员,应该是正品 还没有使用,2017-11-03 12:58:48,0,1,5
j***、,金牌会员,手机又大又实用，特别棒棒哒,2017-10-02 10:45:59,0,0,5
涩***9,铜牌会员,首先肯定的是服务态度真的挺好的，还有顺丰快递真的**快，是在深圳发的货，昨天晚上下的单，然后今天就收到了手机，这个速度快的让我挺意外的，一开始在查手机真假，因为自己比较傻，然后就让我男朋友查了，是9月8号出的第一批产品，用着的感觉还是挺不错了。一开始还有点嫌弃手机哪里屏膜不是跟边缘对平的，但是用了一晚，觉得还可以。我男朋友还说不喜欢就退了吧，我说还行吧，不退了，总之挺喜欢的！！！！,2017-09-16 00:04:45,1,1,4
j***e,金牌会员,从事快递行业，论手机续航的重要性，4000毫安大电池，一天下来还有三分之一。性能方面，手拿一加五表示不想说话。拍照没要求，千元机首选。,2017-12-21 14:04:19,0,0,5
e***n,PLUS会员,各方面都达到了预期，尤其是照相相对note3有了根本上的提升，外观的精致与系统的流畅还是一如既往的优秀。,2017-12-17 17:16:23,1,0,5
j***z,银牌会员,漂亮，漂亮，漂亮。。,2017-10-17 21:57:57,0,0,5
j***0,金牌会员,手机很好 外现很漂亮 功能也很强大 跑分也很高 就是系统占的内存太大了 我买的是16G的 新机子就剩下8G左右不够用啊 大家最少也得买个32G的,2017-09-14 10:22:57,0,0,5
永***8,银牌会员,发的移动全网通 不过手机还可以,2017-12-22 11:27:24,0,0,4
天***英,银牌会员,第一次购买魅族手机，果然不负众望，效果非常好，整机漂亮，反应灵敏，像素很好，满足预期！还在摸索中，不过，很喜欢,2018-01-14 10:09:46,0,0,5
丁***g,银牌会员,手机运行速度确实不错。就是跟大家说下这个屏幕的问题。屏幕保险一定要买。否则像我一样没拿手上十天摔烂了感觉很悲哀,2018-01-12 22:40:24,0,0,5
K***O,PLUS会员,老牌子值得信任，一直用这个牌子。京东的物流挺快，这个要点赞。算是不错的购物体验！！！,2018-02-24 20:56:44,0,0,5
超***y,PLUS会员,第一次买魅族手机。手机不错，挺流畅的。做工可以，屏幕缝隙不大，音量键没松动。相机对焦速度快，成像还可以。性价比蛮高的，赞！,2017-09-04 19:10:21,0,1,5
A***1,PLUS会员,物流速度快  一直在用魅族  不错 双摄现货完美 ！不错，的购物 ！孔雀青到货了再买一台。骁龙625  666,2017-09-11 11:41:04,1,1,5
j***y,银牌会员,魅蓝noet6确实高素颜，但比我现在用的noet3性能差多了，屏幕显示也没有3亮 清晰。同样浏览器打开网页也慢很多，有时还打不开。我难道买到假货。,2018-01-23 21:30:57,0,1,3
j***w,银牌会员,拍照很美。很强悍。去了一次广州塔。用魅蓝note6拍的。没毛病。推荐购买。。。。。物流也很快。2天就到了。,2018-01-15 12:48:35,0,0,5
g***n,金牌会员,用了半个多月了，整体不错，照相功能挺不错的，电量也耐用，除了小米华为乐视，魅族手机第一次用，挺好的，,2018-02-28 10:41:49,0,0,5
倾***心,银牌会员,手机的IME码与盒子上是一样的，但我不知道这是什么情况，新机拿来偶尔会卡顿，也不知道是什么情况，其他的还好，暂时还没发现什么问题,2017-11-25 21:48:37,0,0,5
j***g,银牌会员,"这是用第三部魅族手机了，mx,mate,note6.今天刚收到宝贝，还是一如既往的好，老板非常好，还答应给我补发票，超赞！！！",2017-09-09 22:13:34,1,1,5
o***A,银牌会员,这款手机总体上来说还行，物超所值。优点是:电池继航久，声音大，玩游戏、看视频、拍照片都很对。非常棒的一款手机，大品牌的就是好。,2017-11-29 12:18:51,0,0,5
F***L,铜牌会员,有过一段时间后屏幕出现乱点现象   打字时候直接就废了   一直乱打删都删不了   已经申请售后了,2018-02-26 20:46:33,0,0,5
枫***夜,PLUS会员,骁龙处理器配flyme 系统，感受真的不一样。,2017-09-04 15:43:38,6,1,5
j***3,银牌会员,手机拿到就迫不及待使用了，手感非常好，送的电话卡也很给力，非常满意。手机很适合不重度使用的人使用。,2018-02-23 13:27:07,0,0,5
m***2,PLUS会员,手机很好用，孔雀青真的很漂亮。第二台NOTE6了。魅族手机做工，系统真的很棒。,2018-02-15 13:41:11,0,0,5
j***c,银牌会员,感觉不错，除了充电玩会发烫,2017-11-11 03:04:24,0,0,4
j***8,银牌会员,不是京东自营，快递不那么快，手机发热和note5一样，上网和拍照比note5好，总之还可以，毕竟千元机这样也不错了，还是值得入手的。,2017-09-16 10:04:15,0,1,5
h***d,PLUS会员,不错，一直在用魅族，从note1到5.note6终于解决了处理器和照相两大问题,2018-01-31 21:17:40,0,0,5
j***m,金牌会员,手机照比预想中有差距。主要觉得屏幕显示有点次。好像是色彩问题。双摄主打噱头，模拟大光圈虚化过度明显不自然。拍照效果还是不错的。,2017-11-01 21:58:08,0,0,5
j***j,银牌会员,感激！！比官网，旗舰店，自营店都便宜！！而且新的没用过的正品机，打农药开高帧数没有问题！还吃了几次鸡，新手机用起来就是很爽了,2017-11-14 14:20:37,0,0,5
z***庆,银牌会员,一直想换魅族手机，听网上坑我说MIUI多好多好，换了才知道也不咋样，还是换回我们的魅族好，而且赶上了魅族的骁龙新品。我非常喜欢,2017-10-28 14:36:23,0,0,5
陈***坤,银牌会员,不错 感觉非常好 也比较顺畅 自己研究了半月才买的 就是快递有点慢 15号订的 今天才发过来 不过手机确实不错 给个五星好评吧,2017-10-18 18:30:27,0,0,5
别***掉,PLUS会员,到货有一点点小问题，店家及时解决，服务还不错。喜欢的朋友可以来，机子没毛病,2018-02-06 13:08:18,0,0,5
笑***j,PLUS会员,物流速度挺快的，虽然手机不知为何出了点问题，但店家服务挺认真的，不错。,2018-03-01 16:29:22,0,0,5
N***r,银牌会员,京东商城买东西 买了就降价都习惯了 居然还不发京东快递 发个顺丰快递发5天才到  慢得要死,2018-03-01 17:24:46,0,0,5
王***布,PLUS会员,应该是正品，可以升级系统，就是卡槽有点瑕疵，不太容易拉出来，还没有插卡测试，其他的等用过了才能知道,2017-11-23 13:24:51,0,0,5
c***-,银牌会员,很不错的购物,2017-09-21 07:02:05,0,0,5
j***烬,金牌会员,很不错，挺好的。,2017-10-20 12:17:03,0,0,5
q***9,银牌会员,还可以，就是卡曹晃动，赠送的物品少了耳机，虽然赠品有没有都无所谓，只是说有赠送却没有让人不舒服,2018-01-04 19:36:53,0,0,5
T***A,银牌会员,暂时用着还行,2017-09-14 12:17:33,0,0,5
j***t,银牌会员,我说一下缺点:1Home键竟然有点歪，这就是做工的问题了。2真机远不如图片好看，这是我个认为。3不要买16G的了，根本不够用,2017-09-16 10:56:17,0,0,5
刘***了,铜牌会员,很好非常满意,2017-09-12 20:00:39,0,0,5
醉***空,银牌会员,网购了不少东西，这次的体验是最差的，手机没拿到，到物流提示我已收货，联系快递人员，3天，到现在为止没见到货是什么样子,2017-11-15 19:36:47,0,0,5
f***4,PLUS会员,用了好多年魅族了，一直喜欢他的系统，这次推荐给同事，一口气买了3个！,2018-02-09 14:51:35,0,0,5
f***4,PLUS会员,用了好多年魅族了，一直喜欢他的系统，这次推荐给同事，一口气买了3个！,2018-02-09 14:51:02,0,0,5
张***威,银牌会员,手机可以，配置，价格都可以，就是屏幕一直是魅族的硬伤！期待以后出的手机屏幕可以赶上其他国产手机！屏幕灵敏度有点，，，，，,2017-10-10 18:43:30,0,0,5
j***a,铜牌会员,手机不错,2017-11-03 18:47:21,0,0,5
j***7,钻石会员,很不错的手机，主要是拍照效果好吧。魅族手机要努力啊，系统和华为比起来，现在咩有优势了,2018-02-27 10:56:28,0,0,5
j***x,银牌会员,魅族的Flyme系统还是很不错的，页面简洁功能全面。就是16g的rom太小了，不够用。总体来说note6还是非常值得购买的,2017-09-19 18:15:19,0,0,5
j***u,铜牌会员,手机还是好的，就是赠品不怎么样，耳机还不如送个其他的非要苹果的，保护套有点大，边都包不紧。手机才是主要的，魅蓝还是不错的,2017-10-10 15:26:54,0,0,5
段***皮,银牌会员,东西用起来很不错  像素一般电池一般，体验一般   但是在这个价格已经很好了   系统很完善，很舒服。,2017-09-09 22:49:36,0,1,5
c***n,钻石会员,帮老叔买的，他一直是魅粉，958买的，估计这家是全网最低价了吧，送的膜和壳都不错，用上了。,2018-01-10 10:26:49,0,0,5
y***9,金牌会员,手机还可以，送的钢化膜有点小能用，反应有点慢，打游戏还是有点卡，其它的暂时还没有发现，,2018-02-04 11:14:17,0,0,5
jd_640b184a87ed4,金牌会员,魅族手机真不错，以前用小米手机容易发烫，魅族手机刚回来用了两三天很好用不发烫，拍照清晰，外形美观大气，性比价高的一部手机,2017-09-22 11:08:42,0,0,5
j***0,金牌会员,屏幕足够大，用着很流畅，拿在手里手感跟一块鹅卵石一样，黑色很大气。操作系统很熟悉。,2018-03-03 12:31:09,0,0,5
h***d,PLUS会员,不错，一直在用魅族，尤其是这次终于不用联发科了，照个相也比5强多了,2018-01-29 20:30:05,0,0,5
龙***A,PLUS会员,手机可以性价比高,2017-09-10 21:06:22,0,1,5
j***d,银牌会员,手机不错，就是赠品耳机太坑了，还没用就脱落，我也没指望什么好耳机，因为我用森海塞尔，但赠送的残次品也太不厚道了。,2017-11-11 11:39:34,0,0,5
j***b,银牌会员,手机内存不符合说好的64g的呢，怎么这样51g，物流太慢，整整7天才到，其他都还可以,2018-02-08 11:37:39,0,0,5
j***b,铜牌会员,买了有段时间，现在来评论不算晚吧，魅族系列的手机用了很久了，蛮不错的，值得五星。,2018-03-04 11:33:20,0,0,5
j***j,铜牌会员,为什么没有耳机,2018-02-28 14:25:19,0,0,5
天***冶,银牌会员,手机还行吧。如果下次购买我可能去实体店，不会再在这样的网店去买。发东西慢！赠送的东西不符合，说是欺骗毫无过分。,2017-11-11 01:05:35,0,0,5
l***g,银牌会员,手机用起来不错啊 系统用起来很流畅 快充也很方便 续航也很够 基本没什么明显缺陷 魅蓝真旗舰~,2017-10-23 13:32:15,0,0,5
j***x,银牌会员,手机很漂亮，系统快！电池大！还有快充！希望今后魅族继续做更好的产品,2018-01-04 18:35:31,0,0,5
j***b,铜牌会员,虽然知道只有个手机，但到的时候什么赠品也没还是有点小失望，手机不错，换机也方便,2018-03-04 15:48:38,0,0,5
p***0,银牌会员,相当满意。东西很好。手机很流畅。颜色也很好看。就是物流太慢了。,2018-02-01 15:56:29,0,0,5
j***o,PLUS会员,给老公买的，我们一家人都用魅族，很不错，经济实惠，老公已经是第三台了，换了也不可惜，毕竟价格还能接受，不错，好评,2017-10-17 16:42:13,0,0,5
jd_152829fpd,银牌会员,这是我买过最便宜最好用最满意的安卓手机感觉比我的苹果6还好用好评好评啊，就是没有黑色了。其他的都不用我说了一个子爽,2017-09-25 18:50:00,0,1,5
j***n,铜牌会员,手机好跟想象中的一样好用，就是刚开始用的时候有有很多设置要弄有点麻烦，其他都非常好用，想买的可以下手买,2017-12-25 07:29:27,0,0,5
j***1,银牌会员,京东配送要有足够的耐心，天哪一星期，我又另买一物连皮5天了物流未动，好还我心脏好,2018-01-30 15:11:02,0,0,5
j***7,铜牌会员,手机我已经用了两个月了，充电器就坏了，昨天开始充电变得超级慢，5分钟一点的那种,2018-02-16 09:29:21,0,0,5
你***风,金牌会员,"有人联系你，才不会冷清；
有人陪着你，才不会孤单；
有人惦记你，心才很温暖。",2018-02-28 15:13:20,0,0,5
疯***圣,PLUS会员,手机非常好 高配完美运行王者荣耀 吃鸡等游戏 就是闪光灯不太给力 性价比非常高 好评,2017-11-27 18:16:11,0,0,5
张***殇,银牌会员,感觉手机不错，因为挺好看的就不拍照了，电池也不错，就是感觉价格是不是便宜了点,2018-02-22 09:30:08,0,0,5
嘤***嘤,铜牌会员,手机不错，但是卡槽哪里是坏的，不过看在手机很好快递一天就到的份上给一个好评,2018-03-07 13:05:38,0,0,5
王***1,铜牌会员,手机查了一下是正品，就是为啥没吃充电只能充到87％，第一晚我用完没开机充的，结果昨晚开机充的也只冲到87%,2017-11-05 07:31:04,0,0,5
小***子,银牌会员,很好，挺不错的一款手机，这是第一次买的，用了一个多月，又买了一个4+64的，很不错，魅族品质，值得信赖！,2017-11-16 09:28:13,0,0,5
国***0,银牌会员,刚开始用的还可以，半个月之后开程序多了会突然卡。相机并没有那么高的像素把，总之还凑合，比tao宝好点。,2017-11-27 10:26:21,0,0,5
f***e,PLUS会员,帮朋友买的，双摄效果很好，性价比还是一如既往的高，黑色很酷，打王者体验非常nice！,2017-11-11 12:13:49,0,0,5
喜欢你的人不多,铜牌会员,给妈妈买的。妈妈表示很喜欢。魅族千元机很良心。做工也比别的棒很多。这款手机照相和电池快充都是亮点。很适合妈妈。,2017-09-25 21:31:20,0,0,5
j***0,银牌会员,等这个等了很久了，用了一段时间才来评价的，手机总体来说没有什么毛病，手感很好，非常值。希望魅族以后越来越好吧,2017-10-09 18:11:35,0,0,5
玖***丶,PLUS会员,魅蓝note6还是挺不错的，屏幕大，价格也比较便宜，给爸妈一人买了一个，两位老人都挺喜欢的,2017-09-18 14:53:36,0,0,5
玖***丶,PLUS会员,魅蓝note6还是挺不错的，屏幕大，价格也比较便宜，给爸妈一人买了一个，两位老人都挺喜欢的,2017-09-18 14:53:25,0,0,5
又***丶,PLUS会员,手感不错，青年良品，送的东西也非常不错，就是物流有点慢，价格比自营便宜，相当不错了,2017-11-22 12:32:52,0,0,5
j***p,银牌会员,拍照很不错续航很给力mback真的是有毒哈哈哈，用了两天就上瘾了，大力支持魅蓝发展骁龙机型√。,2017-10-15 23:17:51,0,0,5
j***e,银牌会员,验过货已使用中，款式真的很不错，像素还行，电池倒是特别耐用，魅族的性价比真的高，京东快递服务很赞，包装特别好,2017-09-26 11:45:21,0,0,5
j***0,银牌会员,非常满意    相机   电池  快充   就连我最不报希望的音质都可以    看来魅族下功夫了,2017-12-27 22:27:39,0,0,5
j***x,银牌会员,手机摄像功能很不错，很清晰。因为之前用过一个小一点的，所以感觉有点大，不过手感还是很不错的。慢慢习惯了就好。,2017-09-14 19:59:25,0,1,5
V***n,PLUS会员,魅族良心手机 之前用过MX2 3 4都觉得相当好用 这个手机是帮朋友买的 朋友说也好用,2017-09-28 14:14:15,0,0,5
恒***1,银牌会员,一天多就到货，手机用了几个月，偶尔会闪退，玩王者荣耀和吃鸡的话都很流畅,2018-02-23 11:02:00,0,0,5
死***恋,铜牌会员,手机好，就是春节期间快递太多，晚了一天，手机方面我非常满意。,2018-02-22 10:26:03,1,0,5
j***n,银牌会员,魅族手机根本不好用，才买不到一个月就卡了，以后我再买魅族直播剁手，话就撩这里。谁做不到谁小狗,2017-10-24 21:46:33,1,0,5
w***n,银牌会员,整体超魅蓝note5很多！手机发热不明显，速度快，摄像超级好！除了屏幕看着有点怪，其他都很完美！！,2017-11-22 09:28:46,0,1,5
j***i,PLUS会员,625的手机续航真长，非重度游戏选择此手机无错的。,2018-02-19 13:34:28,0,0,5
Z***遥,PLUS会员,手机还不错，但是耳机是坏的，钢化膜破了 怎么算？？？,2018-02-03 20:13:17,0,0,5
名***P,钻石会员,魅族（MEIZU） 魅族 魅蓝note6 4G手机 曜石黑 全网通(3G RAM+32G ROM)标配,2017-10-25 00:09:32,0,0,5
