名字,会员级别,评论内容,评论时间,点赞数,评论数,评价星级
J***4,PLUS会员[试用],"质量非常好，与卖家描述的完全一致，非常满意,真的很喜欢，完全超出期望值，发货速度非常快，包装非常仔细、严实，物流公司服务态度很好，运送速度很快，很满意的一次购物，谢谢卖家！",2017-10-22 02:48:03,1,0,5
武***品,金牌会员,手机收到了，用了用感觉很不错呦！网速挺快的，还有指纹锁，功能很齐全，是自己真心想要的一款手机。手机膜和手机好像有点儿不匹配，但是卖家很快帮我解决这个问题。卖家态度很好。希望卖家越做越好！,2017-08-16 17:25:53,0,0,5
W***东,PLUS会员,手机上网查了，是正品。手机使用很流畅，魅族一如既往的性价比高，支持国产，支持魅族，像素清晰，手感好，像大牌手机的质感。手机清晰度高，拍照很清晰，满足日常使用足够了。颜色均匀，质感很好。播放音乐声音很清晰，没有杂音。,2017-08-15 21:44:12,1,1,5
杜***3,金牌会员,手机各方面都很好，是正品，同样的手机比实体店便宜多了，而且还赠了手机壳和钢化膜，店家服务态度也很好，用的京东快递，快递也很给力，包装很严实，很满意，好评！好评！好评！,2017-11-15 19:30:21,0,0,5
我***啥,钻石会员,一直都在用魅族手机。魅族手机真心不错。就喜欢魅族手机系统，这是买的第三部了，一人一部，收到手机很不错，物流也给力。店家的服务态度也很好，货也是正品，大家值得购买。,2017-12-06 20:09:49,0,0,5
王***9,金牌会员,手机质量很不错，手感很舒服，电量也很够用，电量大，充电还是蛮快的，主要是玩王者荣耀也不卡，贼6啊。拍照什么的都不错，手机各方面还是挺满意的，主要是比官网要便宜不少。好评……?,2017-10-08 09:51:32,0,0,5
w***a,银牌会员,一直用魅族觉得不错，看到note5的价格和3都差不多了就下手了，没想到双11快递都会这么给力。收到手机比预期感觉要好的多，做工很细致绝不比水果差哪去，超满意。,2017-11-14 13:14:44,0,0,5
忠***巴,金牌会员,这是第二次在他家购买手机了，质量绝对有保证，店家服务态度也非常好，双十一物流比平时慢了两三天，但是值得我去等，希望多做点活动啊，国产手机品牌魅族还是很不错滴,2017-11-16 20:57:34,0,0,5
x***3,PLUS会员,一直以来都是魅族的粉丝，果断入手魅蓝5.画质清晰，打王者荣耀非常流畅，32g内存足够用，满足了手机控的需求，朋友来买的话首推荐这家店，京东配送安全放心！五分好评！,2017-09-02 10:51:08,0,0,5
再***夏,银牌会员,升级亮点，除了 快充 和 3GB RAM起步 值得称道之处，屏幕、处理器、高清摄像头。宝贝很满意，客服也热情，物流送货上门，合作愉快，好评！好评！好评！,2017-10-24 20:26:32,0,0,5
f***e,金牌会员,收到后蛮激动，开箱操作，系统一如既往的流畅，魅族的Home键真的有毒，太爽了！！！电池特意试了下，重度使用仍能顶一整天！！！good！！！,2017-11-21 09:24:20,1,0,5
j***k,铜牌会员,用了以后反应快屏幕清晰不愧是青年良品 用了以后反应快屏幕清晰不愧是青年良品  玩游戏打王者应该是不错的 可惜是给老爸买的用着老高兴了 价钱也挺合适 值得购买哦,2017-08-22 07:17:00,0,0,5
j***0,银牌会员,我很满意，这个手机非常棒我觉得买这部手机是非常正确的选择，魅蓝我买了很多次了就是很喜欢，我觉得大家都应该买魅蓝，青年良品，，魅蓝手机，用了都说好,2017-12-05 16:55:29,0,0,5
紫***尘,银牌会员,刚刚用了一下，感觉手机还不错，第一次用魅族手机，也用过其他牌子千元机，感觉还是魅族的手机最好（也可能是新手机的原因）。唯一的不好就是要60字的好评,2017-11-11 22:02:07,0,0,5
浩***锋,铜牌会员,拍照自然，色彩丰满，屏幕响应速度快，操作很顺手，非常值得购买，客服服务周到，态度很好。手机非常好，非常满意，强烈推荐，赠品多多。五星好评。,2017-11-17 20:31:54,0,0,5
香槟-香槟,铜牌会员,收到手机就立刻打开了，给家人买的，很满意，网上查询是正品！屏幕很清晰，操作很流畅，性价比高！不愧为青年良品！老板服务态度很好！有需要还会再来这家店里买！,2016-12-08 11:33:41,4,7,5
j***m,金牌会员,手机不错，物流很给力，就是钢化膜破了，和他们说了说给解决，京东的服务质量是毋庸置疑的，六十个子其实停难凑的，差不多够了吧！标点符号算不算啊，够了,2017-09-13 07:58:55,0,0,5
